Title,Link,Paragraphs
Los Angeles Dodgers survive late comeback attempt by New York Yankees to take 2-0 lead in World Series,https://www.cnn.com/2024/10/26/sport/yankees-dodgers-game-2-world-series-spt-intl/index.html,"['', 'The Los Angeles Dodgers defeated the New York Yankees by a score of 4-2 to take Game 2 of the World Series Saturday night at Dodger Stadium.', 'Despite the Dodgers being in control most of the game, New York threatened a late comeback in the ninth inning but would strand the bases loaded.', 'Still reeling from Friday’s historic Game 1 win, the Dodgers offense brought the same juice early on Saturday.', 'Tommy Edman, the National League Championship Series (NLCS) MVP, blasted a solo home run in the bottom of the second inning to give Los Angeles a 1-0 lead.', 'The Yankees responded in the next half inning with a Juan Soto solo home run to tie the game up.', 'The game did not remain tied for much longer.', 'Things went off the rails for Yankees starting pitcher Carlos Rodon in the bottom of the third inning after Teoscar Hernandez blasted a two-run home run and Freddie Freeman, the hero of Game 1, followed up with another home run of his own to make it a 4-1 game and ignite the Dodgers fans excitement.', 'Dodgers starting pitcher Yoshinobu Yamamoto was nothing short of dominant, striking out four batters while only giving up one hit in 6.1 innings. He exited to a standing ovation from the Dodgers faithful.', 'The LA bullpen silenced the Yankees offense until the top of the ninth inning.', 'Soto, who had the team’s only hit leading up to his at-bat, singled and later advanced to second base on a wild pitch.', 'Dodgers reliever Blake Treinen struck out Yankees slugger Aaron Judge but the very next at-bat, Giancarlo Stanton drove in New York’s second run of the game to cut into the lead.', 'The Yankees offense did not stop there.', 'Jazz Chisholm Jr. singled to right field and Anthony Rizzo was hit by a pitch to load up the bases.', 'With what FOX announcers called his potential “Derek Jeter moment,” Yankees shortstop Anthony Volpe struck out for the second out. The Dodgers pulled Treinen and had Alex Vesia come in to try to close out the game.', 'Vesia got pinch hitter Jose Trevino to fly out to center field to limit the damage and secure the Game 2 victory.', 'With a 2-0 series lead, the Dodgers are now two wins away from claiming their eighth World Series crown in franchise history.', 'After the game, Edman said his play in the postseason is “everything I could have imagined.”', '“This is what you work for as a baseball player,” Edman told reporters. “You grind your whole life, take thousands, if not hundreds of thousands of swings of batting practice, just constantly working, working, working.”', '“The swing’s never going to be perfect, but try to get as close as you can. And for it to kind of come through on this stage has been really special. Definitely has been a dream of mine for a while.”', 'Despite the win, a potential dark cloud remains over the Dodgers for the rest of the series.', 'Dodgers superstar Shohei Ohtani left the game in the bottom of the seventh inning after appearing to injure himself on a stolen base attempt. He would stay on the ground in pain and would eventually walk off the field with trainers holding his left arm.', 'The Fall Classic shifts to the Bronx, New York, for Game 3 on Monday at 8:08 p.m. ET at Yankee Stadium.', 'This story has been updated with additional information.', '© 2024 Cable News Network. A Warner Bros. Discovery Company. All Rights Reserved.\nCNN Sans ™ & © 2016 Cable News Network.', '', '', '', '', '']"
World Series Game 2 takeaways: Dodgers win; Ohtani exits,https://www.espn.co.uk/mlb/story/_/id/41942747/2024-world-series-game-2-new-york-yankees-los-angeles-dodgers-updates-analysis-takeaways,"['', '', '', '', 'Two games into the 2024 World Series, the Los Angeles Dodgers are two wins away from a title.', 'After the Dodgers edged the New York Yankees in an unbelievable World Series opener on Friday night, they picked up where they left off in a 4-2 Game 2 victory but now await the status of superstar Shohei Ohtani after he exited because of an apparent shoulder injury. Following the game, manager Dave Roberts said Ohtani suffered a subluxation of his left shoulder and will undergo further testing Sunday, but his strength and range of motion are good.', ""How did L.A. double their Fall Classic lead? We've got it all covered, from live updates and analysis during the games to takeaways after the final pitch to what's next for each team."", 'Jump to: Takeaways | Live updates', '', '', 'Los Angeles leads series 2-0', 'Dodgers: The Dodgers held off the Yankees to move to within two wins of a World Series title but now await word on the status of Shohei Ohtani after the superstar exited late in Game 2.', 'Ohtani had all of Dodger Stadium holding its collective breath when he left in the seventh inning after appearing to sustain a shoulder injury during a stolen-base attempt. Ohtani rolled around on the ground while grabbing his left arm before heading to the clubhouse.', ""The injury came on a night that Yoshinobu Yamamoto -- who hadn't pitched in a seventh inning of a game since June 7 -- needed only 86 pitches to blanket the Yankees over 6⅓ innings and it looked as if he could have kept going. He used a five-pitch mix to get it done, including striking out Aaron Judge twice -- once on a slider and once on a split finger. He gave up only one hit, two walks and struck out four. His only blemish was a third-inning home run by Juan Soto."", 'Yamamoto is looking stronger in this postseason after returning from an arm injury in September. It helped that his offense immediately gave him the lead back after the Soto home run as first baseman Freddie Freeman incurred multiple standing ovations -- both before homering in the third inning of Game 2 and in response to his Game 1 winner.', 'Teoscar Hernandez also went deep -- a two-run shot right before Freeman -- as did Tommy Edman in the second inning, giving the Dodgers their second-most home runs (24) in a single postseason in franchise history. The win gives the Dodgers a commanding 2-0 lead with the series shifting to New York for Game 3 on Monday. -- Jesse Rogers', ""Yankees: The Yankees aren't going to win the World Series with this version of Aaron Judge."", ""The presumptive American League MVP went 0-for-4 with three strikeouts Saturday. He's 1-for-9 with six strikeouts in the World Series, and 6-for-40 (.150) with 19 strikeouts in the postseason. The Yankees have advanced this far without Judge supplying anything close to the production he provided during the regular season. The Yankees don't necessarily need that version of Judge to resurface to win the World Series. But they will not beat the Dodgers four times in five games if Judge isn't substantially better. Giancarlo Stanton belted a huge home run in Game 1. Juan Soto delivered the Yankees' first two hits, including a home run, in Game 2. Judge, the third member of the Yankees' slugging trio, needs to contribute in New York. -- Jorge Castillo"", 'The big question for Game 3: As the Dodgers celebrated taking the first two games of the World Series, they did so with a question in the back of their minds: Will they have Ohtani at full strength for the rest of the series? Ohtani, who was caught stealing in the seventh inning, was helped off the field by training staff. An on-field microphone caught him saying his left shoulder was injured. After the game, Roberts said that it was a shoulder subluxation and the Dodgers were ""encouraged"" by the initial results before further testing.', 'Ohtani, the soon-to-be National League MVP, went 0-for-3 with a walk Saturday night. He is 1-for-8 in the series. And while the Dodgers are deep enough to replace him with Mookie Betts or Tommy Edman atop the lineup and with any number of bats at designated hitter, Ohtani is their best player, and losing him would be an enormous gut punch. In a follow-up postgame question about how the Dodgers would adjust without Ohtani, Roberts said ""I\'m expecting him to be there."" Regardless, the excitement of taking a 2-0 series lead was tempered by the specter of losing Ohtani for any period of time. -- Jeff Passan', '', '', '', '']"
"Carlos Rodón crumbles, Aaron Judge keeps struggling as Dodgers ice Yankees for 2-0 World Series lead",https://www.nydailynews.com/2024/10/26/carlos-rodon-crumbles-aaron-judge-keeps-struggling-as-dodgers-ice-yankees-for-2-0-world-series-lead/,"['', '', '', '', '', '', '', '', 'Daily News e-Edition', 'Evening e-Edition', 'TRENDING:', '', '', 'LOS ANGELES — Shortly before Game 2 of the World Series began, Ice Cube emerged from an opening in the center field wall at Dodger Stadium.', 'Dressed in a shiny blue Dodgers jacket, a matching hat and Nikes, the rapper made his way from the warning track to the mound and then home plate. Each step came with a bar, as the Los Angeles native performed “Bow Down” and “It Was A Good Day” in an effort to hype up his hometown cro ...', '', '', '', '', '', '', '', '', '', '', '', '', '', '', '', '', '', '', '', '', '', '', '', '', '', '', 'Please, provide an email to continue reading this article for free and to receive our daily email newsletters with the latest headlines.', '', '', 'MOST POPULAR', 'NYC Mayor Adams says Trump is not a ‘fascist’ during briefing on Madison Square Garden rally', 'Saturday, October 26', 'Fatal overdoses linked to ‘zombie drug’ xylazine skyrocketing in NYC', 'Saturday, October 26', 'Dodgers star Shohei Ohtani leaves World Series Game 2 vs. Yankees with shoulder injury', 'Saturday, October 26', 'Man fatally shot inside Bronx apartment', 'Saturday, October 26', 'Family of kindhearted Salvadoran immigrant killed over a parking spot want suspects to rot in prison', 'Saturday, October 26', 'Yankees rally around Nestor Cortes after Aaron Boone’s questionable choice backfires', 'Saturday, October 26', '15-year-old boy critically wounded with gunshot to head in Brooklyn', 'Friday, October 25', 'Mike Lupica: It’s time for Aaron Rodgers to be a star on the field for the Jets', 'Saturday, October 26', 'Tiny Bed-Stuy sidewalk aquarium paved over by city may be rebuilt at community garden: officials', 'Saturday, October 26', 'Pete Davidson shows off tattoo removal progress after mental health treatment', 'Friday, October 25', 'Copyright © 2024 New York Daily News']"
Dodgers Star Shohei Ohtani Injures Shoulder During World Series Win,https://www.hollywoodreporter.com/news/local-news/dodgers-shohei-ohtani-injures-shoulder-world-series-1236046162/,"['', '', 'The baseball superstar was helped off the field after a failed attempt to steal second base against the New York Yankees.', 'BY RYAN GAJEWSKI', '', 'Los Angeles Dodgers fans experienced a frightening moment just before Halloween when star Shohei Ohtani exited Game 2 of the World Series in pain.', 'Fox Sports reported that Ohtani, a top candidate for this year’s National League MVP Award, injured his left shoulder in a failed attempt to steal second base during the seventh inning of Saturday’s matchup against the New York Yankees. The Dodgers won the game at Dodgers Stadium by a score of 4-2 and hold a 2-0 lead in the series as it heads to the Bronx.', 'After the game, Dodgers manager Dave Roberts told reporters that Ohtani suffered a subluxation of his left shoulder but that the team felt encouraged by his strength and range of motion.', '', 'Immediately after the play, the X (formerly Twitter) account for Fox’s Major League Baseball coverage posted, “Ohtani injured his shoulder on this slide. No word yet on the severity of the injury.” The Japanese-born Ohtani was helped off the field by a member of the team’s staff.', 'During the telecast, Fox broadcaster Joe Davis noted that a Japanese news outlet reported the Dodgers’ designated hitter saying he felt his shoulder pop.', '“There’s a little bit of ‘uh-oh’ with Ohtani, unfortunately, and seeing how that shakes out for the rest of the series,” Fox broadcaster John Smoltz said during the game. “We’ll see how this game and that stolen base in that inning shakes out the rest of the series.”', 'Ohtani had one hit and scored a run Friday in the Dodgers’ stunning comeback win in the first game of the World Series. The team prevailed 6-3 over the Yankees in that game after Freddie Freeman’s walk-off grand slam in the 10th inning.', 'Known for both his power at the plate and his prowess as a starting pitcher, Ohtani joined the Dodgers in the offseason after six seasons with the Los Angeles Angeles. The two-time MLB MVP has not pitched this season while recovering from surgery that he underwent on his right elbow in Sept. 2023.', '“I’m not sure about any details,” Dodgers pitcher Yoshinobu Yamamoto said through an interpreter after the game about Ohtani’s shoulder.', 'Sign up for THR news straight to your inbox every day', 'Sign up for THR news straight to your inbox every day', 'Subscribe for full access to The Hollywood Reporter', 'Send us a tip using our anonymous form.', '', '', '']"
Shohei Ohtani Suffers Shoulder Subluxation,https://www.mlbtraderumors.com/2024/10/shohei-ohtani-suffers-shoulder-subluxation.html,"['MLB Trade Rumors', 'By Nick Deeds | October 26, 2024 at 11:00pm CDT', 'A heart-stopping moment occurred for Dodgers fans in the bottom of the seventh inning tonight when Shohei Ohtani attempted to steal second base. Ohtani was tagged out by Yankees second baseman Gleyber Torres but appeared to suffer an injury on the play and was escorted off the field by a team trainer. After the game, manager Dave Roberts told reporters (including The Athletic’s Fabian Ardaya) that Ohtani had suffered a “little” shoulder subluxation, or partial dislocation. The star will undergo additionally testing tomorrow, and though Roberts emphasized that he did not want to speculate on the severity of the injury until those tests were completed, he noted that they’re “encouraged” by initial tests and that he’s “expecting” Ohtani to be back in the lineup for Game 3 on Monday.', 'It’s a potentially devastating blow to the Dodgers as they look to capture their first full-season World Series championship since 1988. While Ohtani has been unable to pitch this year after undergoing elbow surgery last September, it’s impossible to call his first season with the club anything other than an absolute success. The 30-year-old superstar slashed an eye-popping .310/.390/.646 (181 wRC+) in 159 games for the Dodgers this year and became the first player in MLB history to steal at least 50 bases (59) and hit at least 50 home runs (54) in a single season. Ohtani’s dynamic play has also been a key factor in the club’s postseason run to this point, as he had slashed an impressive .277/.414/.489 with three home runs and ten RBI during the playoffs this year entering tonight’s game.', 'Whether the Dodgers will have that explosive offensive talent in the lineup for the remainder of the series remains to be seen. While the severity of Ohtani’s injury is not currently clear, an injury of any significance will leave he and the Dodgers forced to balance the star’s health with their goal of closing out a World Series championship they’re just two victories away from clinching. Other players on the Dodgers’ roster, including fellow star Freddie Freeman and veteran shortstop Miguel Rojas, have played through injuries this postseason in hopes of bringing a World Series home to Los Angeles. If the Dodgers take a similar course of action with Ohtani and his shoulder issue is fairly mild, it’s possible to imagine him being back in the club’s lineup when the series moves to New York for Game 3 on Monday night.', 'That’s far from a guarantee, however, and it’s equally easy to imagine the issue being severe enough to leave Ohtani at risk of missing the rest of the series. If the injury proves to be severe enough for the Dodgers to remove Ohtani from their playoff roster, outfielders Kevin Kiermaier and James Outman would appear to be the most likely options for the club to consider activating in place of their superstar on the playoff roster. Meanwhile, Ohtani vacating the DH spot in the lineup would allow the club to offer additional rest to Freeman, who has played through the postseason on a sprained ankle and could benefit from the additional time off his feet. In such a scenario, Max Muncy would likely slide over from third base to cover first for Freeman, opening up the hot corner for Enrique Hernandez and second base for Gavin Lux.', 'Of course, with just five months left to Opening Day 2025, a particularly severe injury could not only leave Ohtani unavailable for the remainder of the World Series but potentially impact his Spring Training and readiness for the start of next year. Red Sox shortstop Trevor Story underwent what was believed to be season-ending shoulder surgery back in April following an initial diagnosis similar to Ohtani’s after Story awkwardly landed on his shoulder during a play in the field. Surgery wound up being necessary due to structural damage in his shoulder and came with an initial six-month recovery timeline, though Story managed to return ahead of schedule in just five.', 'The Dodgers are quite familiar with the perils of dislocated shoulders, as during the 2020 NLCS Cody Bellinger suffered a dislocated right shoulder that he played through in their last World Series run but ultimately required surgery on. That procedure came with a recovery timeline of just ten weeks but Bellinger infamously struggled badly over his next two seasons with the Dodgers, leading to questions regarding whether or not he returned to action before he was fully healthy. However severe Ohtani’s injury turns out to be, one silver lining for the Dodgers is that Ohtani’s left shoulder is the one at issue, meaning his pitching arm is likely to be minimally impacted by the issue as he looks toward a return to the mound in 2025.', 'LOS ANGELES DODGERS NEWSSTAND\nSHOHEI OHTANI', '', '', '', '', '', '', '', '', '', '', '', '', '', '', '', '', '', '', '', '', '', '', '', '', '', '', '', '', '', '', '', '', '', '', '', '', '', '', '', '', '', '', '', '', '', '', '', '', '', '', '', '', '', '', '', '', '', '', '', '', '', '', '', '', '', '', '', '', '', '', '', '', '', '', '', '', '', '', '', '', '', '', '', '', '', '', '', '', '', '', '', '', '', '', '', '', '', '', '', '', '', '', '', '', '', '', '', '', '', '', '', '', 'MLB Trade Rumors is not affiliated with Major League Baseball, MLB or MLB.com', '', '', '', '', '']"
,https://www.mlb.com/news/dodgers-win-world-series-game-2-2024,"['Anthony Castrovince', 'LOS ANGELES – It was a night of loud noises. A pregame performance from L.A. legend Ice Cube. The ball jumping off the Dodger bats. A standing ovation for Yoshinobu Yamamoto. The gigantic center-field speakers blaring party music in a celebratory setting.', 'All that Game 2 noise went away when Shohei Ohtani injured his left shoulder on a failed seventh-inning stolen-base attempt and lay on the ground in obvious agony. The Dodger Stadium crowd quieted quickly, then got mighty tense when the Yankees nearly came back in the ninth. But while the injury to their iconic designated hitter hung heavy in the air, the Dodgers were able to feed off the Freddie Freeman frenzy from a night earlier with a 4-2 win Saturday night to take a commanding 2-0 edge in this best-of-seven Fall Classic.', 'Freeman, still nursing that sprained right ankle, went deep again, and this time he had the company of NLCS MVP Tommy Edman and All-Star Teoscar Hernández and the backing of 6 1/3 one-hit innings from Yamamoto. The party quieted when Ohtani went down, and the Yankees had everybody on the edge of their seats when they plated a run and loaded the bases in the ninth. But the Dodgers protected their home turf.', 'In all best-of-seven postseason series, teams taking a 2-0 lead have gone on to win the series 77 of 92 times (84%). The most recent comeback from a 2-0 deficit came in the 2023 NLCS, with the D-backs rallying against the Phillies. Under the current 2-3-2 format, teams winning Games 1 and 2 at home have gone on to take the series 45 of 56 times (80%).', 'And so the Yankees, who brought their band of slugging superstars to the West Coast, head east with a daunting deficit against a Dodgers team that had been an out away from angst in the opener, yet is now two wins from a ring. What remains to be seen is if the tone will shift at Yankee Stadium, and if Ohtani will be back in the lineup in the Bronx.', 'As had been the case in Game 1, the Dodgers struck first in this one. And as had been the case in his hero turn in the previous round, Edman did the striking.', 'Edman, a coach’s kid who can play all over, was an unheralded acquisition for the Dodgers from the Cardinals at the Trade Deadline, partially because he hadn’t played all season after having wrist surgery last October. But in the last two weeks, the wiry utility man has come to be known as “Tommy Tanks” by making life miserable for lefties, and Carlos Rodón just so happens to pitch with his left arm. Leading off the bottom of the second, Edman connected with Rodón’s inside fastball and yanked it to the seats near the left-field foul pole to make it 1-0. It was his 10th hit in his first 15 at-bats off southpaws in this postseason.', 'That particular lead was short-lived, because a much-more-heralded provider of power -- Yankees right fielder Juan Soto -- continued his man-on-a-mission, pre-free agency tear by ripping a solo shot of his own off Yamamoto the very next inning. Soto, who turned 26 on Friday, flipped his bat with flair then confidently strutted around the bases with the score knotted at 1.', 'Sign up to receive our daily Morning Lineup to stay in the know about the latest trending topics around Major League Baseball.', 'But it wasn’t knotted long. In the bottom of the third, the loaded Dodgers lineup feasted on Rodón fastballs to mount a two-out rally. First, Mookie Betts ripped a single to left. Then, Teoscar Hernández, who came to L.A. as one of the lesser-publicized signings in the Dodgers’ $1.2 billion winter and turned in an All-Star campaign, smoked a 98 mph four-seamer up in the zone into the right-field pavilion seats for an impressive two-run blast that made it 3-1.', 'Dodger Stadium was still rocking after Teoscar’s tater when Freeman stepped to the plate. The jersey he wore for Kirk Gibson karaoke night was freshly encased near the stadium’s suite-level entrance, but Freeman made it clear that the epic ending to Game 1 was not the end of his contributions to this cause. He worked the count full, then connected when Rodón challenged him with another high heater. As was the case a night earlier, Freeman left no doubt over where the ball would land, and the Dodgers were up 4-1.', 'That was the lead put in the clearly capable hands of Yamamoto, who had spurned the interested Yankees and one-upped their ace Gerrit Cole when he signed a 12-year, $325 million contract to join the Dodgers last winter. This was a night when Yamamoto showed the broad baseball world -- including an ample audience in his native Japan -- what all the fuss was about, confounding a dangerous lineup by allowing only the Soto swat and two walks and keeping the pressure off the oft-used L.A. bullpen by pitching into the seventh. He retired the last 11 hitters he faced and left to a stirring round of applause.', 'All this rapture made the sound of silence when Ohtani lay in pain at second base all the more piercing. Ohtani had drawn a walk off Clay Holmes and attempted to swipe a bag, just as he had done 59 times in the regular season. This time, his left hand hit the ground hard on his slide, and the force went to his shoulder.', 'The Ohtani injury changed the tone, and then the Yankees tried to change the lead by mounting a ninth-inning rally off Blake Treinen. Juan Soto singled and advanced on a wild pitch, and Giancarlo Stanton drove him home by banging a base hit off the third-base bag. Jazz Chisholm Jr. singled to put runners at first and second with one out, and Treinen plunked Anthony Rizzo with a 2-2 pitch to load the bases. But Treinen got a huge strikeout of Anthony Volpe, and Alex Vesia retired Jose Trevino on one pitch for the final out to bring the loud noises back again.', 'Anthony Castrovince has been a reporter for MLB.com since 2004.', '20 minutes ago', '9:35 PM PDT', '7:42 PM PDT', '4:57 PM PDT', '8:15 PM PDT', 'October 25th, 2024', '20 minutes ago', '9:35 PM PDT', '7:42 PM PDT', '4:57 PM PDT', '', '', '6:10 AM PDT', '7:26 AM PDT', '6:50 AM PDT', '5:45 PM PDT']"
