Title,Link,Paragraphs
Dodgers take 2-0 World Series lead behind Yamamoto's Game 2 gem,https://www.espn.com/mlb/story/_/id/42024081/dodgers-take-2-0-world-series-lead-yamamoto-game-2-gem,"['', '', 'LOS ANGELES -- Yoshinobu Yamamoto gave up one hit over 6⅓ innings, Freddie Freeman homered for the second straight night and the Los Angeles Dodgers hit three early longballs off Carlos Rodon to beat the New York Yankees 4-2 on Saturday night at Dodger Stadium to take a 2-0 World Series lead.', 'Tommy Edman and Teoscar Hernandez also went deep for the Dodgers, who watched star slugger Shohei Ohtani walk off the field because of an apparent left shoulder injury at the end of the seventh inning.', ""After the Yankees closed to 4-2 on Giancarlo Stanton's RBI single in the ninth against Blake Treinen, Alex Vesia relieved with the bases loaded and retired pinch hitter Jose Trevino on a first-pitch flyout for a save."", ""Yamamoto gave up Juan Soto's third-inning homer, then retired his last 11 batters."", 'According to ESPN Research, Yamamoto is the 13th pitcher in World Series history with one or fewer hits allowed in an outing of at least six innings. He is the second Dodgers pitcher to do so after Rich Hill in 2018 against the Boston Red Sox, and the first pitcher to do it against the Yankees.', '""I was really looking forward to this game,"" Yamamoto said through an interpreter, ""and I\'m glad that we had a great ending.""', ""Soto also singled in the ninth and scored on Stanton's one-out hit off the third-base bag. Jazz Chisholm Jr. singled and Anthony Rizzo was hit by a pitch to load the bases. Treinen then struck out Anthony Volpe before Vesia completed a four-hitter."", 'Ohtani hurt his left arm on a feet-first slide when he was caught stealing second base to end the seventh inning.', 'Game 3 is Monday night at Yankee Stadium. Of teams holding 2-0 World Series leads, 45 of 56 have gone on to win the title.', '""No one said it\'s going to be easy,"" Yankees manager Aaron Boone said. ""It\'s a long series, and we need to make it a long series now. We won\'t flinch.""', ""New York's Aaron Judge went 0-for-4 with three strikeouts and is hitting .150 with six RBIs and 19 strikeouts in 40 postseason at-bats. Judge has struck out 13 times over the past five games, his most in any five-game span since June 2021 and his most in a five-game span of the postseason since 2017 when he was a rookie, according to ESPN Research."", ""Soto's tying homer on an inside fastball was the only run Yamamoto gave up in two starts and 13⅓ innings against the Yankees this season. The rookie right-hander left to a large ovation and gave the very slightest tip of his cap to fans when he walked to the dugout."", '""I think everything was working well for me, since the beginning, the first inning,"" he said. ""It worked pretty good today.""', 'Yamamoto joined the Dodgers last December on a $325 million, 12-year contract, a record for pitchers, teaming with Ohtani to create record interest in Major League Baseball in Japan.', 'Yamamoto was sidelined from June 15 to Sept. 10 because of a strained rotator cuff and this was his finest start since the injury.', '""Yamamoto, amazing job tonight and obviously we got out to the early lead and held on,"" Freeman said.', 'In his longest outing since his start in the Bronx, Yamamoto struck out four and walked two with a five-pitch array that included curveballs, splitters, sliders and cutters. He improved to 2-0 in four postseason starts.', 'He threw his best regular-season game at Yankee Stadium in June when he gave up three hits over seven shutout innings. Hernandez had three homers and nine RBIs over that three-game series.', 'A night after Freeman hit the first walk-off grand slam in Series history to transform a 3-2 deficit with two outs in the 10th inning into a 6-3 win, Edman put the Dodgers ahead with a solo shot in the second.', 'After Soto tied the score, Mookie Betts singled with two outs in the bottom of the third and Hernández, in a 3-for-27 slide, homered into the right-field pavilion.', ""Freeman, who before Friday hadn't gone deep since since Sept. 16, was greeted with huge cheers before each plate appearance. He worked the count full and also homered to right-center again."", ""Playing on a sprained right ankle, Freeman has homered in four straight Series games dating to Atlanta's last two games against Houston in 2021. That is one shy of the record held by the Astros' George Springer."", 'All three Dodgers homers came on fastballs from Rodon, whose 31 longballs allowed during the regular season tied for second most in the major leagues. Los Angeles had back-to-back Series homers for only the second time, after Pedro Guerrero and Steve Yeager connected against Yankees left-hander Ron Guidry for a 2-1 win in Game 5 in 1981.', 'Rodon gave up four runs and six hits in 3⅓ innings.', ""Los Angeles took a 2-0 Series lead for the first time since 1988, when Kirk Gibson's walk-off homer against Oakland's Dennis Eckersley won the opener and Orel Hershiser followed with a three-hit shutout. The Yankees are down 2-0 for the first time since 2001, when they rebounded to win three straight at home and lost Games 6 and 7 at Arizona."", 'The Associated Press contributed to this report.', '', '', '']"
Dodgers cruise but Shohei Ohtani injured in Game 2 victory over Yankees: Takeaways,https://www.nytimes.com/athletic/5875068/2024/10/26/dodgers-yankees-world-series-game-2-takeaways/,"['MLB', '', '', 'But the night took a sobering turn at the end of the seventh inning when Shohei Ohtani hurt his left shoulder as he was caught stealing. Ohtani stayed down on the Dodger Stadium dirt until trainers arrived, clutching his left forearm after slamming it hard on the ground as he slid. There was no immediate word on the severity of the injury. Ohtani did not appear in the postgame high-five line.', '', 'All of the early runs in the game came off homers, by the Yankees’ off Yamamoto and by the Dodgers’ , and Freddie Freeman off . Yamamoto worked 6 1/3  innings, walking two with four strikeouts, improving to 2-0 with a 3.86 ERA this postseason.', 'The Yankees’ Aaron Judge went 0-for-4 and struck out three times for the second game in a row. Judge is 6-for-40 (.150) with two homers and 19 strikeouts in the postseason.', 'There wasn’t a better team in the majors against left-handed pitching this season than the Dodgers, who paced the big leagues with a .795 OPS and a 121 wRC+. The improvements were obvious, from their existing production (right-handed hitting Mookie Betts) to left-handed hitters good enough to overcome a platoon split (, Freddie Freeman). Then two other acquisitions made crushing lefties their specialty.', '', '', '', '', '', '', '', '', '', '', '', '', '', '', '', '', '', 'Home runs have been his biggest problem since becoming a Yankee. He gave up the second-most during the regular season (only starter Kutter Crawford allowed more). At this point, expecting Rodón to keep the ball in the yard is a big ask.', '', '']"
World Series: Dodgers' Shohei Ohtani headed for MRI after partially dislocating left shoulder in Game 2 vs. Yankees,https://www.newsday.com/sports/baseball/yankees/shohei-ohtani-yankees-dodgers-world-series-vn89m742,"['', '', '', '', '', '', '', '', '', '', '', '', '', '', '', '', '', '', '', '', '', '', '', '', '', '', '', '']"
World Series Game 2 recap: Dodgers defeat Yankees to take 2-0 lead,https://www.nbcnews.com/sports/mlb/live-blog/world-series-game-dodgers-yankees-live-updates-rcna176814,"['', '', '', '', '', '', '', '', '', 'LOS ANGELES — Dodgers starter Yoshinobu Yamamoto was masterful in a 4-2 victory against the New York Yankees in Game 2 of the World Series on Saturday.', 'The Japanese right-hander threw 6.1 innings while allowing just one hit — a Juan Soto solo home run — with two walks and four strikeouts. Two of those came against AL MVP favorite Aaron Judge, who finished the night 0-4 with three strikeouts. Judge has struggled mightily this postseason, entering Saturday’s matchup with a .154 batting average and striking out three times on Friday.', '""Everything was good because of location,"" Yamamoto said postgame through a translator. ""In the zone, out of the zone, everything was working well.""', 'Dodgers manager Dave Roberts said Yamamoto, ""was fantastic tonight.""', 'The Dodgers got on the board first in the second inning on Tommy Edman’s solo home run off Carlos Rodón. Soto evened the score in the top of the third but that’s where the offense stalled for New York. The Dodgers extended their lead later that inning on Teoscar Hernández’s two-run home run to the right field stands. Moments later Freddie Freeman — the hero of Game 1 — hit a solo shot to make it 4-1 Los Angeles.', 'New York staged a comeback attempt in the top of the ninth inning. With Soto on second, Giancarlo Stanton singled to drive him in and cut the deficit to two runs. Jazz Chisholm then singled to right to have runners on first and second with one out. Los Angeles reliever Blake Treinen followed by hitting Anthony Rizzo to load the bases for Anthony Volpe, but Volpe struck out. Alex Vesia replaced Treinen and got Jose Trevino to fly out to centerfield.', 'Yankees manager Aaron Boone said he was happy his team fought until the end.', '""We gave ourselves a chance to get back in it and win that game off a really good reliever. I love the at-bats there at the end, the compete, the fight,"" he said postgame. ""No one said it\'s going to be easy. It\'s a long series and we need to make a it a long series now. We won\'t flinch. We just gotta keep at it.""', 'While the Dodgers will now take a crucial 2-0 advantage to New York, they might do it with far less star power. NL MVP favorite Shohei Ohtani, who became the first player in baseball history to record 50 home runs and 50 stolen bases in one season, left the game in the seventh inning after suffering a left shoulder injury on a stolen base attempt.', 'He was helped off the field by Los Angeles’ training staff and evaluated.', ""“He had a little left shoulder subluxation,” Roberts said postgame. “We’re going to get some tests at some point tonight or tomorrow and we'll know more in the next couple of days. But the strength was great, the range of motion good, so we’re encouraged.”"", 'Roberts said no decision has been made about whether Ohtani will play in Game 3, but would not rule him out for the remainder of the World Series. ', '“I’m not there,” he said. “I’m expecting him to be in the lineup.”', ""Game 3 will be at 8:05 p.m. ET Monday at Yankee Stadium in New York City. Walker Buehler will start for Los Angeles opposite New York's Clarke Schmidt."", 'Greg Rosenstein', 'Dodgers manager Dave Roberts was asked about his lineup if Ohtani is unable to return this postseason.', '“I’m not there,” he said. “I’m expecting him to be in the lineup.”', 'Greg Rosenstein', 'Dodgers superstar Shohei Ohtani suffered a left shoulder injury tonight in the seventh inning.', '“He had a little left shoulder subluxation,” Los Angeles manager Dave Roberts said postgame. “We’re going to get some tests ... the strength was great, the range of motion good, so we’re encouraged.”', 'NBC News', 'Alex Vesia need a single pitch to retire Jose Trevino, who flew out to centerfield, leaving three men on base.', 'The Dodgers now lead the World Series 2-0 and things turn to the Bronx on Monday night.', 'NBC News', 'Anthony Volpe struck out on a breaking ball down and away, leaving the bases loaded. Rookie catcher Austin Wells was due up but the Yankees went to their bench for Jose Trevino.', 'The Dodgers go to the bullpen again and bring in Alex Vesia.', 'NBC News', 'Anthony Rizzo took a ball off the back to load the bases, with Jazz Chisolm at second and Giancarlo Stanton on third with shortstop Anthony Volpe at the plate.', 'Greg Rosenstein', ""With Juan Soto on second base, Giancarlo Stanton singles on a ground ball to left fielder Chris Taylor. It's now 4-2 Yankees in the ninth."", 'NBC News', 'Giancarlo Stanton rocketed a single off third base, bringing home Juan Soto who had advanced to second base on a wild pitch.', 'The Yankees are down 4-2 with one out and Jazz Chisolm up next.', 'NBC News', ""Juan Soto just missed another home run when he started the ninth with a single off the right field wall off Blake Treinen. Yankees hope that's the start of the rally."", 'NBC News', ""The Yankees have three outs left to tie the game but have Soto, Judge and Stanton due up in the ninth inning. They'll face Blake Treinen, who gave up a run last night in 1.1 innings pitched."", 'Greg Rosenstein', 'Reporting from Dodger Stadium', 'Dodgers star Shohei Ohtani was just helped off the field by training staff after sliding hard into second on a steal attempt in the bottom of the seventh inning. It appeared to be a left wrist or shoulder injury and is unclear if he’ll be taken out of the game.', 'Fox broadcasters, citing Japanese broadcaster NHK, say Ohtani said, ""I popped my shoulder out.""', 'Greg Rosenstein', 'Reporting from Dodger Stadium', 'The Dodgers are in full control.', 'After replacing starter Yoshinobu Yamamoto after 6.1 innings, Anthony Banda got two crucial outs by forcing Jazz Chisholm and Anthony Volpe to fly out.', 'Score remains 4-1 Dodgers in the bottom of the seventh.', 'Greg Rosenstein', 'Reporting from Dodger Stadium', 'Yoshinobu Yamamoto is done for the night.', 'Dodgers manager Dave Roberts just took the ball from him in the top of the seventh inning after a masterful performance. The Japanese right-hander threw 6.1 innings, allowing just one hit, two walks and striking out four.', 'Lefty Anthony Banda replaced him on the mound.', 'Greg Rosenstein', 'The Yankees made another change at the mound, this time bringing in Clay Holmes to replace Tim Hill. Hill did not allow a hit over 1.1 innings.', 'Last night, manager Aaron Boone chose to bring in Nestor Cortes to close out the 10th inning rather than Hill, who has been a reliable arm in the postseason.', ""Cortes hadn't pitched since Sept. 18 and delivered the walk-off grand slam."", 'NBC News', 'Yoshinobu Yamamoto gave manager Dave Roberts a huge gift tonight with this strong start. Yamamoto has thrown 80 pitches through six innings and has only surrendered one hit, a solo homer to Juan Soto.', 'The Dodgers are up three in the bottom of the sixth and can use their best relievers to get the final nine outs.', 'Greg Rosenstein', 'Will Smith crushed a double to center field off Jake Cousins with one out in the bottom of the fourth. He was then moved over to third base on a ground out by Miguel Rojas but was stranded after Shohei Ohtani grounded out to end the inning.', 'Greg Rosenstein', 'With one out in the bottom of the fourth, Yankees manager Aaron Boone is making a pitching change. Jake Cousins has taken over for Carlos Rodón after Rodón surrendered six hits and four runs over 3.1 innings of work.', 'Dodgers remain ahead 4-1 in the fourth.', 'Greg Rosenstein', 'Yoshinobu Yamamoto continues to pitch well. In the top of the fourth, he got Jazz Chisholm and Giancarlo Stanton to ground out, and struck out Anthony Rizzo on four pitches.', 'Dodgers 4, Yankee 1 in the bottom of the fourth.', 'Greg Rosenstein', 'Freddie Freeman is back at it.', 'The hero from last night — who hit a walk-off grand slam to win Game 1 — padded Los Angeles’ lead in Game 2 with a solo shot to right field. The Dodgers now lead 4-1 in the bottom of the third.', 'Greg Rosenstein', 'Miguel Rojas flew out to right field and Shohei Ohtani struck out to open the inning but Mookie Betts singled on a sharp liner to right.', 'Teoscar Hernández then drilled a two-run home run to the right field stands to give the Dodgers a 3-1 lead in the bottom of the third.', 'Greg Rosenstein', 'After Alex Verdugo flied out and Gleybor Torres grounded out, Juan Soto just hit a solo bomb to right field to tie the game at 1 in the top of the third. It is his fourth home run of the postseason.', ""Aaron Judge then lined out to the outfield to end the inning. We go to the bottom of the third where we'll see Shohei Ohtani and Mookie Betts bat."", 'Dodgers 1, Yankees 1 in the bottom of the third.', 'Tim Perone', ""The Yankees were hoping Yoshinobu Yamamoto, tonight's starter for the Dodgers, would be wearing pinstripes, instead."", 'The team pursued the free agent from Japan this past offseason but lost out to the Dodgers who offered a 12-year, $325 million deal. The Yankees reportedly offered $300 million over 10 years.', 'Greg Rosenstein', 'Dodgers outfielder Tommy Edman just hit a solo home run off Carlos Rodón into the left-field stands. The Yankees starter rebounded with no further damage and made a nice play off the mound to end the inning.', 'Dodgers lead 1-0 in the third inning.', 'Greg Rosenstein', 'An efficient inning by Dodgers starter Yoshinobu Yamamoto. Despite a walk to Anthony Rizzo, he got Jazz Chisholm, Austin Wells and Anthony Rizzo out on nine combined pitches to keep the game scoreless.', 'Yankees 0, Dodgers 1 in bottom of second.', 'Greg Rosenstein', 'Reporting from Dodger Stadium', 'Yankees starter Carlos Rodón surrendered a line drive single to Mookie Betts but otherwise was unscathed in the first inning.', 'Rodón ended it with a sky-high pop-up out from Game 1 hero Freddie Freeman.', 'Yankees 0, Dodgers 0 through 1 inning', 'Greg Rosenstein', 'After Yoshinobu Yamamoto began Game 2 with a walk of Gleybor Torres, he got Juan Soto to ground out and followed with a strikeout of Aaron Judge.', 'He then got Giancarlo Stanton to pop out on the very first pitch to end the inning.', 'Yankees 0, Dodgers 0 after top of 1.', 'Greg Rosenstein', 'Reporting from Dodger Stadium', 'Yoshinobu Yamamoto just threw a strike to Gleybor Torres and we are off in Game 2. Torres drew a walk and the Yankees have a baserunner to start the game.', 'NBC News', 'Yoshinobu Yamamoto signed a record $325 million deal for the next season 12 seasons after starting his career in Japan.', 'Yamamoto had a solid rookie campaign and has pitched well in his first two playoff starts, one against the Padres in the Divisional Series and the other against the Mets in NLCS.', 'Greg Rosenstein', 'Rapper Ice Cube is here performing LA-based songs ahead of Game 2. He entered through the center field wall and walked all the way to home plate.', 'Greg Rosenstein', 'Reporting from Dodger Stadium', 'Former Dodgers All-Stars Andre Ethier and Matt Kemp threw the ceremonial first pitch for World Series Game 2.', 'Clayton Kershaw and Austin Barnes caught the throws.', 'NBC News', 'Yankees lefty starter Carlos Rodón has pitched very well in the postseason, specifically his two most recent starts.', 'In the ALCS against the Guardians, Rodón had two strong starts. He only allowed three runs over 10 2/3 innings with 15 strikeouts and just one walk.', 'NBC Los Angeles', 'It’s been less than 24 hours since Freddie Freeman hit a walk-off grand slam in Game 1 of the World Series, but the Dodgers have already put up a display honoring the iconic moment.', 'A display featuring Freeman’s game-worn jersey and the game’s lineup card can be found on the suite level at Dodger Stadium along with a photo.', 'Read the full article here', 'NBC News', 'TV viewership for the World Series is up significantly over last year and was at its highest levels for a Game 1 since 2017, Fox announced today.', 'Read the full article here', 'NBC News', ""After taking Game 1, the Dodgers are in the driver's seat. Since MLB adopted the best-of-seven format in the playoffs, teams winning the first game have won 65% of the series."", 'In the World Series, teams who have taken Game 1 have won the title 23 of 29 times since 1995, according to MLB.', 'Two of the times the Game 1 loser went on to win the World Series? The Yankees in 1996 and 2009. Both times the Yankees went on to win in six games.', 'NBC News', 'NBC Los Angeles', 'In La La Land, there’s never a shortage of star power when the Dodgers are playing big games.', 'See which celebrities were spotted in the stands during Game 1 of the epic World Series matchup between the Dodgers and New York Yankees.', 'Read the full article here', 'NBC New York', 'Aaron Judge discusses the Yankees’ loss to the Dodgers in the bottom of the 10th inning of Game 1 of the World Series.', 'Greg Rosenstein', 'Reporting from Dodger Stadium', ""Here's a video of Aaron Judge with fans before the World Series."", 'NBC New York', 'The Port Authority of New York will host free public viewings of the 2024 MLB World Series starting Oct. 25 at the World Trade Center.', 'The viewings will be located at the North Oculus Plaza, and fans can order food and drinks from the nearby Oculus Beer Garden and Westfield World Trade Center shops and restaurants.', 'Additional activities, giveaways, and food options will be available starting with the viewing for Game 2.', 'The outdoor viewings are scheduled to take place rain or shine.', 'Read the full article here', 'NBC Los Angeles', 'It all feels surreal–like deja vu on the grandest of scales. ', 'Did Freddie Freeman really just channel Kirk Gibson, rekindling the spirit of a moment that is forever etched into the hearts of Dodgers fans from 36 years ago?', 'Did the Los Angeles Dodgers really just go steal victory from the jaws of defeat in Game 1 of the World Series with one out left to spare?', 'Yes. Yes, they did. ', 'Read the full article here', 'NBC News', 'A historic rivalry between the New York Yankees and the Los Angeles Dodgers resumes in Los Angeles for game one of the World Series. The last time the teams met in the fall classic was 1981. NBC News’ Morgan Chesky reports.', 'NBC News', 'The Yankees run out the same batting order as last night while the Dodgers mix things up by moving Tommy Edman and Teoscar Hernandez up and hero Freddie Freeman down to the cleanup spot.', 'The Associated Press', 'LOS ANGELES — Right-hander Walker Buehler will start Game 3 of the World Series for the Los Angeles Dodgers.', 'Manager Dave Roberts made the announcement before Game 2 today for the Dodgers, who won the series opener 6-3 on Freddie Freeman’s walk-off grand slam in the 10th inning.', 'Game 3 will be at Yankee Stadium on Monday night.', '', '', 'Rohan Nadkarni', 'Though Aaron Judge is likely to win the AL MVP, it’s been Giancarlo Stanton who has been the Yankees’ premier slugger this postseason.', 'Stanton entered Game 1 of the World Series batting .294 with five home runs and a 1.179 OPS. He’d also hit home runs in three straight games — and extended that streak to four Friday night.', 'Stanton’s 17 postseason homers are fourth all-time in Yankees history.', 'The Associated Press', 'LOS ANGELES — New York Yankees outfielder Aaron Judge was voted player of the year and the American League’s outstanding player for the second time by fellow major leaguers in the annual Players Choice Awards of the Major League Baseball Players Association.', 'Los Angeles Dodgers designated hitter Shohei Ohtani was voted the National League’s outstanding player, the union said Saturday.', 'Judge led the major leagues with 58 homers and 144 RBIs, hitting .322. He also won both awards in 2022.', 'Ohtani became the first player with 50 homers and 50 stolen bases, batting .310 with 54 homers, 130 RBIs and 59 steals. He was voted the AL’s outstanding player in 2021 and 2023 when he was with the Los Angeles Angels and won the overall player of the year in 2021.', 'Milwaukee first baseman Rhys Hoskins won the Marvin Miller man of the year award, given to a player whose leadership inspires others, and the philanthropist of the year award. Along with wife Jayme, Hoskins has raised over $1 million for the Muscular Dystrophy Association.', 'NBC News', 'Dodgers manager Dave Roberts describes the moment when he heard the walk-off grand slam off Freddie Freeman’s bat.', 'NBC News', 'Here are the sights and sounds from Dodger Stadium as Freddie Freeman won it.', 'Greg Rosenstein', 'Reporting from Dodger Stadium', 'LOS ANGELES — Major drama occurred in the opening game of the 2024 World Series that may have decided which team won Game 1.', 'With the score tied 2-2 in the top of the ninth inning between the New York Yankees and Los Angeles Dodgers, New York second baseman Gleyber Torres drilled a line drive ball 383 feet to left field.', 'As the ball was coming down, a fan reached out over the railing and snagged it in his glove. For a moment, it appeared as a home run to put the Yankees ahead 3-2. ', 'Read the full article here', 'NBC News', 'The Yankees were one out away from winning Game 1 on the road and now hope to even the series before returning to the Bronx.', ""History won't be on their side if they lose tonight. Since MLB has adopted the 2-3-2 format in a best-of-seven series, teams are 11-45 when losing the first two on the road, with World Series records being 7-27, according to MLB."", 'NBC Sports', 'The ""Dan Le Batard Show"" discusses the big-market World Series between the New York Yankees and Los Angeles Dodgers, breaking down what they’re watching for in what could be a historic Fall Classic.', 'NBC News', 'Freeman went over to find his dad in the stands after hitting the winning grand slam in Game 1.', '“I [was] just screaming in his face,” Freeman said to Ken Rosenthal during the postgame interview on Fox. “Sorry dad. This isn\'t my moment, it\'s my dad\'s moment.""', 'NBC News', ""The Yankees were one out away from taking Game 1 and as the below chart shows, their win probability was extremely high when Freddie Freeman stepped into the batter's box."", 'Greg Rosenstein is the sports editor for NBC News Digital.', '© 2024 NBCUniversal Media, LLC', '', '', '', '', '', '', '', '', '']"
