Title,Link,Paragraphs
Dodgers superstar Shohei Ohtani suffers shoulder injury during Game 2 of the World Series,https://www.nbcnews.com/sports/mlb/shohei-ohtani-shoulder-injury-rcna177466,"['', '', '', '', '', '', '', '', '', 'LOS ANGELES — Dodgers superstar Shohei Ohtani suffered a left shoulder injury Saturday during Game 2 of the World Series against the New York Yankees.', '“He had a little left shoulder subluxation,” Los Angeles manager Dave Roberts said postgame. “We’re going to get some tests at some point tonight or tomorrow and we’ll know more in the next couple of days. But the strength was great, the range of motion good, so we’re encouraged.”', 'Ohtani slid hard into second base on a steal attempt in the bottom of the seventh and remained down before Los Angeles training staff came out to help him off the field.', 'He was taken to the locker room for evaluation. The Dodgers won 4-2 and have a 2-0 lead in the series.', 'Roberts said no decision has been made about whether Ohtani will play in Game 3, but would not rule him out for the remainder of the World Series. ', '“I’m not there,"" he said. ""I’m expecting him to be in the lineup.”', 'Ohtani is considered the best player in baseball. The NL MVP favorite hit .310 with 54 home runs, 130 RBI and 59 stolen bases this year. He is the first player in MLB history to record 50 home runs and 50 stolen bases in one season.', 'In Game 1 — a dramatic walk-off grand slam win for the Dodgers in extra innings — Ohtani hit a double and scored a run. ', 'Greg Rosenstein is the sports editor for NBC News Digital.', '© 2024 NBCUniversal Media, LLC', '', '', '', '', '', '', '', '', '']"
Shohei Ohtani injury update: Dodgers star dislocates shoulder in World Series,https://www.usatoday.com/story/sports/mlb/2024/10/26/shohei-ohtani-injury-updates-dodgers-world-series/75874144007/,"['LOS ANGELES – A raucous Saturday night at Dodger Stadium took on an ominous tone after superstar Shohei Ohtani injured his shoulder while sliding into second base on a failed steal attempt in the seventh inning.', 'Dodgers manager Dave Roberts said Ohtani had suffered a subluxation (partial dislocation) of his left shoulder on the play and would go for further testing – but the team was ""encouraged"" about their designated hitter\'s outlook.', '""Once we get the scans we\'ll know more, but with his strength and range of motion good, that\'s certainly a positive,"" Roberts said after the Dodgers\' 4-2 win in Game 2 of the World Series.', 'Ohtani stayed down on the ground for a few moments and exited with a trainer holding his arm, which dragged behind him on the ground as he slid to avoid the tag from New York Yankees shortstop Anthony Volpe.', '""The whole stadium went silent,"" Dodgers left fielder Teoscar Hernández said.', 'Follow every MLB game: Latest MLB scores, stats, schedules and standings.', 'Asked about the possibility of Ohtani missing the rest of the series, Roberts said he hadn\'t thought that far ahead yet, but is ""expecting (Ohtani) to be there. I\'m expecting him to be in the lineup.""', 'The Dodgers have a 2-0 series lead as the World Series heads to New York for Game 3 on Monday.', ""Ohtani, the two-way superstar and only man in major league history to hit 50 home runs and steal 50 bases has been limited simply to hitting duties this season, and had avoided injury. He'd drawn a two-out walk in the bottom of the seventh but was thrown out by Yankees catcher Austin Wells. "", '""You never like seeing the best player in the game get injured like that,"" Yankees outfielder Aaron Judge said. ""Hopefully it’s all good news, and we’ll see what happens.""', 'Roberts said after the game that Ohtani had a ""little left shoulder subluxation,"" the medical term for a partial dislocation, according to the Cleveland Clinic.', 'The USA TODAY app gets you to the heart of the news — fast. Download for award-winning coverage, crosswords, audio storytelling, the eNewspaper and more.']"
World Series Game 2 highlights: Dodgers hold off Yankees 4-2,https://www.foxsports.com/live-blog/mlb/yankees-vs-dodgers-world-series-game-2-live-updates-score,"['The 2024 World Series continued on Saturday with the New York Yankees trying to even the series with the Los Angeles Dodgers following a gut-wrenching, 10th-inning loss in Game 1 at Dodger Stadium on Friday, but ultimately coming up short, 4-2, and going down 2-0 in the series.', ""Yoshinobu Yamamoto was sharp as the Dodgers' starter, only allowing one run. Carlos Rodón was taken off after allowing three runs in the third inning."", 'FOX Sports writers Deesha Thosar and Rowan Kavner provided live in-game analysis from Dodger Stadium. Check out all the top plays from Game 2 here!', ""Kavner: Aaron Boone thought he saw a positive sign in Aaron Judge's last at-bat of Game 1, a pop-out to shortstop that Boone thought Judge barely got under. Whatever he saw didn't lead to production in Game 2 for the presumptive AL MVP. Judge is now 1-for-9 with six strikeouts in the World Series, one of which came as the Yankees tried to mount a ninth-inning comeback. The Yankees loaded the bases, putting the winning run on base, but the Dodgers survived and take a commanding 2-0 lead to the Bronx. Now they await word on their own presumptive MVP."", 'Top 9: Stanton gets Yankees closer', ""Thosar: Anthony Volpe's weakness was fully exposed in the most important at-bat of his career to date. With the bases loaded and one out, Blake Treinen threw sweeper after sweeper after sweeper against Volpe, and the 23-year-old Yankees shortstop swung at all of them. Volpe struggled in his sophomore season this year with laying off outside pitches, and he just couldn't hold back in the ninth inning."", 'Kanver: Bases loaded, ninth inning, team at-bat trailing. Have we heard this before already? Treinen got a huge strikeout on Anthony Volpe. Alex Vesia now enters. Jose Trevino is pinch-hitting for Austin Wells with the Yankees down to their last out. What a start to the World Series.', ""Kavner: Well, things are getting interesting. The Dodgers took a 4-1 lead into the ninth, but an RBI single from Giancarlo Stanton that hopped off the third-base bag, an eight-pitch single from Jazz Chisholm Jr. and an Anthony Rizzo hit by pitch have loaded the bases on Blake Treinen. The tying run's at second, the go-ahead run's at first, and there's only one out."", 'Top 8: Ohtani injury update', 'Top 7: Yamamoto walks off', 'Kavner: Yamamoto got the first out of the seventh inning before departing with a hug from Dave Roberts and a standing ovation from the crowd of 52,725. He allowed just one hit, a solo homer, before retiring the final 11 batters he faced in his first career World Series start. Only one other Dodgers pitcher — Rich Hill in 2018 — has thrown at least six innings while allowing one hit in a World Series game. Dodgers fans might want to forget how that one ended.', 'Bottom 7: Ohtani injured', 'Top 6: Judge strikes out again', ""Kavner: Yamamoto is through six scoreless innings. The only hit he has allowed is Soto's solo homer in the third. He has retired 10 straight since then. This is his longest outing since ... the last time he faced the Yankees, on June 7 in New York. In 13 innings against them, he has allowed just three hits and one run. Lefty Anthony Banda is up in the Dodgers' pen, but there's no one throwing yet. Lefties Jazz Chisholm and Anthony Rizzo are due up in the 7th. Yamamoto's at 80 pitches."", 'Top 5: Yamamoto in control', ""Kavner: Yamamoto has really settled in, retiring seven straight since the Soto homer. Through five innings, that's the Yankees' only hit of the night. Yamamoto has not gone more than five innings in a start since returning on Sept. 10 from a shoulder injury that held him out for nearly three months, but there's no one warming up yet in the Dodgers' bullpen. He's at 72 pitches through five, and the top of the Yankees' lineup is about to come up a third time through."", 'Bottom 5: Teoscar left stranded', 'Top 4: NY shut out', ""The Yankees couldn't narrow the gap at all as Yamamoto continues his strong night."", 'Bottom 4: Rodón is done', ""Thosar: It made little sense to me when the Yankees opted to start Carlos Rodon for Game 2, because the Dodgers hit lefties so well, and Rodon pitches better at home. More than anything, I thought Clarke Schmidt would've given them a better chance to go back to New York with a series split. But the Yankees' worst-case scenario was the Rodon that showed up in the second and third inning, the one that unraveled after he allowed his third home run of the night after just 13 batters faced. It's always hard to tell what the Yankees will get from Rodon, and when they needed a reliable starter more than anything else for Game 2, their top southpaw couldn't deliver. Fortunately for the Yankees, a three-run deficit isn't the worst thing in the world. "", 'Top 3: Soto ties it', ""Thosar: The bat flip said it all. Juan Soto looked into his dugout and pounded his chest after he hammered a solo shot to right field off Yamamoto, who erroneously thought he could get away with a 95 mph fastball that covered the middle of the plate. Soto doesn't miss mistakes on a bad day, and right now he's feeling so good at the plate that Yamamoto's decision to go with anything that resembled a heater, let alone throw it in the zone, was immediately punished. Soto's fourth home run of the playoffs tied the game at 1-1, and he's reached base in each of his 11 postseason games this October."", 'Bottom 3: Two for Teo, one for Freeman', ""Kavner: Back in June, Teoscar Hernández was the hero of the Dodgers' offense in the Bronx, launching three homers in the series win. He's back to tormenting the Yankees again, taking a heater at the top of the zone out for a go-ahead two-run homer. Not to be outdone, Freddie Freeman then made it back-to-back (not his first homer of the series, as you might have heard). The Dodgers are teeing off on Rodon his second time through."", 'Bottom 1: Yamamoto holding NY', ""Rowan Kavner: Yoshinobu Yamamoto hasn't had great command or control early, but he has gotten through two scoreless with two walks and a strikeout. When he carved through the Yankees lineup back in June, his go-to secondaries were the slider and splitter. It's mostly been the curveball the first time through. I'll be curious to see if he works the slider in more often after having success with it his last time out, but he'll need to command the fastball better regardless the second time through."", 'Bottom 2: Edman strikes again', ""Kavner: What a day July 29 was for the Dodgers. In a three-team deal that probably wasn't talked about enough at the time, they got Tommy Edman and Michael Kopech for Miguel Vargas and two lower-level prospects. Kopech immediately became a reliable high-leverage piece, while Edman, who hadn't played a game this year before the Dodgers made the trade, turned into a vital addition both for his defensive versatility (he can both center and shortstop, all the more important with Miguel Rojas banged up) and the switch-hitter's bat against left-handed pitching. He took Sean Manaea deep in Game 6 of the NLCS, and he took Carlos Rodon deep in his first at-bat Saturday to start the scoring. Juan Soto, however, eliminated that advantage quickly."", 'Top 1: Judge strikes out', ""Deesha Thosar: Even though his manager and hitting coach were encouraged by his at-bats in Game 1, Aaron Judge continues to look off at the plate. After leadoff man Gleyber Torres worked a walk, the Yankees' Big 3 had a prime opportunity to cash in. Soto grounded out, but he at least moved Torres up to second. But then Judge followed by striking out on seven pitches, and he kept whiffing on sliders down and away from Yoshinobu Yamamoto. In the regular season, that's a plate appearance that would normally end in a walk for Judge."", 'Bottom 1: No runs', 'Mookie Betts got his first hit of the World Series, but Shohei Ohtani and Freddie Freeman both failed to get on base.', 'Bow down', 'LA rap icon Ice Cube got the Dodger Stadium crowd warmed up with ""Bow Down"" and ""It Was A Good Day.""', 'Judge has one goal', 'Aaron Judge came to New York to do one thing: bring the Yankees a World Series title for the first time since 2009.', 'Freeman still buzzing', 'Freddie Freeman told Ken Rosenthal that his walk-off grand slam to win Game 1 still hasn\'t settled with him: ""I don\'t think it can."" ', 'No regrets for Boone', 'Yankees manager Aaron Boone feels ""convicted"" after choosing to close Game 1 with LHP Nestor Cortes, who was coming off of a 37-day injury layoff.', 'Hamm, Saweetie set the stage', 'The stars are stoked for Game 2.', 'Fans lining up', 'While fans are packing Chavez Ravine in Echo Park, Cosm in Inglewood is also drawing quite the crowd ahead of Game 2.', 'New York Yankees', 'Los Angeles Dodgers']"
Dodgers home runs back Yoshinobu Yamamoto to take World Series Game 2,https://www.truebluela.com/2024/10/26/24280493/dodgers-home-runs-yoshinobu-yamamoto-world-series-game-2-yankees,"['FILED UNDER:', 'Yamamoto pitches into the seventh inning, and three Dodgers hit home runs then hold on to take a 2-0 series lead in the Fall Classic.', 'LOS ANGELES — First pitch of Game 2 of the World Series was seven minutes past the scheduled time, because Ice Cube opened things with a Sorkinesque walk-and-rap all the way from center field to home plate. His decree proved correct, as Saturday was a good day for the Dodgers, who held on to beat the Yankees 4-2 at Dodger Stadium.', 'The Dodgers lead the World Series, two games to none, the first time they’ve held such an advantage since the 2020 National League Division Series.', 'Though he didn’t perform No Vaseline during his pregame jaunt, Ice Cube succeeded in hyping up the crowd and Dave Roberts in the dugout. Soon after, Roberts had more reasons to smile.', 'Yoshinobu Yamamoto had his best, and longest outing since returning from a three-month stint on the injured list. He not only completed six innings for the first time in those eight starts, but even got an out in the seventh as well.', 'Juan Soto punished a fastball that caught too much of the plate in the third inning, but that was the only hit Yamamoto allowed. The right-hander walked off the mound to a hero’s ovation with just the one run to his ledger.', '“I think the thing that excites me is his temperament, poise, the ability to control his emotions and still make pitches,” Roberts said of Yamamoto before the game. “It’s his first World Series start, and he’ll be ready.”', 'Yamamoto is just the second Dodgers pitcher to complete at least six innings and allow only one hit in a World Series game, joining Rich Hill in Game 4 in 2018. The Dodgers had a better result than that one on Saturday night.', 'Blake Treinen allowed three hits for a run and hit a batter in the ninth, his third straight appearance allowing a run after 20 consecutive scoreless appearances. The Yankees got the tying and go-ahead runs on base against him, but struck out Anthony Volpe with the bases loaded for the second out.', 'Treinen was removed after 33 pitches (one night after throwing 22 pitches in a four-out appearance), and Alex Vesia escaped the final threat by getting pinch-hitter Jose Trevino to fly out on one pitch.', 'Tommy Edman has been johnny on the spot for the Dodgers, and has been Superman against left-handers, so it’s only fitting he got the ball rolling with a home run off Carlos Rodón in the second inning.', 'Edman also doubled and stole a base in the third inning, joining a rare quintet in Dodgers World Series history. Edman this postseason has 11 hits in 17 at-bats (.647), with four doubles and two home runs.', 'The third inning brought more thunder against Rodón, with Teoscar Hernández hitting a two-run shot, followed by Game 1 hero Freddie Freeman homering off a left-hander for the second day in a row. Hernández and Freeman authored just the second back-to-back home runs by Dodgers in the World Series, joining Steve Yeager and Pedro Guerrero in the pivotal Game 5 in 1981, also against the Yankees.', 'Forty-three years ago, those back-to-back home runs got the Dodgers to within one win of a championship. This year, they’re now two wins away from a title.', 'Now the question is, will Shohei Ohtani be active to get those two more victories. Ohtani suffered a subluxation of his left shoulder sliding into second base in the seventh inning. An MRI is pending to determine the severity.', 'Home runs: Tommy Edman (2), Teoscar Hernández (3), Freddie Freeman (2); Juan Soto (4)', 'WP — Yoshinobu Yamamoto (2-0): 6⅓ IP, 1 hit, 1 run, 2 walks, 4 strikeouts', 'LP — Carlos Rodón (1-2): 3⅓ IP, 6 hits, 4 runs, 3 strikeouts', 'Sv — Alex Vesia (1): 1 up, 1 down', 'Sunday is a travel day as the World Series shifts to Yankee Stadium. Walker Buehler starts for the Dodgers in Game 3 on Monday (5:08 p.m. PT, Fox), with right-hander Clarke Schmidt starting for New York.', '', '', '', '', 'Gambling Problem? Call 1-800-GAMBLER (1-800-426-2537). Hope is here. GamblingHelpLineMA.org or call (800) 327-5050 for 24/7 support (MA). Visit www.mdgamblinghelp.org (MD). Call 877-8HOPE-NY or text HOPENY (467369) (NY). 21+ (18+ D.C.) and present in select states (for KS, in affiliation with Kansas Star Casino). Call 1-888-789-7777 or visit ccpg.org/chat (CT) or visit FanDuel.com/RG.', '', '', '', '', '', '', '']"
Dodgers star Shohei Ohtani suffers left shoulder injury during Game 2 of the World Series,https://www.cnn.com/2024/10/26/sport/la-dodgers-shohei-ohtani-world-series-injury/index.html,"['', 'Los Angeles Dodgers superstar Shohei Ohtani suffered a shoulder injury before the Dodgers’ 4-2 win over the New York Yankees in Game 2 of the World Series Saturday.', 'The Japanese slugger sustained a left shoulder subluxation and will undergo more testing, Los Angeles Dodgers manager Dave Roberts said after the game, adding that the team is however “encouraged” about the injury.', '“The strength was great,” Roberts told reporters. “The range of motion good. So, we’re encouraged. But obviously I can’t speculate because we don’t get the scans yet. So, once we get the scans, we’ll know more. Again, with the strength, the range of motion good, that’s certainly a positive.', 'A shoulder subluxation occurs when “the humerus partially slides in and out of place quickly,” according to Johns Hopkins Medicine.', 'With the Dodgers up 4-1 in the bottom of the seventh inning, Ohtani attempted to steal second base but was thrown out to end the inning. Ohtani, however, stayed on the ground grimacing in pain and eventually walked off the field with trainers holding his left arm.', 'Roberts said watching Ohtani on the ground in pain was “concerning.”', '“Obviously when you get any one of your players that goes down, it’s concerning,” Roberts said. “But after kind of the range of motion, the strength test, I felt much better about it.”', 'According to the FOX broadcast, microphones picked up a conversation between Ohtani and trainers saying that his left shoulder appears to have popped out of its socket.', 'This weekend’s playoffs mark Ohtani’s first appearance in the postseason after he missed out in each of his six seasons with the Los Angeles Angels.', 'The star player is riding on a series of remarkable accomplishments in recent months, including hitting his 50th homer of the season and stealing his 50th base in the Dodgers’ victory over the Miami Marlins last Thursday. Ohtani went on to rack up his 51st of each stat by the end of the contest.', 'Though Ohtani has had an exceptional debut season with the Dodgers, the 30-year-old player has grappled with physical setbacks.', 'Ohtani underwent elbow surgery in September 2023 – a year to the day before he opened the 50-50 club – and was advised that he likely wouldn’t be able to pitch until 2025; on paper, greatly reducing the effectiveness of the transcendent two-way star.', 'Even after taking a seat from pitching, Ohtani remains the favorite to win the NL MVP award, potentially the first to do so having played solely as a designated hitter.', 'Ohtani has been working diligently to rehabilitate his elbow, even going as far as to throw off a mound in practice last month for the first time since his surgery, sparking rumors and hopes that he might be able to pitch in the playoffs.', 'Roberts shut down the rumors, however, telling reporters on the eve of Game 1 that there is “no possibility” of Ohtani pitching in the playoffs. “None whatsoever.”', 'Game 3 is scheduled for Monday at Yankee Stadium in the Bronx, New York.', 'When asked about how the Dodgers will handle Ohtani potentially missing games, Roberts quickly responded that he is “not there yet.”', '“I’m expecting him to be there. I’m expecting him to be in the lineup,” Roberts said.', 'This story has been updated with additional information.', 'CNN’s George Ramsay contributed to this report.', '© 2024 Cable News Network. A Warner Bros. Discovery Company. All Rights Reserved.\nCNN Sans ™ & © 2016 Cable News Network.', '', '', '', '', '']"
Your Privacy,https://www.si.com/mlb/world-series-dodgers-limbo-shohei-ohtani-shoulder-injury-game-2,"['As the Los Angeles Dodgers celebrated their World Series win, a potentially catastrophic loss left Dodger Stadium. Within minutes of the final out of Saturday’s 4–2 victory over the New York Yankees in Game 2, Shohei Ohtani, wearing street clothes and with his hair wet, presumably from a shower, his face impassive, boarded the elevator to the parking lot. He did not appear to be wearing a brace or a cast on his left shoulder, the one that suffered a subluxation—a partial dislocation—on a failed stolen base attempt in the seventh inning. ', 'As he left, I asked him how his shoulder felt. He did not respond. The elevator doors closed.', 'Manager Dave Roberts said that the team would know more about Ohtani’s status after the superstar DH underwent an MRI but that initial physical tests did not seem to indicate an injury that would end his World Series. ', ""“The strength was great, the range of motion good,” Roberts said. “So we’re encouraged. But obviously I can’t speculate, because we don’t have the scans yet. So once we get the scans, we'll know more.” Roberts added that, at least in theory, a left shoulder injury for a left-handed hitter is preferable to a right shoulder injury."", 'Through two games, the Dodgers have looked like the clearly superior team—their starting pitchers have lasted longer, their relievers have given up fewer runs, their offense has scored more runs, they’ve played cleaner baseball. But if indeed Ohtani misses time, the momentum of the series could swing. ', 'In the seventh, when Ohtani slid into second base and failed to get up immediately, Dodgers left fielder Teoscar Hernández said, “Not only the dugout, but the whole stadium was in silence.”', 'They understood the stakes: Ohtani is probably the most talented player in the history of the sport. He will almost certainly win his third Most Valuable Player award next month, and he had a 1.185 OPS in the National League Championship Series. ', 'The Yankees have largely kept him in check this series, holding him to one hit in Game 1 (although it was a big one—a one-out double on which he took third on an error, then scored the tying run on a sacrifice fly) and the walk in Game 2 that led to the fateful stolen base attempt. But just his presence in the lineup affects the way the Yankees approach the Dodgers: With Game 1 on the line Friday, New York manager Aaron Boone went to lefty starter Nestor Cortés, who had not pitched in more than a month, because he did not like the matchup of lefty reliever Tim Hill against Ohtani. Ohtani flew out, but Freddie Freeman hit a walk-off grand slam. ', 'The series resumes Monday in New York. Hernández said he hoped Sunday’s off-day would help provide Ohtani time to heal. Roberts declined to offer platitudes about how the team could respond if Ohtani cannot play. ', '“I’m not there,” Roberts said. “I’m expecting him to be there. I’m expecting him to be in the lineup.”', ""Stephanie Apstein is a senior writer covering baseball and Olympic sports for Sports Illustrated, where she started as an intern in 2011. She has covered 10 World Series and three Olympics, and is a frequent contributor to SportsNet New York's Baseball Night in New York. Apstein has twice won top honors from the Associated Press Sports Editors, and her work has been included in the Best American Sports Writing book series. A member of the Baseball Writers Association of America who serves as its New York chapter vice chair, she graduated from Trinity College with a bachelor's in French and Italian, and has a master's in journalism from Columbia University."", 'Follow stephapstein', ""© 2024\nABG-SI LLC.\n- SPORTS ILLUSTRATED IS A REGISTERED TRADEMARK OF ABG-SI LLC. - All Rights Reserved. The content on this site is for entertainment and educational purposes only. All betting content is intended for an audience ages 21+. All advice, including picks and predictions, is based on individual commentators' opinions and not that of Minute Media or its related brands. All picks and predictions are suggestions only. No one should expect to make money from the picks and predictions discussed on this website. For more information, please read our Legal Disclaimer. Gambling content intended for 21+. If you or someone you know has a gambling problem, crisis counseling and referral services can be accessed by calling 1-800-GAMBLER.""]"
