Title,Link,Paragraphs
Shohei Ohtani Leaves Game 2 With Shoulder Injury,https://www.outkick.com/sports/shohei-ohtani-leaves-game-2-shoulder-injury,"[""Game 2 of the World Series was pretty much all Los Angeles Dodgers from the start, but on a dime, the vibe in Dodger Stadium went from a party to deafening silence as the team's superstar Shohei Ohtani walked off the field clutching his arm."", 'It happened in the bottom of the seventh inning with the Dodgers up 4-1 after Ohtani was walked to get on base. The next batter was Mookie Betts who struck out. With two outs, next at the plates was Teoscar Hernandez and on the first pitch that he faced, Ohtani — who stole 59 bases in the regular season — took off for second.', 'Yankees catcher Austin Wells got the ball to shortstop Anthony Volpe with just enough time for him to get a tag on Ohtani to end the inning.', ""Not an ideal to end the inning, but it became immediately clear that there were bigger problems for the Dodgers when Ohtani didn't hop to his feet and instead started writhing in pain while the team's trainer rushed over to him."", ""There aren't too many things that can suck the air out of a stadium when the home team is up 4-1 in Game 2 of the World Series, but an injury to Shohei Ohtani will certainly do that."", ""While at first it appeared that Ohtani had injured his wrist or forearm, Fox Sports' Ken Rosenthal reported that he had injured his shoulder."", ""That was Ohtani's left shoulder that appears to have been injured. He hasn't pitched this season after undergoing surgery to repair a torn UCL in his pitching elbow."", ""I don't think Dodgers fans will be able to breathe again until they hear what Ohtani's injury status is, and it's entirely possible that this becomes a turning point in the 2024 World Series."", '', ""You are agreeing to OutKick's Terms of Use and Privacy Policy, but don't worry we don't spam."", 'DISCLAIMER: This site is 100% for entertainment purposes only and does not involve real money betting. Gambling related content is not intended for anyone under the age of 21. If you or someone you know has a gambling problem and wants help, call 1-800-GAMBLER.']"
,https://www.ocregister.com/2024/10/26/alexander-an-uh-oh-moment-for-dodgers-on-way-to-2-0-world-series-lead/,"['', '', '', '', '', '', '', 'e-Edition', 'TRENDING:', '', '', '', '', '', '', 'Election Results', 'Candidate Analysis', 'Voter Information']"
Dodgers closing in on 'golden era' after Game 2 win over Yankees,https://www.sportsnet.ca/mlb/article/dodgers-closing-in-on-golden-era-after-game-2-win-over-yankees/,"['This is a modal window.', '', '', '', 'Teoscar Hernandez hit a two-run shot, Freddie Freeman and Tommy Edman tacked on solo HRs and Yoshinubo Yamamoto dazzled allowing one run over 6.1 innings as the Los Angeles Dodgers defeated the New York Yankees 4-2, to take a 2-0 World Series lead.', 'LOS ANGELES — The scope of ambition for the Los Angeles Dodgers extends well beyond a one-off championship, sustainable competitive windows and dynastic runs.', ""“My ultimate, kind of big picture goal is that when we are done, that we're able to look back and say that was the golden era of Dodgers baseball, and that is an incredibly high bar to even say that,” president of baseball operations Andrew Friedman said before the World Series began. “That's where my focus is.”"", 'That vision is instructive as this Fall Classic clash against the New York Yankees continues to unfold, with the Dodgers taking a 2-0 lead in the best-of-seven across the continent to the Bronx after Saturday’s 4-2 victory.', 'Yoshinobu Yamamoto, the $325-million side-dish to Shohei Ohtani’s $700-million main course during Friedman’s billion-dollar plus off-season, pinned Game 2 under his thumb over 6.1 innings of one-hit, one-run ball, while back-to-back homers in the third inning by Teoscar Hernandez and Freddie Freeman, whose walk-off slam in the opener immediately gave this series a signature moment, seized control of the contest. ', 'A major Dodgers worry emerged at the end of the seventh when Ohtani was caught stealing to end the inning and suffered what manager Dave Roberts said was a left shoulder subluxation, or partial dislocation, when his left hand hit the ground as he slid into the bag. Ohtani stayed down for an extended period, eventually coming off the field holding his left arm at 90 degrees, amid stunned silence from a Dodger Stadium crowd of 52,725.', ""“The strength was great. The range of motion good. So we’re encouraged,” Roberts said of the initial testing on the superstar who’s headed for an MRI sometime Sunday. “Obviously I can't speculate … once we get the scans, we'll know more. Again, with the strength, the range of motion good, that's certainly a positive.”"", ""Asked about the possibility of playing without Ohtani, Roberts quickly shot that down, saying, “I’m not there … I'm expecting him to be in the lineup.”"", 'His status will be of keen interest not only to the Dodgers but to the Yankees, whose fate in this series suddenly hinges on their Legion of Doom trio in the batting order doing damage in Monday’s Game 3 against Walker Buehler, and on Clarke Schmidt containing a deeper Dodgers lineup.', 'Manager Aaron Boone pointed to a too-little, too-late rally in the ninth as something to build on and while he fell back on the “it’s a long series” cliche, he also acknowledged that, “we need to make it a long series now.”', ""“We won't flinch,” he added. “We've just got to keep at it.”"", ""Commissioner Rob Manfred sounded like he was counting on that during a brief chat with writers before the game, saying that figuring out where the Tampa Bay Rays will play in 2025 will be a focus “once we get past Game 7 — and we're going to have seven,” an assertion that may not age well at this pace."", ""Seven games of Dodgers-Yankees is, of course, what Major League Baseball wants more than anything after ending up with this glamour-market showdown. Manfred sees “this matchup as an opportunity to amplify everything we've been working on for the last few years. Focus on the players, trying to grow the game into a more national product, international growth, young people and when you get a stage like this, it's an opportunity to take a step forward.”"", 'Unsaid there is that a World Series featuring lesser markets — Kansas City-Milwaukee let’s say, although the Toronto Blue Jays and their outside the U.S.-complications make for a singular give-and-take in jewel events — are, at best, time to hold ground. ', 'What that means for the wider industry is up for debate, but at a time when the Dodgers are pursuing domination at a level few can match, it’s worth wondering who might be able to stop them.', 'Already they’re in a run of 12 straight years in the post-season, winning the National League West all but once. That season, they still won 106 games in 2021, one fewer than the San Francisco Giants.', 'The randomness inherent to the playoffs means they’ve only won one title during that time — beating the Rays in the Texas pandemic bubble in 2020 — but the depth they’ve assembled this year has allowed them to thrive in spite of injuries that should have submarined them.', 'So, if Ohtani misses any games in the World Series, well the Dodgers have been there, done that.', ""“We were battling throughout the year with a lot of injuries,” said Hernandez. “First was the starting pitching and then Mookie (Betts) and then Freddie. And hopefully not Ohtani in this case. It's not going to be a good feeling, but if he can't go on Monday, we just have to keep doing the thing we've been doing for the past couple weeks.”"", 'Tommy Edman, their long-time trade target finally acquired at this summer’s deadline, opened the scoring in the second with his second homer of the playoffs, turning on a 95.4 m.p.h. Carlos Rodon fastball and launching it 355 feet to left.', 'The only hit off Yamamoto came in the third, when Juan Soto hammered a middle-down sinker at 95.2 m.p.h. 386 feet to right to tie the score. ', 'But the Dodgers went right back at Rodon in the bottom half when Mookie Betts ripped a one-out single before Teoscar Hernandez slashed a 98 m.p.h. up-and-away heater 392 feet to right-centre. And then, with the fans chanting “Freddie, Freddie,” Freeman followed by hammering a 96.9 m.p.h heater up and in to right-centre for a 4-1 edge.', 'It’s the 19th time teammates have gone back-to-back in the World Series.', ""“You don't want that to happen when you score one and the other team comes back and scores to tie the game, or scores more than one run, but we just have to keep pushing,” said Hernandez. “That's what we put in our minds. It doesn't matter how many they score, we can score, and we know that. You just go, fight your at-bat, try to get on base for the guy behind you.”"", 'Edman followed with another double and promptly stole third, prompting first baseman Anthony Rizzo to make a mound visit to settle his pitcher down. Kiké Hernández lined out to left on the next pitch to end the inning but the damage had been done.', 'The pitching held from there until the ninth, when Blake Treinen gave up an one-out RBI single to Giancarlo Stanton, Jazz Chisholm Jr. followed with another base hit and Rizzo was hit by a pitch to load the bases. Treinen rallied to strike out Anthony Volpe before lefty Alex Vesia came on to get Jose Trevino, hitting for Austin Wells, the Dodgers now two wins away from adding another championship to Friedman’s burgeoning golden era.', '176 Comments', '90 Comments', '29 Comments', '25 Comments', '22 Comments', 'With your consent we may collect cookies and information to enhance our service, and improve your experience.', '', '', '', '', '', '', '', '', '', '', '', '', '', '']"
2024 World Series: Yoshinobu Yamamoto shows Yankees what they missed out on in masterful Game 2 Dodgers win,https://www.cbssports.com/mlb/news/2024-world-series-yoshinobu-yamamoto-shows-yankees-what-they-missed-out-on-in-masterful-game-2-dodgers-win/,"['', ""LOS ANGELES -- One night after one of the most amazing and dramatic World Series games in history, the Dodgers cruised to a 4-2 victory to take a 2-0 lead in the best-of-seven Fall Classic. There were no late-inning fireworks, nor did the Dodgers require any. That's because Yoshinobu Yamamoto was in total control for much of the night. "", ""He also really helped them set up for the rest of the series. We'll get to that. "", ""First, though, remember when Yamamoto was posted from Nippon Professional Baseball last offseason? The consensus was that he'd clear $250 million pretty easily and that means there was a limited pool of teams involved in serious bidding. As the time ticked down, two clear favorites among his suitors emerged: The Yankees and the Dodgers. "", 'Through that lens, Yamamoto here in Game 2 of the World Series was showing the Yankees what they missed out on. Yamamoto inked a 12-year, $325 million deal with the Dodgers and looked worth every penny in this one.', ""Really, other than his first start, he's been brilliant. Yamamoto was 7-2 with a 3.00 ERA and 1.11 WHIP with 105 strikeouts in 90 innings. This includes his catastrophic debut, when he gave up five runs in one inning in Seoul. He missed a big chunk of the season due to a shoulder injury, but he's been progressively getting better since his return. "", '""Every time I pitched, the last three games, I became more comfortable and I\'m feeling better,"" Yamamoto said through an interpreter before Game 1. ""Of course it\'s a World Series, so I might face a challenge, but I think I\'m -- because that benefits me, those previous three outings during the postseason.""', ""Yes, he was good in his previous two playoff starts after a bad one to start, but he was full-on dominant in Game 2, his first World Series start. In 6 ⅓ innings of work, he only allowed one hit. It was a solo home run off the bat of Juan Soto, but that can be forgiven because it's Juan Freaking Soto in the World Series. The only other blemishes on Yamamoto's ledger Saturday were two walks, but he pitched around those with relative ease. He struck out four. He induced lots of weak contact. He was masterful. "", ""Now, it wasn't just Yamamoto's outing that was impressive. It was the pressure he was able to take off the bullpen. Sure, there's a day off before Game 3, but the Dodgers might have to play three games in three days in New York -- unless they sweep and end this thing in four. This was the first time in 21 games that a starting pitcher against the Yankees went at least six innings. "", ""With Walker Buehler and a bullpen game looming, Yamamoto's brilliance and workload in Game 2 allowed the Dodgers to save a lot of those bullpen bullets. They only needed eight outs and got them from Anthony Banda, Michael Kopech, Blake Treinen and Alex Vesia. "", 'This is what an October ace looks like. The Dodgers have now won seven straight Yamamoto starts, with the latter four being playoff games, and, obviously, this one, his first World Series start.  ', ""The best baseball players in the world are excellent at curbing any nerves or emotions for the biggest games. They might feel nervous internally, but you can never tell from the outside. Yamamoto exemplified this in Game 2, looking calm and stoic throughout the outing. His manager was confident that's exactly what we'd see. "", '""The thing that excites me is his temperament, poise, the ability to control his emotions and still make pitches,"" Dave Roberts said before Game 2. ', 'On the biggest stage, Yamamoto delivered the goods and perfectly illustrated why he got the most lucrative pitcher contract in MLB history. Twisting the knife a bit into the Yankees, who missed out on signing him, was just an added bonus. And now the Dodgers need just two wins to earn the trophy.', '© 2004-2024 CBS INTERACTIVE. ALL RIGHTS RESERVED.', 'CBS Sports is a registered trademark of CBS Broadcasting Inc. Commissioner.com is a registered trademark of CBS Interactive Inc.', 'The content on this site is for entertainment purposes only and CBS Sports makes no representation or warranty as to the accuracy of the information given or the outcome of any game or event. There is no gambling offered on this site. This site contains commercial content and CBS Sports may be compensated for the links provided on this site.', 'Images by Getty Images and Imagn']"
,https://www.mlb.com/news/yoshinobu-yamamoto-world-series-game-2-start,"['AJ Cassavell', '0:00', '0:00', 'LOS ANGELES -- The Dodgers signed Yoshinobu Yamamoto for a moment precisely like this one:', 'A swing game in the World Series. A handful of the sport’s best hitters in the opposing dugout. A charged atmosphere at Dodger Stadium.', 'Did Yamamoto ever deliver.', 'Making his first World Series start in Game 2 on Saturday, Yamamoto stifled Yankees hitters all night, allowing just one hit across 6 1/3 excellent innings. He exited to a standing ovation from the Dodger Stadium crowd, briefly pausing to touch the bill of his cap in appreciation.', 'Yamamoto allowed a game-tying, two-out solo home run to Juan Soto in the top of the third inning. But that thigh-high fastball was Yamamoto’s only punishable mistake. The Dodgers promptly took the lead with three runs in the bottom of the frame, and that was plenty.', 'Aside from Soto’s homer, Yamamoto kept the fearsome heart of the Yankees’ order off-balance. Aaron Judge and Giancarlo Stanton went hitless against him, and Soto also grounded out weakly twice. (The weak contact became a theme.)', 'The effort was reminiscent of Yamamoto’s first start against New York earlier this season, when he pitched seven scoreless innings on June 7. In total, the right-hander has allowed only one run to the Yankees across 13 1/3 frames, while surrendering just three hits.', 'That was also the last time Yamamoto pitched at least six innings in a start. Shortly after that outing, he landed on the IL with a strained rotator cuff. Are the Dodgers ever glad he’s back?', 'Of course, the Yankees had their crack at signing Yamamoto as well. They were among the finalists for the 26-year-old Japanese sensation. New York’s bid came in at 10 years and $300 million. The Dodgers offered $25 million (and two years) more.', 'What a performance by Yoshinobu Yamamoto!\n山本由伸の素晴らしいピッチング！ pic.twitter.com/Of1bfPWwrl', 'In his first World Series start with L.A., Yamamoto proceeded to turn in the 11th outing in World Series history of at least six innings with one hit or fewer. Only Rich Hill had done so previously for the Dodgers (in Game 4 in 2018).', 'The Yankees had turned in four of those outings (David Cone, Orlando Hernandez, Don Larsen and Bill Bevens). They’d never been on the wrong end of one -- until Saturday night.', 'AJ Cassavell covers the Padres for MLB.com.', '24 minutes ago', '9:35 PM PDT', '8:34 PM PDT', 'October 24th, 2024', 'October 17th, 2024', 'October 11th, 2024', '24 minutes ago', '9:35 PM PDT', '8:34 PM PDT', 'October 24th, 2024', '', '', '6:10 AM PDT', '7:26 AM PDT', '6:50 AM PDT', '5:45 PM PDT']"
Dodgers' Yoshinobu Yamamoto stymies Yankees in World Series Game 2 win as Shohei Ohtani injury casts shadow,https://www.foxnews.com/sports/dodgers-yoshinobu-yamamoto-stymies-yankees-world-series-game-2-win-shohei-ohtani-injury-casts-shadow,"['', ""Los Angeles Dodgers pitching great Orel Hershiser talks to Fox News Digital on where Freddie Freeman's home run ranks in history."", 'The Los Angeles Dodgers kept the spark of excitement high on Saturday night following an incredible walk-off home run from Freddie Freeman against the New York Yankees.', 'In Game 2, Dodgers starter Yoshinobu Yamamoto allowed one run on one hit through 6 1/3 innings as the Dodgers won 4-2. He only allowed two walks on 86 pitches thrown.', 'CLICK HERE FOR MORE SPORTS COVERAGE ON FOXNEWS.COM', '', '', '', '', '', '', '', '', '', '', '', '', '', '', '', '', 'Ryan Gaydos is a senior editor for Fox News Digital.', 'This material may not be published, broadcast, rewritten, or redistributed. ©2024 FOX News Network, LLC. All rights reserved. Quotes displayed in real-time or delayed by at least 15 minutes. Market data provided by Factset. Powered and implemented by FactSet Digital Solutions. Legal Statement. Mutual Fund and ETF data provided by Refinitiv Lipper.']"
"Shohei Ohtani injury: Dodgers star undergoing tests on shoulder, status uncertain for rest of World Series",https://www.cbssports.com/mlb/news/shohei-ohtani-injury-dodgers-star-undergoing-tests-on-shoulder-status-uncertain-for-rest-of-world-series/,"['', 'Los Angeles Dodgers superstar Shohei Ohtani will undergo an MRI on his left shoulder after getting hurt on a stolen-base attempt during the bottom of the seventh inning of World Series Game 2 on Saturday against the New York Yankees. Dodgers manager Dave Roberts told reporters Ohtani suffered a subluxation of his left shoulder, but the team is ""encouraged"" by Ohtani\'s range of motion and strength, even if it\'s premature to know what his status is for World Series Game 3 and beyond.', '""He had a little left shoulder subluxation, but everything -- so we\'re going to get some tests at some point tonight, tomorrow, and then we\'ll know more in the next couple days,"" Robert said after the game. ""But the strength was great. The range of motion good. So we\'re encouraged. But obviously I can\'t speculate because we don\'t get the scans yet. So once we get the scans, we\'ll know more. Again, with the strength, the range of motion good, that\'s certainly a positive.""', 'Roberts later added, when asked if the Dodgers were equipped to play the rest of the World Series without Ohtani: ""I\'m expecting him to be there. I\'m expecting him to be in the lineup.""', ""Ohtani's spot in the lineup did not come up again, so he was never technically pulled from the game as the Dodgers held on for a 4-2 win that gave them a 2-0 lead in the best-of-seven series. Ohtani left Dodger Stadium before talking to the media. Sunday will serve as a travel day before the teams reconvene on Monday in New York for Game 3."", ""Here's a look at the play as Ohtani was injured while making a feet-first slide into second base:"", 'Ohtani is slow to get up after he attempted to steal 2nd. pic.twitter.com/T3Af5GRaiw', ""Ohtani, 30, is the favorite to win the National League Most Valuable Player Award after an historic season that saw him become the first player in Major League Baseball history to hit more than 50 home runs and steal more than 50 bases in the same season. Overall, he batted .310/.390/.646 (190 OPS+) with 54 home runs, 130 runs batted in, and 59 stolen bases (on 63 attempts). His contributions were worth an estimated 9.2 Wins Above Replacement, according to Baseball-Reference's calculations."", ""Ohtani, the sport's unique two-way star, has not pitched this season after undergoing elbow surgery on his throwing arm last fall. Ohtani is a right-handed thrower, meaning that this injury would not have any relation to that operation or his subsequent recovery. As it stands, he's not expected to pitch again until the start of the 2025 campaign."", '© 2004-2024 CBS INTERACTIVE. ALL RIGHTS RESERVED.', 'CBS Sports is a registered trademark of CBS Broadcasting Inc. Commissioner.com is a registered trademark of CBS Interactive Inc.', 'The content on this site is for entertainment purposes only and CBS Sports makes no representation or warranty as to the accuracy of the information given or the outcome of any game or event. There is no gambling offered on this site. This site contains commercial content and CBS Sports may be compensated for the links provided on this site.', 'Images by Getty Images and Imagn']"
Column: Ouch-tani! Shohei Ohtani’s injury could place a Dodgers World Series win at risk,https://www.latimes.com/sports/dodgers/story/2024-10-26/dodgers-win-inevitable-world-series-title-yankees,"['', '', '', '', '', '', '', '', '', '', '', '', '', '', '', '', '', '', '', '', '', '', '', '', '', '', '', '', '', '', '', '', '', '', '', '', '', '', '', '', '', '', '', '', '', '', '', '', '', '', '', '', '', '', '', '', '', '', '', '', '', '', '', '', '', '']"
'Encouraged' Dodgers say Ohtani has partially dislocated shoulder,https://www.espn.com/mlb/story/_/id/42023471/dodgers-ohtani-exits-injury-world-series-game-2,"['', 'NEW! Find where to watch all of your favorite sports!', '', '', 'LOS ANGELES -- Shohei Ohtani suffered a subluxation of his left shoulder during an attempted steal of second base Saturday night, potentially putting his availability for the rest of this World Series in jeopardy.', 'The Los Angeles Dodgers, though, were ""encouraged,"" manager Dave Roberts said after a 4-2 win over the New York Yankees at Dodger Stadium gave his team a 2-0 lead in this best-of-seven series.', 'Initial strength and range-of-motion tests came back positive, Roberts added. Ohtani, whose injury is defined as a minor dislocation, was expected to undergo an MRI on his shoulder Sunday.', 'The Dodgers boarded their flight to New York late Saturday night, though it was unclear if Ohtani joined them. He could technically undergo the MRI in L.A., then fly out on his own to rejoin the team.', 'Game 3 is Monday at Yankee Stadium, which will also host Game 4 on Tuesday and a potential Game 5 on Wednesday.', 'When asked if he believed the Dodgers were equipped to sustain the loss of Ohtani -- given how they\'ve overcome injuries to other key hitters, including Mookie Betts, Max Muncy and, most recently, Freddie Freeman -- Roberts said: ""I\'m not there. I\'m expecting him to be there. I\'m expecting him to be in the lineup.""', ""Ohtani, who did not sit out any games because of injury this season, was tagged out on the steal attempt at second base to end the seventh inning and was slow to get up, rolling on the ground while grabbing his left arm. When he was finally helped to his feet, Dodgers assistant athletic trainer Yosuke Nakajima held the superstar's left arm as the two disappeared into the clubhouse."", 'Ohtani did not speak to reporters postgame, though he departed without wearing a sleeve on his shoulder.', '""The whole stadium went silent,"" Dodgers outfielder Teoscar Hernandez said of watching Ohtani go down. ""You know how big Shohei is for this team. Hopefully he\'s OK, and the day off tomorrow will help him get back on the field on Monday.""', '', '', '']"
