Title,Link,Paragraphs
Why Hugh Freeze didn’t travel with Auburn to Kentucky on Friday,https://www.yardbarker.com/college_football/articles/why_hugh_freeze_didnt_travel_with_auburn_to_kentucky_on_friday/s1_17125_41126260,"['', 'Carrying a dismal 2-5 record into Week 9, a road win over Kentucky would do wonders for Auburn’s 2024 campaign. However, the team is facing a potentially major roadblock with the health of head coach Hugh Freeze.', 'Freeze did not travel with the team to Lexington on Friday due to an illness but will join them Saturday morning, per Pete Thamel of ESPN. Freeze intends to coach the game despite his delayed arrival. Thamel reports that his illness is due to a suspected food poisoning.', 'Auburn is coming off a narrow 21-17 loss to No. 19-ranked Missouri in Week 8. The team entered that game off their bye week but was listless on offense and out-gunned by a hobbled Brady Cook.', 'The veteran head coach is in his second season leading the Tigers after four successful years at Liberty. He was previously the head coach of Ole Miss from 2012 to 2016 before an infamous scandal forced him to resign.', 'Despite a 2-1 start to the year, Auburn has not won a game since their Week 3 game against New Mexico State. The Tigers have since lost their last four outings, all of which were SEC matchups.', 'However, Auburn appears to have their best chance to change the course of their season in Week 9 against Kentucky despite Freeze’s health concerns. The Tigers are just one-point underdogs in the game, their closest spread since being a three-point favorite over Arkansas in Week 4.', 'While their record suggests a lost season, Auburn was realistically a couple of plays away from potentially securing two ranked wins. They were solidly in control against Oklahoma in Week 5 before a late collapse and entered the fourth quarter against Missouri with a double-digit lead before giving up the go-ahead score with less than one minute remaining.', 'This article first appeared on NCAA Football on ClutchPoints and was syndicated with permission.', 'More must-reads:', 'The rivalry game Saturday between Michigan and Michigan State ended in utter chaos. The Wolverines led the Spartans 24-17 and had possession with just over a minute left in the contest at Michigan Stadium in Ann Arbor, Mich. Facing 3rd-and-5 at their own 44, Michigan quarterback Alex Orji rushed for eight yards to ice the game. But after Michigan went for the kneel-down to run out the clock, Wolverines tight end Colston Loveland got into it with Spartans defensive end Anthony Jones. Loveland and Jones first exchanged shoves. Loveland then headbutted Jones, who immediately responded by grabbing his aggressor by the helmet. Players in both yellow and green swarmed the two as the game clock trickled down to zero. The referees eventually got the game back under control, but not before both sidelines emptied out onto the field. On-field fracas aside, Michigan has dominated its matchups against Michigan State over the last few years. The Wolverines have won the last three contests and five of the last seven overall in the rivalry. Michigan leads Michigan State all-time 74-38-5. Michigan State wasted a golden opportunity down 24-17 with 3:02 to play. The Spartans had 1st-and-10 at Michigan’s 21 but were unable to find the end zone and eventually turned it over on downs.', 'The Leafs suffered a big loss at the hands of the St. Louis Blues last night, and Craig Berube wasn\'t in a festive mood, as he ripped into captain Auston Matthews. During the game between the Toronto Maple Leafs and the St. Louis Blues, there was quite a heated exchange between head coach Craig Berube and Auston Matthews that only served to distract from the game at hand. Down by 5-1, when the third Blues goal was counted, Berube could be seen involved in an animated argument with Matthews on the bench. The moment really begged questions about the message that Berube was trying to get across to the Maple Leafs captain. Was this a release of frustration, or was there something more to what Berube was doing with such an intense show of emotion? Berube is known to be very straightforward in his method of coaching. He will not hold back from lacing into guys, even star players like Auston Matthews. On one hand, sometimes these situations wake up players and get them to raise their games in big moments. That could spur an element of urgency in Matthews, who will then take ownership and try to prevent further defensive breakdowns. After all, Matthews is one of the leaders of this team, and perhaps coaches like Berube think a little tough love is what he needs to sharpen his focus at those moments, but it seems all has smoothed over with the two. There\'s a possible down side, too, to Berube\'s aggressiveness. For a player as skilled and composed as Matthews, who leads more by example than by heated passion, such an in-your-face tactic might be counterproductive. If it\'s not presented well, the pressure could be put on Matthews and hurt his confidence or affect team chemistry. Not everyone responds well to hard-nosed coaching, and this sort of public call-out could very well create tension rather than cure what ails. ""I mean, I don\'t know. I mean, it\'s hockey. You get yelled at sometimes. Coach yells. You just kind of take it as it goes,"" Matthews said. ""I don\'t know. There\'s obviously an impact. We obviously all respect him and his presence and everything on the bench. Yeah, so it\'s not anything you take personally."" Postgame, and on the day after the game, Matthews was relatively quiet on the matter, offering little initial comment and speaking on the situation the next day. His measured response may suggest that he understood where Craig Berube was coming from, even if those types of things aren\'t exactly his cup of tea when it comes to being critiqued. The always-chatty Mitch Marner, lined up next to Matthews often on the ice, was also understanding of Berube\'s perspective. It would suggest that the Leafs are prepared to take this altercation on the chin, as it were, heading into tough matchups with the Boston Bruins and Winnipeg Jets. ""I mean, you\'re pissed off if you\'re on the ice against a goal. So, you\'re already pissed off,"" Marner said. ""We need to be more direct with that puck. We need to be better with it. We\'ve got to be at the five as a unit, and, you know, you expect it when you get back it wasn\'t the prettiest of plays out of the five guys on the ice."" Berube\'s hard-nosed approach might become the reason for the overall change in Matthews\' game, but it does have the tendency to push the star player further away if it becomes too much. That is a rather delicate tightrope to walk: calling out athletes to be more intense without having that turn into a cancer within the locker room dynamic. Because of this strategy going down the stretch run, it will be really interesting to see how things pan out for Matthews, Berube and the Leafs.', 'Montreal Canadiens defenseman Arber Xhekaj has been out of the lineup for a bit, but now, head coach Martin St. Louis is giving him another chance. In an announcement, it was revealed that Xhekaj would be back in the Montreal Canadiens lineup when the team takes on the St. Louis Blues on Saturday. This should be a huge game for Xhekaj, who has been a healthy scratch more often than not to start the year. Interestingly enough, Martin St. Louis did offer what appears to be a final warning to the defenseman. Essentially, he wants to see some consistent play with no turnovers. He acknowledged that Xhekaj is no longer a rookie and that he needs to leave those rookie mistakes in the past. ""I expect a better version. Being staying alert, consistent,\' St. Louis said. ""You should be worried about making some mistakes. He\'s not a rookie anymore. So you should say: I gotta be better.\' Very simple. It\'s not like we nitpick everything he does. But he\'s gotta be better. I expect Xhekaj to be a better version."" It will be fascinating to see how this all shakes out for Xhekaj. He and many other Habs players need to take a leap. Something has to give and Xhekaj will want to be the solution, not the problem.', 'Over the 76-year history of NASCAR, retaliation for transgressions on the racetrack have always been prevalent. Plenty of drivers have used the chrome horn to show their displeasure after a competitor roughed them up, and from time to time, competitors crossed the line. The invisible line of conduct was clearly crossed and abused in Saturday\'s NASCAR Craftsman Truck Series race at the Homestead-Miami Speedway, when driver Conner Jones intentionally crashed fellow competitor Matt Mills after Jones was upset with the way he was being raced. On lap 76, Jones\' frustration boiled over, as he sent Mills\' Chevrolet hard into the outside wall in turn four, with Mills\' truck spewing flames from the rear of the vehicle. The incident was bad enough on its own — intentionally wrecking a fellow driver is never acceptable — but the optics were made even worse when it was announced that Mills had to be transferred to a local hospital for further evaluation. Jones has been the subject of several smaller incidents over the course of the 2024 season, and in 12 starts — all of which have come in championship-caliber ThorSport Racing trucks — Jones has yet to finish inside the top 10, with a season-best finish of 11th coming at Charlotte on May 24. Jones\' reputation as a pay driver — a distinction given to drivers who bring funding and sponsorship but lack results — certainly doesn\'t help him in this situation. Nor does his past history in the series, which has been marred by smaller incidents with other competitors. Jones refused to talk to the media after the race, choosing instead to issue an apology via social media. ""I have not yet had the chance to personally apologize to Matt for the incident that took place during today\'s race at Homestead-Miami Speedway, but I intend to do so,"" the statement read. ""Matt and I have encountered several on-track incidents this season, and I let my frustration get the best of me."" The apology is both a nice sentiment and a necessary PR move, but it rings hollow on an afternoon where Jones made an incredibly poor judgement call. It\'s not a crime for athletes to let their tempers get the best of them, but in a sport that is inherently dangerous, using 3,400-pound vehicles as weapons is inexcusable.', 'Get the latest news and rumors, customized to your favorite sports and teams. Emailed daily. Always free!', 'Join hundreds of thousands of readers who start their day with The Morning Bark, the best newsletter in sports.']"
"Hugh Freeze reportedly 'battling an illness,' plans to fly to Kentucky Saturday morning",https://www.saturdaydownsouth.com/auburn-football/hugh-freeze-reportedly-battling-an-illness-plans-to-fly-to-kentucky-saturday-morning/,"['Hugh Freeze did not travel with the rest of the Tigers program to Lexington Friday night, as is custom the day before a matchup. Instead, Auburn’s head coach will be flying up to Lexington Saturday morning with kickoff set for 7:45 p.m. ET.', 'According to a report from ESPN’s Pete Thamel, Freeze is dealing with an illness that is “potentially” food poisoning. He’s still expected to coach the Tigers Saturday.', '', 'Of course, Freeze is well-known for that one time he coached his Liberty debut from a hospital bed in the stadium, a moment many online recalled in reaction to this news.', 'The Flames lost that game 24-0 to No. 22 Syracuse.', '', 'On a more serious note, Auburn is in desperate need of a win Saturday against the Wildcats after a 2-5 start to the season. Neither team has won a game in the month of October, and both teams have had serious trouble consistently moving the football.', 'Auburn has at least kept games close this season, while Kentucky is more of a wild card. The Wildcats beat Ole Miss earlier in the year, but also fell to Florida by 28 and South Carolina by 25.', 'YOU MUST BE LOGGED IN TO POST A COMMENT. PLEASE SIGN IN OR REGISTER', 'Eating that hoe putsy again….do it every time.', ""We do not target any individuals under the age of 21. We support responsible gambling. If you feel like you're losing control over your gambling experience, call 1-800-GAMBLER (NJ, PA, WV), 1-800-9-WITH-IT (IN), 1-800-BETS-OFF (IA), 1-888- 532-3500(Virginia) 1-800-522-4700 (NV, TN), 1-800-522-4700 (CO, TN), 1-855-2CALLGA (IL), 1-800-270-7117 (MI)."", 'About Saturday Down South | Ethics and Editorial Standards | Privacy Policy | Terms and Conditions | Do Not Sell My Personal Information | Cookie Policy | Cookie Settings', 'Other Conferences: Big Ten | ACC | Pac-12', '', '', '', '', '']"
"Hugh Freeze battling illness, expected to coach Auburn vs. Kentucky",https://www.on3.com/college/auburn-tigers/news/hugh-freeze-battling-illness-expected-to-coach-auburn-vs-kentucky/,"['nickkosko59', 'Auburn’s Hugh Freeze will still coach Saturday against Kentucky despite reportedly battling an illness, according to ESPN’s Pete Thamel.', 'On3’s Pete Nakos confirmed that Freeze is “certainly expected to coach” on Saturday.', '“Sources: Auburn coach Hugh Freeze is battling an illness — potentially food poisoning — and didn’t travel with the team to Kentucky yesterday,” Thamel wrote on Twitter. “He’s flying up to Lexington this morning and is expected to coach.”', 'JLAB has the best audio products in the game – and they’re ready to take care of you this football season. Whether you’re traveling to watch your favorite team play or just streaming the game at home.', 'Find the blue box at retailers near you or visit jlab.com.', 'Whatever Freeze potentially ate, it seems to have subsided and he’ll be in Lexington in time to coach the Tigers against the Wildcats.', 'Auburn is 2-5 under Freeze this season and it’s been a tough road to this point. After Kentucky, they’ll get ranked matchups against Vanderbilt, Texas A&M and Alabama out of their last four games.', 'With that slow first half of the year, Freeze took some time to consider the approach of the team and coaches, emphasizing that the team wants to be playing to win and not playing not to lose.', '', '', '', '', '', '“It’s how you want it to be,” Freeze said. “You want to feel that way all the time, but you want to have the confidence and certainly want to do what’s right for your current team to give them the best chance to win.”', 'In Auburn’s most recent game, a close loss to Missouri, it seemed like the Tigers had a chance to win. At one point in the second half, Auburn even had a two-score lead and Missouri quarterback Brady Cook was battling an injury. Still, Missouri came from behind to win.', 'CLICK HERE to go to PrizePicks and use code ON3 to receive a guaranteed $50 once you play $5 in lineups!', '“It’s just like what I was saying a while ago on the very last possession that we had,” Freeze said. “I really wanted on the first play to take a shot and go for the kill. I really did, and I really think it was a good play and a good call. You also just had defense that stoned them on three and out inside the 5-yard line and we haven’t always taken care of the ball or protected when I feel free and loose all the time. So, all of those things are in your mind, so I obviously reverted to our best player in 27 [Jarquez Hunter], and then ended up having to punt and putting in our defense again, which I didn’t mind doing at that point because they were playing so well.', '“Brady Cook did a great job of extending plays. The penalty hurt us also. Missed a line by a freshman corner on the third and 10 really hurt on that last drive.”', ""Ari Wasserman's updated Top 10"", 'Mike Elko sends strong message', 'Things turned ugly as game ended', 'PSU HC apologizes for press conference handling', 'James Franklin on PSU QB injury', '© 2024 On3 Media, Inc. All rights reserved. On3 is a registered trademark of On3 Media, Inc.', '']"
Top 8 most hilarious Hugh Freeze memes as Auburn HC faces illness ahead of Week 9 showdown,https://www.sportskeeda.com/college-football/news-top-8-hilarious-hugh-freeze-memes-auburn-hc-faces-illness-ahead-week-9-showdown,"['Hugh Freeze, the coach of the Auburn Tigers, was likely to not be on the sidelines for the game against the Kentucky Wildcats today. This is because Freeze had been suffering with an illness, rumored to be food poisoning.', 'The news broke on Friday, and here is a collection of some of the best memes posted on social media by college football fans.', 'This is not the first time that Hugh Freeze has been ill for a game. When he coached the Liberty Flames, he remained involved with the game from his hospital bed:', 'With Freeze potentially not making the game, could this be the way he coaches against Kentucky:', 'This gif came from the same game against the Liberty Flames. Could a repeat happen this weekend?', ""If Freeze's illness is food poisoning, this fan has speculatied what his toliet may have dealt with in the last few days:"", 'A mobile Hugh Freeze may have to travel around Kroger Field like this if he is not going to be present at the game:', 'This fan has visualised what a coaching Freeze may look in a hospital bed taking on his responsibilities:', ""This fan has speculated what may have caused Freeze's illness:"", 'Freeze may have to do his post game interviews from his hospital bed, something that he has done before:', 'However, there has been an update to this story since the original post on social media.', ""ESPN's Pete Thamel posted on social media that Hugh Freeze would travel to Lexington and will be on the field to coach the Tigers:"", 'Freeze will be leading an Auburn team that is in desperate need of a win. The Tigers have lost the last four games and are currently 0-4 against SEC teams.', 'A win against the Kentucky Wildcats, who have also been struggling recently, would do a lot for Freeze and the Tigers.', ""While it will not put the Tigers into contention for any playoff spot or a championship game, a victory may save Hugh Freeze's job, and give the team some momentum to bring into the final stretch of what has been a disappointing season."", 'Auburn Tigers Fans? Check out the latest Tigers depth chart, schedule, and roster updates all in one place.', 'Quick Links', '']"
Auburn's Hugh Freeze with the Tigers against Kentucky after arriving a day late because of illness,https://www.hjnews.com/sports/nation/auburns-hugh-freeze-with-the-tigers-against-kentucky-after-arriving-a-day-late-because-of/article_df9d0969-793c-5bcd-ae20-4b5d81e8c6f7.html,"['', '', 'Auburn head coach Hugh Freeze walks off the field after losing 21-17 to Missouri in an NCAA college football game Saturday, Oct. 19, 2024, in Columbia, Mo.', ""LEXINGTON, Ky. (AP) — Auburn coach Hugh Freeze arrived well ahead of the Tigers' Southeastern Conference game against Kentucky on Saturday night and was on the sidelines before kickoff after not flying with the team on Friday because of an illness."", 'An ESPN report said Freeze didn\'t travel after falling ill on Friday. An Auburn football spokesman confirmed that the coach experienced nausea described as a “24 hour bug"" but flew to Lexington on Saturday morning and was with the team as it conducted its pregame Tiger Walk into Kroger Field several hours before the scheduled 7:45 p.m. ET kickoff. Freeze went through his normal pregame routine, the spokesman added, and even took pictures on the field.', 'The Tigers (2-5, 0-4) sought to end a four-game losing streak and salvage fading bowl prospects. Auburn has won nine straight trips to Lexington dating back to 1966 and faces a Wildcats team (3-4, 1-4) trying to get back to .500 after losing consecutive SEC games against No. 25 Vanderbilt and at Florida.', '', 'AP college football: https://apnews.com/hub/college-football and https://apnews.com/hub/ap-top-25-college-football-poll', 'Copyright 2024 The Associated Press. All rights reserved. This material may not be published, broadcast, rewritten or redistributed without permission.', 'Log In', '', 'To view our latest e-Edition, click the image on the left.', '', '', '', '', '', '', '', '', '', '', '', '', '', '', '', '', '', '', '', 'Learn more about your privacy options', '', '', '']"
Auburn coach Hugh Freeze (illness) joins team in Kentucky,https://www.dailypostathenian.com/sports/national/article_ad5c29f2-e72e-5f76-a959-6fcd10a2eaf2.html,"['', '', 'Oct 5, 2024; Athens, Georgia, USA; Auburn Tigers head coach Hugh Freeze on the field against the Georgia Bulldogs at Sanford Stadium. Mandatory Credit: Dale Zanine-Imagn Images', ""Auburn coach Hugh Freeze is expected to be on the sidelines Saturday night in Lexington, Ky., when his team faces Kentucky. Freeze, 55, remained in Auburn Friday when his Tigers departed for Lexington because of an illness. ESPN reported that he took a different flight to the game because of a bout of what is believed to be food poisoning. Auburn (2-5, 0-4 Southeastern Conference) has lost four conference games in a row -- three of them to ranked opponents. Freeze's team was up 17-6 before losing to No. 19 Missouri 21-17 last Saturday. The Wildcats are 3-4 (1-4 SEC) on the season and with Auburn, make up two of the bottom three schools in the conference standings. --Field Level Media"", 'Originally published on fieldlevelmedia.com, part of the BLOX Digital Content Exchange.', 'Log In', '', ""We're always interested in hearing about news in our community. Let us know what's going on!"", 'Department email:\nNews - news@dailypostathenian.com\nSports - sports@dailypostathenian.com\nClassifieds - classified@dailypostathenian.com\nCirculation - circulation@dailypostathenian.com\nComposing - composing@dailypostathenian.com\nOnline - webmaster@dailypostathenian.com\nFull Staff Directory', '', '', '', '', '', '', '', '', '', '', '', '', '', '', '', '', '', '', 'Learn more about your privacy options', '', '', '']"
“I'm sure its mental illness”: CFB fans react as Auburn HC Hugh Freeze gears up to coach from the hospital bed in Week 9,https://www.sportskeeda.com/college-football/news-i-m-sure-mental-illness-cfb-fans-react-auburn-hc-hugh-freeze-gears-coach-hospital-bed-week-9,"['Auburn Tigers coach Hugh Freeze spent Friday night in a hospital after experiencing ""severe nausea"" in what is believed to be caused by food poisoning. However, Freeze is still expected to coach Auburn\'s game on Saturday night against the Kentucky Wildcats at 7:30 p.m. ET and will fly out to Lexington in the afternoon.', ""Freeze confirmed to ESPN's Chris Low that he will be on the sidelines."", 'Freeze is not just going viral for his hospitalization, but also for what he was wearing. He sported a coaching shirt and visor, which is exactly what he would wear on the sideline minus the Auburn logo.', 'Fans took to X to react to the news.', 'This is not the first time that Freeze has had to attend to football duties under strange circumstances. In 2019, his former team, the Liberty Flames, were set to face the Syracuse Orange to open their campaign. Freeze was sick and was unable to attend the game on the sideline, but he still coached from a hospital bed in the press box of Williams Stadium in Lynchburg, Virginia.', 'Syracuse dominated the Flames and won 24-0.', 'Even under healthy circumstances, Freeze and the Tigers have not had much success this season. Auburn (2-5, 0-4 Southeastern Conference) is on a four-game losing streak to SEC foes Arkansas, Oklahoma, Georgia and Missouri.', ""The remaining games won't be easier for the Tigers. Freeze will have to lead his struggling team against three more AP Top 25 teams: No. 25-ranked Vanderbilt, No. 14-ranked Texas A&M and No. 15-ranked Alabama."", ""Senior quarterback Payton Thorne continues to struggle and is coming off a 176 passing-yard performance against Missouri. Both his job security and Freeze's have been topics of conversation among Auburn fans and analysts."", 'Heading into the Week 9 matchup, Kentucky is favored by exactly one point against the Tigers.', 'Auburn Tigers Fans? Check out the latest Tigers depth chart, schedule, and roster updates all in one place.', 'Quick Links', '']"
