Title,Link,Paragraphs
Straight Talk Wireless 400 NASCAR Betting Picks and Predictions on 10/27,https://www.betus.com.pa/motorsports/nascar/straight-talk-wireless-400-nascar-betting-picks-and-predictions-on-10-27-2024-pagu/,"['', '', 'MOTORSPORTS', '', ' ', 'After a chaotic Las Vegas race that saw multiple playoff drivers wreck and Joey Logano stun the field by clinching his spot in the Championship 4, the NASCAR Cup Series rolls into Homestead-Miami Speedway on Sunday for the Straight Talk Wireless 400.', 'Even after a disappointing Vegas showing, Kyle Larson is the favorite to win the race at +300. Who will join Logano in vying for the championship? Or will someone play spoiler? We’ll cover it all with our NASCAR best bets for the week.', ' ', 'In addition to Logano stealing a spot in the championship 4, Vegas was a nightmare for multiple playoff drivers. Tyler Reddick went for a flip in the infield with Chase Elliott involved as well. Defending series champion Ryan Blaney also crashed while Denny Hamlin had trouble in the pits and failed to score any stage points.', '', 'These four now face an uphill battle of advancing, sitting at least 27 points out of the top four, meaning a win will likely be necessary. Which of these four has the best shot to win and should be backed in online betting?', 'That honor clearly goes to Reddick, who has been downright phenomenal at Homestead. While yet to win a Cup race, he has three top-fives in four starts and has two wins in the Xfinity Series. The playoffs have been a disaster for the regular season champ, with his lone top-10 coming at the opener in Atlanta.', 'In spite of that, we are going to pick Reddick for the win at +700, posing great value. Homestead comes at the perfect time as Reddick’s season hangs in the balance. And with that said, we are throwing a low-stakes wager on his +1000 NASCAR futures odds to win the series championship.', 'Meanwhile, Homestead has not been particularly kind to the other three. While Blaney had a runner-up finish last year en route to the championship, he only has one other top-10 since 2017. Elliott’s most recent top-10 came back in 2020, en route to his own championship. Hamlin won that 2020 race, but his next best finish since 2017 is seventh.', 'Fade these three drivers with your NASCAR picks as their championship hopes come to a close.', 'NASCAR Pick: Tyler Reddick +700 to win the Straight Talk Wireless 400.', ' ', 'After Vegas, Kyle Larson, William Byron and Christopher Bell all sit comfortably above the cutline. Larson is the favorite and in three Homestead races since missing in 2020, he has one win and another top-five, though he crashed out last season. While he looked poised to dominate last week, he fell multiple laps down after even worse pit road woes than Hamlin.', 'When Larson is good, he is good, but his only non-drafting oval top-10 in the playoffs was his win at Bristol. We are surprised that NASCAR oddsmakers have him as such a strong favorite. We much prefer his Hendrick Motorsports teammate in Byron, who has quietly been red-hot of late.', 'While he hasn’t won since Martinsville in April, Willy B has four-straight top-fives, all on different kinds of tracks. While not one of his best tracks, he has been solid at Homestead, winning in 2021 and adding a fourth last season. He has incredibly appealing odds to win at +700, but we will bet on his top-five streak continuing at +125 for our NASCAR predictions.', 'As for Bell, his charge to the lead ran out of laps at Vegas, narrowly missing the coveted spot in the championship 4. Though he did win this race last season, Homestead hasn’t been one of his best, with only one other top-10 in three starts. We are only comfortable picking Bell for a top-10, but his -280 odds aren’t appealing enough.', 'NASCAR Top-5 Pick: William Byron +125', ' ', 'Join BetUS and bet now! Get a $450 NASCAR Bonus Available for $200 Bets on your first time deposit!', ' ', 'Now that we’ve covered the playoff field, let’s see which of the remaining drivers pose a strong top-10 value. Martin Truex Jr. made good on our pick last week, just his second top-10 in his last 12 races. Though his NASCAR lines sit at -125, we are confident in Truex’s consistency at Homestead, with five top-10s in his last seven starts.', 'The disastrous year for Richard Childress Racing has been well-documented, though they showed some signs of life late in the regular season. But we are actually in on both Kyle Busch and Austin Dillon for a top-10 this week.', 'While it seems Busch’s record of 19 straight seasons with a win will be snapped, Homestead is one of his best tracks, with six-straight top-10 finishes prior to 2023. Even though he has cooled off considerably from his four-race top-10 streak, including nearly two wins, we will bet on Busch’s history at +120.', 'Dillon has also cooled off following his stunning and controversial win at Richmond, scoring just one top-10 in the 10 races since. But Homestead might be his best track, outside of Richmond. Dating back to 2017, Dillon has four top-10s in seven starts. But even when he was outside the top-10, he finished no worse than 12th.', 'Despite his struggles this season, Dillon always seems to find his way toward the top-10 at Homestead and we think his +360 odds makes for a great low-stakes pick in NASCAR prop betting.', 'NASCAR Top-10 Picks: Martin Truex Jr. -125; Kyle Busch +120; Austin Dillon +360', ' ', 'Odds and information are accurate at the time of writing. Please check with official sources for the latest updates before placing any bets.', ' ', '', '', '', '', '', 'Nascar picks', '', '', '', '', '']"
"What channel is NASCAR Homestead qualifying on today? Time, TV schedule, streaming info",https://www.tennessean.com/story/sports/nascar/2024/10/26/nascar-homestead-qualifying-channel-today-time-tv-schedule-streaming/75860203007/,"[""The NASCAR Cup Series begins the race weekend with practice and qualifying on Saturday ahead of Sunday's Straight Talk Wireless 400 at Homestead-Miami Speedway."", 'The morning practice and qualifying sessions ahead of Truck and Xfinity Series races on Saturday will set the lineup of the second race in the Round of 8. Joey Logano locked into the Championship 4 with the win via fuel mileage last weekend at Las Vegas.', ""Sunday's 400-mile race will likely involve a lot of strategy, and at least three playoff drivers (Tyler Reddick, Ryan Blaney and Chase Elliott) are already resigned to having to win in the round to make the final four after falling in the standings at Las Vegas."", 'Here is what you need to know about NASCAR Cup qualifying in Homestead.', 'Qualifying time: 8:50 a.m. CT Saturday', 'TV: NONE (NBC Sports app only) | Radio: SiriusXM and MRN', 'Streaming: NBC Sports app (subscription required); NASCAR.com, MRN.com and SiriusXM for audio (subscription required)', 'Track:  Homestead-Miami Speedway (1.5-mile oval) in Homestead-Miami Speedway', 'WEEKEND SCHEDULE:NASCAR Homestead full weekend track schedule, TV schedule for the Straight Talk Wireless 400, other races', 'LOGANO IN: NASCAR playoff picture: Cup Series points standings after Las Vegas', 'FROM LAST WEEK: NASCAR Las Vegas race winners and losers: Joey Logano holds off Christoper Bell', 'MUNIZ IN THE TRUCK SERIES: Frankie Muniz, ‘Malcolm in the Middle’ actor, earns full-time NASCAR Truck Series ride', 'We occasionally recommend interesting products and services. If you make a purchase by clicking one of the links, we may earn an affiliate fee. USA TODAY Network newsrooms operate independently, and this doesn’t influence our coverage.']"
Reddick Speeds To Homestead Pole,https://www.speedsport.com/nascar/nascar-cup-series/reddick-speeds-to-homestead-pole/,"['Tyler Reddick will start on pole for Sunday’s NASCAR Cup Series race at Homestead Miami Speedway.', 'Reddick, who endured an early exit in last week’s race at Las Vegas Motor Speedway due to a flip in Stage Two, powered his No. 45 23XI Racing Toyota to a fastest speed of 167.452 mph.', 'He outpaced Hendrick Motorsports’ Kyle Larson by 0.077 seconds. ', '“Aa lot of this starts in the weeks leading up to the race,” Reddick began. “And I think a lot of the speed we brought to (Las) Vegas has really continued so far today. And in practice, obviously, fired off with a lot of speed there. It was nice to see that, gave us confidence going into Group A qualifying. And yeah, being able to run the lap we did in the first round gave us even more of that confidence.', '“Then, going into round two, looking at what everyone had been running for speed, (I) decided to do what I felt was best and it worked out. Sometimes, you take that risk, and it doesn’t really go your way. Thankfully, it was a good lap for us. Given equal tires, the 5 (Kyle Larson) would’ve probably been a little faster, but we’re fortunate to go in Group A this weekend and capitalize on it.”', 'Last week’s polesitter, Christopher Bell, starts third alongside Joe Gibbs Racing teammate Denny Hamlin. Non-playoff driver Ricky Stenhouse Jr. qualified fifth ahead of Martin Truex Jr. (sixth), Chase Elliott (seventh), Bubba Wallace (eighth), Daniel Hemric (ninth) and Justin Haley (10th). ', 'Other playoff drivers outside the top 10 include Ryan Blaney (20th), William Byron (25th) and Joey Logano (26th).', 'SPEEDSPORT.com is a part of the NASCAR Digital Media Network', '', '', '', '', '', '', '']"
,https://www.gwinnettdailypost.com/fieldlevel/tyler-reddick-christopher-bell-look-to-make-magic-in-miami/article_3d98605c-361a-58a3-b33e-cae70482a15f.html,"['', '', '', '', '', '', '', '', '', '', '', '3 Months for $10', 'Digital Only', '(Renews at $7.99 per month.)', '11¢ per day', '', '$59.99 for 1 Year', 'Unlimited Access', '(Renews at $79.90 after 1 Year)', 'Pay Now, Get 12 Months', '', '', '', '', '', '', '', '', '', '', '', '', '', '', '', '', '', '', '', '']"
"Saturday schedule, broadcast info for NASCAR Cup, Xfinity, Trucks at Homestead",https://www.nbcsports.com/nascar/news/saturday-schedule-broadcast-info-for-nascar-cup-xfinity-trucks-at-homestead,"['HOMESTEAD, Fla. — Saturday is a busy day at Homestead-Miami Speedway, as all three series will be on track.', 'Cup teams will practice and qualify in the morning ahead of the Xfinity and Truck doubleheader.', 'The Truck playoff race is scheduled for 12 p.m. ET. The Xfinity playoff race is scheduled for 4 p.m. ET.', '', '', '', 'Saturday: Mostly cloudy skies with a high of 76 degrees and a 16% chance of rain at the start of Cup qualifying. Mostly cloudy skies with a high of 83 degrees and a 20% chance of rain at the start of the Truck race. Mostly cloudy skies with a high of 82 degrees and a 15% chance of rain at the start of the Xfinity race.', '', '', '', '', '', '', '', 'Garage open', '', '', 'Track activity', '', '', 'A Division of NBCUniversal.', 'DISCLAIMER: This site and the products offered are for entertainment purposes only, and there is no gambling offered on this site. This service is intended for adult audiences. No guarantees are made for any specific outcome. If you or someone you know has a gambling problem, please call 1-800-GAMBLER.', 'Ⓒ 2024 NBC Universal']"
REDDICK REBOUNDS FROM VEGAS FLIP TO EARN POLE POSITION AT HOMESTEAD,https://www.motorsport.com/nascar-cup/news/nascar-cup-qualifying-reddick-pole-homestead-cup-playoffs/10667066/,"['', '', '', ""Last weekend, Tyler Reddick was rolling through the infield crash in a wild crash at Las Vegas Motor Speedway. Just six days later, he's shown his determination to drag himself out of the elimination zone by winning pole position at Homestead."", ""Reddick's pole lap of 32.248s was more than enough to secure the top spot, earning his third pole of the year and the ninth of his Cup career. Joining him on the front row is Kyle Larson, who was 0.077s adrift of the pole."", 'Christopher Bell qualified third and Denny Hamlin fourth with Joe Gibbs Racing drivers locking out the second row. Ricky Stenhouse Jr., who earned his first win of the year at Talladega earlier this month, was the highest-qualifying non-playoff driver in fifth.', 'Martin Truex Jr. was sixth, Chase Elliott seventh, Bubba Wallace eighth, Daniel Hemric ninth, and Justin Haley tenth.', 'There were no incidents during either round of qualifying and all drivers set a time.', 'Reddick led the Group A drivers in the early-morning qualifying session with a 32.126s lap. Four of the five drivers who advanced were Toyota drivers with the 23XI duo of Reddick and Wallace advancing along with JGR drivers Hamlin and Truex.', 'Haley was the only Chevrolet driver to advance, representing Spire Motorsports and beating Josh Berry for the final spot by only 0.008s.', 'Two playoff drivers failed to advance and they were both Team Penske champions. Joey Logano, who won last week and is already locked into the Championship 4, was the lowest-qualifying playoff driver and was 13th in Group A (26th overall).', 'His teammate Ryan Blaney, who is in a far more precarious points position as he tries to earn back-to-back titles, will start 20th.', '32.126', '+0.093', '32.219', '+0.158', '32.284', '+0.216', '32.342', '+0.249', '32.375', '+0.257', '32.383', '+0.267', '32.393', '+0.292', '32.418', '+0.339', '32.465', '+0.351', '32.477', '+0.381', '32.507', '+0.384', '32.510', '+0.436', '32.562', '+0.451', '32.577', '+0.471', '32.597', '+0.511', '32.637', '+0.527', '32.653', '+0.684', '32.810', '+1.668', '33.794', ""In Group B, a Toyota again topped the charts with Bell lapping the track with a 32.268s lap. In a contrast to Group A, Bell was the only Toyota to move on while the remaining four spots were all held by Chevrolets. Stenhouse, Larson, Elliott and a surprise in Hemric all moved forward. The Kaulig Racing driver was the last driver to advance, beating Hendrick Motorsports' Alex Bowman by 0.039s."", 'William Byron was far behind his Hendrick teammates with the 2024 Daytona 500 winner qualifying 25th.', '32.268', '+0.002', '32.270', '+0.072', '32.340', '+0.097', '32.365', '+0.134', '32.402', '+0.173', '32.441', '+0.212', '32.480', '+0.250', '32.518', '+0.262', '32.530', '+0.269', '32.537', '+0.276', '32.544', '+0.286', '32.554', '+0.313', '32.581', '+0.376', '32.644', '+0.384', '32.652', '+0.435', '32.703', '+0.533', '32.801', '+0.576', '32.844', '+0.795', '33.063', '', '', '', '', '', '', '', '', '', '', '', '', '', '', '', '', '', 'Receive exciting Motorsport news, updates, and special offers straight to your inbox.', '', '', '']"
Logano heads to Homestead as first NASCAR Cup finale qualifier; Verstappen takes F1 lead to Mexico,https://www.bdtonline.com/sports/national_sports/logano-heads-to-homestead-as-first-nascar-cup-finale-qualifier-verstappen-takes-f1-lead-to/article_dce115f2-8da1-53c2-8aa1-5299c401a09b.html,"['', '', '', '', '', '', '', '', '', '', '', '', '', 'NASCAR Cup Series driver Joey Logano (22) does a burnout after winning a NASCAR Cup Series auto race Sunday, Oct. 20, 2024, in Las Vegas.', '', '', '', '', '', '', 'All Times Eastern', 'Straight Talk Wireless 400', 'Site: Homestead, Florida.', 'Schedule: Saturday, practice, 9:05 a.m.; qualifying, 9:50 p.m., Sunday, race, 2:30 p.m. (NBC)', 'Track: Homestead-Miami Speedway.', 'Race distance: 267 laps, 400.5 miles.', 'Last year: Christopher Bell overcame balance issues in Stage 2 and took advantage of a late caution in Stage 3 to seize the lead with 15 laps remaining and earn his second win of the season.', ""Last race: Joey Logano won at Las Vegas to become the first qualifier for next month's championship finale in Phoenix. Christopher Bell led 155 laps after starting on the pole but didn't have enough to hold off Logano. Daniel Suarez was third, William Byron fourth and Alex Bowman fifth."", ""Fast facts: Bell leads the standings over Kyle Larson by seven points and Byron by 15. Denny Hamlin, Tyler Reddick, defending champion Ryan Blaney and Chase Elliott are below the cutline as the Round of Eight continues in Miami. ... Only four playoff drivers finished in the top 10 including Hamlin, who was eighth after a rough day with pit stop issues. ... Homestead-Miami marks the season's final 1.5-mile layout before closing at half-mile Martinsville and one-mile Phoenix."", 'Next race: Nov. 3, Martinsville, Virginia.', 'Online: http://www.nascar.com', 'Credit One NASCAR Amex Credit 300', 'Site: Homestead, Florida.', 'Schedule: Friday, practice, 4:05 p.m.; qualifying, 4:40 p.m.; Saturday, race, 3:30 p.m. (CW)', 'Track: Homestead-Miami Speedway.', 'Race distance: 200 laps, 300 miles.', 'Last year: Sam Mayer led twice for 45 laps, including the final 31 to win by .227 seconds over Riley Herbst and clinch the first spot in the championship finale.', 'Last race: AJ Allmendinger held off non-playoff driver Ryan Sieg in a two-lap sprint after a final restart and held on to win in Las Vegas by 0.156 seconds and clinch a spot in the championship finale. Allmendinger entered the semifinal opener seventh of eight playoff drivers and below the cutline but led a race-high 102 of 201 laps in the No. 16 Kaulig Racing Chevy for his first win this season. Justin Allgaier was third with playoff driver Chandler Smith fourth.', 'Fast facts: Xfinity is down to the round of eight with two more races left at Homestead-Miami and Martinsville to determine the championship four at Phoenix. ... Allgaier leads the series by 16 points over defending champion Cole Custer and 24 over Smith. Austin Hill, Jesse Love, Mayer and Sam Smith are below the cutline.', 'Next race: Nov. 2, Martinsville, Virginia.', 'Online: http://www.nascar.com', 'Baptist Health 200', 'Site: Homestead, Florida.', 'Schedule: Friday, practice, 2:35 p.m.; qualifying, 3:05 p.m.; Saturday, race, Noon. (FS1)', 'Track: Homestead-Miami Speedway.', 'Race distance: 201 laps, 301.5 miles.', 'Last year: Carson Hocevar overtook eventual champion Ben Rhodes for his only lead with 11 laps remaining and won by 2.705 seconds.', 'Last race: Grant Enfinger won the Love’s RV Stop 225 playoff race at Talladega to automatically qualify for the championship finale at Phoenix on Nov. 8.', 'Fast facts: The series returns from a three-week break and will also run at Martinsville on Nov. 1 and Phoenix on Nov. 8 to wrap the season.. ... Enfinger’s win was the first for his CR7 Motorsports team and first by a playoff driver in nine Talladega races. … Three more spots are at stake over the next two races of the round of eight. Corey Heim (3,077 points) finished 11th and leads Christian Eckes by one with Ty Majeski 25 back and Rajah Caruth 30 behind.', 'Next race: Nov. 1, Martinsville, Virginia.', 'Online: http://www.nascar.com', 'Mexico City Grand Prix', 'Site: Mexico City.', 'Schedule: Friday, practice, 2:30 p.m., 6 p.m.; Saturday, practice, 1:30 p.m., qualifying, 5 p.m.; Sunday, race, 4 p.m. (ESPN)', 'Track: Autódromo Hermanos Rodríguez.', 'Race distance: 71 laps, 189.7 miles.', 'Last year: Max Verstappen quickly surged from third at the start and dominated for his record 16th win of the season.', 'Last race: Charles Leclerc dominated the U.S. Grand Prix at Austin, Texas, leading a 1-2 sweep for Ferrari with teammate Carlos Sainz and giving the automaker its first USGP win since 2018. Verstappen was awarded third after Lando Norris received a late five-second penalty.', ""Fast facts: Formula 1 fined Circuit of the Americas nearly $550,000 after about 200 spectators invaded the track during the cooldown lap. ... Verstappen hadn't won since June before winning the U.S. Sprint to earn five points and widen his points lead on Norris to 57. ... Ferrari earned its first 1-2 sweep in the U.S. since 2006 at Indianapolis. ... Seven-time champion Lewis Hamilton failed to finish his first American race in 16 starts with a spin into gravel after two laps. ... Leclerc moved within 22 points of Norris with the win."", 'Next race: Nov. 3, São Paulo, Brazil.', 'Online: http://www.formula1.com', 'Last race: Alex Palou claimed his second consecutive IndyCar championship and third in four years at Nashville Superspeedway, where Colton Herta won the Music City Grand Prix for Andretti Global.', 'Next race: March 2, 2025, St. Petersburg, Florida.', 'Online: http://www.indycar.com', 'Last event: Justin Ashley took the Top Fuel points lead, holding off Clay Millican in the final round to win the Texas NHRA Fall Nationals. Matt Hagan took the Funny Car title in Texas for a second straight year.', 'Next event: Oct. 31-Nov. 3, Las Vegas.', 'Online: http://www.nhra.com', ""Last event: Michael Kofoid won in Joliet, Illinois, a day after Aaron Reutzel won from the pole, holding off David Gravel. Gravel's series lead over Carson Macedo is 78 points."", 'Next race: Bull Ring Blitz, West Memphis, Arkansas, Friday-Saturday.', 'Online: http://worldofoutlaws.com/sprintcars', 'AP auto racing: https://apnews.com/hub/auto-racing', 'Copyright 2024 The Associated Press. All rights reserved. This material may not be published, broadcast, rewritten or redistributed without permission.', ""47 of Pulaski, VA, passed away Thursday, October 17, 2024. A service to celebrate Alfred's life will be held on Saturday, October 26, 2024, at Dudley Memorial Chapel at 1:00 p.m."", '', '', 'Raymond Neal Rose, 60, of Princeton, West Virginia, passed away, Wednesday, October 23, 2024. Born March 27, 1964, in Alabama, he was employed as a cook at The Railyard in Bluefield West Virginia. He was preceded in death by his wife Chasity, his parents Marcus R. (Ret. US Army) and Dorcas L…', '', '', '', 'First Amendment: Congress shall make no law respecting an establishment of religion, or prohibiting the free exercise thereof; or abridging the freedom of speech, or of the press; or the right of the people peaceably to assemble, and to petition the Government for a redress of grievances.', '']"
