Title,Link,Paragraphs
"FANTASY FASTLANE: HEAVY ON PLAYOFF DRIVERS AT HOMESTEAD, REDDICK’S CHANCE TO SHINE",https://www.nascar.com/gallery/fantasy-fastlane-heavy-on-playoff-drivers-at-homestead-reddicks-chance-to-shine/,"['', '', '1 of 16', 'Sean Gardner | Getty Images', 'We’re one race into the Round of 8 and the Championship 4 forecast already has a twist thanks to Joey Logano, who ended the regular season 15th in points. The good news for half of the drivers below the elimination line is that Homestead-Miami Speedway on Sunday (2:30 p.m. ET, NBC, MRN Radio, SiriusXM NASCAR Radio, NBC Sports App) is among their best tracks on the schedule. Meanwhile, the drivers above the elimination line will be vying for every point they can get to potentially seal a spot for the championship race at Phoenix Raceway.  ', 'Fantasy players will earn 10 Fan Rewards points each time they set their lineup in NASCAR Fantasy Live. Fan Rewards is a way for registered users on NASCAR.com to earn points toward things like NASCAR tickets, NASCAR merchandise and more. Learn more about Fan Rewards.', '2 of 16', 'James Gilbert | Getty Images', 'MUST START:\n\nKyle Larson | View stats\n\nHendrick Motorsports, No. 5 Chevrolet\n\nOdds: 33-10\n\nSlotting Larson here is about as automatic as the New York Yankees winning the World Series (wink, wink) this year. Larson stands above the pack at Homestead, despite having just one victory to his resume. The 2021 Cup champion has led at least 96 laps in four of his last seven races, including both Next Gen races. As long as the No. 5 car can avoid the sand barrels on pit-road entry, he should be a factor.', '3 of 16', 'Sean Gardner | Getty Images', 'MUST START:\n\nTyler Reddick | View stats\n\n23XI Racing, No. 45 Toyota\n\nOdds: 6-1\n\nThe apple doesn’t fall far from the tree here. Reddick rivals Larson as the driver who can rim-ride the outside wall better than anybody in NASCAR. Racing within an inch of the powdery blue wall, won Reddick two Xfinity Series championships, and he has seen that success translate to the Cup Series with three top-five finishes in four starts. With Reddick’s struggles at Martinsville, his championship aspirations could ride through Homestead. ', '4 of 16', 'Sean Gardner | Getty Images', 'MUST START:\n\nWilliam Byron | View stats\n\nHendrick Motorsports, No. 24 Chevrolet\n\nOdds: 7-1\n\nThis lineup is beginning to look a lot like last weekend’s suggestions leading into Las Vegas Motor Speedway. Byron scored his first victory with crew chief Rudy Fugle at Homestead in 2021, and he has three top-10 finishes in the last four starts at the 1.5-mile track. The No. 24 team is heating up at the right time, scoring top-five finishes in the last four races, their longest streak since the spring of 2023. ', '5 of 16', 'Sean Gardner | Getty Images', 'MUST START:\n\nChristopher Bell | View stats\n\nJoe Gibbs Racing, No. 20 Toyota\n\nOdds: 6-1\n\nOK, is this Vegas? Not exactly, but a lot of the same drivers that performed well in Sin City are also among the best in South Beach. Prior to last year, it wasn’t Bell’s best track on the circuit. Even well into last year’s race, the No. 20 car faded outside the top 20. But with a few adjustments, Bell soared to the front and locked up a Championship 4 spot by collecting the checkered flag. Arguably, Bell currently has the most speed in the series and will look to capitalize on that this weekend. ', '6 of 16', 'James Gilbert | Getty Images', 'SLEEPER PICK:\n\nKyle Busch | View stats\n\nRichard Childress Racing, No. 8 Chevrolet\n\nOdds: 18-1\n\nIf you’re into theories, then consider this: Homestead is the 34th race of the season, which will tie the deepest into a season Busch has gone without visiting Victory Lane (2020 at Texas). The No. 8 car has shown speed on intermediates this year, though they underachieved last weekend at Las Vegas. Prior to an 18th-place finish in his first Homestead race with RCR, Busch has eight straight top-10 finishes here. ', '7 of 16', 'Sean Gardner | Getty Images', 'SLEEPER PICK:\n\nAJ Allmendinger | View stats\n\nKaulig Racing, No. 16 Chevrolet\n\nOdds: 45-1\n\nWant to have some fun with your lineup? Can you guess who is the only driver to have the top five finish in both Next Gen races at Homestead? Waiting, waiting… If you thought of Allmendinger, you’re correct. Dating back to his days with Richard Petty Motorsports, the road-course ace has always excelled at Homestead. With Kaulig Racing’s performance in 2024, this is a risky choice, but Allmendinger can wheel a car around Homestead with five top-10 finishes in 12 starts. ', '8 of 16', 'James Gilbert | Getty Images', 'SLEEPER PICK:\n\nAustin Dillon | View stats\n\nRichard Childress Racing, No. 3 Chevrolet\n\nOdds: 100-1\n\nOutside of Dillon’s victory at Richmond, it’s been a disastrous season for the No. 3 team. However, he has cracked the top 10 in both Next Gen races at Homestead and soared to fourth in the finishing order in 2022. Dating back to 2016, Dillon has eight straight finishes of 12th or better in South Beach. ', '9 of 16', 'Sean Gardner | Getty Images', 'STAY AWAY FROM:\n\nRyan Blaney | View stats\n\nTeam Penske, No. 12 Ford\n\nOdds: 12-1\n\nWe listed Blaney in this spot last year and he went on to have the best race he’s ever had at Homestead with a runner-up finish. For all you No. 12 fans, maybe that will apply again this year. But if we go by the numbers, that is an anomaly. Blaney has two top 10s in nine Homestead starts, with just one additional finish better than 17th. It’s highly likely Blaney will be in my lineup for the final two races of 2024, though.', '10 of 16', 'Sean Gardner | Getty Images', 'STAY AWAY FROM:\n\nChase Elliott | View stats\n\nHendrick Motorsports, No. 9 Chevrolet\n\nOdds: 14-1\n\nSitting a distant 53 points below the elimination line, Elliott’s strategy must be focused on winning one of the next two races. That isn’t ideal from a fantasy perspective where every point matters. Then, take into account that Elliott has never had a standout race at Homestead – he has three top-10 finishes in eight starts and an average finish of 10.4 – and it leads me to thinking it would be a good week to sit the No. 9 car. ', '11 of 16', 'Sean Gardner | Getty Images', 'STAY AWAY FROM:\n\nChase Briscoe | View stats\n\nStewart-Haas Racing, No. 14 Ford\n\nOdds: 55-1\n\nThe last time the Cup Series visited a worn-out track similar to Homestead, it was Briscoe who found himself in Victory Lane at Darlington Raceway in the regular season finale. Don’t count on that this weekend. Sure, he has an Xfinity win at Homestead, but he’s never finished better than 17th in three Cup tries.', '12 of 16', 'Sean Gardner | Getty Images', 'FEATURED MATCHUP:\n\nKyle Larson vs. William Byron\n\nComing out with a bang this week, with the two Hendrick Motorsports teammates being a heavyweight bout. Both drivers escaped Las Vegas with solid points days and have good buffers over the elimination line. It’s very likely both drivers will also be strong this weekend, as we went over their respective stats earlier. Larson is consistently the best driver at Homestead, however, and gets the nod. ', '13 of 16', 'Sean Gardner | Getty Images', 'FEATURED MATCHUP:\n\nTyler Reddick vs. Christopher Bell\n\nThese two Toyota drivers might have different mindsets entering the weekend. Bell is 42 points above the elimination line after a strong Vegas performance. Reddick flipped on the track and rolled through the standings, and he likely needs a win this weekend to advance to his first Championship 4. Not sure if Reddick will score that coveted victory, but I do like him in this matchup for his boldness of running within centimeters – millimeters? – of the wall. ', '14 of 16', 'James Gilbert | Getty Images', 'FEATURED MATCHUP:', 'Ryan Blaney vs. Martin Truex Jr.\n\nEven though Blaney is listed as a driver to avoid this weekend, it wouldn’t be surprising to see the defending champion rise to the pressure, sitting 47 points below the elimination line. But he will likely be chasing the win. So will Truex, who would love nothing more than to feel the high of Victory Lane one final time in his last full season. Truex has had funky occurrences the last two Homestead trips, blowing an engine last year and missing his pit box while leading in 2022, yet he still has four top-five finishes in the last seven Homestead races. ', '15 of 16', 'James Gilbert | Getty Images', 'FEATURED MATCHUP:', 'Denny Hamlin vs. Chase Elliott\n\nHamlin leads the way with three victories at Homestead, most of all active drivers. Elliott has been consistently in the back half of the top 10 at Homestead, pacing the field for just 31 laps across eight starts. Both drivers need big days on Sunday, but Hamlin seems to be a gimme this weekend.', '16 of 16', 'Sean Gardner | Getty Images', 'MY LINEUP: Kyle Larson, Tyler Reddick, William Byron, Christopher Bell, Denny Hamlin\n\nGARAGE: Martin Truex Jr.', 'FACEBOOK', 'X', 'INSTAGRAM', 'SNAPCHAT', 'TIKTOK', 'YOUTUBE', 'DISCORD', 'NASCAR® and its marks are trademarks of the National Association for Stock Car Auto Racing, LLC. All other trademarks are the property of their respective owners.', 'Copyright © 2024 NASCAR Digital Media, LLC. All rights reserved.', '', '', '', '', '', '', '']"
NASCAR: Cup Practice & Qualifying,https://www.mdjonline.com/fieldlevel/nascar-cup-practice-qualifying/image_d17c8496-ef5e-5ee1-ab8a-deceacf83174.html,"['', '', '', 'Oct 26, 2024; Homestead, Florida, USA; NASCAR Cup Series owner Joe Gibbs walks down the pit lane during practice for the Straight Talk Wireless 400 at Homestead-Miami Speedway. Mandatory Credit: Jasen Vinlove-Imagn Images', 'Please purchase a subscription to read our premium content. If you have a subscription, please log in or sign up for an account on our website to continue.', '', '', '', '', '', '', '', '', '', '', '', '', '', '', '', '', '', 'Learn more about your privacy options', '', '', '']"
Rick Hendrick’s HMS star Kyle Larson has his priorities straight for the Homestead Miami race,https://www.sportskeeda.com/nascar/news-rick-hendrick-s-hms-star-kyle-larson-priorities-straight-homestead-miami-race,"['Kyle Larson is focused on earning his spot in the Championship 4 as NASCAR heads to Homestead-Miami Speedway this weekend.', 'The Henrick Motorsports driver is currently 35 points above the playoff cutline, sitting in second place overall. He has more wins (six) than any other driver this season and an average finish of 14. Larson is hoping to keep it steady and finish strong.', 'The next race in the Round of 8 is the Straight Talk Wireless 400 in Florida this Sunday, October 27.', 'Larson has a good track record at Homestead-Miami. The 32-year-old last won the playoff race at the 1.5-mile (2.414-kilometer) oval track in 2022. He averages a 13th-place finish in over 10 starts and leads all active drivers with 625 laps led at the track.', 'Last year, Larson led the most laps (96) in the playoff race at Homestead and won the first stage. However, he ended up finishing 34th due to an accident while entering the pit road.', 'The qualifying order for the eight playoff drivers is now split into two groups of four. They will qualify at the end. The top five in each group advance to the second round. A rule change implemented in June means the second-fastest driver is no longer guaranteed a front-row start. A driver with the sixth-fastest time could potentially secure a front-row position.', 'Up till now, only Joey Logano has earned a spot in the Championship 4, courtesy of his win last weekend at Las Vegas.', 'Tony Stewart recently talked about Kyle Larson\'s performance in different racing formats. Back in August, the No. 5 Chevrolet driver had said that he is ""better than him (Max Verstappen) as an all-around driver.""', 'In the latest episode of Kevin Harvick’s Happy Hour podcast, Stewart complimented Larson and said that he, like some other drivers can quickly adapt to any race car.', '', 'Harvick added that F1 driver Max Verstappen could do well in NASCAR too.', 'Quick Links', '']"
NASCAR Homestead-Miami Cup playoff starting lineup 2024: Tyler Reddick rebounds for pole,https://www.nbcsports.com/nascar/news/nascar-homestead-miami-cup-playoff-starting-lineup-2024-tyler-reddick-rebounds-for-pole,"['Rebounding from a disappointing Round of 8 opener, Tyler Reddick captured his third pole position of the season for Sunday’s NASCAR Cup Series race at Homestead-Miami Speedway.', 'The 23XI Racing driver, whose No. 45 Toyota flipped in a 35th-place finish Oct. 20 at Las Vegas Motor Speedway, qualified first ahead of fellow playoff drivers Kyle Larson, Christopher Bell and Denny Hamlin.', 'Those four championship-eligible drivers will start in the first two rows, and Reddick’s 32.248-second lap around the 1.5-mile oval was the fastest.', '“It’s a huge deal for us,” Reddick told NBC Sports’ Dave Burns after the ninth pole of his career in NASCAR’s premier series. “This Camry was really, really fast. It was nice to be able to capitalize on qualifying.', 'RESULTS: Click here for qualifying speeds at Homestead-Miami Speedway', 'STARTING LINEUP: By row l By car number', '“All things considered how last week ended, we’re picking up right where we left off. This is my kind of place, and we know what we need to do (Sunday).”', 'Reddick has three top fives in four Cup starts at Homestead with a best finish of third. He won the 2018 and ’19 Xfinity championships by winning the season finale at the track.', 'Playoff driver Chase Elliott (seventh) also made the final round in qualifying.', 'Title contenders Ryan Blaney (20th), William Byron (25th) and Joey Logano (26th) qualified outside the top 10.', 'Logano is the only driver locked into the Championship 4 finale after his victory at Las Vegas. Entering Homestead, the three drivers above the cutline are Christopher Bell (plus-42 points), Kyle Larson (plus-35) and William Byron (plus-27).', 'Below the cutline are Hamlin (minus-27), Reddick (minus-30), Blaney (minus-47) and Elliott (minus-53).', 'The next two races at Homestead-Miami Speedway and Martinsville Speedway will lock in the other three title-eligible spots in the Championship 4 field of the Nov. 10 season finale at Phoenix Raceway.', 'Here’s the NASCAR Cup Series starting lineup for Sunday at Homestead-Miami Speedway:', 'ROW 1', '1. Tyler Reddick, No. 45 Toyota, 32.248 seconds, 167.452 mph\n2. Kyle Larson, No. 5 Chevrolet, 32.325, 167.053', 'ROW 2', '3. Christopher Bell, No. 20 Toyota, 32.369, 166.826\n4. Denny Hamlin, No. 11 Toyota, 32.428, 166.523', 'ROW 3', '5. Ricky Stenhouse Jr., No. 47 Chevrolet, 32.599, 165.649\n6. Martin Truex Jr., No. 19 Toyota, 32.469, 166.312', 'ROW 4', '7. Chase Elliott, No. 9 Chevrolet, 32.693, 165.173\n8. Bubba Wallace, No. 23 Toyota, 32.505, 166.128', 'ROW 5', '9. Daniel Hemric, No. 31 Chevrolet, 33.059, 163.344\n10. Justin Haley, No. 7 Chevrolet, 32.596, 165.664', 'ROW 6', '11. Alex Bowman, No. 48 Chevrolet, 32.441, 166.456\n12. Josh Berry, No. 4 Ford, 32.383, 166.754', 'ROW 7', '13. Chase Briscoe, No. 14 Ford, 32.480 166.256\n14. Ty Gibbs, No. 54 Toyota, 32.393, 166.703', 'ROW 8', '15. Carson Hocevar, No. 77 Chevrolet, 32.518, 166.062\n16. Noah Gragson, No. 10 Ford, 32.418, 166.574', 'ROW 9', '17. Kyle Busch, No. 8 Chevrolet, 32.530, 166.001\n18. Brad Keselowski, No. 6 Ford, 32.465, 166.333', 'ROW 10', '19. Zane Smith, No. 71 Chevrolet, 32.537, 165.965\n20. Ryan Blaney, No. 12 Ford, 32.477, 166.272', 'ROW 11', '21. Chris Buescher, No. 17 Ford, 32.544, 165.929\n22. Ross Chastain, No. 1 Chevrolet, 32.507, 166.118', 'ROW 12', '23. Daniel Suarez, No. 99 Chevrolet, 32.554, 165.878\n24. Michael McDowell, No. 34 Ford, 32.510, 166.103', 'ROW 13', '25. William Byron, No. 24 Chevrolet, 32.581, 165.741\n26. Joey Logano, No. 22 Ford, 32.562, 165.837', 'ROW 14', '27. Kaz Grala, No. 15 Ford, 32.644, 165.421\n28. Erik Jones, No. 43 Toyota, 32.577, 165.761', 'ROW 15', '29. John Hunter Nemechek, No. 42 Toyota, 32.652, 165.380\n30. Austin Dillon, No. 3 Chevrolet, 32.597, 165.659', 'ROW 16', '31. Todd Gilliland, No. 38 Ford, 32.703, 165.122\n32. AJ Allmendinger, No. 16 Chevrolet, 32.637, 165.456', 'ROW 17', '33. Corey LaJoie, No. 51 Ford, 32.801, 164.629\n34. Harrison Burton, No. 21 Ford, 32.653, 165.375', 'ROW 18', '35. Ryan Preece, No. 41 Ford, 32.844, 164.414\n36. Austin Cindric, No. 2 Ford, 32.810, 164.584', 'ROW 19', '37. JJ Yeley, No. 44 Chevrolet, 33.063, 163.325\n38. Chad Finchum, No. 66 Ford, 33.794, 159.792', 'A Division of NBCUniversal.', 'DISCLAIMER: This site and the products offered are for entertainment purposes only, and there is no gambling offered on this site. This service is intended for adult audiences. No guarantees are made for any specific outcome. If you or someone you know has a gambling problem, please call 1-800-GAMBLER.', 'Ⓒ 2024 NBC Universal']"
NASCAR Cup Series playoffs continue from Homestead-Miami Speedway Sunday on NBC,https://www.jayski.com/2024/10/25/nascar-cup-series-playoffs-continue-from-homestead-miami-speedway-sunday-on-nbc/,"['The NASCAR Cup Series Playoffs continue with NBC Sports’ presentation of the Straight Talk Wireless 400 live from Homestead-Miami Speedway in Homestead, Fla., this Sunday, Oct. 27, at 2:30 p.m. ET on NBC. A 30-minute Countdown to Green Sunday at 2 p.m. ET on NBC leads into live race coverage. Homestead-Miami is the fourth of six consecutive Cup Series playoff races to be presented live on NBC, culminating in the Cup Series Championship on Nov. 10.', 'Joey Logano fended off Christoper Bell to take the win at last week’s race in Las Vegas, clinching a Championship 4 berth at the Cup Series Championship race in Phoenix on Nov. 10. Since the NASCAR Cup Series implemented its multi-round playoff format in 2014, Logano has advanced to the final four in every even-numbered year (2014, 2016, 2018, 2020, 2022 and 2024). Outside of Logano and Bell, only two other playoff drivers finished in the top 10 – William Byron in fourth and Denny Hamlin in eighth.', 'Bell is the defending Straight Talk Wireless 400 champion, while Kyle Larson, Byron, Hamlin, and Logano have all also won at Miami-Homestead in their careers.', 'Larson and Byron currently sit in the final two playoff spots heading into the second Round of 8 playoff race.', 'Coverage from Miami-Homestead begins this Friday with Xfinity Series qualifying at 4 p.m. ET followed by Cup Series qualifying Saturday at 9 a.m. ET, with both windows on NBCSports.com and the NBC Sports app.', '21-time Cup Series race winner and “The Mayor” of NASCAR Jeff Burton and Daytona 500-winning crew chief Steve Letarte will serve as analysts this weekend from Homestead-Miami with Leigh Diffey serving as play-by-play. Marty Snider, Kim Coon, and Dave Burns will serve as pit reporters.', 'Snider will host pre-race coverage alongside Letarte and NASCAR Hall of Famer Dale Jarrett.', 'BROADCAST TEAM', 'STUDIO COVERAGE TEAM', 'HOW TO WATCH', '— NBC Sports —', 'Birthdays\nDale Earnhardt Tribute\nDriver Appearances\nEmail Newsletter\nGoodyear News\nInspection penalty protocol\nNASCAR Charters\nNASCAR Contests\nNASCAR Diversity\nNASCAR Hall of Fame\nNASCAR Next Gen Car\nNMPA Most Popular Driver\nPoints Explanation\nQualifying procedures\nTV Listings', '', 'Born on date 8/26/1996; Jayski.com is part of the NASCAR Digital Media Network', '', '', '', '', '', '', '']"
