Title,Link,Paragraphs
DraftKings NASCAR DFS Picks for Homestead: Fantasy NASCAR Strategy and Picks for the Straight Talk Wireless 400,https://www.fantasylabs.com/articles/draftkings-nascar-dfs-picks-for-homestead-fantasy-nascar-strategy-and-picks-for-the-straight-talk-wireless-400/,"['', '', '', '', '', '', '', '', '', '', '', '', '', '', '', '', '', '', '', '', '', '', '', '', '', '', '', '', '', '', '', 'NASCAR heads to Homestead-Miami Speedway for the third-to-last race of the 2024 season.', 'Homestead is a 1.5-mile track with steep, variable banking. Its old surface age means it’s abrasive on the tires and causes plenty of tire wear, much like Darlington, which is Homestead’s best comparable track.', 'Much like Darlington, being able to analyze long-run speed in practice is key to a successful DFS day.', 'Before we jump into my picks, don’t forget all my NASCAR projections can be found in the NASCAR Models on FantasyLabs, complete with floor, ceiling, median, and ownership projections.', 'Let’s not skip the best part — my Perfect% metric — a metric that tells you how often certain racers appear in the optimal lineup when running 10,000 race simulations.', 'And don’t forget about the tools that FantasyLabs has to offer, like our Lineup Optimizer to effortlessly create up to 300 lineups, or our Lineup Builder if you like to hand-build your lineups.', 'Here are my NASCAR DFS picks for the Straight Talk Wireless 400 at Homestead-Miami Speedway.', 'Homestead DraftKings DFS Cash Game Picks', 'Kyle Larson ($11,000): Larson has led 40% of all laps he’s run for Hendrick Motorsports at Homestead. He starts second. Don’t overthink this.', 'Ross Chastain ($8800): Chastain is in a great spot in all formats, as there are several big-name drivers that will draw usage in both tournaments and cash games that could cause Ross to go overlooked.', 'However, these steep, slick tracks are right up Chastain’s alley, and while he’s yet to lead a lap, he does have a second-place finish here on his resume.', 'Noah Gragson ($7400): I know Gragson starts a bit farther forward than we’d ordinarily like for cash games, but that just makes me like him even more in that format.', 'Barring a problem, Gragson is almost surely going to have a top-10 car after topping the field in practice on every long-run metric from 10 to 30 laps — the maximum average NASCAR scores in practice.', 'If we can get a driver and car combination with some of the best speed at both a price and usage discount because people are worried about place differential, we should get after it.', 'Gragson will likely be overrostered in tournament formats, so considering an underweight angle on him in tournaments given his youth and middling equipment isn’t a bad idea.', 'Austin Cindric ($7000): Cindric starts 36th, meaning aside from the two trash cars of J.J. Yeley and Chad Finchum that start behind him, his only avenue is forward.', 'Homestead has been a great track for Cindric, with finishes of 19th and 12 in his two Cup starts. That comes in addition to his two most recent Xfinity Series races here, where he led the most laps in one and finshed second in the other.', 'He may not have the best short-run speed, but I noticed all the Team Penske Fords improved relative to the field on the long run in practice.', 'Homestead DraftKings DFS Tournament Strategy and Picks', 'Denny Hamlin ($9800): Hamlin has dipped below the $10k price range, so it’s probably time to buy in. Should Larson falter, Hamlin is right in a group with Toyota teammates Christopher Bell and Tyler Reddick for the next-most likely driver to dominate and win.', 'Those other two will come with a cost and ownership premium, so I’ll buy the discount on Hamlin. He also comes with the added upside of going for the win, since racing his way in on points seems unlikely, which gives him (and Reddick) an advantage over Bell when it comes to having the ability to go on an alternate strategy since they likely need to win to advance.', 'In lineups with Larson, you’ll want to negatively correlate Hamlin with Reddick and Bell (especially Reddick) since they’ll pull secondary dominator points from each other. However, if Larson has a problem, then there’s room for more than one of these drivers to dominate.', 'Brad Keselowski ($8800): If we’re thinking about a potential late-race caution that could cause some chaos, look no further than Brad Keselowski.', 'Kez set the fastest five-lap average in practice, so in a chaos-type lineup, you’ll want to add some extra Keselowski in.', 'Other drivers that may pair well with him in a chaos line include William Byron, Bubba Wallace, and Zane Smith, who all displayed short-run speed and are projected to be in fewer lineups than optimal.', 'John H. Nemechek ($6000): JHN is a pivot off his teammate Erik Jones, who figures to be more highly rostered thanks to his better name recognition.', 'But my model has these two drivers pretty equal here, and Nemechek has actually picked up more top-10 finishes than his teammate including Vegas just last week — which is a secondary comp to Homestead — as well as Kansas and the first Bristol race that also required tire management.', '']"
How to watch Sunday’s NASCAR Cup playoff race at Homestead-Miami Speedway,https://www.nbcsports.com/nascar/news/how-to-watch-sundays-nascar-cup-playoff-race-at-homestead-miami-speedway,"['HOMESTEAD, Fla. — The Round of 8 continues for the Cup Series this weekend at Homestead-Miami Speedway.', 'Joey Logano secured a spot in the Championship 4 with his victory last weekend at Las Vegas, leaving seven drivers to vie for the final three spots.', 'Christopher Bell (+42 points), Kyle Larson (+35) and William Byron (+27) all hold a transfer spot entering Sunday’s middle race in the Round of 8.', 'Those below the cutline are Denny Hamlin (-27 points), Tyler Reddick (-30), Ryan Blaney (-47) and Chase Elliott (-53).', '', '', '', '', '', '', 'START: The command to start engines will be given at 2:25 p.m. … The green flag is scheduled to wave at 2:35 p.m.', 'PRE-RACE: Garage opens at 11:30 a.m. … Drivers meeting will be at 1:35 p.m. …Driver introductions will be at 1:50 p.m. … The invocation will be given at 2:17 p.m. by Ryan Reed, pastor from Christ Journey Church. … The national anthem will be performed at 2:18 p.m. by Candy Lover.', 'DISTANCE: The race is 267 laps (400.5 miles) on the 1.5-mile track.', 'STAGES: Stage 1 ends at Lap 80. Stage 2 ends at Lap 165.', 'STARTING LINEUP: Cup starting lineup', 'TV/RADIO: NBC will broadcast the race at 2:30 p.m. Coverage begins at 2 p.m. on NBC. … Motor Racing Network coverage begins at 1:30 p.m. … SiriusXM NASCAR Radio will carry the MRN broadcast.', 'FORECAST: The Weather Underground forecast calls for mostly cloudy skies with a high of 81 degrees and 1% chance of rain at the start of the Cup race.', 'LAST TIME: Christopher Bell won last year’s race to reach the Championship 4 for a second consecutive season. Ryan Blaney finished second. Tyler Reddick placed third. Kyle Larson led a race-high 96 laps and won the opening stage but finished 34th after an incident entering pit road.', 'A Division of NBCUniversal.', 'DISCLAIMER: This site and the products offered are for entertainment purposes only, and there is no gambling offered on this site. This service is intended for adult audiences. No guarantees are made for any specific outcome. If you or someone you know has a gambling problem, please call 1-800-GAMBLER.', 'Ⓒ 2024 NBC Universal']"
"NASCAR Homestead full weekend track schedule, TV schedule for the Straight Talk Wireless 400, other races",https://www.tennessean.com/story/sports/nascar/2024/10/25/nascar-homestead-cup-weekend-schedule-tv-info-sunday-race/75812609007/,"['All three NASCAR national series are racing this weekend at Homestead-Miami Speedway with eyes toward the Championship 4 at Phoenix next month.', 'The Craftsman Truck and Xfinity Series practice and qualify on Friday before racing on Saturday.', 'The Straight Talk Wireless 400 NASCAR Cup Series race runs on Sunday at the 1.5-mile track known for running near the wall in the corners.', 'No qualifying or practice sessions will be formally shown on television, with the Xfinity and Cup Series sessions available on the NBC Sports app only.', 'Here is the full on-track schedule in Homestead:', 'All times Central; on-track activity at Homestead-Miami Speedway.', '1:30 p.m. — NASCAR Craftsman Truck Series practice and qualifying, No TV or streaming available', '3:30 p.m. — NASCAR Xfinity Series practice and qualifying, NBC Sports app', '8 a.m. — NASCAR Cup Series practice and qualifying, NBC Sports app', '11 a.m. — Baptist Health 200 NASCAR Craftsman Truck Series race (134 laps, 201 miles), FS1 (Watch FREE on Fubo', '3 p.m. — Credit One NASCAR AMEX Credit Card 300 NASCAR Xfinity Series race (200 laps, 300 miles), CW Network (Watch FREE on Fubo', '1:30 p.m. — Straight Talk Wireless 400 NASCAR Cup Series race (267 laps, 400.5 miles), NBC (Watch FREE on Fubo)', 'LOGANO IN:NASCAR playoff picture: Cup Series points standings after Las Vegas', 'FROM LAST WEEK:NASCAR Las Vegas race winners and losers: Joey Logano holds off Christoper Bell', 'MUNIZ IN THE TRUCK SERIES:Frankie Muniz, ‘Malcolm in the Middle’ actor, earns full-time NASCAR Truck Series ride', 'LAWSUIT:23XI Racing, co-owned by Michael Jordan, and Front Row Motorsports sue NASCAR', 'We occasionally recommend interesting products and services. If you make a purchase by clicking one of the links, we may earn an affiliate fee. USA TODAY Network newsrooms operate independently, and this doesn’t influence our coverage.']"
NASCAR BETTING: 2024 HOMESTEAD-MIAMI PLAYOFF RACE,https://www.nascar.com/gallery/nascar-betting-2024-homestead-miami-playoff-race/,"['', '', '1 of 39', 'Sean Gardner | Getty Images', ""The NASCAR Cup Series Playoffs continue in the Round of 8 at Homestead-Miami Speedway (Sun., 2:30 p.m. ET, NBC, MRN Radio, SiriusXM NASCAR Radio, NBC Sports App).\n\nView the favorites and underdogs for Sunday's race, with odds courtesy of DraftKings and updated on race day.\n\nKeep sports betting fun by betting responsibly. Visit HaveAGamePlan.org to learn more."", '2 of 39', 'Logan Riely | Getty Images', 'Chad Finchum\n\nOpening odds to win 2024 Homestead-Miami playoff race: 1,000-1', '3 of 39', 'James Gilbert | Getty Images', 'J.J. Yeley\n\nOpening odds to win 2024 Homestead-Miami playoff race: 1,000-1', '4 of 39', 'Meg Oliphant | Getty Images', 'Kaz Grala\n\nOpening odds to win 2024 Homestead-Miami playoff race: 1,000-1', '5 of 39', 'James Gilbert | Getty Images', 'Daniel Hemric \n\nOpening odds to win 2024 Homestead-Miami playoff race: 400-1', '6 of 39', 'Meg Oliphant | Getty Images', 'Harrison Burton \n\nOpening odds to win 2024 Homestead-Miami playoff race: 400-1', '7 of 39', 'Sean Gardner | Getty Images', 'Ryan Preece \n\nOpening odds to win 2024 Homestead-Miami playoff race: 300-1', '8 of 39', 'Sean Gardner | Getty Images', 'Todd Gilliland \n\nOpening odds to win 2024 Homestead-Miami playoff race: 300-1', '9 of 39', 'Sean Gardner | Getty Images', 'Corey LaJoie \n\nOpening odds to win 2024 Homestead-Miami playoff race: 250-1', '10 of 39', 'James Gilbert | Getty Images', 'Michael McDowell \n\nOpening odds to win 2024 Homestead-Miami playoff race: 250-1', '11 of 39', 'Chris Graythen | Getty Images', 'John Hunter Nemechek \n\nOpening odds to win 2024 Homestead-Miami playoff race: 200-1', '12 of 39', 'James Gilbert | Getty Images', 'Justin Haley \n\nOpening odds to win 2024 Homestead-Miami playoff race: 200-1', '13 of 39', 'James Gilbert | Getty Images', 'Ricky Stenhouse Jr. \n\nOpening odds to win 2024 Homestead-Miami playoff race: 200-1', '14 of 39', 'James Gilbert | Getty Images', 'Zane Smith \n\nOpening odds to win 2024 Homestead-Miami playoff race: 200-1', '15 of 39', 'Meg Oliphant | Getty Images', 'Erik Jones \n\nOpening odds to win 2024 Homestead-Miami playoff race: 170-1', '16 of 39', 'James Gilbert | Getty Images', 'Carson Hocevar \n\nOpening odds to win 2024 Homestead-Miami playoff race: 110-1', '17 of 39', 'Sean Gardner | Getty Images', 'Austin Dillon \n\nOpening odds to win 2024 Homestead-Miami playoff race: 100-1', '18 of 39', 'Jonathan Bachman | Getty Images', 'Josh Berry \n\nOpening odds to win 2024 Homestead-Miami playoff race: 100-1', '19 of 39', 'Meg Oliphant | Getty Images', 'Noah Gragson \n\nOpening odds to win 2024 Homestead-Miami playoff race: 100-1', '20 of 39', 'Meg Oliphant | Getty Images', 'Austin Cindric \n\nOpening odds to win 2024 Homestead-Miami playoff race: 90-1', '21 of 39', 'James Gilbert | Getty Images', 'Daniel Suárez \n\nOpening odds to win 2024 Homestead-Miami playoff race: 60-1', '22 of 39', 'Sean Gardner | Getty Images', 'Chase Briscoe \n\nOpening odds to win 2024 Homestead-Miami playoff race: 55-1', '23 of 39', 'James Gilbert | Getty Images', 'AJ Allmendinger\n\nOpening odds to win 2024 Homestead-Miami playoff race: 45-1', '24 of 39', 'Sean Gardner | Getty Images', 'Chris Buescher \n\nOpening odds to win 2024 Homestead-Miami playoff race: 40-1', '25 of 39', 'Chris Graythen | Getty Images', 'Alex Bowman \n\nOpening odds to win 2024 Homestead-Miami playoff race: 35-1', '26 of 39', 'Jonathan Bachman | Getty Images', 'Bubba Wallace \n\nOpening odds to win 2024 Homestead-Miami playoff race: 28-1', '27 of 39', 'Sean Gardner | Getty Images', 'Brad Keselowski \n\nOpening odds to win 2024 Homestead-Miami playoff race: 22-1', '28 of 39', 'Sean Gardner | Getty Images', 'Ty Gibbs \n\nOpening odds to win 2024 Homestead-Miami playoff race: 22-1', '29 of 39', 'Sean Gardner | Getty Images', 'Kyle Busch \n\nOpening odds to win 2024 Homestead-Miami playoff race: 18-1', '30 of 39', 'Meg Oliphant | Getty Images', 'Joey Logano \n\nOpening odds to win 2024 Homestead-Miami playoff race: 17-1', '31 of 39', 'Sean Gardner | Getty Images', 'Ross Chastain \n\nOpening odds to win 2024 Homestead-Miami playoff race: 17-1', '32 of 39', 'Meg Oliphant | Getty Images', 'Martin Truex Jr. \n\nOpening odds to win 2024 Homestead-Miami playoff race: 16-1', '33 of 39', 'Sean Gardner | Getty Images', 'Chase Elliott \n\nOpening odds to win 2024 Homestead-Miami playoff race: 14-1', '34 of 39', 'James Gilbert | Getty Images', 'Ryan Blaney \n\nOpening odds to win 2024 Homestead-Miami playoff race: 12-1', '35 of 39', 'Meg Oliphant | Getty Images', 'Denny Hamlin \n\nOpening odds to win 2024 Homestead-Miami playoff race: 10-1', '36 of 39', 'James Gilbert | Getty Images', 'William Byron \n\nOpening odds to win 2024 Homestead-Miami playoff race: 7-1', '37 of 39', 'Jared C. Tilton | Getty Images', 'Christopher Bell \n\nOpening odds to win 2024 Homestead-Miami playoff race: 6-1', '38 of 39', 'Sean Gardner | Getty Images', 'Tyler Reddick \n\nOpening odds to win 2024 Homestead-Miami playoff race: 6-1', '39 of 39', 'Sean Gardner | Getty Images', 'Kyle Larson \n\nOpening odds to win 2024 Homestead-Miami playoff race: 33-10', 'FACEBOOK', 'X', 'INSTAGRAM', 'SNAPCHAT', 'TIKTOK', 'YOUTUBE', 'DISCORD', 'NASCAR® and its marks are trademarks of the National Association for Stock Car Auto Racing, LLC. All other trademarks are the property of their respective owners.', 'Copyright © 2024 NASCAR Digital Media, LLC. All rights reserved.', '', '', '', '', '', '', '']"
Clinching scenarios for the Cup Series at Homestead-Miami Speedway,https://www.nascar.com/news-media/2024/10/24/clinching-scenarios-for-the-cup-series-at-homestead-miami-speedway/,"['', '', '', 'NASCAR CUP SERIES PLAYOFFS', 'By Staff Report', '', 'NASCAR.com', 'Published: 3 days ago', '2 Minute Read', '', '', 'Sunday’s Straight Talk Wireless 400 at Homestead-Miami Speedway (2:30 p.m. ET, NBC, MRN Radio, SiriusXM NASCAR Radio, NBC Sports App) will be the second of three Round of 8 races in the NASCAR Cup Series Playoffs, and for seven title hopefuls, a chance to clinch one of three remaining Championship 4 bids at Phoenix Raceway. After Joey Logano’s Championship 4-clinching victory at Las Vegas Motor Speedway last weekend, Homestead-Miami will be the next battleground for those vying to lock in a berth.', 'Below are this weekend’s clinching scenarios.', 'RELATED: Playoff standings | Homestead-Miami weekend schedule', 'Already Clinched', 'The following driver has clinched a spot in the four-driver field of the next round: Joey Logano.', 'Can Clinch Via Points', 'If there is a repeat winner or a win by a driver who cannot advance to the next round, the following drivers could clinch by being 56 points above the 3rd winless driver in the standings. The same point requirements listed below would hold true if a new win comes from among Christopher Bell or Kyle Larson.', 'Can Clinch Via Win', 'The following drivers would clinch on their win alone: Christopher Bell, Kyle Larson, William Byron, Denny Hamlin, Tyler Reddick, Ryan Blaney, Chase Elliott.', 'FACEBOOK', 'X', 'INSTAGRAM', 'SNAPCHAT', 'TIKTOK', 'YOUTUBE', 'DISCORD', 'NASCAR® and its marks are trademarks of the National Association for Stock Car Auto Racing, LLC. All other trademarks are the property of their respective owners.', 'Copyright © 2024 NASCAR Digital Media, LLC. All rights reserved.', '', '', '', '', '', '', '']"
Tyler Reddick edges Kyle Larson for NASCAR Cup pole at Homestead,https://www.espn.com/racing/nascar/story/_/id/42021263/tyler-reddick-edges-kyle-larson-nascar-cup-pole-homestead,"['', ""HOMESTEAD, Fla. -- Regular-season champion Tyler Reddick won the pole Saturday for the second race of the third round of NASCAR's playoffs Sunday."", 'Reddick turned a 167.452 mph lap in a Toyota Camry for 23XI Racing to best Hendricks Motorsports driver Kyle Larson by 0.077 seconds and take the top starting spot Sunday at Homestead-Miami Speedway.', 'Reddick is one of seven drivers vying for the remaining three spots in the Cup Series championship finale at Phoenix. Joey Logano of Team Penske became the first driver locked into the championship when he won at Las Vegas last week.', ""It is Reddick's third pole of 2024 in the No. 45 Camry."", ""Christopher Bell of Joe Gibbs Racing, who won the race at Homestead last year, qualified third in the No. 20 Camry. Bell's Gibbs teammate Denny Hamlin was next in the No. 11 Camry."", 'Qualifying positions for the remaining playoff drivers were Chase Elliott in seventh, reigning Cup champion Ryan Blaney in 20th and William Byron in 25th.', '', '', '']"
