Title,Link,Paragraphs
"NASCAR Cup Series at Homestead: Starting lineup, TV schedule for Sunday's race",https://www.tennessean.com/story/sports/nascar/2024/10/26/nascar-homestead-starting-lineup-tv-schedule-race-cup-series-straight-talk-wireless-400/75860143007/,"[""The lineup is set for Sunday's NASCAR Cup Series Playoffs race at Homestead-Miami Speedway."", ""Tyler Reddick is on pole for the Straight Talk Wireless 400. This is Reddick's third pole this year and first at Homestead. Five playoff drivers qualified in the top 10 for Sunday's race, including sweeping the first two rows."", ""Here's the full starting lineup and TV information for Sunday's NASCAR race in Homestead."", 'EXPERT PICKS:NASCAR Homestead predictions 2024: Expert picks for Cup Series race', 'Green Flag Time:  Approx. 1:30 p.m. CT on Sunday, Oct. 27', 'Track:  Homestead-Miami Speedway (1.5-mile oval) in Homestead, Florida', 'Length:  267 laps, 400.5 miles', 'Stages:  80 laps, 85 laps, 102 laps', 'TV coverage:  NBC', 'Radio:  MRN', 'Streaming: FUBO (free trial available); NBC Sports app (subscription required); NASCAR.com and SiriusXM on Channel 90 for audio (subscription required)', 'The Straight Talk Wireless 400 will be broadcast nationally on NBC. Streaming options for the race include the NBC Sports app and FUBO, which offers a free trial to potential subscribers.', 'THE GREAT AMERICAN BOOK: Celebrate a fast-paced history of the Daytona 500 with new book; foreword by Richard Petty', 'Row 1', '1. Tyler Reddick, No. 45 23XI Racing Toyota', '2. Kyle Larson, No. 5 Hendrick Motorsports Chevrolet', 'Row 2', '3. Christopher Bell, No. 20 Joe Gibbs Racing Toyota', '4. Denny Hamlin, No. 11 Joe Gibbs Racing Toyota', 'Row 3', '5. Ricky Stenhouse Jr., No. 47 JTG Daugherty Racing Chevrolet', '6. Martin Truex Jr., No. 19 Joe Gibbs Racing Toyota', 'Row 4', '7. Chase Elliott, No. 9 Hendrick Motorsports Chevrolet', '8. Bubba Wallace, No. 23 23XI Racing Toyota', 'Row 5', '9. Daniel Hemric, No. 31 Kaulig Racing Chevrolet', '10. Justin Haley, No. 7 Spire Motorsports Chevrolet', 'Row 6', '11. Alex Bowman, No. 48 Hendrick Motorsports Chevrolet', '12. Josh Berry, No. 4 Stewart-Haas Racing Ford', 'Row 7', '13. Chase Briscoe, No. 14 Stewart-Haas Racing Ford', '14. Ty Gibbs, No. 54 Joe Gibbs Racing Toyota', 'Row 8', '15. Carson Hocevar, No. 77 Spire Motorsports Chevrolet', '16. Noah Gragson, No. 10 Stewart-Haas Racing Ford', 'Row 9', '17. Kyle Busch, No. 8 Richard Childress Racing Chevrolet', '18. Brad Keselowski, No. 6 Roush Fenway Keselowski Racing Ford', 'Row 10', '19. Zane Smith, No. 71 Spire Motorsports Chevrolet', '20. Ryan Blaney, No. 12 Team Penske Ford', 'Row 11', '21. Chris Buescher, No. 17 Roush Fenway Keselowski Racing Ford', '22. Ross Chastain, No. 1 Trackhouse Racing Chevrolet', 'Row 12', '23. Daniel Suarez, No. 99 Trackhouse Racing Chevrolet', '24. Michael McDowell, No. 34 Front Row Motorsports Ford ', 'Row 13', '25. William Byron, No. 24 Hendrick Motorsports Chevrolet', '26. Joey Logano, No. 22 Team Penske Ford', 'Row 14', '27. Kaz Grala, No. 15 Rick Ware Racing Chevrolet', '28. Erik Jones, No. 43 Legacy Motor Club Toyota', 'Row 15', '29. John Hunter Nemechek, No. 42 Legacy Motor Club Toyota', '30. Austin Dillon, No. 3 Richard Childress Racing Chevrolet', 'Row 16', '31. Todd Gilliland, No. 38 Front Row Motorsports Ford ', '32. AJ Allmendinger, No. 16 Kaulig Racing Chevrolet', 'Row 17', '33. Corey Lajoie, No. 51 Rick Ware Racing Chevrolet', '34. Harrison Burton, No. 21 Wood Brothers Racing Ford', 'Row 18', '35. Ryan Preece, No. 41 Stewart-Haas Racing Ford', '36. Austin Cindric, No. 2 Team Penske Ford', 'Row 19', '37. JJ Yeley, No. 44 NY Racing Team Chevrolet', '38. Chad Finchum, No. 66 Power Source Ford', 'We occasionally recommend interesting products and services. If you make a purchase by clicking one of the links, we may earn an affiliate fee. USA TODAY Network newsrooms operate independently, and this doesn’t influence our coverage.']"
"Weekend schedule, broadcast info at 2024 Homestead for Cup, Xfinity, Trucks",https://www.nbcsports.com/nascar/news/weekend-schedule-broadcast-info-at-2024-homestead-for-cup-xfinity-trucks,"['The middle race in the Round of 8 for the NASCAR Cup, Xfinity and Truck Series will be held this weekend at Homestead-Miami Speedway.', 'Saturday will feature a Truck/Xfinity doubleheader. The Cup race is Sunday on NBC.', 'Joey Logano has secured a spot in the Cup championship race. AJ Allmendinger has advanced to the Xfinity title race. Grant Enfinger is set in the Truck title race.', '', '', '', '', '', '', '', 'Friday: Partly cloudy skies with high in the low 80s and a 15% chance of rain in the afternoon.', '', '', '', 'Saturday: Mostly cloudy skies with a high of 76 degrees and an 8% chance of rain at the start of Cup qualifying. Cloudy skies with a high of 83 degrees and a 15% chance of rain at the start of the Truck race. Cloudy skies with a high of 82 degrees and a 15% chance of rain at the start of the Xfinity race.', '', '', '', 'Sunday: Cloudy with a high of 81 degrees and no chance of rain at the start of the Cup race.', '', '', '', '', '', '', '', '', '', '', '', '', '', '', 'Garage open', '', '', '', 'Track activity', '', '', '', '', '', '', '', '', '', '', 'Garage open', '', '', '', 'Track activity', '', '', '', '', '', '', '', '', '', '', '', '', '', 'Garage open', '', '', '', 'Track activity', '', '', 'A Division of NBCUniversal.', 'DISCLAIMER: This site and the products offered are for entertainment purposes only, and there is no gambling offered on this site. This service is intended for adult audiences. No guarantees are made for any specific outcome. If you or someone you know has a gambling problem, please call 1-800-GAMBLER.', 'Ⓒ 2024 NBC Universal', '', '', '', '', '', '', '', '']"
NASCAR Miami Odds: Who’s the Favorite in South Beach for the Straight Talk Wireless 400?,https://www.bleachernation.com/betting/2024/10/26/nascar-miami-odds-bets/,"['Some links on this page are affiliate links, meaning we may earn a commission if you click and buy. This helps keep the great content coming! We only recommend products we believe in.', 'The NASCAR Cup Series Playoffs continue from Homestead-Miami where “wall ripping” is the fastest way around and tire preservation is key. So before they take the green flag for the Round of 8’s penultimate race, let’s take a look at the post-qualifying NASCAR Miami odds and who the books think will be partying on South Beach afterward.', 'Homestead-Miami Speedway is a 1.5-mile long track and is possibly the most unique among the track type. Not only does the track eat tires alive, at a much faster rate than all other similar tracks, but its preferred line on the wall, is closer to what we see at Darlington than any other 1.5-mile track. This makes practice here very important as teams test their race pace and if their car is able to rip the wall like the best at that skill.', 'Watch the Straight Talk Wireless 400 from Homestead-Miami Speedway on Sunday, October 27th starting at 2:30 PM ET on NBC. Subscribe to fuboTV or check your current cable/satellite TV subscriber to catch the action.', 'Topping the group of drivers who stand out here are Kyle Larson and Tyler Reddick who are known for their ability to wall ride. Reddick had the fastest single-lap speed and kept the pace up finishing top-4 in every 10-lap or more average in his session. Larson meanwhile, was good, not great during Group B’s 20 minutes, but he’ll be fine come race day. The big surprise of practice was Noah Gragson, who topped the charts from 10-lap to 30-lap averages despite posting just the 11th fastest single-lap speed. ', 'Qualifying saw many of the fast cars in practice impressing with the two pre-qualifying favorites on the front row. Grabbing the Straight Talk Wireless 400 pole by almost a full tenth over Kyle Larson was Tyler Reddick with a 32.248-second lap. He’ll have the ever-important no.1 pit stall for the 23XI driver’s must-win race.', 'Joining the two favorites near the front are JGR teammates, and fellow NASCAR Playoffs drivers Christopher Bell and Denny Hamlin on row 2. Qualifying wasn’t without its surprises, as Ricky Stenhouse Jr and Daniel Hemric grabbed their 2nd, with Justin Haley his first, starting spot inside the top 10 this year. The practice and qualifying sessions had a decent impact on the NASCAR Miami odds so let’s take a look at the updated outright numbers.   ', 'Much like last week with my South Point 400 bets, I already have exposure to some of the best cars at better prices than currently available. This makes finding value with the post-qualifying NASCAR Miami odds difficult but we only have three races left and scared money doesn’t win money. So I’ve shopped the board and found my favorite current Straight Talk Wireless 400 markets to hit.', 'I bet this before cars hit the track for practice and qualifying at +400 and despite what I saw in practice, I’m doubling down. Yes, Noah Gragson and Chase Briscoe were awesome in practice, and they along with A.J. Allmendinger have nice histories in South Beach themselves. But Dillon’s resume and affinity for Homestead-Miami speak for themself.', 'AD3 has run 10 Cup Series races in Miami and his only finish worse than 14th came in his first race in NASCAR’s top level. Dillon is also no stranger to starting back in the pack here, and still having success. He finished 4th after starting 32nd in 2022 and has an average finish of 8.7 in the seven races he’s started 16th or worse since 2016.', 'Austin clearly has a TON of ground to make up here, and this could simply be dead as the green flag drops. However, if we believe some drivers are made for certain tracks, and tracks for drivers, this definitely fits the mold. At 10-1, with his history, and voiced love of the track, I’m more than happy to play a tiny bit on this.', '*21+ and Gambling problem? Call 1-800-GAMBLER. Responsible Gaming Resources', 'WRITTEN BY', ""Brian is just a regular guy whose first passion was sports. He's either been playing, watching, now working in, and recreationally betting on sports for over 30 years. His favorite sports to bet are Football (NFL/NCAAF), College Basketball, and the NASCAR Cup Series. In addition to being a content contributor here at Bleacher Nation, Brian co-hosts the Angle of Pursuit Nascar Betting Podcast , & is also the FantasyLifeApp breaking news moderator/manager."", '', '', '', '', '', '', '', '', '', '', 'Coming off a draw with Villarreal CF, Getafe CF will face Valencia CF, who just lost to UD Las Palmas, on Sunday. For our prediction on this matchup, continue reading.Getafe CF vs. Valencia CF Prediction & OddsGetafe CF Moneyline: +117Valencia...', 'Inter Milan and Juventus, two currently near top of the table in Serie A, will play at Giuseppe Meazza on Sunday. We provide our prediction for this matchup in the article below.Inter Milan vs. Juventus Prediction & OddsInter Milan Moneyline:...', 'Bayern Munich (second) is currently well above VfL Bochum (18th) in the Bundesliga, but it plays at VfL Bochum on Sunday at 10:30 AM ET. Below, you can find our prediction for this contest.Bayern Munich vs. VfL Bochum Prediction &...', 'AS Monaco and OGC Nice -- both coming off stalemates -- will clash on Sunday in Ligue 1. AS Monaco drew with Lille OSC last time out, 0-0, and Nice against FC Nantes finished 1-1. Below, you can find our...', 'Strasbourg will play at home versus FC Nantes on Sunday, after mixed results in their most recent matches in Ligue 1 -- a loss to Paris Saint-Germain and a draw against OGC Nice, respectively. We provide our prediction for this...', 'Toulouse FC plays at Montpellier HSC in Ligue 1 on Sunday, with Toulouse FC coming off a 1-1 draw against Angers SCO, and Montpellier HSC a 5-0 loss to Olympique Marseille. Find our prediction for this matchup below.Toulouse FC vs....', 'Union Berlin will play at home versus Eintracht Frankfurt on Sunday, after mixed results in their most recent matches in the Bundesliga -- a win over Holstein Kiel and a loss to Bayer Leverkusen, respectively. We provide our prediction for...', ""There's a top-four clash in the Premier League on Sunday, with fourth-place Arsenal FC taking on second-place Liverpool FC. Below, you can find our prediction for this contest.Arsenal FC vs. Liverpool FC Prediction & OddsArsenal FC Moneyline: +142Liverpool FC Moneyline:..."", 'The Tulane Green Wave hit the road for an AAC battle versus the Memphis Tigers on Thursday, November 28, 2024 at Yulman Stadium.Looking to attend this game live? College football tickets are available on Vivid Seats.Tulane vs. Memphis Tickets &...', 'The Sam Houston Bearkats hit the road for a CUSA clash versus the Liberty Flames on Friday, November 29, 2024 at Elliott T. Bowers Stadium.Looking to attend this game live? College football tickets are available on Vivid Seats.Sam Houston vs....', 'In addition to news, Bleacher Nation publishes both rumor and opinion, as well as information reported by other sources. Information on Bleacher Nation may contain errors or inaccuracies, though we try to avoid them. Links to content and the quotation of material from other news sources are not the responsibility of Bleacher Nation. Photos used are the property of Bleacher Nation, are used under a license with the USA TODAY NETWORK, are used with permission, are fair use, or are believed to be in the public domain. Legitimate requests to remove copyrighted photos not in the public domain will be honored promptly. Comments by third parties are neither sponsored or endorsed by Bleacher Nation.', 'As an Amazon Associate I earn from qualifying purchases.', 'Do Not Sell or Share My Personal Information', '', '', '']"
Your Privacy,https://www.si.com/onsi/racing-america/news/starting-lineup-nascar-cup-series-straight-talk-wireless-400-01jb4jfah2e1,"['Here is the official starting lineup for the 2024 NASCAR Cup Series Straight Talk Wireless 400 at Homestead-Miami Speedway.', 'Row', 'Pos', 'No.', 'Driver', 'Team', 'ROW 1', '1', '45', 'Tyler Reddick (P)', '23XI Racing', 'ROW 1', '2', '5', 'Kyle Larson (P)', 'Hendrick Motorsports', 'ROW 2', '3', '20', 'Christopher Bell (P)', 'Joe Gibbs Racing', 'ROW 2', '4', '11', 'Denny Hamlin (P)', 'Joe Gibbs Racing', 'ROW 3', '5', '47', 'Ricky Stenhouse Jr.', 'JTG Daugherty Racing', 'ROW 3', '6', '19', 'Martin Truex Jr.', 'Joe Gibbs Racing', 'ROW 4', '7', '9', 'Chase Elliott (P)', 'Hendrick Motorsports', 'ROW 4', '8', '23', 'Bubba Wallace', '23XI Racing', 'ROW 5', '9', '31', 'Daniel Hemric', 'Kaulig Racing', 'ROW 5', '10', '7', 'Justin Haley', 'Spire Motorsports', 'ROW 6', '11', '48', 'Alex Bowman', 'Hendrick Motorsports', 'ROW 6', '12', '4', 'Josh Berry #', 'Stewart-Haas Racing', 'ROW 7', '13', '14', 'Chase Briscoe', 'Stewart-Haas Racing', 'ROW 7', '14', '54', 'Ty Gibbs', 'Joe Gibbs Racing', 'ROW 8', '15', '77', 'Carson Hocevar #', 'Spire Motorsports', 'ROW 8', '16', '10', 'Noah Gragson', 'Stewart-Haas Racing', 'ROW 9', '17', '8', 'Kyle Busch', 'Richard Childress Racing', 'ROW 9', '18', '6', 'Brad Keselowski', 'RFK Racing', 'ROW 10', '19', '71', 'Zane Smith #', 'Spire Motorsports', 'ROW 10', '20', '12', 'Ryan Blaney (P)', 'Team Penske', 'ROW 11', '21', '17', 'Chris Buescher', 'RFK Racing', 'ROW 11', '22', '1', 'Ross Chastain', 'Trackhouse Racing', 'ROW 12', '23', '99', 'Daniel Suarez', 'Trackhouse Racing', 'ROW 12', '24', '34', 'Michael McDowell', 'Front Row Motorsports', 'ROW 13', '25', '24', 'William Byron (P)', 'Hendrick Motorsports', 'ROW 13', '26', '22', 'Joey Logano (P)', 'Team Penske', 'ROW 14', '27', '15', 'Kaz Grala #', 'Rick Ware Racing', 'ROW 14', '28', '43', 'Erik Jones', 'LEGACY MOTOR CLUB', 'ROW 15', '29', '42', 'John Hunter Nemechek', 'LEGACY MOTOR CLUB', 'ROW 15', '30', '3', 'Austin Dillon', 'Richard Childress Racing', 'ROW 16', '31', '38', 'Todd Gilliland', 'Front Row Motorsports', 'ROW 16', '32', '16', 'AJ Allmendinger(i)', 'Kaulig Racing', 'ROW 17', '33', '51', 'Corey LaJoie', 'Rick Ware Racing', 'ROW 17', '34', '21', 'Harrison Burton', 'Wood Brothers Racing', 'ROW 18', '35', '41', 'Ryan Preece', 'Stewart-Haas Racing', 'ROW 18', '36', '2', 'Austin Cindric', 'Team Penske', 'ROW 19', '37', '44', 'JJ Yeley(i)', 'NY Racing Team', 'ROW 19', '38', '66', 'Chad Finchum(i)', 'MBM Motorsports', '(P) indicates NASCAR Cup Series Playoff drivers\n# indicates Rookie of the Year contenders\n(i) indicates drivers ineligible to score NASCAR Cup Series points', 'Toby Christie is the Editor-in-Chief of Racing America. He has 15 years of experience as a motorsports journalist and has been with Racing America since 2023.', ""© 2024\nABG-SI LLC\n- SPORTS ILLUSTRATED IS A REGISTERED TRADEMARK OF ABG-SI LLC. - All Rights Reserved. The content on this site is for entertainment and educational purposes only. All betting content is intended for an audience ages 21+. All advice, including picks and predictions, is based on individual commentators' opinions and not that of Minute Media or its related brands. All picks and predictions are suggestions only. No one should expect to make money from the picks and predictions discussed on this website. For more information, please read our Legal Disclaimer. Gambling content intended for 21+. If you or someone you know has a gambling problem, crisis counseling and referral services can be accessed by calling 1-800-GAMBLER.""]"
Around the Track: Previewing the Cup Series at Homestead-Miami,https://www.aol.com/around-track-previewing-cup-series-181419186.html,"['', '', 'HOMESTEAD, Fla. (CHARLOTTE SPORTS LIVE) — Homestead-Miami Speedway is a favorite amongst drivers. Not because they’re in one of America’s social destinations, but because there are options all over the track to move around. Unlike other tracks, cars in any series can get better as the race goes on, and grooves get set.', 'Drivers will race 267 laps over the 1.5-mile track for a total of 400 miles. Banking is at a steep 18-20 degrees in every turn.', 'Denny Hamlin, looking to punch his ticket to the title race, has three wins here which is the most of any active driver.', 'Pole position hasn’t been kind in the past because only three drivers all-time have brought home the win from that spot.', 'Sunday’s Cup Series race at Homestead-Miami Speedway starts at 2:30 p.m.', 'Copyright 2024 Nexstar Media, Inc. All rights reserved. This material may not be published, broadcast, rewritten, or redistributed.', 'For the latest news, weather, sports, and streaming video, head to Queen City News.', 'Advertisement']"
NASCAR Homestead predictions 2024: Expert picks for Cup Series race,https://www.tennessean.com/story/sports/nascar/2024/10/26/nascar-predictions-homestead-schedule-cup-series-race-playoffs/75860171007/,"['The NASCAR Cup Series continues on in the playoffs with the Straight Talk Wireless 400 at Homestead-Miami Speedway.', 'Formerly the track that held the season finale, Homestead-Miami has found a spot in the Round of 8 as a unique challenge for drivers. Handling will be critical, as will keeping cars from bouncing off the wall. Set the over/under on toe link issues at 3.5 on Sunday.', 'Christopher Bell won here in 2023, and he could use a win to lock up a Championship 4 berth this weekend. But Denny Hamlin, Tyler Reddick, Chase Elliott and Ryan Blaney all have large deficits to make up after separate struggles last week at Las Vegas.', ""Here are The Tennessean's expert picks for Sunday's NASCAR Cup Series race at Homestead:"", 'WEEKEND SCHEDULE:NASCAR Homestead full weekend track schedule, TV schedule for the Straight Talk Wireless 400, other races', 'Byron punches his ticket to the championship at the track where he has been dominant in the past. Hendrick Motorsports has claimed two of the last three events at the 1.5-mile oval in southern Florida and Byron will make if three out four with his fourth win of the season.', ""Larson won the last time I picked him to win. Maybe Rick Hendrick should have asked me to pick him to win last week too. This is another good Larson track. He's got a win and two top-five finishes from his past three trips to Homestead. Barring a disaster, he should be near the front late in the race."", 'Not a data decision (even if Reddick has three top-five finishes in four races at Homestead) but a matchup of a driver who thrives riding near the wall and a track that demands it. Reddick locks up a Championship 4 spot on Sunday.']"
Regular-season champ Tyler Reddick takes NASCAR Cup pole at Homestead,https://www.washingtonpost.com/sports/auto-racing/2024/10/26/nascar-playoffs-homestead-qualifying/f3b7fef4-93f4-11ef-b5b1-75167840d9f3_story.html,"['Regular-season champion Tyler Reddick won the pole Saturday for the second race of the third round of NASCAR’s playoffs Sunday', '', '', 'Subscribe to comment and get the full experience. Choose your plan →', '']"
"What time does the NASCAR race start today? TV schedule, channel for 2024 Homestead-Miami playoff race",https://www.sportingnews.com/us/nascar/news/nascar-time-channel-schedule-today-homestead-miami-playoff-race/35f114acb8f03ca498a6d5bf,"['CHIRAG RADHYAN', 'Homestead-Miami Speedway is set to rev up the NASCAR Cup Series playoffs this Sunday afternoon, hosting its exclusive postseason race—the only oval on the schedule to do so solely in the playoffs.', 'The 267-lap Straight Talk Wireless 400, set around the fast, four-turn, 1.5-mile (2.414-kilometer) circuit in Homestead, Florida, marks the second race in the semifinal round of the 10-race playoff journey, following last weekend’s opener at Las Vegas Motor Speedway.', 'This season’s playoff-only tracks have already seen their fair share of action. Watkins Glen International made its playoff debut with a round of 16 showdown, and the Charlotte Motor Speedway Roval set the stage for the dramatic round of 12 cutoff.', '', 'STREAM:Straight Talk Wireless 400 race LIVE on Fubo (free trial)', '', 'The Homestead-Miami playoff race is scheduled to start at 2:30 p.m. ET on Sunday, October 27. The race will be held at Homestead-Miami Speedway in Homestead, Florida.', 'The Las Vegas playoff race will air on NBC in the US, and TSN in Canada.', 'NASCAR fans can also stream the race on Fubo. Test out Fubo with a seven-day FREE trial, and start streaming elite sports action live online and on-demand for free.', 'For a limited time, you can get your first month of Fubo for as low as $59.99, a $20 savings. Stream ESPN, ABC, CBS, Fox, NBC and 200+ top channels of live TV and sports without cable. (Participating plans only. Taxes and fees may apply.) ', 'Listen to the 2024 Straight Talk Wireless 400 at Homestead-Miami and every race of the NASCAR season on SiriusXM.', 'Get SiriusXM for free for your first month. Listen to live NBA, NFL, MLB and NHL games, plus NASCAR, college sports and more. Stay updated with all the news and get all the analysis on multiple sport-specific channels.', '', 'LISTEN:Straight Talk Wireless 400 race live on SiriusXM', '', ""Tickets for Sunday's Straight Talk Wireless 400 at Homestead-Miami Speedway can still be purchased through StubHub."", 'Head to StubHub to find the best deals for all Cup Series events.', 'Below are the updated playoff standings ahead of the 2024 Straight Talk Wireless 400 Race.', '(All times ET)', 'If you purchase a product or register for an account through one of the links on our site, we may receive compensation. Learn more >', ""Chirag Radhyan is a content producer working across The Sporting News' English-language editions."", 'Please Gamble Responsibly. Visit www.gambleaware.org\nCall 1-800-GAMBLER or go to ncpgambling.org. Find help in your State.', 'Please Gamble Responsibly. Visit www.gambleaware.org', '', '', '', '', '']"
