Title,Link,Paragraphs
Page Not Found,"https://www.nbcsports.com/on-her-turf/news/wnba-playoffs-2024-schedule-how-does-it-work-format-bracket-rounds-past-winners""]],[""WNBA","['DISCLAIMER: This site and the products offered are for entertainment purposes only, and there is no gambling offered on this site. This service is intended for adult audiences. No guarantees are made for any specific outcome. If you or someone you know has a gambling problem, please call 1-800-GAMBLER. PointsBet is our Official Sports Betting Partner and we may receive compensation if you place a bet on PointsBet for the first time after clicking our links.', 'Ⓒ 2023 NBC Universal', '', '', '', '', '', '', '', '']"
"WNBA Playoffs odds, expert picks, schedule: Liberty lead, Aces aim for three-peat, plus Caitlin Clark playoff debut",https://www.nytimes.com/athletic/5780602/2024/09/20/wnba-playoff-odds-expert-picks-schedule/,"['Sports Betting', '', 'With the final buzzer of the WNBA regular season Thursday night, the WNBA playoff odds are set — for now. The (+120) secured the No. 1 seed and are favorites to win the WNBA title this year, with the rival Las Vegas Aces (+225) right behind and the No. 2 seed Minnesota Lynx (+240) completing a tier of three at the top of the odds.', '', 'After that, the odds drop off significantly, with the (+800) followed by the Indiana Fever (+3000), (+4000), (+15000) and Atlanta Dream (+25000).', 'The stakes and storylines are thrilling for this year’s playoffs, fitting for a league that is exploding in popularity and delivering for new and old fans alike. The 2023 MVP Breanna Stewart and the Liberty are aiming to get the city’s first-ever title after falling to the Aces in last year’s finals. Meanwhile, reigning Finals MVP A’ja Wilson and the Aces are chasing a three-peat, the first since 2000 when the league was in just its fourth season.', '', '', '', 'Free, daily sports updates direct to your inbox.', '', '', 'The Liberty locked in the No. 1 seed on Tuesday in an 87-71 win over the Washington Mystics, giving New York home-court advantage through the playoffs. The Liberty are 32-8 and have led the league for almost the entire season.', 'A post-Olympics surge by the Lynx (30-10 overall, 13-2 since the Olympic break) kept the Liberty from locking the playoffs before Tuesday. Before the final bracket was set, the Lynx were at +1000 odds and have come down to +800.', '', '', 'Pickman: New York Liberty — The Liberty enter the postseason playing far from their best basketball. However, New York has been the league’s best team in the regular season overall, is abundantly talented, has home-court advantage throughout the playoffs and worked all season to overcome last year’s WNBA Finals scars. It’s not easy to flip a switch come playoffs, but New York knows it has to elevate its level and has the talent to do so.', 'Merchant: Minnesota Lynx — Assuming the Lynx can get past the Sun, they’ve matched up well against the Liberty and Aces all season.', '', '', 'We have another tier of three at the top of the odds for Finals MVP: A’ja Wilson, Napheesa Collier and Breanna Stewart are seen as most likely to make it to the Finals with their team and then absolutely show out.', 'Wilson is having an all-time great season, never seen before in this league (or officially in the NBA): most points (1,021), most rebounds (451) and most blocked shots (98) in a season. It would be the third time in league history a player has won back-to-back Finals MVPs, with Cynthia Cooper winning four in 1997-2000 and Lisa Leslie in 2001-2002.', '', '', '', 'Pickman: Brenna Stewart — She’s been the best and most consistent player on the league’s best team throughout the regular season. A perennial winner, Stewart’s loss in last year’s Finals marked the first major defeat of her career. She will avenge that this fall. If you want more of a value play, however, look to Jonquel Jones at +1200 odds. Jones, who herself is a former league MVP, was New York’s most consistent and dominant player during last year’s playoffs and could be again during this year’s run.', 'Merchant: Kayla McBride — The best player on the winning team doesn’t always snag this award (see: 2021 and 2022), and it’s easy to imagine McBride having a couple of big shooting nights that propel Minnesota.', 'Pickman’s pick: New York in two — Throw out the regular season finale loss against the Dream. It would be a monumental upset if New York lost in the first round.', 'Merchant’s pick: New York in two.', 'Pickman: Minnesota in two — The Lynx have been the WNBA’s best team since the All-Star break, dropping just one game since play resumed. There’s no reason to suspect a struggling Phoenix team will bring significant hiccups.', 'Merchant: Minnesota in two.', 'Pickman: Sun in two. The Sun won the season series over Indiana 3-1, but all three of their wins came within the first five weeks of the season when Indiana was still figuring itself out. What pace the series is played at will go a long way in determining the winner of this matchup. Indiana could be the first lower seed to upset a higher seed in the new format, but it’s also hard to bet against the Sun’s playoff experience.', '', 'Merchant: Connecticut in two. We’re still waiting on the first first-round upset in this format, and though Indiana has been feisty post-break and beat Connecticut in the most recent meeting, the Sun also have a five-year streak of making the WNBA semifinals on the line. The bet here is the streak stays alive.', 'Pickman: Another matchup loaded with talent, the Aces have consistently elevated their level of play in the postseason. Continuity will make a difference as Las Vegas goes for its three-peat.', 'Merchant: Las Vegas in two.', '', '', '', '', '']"
Connecticut Sun to take on Indiana Fever at home for game 1 of WNBA playoffs,https://www.nbcconnecticut.com/news/sports/connecticut-sun-indiana-fever-caitlin-clark-game-1-wnba-playoffs-mohegan-sun-arena/3390804/,"['UNCASVILLE, CONNECTICUT – MAY 14: Caitlin Clark #22 of the Indiana Fever controls the ball as Olivia Nelson-Ododa #10 of the Connecticut Sun defends at Mohegan Sun Arena on May 14, 2024 in Uncasville, Connecticut. The Connecticut Sun defeated the Indiana Fever 92-71. NOTE TO USER: User expressly acknowledges and agrees that, by downloading and or using this photograph, User is consenting to the terms and conditions of the Getty Images License Agreement. (Photo by Elsa/Getty Images)', 'Connecticut will be the center of the basketball world when the Connecticut Sun takes on the Indiana Fever at home on Sunday in the first round of the WNBA playoffs. It is a best-of-three series.', 'And the start of the playoffs is looking like the start of the season.', '', 'Caitlin Clark made her WNBA debut here in Connecticut when the Sun and Fever battled it out on the court at Mohegan Sun.', ""The arena was packed with Sun fans and the many who made a special trip to Connecticut just to be there in person for Clark's first game."", 'The Sun won the game, 92-71.', 'Last season, as a college player, Clark set the NCAA all-time scoring record at Iowa and she was a big reason why a record 18.9 million viewers tuned in to the national championship game, which her Hawkeyes lost to unbeaten South Carolina. ', 'And her WNBA debut in May set a viewership record for ESPN when more than 2 million viewers tuned in, breaking ESPN’s previous record of nearly 1.5 million viewers for a Phoenix Mercury-Connecticut Sun game on May 22, 2004, in Diana Taurasi’s rookie season.', '', 'And Clark has had quite a season. In August, she set a new WNBA rookie three-point record and the massive numbers of people who are watching her games have made headlines.', 'All eyes will be on Clark as she makes her postseason debut. The Fever struggled early in the season with a difficult schedule, but have really come on strong after the Olympic break.', 'While Clark surely has star power, the Sun are a force on the court.', 'Connecticut has been to eight straight postseasons — the longest active streak.', 'The Sun (28-12) defeated the Chicago Sky on Thursday night, 87 to 54, setting a new franchise record for most wins in a single regular season and they enter the playoffs as the number 3 seed.', 'The Fever lost to the Washington Mystics, 91 to 92, on Thursday night to finish the season, 20-20. This is the first time the Fever, the sixth seed, will be in the playoffs since 2016.', 'Season Series: The Sun won three of the four meetings, but the Fever took the last one. The three Connecticut wins all came within the first month of the season.', ""Major Storylines: Clark has always thrived on the biggest stage and is ready for her playoff debut. For the Fever to succeed, they'll need other players to step up and help her. Clark averaged 16.3 points and 3.8 rebounds in the four meetings. The Sun are looking to get back to the WNBA Finals for the first time since 2022."", 'The Sun will take on the Fever at Mohegan Sun Arena at 3 p.m. on Sunday, Sept. 22.', 'Game 1: Indiana at Connecticut, Sunday, Sept. 22 at 3 p.m.', 'Game 2: Indiana at Connecticut, Wednesday, Sept. 25 at 7:30 p.m.', 'Game 3: If necessary, Connecticut at Indiana, Friday, Sept. 27. The time is to be determined.', 'Games one and two are at Mohegan Sun Arena.', 'It is located at 1 Mohegan Sun Boulevard, Uncasville, CT 06382', 'You can find directions here.', 'Tickets for game one are still available and the Ticketmaster website shows prices start at around $112 while some resale tickets are listed in the thousands.', '', '', '', '', '', '', '', '']"
"WNBA playoff picks, predictions for 2024 bracket: Caitlin Clark debut, Aces three-peat chances and more",https://www.sportingnews.com/us/wnba/news/wnba-playoff-picks-predictions-2024-bracket/e7926fc22fd2e083d27c1fcf,"['DAVID SUGGS', 'KYLE IRVING', 'STEPHEN NOH', ""The moment we've all been waiting for has arrived."", 'After a thrilling regular season that saw a number of records broken, the 2024 WNBA Playoffs begin on Sunday.', ""There will be no shortage of storylines this postseason, headlined by Fever rookie Caitlin Clark making her playoff debut to A'ja Wilson and the Aces looking to become only the second WNBA team to three-peat. The stars will be out in full force in what has the potential to be a historic month."", ""Ahead of the playoffs, The Sporting News' WNBA experts share their predictions for how the next few weeks will play out."", ""MORE: Is Diana Taurasi retiring? Mercury continue to hint at WNBA legend's last game"", 'Steph Noh: There’s really only one choice here. The Fever have been way better than an average No. 6 seed, going 10-4 after the All-Star break. They already beat the Sun three weeks ago, and Caitlin Clark has been playing out of her mind during this stretch.', ""David Suggs: It's gotta be the Fever. Clark and Kelsey Mitchell are as frightening a backcourt as there is in the W, while Aliyah Boston has come into her own in the past few months. Expect a competitive series between the two Eastern Conference standouts."", ""Kyle Irving: The Fever. They're going to be a common answer, but the praise is earned."", 'Indiana looks like a different team coming out of the Olympic break and Clark is the head of the snake. She averaged 24.3 points, 8.9 assists, 5.5 rebounds, and 1.1 steals per game in that span, solidifying her place as one of the best players in the WNBA already. With Mitchell and Boston also playing the best basketball of their careers, the Fever will be a tough out.', ""SN's WNBA HQ: Live WNBA scores | Full WNBA schedule"", ""Steph Noh: While the Fever have a chance to pull off the upset, don't discount this Sun team. They have the No. 1 defense in the league, and Alyssa Thomas has led them deep in the playoffs for five consecutive years, including two finals appearances. I don’t feel great about it, but I’m picking the Sun in that first-round series."", ""David Suggs: Clark could very well lead Indiana past Connecticut in Round 1. I just don't see it at the moment."", ""The Fever have been as good as anyone since returning from the Olympic break, with Clark, Mitchell, and Boston showcasing a level of consistency that eluded them during the first half of the season. Nevertheless, experience is king in the postseason. Alyssa Thomas, DeWanna Bonner, and the Sun have that in abundance. Couple that with an Indiana defense that can look porous at times and it's hard to pick against Connecticut. At least at the moment."", 'Kyle Irving: Even if the Fever are the ""most likely"" to pull off a first-round upset, I don\'t think the Sun will let it happen.', 'Connecticut is an experienced team that has not been stopped short of the semifinals since 2018 and made two WNBA Finals runs in that span. Thomas, Bonner, and Brionna Jones lead the way but no player has given Clark more trouble than defensive ace DiJonai Carrington. Marina Mabrey has injected life into their offense since being acquired at the trade deadline, too.', 'MORE: Debunking theory that Caitlin Clark benefits from generous scorekeeping', 'Steph Noh: I’m going with Breanna Stewart. A’ja Wilson is the best player, but the Liberty have been better than the Aces this year and have the best chance of winning the championship. Stewart is the league’s reigning MVP and has made four consecutive All-Defensive teams. She’s already won two finals MVPs. Why not make it a third?', ""David Suggs: I'll go with Napheesa Collier. She's arguably the second-best player in the world and plays for a side that went 3-1 against Las Vegas and 2-1 against New York this season."", ""Collier can do it on both ends of the floor and is coming off the best season of her career. I think that could propel her to postseason MVP glory when it's all said and done."", ""Kyle Irving: A'ja Wilson. She's the best player in the WNBA by a significant margin and she's ready to prove that — again — this postseason."", 'Steph Noh: Alanna Smith. The Lynx center plays hard, hits big 3s and is in contention for Most Improved Player for the second straight season. She’s been a great developmental story for one of the league’s best teams.', ""David Suggs: Leonie Fiebich. The Liberty wing has impressed off the bench in her maiden WNBA season, sinking 42.9 percent of her 3-point attempts this year. At 6-4, Fiebich has center-like height, but it's at the perimeter where she can wreak the most havoc. New York has two of the W's best playmakers in Sabrina Ionescu and Courtney Vandersloot. Expect both of them to get Fiebich involved time and time again."", ""Kyle Irving: DiJonai Carrington. No player has disrupted Clark more than Carrington and she'll be in the spotlight as the star rookie's primary defender in the first round. Carrington stepped into a full-time starting role after finishing runner-up for Sixth Woman of the Year last season and has been one of the best perimeter defenders in the W. She's also averaging a career-high 12.7 points per game to round out her skillset."", ""MORE: A'ja Wilson breaks WNBA single-season scoring record"", 'Steph Noh: The Liberty. They were ousted in four games in last year’s finals. This team is better, and the Aces are worse. Las Vegas had six of its players participate in the Olympics, and that fatigue is going to make their path much harder this season.', ""David Suggs: The Lynx. Minnesota has bested Las Vegas in three of its four matchups this season. Cheryl Reeve's side has the best defense in the West and more depth than the Aces. Wilson is the best player in the world, but Collier isn't too far behind, having put forth a season that will likely result in a top-three finish in MVP voting."", ""Kyle Irving: The Liberty. Everyone expected to see a WNBA Finals rematch between New York and Las Vegas. Instead, we might see the matchup unfold in the second round. That could be bad news for the Liberty's best regular season in franchise history, but it could also spell the end of the Aces' three-peat hopes."", 'Steph Noh: The Liberty. They have homecourt advantage throughout the playoffs, they have the talent and they have the playoff experience. Jonquel Jones and Ionescu have grown as passers, Stewart continues to be a two-way force and Sandy Brondello is looking like one of the top coaches in the league.', ""David Suggs: The Lynx. Reeve's side might not have the star power that the Aces and Liberty have. It's a damn good roster, though, spearheaded by Collier and Kayla McBride. Courtney Williams, Bridget Carleton and Alanna Smith are as good a supporting cast as there is in the W, while Myisha Hines-Allen — acquired at the trade deadline from Washington — has offered the Lynx a bruising presence in the paint."", 'Minnesota has been efficient and effective through 40 regular season games. A similar showing in the postseason could bring a championship to the Great Lakes.', ""Kyle Irving: I'm still riding with the Aces. Even with a bumpy road in the regular season, the back-to-back reigning champions will know it's time to flip the switch. Wilson is having a historic MVP season and she has plenty of help around her to finish the job a third consecutive time."", 'David Suggs is a content producer at The Sporting News. A long-suffering Everton, Wizards and Commanders fan, he has learned to get used to losing over the years. In his free time, he enjoys skateboarding (poorly), listening to the likes of Stevie Wonder, Marvin Gaye and D’Angelo, and penning short journal entries.', 'You read that wrong – not Kyrie Irving. From Boston, graduated from the University of New Hampshire. Sixth season as a content producer for NBA.com\'s Global editions. Covering the NBA Draft has become his annual ""dream come true"" moment on the job. Irving has a soft spot for pass-first point guards, with Rajon Rondo and Steve Nash being two of his favorite players of all time.', 'Stephen Noh started writing about the NBA as one of the first members of The Athletic in 2016. He covered the Chicago Bulls, both through big outlets and independent newsletters, for six years before joining The Sporting News in 2022. Stephen is also an avid poker player and wrote for PokerNews while covering the World Series of Poker from 2006-2008.', 'Please Gamble Responsibly. Visit www.gambleaware.org\nCall 1-800-GAMBLER or go to ncpgambling.org. Find help in your State.', 'Please Gamble Responsibly. Visit www.gambleaware.org', '', '', '', '', '']"
"WNBA playoffs bracket: Final standings, seeds, matchups, first round schedule",https://www.usatoday.com/story/sports/wnba/2024/09/19/wnba-playoffs-bracket-schedule-final-standings/75299077007/,"['This story was updated to add new information.', 'The WNBA postseason field is finalized after the conclusion of the regular season Thursday.', ""A'ja Wilson and the defending champion Las Vegas Aces are back in the playoffs along with seven other teams."", 'Three teams were battling for the eighth and final playoff spot Thursday. The Atlanta Dream earned the final playoff bid with a 78-67 victory over the New York Liberty.', 'The Chicago Sky and Washington Mystics fell short of a playoff bid after participating in the playoffs last season. The Seattle Storm, Indiana Fever and the Phoenix Mercury earned a postseason bid after not qualifying in 2023.', 'Caitlin Clark and Aliyah Boston will make their postseason debuts on Sunday.', 'Playoff bound:Caitlin Clark, Indiana Fever face Connecticut Sun in first round', ""Here's who is in the playoffs and the first-round matchups:"", 'All times Eastern', '(* - If necessary)', ""Breanna Stewart has led the Liberty to the league's top seed. After losing in the Finals last season, the question remains whether this is the year they will claim the title as their own."", 'Longtime coach Cheryl Reeve and the Lynx are back for another playoff run after they were quickly eliminated by the Sun last year in the first round. The Lynx have not made it to the Finals since winning it all in 2017.', 'The Sun will make their eighth consecutive playoff appearance but are still in search of their first title. The team reached the WNBA Finals in 2019 and 2022 but fell short.', ""A'ja Wilson, Kelsey Plum and the Aces have won the last two WNBA Finals and will compete for a chance at the three-peat under the guidance of coach Becky Hammon."", 'Seattle has returned to the playoffs after missing out in 2023. The Storm were consistently in the playoffs from 2016-21, winning the title in 2018 and 2020.', 'Rookie Caitlin Clark will make her postseason debut this weekend with the Fever. Fellow former top pick Aliyah Boston also makes her playoffs debut. The 2023 WNBA Rookie of the Year award winner missed the playoffs last season.', ""Diana Taurasi and the Mercury are back in the playoffs after losing in the first round in 2022 and completely missing the postseason in 2023. This marks Brittney Griner's first postseason appearance since returning to the team following her detainment in Russia."", ""The Dream reached the playoffs for the second consecutive year with Tanisha Wright at the helm. Prior to Wright's arrival, the Dream went four seasons without a playoff appearance.""]"
