Title,Link,Paragraphs
Fever vs. Sun Series Preview: How Much History Can Caitlin Clark Continue to Make?,https://www.actionnetwork.com/wnba/indiana-fever-vs-connecticut-sun-series-preview-how-much-history-can-caitlin-clark-continue-to-make,"['Pictured: Dijonai Carrington of the Sun and Caitlin Clark of the Fever for Action Network’s series preview for Connecticut vs. Indiana in the first round of the WNBA Playoffs.', 'Now this is going to be the fun part of the eventual documentary.', 'Where the young standout coming into her own in the WNBA is face-to-face with the biggest test of her early career.', ""Where after an uneasy start to her 2024, really showed more glimpses of putting it altogether — perhaps showing us more of what's to come."", ""And not only that, she'll get to face her rival in Round 1."", ""That's right, DiJonai Carrington has finally arrived. And only, Caitlin Clark stands in her way. OK, fine — let's be serious."", 'The Fever went 1-3 against the Sun this season, but that one win was in August, and it was the only time these two faced off after June.', 'The Fever managed to go 9-4 in 13 games following the Olympic break before dropping their season finale, which had no impact on their standing anyway.', ""In that 13-game run, Clark averaged 24.3 points, 8.9 assists, 5.5 rebounds, and shot about 44/36/93. More on Clark shortly…under-discussed has been Kelsey Mitchell, who averaged 24.8 points on 50/45/87 shooting in the last month of the season before the meaningless finale. It's worth noting that she dropped 23 points on an efficient 8-for-14 (4-for-7 from three) in an 84-80 win over the Sun at home on August 28 as Connecticut emerged from the break in uneven fashion."", 'Mitchell was in the midst of a stretch where she netted 20 or more points in 12 of 13 games, which obviously coincides with the late-season Fever success.', ""On the Fever front, it's also worth noting that Aaliyah Boston recorded 13.8 points, 9.6 boards and 4.2 assists in the same stretch, converting over 51 percent from the field."", 'Offers\nSelect A Location\nAlabama\nAlaska\nArizona\nArkansas\nCalifornia\nColorado\nConnecticut\nDelaware\nFlorida\nGeorgia\nHawaii\nIdaho\nIllinois\nIndiana\nIowa\nKansas\nKentucky\nLouisiana\nMaine\nMaryland\nMassachusetts\nMichigan\nMinnesota\nMississippi\nMissouri\nMontana\nNebraska\nNevada\nNew Hampshire\nNew Jersey\nNew Mexico\nNew York\nNorth Carolina\nNorth Dakota\nOhio\nOklahoma\nOregon\nPennsylvania\nRhode Island\nSouth Carolina\nSouth Dakota\nTennessee\nTexas\nUtah\nVermont\nVirginia\nWashington\nWest Virginia\nWisconsin\nWyoming\nWashington, D.C.\nUnderdog\nGet up to $1000 Bonus Cash On Your First Deposit!\nAge, location, and other restrictions apply. Please play responsibly.\nACTION\nPromo Code\nClaim $1000\nFliff\nSpend $100, Get $200 in Fliff Coins!\nPlayers must be 18+ and be residents of the U.S. Void where prohibited. Please play responsibly. Full T&C Apply.\nACTION\nPromo Code\nClaim $200', ""These teams couldn't be any more different.The Sun are gonna try to f… ahem… rough the Fever up, so how this series is officiated will be important."", ""They'll also lean heavily on six players: Carrington, Thomas, Tyasha Harris, DeWanna Bonner, Brionna Jones and Marina Mabrey, all of whom logged 27 plus minutes, and no one else above 16.3."", ""If they're allowed to be phyiscal, it'll leave an imprint of how this unfolds, and will be indicative of how forceful the starting Carrington-Harris-Bonner-Thomas-Jones unit could be with the Fever."", ""But if the Sun aren't able to be but so physical, the Fever will run their asses up and down the floor, attempting to increase the speed of the game as Clark runs the offense in transition."", 'The Sun had an elite defense all season, and generally are No. 1 or No. 2 in major metrics across the board.', ""The allowed the fewest points per 100 possessions (96.4).They're the second-best at guarding the three (teams shot 31.3 percent from deep against them — only Lynx better, 30 percent)."", 'The Sun had the second-best net rating in the WNBA (+8.6) and was one of just five teams to have a positive net. The Fever were sixth at -3.4.', ""The Sun forced the most fouls in the W per 100 possessions at 23.8, while the Fever forced the third-fewest at 21.4. This is important given the difference in pace, where the Sun's methodical 75.8 is the league's slowest compared to the Fever's 79.8 second fastest in the W."", ""And because the Sun don't generate a ton of possessions and drag out offense more than other teams, it could make Fever turnovers more costly."", 'Heading into the final game of the season, Clark averaged 5.6 per game for the season, 2.0 more than anyone else (Thomas second at 3.6).', 'The Sun forced the most turnovers per game per 100 possessions (19.6). The Fever force a league-low 14.5 per 100.', ""But along with a clash in styles, there's a clash in performance."", 'The Sun was 18-6 before the Olympic break and went 10-6 to end the year, losing six games in half the time after the rest period than they did beforehand.', 'Meanwhile, the Fever went 9-4 up until the finale after an 11-15 start to the season.', ""(There's probably a half-decent Fever being hotter than the Sun pun in here somewhere, but it's not worth it.)"", 'Generally, I believe in young teams getting their ass whooped before potentially experiencing greatness.', ""In the W, it's a tougher rule to subscribe to because there aren't any seven-game series."", 'Candace Parker won MVP and Rookie of the Year in 2008 and — with her and Lisa Leslie, to be fair — the No. 3 seed Los Angeles Sparks beat the No. 2 seed Seattle Storm, led by Lauren Jackson, 2-1 in the playoffs.', 'They then lost to eventual Western Conference Champion San Antonio Silver Stars 2-1 in the West Finals. They had two other WCF trips before finally winning a title with Parker in 2016.', ""Another all-time talent, A'ja Wilson, joined the Las Vegas Aces in 2018 as the No. 1 overall pick. They didn't even make the 2018 playoffs, though they've been to at least the conference finals every year since 2019, losing in the 2020 Finals and winning each of the last two in 2022 and 2023, respectively."", 'Breanna Stewart and the Seattle Storm were bounced on a one-and-done playoff game with the Atlanta Dream, but they won the title two seasons later.', ""Of note: The Fever, as an organization, haven't made the playoffs since 2016 — Stephanie White, current Sun head coach, actually led them there."", 'Clark, Mitchell, Boston, NaLyssa Smith, and Lexie Hull have never played in a playoff game.', ""Temi Fagbenle won a title with the 2017 Minnesota Lynx but played four minutes in the title run. She played two more playoff games with the Lynx in two subsequent seasons, so she's logged 44 playoff minutes in four games in her career. Katie Lou Samuelson has three playoff outings to her name with 39 total minutes, the last was a start for the 2021 Storm. And Erica Wheeler started for the Fever in their 2016 playoff outing, and hasn't been back since."", ""The Sun have been a playoff team every year since 2017, they've been top three in the East and have had 21 or more wins all but once across the this stretch, they've won at least one series all but once since 2019 and they have two finals losses."", 'Thomas has been there since 2014, Jones since 2019, Bonner since 2020, and Carrington since 2021. Their core has been mostly constant.', ""It's two completely opposites meeting to do battle — but it's, at most, a three-game series — so even undertakings that feel unprecedented need to be considered when a generational talent is involved.All this said and rambling done, here's what I'm rolling with."", 'Pick: Connecticut Sun G1/Series (-140 on FanDuel).', ""The Sun can sweep, but if the Fever split in Connecticut, I don't think the Fever winning at home is just a guarantee. The Sun's defense travels — they won in Minnesota to close out Round 1 and beat the Liberty in Brooklyn to begin Round 2 just last season."", ""But I'll add that there are a couple correct series looks I believe are a longshot worthy look, if nothing else, both on FanDuel."", 'Indiana is the scariest underdog in Game 1, regardless of the history going up against them. They have a transcendent player, so they might be able to do transcendent things sooner than expected.', ""But overall, I don't think this is the year, or the match-up."", 'Offers\nSelect A Location\nAlabama\nAlaska\nArizona\nArkansas\nCalifornia\nColorado\nConnecticut\nDelaware\nFlorida\nGeorgia\nHawaii\nIdaho\nIllinois\nIndiana\nIowa\nKansas\nKentucky\nLouisiana\nMaine\nMaryland\nMassachusetts\nMichigan\nMinnesota\nMississippi\nMissouri\nMontana\nNebraska\nNevada\nNew Hampshire\nNew Jersey\nNew Mexico\nNew York\nNorth Carolina\nNorth Dakota\nOhio\nOklahoma\nOregon\nPennsylvania\nRhode Island\nSouth Carolina\nSouth Dakota\nTennessee\nTexas\nUtah\nVermont\nVirginia\nWashington\nWest Virginia\nWisconsin\nWyoming\nWashington, D.C.\nThrillzz\nGet a 100% Deposit Match up to $25 in Sweeps Coins + Free Coins on Your First Purchase!\nPlayers must be 18+ and be residents of the U.S. Void where prohibited. Mobile only. Please play responsibly.\nACTION1\nPromo Code\nClaim $25\nPrizePicks\nPlace a $5 Lineup, Get $50 Instantly - No Strings Attached!\nAge, location, and other restrictions apply. Please play responsibly.\nACTION2\nPromo Code\nClaim $50', 'Follow Bryan Fonseca @bryanfonsecany on Twitter/X.', 'How would you rate this article?', 'This site contains commercial content. We may be compensated for the links provided on this page. The content on this page is for informational purposes only. Action Network makes no representation or warranty as to the accuracy of the information given or the outcome of any game or event.', 'Copyright 2024 © Action Network Inc, All Rights Reserved.Privacy Policy | Terms of Service | AdChoices', 'DISCLAIMER: This site is 100% for entertainment purposes only and does not involve real money betting.', 'Gambling Problem? Call 1-800-Gambler.', '']"
No title found,https://www.wnba.com/news/portland-15th-franchise-announcement,"['', '', '', '', '', '', '', '', '', '', '', '', ' – RAJ Sports to Launch', 'Newest WNBA Team, Which Will Debut in 2026 Season –', 'NEW YORK and PORTLAND, Ore., Sept. 18, 2024 – The Women’s National Basketball Association (WNBA) announced today that it has awarded Portland, Oregon, the league’s 15th franchise. The Portland team, set to begin play in the 2026 season, will be owned and operated by RAJ Sports, led by Lisa Bhathal Merage and Alex Bhathal. Portland is the third expansion franchise awarded by the WNBA during this round of expansion, following the Golden State Valkyries and a Toronto franchise, bringing the league from 12 to 15 teams.', '“As the WNBA builds on a season of unprecedented growth, bringing a team back to Portland is another important step forward,” said WNBA Commissioner Cathy Engelbert. “Portland has been an epicenter of the women’s sports movement and is home to a passionate community of basketball fans. Pairing this energy with the Bhathal family’s vision of leading top-flight professional sports teams will ensure that we deliver a premier WNBA team to the greater Portland area.”', 'Lisa Bhathal Merage will serve as controlling owner and WNBA Governor, while Alex Bhathal will serve as Alternate Governor. The Bhathal family (Lisa, Alex and their parents, Marta and Raj) brings more than 50 years of experience in the professional sports industry, including serving as investors of the NBA’s Sacramento Kings and controlling owners of the National Women’s Soccer League’s Portland Thorns. Ms. Merage’s husband, Richard Merage, will also join the buyer group as an investor and Executive Board member of Portland WNBA. Mr. Merage is the Chief Executive Officer of MIG Capital, LLC, an investment management firm he co-founded in 2006 following the sale of his family’s business, Chef America, to Nestle.', '“For decades, Portland has been the global epicenter of sports lifestyle and today, we are now the global epicenter of women’s sports,” said Lisa Bhathal Merage. “We believe in the transformative power of women’s sports and are thrilled that the W will call Portland home. We know that Portland’s vibrant and diverse communities will highly support and rally around this team. Our goal is to grow this organization in partnership with the Portland community and we look forward to supporting the best women’s basketball players in the world when they take the floor at the Moda Center in 2026.”', 'The team will play its home games at the Moda Center in downtown Portland. Fans who wish to buy season tickets for the WNBA Portland team can do so by placing a deposit at WNBA.com/portland. The new team marks the WNBA’s return to Portland after more than 20 years. The Portland Fire played three seasons in the WNBA from 2000-02.', 'The latest expansion announcement comes amid the WNBA’s historic 28th season. In addition to announcing three new teams, the league in recent months has added its most anticipated rookie class ever; signed a groundbreaking new media rights deal; and shattered records for viewership, attendance, merchandise sales, social media engagement, digital subscriptions (WNBA League Pass) and app downloads.', ' ', 'Additional Quotes:', 'Oregon Sen. Ron Wyden', '“Today puts basketball fans in Portland and all across Oregon in the ‘W” column,” Wyden said. “Our city and entire state have consistently set the gold standard for supporting women’s sports, and I’m thrilled the Bhathal family is expanding its commitment to women’s sports locally by bringing Portland a much-deserved WNBA franchise. I know from hosting Commissioner Engelbert for a roundtable at the Sports Bra in February 2023 with women athletes, women’s sports executives and coaches that enthusiasm for women’s basketball is off the charts. And I can’t wait for this new team to tip off in 2026.”', 'Oregon Governor Tina Kotek', '“Portland has a passion for women’s sports and the teams who play in the Rose City, making us the ideal home of the next WNBA team,” Governor Kotek said. “From the Thorns to the Rose City Rollers to the Sports Bra, Portland embraces a diversity of athletes and fans. This is an exciting new chapter for our city and our state.”', 'Portland Mayor Ted Wheeler', '“We are thrilled to welcome the WNBA to Portland, a city renowned for its vibrant sports culture and deep commitment to fostering women’s athletics,” said Mayor Ted Wheeler. “This expansion marks a significant milestone in our city’s sports history and underscores our role as a burgeoning hub for women’s sports. It’s more than basketball; it’s about energizing our community, enhancing our local economy, and celebrating pride in our city.”', 'RAJ SPORTS', 'RAJ Sports, led by Alex Bhathal and Lisa Bhathal Merage, focuses on investment opportunities in sports and sports-related properties, drawing on the Bhathal family’s multi-generational experience and relationships in the industry. The firm seeks to leverage the power of sports to affect broader social and economic change through a variety of business and philanthropic strategies. Its deep experience in professional sports operations and large-scale real estate developments that create thriving community centers, positions the firm to deliver valuable assets that will support further growth for the players, staff, and fans. In 2013, the Bhathal family became investors in the Sacramento Kings (NBA); subsequently building the platform to include the Sacramento RiverCats (MiLB), Stockton Kings (NBA G-League) and several sports anchored real estate developments. The 2024 acquisitions of Portland Thorns (NWSL) and the WNBA Portland expansion team represents a milestone for the city of Portland and places it at the epicenter of growth for women’s sports.', 'About the WNBA', 'The WNBA is a bold, progressive basketball league that stands for the power of women. Currently in its 28th season in 2024, the W is a unique sports property that combines competition and entertainment with a commitment to diversity, equity and inclusion and social responsibility. Through its world-class athletes, the in-game fan experience, TV and digital broadcasts, digital and social content, and community and youth outreach programs, the league celebrates and elevates the game of basketball and the culture around it. In 2020, the WNBA and the Women’s National Basketball Players Association (WNBPA) signed a groundbreaking CBA that has charted a new course for women’s basketball – and women’s sports overall – with a focus on increased player compensation, improvements to the player experience, expanded career development opportunities and resources specifically tailored to the female professional athlete. Key elements of the agreement are supported through the league’s partnership platform, the WNBA Changemakers Collective, with AT&T, the WNBA’s Marquee Partner and inaugural Changemaker, as well as fellow inaugural Changemakers Deloitte and NIKE, Inc., and subsequent additions Google, U.S. Bank and CarMax. During the 2020 season, the WNBA and WNBPA launched the WNBA Justice Movement forming the Social Justice Council with the mission of being a driving force of necessary change and continuing work regarding women’s and maternal health and voting rights, among other important societal issues.', 'Copyright 2024 NBA Media Ventures, LLC. All rights reserved. No portion of WNBA.com may be duplicated, redistributed or manipulated in any form. If you are having difficulty accessing any content on this website, please visit our Accessibility page.', '']"
No title found,https://www.forbes.com/sites/sophiekaufman/2024/09/20/wnba-playoffs-2024-everything-you-need-to-know-ahead-of-the-first-round/,"['For further information, do not hesitate to contact us.', 'Ref: 68.181.17.80 2024-09-20T21:26:41.497Z']"
"WNBA Playoffs: Schedule, matchups, how to watch, where to watch",https://www.sbnation.com/wnba/2024/9/19/24249166/wnba-playoffs-schedule-matchups-connecticut-sun-indiana-fever-las-vegas-aces-seattle-storm,"['FILED UNDER:', 'The Connecticut Sun host the Indiana Fever, the Las Vegas Aces host the Seattle Storm, and two other first-round matchups are set.', 'The WNBA playoffs are here, and first-round match-ups are set, with play beginning on Sunday, September 22nd.', 'The first round is a best-of-three series, with the higher-seeded team hosting the first two games, and the lower-seeded time hosting the deciding Game 3, if necessary.', 'The subsequent two rounds — the Semi-Finals and Finals — are each played best-of-five, with the higher-seeded team hosting the first two games, the lowest-seeded team hosting Game 3 and 4 (if necessary), and the higher-seeded team hosting Game 5 (if necessary).', 'Sunday, September 22nd is an all-day affair — nationally-televised games will be played at 1pm, 3pm, 5pm, and 10pm ET. First-round games will continue on Tuesday, Wednesday, Thursday, and Friday.', 'The Semi-Finals will begin on Sunday, September 29th and will be wrapped up by Tuesday, October 8th. The Finals will begin on Thursday, October 10th, and conclude by Sunday, October 22nd.', 'Game 1 will be in New York on Sunday, September 22nd at 1pm ET (on ESPN)\nGame 2 will be in New York on Tuesday, September 24th at 7:30pm ET (on ESPN)\nGame 3, if necessary, will be in Atlanta on Thursday, September 26th, time TBD (on ESPN2)', 'Game 1 will be in Minnesota on Sunday, September 22nd at 5pm ET (on ESPN)\nGame 2 will be in Minnesota on Wednesday, September 25th at 9:30pm ET (on ESPN)\nGame 3, if necessary, will be on Phoenix on Friday, September 27th, time TBD (on ESPN2)', 'Game 1 will be in Connecticut on Sunday, September 22nd at 3pm (on ABC)\nGame 2 will be in Connecticut on Wednesday, September 25th at 7:30pm (on ABC)\nGame 3, if necessary, will be in Indiana on Friday, September 27th, time TBD (on ESPN2)', 'Game 1 will be in Las Vegas on Sunday, September 22nd at 10pm (on ESPN)\nGame 2 will be in Las Vegas on Tuesday, September 24th at 9:30pm (on ESPN)\nGame 3, if necessary, will be in Seattle on Friday, September 27th, time TBD (on ESPN2)', 'Game 1: Sunday, September 29th\nGame 2: Tuesday, October 1st\nGame 3: Friday, October 4th\nGame 4 (if necessary): Sunday, October 6th\nGame 5 (if necessary): Tuesday, October 8th', 'Game 1: Sunday, September 29th\nGame 2: Tuesday, October 1st\nGame 3: Friday, October 4th\nGame 4 (if necessary): Sunday, October 6th\nGame 5 (if necessary): Tuesday, October 8th', 'Game 1: Thursday, October 10th at 8pm on ESPN, ESPN Deportes\nGame 2: Sunday, October 13th at 3pm on ABC, ESPN Deportes\nGame 3: Wednesday, October 16th at 8:30pm on ESPN, ESPN Deportes\nGame 4 (if necessary): Friday, October 18th at 8pm on ESPN, ESPN Deportes\nGame 5 (if necessary): Sunday, October 20th at 7:30pm on ESPN, ESPN Deportes', '', '', '', '', 'Gambling Problem? Call 1-800-GAMBLER (1-800-426-2537). Hope is here. GamblingHelpLineMA.org or call (800) 327-5050 for 24/7 support (MA). Visit www.mdgamblinghelp.org (MD). Call 877-8HOPE-NY or text HOPENY (467369) (NY). 21+ (18+ D.C.) and present in select states (for KS, in affiliation with Kansas Star Casino). Call 1-888-789-7777 or visit ccpg.org/chat (CT) or visit FanDuel.com/RG.', '', '', '', '', '', '', '']"
No title found,https://www.wbez.org/wbez-news/2024/09/20/the-sky-didnt-make-it-to-the-playoffs,"['', '', '', 'MENU', '', '', 'LISTEN LIVE', 'Photo by David Attie / PBS', '', '', 'Photo by David Attie / PBS', '', 'The Chicago Sky’s season ended last night with an 87-54 loss to the Connecticut Sun. After nabbing superstar rookies Angel Reese and Kamilla Cardoso in the draft, the Sky closed out the season with a disappointing 13 and 27 record. WBEZ sports Contributor Cheryl Raye Stout joins Mary Dixon now to discuss what next for the team.', '© 2024 Chicago Public Media Inc. | Privacy Policy | Terms of Use | FCC Public Filing Info | Notice of FCC Applications']"
Caitlin Clark's Indiana Fever discover WNBA playoff opponent - as the Atlanta Dream secure final spot,https://www.dailymail.co.uk/sport/wnba/article-13871691/caitlin-clark-indiana-fever-wnba-playoffs-atlanta-dream.html,"['By MAX WINTERS', 'PUBLISHED: 22:02 EDT, 19 September 2024 | UPDATED: 01:39 EDT, 20 September 2024', '', '1', 'View\ncomments', '', '', '', 'The WNBA playoffs are set after a thrilling final night of the regular season. ', 'Caitlin Clark and the Indiana Fever were beaten by the Washington Mystics on Thursday night, but the rookie still put up a record-breaking performance. ', 'The Fever were already through to the postseason but now know they will take on the Connecticut Sun after the standings were finalized.', 'Atlanta needed a victory on Thursday night to clinch a spot and the Dream did just that by beating New York 78-67. The Liberty had already clinched the top seed. ', ""The postseason begins Sunday with four best-of-three matchups but the Dream's prize for sneaking into the playoffs is another meeting with New York."", 'Caitlin Clark and the Indiana Fever will play the Connecticut Sun in the WNBA playoffs', 'Atlanta needed a victory to clinch a spot and the Dream did just that by beating New York', 'Elsewhere, the Minnesota Lynx, the No. 2 seed, will host the No. 7 seed Phoenix Mercury.', 'The final opening round matchup is the two-time defending champion Las Vegas Aces, the No. 4 seed, hosting the fifth-seeded Seattle Storm.', 'Las Vegas is trying to become the first team to win three titles in a row since Houston won four straight in the first four seasons of the WNBA - from 1997 to 2000.', 'The better seeded team will host the first two games of the series with a potential decisive third game to be played at the site of the lower seeded squad.', 'There will be no postseason action for the Chicago Sky, whose on sublime rookie Angel Reese is currently injured. ', 'Defeat by the Connecticut Sun on Thursday ensured the Sky finished on a five-game losing streak and will miss the postseason for the first time since 2018. ', 'Undermanned and injured, the Sky continued to play without star Reese and Kamilla Cardoso, as well as key veterans Chennedy Carter and Diamond DeShields.', '', '', '', '', '', '', '', '', '', '', '', '', '', '', '', 'Published by Associated Newspapers Ltd', 'Part of the Daily Mail, The Mail on Sunday & Metro Media Group']"
No title found,"https://www.hollywoodreporter.com/tv/tv-news/watch-stream-wnba-playoffs-basketball-games-online-1236007498/""],null,77,[[null,null,null,null,""NEWS_QUESTION_RESULT_GROUP","['', '', 'Sorry, the page you were looking for cannot be found.', 'Send us a tip using our anonymous form.', '', '', '']"
