Title,Link,Paragraphs
Caitlin Clark heads to 1st WNBA postseason and Aces look for threepeat as playoffs begin Sunday,https://www.pressdemocrat.com/article/sports/wnba-basketball-playoffs/,"['Caitlin Clark will make her first appearance in the WNBA playoffs in the arena where she started her professional career.', 'The Indiana Fever will play in Connecticut on Sunday as the league’s postseason gets underway with four best-of-three series. The two-time defending champion Las Vegas Aces will host Seattle, top-seed New York will play Atlanta and Minnesota faces Phoenix.', '', 'Clark, who had a record-breaking rookie season, will try to lead Indiana to its first playoff win since 2015, when current Sun coach Stephanie White was in charge of the Fever.', 'This is the third straight postseason the league will use a best-of-three format with the better seeded team hosting the first two games. A decisive third game would be played at the home of the lower-seeded team.', 'Las Vegas aims to become the first team to win three consecutive titles since Houston won the first four WNBA championships.', 'Here’s a look at the four series that begin Sunday.', 'The Liberty had the best record in the league and fell just two wins short of the franchise’s first championship last year, losing to Las Vegas in four games. The Dream are in the playoffs for the second consecutive season, led by Tina Charles.', 'Season series: New York won three of the four games with the lone loss coming in the season finale, when the Liberty had nothing to play for and the Dream were fighting to get into the playoffs.', 'BetMGM odds to win championship: New York +125, Atlanta +50,000.', 'Major storylines: The Liberty’s chemistry has improved this season, the second with the core group of Breanna Stewart, Sabrina Ionescu, Jonquel Jones and Courtney Vandersloot playing together. Stewart has shown once again she’s one of the best players in the league and is a tough matchup. Atlanta is back in the playoffs for the second consecutive year — the first time that’s happened since 2013-14. Charles is a New York native, who played several seasons for the Liberty.', ""A’ja Wilson has been the best player in the league this year, raising her already impressive play to another level. She became the first player in league history to score over 1,000 points in a season and has been dominant on both ends of the court. The Aces started off slowly this season, while Chelsea Gray was out recovering from a foot injury suffered in the WNBA Finals last year. The team has come on strong lately. They've won nine of their last 10 games heading into the playoffs, including a win over Seattle on Tuesday. The Storm added Nneka Ogwumike and Skylar Diggins-Smith in the offseason to add to their competitive edge."", 'Season series: The Aces took three of the four games from the Storm this season.', 'BetMGM odds to win championship: Las Vegas +225, Seattle +2500.', 'Major storylines: The Aces are peaking at the right time to make a run at another championship, with Wilson, Gray, Kelsey Plum and Jackie Young leading the way. Las Vegas added Tiffany Hayes midway through the season and she’s been a solid spark off the bench. Las Vegas knows how to win in the playoffs and will be a tough out. Seattle’s concern is the health of Jewell Loyd, who missed the last three games with a knee injury. Without Loyd, the Storm will be hard-pressed to knock off the champions.', 'The Minnesota Lynx have been the surprise team of the season led by star forward Napheesa Collier. Minnesota took the Commissioner’s Cup title by defeating New York, indicating how good Cheryl Reeve’s team could be. Minnesota is one of the hottest teams heading into the playoffs. The Lynx had won 13 of 14 games before losing a meaningless contest to close out the regular season. The Mercury have been on the other end of the spectrum, heading into the playoffs with seven losses in their last 10 games.', 'Season series: The Lynx won three of the four meetings this season, with all victories coming by double digits.', 'BetMGM odds to win championship: Minnesota +270, Phoenix +10,000.', ""Major storylines: Diana Taurasi hasn’t said whether she’s going to retire at the end of this season or not, but Phoenix honored the league's all-time leading scorer on Thursday as if it was the end of her career. The Mercury have the talent to make a run in the playoffs with Taurasi, Brittney Griner, Natasha Cloud and Kahleah Copper leading the way. They may just be hard-pressed to beat the talented Lynx, who have been playing extremely well. Since winning their last title in 2017, Minnesota has won only one playoff series, beating Phoenix in 2020."", 'All eyes will be on Clark as she makes her postseason debut. The Fever struggled early in the season with a difficult schedule, but have really come on strong after the Olympic break. They had the first .500 or better season since 2016 — the last time the team made the playoffs finishing at 20-20. Clark, who set the league record for assists and the rookie mark for points, has help from Aliyah Boston and Kelsey Mitchell. Connecticut has been to eight straight postseasons — the longest active streak. Led by Alyssa Thomas and DeWanna Bonner, the Sun look to end Clark’s first year.', 'Season series: The Sun won three of the four meetings, but the Fever took the last one. The three Connecticut wins all came within the first month of the season.', 'BetMGM odds to win championship: Connecticut +1,000, Indiana +2,500.', ""Major storylines: Clark has always thrived on the biggest stage and is ready for her playoff debut. For the Fever to succeed, they'll need other players to step up and help her. Clark averaged 16.3 points and 3.8 rebounds in the four meetings. The Sun are looking to get back to the WNBA Finals for the first time since 2022.""]"
How to buy Indiana Fever vs. Connecticut Sun tickets for the WNBA Playoffs,https://www.businessinsider.com/guides/tickets/how-to-buy-indiana-fever-connecticut-sun-tickets-wnba-2024,"['When you buy through our links, Business Insider may earn an affiliate commission. Learn more', '', ""The WNBA Playoffs seeding was officially locked in last night, which means that you can finally know what each Round 1 match-up will entail. The Indiana Fever made the cut at no. 6 in the league, meaning that they'll square off with no. 3 Connecticut Sun in Round 1. We've put together everything you need to know about how to buy Indiana Fever vs. Connecticut Sun tickets for both confirmed and contingent games."", 'The WNBA Playoffs tip off on Sunday, September 22. Round 1 is played out of the best of three, meaning that each match-up has two games guaranteed and one contingent, should each team win one game right off the bat. Since the Sun is the higher-seeded team, Connecticut will host the first two games at the Mohegan Sun Arena, and then a third game will take place at Gainbridge Fieldhouse in Indianapolis, Indiana.', 'Below, you can find a full breakdown of the Fever vs. Sun 2024 Playoffs, including a schedule and a comparison of original and resale ticket prices. You can also browse tickets at your leisure on resale sites like StubHub and Vivid Seats.', ""The Indiana Fever vs. Connecticut Sun Round 1 Playoffs schedule begins on September 22 in Connecticut. The teams are also guaranteed to play a second game on September 25 in Connecticut. If each team wins one game, they'll head to Indiana for a third and final game. Typically, if a third game isn't necessary, purchasers are refunded or given a credit, but you should always double-check the exact terms and conditions of the service you are buying from before paying."", 'The chart below shows the cheapest available ticket listings on Vivid Seats, which have the most affordable starting prices of the three services we compared today.', ""Connecticut Sun tickets for the first two games went on sale last week, and Indiana Fever tickets for the potential third game go on pre-sale today. Original tickets are sold through the team's respective Ticketmaster pages. However, there aren't many tickets left for the first two games, and tickets are expected to go fast for the third, keeping in line with the rest of the Indiana Fever's home game sales this season. There are lots of tickets on resale websites like StubHub and Vivid Seats, which tend to have more variety in seating and pricing. If you're a first-time customer at Vivid Seats, you can use our exclusive code, INSIDER20, at check out for $20 off an order of $200 or more."", ""Tickets for the Indiana Fever vs. Connecticut Sun match-up vary depending on the date and location. At the time of writing, the cheapest remaining original standard tickets start at $133.65 for Game 1 and $116.25 for Game 2. On Vivid Seats, the cheapest resale listings start at $100 for Game 1 and $76 for Game 2. On StubHub, the cheapest resale listings start at $113 for Game 1, and no tickets are available for Game 2 yet. Overall, the cheapest ticket listings we've seen are on Vivid Seats."", ""Note: Certain services and regions prohibit the resale of tickets. Business Insider does not endorse or condone the illegal reselling of tickets, and entry into an event is at the venue's discretion."", 'You can purchase logo and accolade licensing to this story here.\n\nDisclosure: Written and researched by the Insider Reviews team. We highlight products and services you might find interesting. If you buy them, we may get a small share of the revenue from the sale from our partners. We may receive products free of charge from manufacturers to test. This does not drive our decision as to whether or not a product is featured or recommended. We operate independently from our advertising team. We welcome your feedback. Email us at reviews@businessinsider.com.', 'Jump to']"
"WNBA playoffs 2024: Indiana Fever, Caitlin Clark vs Connecticut Sun matchup in first round",https://www.indystar.com/story/sports/basketball/wnba/fever/2024/09/19/wnba-playoffs-2024-fever-vs-sun-matchup-in-first-round/75266075007/,"['(This story has been updated with new information)', ""The Indiana Fever will play the Connecticut Sun in the first round of the 2024 WNBA playoffs. The Fever are the league's No. 6 seed and the Sun are No. 3."", 'The Fever (20-20) are in the playoffs for the first time since 2016, the last time they finished .500. Likely Rookie of the Year Caitlin Clark (19.2 points, league-leading 8.4 assists, 5.7 rebounds) and Kelsey Mitchell (19.2 points, 40.2% 3-point shooting) lead the Fever offense, helped by fellow WNBA All-Star Aliyah Boston (14.0 points, 8.9 rebounds) and NaLyssa Smith (10.6 points, 7.1 rebounds).', ""More:Kelsey Mitchell injury scare 'nothing major.' Fever expect to have top scorer for playoffs."", ""The Sun (28-12) have six double-figure scorers (details below) and feature the league's stingiest defense, allowing 74 points per game. Connecticut takes care of the ball (12 turnovers per game) and forces opponents into a league-most 15 turnovers."", 'Alyssa Thomas was a member of the U.S. Olympic team that won the 2024 Paris Olympics. DeWanna Bonner and Brionna Jones were on the WNBA All-Star team that beat the Olympic squad in an exhibition. Tyasha Harris is a 2016 graduate of Heritage Christian High School in Indianapolis.', 'The Fever like to push the pace, while the Sun are happy to make it a halfcourt game. The team that imposes its style will likely have an advantage.', 'Sept. 22, Sunday: at Connecticut, 3 p.m. ET, ABC', 'Sept. 25, Wednesday: at Connecticut, 7:30 p.m., ESPN', '*-Sept. 27, Friday: at Indiana, TBA, ESPN2', '*-if necessary', 'The Sun own a 3-1 season edge this season, with the first three matchups coming in the first 11 games of the season.', 'May 14, at Connecticut: Sun 92, Fever 71', 'May 20, at Indiana: Sun 88, Fever 84', 'June 10, at Connecticut: Sun 89, Fever 72', 'Aug. 28, at Indiana: Fever 84, Sun 80', 'Six Sun players average in double figures. They traded for Marina Mabrey from the Chicago Sky to add 3-point skill.', 'DeWanna Bonner (15.0 points, 6.0 rebounds, 1.2 steals); Marina Mabrey (14.9 points, 42.4% 3-point shooting), Brionna Jones (13.7 points, 5.5 rebounds), DiJonai Carrington (12.7 points, 5.0 rebounds), Tyasha Harris (10.5 points), Alyssa Thomas (10.6 points, 8.4 rebounds, 7.9 assists)', 'With player number, name, height', '3, Tiffany Mitchell, 5-9', '4, Marina Mabrey, 5-11', '10, Olivia Nelson-Odada, 6-5', '21, DiJonai Carrington, 5-11', '22, Veronica Burton, 5-9', '24, DeWanna Bonner, 6-4', '25, Alyssa Thomas, 6-2', '42, Brionna Jones, 6-3', '45, Astou Ndour-Fall, 6-5', '51, Caitlin Bickle, 6-1', '52, Tyasha Harris, 5-10', ""Jealousy, fear, respect:How Caitlin Clark's been treated by WNBA players is complicated"", ""'Babysitting' is over:Clark's technical foul worries behind her for now"", 'Stephanie White, an Indiana basketball legend, is in her third season coaching the Sun. White won Indiana Miss Basketball at Seeger High School (1995), led Purdue to a national championship (1999), and played for (2000-04) and coached the Fever (2015-16).', 'Briann January, a former Fever player (2009-14), is an assistant coach.', 'The team plays in the Mohegan Sun casino in Uncasville.', ""Connecticut is a women's basketball hotbed. The UConn women's basketball team, coached by Geno Auriemma, has been a powerhouse for decades, winning 11 NCAA championships. The fandom has extended to the pros."", 'The franchise, originally the Orlando Miracle starting in 1999, moved to Connecticut in 2003.', ""No. They lost the WNBA Finals in 2004, '05, '19 and '22.""]"
"WNBA Playoffs Power Rankings: Liberty, Lynx, Aces the teams to beat heading into postseason",https://www.cbssports.com/wnba/news/wnba-playoffs-power-rankings-liberty-lynx-aces-the-teams-to-beat-heading-into-postseason/,"['', 'The 2024 WNBA playoffs have arrived, and the month-long sprint to crown a new champion begins on Sunday, when all four first-round matchups will begin. Those best-of-three series, in which the lower seed can force a deciding Game 3 at home, will either produce extreme drama or be over before we can blink. From there, we move to a pair of best-of-five semifinal series and another best-of-five showdown in the Finals. ', ""The bracket is set, the schedule is out and teams know the path they have to take to lift the trophy. Which of them has the best chance to do so? Before the action gets underway, here are CBS Sports' final power rankings of the season, the annual pre-playoffs edition. "", ""The Liberty sort of stumbled to the finish line by losing two of their last three games, but that shouldn't overshadow their body of work this summer. They have been the best team in the league all season long, and finished with the best offensive rating (107.0), third-best defensive rating (95.3) and best net rating (plus-11.7). They boast an All-Star starting five led by one of the two best players in the world in Breanna Stewart and have homecourt advantage throughout the playoffs. They are the team to beat. "", 'What a season for the Lynx, who won the Commissioner\'s Cup championship and went 14-2 after the Olympics to grab the No. 2 seed in the playoffs. They may not have the star power of some other contenders, but as Coach of the Year frontrunner Cheryl Reeve put it earlier this month, the players ""believe in each other and they believe in our collective."" The Lynx finished second in defense (94.8 defensive rating) and led the league in 3-point shooting (38.0%). Plus, the Liberty and Aces are both on the other side of the bracket, which is a boost for their chances to get to the Finals. ', ""For much of the season, the Aces were in disarray. Candace Parker retired, Chelsea Gray missed the first month and struggled to find a rhythm upon her return and head coach Becky Hammon repeatedly called out their lack of effort on the defensive end. While some of their warts cannot be totally ignored, they certainly look like a contender heading into the playoffs. They won nine of their last 10 to close the season, have the best player in the world in A'ja Wilson and know what it takes to win it all. The quest for a threepeat is back on in earnest. "", 'The Sun started the season 13-1, but went just 15-11 the rest of the way. They were also 4-9 against their fellow top-five teams and 24-3 against everyone else. An offseason trade to acquire Marina Mabrey did not juice their offense as much as they may have hoped, and they took fewer 3-pointers than any other playoff team. And yet, no one will want to see them in the playoffs. They are big, they are physical, they are experienced and they had the best defensive rating in the league (94.1). They are, in short, absolute hell to play against, and that will always give them a chance. ', 'The Storm ""won"" the offseason by signing Nneka Ogwumike and Skylar Diggins-Smith in free agency, but the team never quite meshed in the way they may have hoped. Ironically, that was in large part due to a very poor season by franchise stalwart Jewell Loyd. They finished seventh in the league in offensive rating (102.1) and last in 3-point percentage (28.8), which was the worst full season mark by any team since the 2021 Fever, who won only six games. Much like the Sun, their inability to score on a consistent basis is a major reason they struggled against fellow top-five teams (4-10) despite boasting a strong defense. It\'s hard to write them off given their talent and experience, but they have a tough path that starts with the back-to-back champion Aces. ', 'The Fever are back in the playoffs for the first time since 2016, thanks largely to No. 1 overall pick Caitlin Clark, who put together one of the best rookie seasons of all time. After the Olympic break, they really started to click, and had the best offensive rating in the league (109.6) by a wide margin in that span. Their ability to go on incredible scoring binges is matched only by their inability to stop anyone on the other end. Their 106.5 defensive rating post-Olympics is the worst of any playoff team. ', ""A winter filled with so much promise ultimately gave way to a rather disappointing season. The Mercury showed some flashes of brilliance on the offensive end, but were far too inconsistent and finished ninth in the league in defensive rating (105.4). It also doesn't help that Kahleah Copper may not be 100% heading into the playoffs due to a back injury that forced her to miss games down the stretch. There is a lot of talent on this team, enough to make them dangerous in a short series, but it's hard to see them making any sort of playoff run. "", ""It is a borderline miracle that the Dream are even in the playoffs considering how rocky their season was at times. They lost 15 of 18 heading into the Olympics and then had another stretch where they lost eight of 10 after the break. In fact, they were minutes away from being eliminated a week ago. Now that they're healthy, they aren't as bad as their record might indicate, but they don't have enough offense to make any noise in the playoffs. In fact, it would be a surprise if they even win a game against the Liberty. "", '© 2004-2024 CBS INTERACTIVE. ALL RIGHTS RESERVED.', 'CBS Sports is a registered trademark of CBS Broadcasting Inc. Commissioner.com is a registered trademark of CBS Interactive Inc.', 'The content on this site is for entertainment purposes only and CBS Sports makes no representation or warranty as to the accuracy of the information given or the outcome of any game or event. There is no gambling offered on this site. This site contains commercial content and CBS Sports may be compensated for the links provided on this site.', 'Images by Getty Images and Imagn', '', '', '']"
"Connecticut Sun Coach Stephanie White Insists Team Won't Try To Avoid Clark, Fever",https://www.outkick.com/sports/connecticut-sun-coach-stephanie-white-insists-team-wont-try-avoid-clark-fever,"[""UNCASVILLE, CT – While the Connecticut Sun easily clinched a playoff spot prior to Thursday night's regular season finale against the Chicago Sky, their first-round opponent is still undetermined. "", 'The most likely scenario, overwhelmingly so, is that the Sun will face the Indiana Fever and rookie sensation Caitlin Clark in the playoffs beginning on Sunday. ', ""Entering Thursday, Indiana is locked into the No. 6 spot in the WNBA standings, meaning they will play the No. 3 seed in the first round. Currently, that's the Sun. "", 'The only way that the Sun would not finish third is if they lose on Thursday to the Sky and then the Las Vegas Aces beat the Dallas Wings. ', ""Connecticut Sun head coach Stephanie White said her team won't throw the final WNBA regular season game to avoid Indiana Fever and Caitlin Clark in the playoffs. "", '(USA Today Network/Imagn Images)', 'In that case, the Aces and Sun would have the same record and Las Vegas would be awarded the higher seed thanks to their head-to-head record against the Sun this season (the Aces won all three matchups). ', 'But the Sun enter the matchup at home against Chicago as massive favorites (-900) and thus are extremely likely to capture the third seed in the WNBA playoffs. ', ""Unless, of course, they don't try that hard to win the game against the Sky, since losing would give them a chance not to play Indiana in the first round. "", ""That's an idea that's been floated around on social media. "", ""OutKick asked Stephane White, the Sun's head coach, if it entered her mind at all to play for a specific first-round postseason opponent."", '""I think the biggest thing that enters my mind is momentum,"" White responded. ""There are a lot of factors outside our control, and we want to go out and control what we can control."" ', 'When asked if she planned to rest her starters for the playoff run, White said no. ', '""We\'re going to play them,"" she said. She later added, ""We want to win."" \\', ""If that's the case, it looks like Sun-Fever is going to be the first round matchup. The Sun won the first three games of the series this season, but Caitlin Clark and the Fever beat Connecticut in the most recent matchup. "", ""Plus, the Fever are one of the hottest teams in the league thanks to Clark's comfort level rising in her first professional season. "", 'Should the Sun win Thursday night, Indiana and Connecticut will face off at Mohegan Sun Arena on Sunday. ', ""That's fitting, since that's exactly how these teams opened the season. "", 'UPDATE: White was true to her word as the Connecticut Sun starters played their usual minutes, and they demolished the Chicago Sun, 87-54, to secure the #3 seed in the NBA playoffs. ', 'Dan began his sports media career at ESPN, where he survived for nearly a decade. Once the Stockholm Syndrome cleared, he made his way to OutKick. He is secure enough in his masculinity to admit he is a cat-enthusiast with three cats, one of which is named ""Brady"" because his wife wishes she were married to Tom instead of him.', '', ""You are agreeing to OutKick's Terms of Use and Privacy Policy, but don't worry we don't spam."", 'DISCLAIMER: This site is 100% for entertainment purposes only and does not involve real money betting. Gambling related content is not intended for anyone under the age of 21. If you or someone you know has a gambling problem and wants help, call 1-800-GAMBLER.']"
"WNBA playoff schedule: Matchups, format, broadcast info","https://www.nbcbayarea.com/news/sports/caitlin-clark-wnba-playoff-schedule/3657488/?os\u003davefgi\u0026ref\u003dapp""]],[""WNBA","['Here’s everything to know about the 2024 WNBA playoffs and how it works.', ""It's time for one of the most highly anticipated postseasons in WNBA history."", ""How far can Caitlin Clark lead the Indiana Fever in her postseason debut? Can A'ja Wilson guide the Las Vegas Aces to the second three-peat in league history? Will Breanna Stewart help the top-seeded New York Liberty win their first championship in franchise history?"", '', ""All of those questions will soon be answered when the playoffs tip off this weekend. Here's everything you need to know about the 2024 WNBA postseason."", 'The WNBA playoffs begin on Sunday, Sept. 22.', 'The top eight teams in the WNBA -- regardless of conference -- make the playoffs.', 'Here are the matchups for the first round of the WNBA playoffs:', 'The first round of the WNBA playoffs features a best-of-three format where the higher seed hosts the first two games of the series and, if necessary, the lower seed hosts the decisive Game 3.', 'The semifinals and WNBA Finals both have a best-of-five format where the higher seed hosts Games 1, 2 and 5.', 'The WNBA playoffs will air on ESPN, ESPN2 and ABC. All games will stream on ESPN.com and the ESPN app.', 'Caitlin Clark makes her WNBA postseason debut on Sunday at 3 p.m. against the Connecticut Sun on ABC.', '', 'Here is the full schedule for the 2024 WNBA playoffs. All times ET. (*- if necessary):', 'No. 1 NEW YORK LIBERTY vs. No. 8 ATLANTA DREAM', 'No. 2 MINNESOTA LYNX vs. No. 7 PHOENIX MERCURY', 'No. 3 CONNECTICUT SUN vs. No. 6 INDIANA FEVER', 'No. 4 LAS VEGAS ACES vs. No. 5 SEATTLE STORM', 'SEMIFINALS', 'WNBA FINALS', '', '', '', '', '', '', '', '']"
