Title,Link,Paragraphs
New York Liberty clinch #1 seed after cruising by Washington Mystics 87-71,https://www.netsdaily.com/2024/9/17/24247777/liberty-vs-mystics-87-71-breanna-stewart,"['FILED UNDER:', 'For the second time in franchise history, the New York Liberty will own home-court advantage throughout the WNBA playoffs.', 'It took 39 games, but the New York Liberty have accomplished the first of their goals in 2024.', 'Such is life when expectations are sky high, and anything less than a championship is a disappointment. But the Liberty took one step toward their ultimate prize on Tuesday night, defeating the Washington Mystics on the road, thereby clinching the WNBA’s best record and home-court advantage throughout the postseason.', '“It was important for us as one of our goals,” said Sandy Brondello. “We set out trying to get that home-court advantage. Now, obviously, we still have to take care of our business in the playoffs, the first round, the second round. We know it’s going to be extremely hard, but getting home court, we have a great arena, we have great fans. We want to play in front of our fans as much as we can.”', 'New York could have clinched on Sunday afternoon, but suffered a doozy of a loss to the Minnesota Lynx, who thoroughly outplayed the hosts. In addition to the #1 seed dangling in front of them, Brondello called that performance another “big motivator” for the Liberty heading into Washington. The carrot and the stick.', 'There was also the possibility of a restful Thursday in the regular season’s final game, should the Liberty handle business on Tuesday. Whatever it was, New York’s starters came out plenty motivated, winning the first quarter 29-18. Though the 3-point shot for Brondello’s team never fully emerged, it didn’t need to. By way of transition opportunities, offensive rebounds, and plain old offensive execution...', '...New York outscored Washington 18-0 in the paint through ten minutes. It set the tone for what was nearly a wire-to-wire victory, a game in which all nine rotation regulars scored multiple buckets.', 'Breanna Stewart and Courtney Vandersloot were the tone-setters of the first quarter with two-way excellence, with Sabrina Ionescu and Jonquel Jones not far behind in the second quarter. Ionescu once again struggled from the field, but shot a quiet 2-of-8 rather than the 4-of-21 she shot on Sunday, and dropped seven assists. Before Jones battled foul trouble in the second half, she frequently ran in transition and sealed for deep post position, a viable offensive threat once again...', 'The Mystics have been resilient all season though, 13-12 since their 0-12 start, and that quality reared its head again. Ariel Atkins would lead all scorers with 22 points, continuing her personal tradition of killing New York, as Washington cut the margin to seven points early in the third quarter.', 'Alas, that was all she wrote. The Liberty ripped off a 19-4 run, finally hitting some threes and continuing to capitalize on Washington’s sloppy play, flipping turnovers into beautiful transition sequences...', 'It was the Germans’ turn to shine, as Leonie Fiebich and Nyara Sabally joined three other Libs in double-figures. Sabally continued to roll, rebound, and protect the rim as she’s done all season when healthy, an athletic punch off the bench few others teams can contend with.', ""Fiebich put a fitting cap on her season, breaking Maya Moore’s rookie record for most games with a plus-minus of at least +10, and Tuesday’s performance was the perfect example of why New York always wins her minutes. Deflections, cuts, timely rebounds, and seamless contributions to the team's offense at its best..."", '“We don’t win those all these games without her impact,” said Brondello. “Yes, she started some of the games, she was able to step in, she’s so versatile and then does whatever the team needs. And it’s great to just to see her grow around the team. So, yeah, All-Rookie, that’s a no-brainer. And Sixth Person of the Year. I think that should be a no-brainer as well.”', 'Whether or not voters agree with Brondello remains to be seen. But Fiebich’s case lies in the fact that she’s played the fourth-most minutes on a dominant team, and she has been a huge contributor to their success, not a hanger-on.', 'Now, the New York Liberty are no longer just dominant, but officially the WNBA’s best regular-season team. Is that their ultimate goal in 2024? Of course not.', 'But it is a big one, and they’ve accomplished it.', 'New York returns home to close the regular season with Fan Appreciation Night, where they’ll play the Atlanta Dream. The Dream can clinch the #8 seed and a first-round date with New York with a win, who may be prioritizing rest this coming Thursday, Tip-off is scheduled for 7:00 p.m. ET.', 'Gambling Problem? Call 1-800-GAMBLER (1-800-426-2537). Hope is here. GamblingHelpLineMA.org or call (800) 327-5050 for 24/7 support (MA). Visit www.mdgamblinghelp.org (MD). Call 877-8HOPE-NY or text HOPENY (467369) (NY). 21+ (18+ D.C.) and present in select states (for KS, in affiliation with Kansas Star Casino). Call 1-888-789-7777 or visit ccpg.org/chat (CT) or visit FanDuel.com/RG.', '', '', '', '', '', '', '']"
,https://www.audacy.com/podcast/espn-daily-a73f8/episodes/how-the-indiana-fever-forged-a-path-to-the-postseason-64aaf,"['Today • 32m', '32m', '29m', '34m', '43m', '', '', '', '', '', '', '', '', '© 2024 Audacy, Inc. All rights reserved.', '', '', '', '', '']"
WNBA round-up: Playoff picture set as record-breaking regular season comes to a close,https://www.cnn.com/2024/09/20/sport/wnba-regular-season-final-day-spt-intl/index.html,"['', 'It has been a WNBA season unlike any other.', 'The 2024 campaign has seen unprecedented growth, records shattered and an introduction to one of the most hyped rookie classes in the history of the league – and we still have the postseason to go.', 'Eight of the 12 WNBA teams make the playoffs and are seeded from one to eight, regardless of conference.', 'The regular season came to a close on Thursday night with all 12 teams in action. While some squads already knew where they stood heading into the playoffs, there were still some matters to be decided on the final day and storylines everywhere you looked.', 'The Phoenix Mercury fell to the Seattle Storm 89-70 on Thursday, but much off the attention was focused on what happened after the buzzer.', 'Diana Taurasi, widely considered to be one of the best women’s basketball players of all time, addressed the Phoenix crowd on the court after what was possibly her final regular season game ever.', 'The 42-year-old was drafted first overall by the Mercury in 2004 and has spent her entire WNBA career with the franchise. She is a former MVP, a three-time WNBA champion, six-time EuroLeague champion, six-time Olympic champion, an 11-time WNBA All-Star and the league’s all-time leading scorer.', 'It has been speculated that this will be Taurasi’s final season as an active player. While the rumors are still unconfirmed, she delivered an emotional speech to the adoring home faithful.', '“There’s really no place to start, but there’s always a place to finish,” she said. “It seems to be the same place, which, as you guys know, when I got here in 2004, I kinda knew I was going to be here for a long time. I had a feeling that this was home in a strange and mysterious way.', '“I want to thank every single coach, every single player, every single person that’s put on a WNBA jersey because it takes a village and our league is about uplifting each other and, in return, to see where we are now, 28 years later, for the ones who played before, this league is where it is now, we’re thankful for you guys, and we’re thankful for the next generation.', '“If it is the last time, it felt like the first time,” she added.', 'Taurasi will get at least one more opportunity to perform in front of the home crowd – the seventh-seeded Mercury will take on the No. 2 Minnesota Lynx in a best-of-three first round playoff series.', 'This season has seen record highs in attendance and viewership, continuing right until the end of the regular season.', '20,711 fans packed into Capital One Arena in Washington DC as the Mystics defeated the Indiana Fever, 92-91, making it the highest-attended WNBA game ever.', 'After breaking the single-season assist record earlier this month, transcendent rookie Caitlin Clark entered the game eight three-pointers shy of the single-season record of 128 set by Sabrina Ionescu in 2023.', 'Though Clark didn’t catch Ionescu’s tally in the game – she played just under 20 minutes with the 20-20 Fever having already secured the sixth seed – she made two triples to take her total to 122, passing Taurasi for second place.', 'Indiana’s return to the playoffs for the first time since 2016 marks an incredible turnaround for the team. The franchise found itself 3-10 to open the season, but caught fire after the Olympic break to claw its way back to .500 and secure a spot in the postseason.', '“Just really proud of their growth, their resiliency,” Fever head coach Christie Sides said after the game. “They went to work, they got better. We didn’t have the time early, but they just kept getting better as the season progressed.', '“They deserve the opportunity to play in these playoffs.”', 'The Mystics came into the game as the ninth seed, knowing that they would have to win to give themselves a chance of making the postseason. The game got off to the worst possible start for Washington, falling into a 20-2 deficit, but it mounted a huge comeback to steal the win.', 'Sika Koné led the way with 20 points and four other Mystics players scored in double figures in the crucial victory, but a playoff berth simply wasn’t to be, as the Atlanta Dream took the matter out of Washington’s hands.', 'The Dream edged out the Mystics for the eighth seed with a 78-67 win over the New York Liberty, with center Tina Charles etching her name into the record books in the process.', 'Charles, a former league MVP and an eight-time All-Star, pulled down her third rebound of the game in the first quarter to become the all-time WNBA rebounding leader with 4,007 boards, passing Sylvia Fowles for top spot.', 'Her record-breaking performance could not have come at a better time for Atlanta, which needed a lift heading into Thursday’s matchup on the road. The Dream entered the matchup as the eighth seed but had the Mystics hot on their heels only one game behind, and knew that only a win would guarantee a postseason berth.', 'According to Charles, however, the outcome was never in doubt.', '“We came here with our bags packed,” said the 35-year-old postgame. “We knew we’d take care of business. For us, honestly, the playoffs had started maybe like a week ago just because of the situation that we had been in.”', 'Charles also ended the game with 10 points and 10 rebounds to record her 194th career double-double, the most by any player in league history. Fowles was also the previous holder of this record.', 'The matchup also served as a playoff preview: Atlanta will take on the first-seeded Liberty in the first round of the postseason.', 'New York had already wrapped up the No. 1 spot prior to Thursday’s game, so it remains to be seen how the squad will fare against a revitalized Dream group when the season is on the line.', 'First round series are best of three games.', 'Away @ Home (Game 1)', 'No. 8 Atlanta Dream @ No. 1 New York Liberty', 'No. 7 Phoenix Mercury @ No. 2 Minnesota Lynx', 'No. 6 Indiana Fever @ No. 3 Connecticut Sun', 'No. 5 Seattle Storm @ No. 4 Las Vegas Aces', '© 2024 Cable News Network. A Warner Bros. Discovery Company. All Rights Reserved.\nCNN Sans ™ & © 2016 Cable News Network.', '', '', '']"
WNBA playoffs begin Sunday: Official postseason bracket released,https://www.kare11.com/article/news/nation-world/wnba-playoff-matchups-set/507-514ca037-3867-4c08-bb36-900beb161f6e,"['NEW YORK — The WNBA playoffs are set with the Atlanta Dream getting the eighth seed on Thursday night.', 'The postseason begins Sunday with four best-of-three matchups. The Dream face the top-seeded New York Liberty. The Minnesota Lynx, the No. 2 seed, will host the No. 7 seed Phoenix Mercury while the No. 3 Connecticut Sun will welcome the No. 6 seed Indiana Fever and sensational rookie Caitlin Clark.', 'The final opening round matchup is the two-time defending champion Las Vegas Aces, the No. 4 seed, hosting the fifth-seeded Seattle Storm.', 'Las Vegas is trying to become the first team to win three titles in a row since Houston won four straight in the first four seasons of the WNBA — from 1997 to 2000.', 'The better seeded team will host the first two games of the series with a potential decisive third game to be played at the site of the lower seeded squad.', 'Three of the eight playoff positions came down to the final day of the regular season.', 'The final playoff spot came down to the last day of the regular season. Atlanta needed a victory to clinch a spot and the Dream did just that by beating New York 78-67. The Liberty had already clinched the top seed. Connecticut knocked off Chicago 87-54 to secure the No. 3 seed.', '', '', '', '', '', '', '', '', 'IN OTHER NEWS', 'NEW YORK — Tech behemoth Oracle has agreed to settle a class action lawsuit for $115 million over allegations that it tracked consumer activity both on and offline.', ""The suit alleges Oracle captured, compiled, and sold individuals' data to third parties without their consent. Oracle maintains its practices were lawful, that it disclosed its activities, and it admitted no wrongdoing."", 'Under the class action settlement, Oracle will pay $115 million to establish a settlement fund, and anyone residing in the United States from August 19, 2018 to the present who was affected may be eligible to file a claim. The fund will also cover up to $28.75 million for attorneys fees and other costs. All valid claimants will receive the same amount of money, which is dependent on how many people file.', 'If you browsed the web, used geolocation services, or made in-store purchases electronically during the six-year period addressed in the settlement, you may be eligible. Allegedly, Oracle Advertising improperly collected personal data from these activities and subsequently sold or made that data available to third parties. The company allegedly did so using Oracle Advertising products including ID Graph and Data Marketplace.', '""All natural persons residing in the United States whose personal information, or data derived from their personal information, was acquired, captured, or otherwise collected by Oracle Advertising technologies or made available for use or sale by or through ID Graph, Data Marketplace, or any other Oracle Advertising product or service from August 19, 2018 to the date of final judgment in the Action"" are eligible, according to the settlement website.', 'The court will decide whether to approve the proposed settlement at a hearing on November 14, 2024.', 'Claims may be filed online on the official settlement website or by mail. Claims must be filed by October 17, 2024.', 'Shares of Oracle Corp, based in Austin, Texas, rose slightly on Friday.', '_____', '""The Associated Press receives support from Charles Schwab Foundation for educational and explanatory reporting to improve financial literacy. The independent foundation is separate from Charles Schwab and Co. Inc. The AP is solely responsible for its journalism.""', '', '', '', '', '', '', '', '', 'IN OTHER NEWS', '', '', '', '', '', '', '', '', '']"
Playoff-bound Indiana Fever resting for the match against Connecticut,https://www.wqad.com/video/news/national/playoff-bound-indiana-fever-resting-for-the-match-against-connecticut/526-7aee53be-71c5-455b-b970-d194da33840a,"['', '', '', '', '', '', '', '', '', '', '', '', '', '', '', '', '']"
"Mystics vs. Liberty final score: Washington loses, 87-71",https://www.bulletsforever.com/mystics/2024/9/17/24247686/washington-mystics-new-york-liberty-wnba-game-recap,"['FILED UNDER:', 'The Mystics lose to the Liberty and drop out of the 8th and final playoff spot with one more game left.', 'Mystics lose this one 87-71.', 'With the clinching the #1 seed on the line for this game, the New York Liberty wasted no time in this one opening up a 29-18 after the first frame of this one, going up by as much as 14 points.', 'In the first half, Liberty took control with stifling defense. The Mystics 10 first half turnovers turned into 13 points off of turnovers for the Liberty. For the game the Liberty finished with a huge 25-7 points off of turnovers advantage while holding the Mystics to just 37.7 percent shooting.', 'Liberty never really let up, even growing their lead to as much as 22 points.', 'For the Mystics, Ariel Atkins was the lone Mystic who seemed to get things going offensively, scoring 22 points on the night. Brittney Sykes suffered an ankle injury during the game and was ruled out early in the 4th quarter.', 'With the Mystics dropping this game they have dropped out of the 8th and final playoff spot for the playoffs. They will finish the season on Thursday at home against the Indiana Fever, with still a chance, although a small one, to make the playoffs.', '', '', '', 'Gambling Problem? Call 1-800-GAMBLER (1-800-426-2537). Hope is here. GamblingHelpLineMA.org or call (800) 327-5050 for 24/7 support (MA). Visit www.mdgamblinghelp.org (MD). Call 877-8HOPE-NY or text HOPENY (467369) (NY). 21+ (18+ D.C.) and present in select states (for KS, in affiliation with Kansas Star Casino). Call 1-888-789-7777 or visit ccpg.org/chat (CT) or visit FanDuel.com/RG.', '', '', '', '', '', '', '']"
Indiana Fever Will Face Connecticut Sun In WNBA Playoffs,https://www.si.com/onsi/womens-fastbreak/news/indiana-fever-will-face-connecticut-sun-in-wnba-playoffs-01j86cnemqcr,"[""It's official. Caitlin Clark's first postseason appearance will take place in the same place her first WNBA game did, in Connecticut against the Sun."", ""The Indiana Fever were locked into the sixth seed regardless of the result of the team's game against the Washington Mystics. However, the third seed was still to be determined going into the final night of regular season action."", ""But the Sun's win over the Chicago Sky sealed the playoff matchup most had expected. Which means Clark will renew her rivalry with DiJonai Carrington and company."", 'The two teams have met four times already, with the first three contests coming early in the year. The Sun won those initial three games.', 'The Fever took the most recent contest however. That win did take place in Indiana though.', 'This best-of-three series will start at Mohegan Sun Arena and the Fever will at least need to split the first two games in order to get back home to Gainbridge Fieldhouse.', ""It's clear that Clark and the Fever have come a long way since the season started and will have a chance to show just how much they've grown as the franchise returns to playoff action for the first time since 2016."", ""All eyes will be on Clark come game one on Sunday. She'll get a crack at proving there will be no postseason adjustment necessary like the one she had to make to joining the professional ranks."", ""We'll all see soon enough if CC and the Fever have improved enough to upset the Sun."", 'ROBIN LUNDBERG', ""Robin Lundberg is a media veteran and hoops head who has spent the bulk of his career with iconic brands like Sports Illustrated and ESPN. His insights have also been featured on platforms such as Fox and CNN and he can currently be heard hosting shows for Sirius XM and on his burgeoning YouTube show. And now he brings his basketball expertise to Women's Fastbreak on SI!"", 'Follow robinlundberg', ""© 2024\nABG-SI LLC\n- SPORTS ILLUSTRATED IS A REGISTERED TRADEMARK OF ABG-SI LLC. - All Rights Reserved. The content on this site is for entertainment and educational purposes only. All betting content is intended for an audience ages 21+. All advice, including picks and predictions, is based on individual commentators' opinions and not that of Minute Media or its related brands. All picks and predictions are suggestions only. No one should expect to make money from the picks and predictions discussed on this website. For more information, please read our Legal Disclaimer. Gambling content intended for 21+. If you or someone you know has a gambling problem, crisis counseling and referral services can be accessed by calling 1-800-GAMBLER.""]"
,https://www.marca.com/en/basketball/wnba/2024/09/20/66ece0bbca4741c2068b45c0.html,"['Aceptar y continuarConfiguration\n\nWith your consent, we and our partners use cookies or similar technologies to store, access, and process personal data like your visit on this website. You can withdraw your consent or object to data processing based on legitimate interest at any time by clicking on ""Learn more"" or in our Cookie Policy on this website.', 'We and our partners process data for the following purposesActively scan device characteristics for identification, Analizar su idoneidad para ofrecerle soluciones basadas en su red de telecomunicaciones, Create profiles for personalised advertising, Create profiles to personalise content, Develop and improve services, Enriching the profile with third-party information., Measure advertising performance, Measure content performance, Sharing your browsing analysis and interest groups with third parties., Storage and access to geolocation information for targeted advertising purposes, Storage and access to geolocation information to carry out marketing studies, Store and/or access information on a device, Understand audiences through statistics or combinations of data from different sources, Use limited data to select advertising, Use limited data to select content, Use precise geolocation data, Use profiles to select personalised advertising, Use profiles to select personalised content', '', ""The stage is set for Caitlin Clark as she'll battle the best in the WNBA with every matchup set for the playoffs"", '', '', '', '', '', '', '', '© Unidad Editorial Información Deportiva, S.L.U. All rights reserved.', 'Follow us']"
"WNBA playoff schedule: Matchups, format, broadcast info","https://www.nbcbayarea.com/news/sports/caitlin-clark-wnba-playoff-schedule/3657488/?os\u003davefgi\u0026ref\u003dapp""],null,77,[[null,null,null,null,""NEWS_QUESTION_RESULT_GROUP","['Here’s everything to know about the 2024 WNBA playoffs and how it works.', ""It's time for one of the most highly anticipated postseasons in WNBA history."", ""How far can Caitlin Clark lead the Indiana Fever in her postseason debut? Can A'ja Wilson guide the Las Vegas Aces to the second three-peat in league history? Will Breanna Stewart help the top-seeded New York Liberty win their first championship in franchise history?"", '', ""All of those questions will soon be answered when the playoffs tip off this weekend. Here's everything you need to know about the 2024 WNBA postseason."", 'The WNBA playoffs begin on Sunday, Sept. 22.', 'The top eight teams in the WNBA -- regardless of conference -- make the playoffs.', 'Here are the matchups for the first round of the WNBA playoffs:', 'The first round of the WNBA playoffs features a best-of-three format where the higher seed hosts the first two games of the series and, if necessary, the lower seed hosts the decisive Game 3.', 'The semifinals and WNBA Finals both have a best-of-five format where the higher seed hosts Games 1, 2 and 5.', 'The WNBA playoffs will air on ESPN, ESPN2 and ABC. All games will stream on ESPN.com and the ESPN app.', 'Caitlin Clark makes her WNBA postseason debut on Sunday at 3 p.m. against the Connecticut Sun on ABC.', '', 'Here is the full schedule for the 2024 WNBA playoffs. All times ET. (*- if necessary):', 'No. 1 NEW YORK LIBERTY vs. No. 8 ATLANTA DREAM', 'No. 2 MINNESOTA LYNX vs. No. 7 PHOENIX MERCURY', 'No. 3 CONNECTICUT SUN vs. No. 6 INDIANA FEVER', 'No. 4 LAS VEGAS ACES vs. No. 5 SEATTLE STORM', 'SEMIFINALS', 'WNBA FINALS', '', '', '', '', '', '', '', '']"
