Title,Link,Paragraphs
Blinken: Civilian protection ‘vitally important’ after Israeli strikes in Beirut,https://www.voanews.com/a/blinken-civilian-protection-vitally-important-after-israeli-strikes-in-beirut/7818707.html,"['Print', 'U.S. Secretary of State Antony Blinken on Friday urged Israel to take measures to protect civilians and ensure they are not caught “in a terrible crossfire,” as Washington continued its efforts to prevent a broader conflict in the Middle East and seek a diplomatic solution in Lebanon.', 'This came as fresh Israeli strikes in Gaza and Beirut resulted in numerous casualties. The Israeli military said it was targeting terrorist operatives.', 'Blinken said Lebanon’s future was for the Lebanese people to decide, not for any external actor.', ""“It's clear that the people of Lebanon have an interest, a strong interest, in the state asserting itself and taking responsibility for the country and its future. The presidency has been vacant for two years now, and for the Lebanese people, having a head of state would be very important, but that's for the Lebanese to decide, and no one else,” Blinken told reporters during a news conference in Vientiane, Laos."", 'U.S. officials have reiterated that Israel has the right to defend itself against terror attacks from Iran-backed Hamas and Hezbollah, as Israel expands its ground incursion into Lebanon.', ""The Pentagon said Friday that Defense Secretary Lloyd Austin spoke with his Israeli counterpart, Yoav Gallant, on Thursday to discuss Israel's operations in Lebanon."", ""Austin reaffirmed “ironclad support for Israel's right to defend itself” and said Washington was committed to a “diplomatic arrangement” that safely returned both Lebanese and Israeli civilians to their homes on both sides of the border."", 'Airstrikes in Beirut', 'In the Lebanese capital, two Israeli airstrikes late Thursday hit apartment buildings in the central part of the city — without any warning and far from the Hezbollah stronghold south of Beirut that Israel has bombarded nightly for more than two weeks.', 'The Lebanese Health Ministry put the toll at 22 dead and 117 injured, but the casualty numbers were expected to rise as rescuers continued to sift through the rubble Friday.', ""Israeli and Lebanese media speculated that the likely target was Wafiq Safa, the longtime head of Hezbollah's Liaison and Coordination Unit. There was no immediate confirmation that he was the target or whether he was killed."", 'At a news conference Friday, Hezbollah spokesperson Mohammad Afif said, “The battle with the enemy is still in its very early stages.”', 'Speaking outdoors with the rubble of destroyed buildings behind him in the group’s stronghold on the southern outskirts of the capital, Afif referred to Hezbollah rocket attacks that have gone as far south as Haifa, Israel, in recent days.', '“What happened in Haifa and the surroundings in the past few days proves that we are still in the beginning,” he said. “And I say to the enemy: You have only seen a few of our strikes.”', ""After a period of relative calm, Hezbollah began firing rockets at Israel following Hamas' October 7, 2023, terror attack on Israel, displacing tens of thousands on both sides of the border and leading to the current escalation."", 'UN peacekeepers attacked', 'In the south, peacekeepers with the U.N. interim force in Lebanon, known as UNIFIL, sustained Israeli fire for a second day. The mission said two Sri Lankan peacekeepers were wounded, one critically.', 'They were injured in a blast near an observation tower at the mission’s headquarters in Naqoura. The headquarters was also hit by Israel Defense Forces tank fire on Thursday, injuring two Indonesian peacekeepers.', 'UNIFIL said that at a separate position on Friday near the demarcation line between Lebanon and Israel at Labbouneh, several protective blast walls collapsed when an IDF armored bulldozer hit the perimeter and IDF tanks moved near the position.', 'Asked about Thursday’s attack at a news conference on the sidelines of the ASEAN summit in Laos, U.N. Secretary-General Antonio Guterres told reporters that the “incident is intolerable, and it cannot be repeated.”', '“Peacekeepers must be protected by all parties of the conflict, and what has happened is obviously condemnable,” Guterres said.', 'The IDF said of Friday’s incident that its soldiers “identified an immediate threat against them” and “responded with fire toward the threat.”', '“An initial examination indicates that during the incident, a hit was identified on a UNIFIL post, located approximately 50 meters from the source of the threat, resulting in the injury of two UNIFIL personnel,” the military said.', 'The IDF has told UNIFIL to move 5 kilometers (3 miles) north of the area, but the United Nations says its force is mandated to stay and do its job. The mission has taken some precautionary measures and plans to remain, the head of U.N. peacekeeping said Thursday.', 'Asked by VOA at a press encounter Friday at the White House if he was asking Israel stop firing at U.N. peacekeepers, President Joe Biden replied, “Absolutely, positively.”', 'In his call with the Israeli defense minister, Austin also emphasized the importance of ensuring the safety of UNIFIL forces in the area “and urged coordinating efforts to pivot from military operations to a diplomatic pathway as soon as feasible.”', 'France, which has historical links with Lebanon and 700 peacekeepers in UNIFIL, condemned “continued deliberate Israeli fire against” the force.', ""“These attacks constitute serious violations of international law and must cease immediately,” France's foreign ministry said in a statement Friday. “The Israeli authorities must explain themselves. France is therefore summoning the Israeli ambassador to France to the Ministry for Europe and Foreign Affairs today.”"", 'Italy’s government also formally protested to Israel and summoned the Israeli ambassador, after two bases with Italian peacekeepers were repeatedly hit Thursday.', 'UNIFIL has over 10,000 peacekeepers from more than 50 countries in south Lebanon.', 'The Lebanese army said two of its soldiers were killed and three wounded in an Israeli airstrike Friday near a military checkpoint in south Lebanon close to the border. There was no immediate comment from the Israeli military.', 'War in Gaza', 'On Thursday, an Israeli airstrike on a school in Gaza sheltering displaced people killed at least 27 people, according to Palestinian medical officials.', 'Israel said the strike targeted militants in a command center that was embedded inside the school.', 'The humanitarian situation in Gaza continues to deteriorate, with the World Food Program reporting that no food aid has entered the territory since October 1.', '“The main crossings into northern Gaza have been closed and will be inaccessible if this escalation continues,” U.N. spokesperson Farhan Haq told reporters.', 'He said the food program distributed its last remaining food stocks in northern Gaza to partners and community kitchens but it was barely enough to last two weeks.', 'The situation is also bad in southern Gaza.', '“There are no food distributions, and bakeries are struggling to secure wheat flour, which puts them at risk of shutting down any day,” Haq said. “Aid entering Gaza is at its lowest level in months. No one has received food parcels in this month due to constrained access of aid supplies.”', 'Despite the situation, the U.N. is preparing to start a second round of polio vaccinations for children in Gaza on Monday, and it appealed for the implementation of a humanitarian pause to safely enable the campaign. Nearly 600,000 children were vaccinated in the first round in early September, and they require a second dose to complete their protection. The virus has resurfaced in Gaza’s wastewater after a 25-year absence.', 'Region waits', 'Meanwhile, the region waits to see when and how Israel will retaliate against Iran for a large ballistic missile strike on October 1, and whether it will tip the region into a wider war.', ""Israel's war Cabinet met Thursday night, reportedly to sign off on its response."", 'Israel\'s defense minister said Wednesday that the retaliation would be ""deadly, precise and surprising.""', ""Biden has said he would not support an Israeli strike on Iran's nuclear sites. He spoke by phone with Prime Minister Benjamin Netanyahu on Wednesday to discuss the regional situation."", 'About 1,200 people were killed in Israel in the October 7, 2023, Hamas attack that triggered the yearlong war in Gaza. Some 250 people also were taken hostage, with about 100 of them still being held.', ""Israel's military campaign of air and ground attacks in Gaza has killed more than 42,000 Palestinians and wounded more than 97,700, according to the Gaza Health Ministry. The ministry does not differentiate between militants and civilians but has said just more than half were women and children."", 'Both Hamas and Hezbollah have been designated terrorist organizations by the United States, United Kingdom, European Union, Israel and others.', 'VOA State Department Bureau Chief Nike Ching contributed to this story from Vientiane, Laos. U.N. Correspondent Margaret Besheer, VOA White House Bureau Chief Patsy Widakuswara, VOA Pentagon Correspondent Carla Babb and VOA reporter Natasha Mozgovaya contributed to this report. Some information came from The Associated Press, Agence France-Presse and Reuters.', 'The Voice of America provides news and information in more than 40 languages to an estimated weekly audience of over 326 million people. Stories with the VOA News byline are the work of multiple VOA journalists and may contain information from wire service reports.', '']"
"US Wants Lebanon Solution, Not ""Broader Conflict"", Says Blinken",https://www.ndtv.com/world-news/us-wants-lebanon-solution-not-broader-conflict-says-antony-blinken-6770756,"['US Secretary of State Antony Blinken voiced hope Friday for a diplomatic solution in Lebanon and preventing a broader conflict, as he backed efforts by the fragile state to assert itself against Hezbollah.', 'Blinken again said that Israel, which has been carrying out deadly strikes on Lebanon, ""has a right to defend itself"" against Hezbollah, but said he was alarmed by the worsening humanitarian situation.', '""We continue to engage intensely to prevent broader conflict in the region,"" Blinken told reporters after an East Asia Summit in Laos.', '""We all have a strong interest in trying to help create an environment in which people can go back to their homes, their safety and security, kids can go back to school,"" he said.', '""So Israel has a clear and very legitimate interest in doing that. The people of Lebanon want the same thing. We believe that the best way to get there is through a diplomatic understanding, one that we\'ve been working on for some time, and one that we focus on right now.""', 'Later in the day Blinken spoke by phone with Lebanese Prime Minister Najib Mikati and parliament speaker Nabih Berri, according to a statement from the US State Department.', 'Lebanon\'s presidency has been vacant for two years, and Blinken stressed the ""the need to empower leadership that reflects the will of the people for a stable, prosperous, and independent Lebanon"".', '', '', 'He said that ""Lebanon cannot allow Iran or Hezbollah to stand in the way of Lebanon\'s security and stability"".', 'The statement did not mention discussions on a possible ceasefire between Israel and the Iran-backed group.', 'After a year of cross-border fire with Hamas ally Hezbollah over the Gaza war, Israel has expanded its operations in Lebanon.', ""Blinken said the United States would work to support the fragile Lebanese state to build itself up after Hezbollah's long-held sway."", '""It\'s clear that the people of Lebanon have an interest -- a strong interest -- in the state asserting itself and taking responsibility for the country and its future,"" he said.', 'He also said that the United States was voicing concern directly to Israel on the humanitarian situation in Gaza.', '""I have real concern about the inadequacy of the assistance that\'s getting to them,"" Blinken said, adding that the United States has been ""very directly engaged with Israel"" on the topic.', '(Except for the headline, this story has not been edited by NDTV staff and is published from a syndicated feed.)', 'Track Latest News Live on NDTV.com and get news updates from India and around the world']"
"US Focuses On Shaping Israeli Actions, Not Reviving Ceasefire",https://www.politicalfiber.com/daily-news/us-focuses-on-shaping-israeli-actions-not-reviving-ceasefire/8204/,"[' ', 'The United States has shifted its focus from reviving a potential ceasefire deal between Israel and Hezbollah to trying to shape and limit Israel’s military actions in Lebanon and against Iran, according to officials. After a US-led proposal for a ceasefire failed, there appears to be no immediate push to restart negotiations.', 'US officials indicate that despite efforts to halt the intensifying Israeli military campaign, which has claimed over 1,400 lives and displaced more than a million in under three weeks, Washington is now working to contain and influence Israeli actions rather than prevent them altogether. The Biden administration’s inability to curb Israel’s military operations in Lebanon has raised questions about the US’s influence, especially considering Israel’s similar disregard for calls for restraint in Gaza.', 'There is growing concern within the US government that what Israel initially described as a limited military campaign may expand into a prolonged and larger-scale conflict. Diplomatic efforts to mediate a ceasefire have stalled, both in Lebanon and in ongoing negotiations with Hamas.', 'American officials have acknowledged that while the US persuaded Israel to scale back a planned larger incursion into Lebanon, their ability to influence Israel’s military decisions remains limited. As one senior official noted, while they couldn’t prevent Israeli military action, they are trying to shape its scope.', 'The proposed ceasefire, initially put forward by the US and France, aimed to pause hostilities for 21 days to allow civilians on both sides of the border to return home. The US supported Israel’s efforts to target Hezbollah militants but voiced concerns about the potential for the conflict to spiral into a longer-term engagement.', 'The US also faces challenges in influencing Israel’s response to a recent missile attack by Iran. While the US has cautioned Israel against a disproportionate retaliatory strike, it remains unclear whether those warnings have been heeded. President Joe Biden has expressed opposition to Israel striking Iran’s nuclear facilities, but it’s uncertain if that position has successfully deterred Israeli plans.', 'US officials hope that Israeli Defense Minister Yoav Gallant’s visit to Washington may delay any major retaliatory actions against Iran, buying time for further consultations. However, some experts, such as former Israeli diplomat Alon Pinkas, argue that Israeli political dynamics may not align with this cautious approach.', 'Despite the current lack of progress, the US maintains that diplomacy remains the only solution to the conflict. White House officials say they will continue consultations with both Israeli and Lebanese leaders in hopes of finding the right moment to push for a ceasefire agreement. However, some challenges remain, including the unclear state of leadership within Hezbollah following recent Israeli airstrikes, and Lebanon’s own political instability.', 'The conflict in Lebanon poses additional risks for the US, especially as Israeli airstrikes have targeted areas near Beirut’s main airport, potentially jeopardizing the safety of American citizens still in the region. US officials are in discussions with Israel to ensure that evacuation routes remain open for civilians, particularly access to the airport.', 'In the meantime, while the US supports Israel’s efforts to weaken Hezbollah, it continues to urge caution in minimizing civilian casualties, with Pentagon officials reminding Israel to take civilian safety into account during operations.', 'As the conflict continues, the US appears to be balancing its support for Israel’s security interests with its diplomatic efforts to limit the scale of the fighting. With ceasefire negotiations stalled, the Biden administration is working to ensure that Israel’s actions do not escalate further, while attempting to mitigate the humanitarian impact of the ongoing violence.', ' ', 'Your email address will not be published. Required fields are marked *', 'Comment *', 'Name *', 'Email *', 'Website', 'Save my name, email, and website in this browser for the next time I comment.', '', 'Receive our email bulletin', '', 'I accept terms & conditions']"
,https://www.tehrantimes.com/news/504938/Amid-Israeli-aggression-US-pushes-for-an-anti-resistance-president,"['BEIRUT - In Lebanon’s political history “presidential vacuum” is a recurring case. The current one dates back to October 31, 2022, after the end of the term of former President Michel Aoun.', 'In a sceptical manner, and amid the raging US-Israeli genocidal war, the issue of electing a president has been brought back to the forefront as it is being proposed as a condition for stopping the aggression, in addition to implementing UN Security Council Resolution 1701.', 'Obviously, what the US is pushing for is not electing a president but accepting a president who satisfies the wishes of Washington and the imperialist West.', 'Currently, US Secretary of State Anthony Blinken has been entrusted with managing the entire Lebanese political file, along with the provocative pressure exerted by US envoy Amos Hochstein. In parallel, US Secretary of “War” Lloyd Austin has requested his Israeli counterpart, “War” Minister Yoav Galant, to “move from military operations to the diplomatic track quickly.”', 'Washington is pressuring at all levels to elect Army Commander Joseph Aoun as President of Lebanon. In an interview with Lebanon’s MTV (anti-resistance channel), Hochstein has highlighted Washington’s desire for “the presidential election to be held quickly.” This demonstrated Washington’s conviction that “Israel” is quite reluctant to proceed with its ground invasion of Lebanon. Hochstein’s statement has revealed Washington’s intention to create a buffer zone at the Lebanese-Palestinian border as soon as possible in fear of escalatory operations by Hezbollah in the upcoming weeks.', 'Lebanon’s elite and ordinary citizens fully realize that the United States is the main and only party concerned with stopping the aggression and that it has proposed this condition of “surrender” to blackmail the resistant people.', 'According to the Watson Institute for International and Public Affairs at Brown University, Washington spent no less than $22.76 billion on military aid to the occupying colonial entity between October 7, 2023 and September 30, 2024 (the largest recipient of US aid since World War II / the cumulative value of US aid to date is approximately $251.2 billion).', 'According to an agreement concluded under the Obama administration for the period 2019-2028, the Israeli occupation regime receives $3.8 billion annually in US military aid, including $500 million allocated to fund missile “defence” systems. However, this announced figure is not the actual value of US support; neither the Pentagon nor the State Department have provided comprehensive lists of the aid delivered to the occupation entity, as was the case with regard to the transfer of weapons to Ukraine.', 'Historically, the Israeli army has provided intelligence to the Israeli army and largely helped it economically, militarily, and diplomatically along with developing its arms industry. During the 1960s, the Kennedy administration was keen to increase this military aid as the US administration considered the occupation entity a strategic ally against the Soviet Union. After the signing of the Camp David Accords in 1978, military support increased steadily.', 'In March 2024, The Washington Post revealed that the Biden administration had concluded at least 100 arms deals with the occupation entity without informing Congress of the details of the deal. The quantity and type of arms are unknown.', 'Besides, in August 2024, the Biden administration announced other agreements worth $20.3 billion to be implemented through the Foreign Military Sales program, including 50 Boeing F-15 fighter jets at a cost of $18.8 billion. According to the Washington Post, the deals, which were not reported to Congress, include thousands of precision-guided munitions, small-diameter bombs, tunnel-busting bombs, and other lethal military aid.', 'In 2026, the Financial Times estimates the world’s 15 largest arms companies will receive cash flows of at least $52 billion (nearly double the amount they received in 2021). $26 billion to 5 major arms companies in the US due to increased military spending allocated to Ukraine and the colonial Israeli entity.', '', 'In this context, the US is making futile attempts to impose a president on the Lebanese as Washington is frightened that Hezbollah is regaining the momentum of its heroic operations in defence of Lebanon’s sovereignty and Iran has taken strenuous steps in defence of the Lebanese people.', 'Washington has just imposed new sanctions on Tehran in response to the legitimate military action carried out by Iranian forces against strategic targets in the occupied Palestinian territories.  Iranian Foreign Ministry spokesman Esmail Baghaei described the operation as a legal measure in accordance with international law and consistent with the exercise of the inherent right to self-defence.', 'The current war has exposed Washington’s bloody face; its constant incitement against the Lebanese resistance has failed. Washington has not learnt from previous historical experiences that the foolish ambition to eradicate any resistance movement is a failed behaviour. Further, the upcoming days will show that the international community’s -especially Islamic and Arab governments- procrastination will have a reactionary effect; their people will undeniably emulate the honourable resistance method of the Lebanese as the only legitimate path to freedom.', '', 'All Content by Mehr News Agency is licensed under a Creative Commons Attribution 4.0 International License.']"
