Title,Link,Paragraphs
US warns Israel not to attack Beirut airport – as it happened,https://www.theguardian.com/world/live/2024/oct/07/middle-east-crisis-live-updates-israel-hezbollah-strikes-october-7-beirut-lebanon-war-news?filterKeyEvents\u003dfalse\u0026page\u003dwith:block-6703a2a78f0818b7c81ce21d,"['This live blog is closed. You can read the latest report from our correspondents on the ground here', 'The US state department spokesperson, Matthew Miller, has called on Israel not to attack Beirut airport or the roads leading to it.', 'Earlier on Monday, Israel’s air force carried out a strike in the southern suburbs of Beirut, near the international airport, a security source told AFP.', 'Miller told reporters:', 'We think it’s very important that not only the airport be open, but that the roads to the airport be open, so that American citizens who want to leave can get out, but also citizens of other countries.', 'We’re ending our live coverage here, but will be back if any major news breaks.', 'For now, you can read the latest on the situation on the Israel-Lebanon border here:', 'In New York, protests marking 7 October have seen pro-Palestinian demonstrations grow to a blocks-long column that marched through Manhattan streets, avenues and landmarks.', 'Protesters spread a large Palestinian flag on a street near the New York Stock Exchange early Monday afternoon, while a smaller group of counter-protesters held an Israeli flag.', 'Associated Press journalists saw several people being taken into police custody at various points in the march. Police said multiple arrests were made; no further information was immediately available.', 'While the protesters paused to conduct a Muslim evening prayer at the southwestern corner of Central Park, the parents of American-Israeli hostage Omer Neutra shared their anguish from the park’s SummerStage venue.', '“We would never have imagined we would still be standing here a whole year later, with no news of him,” his mother, Orna Neutra, told hundreds of people at an event that drew New York’s governor, mayor, US senators and other elected officials. Her son, a New York-born Israeli soldier, turns 23 next week.', 'People around the world have marked the anniversary of the 7 October Hamas attacks, which left 1,200 people dead and sparked the conflict in Gaza.', 'Vigils paid tribute to the victims of the Hamas attacks, and the hostages in Gaza, and protests called for an end to the Israeli offensive, which has left nearly 42,000 people dead and tens of thousands injured.', 'Here’s a wrap from our video team looking at protests and vigils around the world.', 'French President Emmanuel Macron held meetings on Monday with the families of two French nationals who are being held hostage in the Gaza Strip and families of victims of the 7 October attacks who are living in France, Macron’s office said.\n\nMacron said France will do “everything possible” to push for a cease-fire and an agreement that would allow the release of Ohad Yahalomi and Ofer Kalderon, the French hostages, as a priority, the statement said.\n\nMacron expressed “the nation’s compassion” toward those affected by the 7 October attacks and told the families meeting at the Elysee presidential palace that France will stand by their side and continue to “fight tirelessly” against the rise of antisemitism.', 'The US State Department says that nearly 900 American citizens, green card holders and their families have now left Lebanon on US-contracted flights since late September.\n\nAnother 150 Americans, legal permanent residents and immediate family left Beirut on Monday on a flight to Istanbul, department spokesperson Matthew Miller said.\n\nThe US has so far organised eight flights — most to Istanbul but at least one to Germany — since fighting between Israel and Hezbollah intensified at the end of last month.\n\nEach of those flights, which cost $283 per person, has had a capacity of 300 passengers for a total of 2,400 seats, meaning that fewer than half of the available seats have been occupied.\n\nMiller said about 8,500 Americans citizens, many of them dual US-Lebanese nationals, have reached out to the US embassy in Beirut for information about how to leave the country.', 'Hezbollah launched around 190 rockets at Israel on Monday, the IDF reported, adding that most were targeting the north of the country.', 'Late on Monday, Hezbollah said that it had launched a “barrage” of rockets at a military intelligence base on the outskirts of Tel Aviv.', 'Air raid alerts were activated across the centre of the country. The IDF said “about five launches were detected that crossed from Lebanon, some of them were intercepted by the Air Force and the rest fell in an open area.”', 'At least 21 people, including five children and two women, were killed in strikes in central Gaza on Monday night, according to Al Aqsa Martyrs hospital, where the bodies were taken.', 'Two strikes hit houses in the Bureij refugee camp. An Associated Press journalist counted the bodies along with about a dozen wounded, including several children.\n\nEmergency responders said more people are thought to be under the rubble.', 'There was no immediate comment from the Israeli military on the reported attacks.', 'A short while ago, Joe Biden was asked what his message to the families of those still being held hostage in Gaza was.', 'The US president was leaving the White House for an event, after ceremonies were held to mark the anniversary of 7 October earlier in the day.', 'Biden told the reporter that he would be talking to some of the families later.', 'When asked whether he’d spoken to Israeli prime minister Benjamin Netanyahu, Biden replied “no”.', 'Air raid alerts have continued to sound in northern Israel.', 'In the last hour, sirens have gone off in the city of Kiryat Shmona and Rosh Hanikra, both locations lie right on the border with Lebanon.', 'More on the late night strikes on Beirut’s southern suburbs.', 'The country’s National News Agency (NNA) reported that the area was “the target of two raids” late on Monday. The attacks came after Israel’s military had issued a warning to inhabitants of the area. Several strikes had already hit the suburbs earlier in the evening.', 'A correspondent from the AFP news agency reported seeing smoke rising from the suburbs.', 'NNA said that Israeli strikes also hit areas in southern Lebanon, including coastal villages, after the Israeli army on Monday had said it would expand its operations against Hezbollah to Lebanon’s coast south of the Al-Awali river.', 'It’s 1am in Gaza, Beirut and Tel Aviv. Here’s a recap of the latest developments:', 'Israel launched new strikes on Beirut’s southern suburbs late on Monday, hours after intense Israeli airstrikes on southern Lebanon with 100 aircraft targeting about 120 sites in the space of an hour, according to the country’s military. Lebanese state media said two new strikes hit Beirut’s southern suburbs on Monday night, shortly after Israel’s military issued a warning to inhabitants of the area.', 'Israel’s military also declared areas around a number of towns in northwest Israel as closed to the public on Monday. The Israel Defense Forces (IDF) announced that a “new closed military zone” would be imposed along the border with Lebanon would now include the towns of Shlomi, Rosh Hanikra, Hanita, Arab al-Aramshe and Adamit. A separate IDF statement warned Lebanese civilians to avoid being on the beach or on boats on the coast from the Awali River southward until further notice.', 'At least 1,400 Lebanese people, including civilians, medics and Hezbollah fighters, have been killed and 1.2 million driven from their homes. In southern Lebanon an Israeli strike late on Sunday killed at least 10 firefighters, the latest in a series of strikes that have killed dozens of first responders, according to Lebanon’s health ministry. Lebanon’s state-run National News Agency reported more than 30 strikes overnight into Sunday.', 'Hezbollah said it had targeted an Israeli military intelligence base near Tel Aviv on Monday. The Israeli military said sirens sounded in central Israel after approximately five projectile launches were identified crossing from Lebanon into Israeli territory. The military said some projectiles were intercepted, while the rest fell in open areas.', 'Israel also intensified its bombardment of northern Gaza, calling for evacuations of the north of the territory amid renewed military operations. Israeli tanks advanced into Jabalia on Monday, the largest of the Gaza Strip’s eight historic urban refugee camps, after encircling it, residents said. “We are in a new phase of the war,” the Israeli military said in leaflets dropped over the area. “These areas are considered dangerous combat zones.”', 'At least 41,909 Palestinian people have been killed and 97,303 injured in Israeli strikes on Gaza since 7 October 2023, the Gaza health ministry said in a statement on Monday. The territory’s health ministry said the toll included 39 deaths in the previous 24 hours.', 'Ceremonies were held across Israel on Monday as the country marked the first anniversary of the 7 October Hamas attacks. Israel’s prime minister, Benjamin Netanyahu, vowed to continue fighting to “thwart any future threat against the state of Israel” in a televised address. As memorial events took place across Israel, violence continued to rage on multiple fronts, with Israel also expanding its ground operation into Lebanon with elements of a third division joining the fighting. Demonstrations and memorials marking the anniversary of the 7 October attacks on Israel and the ensuing war in Gaza took place across the world.', 'Families of Israeli hostages still held in Gaza gathered near Netanyahu’s Jerusalem residence and stood during a two-minute siren, replicating a custom from Holocaust Remembrance and Memorial Day. Out of 251 people taken hostage on 7 October 2023, an estimated 97 are still being held inside the Gaza Strip, including 34 who the Israeli military says are dead.', 'Joe Biden commemorated the anniversary of the 7 October attacks in Israel with a candle-lighting ceremony at the White House. The US president paid tribute in a statement earlier on Monday to “the deadliest day for the Jewish people since the Holocaust” and condemned the “vicious surge in antisemitism in America” since the attacks. Biden also spoke with Israel’s president, Isaac Herzog, on Monday.', 'Hezbollah has instructed fighters not to target Israeli forces near a UN peacekeeper base in the Lebanese border town of Maroun al-Ras, according to a statement by one of the group’s field commander on Monday. The Israeli military is setting up a forward operating base near a UN peacekeeping mission on the blue line in southern Lebanon. The base put peacekeepers at risk, said an official, who spoke on condition of anonymity due to the sensitivity of the situation.', 'Israel’s military claimed on Monday that it intercepted a surface-to-surface missile fired at central Israel from Yemen. The missile set off air raid sirens across large swaths of central Israel, sending residents running for shelter. Yemen’s Houthi group later claimed responsibility for the attacks. The Iran-backed group said they fired two missiles at military targets in the Jaffa area in central Israel.', 'Israel does not have confirmation that the potential successor to the former Hezbollah leader Hassan Nasrallah has died, a government spokesperson said. Asked if Israel could confirm the death of Hashem Safieddine, who chairs Hezbollah’s executive council, the Israeli spokesperson said: “When it is confirmed, as and when, it will be on the IDF (Israeli military) website.”', 'A 12-year-old Palestinian child was shot dead by Israeli security forces in Qalandia refugee camp in the Israeli-occupied West Bank on Monday, Palestinian news agency Wafa reported. It said seven other people, including three children, were wounded in the same incident. The child was named by the agency, citing the health ministry, as Hatem Ghaith. A 66-year-old Palestinian man was killed in a separate Israeli raid in the occupied West Bank on Monday, the Palestinian health ministry said. The ministry said Ziad Abu Haleel was killed when Israeli forces “attacked him during a raid on his home in Dura, south of Hebron”.', 'The UK prime minister, Keir Starmer, urged all sides to pull back from the brink in the Middle East as he addressed the House of Commons on the anniversary of the 7 October attack by Hamas on Israel. Starmer said stopping all arms sales to Israel will “never” be his position. The UK has withdrawn the families of its embassy staff working in Israel due to the escalation in fighting.']"
"US not trying to revive Hezbollah ceasefire deal, US officials tell CNN",https://www.jpost.com/breaking-news/article-823657,"[""The US is not actively seeking to revive a ceasefire deal between Israel and Hezbollah but is instead focusing its efforts on trying to limit Israeli operations in Lebanon and Israel's response to Iran, US officials told CNN on Monday."", 'By subscribing I accept the terms of use and privacy policy', '', '', '', '', '']"
"Cairo, Doha push back on US proposal for Lebanese political reform",https://www.jns.org/us-proposal-for-lebanese-political-reform-facing-resistance/,"['The United States wants to use Israel’s military offensive against Hezbollah as a springboard to remove the Iranian terror proxy from Lebanon’s political system. However, the move is garnering pushback from Egypt and Qatar.', 'According to a report on Wednesday in The Wall Street Journal, the Biden administration is pushing a plan to elect a new president in Lebanon, seeing the weakening of Hezbollah by Israel as an opportunity for serious reform in Beirut.', 'But the administration is running into Arab opposition. Secretary of State Antony Blinken called the leaders of Qatar, Egypt and Saudi Arabia in recent days to ask them to support the election of a new president. Senior White House official Amos Hochstein has also told Arab officials about the opportunity for a political breakthrough. The reception to the idea in Doha and Cairo was not welcoming, according to the Journal, which cited U.S. and Arab officials familiar with the discussions.', '“Officials from Egypt and Qatar—which have played a key role in cease-fire negotiations in both Gaza and Lebanon—told U.S. officials they view the American plan as unrealistic and even dangerous,” according to the article.', '“In talks with U.S. officials, they have argued that Israel will never succeed in destroying Hezbollah and that the group must be a part of any political settlement to the conflict.”', 'Cairo is also concerned that outside efforts to meddle in Lebanon’s domestic politics during the current crisis could raise the risk of fighting between political factions in a country that suffered a devastating civil war from 1975 to 1990.', 'In contrast to Cairo and Doha, Riyadh supports the U.S. initiative to remove Hezbollah from power, Saudi officials familiar with the matter told the Journal.', 'The Land of the Cedar has been without a president since Michel Aoun’s departure on Oct. 30, 2022.', 'The article highlights that Lebanon’s 128-member parliament chooses the president, with no single bloc holding enough seats to choose a new leader, underscoring the difficulty of achieving this without Hezbollah and its allies in the legislature.', 'The current prime minister is Najib Mikati, who holds the Sunni seat for the Azm Movement, which has no members in the parliament. The parliament speaker is Nabih Berri, from the Hezbollah-aligned Shi’ite Amal Party.', 'Both leaders said last week that they support the election of a new president, however, they have also expressed support for Hezbollah in the terror army’s conflict with Israel.', 'Hezbollah’s Deputy Secretary-General Naim Qassem this week rejected a ceasefire while Jerusalem continues its military campaign against the terror group.', '“As far as we are concerned, prior to the truce, any other discussion is out of place. If the enemy continues its war, the battlefield will decide [between us],” said Qassem.', 'However, Qassem for the first time signaled the terrorist organization’s approval of efforts to reach a truce in Israel’s military campaign in Lebanon, irrespective of the ongoing war against Hamas in Gaza.', '“We support the political efforts led by Berri under the banner of achieving a ceasefire,” the terrorist leader said in a statement.', 'Once a truce is “firmly established and diplomacy can reach it, all other details will be discussed and decisions will be made collaboratively,” he concluded.', 'Hochstein, after failing to reach a diplomatic solution following months of shuttle diplomacy between Beirut and Jerusalem, is continuing to push for a diplomatic solution. He tweeted on Oct. 4:', '“Lots of wrong, irresponsible reporting these last few days. #US did not ‘green light’ military operations in #Lebanon. Ultimately, only a diplomatic resolution will allow residents to return home. We continue to work with governments of Israel & Lebanon on best path to restore calm.”', 'In mid-September, Israeli Prime Minister Benjamin Netanyahu told Hochstein that “it will not be possible to return our residents without a fundamental change in the security situation in the north,” according to a readout from the Israeli Prime Minister’s Office.', 'While Jerusalem “appreciates and respects” the Biden administration’s support, it will “ultimately do what is necessary to safeguard its security and return the residents of the north securely to their homes,” he told Hochstein during a meeting at Israel Defense Forces headquarters in Tel Aviv.', 'Jerusalem has escalated its military offensive against Hezbollah since adding the safe return of tens of thousands of displaced residents to their homes in the north as an official war goal in mid-September. At the end of September, ground troops entered Lebanese territory for the first time.', 'Key Hezbollah leaders, including Hassan Nasrallah, have been killed in recent months, and the Israeli Air Force has engaged in relentless bombing of the Hezbollah stronghold of Dahiya south of Beirut, in addition to other aerial and ground attacks.', 'Shortly before the killing of Nasrallah, the United States and France had proposed a 21-day ceasefire.', 'The Iranian-backed terror army began near-daily rocket and drone attacks in support of Hamas on Oct. 8, the day after the Gaza-based terror group initiated a war by invading the northwestern Negev.', 'Hezbollah has launched more than 12,400 rockets, missiles and drones at Israel over the past year, killing more than 40 people and causing widespread damage.', 'Join the conversation.\nRegister here to post your comment. Already have an account? Login here.', ""I wrote a comment earlier that the enemy in Lebanon is shiite muslim and here we have shiite muslims aiming to maintain their control and domination. On one side this can be expected because of their mistaken view of superiority and supremacy but they are THE problem and THE problem has to be removed- totally. Which means, given the nature of this beast, they must be wiped out. Totally. As the people of the world are watching this, the shiite should be put in a category with german nazis and russian bolsheviks. They need to become less than insignificant. While the 'idea' may never be wiped out just as evil is never totally wiped out in this physical realm, the shiite along with like ideas must be rendered less than significant. Evil must be exposed and revealed to be the anti-God force they truly are. Their behavior reveals their wretched inherent darkness."", 'Bibi needs to send the best diplomats Israel has to offer to straighten out the Lebanon problem. My choice for the diplomatic role is the IDF and the Mossad. These two diplomats seem to get the best deals for Israel and the Jewish people.', '', '', '', '']"
US looks for Lebanon peace push,https://www.nwaonline.com/news/2024/oct/13/us-looks-for-lebanon-peace-push/,"['Hezbollah leadership loss creates opportunity for talks', 'October 13, 2024 at 3:18 a.m.', 'by MATTHEW LEE The Associated Press', '', ""WASHINGTON -- With Israel's sabotage and military operations in Lebanon taking out many of Hezbollah's senior leaders, some in Washington and elsewhere believe there may be a window for a new push to break the political deadlock in Lebanon to try to ease the escalating war."", 'To that end, U.S. Secretary of State Antony Blinken spoke by phone separately Friday with acting Lebanese Prime Minister Najib Mikati and parliament speaker Nabhi Berri about the need to resolve the situation, the State Department said.', ""Earlier in the week, Blinken spoke with his Saudi, Qatari and French counterparts about how a resolution -- particularly the election of a new Lebanese president -- might reduce tensions in the Middle East by getting Hezbollah to move its forces away from Israel's northern border to the line set out in a U.N."", '', 'Already a subscriber? Log in!', ""By 101LifeHacks – 67+ Genius Life Hacks You'll Wish You Knew Sooner"", 'Copyright © 2024, Northwest Arkansas Newspapers LLC.', 'All rights reserved.', 'This document may not be reprinted without the express written permission of Northwest Arkansas Newspapers LLC.', 'Material from the Associated Press is Copyright © 2024, Associated Press and may not be published, broadcast, rewritten, or redistributed. Associated Press text, photo, graphic, audio and/or video material shall not be published, broadcast, rewritten for broadcast or publication or redistributed directly or indirectly in any medium. Neither these AP materials nor any portion thereof may be stored in a computer except for personal and noncommercial use. The AP will not be held liable for any delays, inaccuracies, errors or omissions therefrom or in the transmission or delivery of all or any part thereof or for any damages arising from any of the foregoing. All rights reserved.', 'Do Not Sell or Share My Personal Information', '', '', '']"
US on Israeli bombing in Lebanon: Military pressure can enable diplomacy but has risk,https://www.yahoo.com/news/us-israeli-bombing-lebanon-military-195304368.html,"['', '', '', '', '', 'By Kanishka Singh', ""WASHINGTON (Reuters) - The U.S. government, reacting to Israel's heavy bombardment in Lebanon, said on Sunday that military pressure can enable diplomacy but can also lead to miscalculations."", ""Israeli air attacks battered Beirut's southern suburbs overnight and early on Sunday while dozens were killed separately in Gaza as the Israeli army launched a new incursion in the north."", ""The region has been on edge awaiting Israel's response to a missile attack from Iran last week that Tehran carried out in retaliation for Israel's escalations in Lebanon. The Iranian attack ultimately killed no one in Israel and Washington called it ineffective."", '""Military pressure can at times enable diplomacy. Of course, military pressure can also lead to miscalculation. It can lead to unintended consequences,"" a U.S. State Department spokesperson said in an emailed statement.', 'Defense Minister Yoav Gallant told CNN that Israel was coordinating its response to Iran with the United States but would make its own independent decisions.', '""Everything is on the table,"" CNN quoted him as saying.', 'The United States said it supports Israel going after extremist targets in Lebanon like Iran-backed Hezbollah militants but does not want the targeting of civilians or civilian infrastructure.', '""We\'re in conversations with Israel about all these factors now. We have been clear and consistent that further escalation is in no one\'s interest,"" the spokesperson added. ""Every civilian casualty is one too many.""', ""Washington's occasional condemnation of ally Israel over civilian death tolls in Gaza and Lebanon has mostly been verbal, with no substantive change in policy even as the United States has seen months of protests demanding an arms embargo."", ""Washington's goal is to reach a ceasefire in Lebanon to provide space for diplomacy, the State Department added."", 'The United States and France put forward a 21-day ceasefire proposal for the Israel-Lebanon border in late September. Washington and its allies also expressed support for a ceasefire in Gaza. However, efforts on both fronts have failed thus far.', 'Israel has since escalated its military campaign in Lebanon which in recent days has killed hundreds, wounded thousands and displaced over 1 million people. Israel says it is targeting Hezbollah.', 'French President Emmanuel Macron said over the weekend that shipments of arms to Israel should be stopped. Israel said such a step will serve the purposes of Iran.', ""A Gaza ceasefire deal between Israel and Palestinian Islamist group Hamas has not been reached due to gaps in exchanges of Israeli hostages and Palestinian prisoners as well as Israel's demand that it maintain presence in a corridor on the southern edge of the Gaza Strip bordering Egypt."", 'The latest bloodshed in the decades-old Israeli-Palestinian conflict was triggered on Oct. 7, 2023, when Hamas attacked Israel, killing 1,200 and taking about 250 hostages, according to Israeli tallies.', ""Israel's subsequent military assault on the Hamas-governed enclave has killed almost 42,000 Palestinians, according to the local health ministry, while displacing nearly the entire population of 2.3 million, causing a hunger crisis and leading to genocide allegations at the World Court that Israel denies."", '(Reporting by Kanishka Singh in Washington; Editing by Mark Porter)']"
