Title,Link,Paragraphs
Microsoft's quantum chip Majorana 1 is a few qubits short,https://www.zdnet.com/article/microsofts-quantum-chip-majorana-1-is-a-few-qubits-short/,"['If COBOL is so problematic, why does the US government still use it?', 'Microsoft says its Majorana 1 contains eight topological qubits and can scale to a million, though the details on how it will scale are scant.', 'Microsoft\'s quantum computing scientists announced they have finally realized a long-held goal of building a ""topological qubit"", the equivalent of a transistor for ordinary chips, that may help advance quantum computing. ', 'The qubit is the functional element of a quantum chip, called Majorana 1, based on an exotic particle, a hybrid of matter and anti-matter discovered in the past 20 years.', ""Also: Google's quantum breakthrough is 'truly remarkable' - but there's more to do"", '""Majorana 1 marks a transformative leap toward practical quantum computing,"" states Microsoft in the blog post by Chetan Nayak, head of quantum hardware.', ""However, the caveats suggest you should take Microsoft's breakthrough with a big grain of salt. "", ""Also: OpenAI's o3 isn't AGI yet but it just did something no other AI has done"", ""For one thing, there's skepticism about the veracity of Microsoft's claims, even with a highly technical report in this week's Nature Magazine by Microsoft's quantum researchers. "", 'In addition, the Majorana 1 is not even a beta product as far as computing goes, maybe not even alpha. It cannot do any useful work until it somehow is extended with many more qubits, known in technical terms as ""scaling"" the device.', 'The topological qubit is unlike other quantum devices because of the way it leverages a particular breakthrough in materials science.', 'The ""Majorana fermion"" is a particle with the property of being both matter and anti-matter. The particle existed as a hypothesis for decades until researchers confirmed its existence in 2012. The name of the Microsoft chip, Majorana 1, is a nod to the importance of the particle.', 'Microsoft is unique among quantum computing researchers by chasing the fermions as the root of their qubit endeavor. Microsoft claims the topological qubit could be far more useful in any ultimate quantum device because it is, in a sense, more ""digital"" than other quantum machines. ', ""Also: If you're not working on quantum-safe encryption now, it's already too late"", ""All quantum approaches have to measure the output of a qubit as if measuring a continuous variable like a flow of water. However, the topological qubit essentially alternates between two electrical states, so it's simpler to measure, as described in a separate technical paper posted by the Microsoft team on the arXiv pre-print server. "", ""Those elements of Microsoft's approach are mostly theoretical until proven. And there are grounds for caution because the very existence of a topological qubit is something that has to be inferred, rather than directly observed. "", 'In the Nature technical paper, Microsoft scientists claim to have indirectly measured the topological qubit inside Majorana 1, though some scientists briefed on the device have their doubts.', 'Lead author Morteza Aghaee and dozens of colleagues describe the Majorana 1 as a computer chip made of indium arsenide and aluminum. The chip is fashioned as a collection of nanowires that cause a reaction in quantum dots, leading to the topological qubit. ', 'The presence of the topological qubit is measured by an interferometer, a device that uses the intersection of light beams to measure the ""parity"" of the quantum dot.', ""Also: Google's AI Co-scientist is 'test-time scaling' on steroids. What that means for research"", 'However, Nature reporter Davide Castelvecchi notes in an overview article that Aghaee and team are careful to point out that their interferometer\'s tests ""do not, by themselves"" prove there are the necessary Majorana particles in the device. ', 'And Castelvecchi quotes one physicist, Steven Simon of the University of Oxford, UK, who says, ""There\'s no slam dunk to know immediately from the experiment"" that the qubits are made of topological states. ', 'Castelvecchi also notes: ""Some researchers are critical of the company\'s [Microsoft\'s] choice to publicly announce the creation of a qubit without releasing detailed evidence."" ', 'Castelvecchi, who has covered the quantum race for many years, notes that another Microsoft team made a similar claim in 2021 about topological qubits and had to retract it.', ""Also: Google's Gemini 2.0 AI promises to be faster and smarter via agentic advances"", ""In fact, this week's announcement comes many years after Microsoft originally expected to demonstrate a topological qubit. In 2018, in Barron's magazine, Microsoft's quantum team told the paper that the company would have a topological qubit ready by the end of that year. In a sense, the Majorana 1 is seven years late."", ""That's not a criticism so much as an example of how quantum in general, and Microsoft's quest, specifically, takes a lot more effort than people expect based on what's in a press release."", 'Which brings us to the more important caveat: Majorana 1 is not a computer chip. It is a prototype of a computer chip. ', ""Also: What is sparsity? DeepSeek AI's secret, revealed by Apple researchers"", ""Another thing Microsoft told Barron's in 2018 is that a functional quantum computer was only five years away. That prediction turned out to be too optimistic."", 'The Microsoft press piece about the recent achievement states, ""Today, the company has placed eight topological qubits on a chip designed to scale to one million."" ', 'It\'s important to note you need the full million to do any real computation. Microsoft insists the million target will be reached ""within years, not decades,"" but it\'s unclear how. ', 'The arXiv paper has lots of interesting information about expanding the Majorana chip from one qubit to multiple qubits, but it does not make any predictions about time frames.', ""Who's to say Microsoft won't produce a scaled-up Majorana in the coming years? If Microsoft's claims, so far, can be rapidly extended and validated, then there's reason to hope progress will be swift in scaling. "", 'However, without an explicit device roadmap or time frame, Microsoft has the same challenge Google has with the ""Willow"" quantum chip it unveiled in December: to prove it can be taken from qubit science into a working computer. ']"
Microsoft has a new quantum computer – but does it actually work?,https://www.newscientist.com/article/2469079-microsoft-has-a-new-quantum-computer-but-does-it-actually-work/,"['Advertisement', 'Researchers at Microsoft say they have created so-called topological qubits, which would be exceptionally resistant to errors, but their claim has been met with scepticism', 'By Karmela Padavic-Callaghan', '19 February 2025', '', 'Majorana 1, a quantum chip that relies on topological qubits', 'John Brecher/Microsoft', '', 'Microsoft researchers say they have created “topological qubits”, long sought-after components for a radically different kind of quantum computer. This isn’t the first time the firm has made this claim – it attempted to produce these error-proof quantum bits in a similar experiment in 2023, but the results weren’t fully conclusive, raising doubts among colleagues in the field about whether it has fully worked this time.', '', 'Read more', 'Why quantum computers are being held back by geopolitical tussles', '', 'Topological qubits could solve one of quantum computing’s biggest problems: all…', 'Advertisement', '', 'To continue reading, subscribe today for unlimited access', '', '', '', '', 'Existing subscribers', 'Advertisement', 'Explore the latest news, articles and features', 'News', 'Subscriber-only', 'Leader', 'Free', 'News', 'Subscriber-only', 'Analysis', 'Subscriber-only', 'Trending New Scientist articles', 'Advertisement', 'Download the app', 'gdg']"
Massive Microsoft Quantum Computer Breakthrough Uses New State Of Matter,https://www.forbes.com/sites/johnkoetsier/2025/02/19/massive-microsoft-quantum-computer-breakthrough-uses-new-state-of-matter/,"[""Microsoft's new Majorana 1 quantum computing chip"", 'Microsoft announced Wednesday that it has invented an entirely new kind of quantum computer. Its new quantum chip, Majorana 1, is a quantum processor analogous to transistors in classical computers’ semiconductor chips and offers a path to million-qubit systems in a single relatively small quantum computing fridge. That would enable the creation of a single quantum computer which would be more powerful than all classical computers on the planet. It would be incredibly useful for things like designing new battery substrates, inventing new drugs, simulating nuclear fusion reactors, inventing post-quantum cryptography methods, and much more.\n\nIntriguingly, Microsoft essentially created a new state of matter--not liquid, solid, gas, or plasma, but a topological superconductor--to make this happen.', 'The Majorana 1 takes its name from the Majorana zero mode, a tiny and mysterious form of matter that is a quasiparticle which acts like half of an electron and, unlike matter and antimatter, is its own antiparticle. (Imagine a pair of shoes: a Majorana zero mode is like a left and right shoe simultaneously.) Microsoft uses Majorana zero modes because they can store quantum information in a way that’s resistant to errors.', 'Microsoft believes that this development, a long 19 years in the making, will enable the construction of commercially usable and viable quantum computers within five years.', '“We’ll have a fault tolerant quantum computer, a real fault tolerant quantum computer in years, not decades,” says Dr. Chetan Nayak, who runs the quantum hardware program at Microsoft and has been working on this problem for almost two decades. “And once we have that, that’s the thing we’re going to build on to get out to utility scale.”', 'Microsoft has already built an eight-qubit proof of concept, which it has submitted to the Defense Advanced Research Projects Agency and has resulted in the company’s inclusion in DARPA’s final phase of the Underexplored Systems for Utility-Scale Quantum Computing (US2QC) program.', 'There’s a lot to break down in Microsoft’s announcement. Essentially, Dr. Nayak told me in a TechFirst podcast, it relies on four key breakthroughs:', 'Superconductivity is a state of matter, Nayak says, as much as liquid, gas, solid or plasma. Topological superconductors, which Microsoft doesn’t believe occur naturally in the universe, are composed of a materials stack including indium arsenide, aluminum and other materials, most of which Microsoft fabricated atom by atom.', '', '', '', '', '', '', '', '', '', '', '', '', '', '', '', '', '', '', '']"
Microsoft Claims Quantum-Computing Breakthrough—but Some Physicists Are Skeptical,https://www.scientificamerican.com/article/microsoft-claims-quantum-computing-breakthrough-but-some-physicists-are/,"['FEBRUARY 20, 2025', '3 MIN READ', 'Microsoft Claims Quantum-Computing Breakthrough—but Some Physicists Are Skeptical', 'With its ‘topological’ quantum computers, Microsoft aims to reach useful scales faster than competing technologies', 'BY DAVIDE CASTELVECCHI & NATURE MAGAZINE', 'Microsoft has unveiled its Majorana 1 quantum chip.', '© John Brecher for Microsoft', 'Join Our Community of Science Lovers!', 'Microsoft has announced that it has created the first ‘topological qubits’ — a way of storing quantum information that the firm hopes will underpin a new generation of quantum computers. Machines based on topology are expected to be easier to build at scale than competing technologies, because they should better protect the information from noise. But some researchers are sceptical of the company’s claims.', 'The announcement came in a 19 February press release containing few technical details — but Microsoft says it has disclosed some of its data to selected specialists in a meeting at its research centre in Santa Barbara, California. “Would I bet my life that they’re seeing what they think they’re seeing? No, but it looks pretty good,” says Steven Simon, a theoretical physicist at the University of Oxford, UK, who was briefed on the results.', 'At the same time, the company published intermediate results — but not the proof of the existence of topological qubits — on 19 February in Nature.', 'Topological states are collective states of the electrons in a material that are resistant to noise, much like how two links in a chain can be shifted or rotated around each other while remaining connected.', 'The Nature paper describes experiments on a superconducting ‘nanowire’ device made of indium arsenide. The ultimate goal is to host two topological states called Majorana quasiparticles, one at each end of the device. Because electrons in a superconductor are paired, an extra, unpaired electron will be introduced, forming an excited state. This electron exists in a ‘delocalized’ state, which is shared between the two Majorana quasiparticles.', 'The paper reports measurements suggesting that the nanowire does indeed harbour an extra electron. These tests “do not, by themselves” guarantee that the nanowire hosts two Majorana quasiparticles, the authors warn.', 'According to the press release, the team has carried out follow-up experiments in which they paired two nanowires and put them in a superposition of two states — one with the extra electron in the first nanowire, and the other with the electron in the second nanowire. “We’ve built a qubit and shown that you can not only measure parity in two parallel wires, but a measurement that bridges the two wires,” says Microsoft researcher Chetan Nayak.', 'DAN GARISTO', 'ANIL ANANTHASWAMY', 'DAVIDE CASTELVECCHI & NATURE MAGAZINE', 'KATHERINE WRIGHT', '“There’s no slam dunk to know immediately from the experiment” that the qubits are made of topological states, says Simon. (A claim of having created Majorana states, made by a Microsoft-funded team based in Delft, the Netherlands, was retracted in 2021.) The ultimate proof will come if the devices perform as expected once they are scaled up, he adds.', 'Some researchers are critical of the company’s choice to publicly announce the creation of a qubit without releasing detailed evidence. “If you have some new results not connected to this paper, why don’t you wait until you have enough material for a separate publication?"" says Daniel Loss, a physicist at the University of Basel, Switzerland. “Without seeing the extra data from the qubit operation, there is not much one can comment,” says Georgios Katsaros, a physicist at the Institute of Science and Technology Austria in Klosterneuburg.', '“We are committed to open publication of our research results in a timely manner while also protecting the company’s IP [intellectual property],” says Nayak.', 'Microsoft has also shared a roadmap for scaling up its topological machines and demonstrating that they can perform quantum calculations2. Vincent Mourik, a physicist at the Helmholtz Research Centre in Jülich, Germany, whose concerns helped to lead to the earlier retraction, is sceptical of the whole concept. “At a fundamental level, the approach of building a quantum computer based on topological Majorana qubits as it is pursed by Microsoft is not going to work.”', '“As we perform more types of measurements, it will become harder to explain our results with non-topological models,” says Nayak. “There may not be one single moment when everyone will be convinced. But non-topological explanations will require more and more fine-tuning.”', 'This article is reproduced with permission and was first published on February 19, 2025.', 'DAVIDE CASTELVECCHI is a staff reporter at Nature who has been obsessed with quantum spin for essentially his entire life. Follow him on Twitter @dcastelvecchi', ""First published in 1869, NATURE is the world's leading multidisciplinary science journal. Nature publishes the finest peer-reviewed research that drives ground-breaking discovery, and is read by thought-leaders and decision-makers around the world."", 'Which Knot Is Stronger? Humans Aren’t Great Judges', 'People are surprisingly bad at guessing knot strength, a study found', 'CLARA MOSKOWITZ, JEN CHRISTIANSEN', 'Why the News Feels Overwhelming—And How to Cope', 'An explanation of the science behind news fatigue, plus expert advice to take control and protect your well-being while staying engaged', 'MEGHAN BARTELS', 'Microsoft Claims Quantum-Computing Breakthrough—but Some Physicists Are Skeptical', 'With its ‘topological’ quantum computers, Microsoft aims to reach useful scales faster than competing technologies', 'DAVIDE CASTELVECCHI, NATURE MAGAZINE', 'This Backyard Bird Has a Lot to Teach Us about Sex Variability', 'White-throated Sparrows demonstrate that traits we usually associate with sex can be influenced by genes that are not on sex chromosomes', 'DONNA L. MANEY', 'Men Actually Crave Romantic Relationships More Than Women Do', 'Multiple-study analysis looks at why men’s emotional intimacy is much more difficult outside of romantic relationships', 'CLARISSA BRINCAT', '‘City Killer’ Asteroid’s Earth Impact Risk Rises and Falls Again', 'Asteroid 2024 YR4’s risk of hitting Earth is shifting with new data, astronomers say', 'LEE BILLINGS', 'Learn and share the most exciting discoveries, innovations and ideas shaping our world today.', 'Follow Us:', 'Scientific American is part of Springer Nature, which owns or has commercial relations with thousands of scientific publications (many of them can be found at www.springernature.com/us). Scientific American maintains a strict policy of editorial independence in reporting developments in science to our readers.', '© 2024 SCIENTIFIC AMERICAN, A DIVISION OF SPRINGER NATURE AMERICA, INC.\nALL RIGHTS RESERVED.', '', '', '', '', '', '', '', '', '', '', '']"
Physicists Question Microsoft’s Quantum Claim,https://www.wsj.com/science/physics/microsoft-quantum-computing-physicists-skeptical-d3ec07f0,"['FTSE 100', '8673.63', '0.16%', 'DAX', '22326.48', '0.17%', 'CAC 40', '8105.77', '-0.60%', 'SX5P', '4723.34', '-0.24%', 'FTSE MIB', '38247.14', '-0.45%', 'IBEX 35', '12955.80', '0.03%', 'FTSE 250', '20619.17', '0.03%', '', '', '', 'Advertisement', '', '', 'By', 'Feb. 21, 2025 5:18 pm ET', 'Listen', '(2 min)', 'Microsoft’s announcement of a quantum-computing breakthrough generated a wave of excitement this week—but physicists who have reviewed the work say they aren’t convinced of the finding.', 'The company claims to have created an elusive particle called a Majorana particle that one day could power a quantum computer, enabling it to crunch data exponentially faster than is currently possible. ', '', '', 'Includes unlimited digital access to The Wall Street Journal, MarketWatch, Barron’s and Investor’s Business Daily', 'WSJ', ""Includes unlimited digital access to WSJ's unrivaled journalism."", 'Already a subscriber? Sign in', 'Continue reading your article with\na WSJ subscription', '', 'Top stories chosen by WSJ editors', '', '', '', '', '', 'WSJ Membership', 'Customer Service', 'Tools & Features', 'Ads', 'More', 'Dow Jones Products', '', '', '', '', '', '', '', '']"
China-US chip war takes a quantum leap with breakthroughs declared on same day,https://www.scmp.com/news/china/science/article/3299670/china-us-chip-war-takes-quantum-leap-breakthroughs-declared-same-day,"['Peking University and Microsoft research teams’ papers reveal very different approaches to achieving stable, error-free qubits', 'The Chinese study used light to generate and control a network of interconnected quantum states, showing the potential to build a quantum network on a tiny chip – a crucial step towards a quantum-based internet where information is shared securely and efficiently.', 'One reviewer of the study called the achievement “an important milestone for scalable quantum information” and noted that similar experiments had previously been attempted in the US, Europe and Japan.', 'The technology moved closer to “harnessing millions of potential qubits working together to solve the unsolvable – from new medicines to revolutionary materials – all on a single chip”, the company wrote in a post on social media.', '']"
