Title,Link,Paragraphs
Microsoft deploys new state of matter in its first quantum computing chip,https://www.cnbc.com/2025/02/19/microsoft-reveals-its-first-quantum-computing-chip-the-majorana-1.html,"['', '', '', '', '', '', '', '', '', '', '', '', '', '', '', '', '', '', '', '', '', '', '', '', '', '', '', '', '', '', '', '', '', '', '', '', '', '', '', '', '', '', '', '', '', '', '', '', '', '', '', '', '', '', '', '', '', '', '', '', '', '', '', '', '', '', '', '', '', '', '', '', '', '', '', '', '', '', '', '', '', '', '', '', '', '', '', '', '', '', '', '', '', '', '', '', '', '', '', '', '', '', '', '', '', '', '', '', '', '', '', '', '', '', '', '', 'In this article', 'Microsoft\non Wednesday announced Majorana 1, its first quantum computing chip. ', 'The achievement comes after the company spent nearly two decades of research in the field, but Microsoft claims that building Majorana 1 required that it create an entirely new state of matter, which it is referring to as a topological state.', 'Microsoft’s quantum chip employs eight topological qubits using indium arsenide, which is a semiconductor, and aluminum, which is a superconductor.', '“The difficulty of developing the right materials to create the exotic particles and their associated topological state of matter is why most quantum efforts have focused on other kinds of qubits,” the company said in a blog Wednesday.', 'Understanding topological matter and getting it to work in building a quantum-computing chip required that Microsoft spray atom by atom to get the materials to line up perfectly, the company wrote in the blog.', '“Ironically, it’s also why we need a quantum computer — because understanding these materials is incredibly hard,” said Krysta Svore, Microsoft technical fellow, in the blog. “With a scaled quantum computer, we will be able to predict materials with even better properties for building the next generation of quantum computers beyond scale.”', 'A new paper in the journal Nature describes the chip in detail.', 'Technologists believe quantum computers could one day efficiently solve problems that would be taxing if not impossible for classical computers. Today’s computers use bits that can be either on or off while quantum computers employ quantum bits, or qubits, that can operate in both states simultaneously.', 'Google\nand IBM\nhave also developed quantum processors, as have smaller companies IonQ\nand Rigetti Computing\n.', 'Microsoft won’t be allowing clients to use its Majorana 1 chip through the company’s Azure public cloud, as it plans to do with its custom artificial intelligence chip, Maia 100. Instead, Majorana 1 is a step toward a goal of a million qubits on a chip, following extensive physics research.', 'Rather than rely on Taiwan Semiconductor\nor another company for fabrication, Microsoft is manufacturing the components of Majorana 1 itself in the U.S. That’s possible because the work is unfolding at a small scale.', '“We want to get to a few hundred qubits before we start talking about commercial reliability,” Jason Zander, a Microsoft executive vice president, told CNBC.', 'In the meantime, the company will engage with national laboratories and universities on research using Majorana 1. ', 'Despite the focus on research, investors are fascinated by quantum.', 'IonQ shares went up 237% in 2024, and Rigetti gained nearly 1,500%. The two generated a combined $14.8 million in third-quarter revenue. Further gains came in January, after Microsoft issued a blog post declaring that 2025 is “the year to become quantum-ready.”', 'Microsoft’s Azure Quantum cloud service, which lets developers experiment with programs and algorithms, offers access to chips from IonQ and Rigetti. It’s possible that a Microsoft quantum chip might become available through Azure before 2030, Zander said.', '“There’s a lot of speculation that we’re decades off from this,” he said. “We believe it’s more like years.”', 'Rather than exist as a stand-alone category, quantum computing might end up boosting other parts of Microsoft. For example, there’s Microsoft’s AI business, which has an annualized revenue run rate that exceeds $13 billion. Quantum computers could be used to build data used to train AI models, Zander said. ', '“Now you can ask it to invent some new molecule, invent some new drug, something that really would have been impossible to do before,” Zander said.', 'WATCH: Quantum computing comes into focus', 'Got a confidential news tip? We want to hear from you.', 'Sign up for free newsletters and get more CNBC delivered to your inbox', 'Get this delivered to your inbox, and more info about our products and services.', '© 2025 CNBC LLC. All Rights Reserved. \nA Division of NBCUniversal', 'Data is a real-time snapshot *Data is delayed at least 15 minutes. Global Business and Financial News, Stock Quotes, and Market Data and Analysis.', 'Data also provided by']"
Microsoft Outdoes Apple in Ambition,https://www.theinformation.com/articles/microsoft-outdoes-apple-in-ambition,"['Tech’s Winter It Item: The Humble Woolen Ski Sweater\nSave 25% and learn more', '', '', '', '', '', '', '', '', '', '', '', '', '', '', 'Subscribe to read the full article']"
Microsoft Unveils Quantum Computing Chip for Future Data Centers,https://www.bloomberg.com/news/articles/2025-02-19/microsoft-unveils-quantum-computing-chip-for-future-data-centers,"['', '', '', '', '', '', '', '', 'Chip Wars:', '', '', '', 'By accepting, you agree to our updated Terms of Service, including the arbitration provision and class action waiver. You understand that we process your information as described in the Privacy Policy, which may include sharing information about your use of Bloomberg.com with third parties.']"
,https://www.nytimes.com/2025/02/19/technology/microsoft-quantum-computing-topological-qubit.html,"['', '', '', 'Microsoft’s new “topological qubit” is not based on a solid, liquid or gas. It is another phase of matter that many experts did not think was possible.', '', '', '', '', '', '', '', '', '', '', '', '', '', '', '', '', 'We encourage you to review our updated Terms of Sale, Terms of Service, and Privacy Policy. By continuing, you agree to the updated Terms listed here.']"
Breakthrough quantum chip that harnesses new state of matter could set us on the path to quantum supremacy,https://www.livescience.com/technology/computing/quantum-processor-that-uses-entirely-new-state-of-matter-could-set-us-on-the-path-to-quantum-supremacy,"['Microsoft scientists have created a quantum processor that taps into a rare state of matter that was first theorized in the 1930s, paving the way for a processor with a million qubits within years.', 'When you purchase through links on our site, we may earn an affiliate commission. Here’s how it works.', 'Scientists at Microsoft have built a new quantum computing chip using a special category of material capable of tapping into a new state of matter. This breakthrough could enable researchers to build a single chip with millions of reliable qubits much sooner than experts predicted — possibly within just a few years rather than decades.', 'The new quantum processing unit (QPU), called ""Majorana 1,"" is an eight-qubit prototype chip built from the first material of its kind in the world — a topological conductor, or topoconductor. This can reach the ""topological"" state of matter and tap into the laws quantum mechanics under the right conditions in order to process the 1s and 0s of computing data in a quantum computer.', 'The new type of qubit, called a ""topological qubit,"" is stable, smaller, less power-draining and more scalable than a qubit made from a superconducting metal — the most common type of qubit used in quantum computers built by companies such as Google, IBM, and Microsoft itself.', '""We took a step back and said \'Ok, let\'s invent the transistor for the quantum age. What properties does it need to have?\',"" Chetan Nayak, Microsoft technical fellow and professor of physics at the University of California Santa Barbara, said in a statement. ""And that\'s really how we got here — it\'s the particular combination, the quality and the important details in our new materials stack that have enabled a new kind of qubit and ultimately our entire architecture.""', ""Related: Quantum simulation breakthrough will lead to 'discoveries impossible in today's fastest supercomputers,' Google scientists claim"", 'The fabrication of this QPU was only possible after researchers, for the first time, used the architecture to definitively observe and control an enigmatic subatomic particle with special properties called the ""Majorana fermion,"" or ""Majorana zero mode"" (MZM), theorized by mathematician Ettore Majorana in 1937.', '', 'Scientists have previously tried to create Majorana fermions to use for a new kind of quantum computing. Explorations of the Majorana fermion and its proposed use in quantum computers span many years, including a reported discovery of the particle in 2012 and in April 2024. Scientists in June 2023 also published a study reporting the discovery of the topological state of matter.', 'Get the world’s most fascinating discoveries delivered straight to your inbox.', ""Majorana's theory proposed that a particle could be its own antiparticle. That means it's theoretically possible to bring two of these particles together, and they will either annihilate each other in a massive release of energy (as is normal) or can coexist stably when pairing up together — priming them to store quantum information."", 'These subatomic particles do not exist in nature, so to nudge them into being, Microsoft scientists had to make a series of breakthroughs in materials science, fabrication methods and measurement techniques. They outlined these discoveries — the culmination of a 17-year-long project — in a new study published Feb. 19 in the journal Nature.', 'Chief among these discoveries was the creation of this specific topoconductor, which is used as the basis of the qubit. The scientists built their topoconductor from a material stack that combined a semiconductor made of indium arsenide (typically used in devices like night vision goggles) with an aluminum superconductor.', 'The researchers needed the right combination of these components to trigger the desired transition into the new topological state of matter. They also needed to create very specific conditions to achieve this — namely, temperatures near absolute zero and exposure to magnetic fields. Only then could they usher MZMs into existence.', '', 'To construct one qubit, which is less than 10 microns in size — much smaller than superconducting qubits — the scientists arranged a set of nanowires into an H shape, with two longer topoconducting wires joined in the center by one superconducting wire. They next induced four MZMs to exist on all four points of the H by cooling the structure down and tuning it with magnetic fields. Finally, to measure the signal when the device would be operational, they connected the H with a semiconductor quantum dot — equivalent to a small capacitor that carries charge.', 'Topoconductors differ from superconductors in the way they behave when burdened with an unpaired electron. In superconductors, electrons usually pair up — known as Cooper pairs — with an odd number of electrons (any unpaired electron) requiring a massive amount of energy to accommodate, or enter an excited state. The difference in energy between the ground state and the excited state is the basis for the 1s and 0s of data in superconducting qubits.', 'Like superconductors, topoconductors use the presence or absence of an unpaired electron as the 1s and 0s of computing data, but the material can ""hide"" unpaired electrons by sharing their presence among the paired electrons. This means there is no measurable energy difference when unpaired electrons are added into the system, making the qubit more stable at the hardware level and protecting the quantum information. However, it also means it\'s harder to measure the qubit\'s quantum state.', 'This is where the quantum dot comes in. The scientists beam a single electron from the quantum dot into one end of the wire, through the MZM, and it emerges from the other end, through another MZM. By blasting the quantum dot with microwaves as this happens, the returning reflection carries an imprint of the quantum state of the nanowires.', 'The accuracy of this measurement is approximately 99%, the scientists said in the study, noting that electromagnetic radiation is one example of an external factor that triggers an error once per millisecond, on average. The scientists said this is rare and indicates that the inherent shielding in the new type of processor is effective at keeping radiation out.', '""It\'s complex in that we had to show a new state of matter to get there, but after that, it\'s fairly simple. It tiles out. You have this much simpler architecture that promises a much faster path to scale,"" Krysta Svore, Microsoft\'s principal research manager, said in the statement.', 'Svore added this new qubit architecture, called the ""Topological Core,"" represents the first step on the path to creating workable 1 million-qubit quantum computers — likening its creation to the shift from building computers using vacuum tubes to transistors in the 20th century.', 'This is thanks to the smaller size and higher quality of the qubits, alongside the ease with which they can scale because of the way the qubits fit together like tiles, the scientists said in the study.', 'In the next few years, the scientists plan to build a single chip with a million physical qubits, which will, in turn, lead to useful scientific breakthroughs in fields like medicine, materials science and our understanding of nature that would be impossible to make using the fastest supercomputers.', '', ""—World's 1st hybrid quantum supercomputer goes online in Japan"", ""—Schrödinger's Cat breakthrough could usher in the 'Holy Grail' of quantum computing, making them error-proof"", '—New quantum computing milestone smashes entanglement world record', 'The quantum chip does not work in isolation, however. Rather, it exists in an ecosystem alongside a dilution refrigerator to achieve extremely cold temperatures, a system that manages control logic, and software that can integrate with classical computers and artificial intelligence (AI). The scientists said that optimizing these systems so that they can work at a much bigger scale will take years of further research. But this timeline may be expedited with further breakthroughs.', '""Those materials have to line up perfectly. If there are too many defects in the material stack, it just kills your qubit,"" Svore said in the statement. ""Ironically, it\'s also why we need a quantum computer — because understanding these materials is incredibly hard. With a scaled quantum computer, we will be able to predict materials with even better properties for building the next generation of quantum computers beyond scale.""', ""Keumars is the technology editor at Live Science. He has written for a variety of publications including ITPro, The Week Digital, ComputerActive, The Independent, The Observer, Metro and TechRadar Pro. He has worked as a technology journalist for more than five years, having previously held the role of features editor with ITPro. He is an NCTJ-qualified journalist and has a degree in biomedical sciences from Queen Mary, University of London. He's also registered as a foundational chartered manager with the Chartered Management Institute (CMI), having qualified as a Level 3 Team leader with distinction in 2023."", '', '', ""AI-designed chips are so weird that 'humans cannot really understand them' — but they perform better than anything we've created"", ""Quantum simulation breakthrough will lead to 'discoveries impossible in today's fastest supercomputers,' Google scientists claim"", 'China is building a space telescope to rival the JWST — and it could survive in orbit decades longer', 'Live Science is part of Future US Inc, an international media group and leading digital publisher. Visit our corporate site.', '© Future US, Inc. Full 7th Floor, 130 West 42nd Street, New York, NY 10036.']"
A new Microsoft chip could lead to more stable quantum computers,https://www.technologyreview.com/2025/02/19/1112072/a-new-microsoft-chip-could-lead-to-more-stable-quantum-computers/,"['The company says it is on track to build a new kind of machine based on topological qubits.', '', '', '', '', '', '', '', '', '', '', '', '', '', '', '', '', '', '', '', '', '', '', '', '', '', '', '', '', '', '', '', '', '', '', '', '', '', 'We use cookies to give you a more personalized browsing experience and analyze site traffic.See our cookie policy', '', '', '', '', '']"
New state of matter just dropped?,https://www.morningbrew.com/stories/2025/02/21/new-state-of-matter-just-dropped,"['Microsoft unveiled a potentially revolutionary quantum chip that it says is underpinned by a fourth state of matter.', 'Microsoft', '• 5 MIN READ', 'The company that gave the world Bing Maps says it has created a fourth state of matter to achieve a quantum computing breakthrough.', 'This week, Microsoft unveiled the Majorana 1 quantum chip, a microprocessor that harnesses the properties of an elusive material called a topological superconductor yielding particles that are neither a liquid or solid, nor a gas. Building on exotic physics research that the tech giant began 17 years ago, Microsoft outlined this new state of matter in a peer-reviewed paper published in the journal Nature.', 'Microsoft says its chip could be used to solve industrial-scale problems—like designing self-repairing construction materials and accelerating drug discovery—“in years, not decades.” That timeline stands at odds with chip overlord Nvidia CEO Jensen Huang, who tanked quantum computing stocks last month when he mused that useful quantum computers are at least 15 to 20 years away.', 'Microsoft’s quantum drop is thrilling theoreticians for whom the words “topological entanglement entropy” aren’t gibberish, but let’s look into what it means for the rest of us, and explore whether Majorana 1 is truly a harbinger of a computing revolution.', 'Microsoft’s research was supported by the Defense Advanced Research Projects Agency, the government agency tasked with funding cutting-edge research with national security applications. While currently in experimental mode, quantum computing holds the promise of ultra-powerful cryptography and the ability to simulate complex natural systems.', 'Infusing computers with quantum mechanics know-how enables them to store information via quantum bits that can take the value of a 1 and 0 simultaneously (they’re called qubits).', 'Typically, qubits are produced by using low temperatures to create superconductors or trapping particles in electric currents. The systems are extremely difficult to scale because qubits are fragile, tending to lose their 1-and-0 quantum state when the computer runs, leading to errors.', 'Morning Brew delivers quick and insightful updates about the business world every day of the week from Wall St. to Silicon Valley.', 'While Google says it lowered the error rate by grouping the qubits in a special grid formation, Microsoft claims to have created a different workaround.', 'Using sophisticated materials engineering, Microsoft’s researchers combined the semiconductor indium arsenide with aluminium, which is a superconductor. They fashioned the unique material into a pair of nanoscopic wires and brought them to an extremely low temperature, spawning particles that constitute an exotic state of matter, known as Majorana particles, with unique properties that make for less error-prone qubits.', 'Notably, the chip engages with the qubits digitally, making it easier to correct errors while operating at scale.', ""More research is needed to see whether this is the breakthrough that gets quantum computing out of the lab and into commercial use. While some researchers unaffiliated with Microsoft are optimistic, they warn that it's a bit of a Schrodinger’s qubit situation. Microsoft’s paper only presents intermediary results, which the company itself disclaims don’t actually prove that the qubits it created truly run on a topological superconductor."", 'Skepticism from some scientists notwithstanding, investors are enthused, buoying the entire quantum computing industry. The quantum computing ETF QTUM opened 1% in the green the day after the chip was announced on Wednesday.', 'Looking ahead…Microsoft said that it would have to pack its quantum chip with 100 qubits before it is commercially viable and projected that it could become available to cloud customers of Microsoft Azure for experimental tinkering by 2030.—SK', 'Morning Brew delivers quick and insightful updates about the business world every day of the week from Wall St. to Silicon Valley.', 'BUSINESS, WORK, AND MONEY BY MORNING BREW INC.', '© 2025 Morning Brew Inc.', 'All Rights Reserved.', '', '', '', '', '', '', '']"
