Title,Link,Paragraphs
This Week in AI: Microsoft Sees Quantum Breakthrough as Ai Pin Deflates,https://www.pymnts.com/artificial-intelligence-2/2025/this-week-in-ai-microsoft-sees-quantum-breakthrough-as-ai-pin-deflates/,"['If you’re interested in artificial intelligence (AI) news, here are the the latest in AI updates.', 'Let’s start with Microsoft’s quantum moment. It has created the world’s first ‘topoconductor,’ which is a new type of matter — not solid, liquid or gas — that has only previously existed in theory. The topoconductor forms the core of Majorana 1, its new quantum chip.', '“We believe this breakthrough will allow us to create a truly meaningful quantum computer not in decades, as some have predicted, but in years,” Microsoft CEO Satya Nadella wrote in a Wednesday (Feb. 19) LinkedIn blog post.', 'Quantum computing has been in development for decades, but its exponentially greater computing power has not found practical use due to instability, errors and cost. It also needs to scale to be useful.', 'Microsoft said its topoconductor, or topological superconductor, leads to a more stable qubit, or quantum bits used for processing information in quantum computers. This is opposed to today’s “classical” computer bits of 1s and 0s that are manipulated to perform computations.', 'But qubits aren’t stable. When they are destabilized, they turn into an ordinary bits and lose their quantum abilities that enable them to perform exponentially greater than classical computers.', '“The qubits created with topoconductors are faster, more reliable and smaller,” Nadella said. “They are 1/100th of a millimeter, meaning we now have a clear path to a million-qubit processor” or chip.', 'Nadella added that its palm-sized quantum chip can solve problems that “all the computers on Earth today combined could not!”', 'In December, Google unveiled its new Willow chip that can “reduce errors exponentially” as it scales using more qubits, according to a company blog post. It was able to do a benchmark calculation in less than five minutes that would take today’s fastest supercomputer 10^25 (septillion) years to do.', 'Figure’s humanoid robots are showing off skills we’ve always wanted robots to have, such as putting away our groceries, among other ordinary tasks.', 'The Nvidia-backed robotics AI startup unveiled Helix on Thursday (Feb. 20), a generalist vision-language-action model that gives a robot the combined ability to see, understand language and exercise control.', 'Figure said its robots can now pick up anything, even small household objects that they have never encountered before.', 'The video released by Figure shows its robots understanding the homeowner’s voice command to put away groceries in their right place. They pick up the items and decide where to place them — some in the fridge and others in cabinet drawers.', 'This is a big deal because the hardest part of making humanoid robots useful isn’t just getting them to move like humans — it’s getting them to generalize and adapt to new tasks in dynamic environments.', 'Figure aims to get its robots into factories, warehouses and ultimately, homes. If they pull this off at scale, we could be looking at a future where C-3PO-type robots of Star Wars fame become more than just science fiction.', 'Meanwhile, Elon Musk’s xAI on Wednesday launched Grok 3, its latest attempt to go toe-to-toe with OpenAI, Anthropic, Google and other AI rivals.', 'While early versions of Grok felt more similar to ChatGPT, Grok 3 outperformed top-of-the-line AI models from OpenAI, Google, Anthropic and new Chinese startup DeepSeek.', 'Grok 3 was trained on double the computing power as Grok 2: a cluster of 200,000 Nvidia H100 GPUs running on its own Colossus supercomputer.', 'The real question is how long Grok can hold on to its lead in performance. Meta is set to launch Llama 4, and OpenAI is releasing GPT-4.5 and GPT-5. Anthropic is also supposedly coming out with an updated model soon.', 'Finally, let’s talk about Humane’s Ai Pin, a wearable AI-powered smart device that its creators hoped would replace smartphones. It was a square device that users attached to the shirt like a brooch but using magnets. The idea was to evoke the Star Trek communicator.', 'The AI Pin projected information onto your hand and could send messages, answer calls, search the web, play music, take photos, translate conversations and more. Time magazine even named it among the best inventions of 2023.', 'The $699 device — later discounted to $499 — launched less than a year ago but immediately faced negative reviews from early adopters: The AI was slow. The interface was clunky. The device overheated. And don’t forget the $24 a month subscription fee (excluding taxes and other fees) just to use it.', 'Humane had some serious hype going in — a founding team of ex-Apple veterans and funding from OpenAI CEO Sam Altman, SoftBank, Microsoft and Salesforce CEO Marc Benioff (who owns Time).', 'But none of that mattered once people actually tried using it. The AI Pin was impractical and expensive.', 'However, HP is buying the startup for $116 million, a purchase that includes its technology, technical staff and patents, both granted and pending. The Humane team would become HP’s new AI innovation lab called HP IQ, tasked with making its computers, printers and scanners smarter.', 'In the meantime, the 10,000 early adopters of the AI Pin were told their devices will no longer work after Feb. 28.', 'The head of the House Judiciary Committee is demanding more clarity on Europe’s tech regulations.', 'As Reuters reported Sunday (Feb. 23), Rep. Jim Jordan (R-OH) wants European Union (EU) antitrust chief Teresa Ribera to clarify how she enforces the European Union’s rules governing Big Tech under the Digital Markets Act (DMA), saying they seem to target American firms.', '“We write to express our concerns that the DMA may target American companies,” Jordan wrote in a letter sent to Ribera, seen by Reuters. ', 'The letter, co-signed by Scott Fitzgerald (R-WI), chairman of the subcommittee on the administrative state, regulatory reform and antitrust, argues the rules place undue burdens on companies and give Europe’s tech firms an advantage. It also criticizes the 10% fines on global yearly revenues companies are subject to under the DMA.', '“These severe fines appear to have two goals: to compel businesses to follow European standards worldwide, and as a European tax on American companies,” the letter said.', 'The lawmakers gave Ribera until March 10 to respond to their letter. PYMNTS has reached out to the European Commission (EC) — the EU’s antitrust enforcement arm — for comment, but has not yet gotten a reply.', 'As Reuters notes, the letter came two days after President Donald Trump signed a memorandum saying the White House would scrutinize the DMA and its counterpart Digital Services Act (DSA) “that dictate how American companies interact with consumers in the European Union.”', 'Adopted in 2023, the DMA governs tech giants such as Google, Amazon, Meta and Microsoft, and is designed to provide a level playing field and greater consumer choice.', 'However, complaints about the DMA are not confined to just Republicans. As covered here in late 2023, a bipartisan group of lawmakers wrote to then President Biden with concerns that the new regulations unfairly target American tech companies.', 'They argued that the DMA designates five leading U.S. tech companies as “gatekeepers” while excluding many Chinese and European firms.', 'The news follows reports from last month that the EC was reconsidering its investigations into American tech companies ahead of Trump’s inauguration. One EU official said the shift was due to “tech oligarchs” being close to Trump, a situation that creates “a whole new ballgame,” per a report from the Financial Times.', 'We’re always on the lookout for opportunities to partner with innovators and disruptors.']"
Microsoft unveils chip it says could bring quantum computing within years,https://www.theguardian.com/technology/2025/feb/19/topoconductor-chip-quantum-computing-topological-qubits-microsoft,"['Chip is powered by world’s first topoconductor, which can create new state of matter that is not solid, liquid or gas', 'Quantum computers could be built within years rather than decades, according to Microsoft, which has unveiled a breakthrough that it said could pave the way for faster development.', 'The tech firm has developed a chip which, it says, echoes the invention of the semiconductors that made today’s smartphones, computers and electronics possible by miniaturisation and increased processing power.', 'The chip is powered by the world’s first topoconductor, which can create a new state of matter that is not a solid, liquid, or gas – making it possible to design quantum systems that fit in a single chip smaller than the palm of a hand, and to create more reliable hardware, a peer-reviewed paper published in Nature reports.', 'Paul Stevenson, a professor of physics at the University of Surrey, said Microsoft could be “very serious competitors” in the race to build the first reliable quantum computers if the company successfully built on this research.', '“The new papers are a significant step, but as with much promising work in quantum computing, the next steps are difficult and until the next steps have been achieved, it is too soon to be anything more than cautiously optimistic,” he said.', 'George Booth, a professor of theoretical physics at King’s College London, said the research represented an “impressive technical achievement”, albeit one whose value would probably become clear only with hindsight. “Whether a claim of ‘years’ [rather than decades before meaningful development] is accurate will remain to be seen,” he said.', 'Microsoft claims that the topoconductor offers a path to developing quantum systems that can scale to a million qubits – the delicate building blocks of quantum computers that are analogous to the ones and zeros computers currently use.', 'This could eventually produce the most powerful computers yet, based on quantum mechanics rather than classical physics, which would be capable of solving highly complex industrial and societal problems.', 'This could include breaking down microplastics into harmless byproducts; inventing self-healing materials for construction, manufacturing or healthcare; solving complex logistics supply chain problems; or cracking encryption codes.', 'Sign up to TechScape', 'A weekly dive in to how technology is shaping our lives', '', 'Earlier this month, the US Defense Advanced Research Projects Agency (Darpa) selected Microsoft’s topoconductor as one of two pathways to quantum computing it is exploring as part of a programme intended to determine whether it is possible to build an industrially useful quantum computer by 2033, much faster than most predictions.', 'The other approach is created by PsiQuantum, which is using silicon-based photonics, meaning light wave-based technology, to create a quantum computer based on a lattice-like fabric of photonic qubits.', 'Microsoft previously claimed to have developed topological qubits in a paper that had to be retracted after scientific flaws were pointed out.', 'Booth said that although Microsoft’s progress had been slow relative to some other companies, it had instead “focused on the long game by working on a system which is inherently more resilient to noise and interference” than the fragile basic quantum computers that competitors have been building for a few years.', '“These topological qubits protect the information they carry by using the properties of a new type of emergent particle, a Majorana fermion, which means that it is harder for this information to be lost as it is processed. However, [there is an] added layer of complexity when constructing these qubits when compared to competing architectures,” he said.', 'These Majorana particles had never previously been seen or made. Microsoft said they had to be “coaxed into existence with magnetic fields and superconductors”, which is why most quantum computing research has focused on other approaches.', 'Booth said the research represented a step in the direction of a very different platform that could “compete with the more mature technologies pioneered by the likes of Google”, though he added that there was still a long way to go in demonstrating that the technology could be scaled up.']"
Microsoft’s New Majorana 1 Processor Could Transform Quantum Computing,https://www.wired.com/story/microsoft-just-claimed-a-quantum-breakthrough-a-quantum-physicist-explains-what-it-means/,"['THIS ARTICLE IS republished from The Conversation under a Creative Commons license.', 'Researchers at Microsoft have announced the creation of the first “topological qubits” in a device that stores information in an exotic state of matter, in what may be a significant breakthrough for quantum computing.', 'At the same time, the researchers also published a paper in Nature and a “road map” for further work. The design of the Majorana 1 processor is supposed to fit up to a million qubits, which may be enough to realize many significant goals of quantum computing—such as cracking cryptographic codes and designing new drugs and materials faster.', 'If Microsoft’s claims pan out, the company may have leapfrogged competitors such as IBM and Google, who currently appear to be leading the race to build a quantum computer.', 'However, the peer-reviewed Nature paper only shows part of what the researchers have claimed, and the road map still includes many hurdles to be overcome. While the Microsoft press release shows off something that is supposed to be quantum computing hardware, we don’t have any independent confirmation of what it can do. Nevertheless, the news from Microsoft is very promising.', 'By now you probably have some questions. What’s a topological qubit? What’s a qubit at all, for that matter? And why do people want quantum computers in the first place?', 'Quantum computers were first dreamed up in the 1980s. Where an ordinary computer stores information in bits, a quantum computer stores information in quantum bits—or qubits.', 'An ordinary bit can have a value of 0 or 1, but a quantum bit (thanks to the laws of quantum mechanics, which govern very small particles) can have a combination of both. If you imagine an ordinary bit as an arrow that can point either up or down, a qubit is an arrow that can point in any direction (or what is called a “superposition” of up and down).', 'This means a quantum computer would be much faster than an ordinary computer for certain kinds of calculations—particularly some to do with unpicking codes and simulating natural systems.', 'So far, so good. But it turns out that building real qubits and getting information in and out of them is extremely difficult, because interactions with the outside world can destroy the delicate quantum states inside.', 'Researchers have tried a lot of different technologies to make qubits, using things like atoms trapped in electric fields or eddies of current swirling in superconductors.', 'Microsoft has taken a very different approach to build its “topological qubits.” They have used what are called Majorana particles, first theorized in 1937 by Italian physicist Ettore Majorana.', 'Majoranas are not naturally occurring particles like electrons or protons. Instead, they only exist inside a rare kind of material called a topological superconductor (which requires advanced material design and must be cooled down to extremely low temperatures).', 'A Microsoft explainer on the Majorana 1 processor.', 'Indeed, Majorana particles are so exotic they are usually only studied in universities—not used in practical applications.', 'The Microsoft team say they have used a pair of tiny wires, each with a Majorana particle trapped at either end, to act as a qubit. They measure the value of the qubit—expressed by means of whether an electron is in one wire or the other—using microwaves.', 'Why has Microsoft put in all this effort? Because by swapping the positions of Majorana particles (or measuring them in a certain way), they can be “braided” so they can be measured without error and are resistant to outside interference. (This is the “topological” part of “topological qubits.”)', 'In theory, a quantum computer made using Majorana particles can be completely free of the qubit errors that plague other designs.', 'This is why Microsoft has chosen such a seemingly laborious approach. Other technologies are more prone to errors, and hundreds of physical qubits may need to be combined together to produce a single reliable “logical qubit.”', 'Microsoft has instead put its time and resources into developing Majorana-based qubits. While the company is late to the quantum party, it hopes to catch up quickly.', 'As always, if something sounds too good to be true, there is a catch. Even for a Majorana-based quantum computer, such as the one announced by Microsoft, one operation—known as T-gate—won’t be achievable without errors.', 'So the Majorana-based quantum chip is only “almost error-free.” However, correcting for T-gate errors is much simpler than the general error correction of other quantum platforms.', 'Microsoft plans to scale up by grouping together more and more qubits.', 'What now? Microsoft will try to move ahead with its road map, steadily building larger and larger collections of qubits.', 'The scientific community will closely watch how Microsoft’s quantum computing processors operate, and how they perform in comparison to the other already established quantum computing processors.', 'At the same time, research into the exotic and obscure behavior of Majorana particles will continue at universities around the globe.', ""In your inbox: WIRED's most ambitious, future-defining stories"", 'DOGE takeover: Elon Musk’s toxicity could spell disaster for Tesla', 'Big Story: A crypto crimefighter’s descent into Nigerian prison', 'I dated multiple AI partners at once. It got real weird', 'Summer Lab: Explore the future of tech with WIRED', 'MORE FROM WIRED', 'REVIEWS AND GUIDES', '© 2025 Condé Nast. All rights reserved. WIRED may earn a portion of sales from products that are purchased through our site as part of our Affiliate Partnerships with retailers. The material on this site may not be reproduced, distributed, transmitted, cached or otherwise used, except with the prior written permission of Condé Nast. Ad Choices']"
"Powerful quantum computers in years not decades, says Microsoft",https://www.bbc.com/news/articles/cj3e3252gj8o,"['Microsoft has unveiled a new chip called Majorana 1 that it says will enable the creation of quantum computers able to solve ""meaningful, industrial-scale problems in years, not decades"".', 'It is the latest development in quantum computing - tech which uses principles of particle physics to create a new type of computer able to solve problems ordinary computers cannot.', 'Creating quantum computers powerful enough to solve important real-world problems is very challenging - and some experts believe them to be decades away.', 'Microsoft says this timetable can now be sped up because of the ""transformative"" progress it has made in developing the new chip involving a ""topological conductor"", based on a new material it has produced.', 'The firm believes its topoconductor has the potential to be as revolutionary as the semiconductor was in the history of computing.', 'But experts have told the BBC more data is needed before the significance of the new research - and its effect on quantum computing - can be fully assessed.', 'Jensen Huang - boss of the leading chip firm, Nvidia - said in January he believed ""very useful"" quantum computing would come in 20 years.', 'Chetan Nayak, a technical fellow of quantum hardware at Microsoft, said he believed the developments would shake up conventional thinking about the future of quantum computers.', '""Many people have said that quantum computing, that is to say useful quantum computers, are decades away,"" he said. ""I think that this brings us into years rather than decades.""', 'Travis Humble, director of the Quantum Science Center of Oak Ridge National Laboratory in the US, said he agreed Microsoft would now be able to deliver prototypes faster - but warned there remained work to do.', '""The long term goals for solving industrial applications on quantum computers will require scaling up these prototypes even further,"" he said.', ""Quantum computing holds the promise of carrying out calculations that would take today's systems millions of years and could unlock discoveries in medicine, chemistry and many other fields."", 'There are numerous important problems that ""classical"" computers, of the sort we use every day in our phones, and laptops and power most modern applications, cannot solve.', 'But these are problems quantum machines might be able to rapidly crack, promising new discoveries by creating new medicines or designing better batteries.', 'A host of technology firms, including the silicon valley giants, are currently engaged in a multi-billion dollar race to develop a quantum computer powerful enough to solve these problems.', 'Microsoft is approaching the problem differently to most of its rivals.', 'Its path to building a quantum computer relied upon being able to create a ""topoconductor"" or topological conductor.', 'It uses the newly developed material to create a new state of matter- a so-called ""topological state"" which isn\'t a gas, liquid or solid and, until relatively recently, had existed only in theory.', 'Specifically, it relies on so-called Majorana particles, which themselves were previously considered theoretical - work claiming that they had been discovered in 2018 had to be retracted.', 'While rivals produced a steady stream of announcements - notably Google\'s ""Willow"" at the end of 2024 - Microsoft seemed to be taking longer.', 'Pursuing this approach was, in the company\'s own words, a ""high-risk, high-rewards"" strategy, but one it now believes is going to pay off.', '""In the same way that the invention of semiconductors made today\'s smartphones, computers and electronics possible, topoconductors and the new type of chip they enable offer a path to developing quantum system,"" Microsoft said.', 'The biggest challenge of quantum computers relates to their fundamental building block, called a qubit, which is incredibly fast but also extremely difficult to control and prone to errors.', 'The more qubits a chip has the more capable it is.', 'Microsoft says it has put eight of its new topological qubits on its new chip - considerably less than the chips created by some of its rivals.', 'However, it claims to have a path to scaling it up to a million qubits - which would create immense computing power.', 'Professor Paul Stevenson of Surrey University said the research published by Microsoft was a ""significant step"", but he felt it had tough challenges ahead.', '""Until the next steps have been achieved, it is too soon to be anything more than cautiously optimistic,"" he said.', 'Chris Heunen, Professor of Quantum Programming at the University of Edinburgh, told the BBC he felt Microsoft\'s plans were ""credible"".', '""This is promising progress after more than a decade of challenges, and the next few years will see whether this exciting roadmap pans out,"" he said.', 'Can AI resurrect the past, or are these videos a polished, modernised version of history designed for engagement?', 'Since a potentially hazardous asteroid was detected in December, tens of others objects have come close to Earth.', 'Photographs of gulls eating anything from chips to starfish will help solve a scientific puzzle.', 'Quantum computers will be able to crack existing encryption and threaten critical infrastructure.', 'The lead researcher has told the BBC he was so astounded he assumed his computer had been hacked.', 'Copyright 2025 BBC. All rights reserved.  The BBC is not responsible for the content of external sites. Read about our approach to external linking.', ' ', '']"
