Title,Link,Paragraphs
Three Israelis released by Hamas in Gaza as part of ceasefire deal – along with five Thai hostages,https://www.the-independent.com/news/world/middle-east/israel-gaza-hostage-hamas-soldier-ceasefire-b2688969.html,"['', '', 'It is the third exchange of hostages since a ceasefire was agreed about a fortnight ago', '', '', ""From reproductive rights to climate change to Big Tech, The Independent is on the ground when the story is developing. Whether it's investigating the financials of Elon Musk's pro-Trump PAC or producing our latest documentary, 'The A Word', which shines a light on the American women fighting for reproductive rights, we know how important it is to parse out the facts from the messaging."", '', '', 'Hamas has handed over three Israelis and five Thai nationals in chaotic scenes at multiple locations in Gaza, as part of the latest phase of a fragile ceasefire deal.', 'Arbel Yehoud, 29, and Gadi Moses, 80, both civilians, an Israeli female soldier Agam Berger, 20, and five Thai citizens were released among massive crowds in the north and the south of the Gaza Strip. Later, they crossed into Israel where the Israelis were reunited with their families, while the Thai workers were met by members of the consulate.', 'Ms Berger was the first to be released in northern Gaza. Hours later, in southern Gaza in chaotic scenes that sparked uproar in Israel, huge crowds gathered at the second handover sight located at the destroyed home of slain Hamas leader Yahya Sinwar, in Khan Younis. There hundreds of Palestinians swarmed heavily armed militants as they fought through the scrum to deliver a visibly shaken Ms Yehoud, 29, to Red Cross vehicles.', 'The releases were part of the first phase of this Israel-Hamas ceasefire, which will see 33 hostages freed for up to 1,900 Palestinian detainees in Israeli jails across six weeks.', 'Israeli prime minister Benjamin Netanyahu called the chaos around Ms Yehoud’s handover “shocking” and temporarily suspended the release of 110 Palestinian prisoners over Hamas’s handling of the incident.', 'Mr Netanyahu said: “I demand that the mediators make certain that such terrible scenes do not recur, and guarantee the safety of our hostages. Whoever dares to harm our hostages will pay the price.”', 'He later said that he had received such a commitment and the prison releases began later on Thursday afternoon.', 'There appeared to be no live images of Mr Moses’s release, but he was pictured later. He is among the oldest remaining hostages in Gaza. His family members told The Independent last week he suffered from numerous medical issues.', 'The release of the five Thai nationals – which was not officially part of the deal – was also not widely televised. Israel named them as Thenna Pongsak, Sathian Suwannakhan, Sriaoun Watchara, Seathao Bannawat, and Rumnao Surasak.', 'More than 30 Thai farm workers were taken hostage on 7 October, 2023, in the Hamas attack that triggered the war in Gaza. Around 1,200 people were killed during the assault according to the Israelis, while 251 more, including the eight released today, were taken hostage.', 'Israel’s retaliatory air and ground offensive in Gaza in the 15 months since then has killed more than 47,000 Palestinians, according to the local health ministry, and displaced nearly 2 million people.', 'Eight of the 33 hostages slated for release in the first phase are dead, the Israeli government said this week. Five Israeli civilians and five soldiers – all women – as well five Thai nationals not included in the original deal, have been released so far in the ceasefire, which began on 19 January. The next hostage release is scheduled for Saturday. In return, Israel has released 290 Palestinians held in Israeli prisons.', 'Earlier in Jabalia, northern Gaza, Ms Berger, 20, a military spotter, was filmed emerging from a heavily damaged building before walking onto a stage where she waved at the crowd. Ms Berger had reportedly arrived at the Nahal Oz base in southern Israel just two days before Hamas’s 7 October attack during which she was captured.', 'A video from Ms Berger’s family home showed dozens of people celebrating as they watched her being released.', '“This is the happiest moment of my life,” one of Ms Berger’s relatives told Israeli outlet Channel 12. “Now we can breathe again.”', 'Ms Berger’s family said in a statement: “Thank God we have reached this moment, and our hero Agam has returned to us after 482 days in enemy hands.” Later the family of Ms Yehoud shared a photo of the family aboard an Israeli helicopter.', 'Ms Yehoud, who appeared in a video by the militant Palestinian Islamic Jihad this week, was taken with her partner Ariel Cunio. Mr Cunio, together with his brother David, remains inside Gaza and is not included in the list of releases for the first part of the ceasefire deal. Ms Yehoud’s brother Dolev was killed during the 7 October assault.', '“Our mission is not yet complete. Ariel, Arbel’s partner, is still held captive in Gaza. So are his brother David, their good friend Sasha, the other hostages from Nir Oz, and all our loved ones,” the family wrote. “We will not rest until all hostages are released. We urge everyone not to let this open door close. Everyone must be brought home immediately so that we can heal as a society.”', 'The family of Gadi Moses also shared a photo, showing the frail grandfather with his three children.', 'At Hostages Square, a rallying point in Tel Aviv, a group representing those held in Gaza clutched around huge screens playing the live images. The Hostages and Missing Families Forum Headquarters called the hostage transfer “harrowing” adding “our hearts were gripped with fear”. They once again called for all the hostages to be released.', 'Ms Berger is believed to be the last female Israeli solider still left inside Gaza. She had been captured alongside her fellow observers Liri Albag, Karina Ariev, Daniella Gilboa, and Naama Levy, who have all been released already.', 'Ms Yehud is the last female civilian hostage that Israel believes is most likely alive. Another civilian woman, Shiri Bibas, remains in Gaza after she was abducted from Nir Oz with her two young sons, Ariel, who was four at the time, and Kfir, who was nine months. The Israeli military has expressed grave concern for the lives of Ms Bibas and her children, though their deaths have not been confirmed.', 'The partner of Mr Moses, one of the oldest remaining hostages, was also killed by Hamas on 7 October. His ex-wife Margalit Moses, initially a hostage, was released during the first week-long ceasefire deal in November 2023.', 'Meanwhile in the occupied West Bank, families of the detainees waited anxiously for news of the releases after the delay. Scuffles erupted around Ofer prison with Palestinian teenagers throwing stones outside the complex and Israeli forces firing tear gas as they tried to clear the area.', 'Prisoners were finally released in the afternoon in white buses, with windshield’s shattered from the clashes. On board is expected to be 30 serving life sentences after being convicted of deadly attacks against Israelis and 30 minors, the youngest just 15 years old.', 'Among those seen leaving Ofer prison was Zakaria Zubeidi, a prominent former militant leader and theatre director who took part in a dramatic jailbreak in 2021 before being rearrested days later. In a grey prison sweatsuit, he flashed a victory sign at the crowds.', 'The ceasefire deal, brokered by United States, Egypt and Qatar after a year of tough negotiations, has been fraught with delays and at several points has floundered.', 'Israel said Ms Yehoud, who Palestinian militant factions initially accused of being a combatant, was supposed to have been freed last Saturday and delayed the opening of crossings to northern Gaza when she was not. After an agreement, brokered by the United States, Egypt and Qatar, was pushed through late on Sunday to release her on Thursday, Israel opened the crossing, known as the Netzarim corridor, the following morning.', 'Hundreds of thousands of Palestinians then began returning to their homes in the north of the territory, much of which has been destroyed by more than 15 months of war.', 'Join thought-provoking conversations, follow other Independent readers and see their replies', '']"
"After 484 days, Hamas hostage Ofer Calderon released from Gaza captivity",https://www.timesofisrael.com/taken-captive-ofer-calderon-initially-escaped-through-window/,"['ISRAEL AT WAR - DAY 488', 'On February 1, 2025, Ofer Calderon, 54, was released from Hamas captivity in Gaza as part of phase one of a mediated ceasefire-hostage release deal. He was handed over to the Red Cross, who delivered him to IDF soldiers who escorted him and fellow freed captive Yarden Bibas into Israel. Below is what we initially knew of his capture: ', 'Ofer Calderon, 52 (now 54), was taken captive on Saturday, October 7, with two of his children, when Hamas terrorists stormed Kibbutz Nir Oz, killing over 100 residents and some 15 foreign agricultural workers, and taking about 80 hostages.', 'Calderon, along with Erez and Sahar, two of his four children, initially escaped from their shelter through the window during the Hamas onslaught, into the fields of Kibbutz Nir Oz, where they were later taken hostage.', 'Sahar Calderon, 16, and Erez Calderon, 12, were released on November 27 as part of a temporary ceasefire deal brokered by Qatar and the United States between Hamas and Israel.', 'Hadas Calderon, Ofer’s ex-wife, was in the sealed room of her home on the kibbutz, holding the door handle against the terrorists. Their elder son, Rotem, 19, also survived in the safe room of his apartment, in the kibbutz area for young adults, while his older sister Gaya, 21, was in Tel Aviv.', 'Grandmother Carmela Dan was at her house down the street with Hadas Calderon’s niece, Noya Dan. Their bodies were found on October 19.', 'At a press conference held in the aftermath of the Hamas massacres in Israel’s south, Gaya Calderon wept, saying, “My dad brought me up, he’s my best friend, I have no one to talk to.”', 'Hadas Calderon stood in front of the Defense Ministry for days before her two children were released, and extended members of the family are continuing to rally for Ofer Calderon’s release.', 'Ofer marked his 53rd and 54th birthdays in captivity in Gaza.', '', 'Supporting The Times of Israel isn’t a transaction for an online service, like subscribing to Netflix. The ToI Community is for people like you who care about a common good: ensuring that balanced, responsible coverage of Israel continues to be available to millions across the world, for free.', ""Sure, we'll remove all ads from your page and you'll unlock access to some excellent Community-only content. But your support gives you something more profound than that: the pride of joining something that really matters. "", '', '', '', '', '', '', '', '', '', '', '', '', '', '', '', '', '', '', '', '© 2025 The Times Of Israel, All Rights Reserved']"
Joy and relief: Gaza hostage release hits home for South Florida brothers,https://www.nbcmiami.com/news/local/gaza-hostage-release-hits-home-for-south-florida-brothers/3530836/,"['One South Florida family saw one of its own reunite with family in Israel after being held hostage by Hamas. NBC6’s Ari Odzer reports', 'Every hostage release is emotional for the Jewish community, but Thursday’s events, in which three Israelis and five Thai nationals were set free from Hamas captivity in exchange for 110 convicted Palestinian prisoners, really hit home for Ronald and Edward Bakalarz. ', 'Their cousin, Agam Berger, is now safe in Israel after 482 days imprisoned in Gaza. ', '', '“How can you describe that emotion?” Edward Bakalarz said as we watched videos on social media showing Agam reuniting with her family. ', '“God bless ‘em, my only hope is that she is able to recuperate,” Ronald Bakalarz added. ', '', 'It’s personal for these brothers. Seeing their cousin reunited with family and friends is a moment they’ve been hoping and praying for since October 7 of 2023. We met them at their synagogue, the Aventura Turnberry Jewish Center. ', 'I asked Edward what he was thinking when he saw the videos of Agam being released. ', '“Cry, that’s the first thing that came to my mind, actually, right now, just a lot of excitement that she’s free, concern about that year and a half affected her life, the impact it had on our family,” he said through tears. ', '', 'The reunion scenes are saturated with joy and relief.', '“On the one hand, a lot of emotion, a lot of happiness for the family, on the other hand, I thought it was disgusting the way that they paraded her and all the other hostages who were released, making an absolute show of this whole thing,” Ronald Bakalarz said. ', 'Hamas could have just transferred the hostages to Red Cross vans. Instead, they surrounded them with armed, masked men in uniforms, making them essentially get through a gauntlet to freedom. They even staged a ceremony, making the hostages smile and wave on a stage. ', '“So humiliating,” Edward said as we watched the videos of those scenes. ', 'Hamas was putting the hostages through one last bout of psychological torture. It makes the homecoming even sweeter. For every hostage released, the synagogue is taping a yellow ribbon onto its giant “Bring Them Home Now” dog-tag installation. Today, Ronald and Edward did the honors, with eight new ribbons, 82 more to go, and maybe a permanent cease-fire on the horizon.', '“The hope is that we can end the war, the reality is that it’s quite obvious that Hamas is not interested in ending it,” Ronald Bakalarz said. ', 'Ronald says he’s been to Israel several times since Oct. 7 to be with his family there, to support them as much as possible, and he says they’re all praying for the rest of the hostages to come home soon.', 'Sign up to receive breaking news alerts in your inbox.', '', '', '', '', '', '', '', '']"
Exposing Hamas’s true evil: The hostage certificate farce - opinion,https://www.jpost.com/opinion/article-840649,"['What’s with those hostage-release certificates and Hamas’s forced thank-you letters to your torturers? Does Hamas really think the world is that stupid? Alas, it seems to be: confusing innocent people kidnapped for being Jewish – or near Jews – with terrorists convicted of heinous crimes.', 'The ex-hostages suffered from sheer bigotry; the Palestinians committed crimes and received well-deserved punishment.', 'Sixteen months ago, Hamas terrorists led other Palestinians in swarming Israel. Kidnapping 253, they treated people as brutalized piñatas, dehumanized sex slaves, human shields, and objectified trading cards.', '', '', '', '', '', '', '', '', '', '', '', '', '', '', '', '', '', '', '', '', '', '', '', '', '', '', '']"
Watch: Freed Palestinian prisoners greeted by jubilant crowds,https://www.bbc.com/news/videos/cednwn9z4deo,"['A bus carrying freed Palestinian prisoners was greeted with celebrations in Ramallah, in the occupied West Bank, on Saturday.', 'It was carrying those who had been released from Ofer prison, in Israel.', 'In total 183 prisoners were released by Israel - many coming from Ofer prison. In exchange, earlier Hamas released three Israeli hostages who were taken to Gaza on 7 October 2023.', 'Watch CCTV of a 14-year-old girl who stabs two teachers and a student at Ysgol Dyffryn Aman.', 'Thousands of people marched to Los Angeles City Hall before blocking a major freeway.', 'The Star-Spangled Banner was booed after President Donald Trump announced he would impose tariffs on Canada.', 'BBC Australia reporter Simon Atkinson visits Townsville, which was hit by severe rainfall over the weekend.', 'A signed summary of BBC Newsline.', 'The former solider collected information and passed it to Tehran, before escaping from HMP Wandsworth.', ""The BBC reports the end of Tony Martin's trial in April 2000 for shooting dead a teenage intruder."", 'This video has been removed for rights reasons.', 'Staff at the Royal Botanic Garden Edinburgh are working to recover from the lasting impact of Storm Eowyn.', 'Freddie, who is studying politics, reveals which politicians he thinks would do well as contestants.', 'People gathered for the annual Groundhog Day winter forecast in the town of Punxsutawney, Pennsylvania.', 'Talking is Mental is an initiative started by a couple who live in Glasgow to help people who feel lonely or want a sense of community.', ""Ahead of the annual Clowns' Church Service, we've gone back to 1977 to learn more about its history."", 'Pauline Richards, 74, known as ""Mrs Chicken"" has worked at the East Street branch for 47 years.', 'Dolcie-Mae must remain in hospital until a matching stem cell donor can be found.', 'A small plane crashed into several buildings on Friday evening, killing all six people on board and one person on the ground.', 'Meet the bagpiper helping to show that the bagpipes are more than ""just a traditional instrument"".', 'Fair Shot Café helps train about 15 people a year, preparing them for work in hospitality.', ""As Donald Trump threatened to impose border taxes, the leaders of America's neighbours said they were prepared to act."", ""Ryan O'Hara, 28, was the crew chief of the helicopter that collided with the passenger plane on Wednesday."", 'Copyright 2025 BBC. All rights reserved.  The BBC is not responsible for the content of external sites. Read about our approach to external linking.', ' ', '']"
Hamas releases U.S. hostage Keith Siegel; Rafah crossing reopens for Gazan patients,https://www.washingtonpost.com/world/2025/02/01/hamas-release-american-hostage-keith-siegel-rafah-crossing-reopen/,"['Keith Siegel, a 65-year-old citizen of Israel and the United States, and two other male hostages were released Saturday as part of the first phase of the Gaza ceasefire deal.', '', '', '']"
Hostages released and a protest over whales: photos of the day – Thursday,https://www.theguardian.com/news/gallery/2025/jan/30/hostages-released-and-a-protest-over-whales-photos-of-the-day-thursday,"['The Guardian’s picture editors select photographs from around the world', 'Thu 30 Jan 2025 09.05 EST\nLast modified on Thu 30 Jan 2025', 'Photograph: Andrew Caballero-Reynolds/AFP/Getty Images', 'Photograph: State Emergency Service Of Ukraine /EPA', 'Photograph: Dawoud Abu Alkas/Reuters', 'Photograph: Omar Al-Qattaa/AFP/Getty Images', 'Photograph: Tomer Appelbaum/Reuters', 'Photograph: Eyad Baba/AFP/Getty Images', 'Photograph: Anadolu/Getty Images', 'Photograph: Christian Mang/Getty Images', 'Photograph: Sergei Gapon/AFP/Getty Images', 'Photograph: Aline Massuca/Reuters', 'Photograph: Henry Romero/Reuters', 'Photograph: Frazer Harrison/AFP/Getty Images', 'Photograph: David Levene/The Guardian', 'Photograph: Teresa Suárez/EPA', 'Photograph: Tim P Whitby/Getty Images for the Walt Disney Company Ltd', 'Photograph: Aaron Favila/AP']"
Released Gaza prisoners joyous despite torture and loss,https://www.middleeasteye.net/news/released-gaza-prisoners-joyous-despite-torture-loss,"['After a year and two months of detention, Ahmed Dababesh was released from Israeli prison.', 'He searched for his wife and daughter, whose faces he had forgotten after the horrors he saw while incarcerated.', 'On Saturday afternoon, Israel released 111 Palestinian prisoners from the Gaza Strip as part of the first phase of an exchange deal with Hamas.', 'The released prisoners were arrested after 7 October 2023, and their release came along with 110 other prisoners, including those serving life sentences. Their release came after Hamas freed three Israeli prisoners and provided the name of a sick Israeli prisoner.', 'According to Israeli data, the number of Palestinians from Gaza detained after 7 October exceeds 3,000, held in several prisons, including secret facilities established after the war.', 'Dababesh quickly got off the bus that transported the released prisoners to Khan Younis in southern Gaza. He ran towards the gathered residents, searching for his wife and daughter - but they were not there.', 'His father and brothers were waiting for him. They embraced him with tears before informing him that 20 members of his family after his arrest, including his wife and daughter Ghena, had been killed in Israeli bombings after his arrest. ', 'Dababesh collapsed in tears, asking to see their pictures.', '“I expected that they would be the first to receive me. I imagined my child innocently running towards me and kissing me. I forgot what she looked like in prison because of the horror I saw,” he told Middle East Eye.', 'In prison, Dababesh, like all Gaza detainees, endured both physical and psychological torture.', 'He was subjected to long hours of interrogation under extreme cold and heat.', '""Since my arrest, for a period of six months, we were handcuffed and blindfolded all the time, even if we went to the bathroom,"" he said.', ""'The jailers were burning us with fire, heating sharp knives and burning our skin with them'"", '- Riyad Dahnoun, former prisoner', '""We wore a summer shirt even in the extreme cold and frost for long months in Naqab prison.""', 'Among the methods of psychological torture, jailers showed him pictures of his destroyed house but refused to tell him the fate of his family.', 'He also witnessed the torture of a number of other prisoners.', '“The prisoners were taken into special torture rooms and trampled on a floor full of pebbles to injure their bodies. Many prisoners were killed as a result of torture,” he added.', 'Riyad Dahnoun, from Beit Lahia, was released in the latest prisoner exchange after being detained for more than a year in detention following his displacement at Khalifa bin Zayed school.', 'It was clear that he was unable to walk. When asked why, he revealed burns and ulcers on his leg as a result of the torture he endured. ', '“The jailers were burning us with fire, heating sharp knives and burning our skin with them. My whole body was like this. They were heating pieces of iron and forcing us to sit on them,” he added.', 'The food provided to the prisoners was very bad. Dahnoun described it as ""chicken food"" - a small box of uncooked white rice distributed to the prisoners throughout the day.', '""I weighed 79kg before arrest. Today, I weigh 46kg. The food is bad, the treatment is bad and the torture is unreasonable. I left my fellow prisoners behind, and my heart cries out in grief for them.""', 'Doctor Muhammad al-Aqra was among those released. He seemed exhausted as he recounted his year in detention to MEE.', '“Israel is a lawless state,” he said.', '“We were in graves and we came out. That\'s all I can say - beatings, hanging, torture, breaking our limbs and endless insults. I was in a grave, not a prison.""', 'The prisoner does not know how long he will spend in prison, whether he will be sentenced or what charges will be fabricated against him.', 'Many of those released were devastated to learn that members of their families had been killed in Israeli airstrikes while they were in detention.', 'They left prison hoping their physical wounds and the visible scars of torture would heal - but instead, they were met with a deeper wound, one that will take a long time to heal. ', 'Copyright © 2014 - 2025. Middle East Eye. All rights reserved. Only England and Wales jurisdiction apply in all legal matters.', 'Middle East Eye          ISSN 2634-2456                     ']"
Prisoner Exchange Highlights Palestinian Unity: What Are Key Resistance Groups in Gaza?,https://www.palestinechronicle.com/prisoner-exchange-highlights-palestinian-unity-what-are-key-resistance-groups-in-gaza/,"['', '', '', '', '', '', '', '', '', '', '', '', '', '', '', '', '', '', '', '', '', '', '', '', '', '', '', '', '', '', '', '', '', '', '', '', '', '', '', '', '', '', '', '', '', '', '', '', '', '', '', '', '', '', '', '', '', '', '', '', '', '', '', '', 'Call to Action: The Palestine Chronicle urgently needs your support to continue amplifying Palestinian voices— and stand with justice.', '', '', '', '', '', '', '', '']"
