Title,Link,Paragraphs
Nvidia GeForce RTX 5080 review: the new 4K graphics card to go for,https://www.rockpapershotgun.com/nvidia-geforce-rtx-5080-review,"['Ohhh, it gets by, with a little help, from frame gen', 'Has any genus of graphics card been as dramatically storied as the GeForce XX80s? The RTX 3080 was a thing of beauty, only to be tarnished by the worst wheeler-dealing spree (and crypto mining misappropriation) in PC component history. Then the RTX 4080 rocked up with its laughable £1269 / $1199 price tag, a miscalculation so severe that the RTX 4080 Super looked good – despite hardly being any faster – simply for not repeating it. For the new RTX 5080’s sake, you almost want it to be boring.', 'It isn’t. But then, neither is it a blood-boiler like the RTX 4080, nor a largely aspirational show-off piece like the RTX 5090. By maintaining the 4080 Super’s course correction on price while tooling up on compelling DLSS 4 improvements, the RTX 5080 is an agreeable GPU from the off. Particularly, if you’ve got the 4K monitor to take full advantage of it.', 'It’s certainly a more sensible buy than the RTX 5090 for high-rez gamesplaying. A Founders Edition, like the one I’m testing here, will set you back £979 / $999, or roughly half the price of the next (and final) RTX 50 model in the pile. Plus, while it has the same 16GB of 256-bit VRAM as the 4080 and 4080 Super, that’s still enough for all the AAA industry’s biggest resource-eaters, and it’s been upgraded to GDDR7 for a stretch of extra bandwidth. Get the Founders Edition and you’ll also bag yourself the same lovely metallic design and effective dual-fan cooler that the RTX 5090 FE has, running even colder here thanks to the RTX 4080’s lower power needs.', ""It's still a thirsty creature, to be sure: Nvidia reckon you’ll need at least an 850W PSU to run it, and max usage is rated at a toasty 360W. Unlike on the RTX 5090 FE, however, I didn’t record the RTX 5080 FE actually hitting its limit, with it peaking at 322W while running games. Its GPU temperature high of 64°c was a good nine degrees cooler the 5090 as well. See? Sensible. Ish."", 'The biggest and scariest of mainstream monitor resolutions doesn’t faze the RTX 5080 a jot, even in the more recent tough runners. The RTX 5090 is faster still, though the RTX 5080 is always able to match a good majority of its sibling’s frames-per-second output for half the cash. It’s also a juicy upgrade over the RTX 30 series’ elite – encouraging, if you’re upgrading from an older card – and it even comes somewhat close to the RTX 4090, which at the time of writing is still going for upwards of £1300 in the secondhand market.', 'Keen bar chart fans may recall that the RTX 4080 did beat the RTX 3090 and RTX 3090 Ti outright, so it’s a bit of a backwards shuffle for the RTX 5080 to not completely outpace the previous generation’s top dog in turn. I’m not sure that’s a particularly huge deal, outside of maintaining conventions, though I do wish the RTX 5080 gave more of a speed boost to rasterised, native-rez games over the RTX 4080 Super.', 'To look at this, we must – temporarily but with apologies – return to the old RPS test rig and its Core i5-11600K, which is the only one I have RTX 4080 Super results for. Cyberpunk 2077 sees a decent bump, rising from 51fps (with Ultra settings) on the 4080 Super to 71fps on the 5080, though the newest GPU’s 81fps in F1 22 (on Ultra High) is an uptick of just 12fps. Metro Exodus barely improved either, averaging 99fps on the 4080 Super and 106fps on the 5080.', 'What none of these RTX 40 series cards have, however, is a full suite of DLSS 4 framerate-massaging tools. While one of my personal favourites among these – the new Transformer model option for upscaling, which enhances overall image quality in exchange for a smaller performance boost – is available to older RTX models, the headlining multi Frame Generation (MFG) is exclusive to the RTX 50 series. And this actually can nudge the RTX 5080 past the RTX 4090, at least in terms of purely visible smoothness.', 'If you’re unfamiliar, MFG takes the AI frame generation of DLSS 3 and can throw up anywhere between one and three generated frames for every one of the frames that your PC actually renders. This adds some extra input lag, and it won’t necessarily feel smoother (as the generated frames don’t take into account your mouse movements or keyboard presses), but the visual impact can look very fine indeed. On the RTX 5080, MFG also opens up the possibility of above-60fps framerates at while combining 4K with some of the most demanding ray tracing and path tracing effects in the business. In all three games I tried, applying the 4x frame gen option let it saunter past the RTX 4090, whose DLSS 3 version maxes out at the equivalent of MFG’s 2x setting.', 'Outside of benchmark nerdery, everything looks and feels playable, though Alan Wake II did start pushing 100ms of latency with 4x MFG on – enough for aiming to get a little sluggish. I’d probably drop DLSS upscaling from Quality to Balanced, in that case, to bump up that base of 37 non-AI frames per second. That would improve visual smoothness even more while touching up responsivity. Otherwise, though, DLSS 4 makes a persuasive argument in the RTX 5080’s favour, and with 75 compatible games confirmed, it’s getting a far more widely-supported start to life than rival frame gen tech like FSR 3 and XeSS 2 did.', 'As ever, anything 4K can do, 1440p can do faster, and there are good reasons to choose the RTX 5080 for this resolution if you’ve redirected all your monitor upgrade budget into a GPU fund. CPU bottlenecking snips the tall-poppyness of the RTX 5090, allowing this cheaper card to keep pace more effectively, while also narrowing the gap against RTX 4090 and downright styling on the RTX 3090.', 'That said, it’s worth waiting for the RTX 5070 and RTX 5070 Ti at this stage. The RTX 5080 is undoubtedly a barnstormer at 1440p but unlike with 4K, there is sometimes a feeling that you’re paying for more power and features than you can use. 4x MFG, for instance, isn’t as useful because the framerates you can get without it are already sky-high: take Cyberpunk 2077 with Psycho ray tracing, which the RTX 5080 could run at 106fps with just Quality-level DLSS upscaling. Most monitors wouldn’t even be able to display all the extra AI frames, even if your eyes could perceive the difference between such speeds – and diminishing returns very much do come into effect.', 'Then again, there is a case for 2x frame gen in some games. F1 24 on Ultra High rose from 116fps with only Quality DLSS to 148fps with frame gen, and that actually did make for a noticeable (if minor) smoothness improvement. The RTX 5080 clearly isn’t a bad GPU for Quad HD – it’s just not the best resolution for spreading its DLSS 4 wings, hence why it’ll be intriguing to see whether the more affordable RTX 5070 duo can make for more suitable matches.', 'Or AMD’s Radeon RX 9070, maybe. That will have its own souped-up DLSS rival in FSR 4, though it sounds like this will be a simpler 2x frame generator in the DLSS 3 vein. With the faster and more flexible MFG, DLSS 4’s pin-sharp Transformer model option, and the GeForce line’s historic advantages with ray and path tracing, it’s hard to see how RDNA 4 GPUs like this will be able to stand up to the RTX 50 series on features.', 'For 4K, anyway, the RTX 5080 is the one to beat. It’s cooler, more efficient, and (not, uh, counting any potential stock shortages) drastically more attainable than the RTX 5090, while still having enough muscle for slick, max-quality performance. Is it as lovable as that poor, reseller-abused RTX 3080? Not so much – a bigger jump up from the RTX 4080 Super would have been appreciated. But it’s better deal overall than both the Super and the original RTX 4080, especially once you start exploiting its more advanced tech. Tech that can help it leave the RTX 4090 behind, let alone those 4080s.', 'This review is based on a retail unit provided by the manufacturer.', 'Find out how we conduct our reviews by reading our review policy.', 'Rock Paper Shotgun is better when you sign in', 'Sign in and join us on our journey to discover strange and compelling PC games.', ""Rock Paper Shotgun is owned by Gamer Network Limited, an IGN Entertainment company and subsidiary of Ziff Davis. © 2025 Gamer Network Limited, 18 Mansell Street Level 3, London, E1 8AA, United Kingdom. Company number 03882481. All rights reserved. No part of this website or its content may be reproduced without the copyright owner's permission.""]"
RTX 5090 Scam Alert: eBay Sellers Trick Desperate Gamers With Fake Listings—How to Avoid?,https://www.techtimes.com/articles/309280/20250204/rtx-5090-scam-alert-ebay-sellers-trick-desperate-gamers-fake-listingshow-avoid.htm,"[""The release of Nvidia's RTX 50-series GPUs brought unfortunate news of exceptionally high prices to the market. Customers need to allocate $2000 for the RTX 5090's base price, while third-party versions of the graphic cards easily go beyond $3000."", 'The worst part of its release lies beyond the premium pricing problem. The launch turned intolerable because professional market speculators along with dishonest individuals have exploited the situation.', 'Scalpers have taken over the market by purchasing all available RTX 5090 units to sell them on eBay with exorbitant price tags. This latest scheme employs deceptive marketing which targets hopeless shoppers in the market.', 'When GPUs became scarce during the height of the COVID pandemic, consumers witnessed obvious price gouging through scalpers. The market featured sellers who openly sold GPU devices at higher costs despite GPU stock increasing over time.', 'Scammers now use deceptive consumer activism pretenses to trick people into their fraudulent schemes.', 'You can find advertisements on eBay for ""Nvidia GeForce RTX 5090 32GB (Read the Description)"" products. The small text reveals the complete truth because these vendors do not offer real GPUs for sale despite them presenting the picture as their product for sale.', 'Read more: Can PS5 Pro Beat RTX 4090? Here’s What the Rumors Say', 'Digital Trends investigated the situation to discover that scammers explain the deceptive listings as countermeasures against scalping bots. Scammers argue that bots will buy any item with ""RTX 5090"" text in its title, leading to their automatic purchase of photos instead of actual GPUs which results in bot money wastage.', ""There exists a harsh truth regarding this practice that proves it is not activism. It's a scam."", 'The real goal is to trick human buyers who don\'t read the fine print. A desperate gamer might glance at the title, see positive seller feedback, and hit ""Buy Now"" without realizing they\'re only purchasing a printed image of a graphics card for $2,000.', ""Sadly, this scam is working. Many buyers are falling for these fake listings, thinking they've finally secured an RTX 5090. A quick search of eBay's sold listings reveals dozens of transactions where people unknowingly paid thousands for a worthless photo."", 'While eBay may refund the buyers and punish the sellers, the fact remains that this scam is raking in easy money for fraudsters.', ""If you're looking to buy an RTX 5090 (or any high-demand product), follow these steps to protect yourself from fraud:"", 'If a listing includes ""Read the Description"" in the title, that\'s a massive red flag. Honest sellers don\'t need to use vague warnings: they simply list their product as it is.', ""Scammers sometimes manipulate text in their listings by using weird fonts or symbols to evade eBay's automatic scam filters. If a title looks unusual, be extra cautious."", ""A high feedback rating doesn't always mean a seller is legitimate. Some scammers build up their ratings by selling cheap items (like trading cards) before switching to fraudulent GPU listings."", ""Always check the entire product description. If a deal looks too good to be true, make sure you're not accidentally buying a photo or an empty box."", ""If you see a listing that seems deceptive, report it to eBay immediately. The faster these scams are flagged, the fewer victims they'll claim."", ""With the recent RTX 5090 scams, it is evident that tech companies and online marketplaces arenot doing enough to protect buyers. If legitimate customers can't purchase GPUs before scalpers grab them all, and if eBay allows misleading listings to thrive, the system is broken."", ""Related Article: CES 2025: Nvidia Surprises Fans With Robot; New RTX 50 Series Gives 'More Realistic' Touch to Games"", 'Sign up for our free newsletter for the Latest coverage!', '']"
NVIDIA GeForce RTX 5080 / RTX 5090 Linux Gaming Benchmarks,https://www.phoronix.com/review/nvidia-rtx5080-rtx5090-linux,"['Over the past week I have published a number of GeForce RTX 5090 Linux compute benchmarks as well as the GeForce RTX 5080 on Linux. With that early NVIDIA R570 Linux driver build as part of the CUDA 12.8 package I was asked to wait on Linux gaming benchmarks until the proper RTX 50 Linux driver is released. Well, it was released this morning with the NVIDIA 570.86.16 Linux beta availability and have in turn been pushing the GeForce RTX 5080 and RTX 5090 through a number of Linux gaming/graphics benchmarks.', '', ""In this article is an initial look at the GeForce RTX 5080 Founders Edition and GeForce RTX 5090 Founders Edition graphics cards under various Linux gaming/graphics benchmarks for what I've been able to wrap up so far today compared to recently re-tested prior generation NVIDIA GeForce RTX and AMD Radeon RX graphics cards."", '', 'This initial benchmarking bout for NVIDIA Blackwell Linux gaming included:', '- RTX 2070\n\n- RTX 2070 SUPER\n- RTX 2080\n- RTX 2080 SUPER\n- RTX 2080 Ti\n- TITAN RTX\n- RTX 3070\n- RTX 3070 Ti\n- RTX 3080\n- RTX 3090\n- RTX 4070\n- RTX 4070 SUPER\n- RTX 4070 Ti SUPER\n- RTX 4080\n- RTX 4080 SUPER\n- RTX 4090\n- RTX 5080\n- RTX 5090\n- RX 7800 XT\n- RX 7900 GRE\n- RX 7900 XT\n- RX 7900 XTX', '', ""The GeForce RTX 5080/5090 were running with today's NVIDIA 570.86.16 beta driver while the prior NVIDIA cards were on the NVIDIA R565 stable driver with being re-tested over the course of January. The AMD Radeon graphics cards were using their upstream state with the Linux 6.13 kernel and Mesa 25.0-devel from the Oibaf PPA."", ""The NVIDIA R570 packaged Linux driver is the only means of RTX 50 series support on Linux right now. There isn't yet any Nouveau or experimental NOVA kernel driver support yet for these new Blackwell graphics cards even with leveraging the NVIDIA GSP firmware. Plus the promising Rust-based NOVA driver hasn't even been upstreamed into the Linux kernel yet and will still likely be sometime before that is really primed for the mainline kernel. The NVK Vulkan driver does continue mature within Mesa. But for now those purchasing the $999 or $1999 USD graphics cards will really be wanting to use the NVIDIA packaged driver stack for Linux."", '', ""The NVIDIA 570.86.16 beta driver and the earlier 560.86.10 beta build wuithin the CUDA 12.8 driver package has been working out well for the GeForce RTX 5080 and RTX 5090 atop Ubuntu Linux. I haven't encountered any stability issues, feature limitations, or other issues compared to prior generation NVIDIA GeForce RTX graphics cards on Linux. It's been a great experience with my testing thus far."", ""So let's continue on with an initial look at the GeForce RTX 5080/5090 Linux gaming/graphics performance in several titles that are benchmark-friendly and meet my requirements around reproducibility and automation. Thanks to NVIDIA for supplying these graphics cards for launch-day Linux testing."", ""Phoronix Premium allows ad-free access to the site, multi-page articles on a single page, and other features while supporting this site's continued operations."", 'The mission at Phoronix since 2004 has centered around enriching the Linux hardware experience. In addition to supporting our site through advertisements, you can help by subscribing to Phoronix Premium. You can also contribute to Phoronix through a PayPal tip or tip via Stripe.', '', 'Legal Disclaimer, Privacy Policy, Cookies | Do Not Sell or Share My Personal Information | Contact', 'Copyright © 2004 - 2025 by Phoronix Media.', 'All trademarks used are properties of their respective owners. All rights reserved.']"
"GeForce RTX 5090 & GeForce RTX 5080 Out Now, Featuring Game-Changing AI and Neural Rendering Capabilities, and DLSS 4 With Multi Frame Generation",https://www.nvidia.com/en-us/geforce/news/rtx-5090-5080-out-now/,"['The new GeForce RTX 5090 and GeForce RTX 5080 are out now! Stock-clocked and factory-overclocked models are available from top add-in card providers such as ASUS, Colorful, Gainward, GALAX, GIGABYTE, INNO3D, KFA2, MSI, Palit, PNY, and ZOTAC. NVIDIA Founders Edition models are available in limited quantities from the Best Buy website. And pre-built desktops from system builders, including Falcon Northwest, Maingear, and Origin PC are also available.', 'If you want to add our new graphics cards to your system, for a game-changing upgrade, or want a pre-built PC outfitted with our transformative tech, head over to our GeForce RTX 5090 Product Finder, or GeForce RTX 5080 Product Finder.', 'Powered by the NVIDIA Blackwell RTX architecture, GeForce RTX 50 Series GPUs can double game frame rates, halve app workflow times, increase AI generation performance by 2X, and export video up to 60% faster.', 'View the complete list of GeForce RTX 5090 and GeForce RTX 5080 specifications here', 'DLSS 4 with Multi Frame Generation is available now in over 75 games, including Alan Wake 2, Cyberpunk 2077, and Hogwarts Legacy, and many more games and apps support other DLSS enhancements, such as updated Frame Generation, or the new transformer AI model for Super Resolution, Ray Reconstruction, and DLAA. In games and apps that don’t include native DLSS 4 support, new DLSS overrides in the latest NVIDIA app update enable you to manually upgrade your library.', 'DLSS 4 with Multi Frame Generation gives GeForce RTX 50 Series owners the power to experience graphically-advanced ray-traced games at 4K, at the highest detail levels, at unprecedented frame rates. Play Cyberpunk 2077 maxed out at up to 290 FPS, Alan Wake 2 at up to 230 FPS, and Star Wars™ Outlaws at up to 220 FPS!', 'In creative apps, creators will see improvements for Generative AI, video editing, livestreaming and 3D rendering thanks to updates to the GeForce RTX 50 Series dedicated hardware. ', 'The updated fifth generation Tensor Cores add support for FP4, delivering 2X performance over FP8 gen over gen while reducing the VRAM required to run Generative AI models. And the performance boost is even more compared to FP16.', 'GeForce RTX 50 Series Ray Tracing cores yield an up to 1.4X performance improvement in 3D rendering apps. Plus DLSS Multi Frame Generation boosts viewport framerates in creative apps - delivering 2X the performance over the previous generation when editing 3D scenes in applications like D5 Render.', 'The video encoders and decoders add 4:2:2 pro-grade color format support, allowing you to decode up to 9x 4K30 4:2:2 streams per decoder, and encoding up to a staggering 11X encoding speed compared to software encoders. There’s also three 9th Gen NVIDIA encoders on the GeForce RTX 5090 and 2 on the RTX 5080, and 2x 6th Gen NVIDIA decoders in both, to boost video export speed. The HEVC and AV1 encoders have a 5% improvement in quality. There is also a new AV1 Ultra High Quality mode that improves the quality by an extra 5%. ', 'Livestreamers also benefit from the ninth-gen NVIDIA encoders for better livestreaming quality, especially for those using NVIDIA Broadcast. The new NVIDIA Broadcast app comes with two new beta effects focused on pushing the livestreaming experience to the next level: Studio Voice enhances a user’s microphone to match that of a high-quality microphone. Virtual Key Light relights the subject to deliver even lighting as if a physical key light was defining the form and dimension of the individual.', 'Download NVIDIA Broadcast here', 'Alongside the launch of our new GPUs, gamers and creators can download several new items to enhance their PCs.', 'Our new Game Ready and NVIDIA Studio drivers add support for DLSS 4, new RTX gaming technologies, new games, new NVIDIA Studio technologies and optimizations, new AI optimizations, and NVIDIA app’s new features.', 'And game updates for Alan Wake 2, Cyberpunk 2077, and Hogwarts Legacy add native support for DLSS 4 with Multi Frame Generation, along with new technologies that further enhance image quality.', 'The world’s press and YouTubers have been putting the GeForce RTX 5090 and GeForce RTX 5080 through their paces alongside the game-changing DLSS 4 - here’s a sampling of what they said in their reviews:', 'If you want to add our new graphics cards to your system, for a game-changing upgrade, or want a pre-built PC outfitted with our transformative tech, head over to our GeForce RTX 5090 Product Finder or GeForce RTX 5080 Product Finder.', 'For further information about the technology powering these two new super speed GPUs, and the features enabled by them, check out the following articles:', 'For news about future RTX games, RTX technologies, new GPU launches, new drivers, new NVIDIA software, and more, bookmark the GeForce.com homepage.']"
"Japanese RTX 50 retailer apologizes for lottery-fueled mayhem — unruly crowd caused injuries, damaged nearby kindergarten",https://www.tomshardware.com/pc-components/gpus/japanese-rtx-50-retailer-apologizes-for-lottery-fueled-mayhem-unruly-crowd-caused-injuries-damaged-nearby-kindergarten,"['', 'Store and neighboring businesses were overwhelmed by crowds.', 'When you purchase through links on our site, we may earn an affiliate commission. Here’s how it works.', ""The owner of the Akihabara, Tokyo computer store which held an RTX 50 product release lottery has issued a sweeping apology to customers, neighbors, and everyone else who got caught up in the chaos last week. Unitcom, which operates the PC Studio chain, seemed particularly remorseful over the reports of personal injuries, and damage to a neighboring kindergarten's fences and signage in its press release (Japanese language, machine translated). The chaos and carnage occurred during the firm's ill-feted RTX 5090 and 5080 lottery sales release day event."", '幼稚園侵入してるやつエグいってwwwwまじで捕まってくれ pic.twitter.com/Bww5uP4oXpJanuary 30, 2025', ""Click 'see more' to watch Tommy P's video showing the crowd chaos at PC Studio's RTX 5090 and 5080 lotto event day."", 'PC Studio sought to distribute limited stocks of the freshly released Nvidia GeForce RTX 5090 and 5080 graphics cards fairly by giving customers a chance to buy raffle tickets. The raffle ticket sale was to commence at 10.20 am on Friday, January 31, with only those already in line at that time having a chance to trade a winning ticket with the opportunity to buy a Blackwell GeForce graphics card. The raffle was to be drawn at 11.00 am, and the winners could then enter to claim their rights to an RTX 50 in-store.', 'The best-laid plans of mice and men, and computer store retailers, often go awry, though, and this is very true of the PC Studio lotto. The PCs and parts retail chain had prepared a staff of about 25 people to marshal the crowd and process sales but unfortunately, the crowd was far bigger than expected resulting in (machine translated) descriptions of the event including words like – turmoil, severe damage, and uproar. Unitcom / PC Studio ended its blog post by repeating its regret – ""We apologize deeply,"" it wrote.', ""We've looked around for more details of the chaotic graphics card lottery event, and understand that at least 400 people tried to get in the raffle ticket sales queue. Tokyo Game Life shared a few images of the scenes (while pondering how a Nintendo Switch 2 launch would fare). However, Tommy P's video, embedded top, might provide a better view of the chaos."", 'Of course, unruly personal behavior is entirely the responsibility of any member of the crowd who indulges in it. Unitcom / PC Studio has done the right thing in apologizing to customers and neighbors, though. Some will also lay blame at the door of Nvidia, for its overly hyped and woefully undersupplied Blackwell consumer graphics card retail debut.', 'If you are in the market for an RTX 5080, please keep an eye on our Where to buy the Nvidia RTX 5080 in the US guide, and avoid the rowdy crowds by shopping online.', ""Get Tom's Hardware's best news and in-depth reviews, straight to your inbox."", ""Mark Tyson is a news editor at Tom's Hardware. He enjoys covering the full breadth of PC tech; from business and semiconductor design to products approaching the edge of reason."", 'Korean retail RTX 5090 spotted for sale in China — Chinese shoppers plunder Japan and Taiwan, too', 'Users report bricked or unstable RTX 5090 and 5080 cards — root cause to be determined', 'Expand your storage with a 4TB WD Black SN850X M.2 SSD for only $269 at Amazon', 'Tomshardware is part of Future US Inc, an international media group and leading digital publisher. Visit our corporate site.', '© Future US, Inc. Full 7th Floor, 130 West 42nd Street, New York, NY 10036.']"
