Title,Link,Paragraphs
Houston shoppers brave long lines for powerful new graphics card,https://www.khou.com/article/news/local/dozens-people-wait-hours-line-new-computer-card-houston/285-f74973c4-d338-4581-b64a-5b8b906abbae,"['HOUSTON — Dozens of people waited in line at an electronics store Wednesday night, camping out for the latest computer chip for high-end PCs. The new video graphics card was set to be released Thursday morning.', ""About 115 people were in line at Houston's Micro Center as of 7 p.m. They were waiting for 8 a.m. Thursday, when the new graphics cards would be available."", 'The first group in line was excited to use their graphics cards for video games, video editing, virtual reality and generative AI that require high ""horsepower"" from a personal computer. They had started the line at 7 a.m. Tuesday morning.', 'The Nvidia RTX 5000 series was expected to fly off shelves upon release. Demand for previous versions of the graphics cards was much higher than supply. The release drew similar lines and subsequent reselling.', ""People in line were expecting to pay $2,200 to $2,800 depending on the version. If you weren't inclined to wait for hours in line, the graphics cards would be sold and resold online at a markup of thousands of dollars. People we spoke to were determined to avoid paying the inflated prices, which could reach as much as $6,000."", 'Others worried that tariffs could further raise prices for computer components, raising prices even higher.', 'The line-waiters were expecting an update at 8 p.m. Wednesday, when the store would announce how many units it had to sell. Some people might get disappointing news and leave the line, depending on the inventory.', 'Hopeful shoppers used tents, folding chairs, tables and popups to make their wait more comfortable.', 'The store is on Rice Avenue, just south of Southwest Freeway.', 'People in line expected that gameplay for titles like ""Cyberpunk 2077"" and ""Indiana Jones and the Great Circle"" could be greatly improved by a better graphics card.', '', '', '', '', '', '', '', '', 'IN OTHER NEWS', '', '', '', '', '', '', '', '']"
Review: Nvidia GeForce RTX 5080 Founders Edition,https://www.wired.com/review/nvidia-geforce-rtx-5080-fe-review/,"['', '8/10', 'NVIDIA’S NEWEST 50 Series GPUs are slowly trickling out, and as usual, the very top-end RTX 5090 (7/10, WIRED Recommends) is the graphics card that everyone is talking about. It boasts extreme 4K gaming, the latest in AI-powered gaming enhancements, and a power draw to match.', ""I can’t blame you for not wanting to spend $2,000 on a GPU; that’s enough to build a midrange gaming PC on its own. At just $1,000 for the RTX 5080 Founders Edition, this still-expensive step-down card will be the model that more people seriously consider, even if it's still a splurge. It's a better choice from a performance perspective, meeting people where they already are in terms of monitor resolution, game choice, and existing power supplies."", ""But how does it fare against the more expensive card, and how does it handle some of the more popular and evergreen games? Well enough to my eyes. If you're building your next high-end gaming PC and are looking for a high-end video card to match, this might be exactly what you're looking for—if you can find one for sale."", 'THE FORM FACTOR of the RTX 5080 is identical to its more powerful counterpart, with a true two slot design that should fit in most cases very comfortably. I really appreciate the size reduction overall, and I hope AIC cards follow suit.', 'Where the RTX 5090 draws an immense 575 watts, the 5080 only asks for 360 watts with the same new power connector. Like the RTX 5090 FE, the RTX 5080 includes an adapter, and I imagine most partner cards will as well.', 'That means a lower overall system power requirement, with Nvidia recommending just 850 watts for the Founders Edition. I expect this will be an easier requirement for existing rigs to meet without needing to buy a new 1,000-watt or higher PSU.', 'Nvidia introduced a new version of its AI-powered enhancement tools for the RTX 50 Series. These notably add support for multi-frame generation, which uses AI to generate up to three frames between. If you’re interested in learning more about the effects of using this tech on image quality, make sure to check out the RTX 5090 review.', 'The short version is that multi-frame generation can produce minor artifacts, particularly in areas where two objects at different depths overlap, such as looking through a fence. These are hard to spot across a whole screen though, and the higher frame rate makes the gaming experience much smoother, so the frames are onscreen less time.', 'I’ll start by checking out performance in Cyberpunk 2077, one of the more demanding games that currently supports multi-frame generation.', 'Nvidia GeForce RTX 5080', 'RATING: 8/10', 'If you buy something using links in our stories, we may earn a commission. This helps support our journalism. Learn more. Please also consider subscribing to WIRED', 'While it isn’t perfect, I’m impressed that the RTX 5080 is able to maintain a relatively smooth 60 frames per second while running at 4K, even without having to turn on multi-frame generation. I’m not averse to using the feature, as it does a great job providing extra smoothness with minimal artifacts, but I’d rather just use the card’s natural horsepower when possible.', ""I'm just using ray tracing here, with everything on the highest setting, but Cyberpunk 2077 has an additional setting for path tracing that’s even more demanding."", 'Unsurprisingly, the RTX 5080 has trouble keeping up with path tracing, the most demanding and graphically intensive form of ray tracing. Fortunately, you can break the 60-fps mark by just turning on a single AI-generated frame, which should have a minimal effect on the overall visual quality. I do appreciate the balance here of fine-tuning settings to get close, or turning on frame generation for a big jump in FPS, then comparing the outcomes on a per-game basis.', 'Nvidia GeForce RTX 5080', 'RATING: 8/10', 'If you buy something using links in our stories, we may earn a commission. This helps support our journalism. Learn more. Please also consider subscribing to WIRED', 'The RTX 5090 takes a big lead over the RTX 5080 here, but whether that extra performance is worth it will depend on your existing rig. The RTX 5090 needs a 1,000-watt or higher PSU, and it really benefits from a high-refresh 4K or 1440p screen. If those don’t describe you, know that there are additional costs associated with the highest-end card.', 'Where the RTX 5090 review focused on the top end of performance, I want to zoom in here on games that are less graphically demanding but more commonly played. I cranked the graphics up to Ultra wherever I could, because that’s just what you do with a new GPU. For this first round I used native resolution, but I’ll discuss supersampling as well.', 'These are the kind of numbers I’m excited to see as a daily gamer. These games are meat and potatoes for a lot of folks, and especially at 1440p or lower, you won’t need to tweak much to get them running smoothly.', 'If you’re playing at 1080p and 120 Hz or lower, I recommend supersampling, which lets you render games at 4K and then display them at your monitor’s native resolution. Running Helldivers 2 at 1080p, for example, only used a portion of the GPU’s power. While using Ultra Super-Sampling, the frame rate dropped, but the image quality was much better, and the GPU was running at its full potential.', 'While it may run on mobile phones, the PC version of Minecraft can still demand a lot from your GPU, particularly with the updated ray-tracing models. If you can run it smoothly, it gives the game an incredible boost from what you’re used to, letting light shine through windows and bounce off different textured surfaces.', 'In a forum post early in the morning on January 28, just two days before launch, Nvidia warned buyers of limited availability for the 50 Series cards.', '“We expect significant demand for the GeForce RTX 5090 and 5080 and believe stock-outs may happen. Nvidia & our partners are shipping more stock to retail every day to help get GPUs into the hands of gamers.”', 'Nvidia GeForce RTX 5080', 'RATING: 8/10', 'If you buy something using links in our stories, we may earn a commission. This helps support our journalism. Learn more. Please also consider subscribing to WIRED', 'If previous releases are any indication, the Founders Editions may be even harder to come by than their AIC counterparts. I hoped they might be more plentiful this time around, but the forum warning doesn’t help. If you want a Founders Edition of either card, I’d make sure to bookmark the purchase pages on multiple retailers and check often for restocks.', 'In the RTX 5090 review, I mentioned that the card felt more like a showpiece, or a demonstration model for the new generation’s capabilities. I expect to see more RTX 5080s out in the world, and not just because it’s half the price. Over 50 percent of users in the Steam Hardware Survey reported using a 1080p display as their main screen, and less than 5 percent of PC gamers in the study had a 4K monitor.', 'For a lot of people, having an RTX 5090 would be like buying a Lamborghini when the speed limit is 15 MPH. Meanwhile, the RTX 5080 clobbered basically every commonly played game I threw at it, and its lower power consumption makes it a much easier upgrade path for more people.', 'The biggest problem may just be getting your hands on one, which is a real shame. The RTX 5080 is the card in the 50 Series that I think will appeal to most people, balancing performance, power requirements, and price. The Founders Edition is a premium example too, with a compact form factor and understated styling.', 'Nvidia GeForce RTX 5080', 'RATING: 8/10', 'If you buy something using links in our stories, we may earn a commission. This helps support our journalism. Learn more. Please also consider subscribing to WIRED', 'MORE FROM WIRED', 'REVIEWS AND GUIDES', '© 2025 Condé Nast. All rights reserved. WIRED may earn a portion of sales from products that are purchased through our site as part of our Affiliate Partnerships with retailers. The material on this site may not be reproduced, distributed, transmitted, cached or otherwise used, except with the prior written permission of Condé Nast. Ad Choices']"
"PNY RTX 5080 OC review: ""this GPU is for the next-gen overclockers""",https://www.gamesradar.com/hardware/desktop-pc/pny-rtx-5080-oc-review/,"['When you purchase through links on our site, we may earn an affiliate commission. Here’s how it works.', 'The PNY RTX 5080 OC takes Nvidia’s 4K graphics card up a notch with a factory overclock and a triple fan cooling setup, but the three-slot design is a bit unwieldy compared to the Founders Edition. It also has access to the exact same DLSS 4 and Multi-Frame generation abilities that make the vanilla card worth buying, and its higher boost clock could come in handy for PC games without AI tricks.', 'Factory overclock', 'Triple fan cooling', 'Runs pretty quiet', 'Excellent DLSS 4 abilities', 'Pretty hefty compared to Founders Edition', 'Higher price', 'Why you can trust GamesRadar+ Our experts review games, movies and tech over countless hours, so you can choose the best for you. Find out more about our reviews policy.', 'Yes, I only just shared my Nvidia GeForce RTX 5080 review with all you high-frame rate thrill seekers, but I’ve also been testing the PNY RTX 5080 OC version. While many of you will be looking to grab the Founders Edition model, chances are you’ll end up checking out various factory-overclocked models. While I’d naturally recommend PNY’s take on the 80-class to overclocking enthusiasts first, cards like this could end up being the best option for players with an aversion to AI.', 'That’s not to say I’d avoid using DLSS 4 on the PNY RTX 5080 OC. Ditching the AI tools will simply result in you messing around with settings to boost fps when playing at 4K. However, not every game benefits from the green team’s Frame Generation magic, and in the instances where you’re relying on native performance, overclocked GPUs can pull harder punches in the best graphics card ring.', 'Even though the PNY RTX 5080’s factory overclock ultimately only inches a few frames higher than the Founders Edition, having the freedom to boost clock speeds further can make all the difference. That said, I do have reservations about how useful overclocking is in relation to AI-boosted performance, not to mention the extra cooling required comes with size caveats.', '', 'Just like the Founders Edition model, the PNY RTX 5080 OC is packing a Blackwell GB203 armed with 10,752 CUDA cores, 336 tensor cores, and 84 ray tracing cores. The uplift compared to the RTX 4080 Super is admittedly modest, and that does mean native performance is closer to the Lovelace model than some players may have expected. Perhaps that’s more a commentary on the fact the last generation already packed an unprecedented punch, but new DLSS abilities ultimately change that narrative.', 'Of course, when it comes to models like the PNY RTX 5080 OC specifically, the conversation ends up revolving around clock speeds. This version comes with a factory overclock that ramps up its boost clock from 2,617 MHz to 2,780 MHz, which theoretically should help you boost fps a bit further compared to the Founders Edition or other vanilla cards. That’s certainly the case when it comes to native performance, but I’ll get onto how that mixes with new Frame Generation tricks when chatting performance.', 'Virtually everything else specs-wise about the PNY RTX 5080 OC lines up with the Founders Edition, including its 16GB GDDR7 VRAM, 360W TDP, and 256-bit memory bus. Just in case it isn’t clear, custom versions like this are meant to be slightly souped-up options rather than a completely different model, and while there are performance benefits to using a card designed for overclocking, your out-of-the-box results shouldn’t be worlds apart from other models.', '', 'Just when I thought we were done with huge graphics cards, the PNY RTX 5080 came along and shattered my two-slot dreams. That’s not to say I expected this factory overclock card to match the Founders Edition on slenderness, but I don’t think I was quite expecting something the same size as many custom GeForce RTX 4090 cards from a few years ago. Simply put, this card is one of the largest versions you’ll find this generation, and that might be a good or a bad thing depending on your PC case space.', 'Keep in mind that the PNY RTX 5080 is a triple fan graphics card, and that naturally makes it more of a chonk. Enhanced cooling is pretty much vital when it comes to overclocked GPUs, not to mention it’ll suit some of you who’ve always used a card with this kind of cooling setup. While some of you will be quite happy to whack a new component into your rig regardless of its design, some systems are laid out with a three-fan shroud in mind, and sticking with that means airflow should remain the same.', 'As for aesthetics, the PNY RTX 5080 keeps things pretty corporate with no RGB and a black shroud highlighted by logo text. Despite its enormous stature, this card should blend in with your existing system pretty well, and even the little GPU support bracket/screwdriver hybrid included with the package is fairly inconspicuous. Just keep in mind that if you’re upgrading from something older than Nvidia’s 30-series, the size of this GeForce card could catch you off guard and interfere with your PCIe component space.', 'In line with every Nvidia graphics card from the last generation, the PNY RTX 5080 uses a 12-pin power connector. Unlike the Founders Edition, the socket isn’t angled, but it is recessed within the shroud a little to combat any bulky cabling issues preventing your case door from closing. The design choice means extruding wires will partially occupy the same footprint as the GPU itself, and it’s a better solution than simply having them aggressively extend outwards from the card. That said, I did find it tricky to get my fat thumbs around the dongle to remove it, which feels like it could spark future frustration if the need to remove it crops up.', 'Both the RTX 5080 and its flagship RTX 5090 rely on Nvidia’s new DLSS 4 as a standout feature. The PNY RTX 5080 is no different in that it uses revamped versions of AI Super Sampling and Multi-Frame Generation alongside enhanced ray tracing techniques to boost performance and fidelity. Access to those tricks is dependent on whether developers add support, but with many PC games are releasing with the settings built-in by default, playing with AI enhancements switched on is slowly becoming a standard.', 'That said, overclocked cards like the PNY RTX 5080 are designed to give you ways to boost fps without AI shackles. You won’t even have to immediately play around with boost clock speeds yourself seeing as this model comes with that aforementioned factory overclock, but you’ll then be able to tweak things further using PNY’s Velocity X software. The app itself is fairly straightforward and keeps things simple with small menus for clock speed sliders, fan temperature curve customization, and pre-set buttons. It’s pretty much the same app that’s been around since the RTX 3090 but still offers a simple way to experiment with overclocking while striking a balance between frame rate boosts and thermals.', 'Speaking of software, the PNY RTX 5080 also uses the new Nvidia App as a base station for driver settings and access to the GPU’s other features. You’ll be able to access many of the options previously concealed within the GPU marker’s older Control Panel hub, optimize game settings in a central place, and tap into creative tools like Nvidia Broadcast for streaming. It’s certainly an improvement over the old Nvidia GeForce Experience app, and while it’s compatible with GPUs outside of the 50-series, it’ll still help you better access your expensive new GPU’s tricks.', '', 'Pitting the PNY RTX 5080 against the Founders Edition GPU feels less like a boxing match and more like shadowboxing. That’s hardly surprising since we’re effectively talking about the same graphics card, only the PNY version is wearing a thicker set of armor and has perhaps chugged five espressos before swinging into action. What I’m saying is that I did see slightly higher frame rates thanks to the factory overclock in some instances during testing, but I otherwise felt like I was using the same graphics card.', 'Let’s chat native performance first, as the PNY RTX 5080 did inch higher than the Founders Edition in Cyberpunk 2077, pulling off a 74fps average with 4K ultra settings enabled. Sure, a 3fps difference isn’t anything to get that excited about, but it does prove that even slightly boosted clock speeds can help claw back some frames. Hitman 3 ended up in the same boat, hitting 166fps rather than 164fps at base clock speeds.', 'Hardly exciting, right? Well, keep in mind this is out-of-the-box performance, so overclocking the card further could help you inch ever higher up the frame rate ladder. What I will say is that in Total War: Warhammer 3, I was able to squeeze 91fps at 4K out of the card compared to 87fps using the stock card. That’s around 4.6% of an increase, and if that sort of benefit applies to future games hovering around 60fps, that could come in clutch.', 'If I’ve learned one thing from benchmarking the PNY RTX 5080 and Founders Edition in the same week, it’s that boost clock increases become less valuable with DLSS 4 enabled. That makes sense seeing as Multi-Frame Generation will take the GPU’s generated visuals and effectively fill in the gaps, meaning the minor frame gains are mixed in with AI-generated fps.', 'Don’t get me wrong, that’s not necessarily a bad thing. The fact we’re at a stage where playing around with settings and tweaking clock speeds to churn out a few extra frames is pretty nice. If you find that sort of thing fun, you’ll likely disagree, but I’d honestly take being able to ramp up fps from 66fps to 309fps in Dragon Age: The Veilguard using DLSS 4 than sinking time into tweaking individual settings to inch a few frames higher.', 'Timespy: 32,416\nFirestrike: 53,332', 'I’m not saying everyone should start using DLSS 4 without question, and I’ll be looking closely at the pros and cons of this frankly revolutionary tech over the next few months. What I will say is that Nvidia is pretty on the ball with coming up with solutions for its own problems, implementing a new Transformer AI model to help combat artifacts and any shenanigans caused by upscaling. As I already touched on in my Founders Edition rundown, I wasn’t able to sniff out many visual hiccups playing the likes of Cyberpunk 2077 and Dragon Age: The Veilguard, and I’m already seeing an impressive improvement compared to the early days of DLSS 2 and original techniques.', 'It’s also worth noting that in some scenarios, latency could become a bit of an issue, even if tools like Nvidia Reflex seem to be offsetting any of those caveats at the moment. Put it this way, I’ve spent a nice chunk of time this week playing Marvel Rivals at 4K with Multi-Frame Generation switched on and didn’t catch onto any delayed inputs, even though I managed to kick things up from 70fps to 312fps.', 'Frame rates aside, I was admittedly more interested in the PNY RTX 5080’s cooling abilities and whether opting for a massive tri-cooler shroud is beneficial. The answer is a resounding yes, as the highest temperature I managed to get out of this card was around 64°C. I’m not saying that puts the Founders Edition’s efforts to shame, as you’re still talking about results sitting mostly in the sixties. But, the fact that I got away with playing Cyberpunk 2077 in RT Overdrive mode while the card happily burred away at sometimes 59°C is mighty impressive.', 'Before you ask, no, the PNY RTX 5080 doesn’t make a racket to achieve those temperatures. The cooling system ended up providing a similar gentle hum to Nvidia’s own design, but your mileage may vary based on your choice of case and setup. Just know that you aren’t going to hear the card’s cooling efforts under normal circumstances, and it helps justify the model’s egregious size.', '', 'Just like the Founders Edition, the PNY RTX 5080 OC pulls off phenomenal 4K frame rates using DLSS 4 and Multi-Frame Generation. If you do opt for this factory overclocked card, you will also see further games in native performance, which could please some of you out there with an aversion to AI tools. The fact it’s larger than Nvidia’s stock card is a drawback worth keeping in mind, but it does come with noticeable cooling benefits that will help make further boost clock tweaks more of a reality.', 'Those of you looking to buy an RTX 5080 might not have a choice between a vanilla card and something like the PNY RTX 5080 OC. If that ends up being the case for you specifically, just know that PNY’s model is a custom option I can comfortably recommend despite its size and higher MSRP. Ultimately, an overclocked card like this is going to be that bit more futureproof compared to a model with limited room for boosts, so you can attribute any extra investment to that.', ""Over the course of a week, I tested the PNY RTX 5080 OC side by side with the Founders Edition model while comparing both graphics cards in terms of design and performance, During that time, I used a set collection of benchmark games including Cyberpunk 2077, Hitman 3, Total War: Warhammer 3, Dragon Age: The Veilguard, and Marvel Rivals and collated average frame rates for both cards. In turn, this enabled me to directly compare the overclocked PNY card to Nvidia's Founders Edition to check for performance benefits."", 'For more on how we test graphics cards and other components, take a look at our full GamesRadar+ Hardware policy.', 'Looking to pick up a next-gen GPU? Check out where to buy the RTX 5090 and where to buy the RTX 5070. Alternatively, swing by the best Alienware gaming PCs if you want an out-of-this-world rig that’s ready to go.', 'I’ve been messing around with PCs, video game consoles, and tech since before I could speak. Don’t get me wrong, I kickstarted my relationship with technology by jamming a Hot Wheels double-decker bus into my parent’s VCR, but we all have to start somewhere. I even somehow managed to become a walking, talking buyer’s guide at my teenage supermarket job, which helped me accept my career fate. So, rather than try to realise my musician dreams, or see out my University degree, I started running my own retro pop culture site and writing about video games and tech for the likes of TechRadar, The Daily Star, and the BBC before eventually ending up with a job covering graphics card shenanigans at PCGamesN. Now, I’m your friendly neighbourhood Hardware Editor at GamesRadar, and it’s my job to make sure you can kick butt in all your favourite games using the best gaming hardware, whether you’re a sucker for handhelds like the Steam Deck and Nintendo Switch or a hardcore gaming PC enthusiast.', 'Gamesradar is part of Future US Inc, an international media group and leading digital publisher. Visit our corporate site.', '© Future US, Inc. Full 7th Floor, 130 West 42nd Street, New York, NY 10036.']"
