Title,Link,Paragraphs
Does NASCAR Clash win for Chase Elliott mean anything long term? Just maybe. Here's why.,https://www.hendrickmotorsports.com/news/articles/138962/nascar-clash-win-chase-elliott-hendrick-motorsports-cup-series,"['', 'CONCORD, N.C. - Historically speaking, one could get in trouble pretty quickly trying to draw some sort of correlation between a win in the Clash and overall success in the NASCAR Cup Series the same season. ', ""Sure, there are exceptions. Since the event's inaugural run in 1979, the driver who won the Clash went on to win the ensuing DAYTONA 500 six times. On eight occasions, the Clash winner eventually claimed a season championship in the same year. "", 'Only once has a driver won the Clash, the DAYTONA 500 and the points title - Hendrick Motorsports vice chairman Jeff Gordon in 1997. It was one of a pair of Clash wins for Gordon whose first win as the driver of the No. 24 Hendrick Motorsports Chevrolet came in the preseason opener in 1994. ', 'Even after turning in the most dominating performance in Clash history this past weekend at Bowman Gray Stadium, winning all three practice sessions in which he took part, the pole and then leading 171 of 200 laps en route to victory, Chase Elliott kept it in perspective while fielding postrace questions. ', '""I mean, look, I know it\'s not a points race, but I don\'t care. These things, man, they are so hard to win,"" Elliott said. ""This garage has become so competitive, these guys are so good at what they do, it\'s very rewarding to cross the finish line first in whatever type of event it is when you\'re racing against those types of drivers and teams.', '""That to me is very enjoyable from our perspective. We\'ll take the positives from the weekend. For sure we recognize there\'s 37 more to go. There\'s a lot of racing left. Just hope we can build on this.""', '', '', 'The word, ""build"" is an incredibly pertinent one in Elliott\'s situation. ', ""One reason Elliott's victory on Sunday could well be a harbinger of things to come in 2025 is because it only continued the trajectory the team has been on for quite some time, dating back into 2024. And that trend took an even sharper upward turn later in the season as Elliott pushed for a Championship 4 berth, only to come up one spot short at Martinsville Speedway in the season's penultimate race. "", 'But Elliott led 129 laps in that event, a week after leading 81 circuits at Homestead-Miami Speedway. Those 210 laps paced, made up 48.7% of his laps led on the season, including a win at Texas Motor Speedway. ', 'So, obviously, the team was surging as the year came to a close and Sunday seemed to signal that Elliott, crew chief Alan Gustafson and the No. 9 bunch may be poised to pick up right where they left off. ', '""I thought last year was a really good step for us to getting back to the form we want to be in, and that\'s winning championships and being in the Final 4,"" Gustafson said. ""I think as long as you\'re moving forward and continuously improving, if you can do that, you\'re going to get where you want to be. I felt like last year that was the case. We got better from the previous year, kind of got better throughout the whole season.""', ""Also, important to note in Elliott's case is the venue. From 1979-2020, the Clash was held on the big track at Daytona International Speedway, a place where upset winners routinely reign supreme. "", 'That changed when the Clash went to the Daytona Road Course in 2021 and even more so in 2022 when it changed venues and coastlines, heading to the Los Angeles Coliseum for a three-year stint on a quarter-mile short track. ', 'The oval on Sunday at Bowman Gray was certainly closer to the Coliseum than Daytona, though, despite their matching lengths, drivers insisted there were plenty of differences between the two. But more importantly, Bowman Gray is also at least somewhat similar to a few other tracks on the NASCAR Cup Series schedule, most notably Martinsville and Phoenix Raceway, that last two stops on the slate with the latter hosting the Championship 4 race. ', '', '', 'The last two years, Ryan Blaney and Joey Logano have each won a championship at Phoenix with Blaney sweeping the past two fall events at Martinsville. Again, on Sunday, Blaney charged to the front of the field but this time, could do nothing with Elliott, who held him off down the stretch for the win. ', ""There's a long season ahead and certainly, Sunday's results don't mean that come late October and early November, things will play out the same way. But Sunday's result can't be completely dismissed either and if Elliott and the No. 9 bunch go on to have a big 2025, the Clash may just be remembered as an early message to the rest of the field. "", '“Grip is grip,” Gordon said. “Those guys really had something special and you could see the car was working well. Chase I thought was doing a great job managing the tires and the balance and I just thought all the way around it was a good weekend for the No. 9 team in a big way. I don’t know how much of that transfers over to anything else but if they can find one, tiny ounce, they’ll take it.” ', '""I think it\'s just some validation to we all tried to come here and win, we all tried to come here and be successful, and we were able to,"" Gustafson added. ""Gives you validation in your process, validation in how your team is operating and working. Certainly, I think it\'s going to give Chase some confidence and validation seeing he did an amazing job to win the race. Basically, did everything right.""']"
"NASCAR Through the Gears: Chase Elliott wins Clash, Denny Hamlin doesn't and Super Bowl rules",https://www.news-journalonline.com/story/sports/nascar/2025/02/03/nascar-clash-results-chase-elliott-daytona-500/78177266007/,"['""Hurry up and wait"" isn\'t just for the DMV or doctor\'s office.', 'That remains the early-season NASCAR strategy — for now, and yes, we’ll explain in a bit.', 'NASCAR fired out of the blocks with two nights of action at Bowman Gray, and now jams the clutch and holds its horses for 10 days before gearing up again at Daytona.', 'The coming weekend won’t be a complete downer, you might’ve heard. Basically an entire nation will be captivated by a little something we like to call “the Daytona 500 of professional football.""', 'And yes, that’ll also be part of a little chatter down below as we go through the gears before re-entering the idle mode for a short rest …', 'Need a break? Play the USA TODAY Daily Crossword Puzzle.', 'QNA WITH SVGA chat wtih Shane van Gisbergen as full-time Cup season, Daytona 500 approach', 'Well, what did you think? ', 'When Chase Elliott wins, most folks are happy. When he wins by rooting Denny Hamlin out of the lead, many others are happy. ', 'So, there’s that. And that.', 'The small-venue/big-crowd vibe was great. And Winston-Salem is tucked inside a part of the country that’s long been hard-NASCAR country and therefore deserved the weekend spotlight. ', 'And right about here, you feel a however coming, don’t you? Well, you got it.', 'However, it sure feels like there’s an obvious reason NASCAR long ago quit racing on quarter-mile tracks with big stock cars. Contact is unavoidable and no one is against occasional contact, but it all feels more like a steady lean against each other than a punt-and-run or door-slap. ', 'For my money, now that Rockingham is back in play for Xfinity and Trucks this year, let’s give the one-mile Rock a real look for next year. Or maybe half-mile North Wilkesboro when you decide to take its All-Star Race elsewhere. But certainly a half-miler at minimum. ', 'Others will surely disagree.', 'We can rest assured about the where of future Clashes (it’ll surely bounce around). But the when?', ""That’ll depend on the timing of the NFL’s move to an 18-game season. The current 17-game slate leads into a playoff schedule ending with the Super Bowl on the Sunday before NASCAR comes to Daytona in the middle of the following week — this year's Daytona Speedweek is Feb. 12-16."", 'Barring other maneuvers, adding an 18th game to the schedule would presumably move the Super Bowl back a week, to the Daytona 500’s long-favored slot — the Sunday before the third Monday of February, which is Presidents Day weekend.', 'With many folks off work on Presidents Day, that sure seems like a perfect fit for Super Bowl Sunday, considering how many yawners you see at the next day’s water cooler. NASCAR would likely just move everything back a week, and there’s precedent for that.', 'From 2012-17, the 500 was scheduled for the Sunday before the fourth Monday of February. Eventually, we’re probably headed there again, because when the NFL stretches its legs, the whole world makes room.', 'Barring a late, late, last-minute announcement, we’re looking at 45 entries for the 67th Daytona 500. ', 'Let’s do some math. Thirty-six chartered teams are guaranteed starting spots, so that means … let’s see, 45 minus 36 … yep, there you go, nine teams have to make the field through one of two forms of qualifying.', 'Of the nine non-guaranteed cars, the two fastest in next Wednesday’s pole qualifying (Feb. 12), which only sets the front row, gain entry onto the Daytona 500 starting grid. The other seven will have to earn spots in the next day’s 150-mile qualifying races. ', 'Four will be in one qualifier, three in the other. The highest finisher in each makes the field.', 'Here’s your brand new “however,” however. Helio Castroneves, due to a new rule allowing for star-power race entries, is guaranteed a Daytona start, so even if he doesn’t make one of the above cuts, he’s in as the 41st starter. ', 'So, after all that, here are your nine hopefuls … yes, including Helio, who’s in regardless (in order of car number):', '● 01: Corey Lajoie, Ford, Rick Ware Racing', '● 40: Justin Allgaier, Chevrolet, JR Motorsports', '● 44: JJ Yeley, Chevrolet, NY Racing', '● 56: Martin Truex Jr., Toyota, Tricon Garage', '● 62: Anthony Aldredo, Chevrolet, Beard Motorsports', '● 66: Chandler Smith, Ford, MBM Motorsports', '● 78: BJ McLeod, Ford, Live Fast Motorsports', '● 84: Jimmie Johnson, Toyota, Legacy Motor Club', '● 91: Helio Castroneves, Chevrolet, Trackhouse Racing', ""You see the driver of the No. 01 above? You might be seeing more of him in the years to come. Or not, if you don't subscribe."", 'Corey LaJoie is one of those modern racers with a genuine personality, and he makes the most of it. Unfortunately, it hasn’t been parlayed into enough Cup-level sponsorship to accelerate his racing career.', 'But Corey recently announced a part-time racing plan for 2025 which will include a barely-off-track gig as a broadcaster for Amazon’s five midseason races. ', 'By the way, Amazon’s five weeks of NASCAR coverage begins with the Coke 600 in late May. You have well over three months to either subscribe or prepare for Uncle Ed’s outburst when he realizes he’s stuck with baseball for over a month of Sundays.', '— Email Ken Willis at ken.willis@news-jrnl.com']"
NASCAR’s most popular driver wins in return to historic North Carolina track,https://www.wbtv.com/2025/02/03/nascars-most-popular-driver-wins-return-historic-north-carolina-track/,"['WINSTON-SALEM, N.C. (WBTV) - The most popular driver in NASCAR won in the sport’s return to a historic North Carolina racetrack on Sunday night.', 'Chase Elliott, driver of the Hendrick Motorsports No. 9 car, dominated in the Cup Series’ return to Bowman Gray Stadium in Winston-Salem.', 'Elliott led 171 of 200 laps en route to his first victory at The Clash. Sunday marked the first time Bowman Gray hosted the preseason event, and was the first time the Cup Series raced at the historic quarter-mile track since 1971 when Bobby Allison won.', 'NASCAR’s defending seven-time most popular driver started on the pole for Sunday’s main event and held the lead for nearly the first 100 laps before Denny Hamlin and Tyler Reddick each briefly took the lead.', 'After the race, Elliott thanked fans for making the return to Bowman Gray “special.”', '“Thanks to everybody for coming out,” he said right after getting out of the car. “Y’all made for a really fun environment, and you know, we don’t race in stadiums like this, so it’s just really cool and I appreciate y’all making that moment special for me and my team. This was awesome.”', 'The venue serves as the football stadium for Winston-Salem State’s football team but has long hosted races, including weekly ones throughout the middle part of the year. Elliott said the fans “deserved” to see a Cup race there and said he hopes NASCAR’s highest level returns to the unique short track.', '2023 Cup Series champion Ryan Blaney -- who started dead last -- made a charge through the field and put pressure on Elliott for the last few dozen laps of the race but was unable to get by him and came home second. Hamlin, Joey Logano and Bubba Wallace rounded out the top five, respectively.', 'Next up on the NASCAR schedule is Daytona 500 qualifying on Wednesday, Feb. 12, followed by the duels on Thursday and then of course the running of the race itself on Sunday, Feb. 16.', 'Related: Iconic NASCAR driver to make return at historic North Carolina speedway', 'Copyright 2025 WBTV. All rights reserved.']"
Bowman Gray doesn’t disappoint. So should Clash return in 2026?,https://www.foxsports.com/stories/nascar/bowman-gray-doesnt-disappoint-so-should-clash-return-2026,"['', '', 'WINSTON-SALEM, N.C. — Chase Elliott exited his race-winning car to a delighted standing-room only crowd cheering wildly in Bowman Gray Stadium.', '""I hope we didn\'t disappoint,"" Elliott said. ""It was fun for me at least. We\'ll hopefully come back here one day.""', 'This was the first Cup event weekend in 53 years at the football stadium that doubles as a storied racetrack. And it provided NASCAR a nice throwback to its roots for its annual preseason exhibition race. NASCAR’s previous experiment for the event, building a racetrack inside the Los Angeles Memorial Coliseum, had run its course after three years.', 'So NASCAR took the Clash to a track where Cup cars once raced and one that still enjoys a healthy spring and summer schedule of racing featuring NASCAR’s modified division. Known for its wild and raucous — and sometimes pugilistic — nights of racing, the track affectionately known as ""The Madhouse"" got a facelift from NASCAR. The league owns the promotional rights for racing at the publicly owned stadium.', 'About 40 percent of the 17,000 seats were sold to locals and the rest to fans who wanted to see Cup cars trying to navigate on what is essentially your standard quarter-mile running track. NASCAR had to add energy-absorbing walls, a new catchfence and new lights to meet its Cup standards. But the event certainly had that Saturday night racing feel, albeit on a Sunday night.', ""Fans stood up lap after lap, just as they would for other races at the track. Josh Berry advanced from the last-chance qualifier with a car that had to be repaired with specialized racing tape after all the damage it sustained in the event. The drivers showed tempers, although they didn't overflow into any fisticuffs or need for bail money."", '""I’m looking forward to hopefully coming back next year,"" said Ryan Blaney, who started 23rd in the 23-car main event and finished second. ""I don\'t see why you wouldn\'t come back.""', 'While both the LA Memorial Coliseum and Bowman Gray were both quarter-mile tracks, the Bowman Gray track was completely flat and also had some imperfections as far as the wall. In order to keep the authenticity of the track, the new steel-absorbing wall included areas that jutted into the upper groove in the turns, just as the old guardrail that had to be replaced to accommodate the Cup cars.', '""I just feel like if we\'re going to race on a football field, this is probably as good of a place as any to do it,"" Elliott said as he sat in the postrace news conference, which is normally the weight room for Winston-Salem State University, where the stadium is located.', ""By going to an existing track rather than the temporary one in Los Angeles, the drivers could race on a worn surface instead of on a freshly paved one. When tracks are freshly paved, the racing typically isn't quite as good."", '""[The track] just seemed bigger to me,"" Elliott said. ""I don\'t know what the technical distance would be, how different it is or not. The straightaways seemed a little longer, the corners weren\'t so sharp, it didn\'t seem like it was such a sharp apex. ', '""All of those things, that combined with the track surface having some age to it, probably had a pretty large impact on the race being better and kind of putting it a little more in your hands as far as tire management and all that stuff.""', 'Elliott had raced in a regional stock-car series at the track in 2011 and 2012, but he didn’t feel that helped him, as these heavy stock cars raced much differently than any other vehicle on the track.', 'Neither of the local track modified stars made the main event but certainly helped with the weekend vibe. Tim Brown, a 12-time track champion, was greeting fans at one of the area’s most famous hot dog joints the day before getting on the track.', 'Burt Myers, an 11-time champion, got wrecked out of the last-chance qualifier and still couldn’t help but smile after exiting the care center.', '""The lights, the walls, the whole facility, the infield, everything the way it looks, it brought it to a Cup level,"" Myers said.', '""To see them do that to my little home track here in Winston-Salem was heartwarming on my end.""', 'Myers is used to racing in front of solid crowds at the track during the summer. For the Cup drivers, a crowd of close to 20,000 will likely be the smallest of the season.', 'So does NASCAR do this somewhere else and potentially help another facility? It potentially could have agreements where, instead of the track pocketing the money that it would get from the television contract for the event, NASCAR spends that money on upgrades.', 'There has also been consideration of making this race an international event.', 'And, especially after a successful (albeit a little cold) race Sunday night, there will be increased chatter about making a return to Bowman Gray.', '""There\'s going to be just as many people here next year as there was tonight,"" Blaney said. ""I don\'t think it would lose any of its luster.""', 'Joey Logano, who finished fourth, could see both arguments for wanting to return next year versus going somewhere else. At least in the short term.', '""It looks good, the energy is real,"" Logano said. ""It\'s not like you have this ginormous stadium and you get half or three quarters of it full. It’s standing room only, it\'s a special feel, it\'s hard to get the ticket.', '""People want what they can\'t have, right? In the same breath, I would say it\'s very important for us to move things around. We seen the success of our sport moving to new racetracks. I\'m a big fan of going to new race tracks.""', 'Elliott stressed the importance, though, of going to facilities where every fan seems to be into it.', '""Probably the biggest lesson I\'ve taken from the weekend is kind of reaffirming my belief in less is more,"" Elliott said. ""Like this crowd. It wasn\'t 80,000, 90,000, but it was a smaller number. A more intimate number.""', ""When Elliott wins a race, though, the crowd seems bigger since he is the sport’s most popular driver. Blaney even joked a little that there was only one way for him to pass Elliott for the win, and he didn't dare do it."", '""I\'m not going to bulldog into him and get chased out of here with pitchforks,"" Blaney said.', 'Drivers rarely show restraint at Bowman Gray. The fans come to see drivers occasionally dump another. The race Sunday attracted fans from 44 states and five countries.', 'Even without seeing a driver wreck another for the win, these fans most likely will want to come back. The only question is when.', '""They took a facility here that\'s been around for a long time and made it feel like a brand new one,"" said veteran driver and team co-owner Denny Hamlin. ""The fans obviously were very, very excited to see us. They were enthusiastic. We feed into that. It felt like a big event even though it\'s not a points-paying event or anything like that.', '""You want to go wherever can give you that feel and atmosphere. There\'s surely bigger venues and bigger cities to go to, but will you have this type of feel or not? That\'s really what matters.""', 'Bob Pockrass covers NASCAR for FOX Sports. He has spent decades covering motorsports, including over 30 Daytona 500s, with stints at ESPN, Sporting News, NASCAR Scene magazine and The (Daytona Beach) News-Journal. Follow him on Twitter @bobpockrass.']"
