Title,Link,Paragraphs
"Chase Elliott controls, wins Cook Out Clash in Cup Series return to Bowman Gray",https://www.nascar.com/news-media/2025/02/02/2025-nascar-cup-series-clash-bowman-gray-race-recap/,"['', 'CLASH AT BOWMAN GRAY', 'By Reid Spencer', '', 'NASCAR Wire Service', 'Published: February 2, 2025', '4 Minute Read', '', '', '', '', '', '', '', '', '', '', '', '', '', '', '', '', '', '', '', '', '', '', '', '', '', '', '', '', '', '', '', '', '', '', '', '', '', '', 'By using NASCAR.com, you are agreeing to our Terms of Use and Privacy Policy , including our Cookie Policy.']"
NASCAR Winston Salem Auto Racing,https://www.couriernews.com/sports/nascar-winston-salem-auto-racing/image_47052333-445f-5053-8410-871a7cb618fd.html,"['', '', '', '', '', 'Driver Noah Gragson looks on prior to a NASCAR Cup Series auto race at Bowman Gray Stadium, Sunday, Feb. 2, 2025, in Winston-Salem, N.C.', 'Cloudy with a few showers. Low 44F. Winds light and variable. Chance of rain 40%.', 'Cloudy with a few showers. Low 44F. Winds light and variable. Chance of rain 40%.', 'A few showers early with overcast skies later in the day. High 59F. Winds light and variable. Chance of rain 40%.', '', '', '', '', '', '', '', '', '', '', '', '', '', '', '', '', 'Learn more about your privacy options', '', '', '']"
NASCAR’s Clash Proves It Can Go Anywhere—Even The Madhouse,https://www.forbes.com/sites/gregengle/2025/02/02/nascars-clash-proves-it-can-go-anywhere-even-the-madhouse/,"['WINSTON SALEM, NORTH CAROLINA - FEBRUARY 01: Tyler Reddick, driver of the #45 Jordan Brand Toyota', '', '', '', '', '', '', '', '', '', '', '', '', '', '', '', '', '', '', '', '', '', '', '', '', '', '', '', '', '', '', '', 'SPECIAL OFFER', '$\n9.99', 'Billed Monthly', '$\n74.99', 'Billed Annually', '$\n145', 'Billed Biennially', 'Subscriptions renew automatically. You may cancel your subscription at any time.', 'Benefits']"
NASCAR Clash at Bowman Gray: Time to move past mere entertainment,https://www.planetf1.com/features/nascar-clash-bowman-gray-opinion,"['We use technology such as cookies on our site to collect and use personal data to personalise content and ads, to provide social media features and to analyse our traffic.', 'The NASCAR Cup Series field practices for the Clash at Bowman Gray Stadium.', 'Chase Elliott took a decisive victory at Sunday’s 200-lap NASCAR Clash, an exhibition event that was hosted for the first time at the historic Bowman Gray Stadium in North Carolina.', 'The racing was messy, with both the Last Chance Qualifier and the main event studded by needless crashes as drivers fought for position; while many fans were critical of the quality of racing, many did admit to being entertained. But shouldn’t we be looking for something more than mere entertainment?', 'Beginning in 1979, the NASCAR Cup Series season kicked off with a non-championship event known as the Clash. At the time, the event was seen as a way to bring race fans into Daytona for Speedweeks, or, the several week period where endurance racing and stock car racing swapped the stage.', 'In an era of unreliability, the Clash was a great way for the NASCAR field to get warmed up for the year. As reliability improved, fan loyalties turned the Clash into a can’t-miss event, one that filled grandstands in and of itself.', 'But as the 2020s got underway, teams grew concerned about the amount of money they were throwing away to compete in a non-points-paying race, and series executives started to toy with the format.', 'First, the event was moved from the Daytona International Speedway oval to the infield road course. Then, the Clash headed out to the Los Angeles Memorial Coliseum — a small venue that received much of the same criticism as that I’m about to levy, albeit with the added bonus of drawing a whole new audience into the sport.', 'This year, NASCAR moved the Clash to Bowman Gray Stadium, one of the legacy oval tracks that defined the early years of the Cup Series. The small nature of the track required four heat races to set the field, with a contentious Last Chance Qualifier completing the lineup ahead of the main event.', 'Chase Elliott won both his heat race as well as the main event, allowing the fan favorite driver to take home his first-ever Clash victory. But beyond that, Sunday’s racing was characterized by reckless driving and lots of wrecks. Many fans, unsure of what to make of the whole affair, decided that, at the very least, the wrecks made for some captivating entertainment.', '👉 NASCAR lawsuit: All the allegations of monopoly-like behavior against the Cup Series', '👉 NASCAR Playoffs explained: Format, rules, tracks, and schedule', 'But shouldn’t entertainment be just one of the many factors against which we evaluate a race in 2025?', 'All forms of sport, be it racing or something like football, seek to find the ideal balance between sporting integrity and entertainment. Fans need to tune into these events, to go out of their way to attend them — but with events like the Clash, that entertainment is beginning to conflict with the integrity of NASCAR, and the goals of the series.', 'Over the past several years, NASCAR has pushed itself to evolve, adding street circuits or international races to its calendar while balancing out its growth by trying to cut developmental costs — and it has been exceptionally promising.', 'A race on the streets of Chicago proved that NASCAR Cup Series racing can transcend the oval format and engage new audiences, while the implementation of the Next-Gen car was hailed as being as good for teams’ pocketbooks as it has been for drawing in international talent like Shane van Gisbergen.', 'But the Clash at Bowman Gray flew in the face of those goals. As drivers collided with each other and bit the wall for an event that is of no direct consequence to the 2025 championship, it was difficult not to wonder how much the repair bill would be, and what value any of the teams were getting from any of this.', 'The location itself gave cause for concern. The Cup Series stopped turning up at the quarter-mile Bowman Gray Stadium all the way back in 1971 because its cars had outgrown the oval, and the problem of size popped up again and again during the Clash as drivers fought for purchase — generally by simply knocking a competitor out of the way.', 'While drivers like Ryan Blaney, Kyle Larson, and Chase Elliott all displayed legitimate and considered race craft when it came to positioning their cars and overtaking other drivers, most of the rest of the field relied on bumper shoves and late braking to mount a move, and it generally resulted in chaos.', 'The Clash was entertaining, at least in the most basic sense that a lot of drama happened, and a lot of cars wrecked. But the whole event felt like a bastardization of the ethos driving modern NASCAR and forced a certain level of cognitive dissonance.', 'To enjoy the wrecks in the Last Chance Qualifier, it was necessary to ignore that many of the cars in the event were there because they’re fielded by smaller-budget teams, and that those teams will find it more challenging to afford a slew of repairs — an especially daunting task considering the Cup Series’ crown jewel race, the Daytona 500, is on the horizon.', 'Entertainment is important in racing, yes, but defining entertainment as “lots of wrecks” does a disservice to the drivers, teams, and fans invested in the growth and evolution of NASCAR.', 'Read next: Explained: NASCAR Cup Series points and championship format', '', '', '', '', '© Planet Sport Limited 2025 • All Rights Reserved']"
No title found,https://www.msn.com/en-us/sports/other/chase-elliott-runs-the-madhouse-blaney-s-wild-charge-larson-s-nightmare-at-the-clash-part-2/vi-AA1yp07W,[]
"NASCAR Power Rankings: Ryan Blaney, Chase Elliott move to top after Clash",https://www.foxsports.com/stories/nascar/nascar-power-rankings-ryan-blaney-chase-elliott-move-top-after-clash,"['', '', 'The preseason Clash at Bowman Gray is in the books, and while NASCAR does not have any points races on quarter-mile ovals, the Clash did give a peek into how teams could perform this year. ', 'Bowman Gray Stadium was still a short track, and it was similar to Martinsville. As a matter of fact, drivers used the same tire as Martinsville.', 'Here’s this week NASCAR’s power rankings, based on a mix of performance at Bowman Gray and how a driver should perform this year.', '1. Ryan Blaney (Last Week: 3)', 'He didn’t win the Clash, but his run might have been the most impressive, as he went from last (23rd) to second over the 200-lap race. And the Penske driver did it without making enemies.', '2. Chase Elliott (LW: 6)', 'The sport’s most popular driver opened 2025 by delighting his fans with the victory at Bowman Gray. The Hendrick driver wasn’t just good in the main event; he was good in practice, qualifying and the heat race, too. ', '3. Joey Logano (LW: 7)', 'Logano finished fourth at the Clash, which was a solid start to defending his title. All three Penske cars finished in the top seven, and affiliate car Josh Berry placed 13th, an indication this track fell in the Penske wheelhouse. ', '4. Christopher Bell (LW: 1)', 'On the other side of the spectrum, only one Joe Gibbs Racing driver finished in the top 10. Bell finished second in his heat but ended up 12th in the main event.', '5. Kyle Larson (LW: 2)', 'Larson was impressive in winning the last-chance qualifier, a race he probably didn’t expect to run but was relegated to after a spin in his heat. The main event was a challenge, as Larson was 17th, partially because his Hendrick car was turned with 85 laps remaining.', '6. Denny Hamlin (LW: 10)', 'Hamlin was terrible at the start of the weekend and improved throughout to finish third. Making those gains during the race weekend could be a sign that the crew chief change at JGR won’t hinder his performance.', '7. Tyler Reddick (LW: 5)', ""Reddick won his heat and looked strong early in the main event before losing the handle of his car and settling for eighth. Not a bad finish, but more was expected considering the 23XI Racing driver's strong start to the weekend."", '8. William Byron (LW: 4)', 'Byron had a pretty forgettable weekend. He started 11th, got turned with 85 laps to go (the same time as his HMS teammate Larson) and never recovered to finish 18th. Now he heads to Daytona, where he’s the defending Daytona 500 winner.', '9. Brad Keselowski (LW: 8)', 'Keselowski finished second in his heat and was having a solid run until being turned with 80 laps remaining. That turned out to be the final caution of the day. The RFK Racing driver never got back on the lead lap and finished 21st.', '10. Bubba Wallace (LW: NR) ', 'A more than respectable fifth-place finish for Wallace in his first event with new 23XI Racing crew chief Charles Denike. For starting where he did at 14th, Wallace could leave Bowman Gray with a smile.', 'Dropped out: Alex Bowman (LW: 9)', 'On the verge: Alex Bowman, Chase Briscoe, Chris Buescher, Kyle Busch, Ross Chastain, Austin Cindric', 'Bob Pockrass covers NASCAR for FOX Sports. He has spent decades covering motorsports, including over 30 Daytona 500s, with stints at ESPN, Sporting News, NASCAR Scene magazine and The (Daytona Beach) News-Journal. Follow him on Twitter @bobpockrass.']"
Winston-Salem officials say NASCAR race put city in the national spotlight,https://www.wfdd.org/story/winston-salem-officials-say-nascar-race-put-city-national-spotlight,"['', '', 'by April Laissle', 'Events at Bowman Gray Stadium on Feb. 1, 2025. SANTIAGO OCHOA/WFDD', 'Winston-Salem officials are celebrating the success of last weekend’s NASCAR race at Bowman Gray Stadium. At a meeting on Monday, City Manager Pat Pate said the event went off without a hitch and brought much-needed attention to the area. ', '“Winston-Salem was mentioned on national TV so many times,"" he said. ""We can\'t count how much that would cost if we were trying to put those ads out there ourselves.”', 'Concessions at the event brought in revenue too, though the final numbers are still being tallied. Assistant City Manager Ben Rowe says NASCAR declined to fund an official economic impact analysis, but that doesn’t mean it’s off the table.', '“I may look into it on the city side, but not necessarily looking to pay six figures for an economic impact study,"" he said. ""But if we have local resources or universities that might be able to do something, we might look into that.”', 'Officials say the city will likely also see increased funds from hotel occupancy taxes. ', 'Donate', '']"
"What channel is NASCAR Clash qualifying on today? Time, TV schedule, streaming info",https://www.tennessean.com/story/sports/nascar/2025/02/01/nascar-clash-qualifying-channel-today-time-tv-schedule-cup-series/78055244007/,"['', '', '', '', '', '', '', '', '', '', '', '', '', '', '']"
AT-TRACK PHOTOS: 2025 COOK OUT CLASH AT BOWMAN GRAY,https://www.nascar.com/gallery/at-track-photos-2025-cook-out-clash-at-bowman-gray/,"['', '', '', '', '', '', '', '', '', '', '', '', '', '', '', '', '', '', '', '', '', '', '', '', '', '', '', '', '', '', '', '', '', '', '', '', '', '', '', '', '', '', '', '', '', '', '', '', '', '', '', '', '', '', '', '', '', '', '', '', '', '', '', '', '', '', '', '', '', '', '', '', '', '', '', '', '', '', '', '', '', '', '', '', '', '', '', '', '', '', '', '', '', '', '', '', '', '', '', '', '', '', '', '', '', '', '', '', '', '', '', '', '', '', '', '', '', '', '', '', '', '', '', '', '', '', '', '', '', '', '', '', '', '', '', '', '', '', '', '', '', '', '', '', '', '', '', '', '', '', '', '', '', '', '', '', '', '', '', '', '', '', '', '', '', '', '', '', '', '', '', '', '', '', '', '', '', '', '', '', '', '', '', '', '', '', '', '', '', '', '', '', '', '', '', '', '', '', '', '', '', '', '', '', '', '', '', '', '', '', '', '', '', '', '', '', '', '', '', '', '', '', '', '', '', '', '', '', 'By using NASCAR.com, you are agreeing to our Terms of Use and Privacy Policy , including our Cookie Policy.', '', '', '', '', '', '', '']"
Race Results: 2025 Cook Out Clash at Bowman Gray,https://www.racingamerica.com/news/nascar/race-results-2025-cook-out-clash-at-bowman-gray,"['', '24/7 Free Streaming Channel', '', '', 'NASCAR', 'LATE MODELS', 'MODIFIEDS', 'TOBY CHRISTIE', 'SERIES', 'TRACKS', 'RESULTS', 'Upcoming Events on', '24/7 Streaming Ch. (Free)', 'UARA Sportsman at Freedom Factory', 'Pro Late Models at Cordele', 'Alabama 200 at Montgomery', 'Rattler 250 Thursday at South Alabama', 'PPV - Easter Bunny 150 Friday at Hickory', '', '', '', '', '', '', '', '', '', '', 'ADVERTISEMENT', 'Chase Elliott emerged victorious over Ryan Blaney for the win in the Cook Out Clash at Bowman Gray Stadium. Here are the complete results from the annual exhibition event.', 'NASCAR', ""Chase Elliott took the race win from the pole position in Sunday's NASCAR Cup Series Cook Out Clash at Bowman Gray Stadium. Elliott held off Ryan Blaney, who started from the last position in the starting grid and rallied to finish runner-up."", 'Denny Hamlin came home in the third position, and he was followed by Joey Logano and Bubba Wallace inside the top-five.', 'ADVERTISEMENT', 'ADVERTISEMENT', ""The event featured four lead changes among three drivers. Elliott, the race-winner, led the most laps on the night as he was in front of the field for 171 of the race's 200 laps. Elliott led the final 75 laps of the race."", 'Denny Hamlin led the second-most laps in the race with 10 laps led, and Tyler Reddick also led one time for one lap.', 'There were also eight caution flag periods during the race, two prior to the halftime competition caution. Following the competition caution, there were five cautions.', ""Sunday's race marked the first NASCAR Cup Series event at Bowman Gray Stadium since the 1971 season."", 'Photo Credit: Sean Gardner, Getty Images for NASCAR', 'ADVERTISEMENT', 'RACING AMERICA NEWSLETTER', 'NASCAR CUP SERIES', 'Chase Elliott Earns Cook Out Clash Pole After Wild Bowman Gray Heat Races', 'Feb 2, 2025', 'NASCAR CUP SERIES', 'Pye-Barker Returns as 14-Race Primary Sponsor for JHN, No. 42 LMC Team', 'Jan 30, 2025', 'NASCAR CUP SERIES', 'National Debt Relief Joins Denny Hamlin, Joe Gibbs Racing for Four-Race Sponsorship', 'Jan 30, 2025', 'Join Our Growing Racing Community!', 'RACING AMERICA & SPEED51 TRADEMARKS ARE OWNED BY RTA MEDIA HOLDINGS, LLC', '© 2025 RTA MEDIA HOLDINGS, LLC. ALL RIGHTS RESERVED.', '']"
How to watch NASCAR: Your hub for the 2025 season,https://www.nascar.com/news-media/2025/01/31/how-to-watch-nascar-your-hub-for-where-to-view-nascar-events/,"['', 'NASCAR CUP SERIES', 'By Staff Report', '', 'NASCAR.com', 'Published: January 31, 2025', '3 Minute Read', '', '', '', '', '', '', '', '', '', '', '', '', '', '', '', '', '', '', '', '', '', '', '', '', '', '', '', 'By using NASCAR.com, you are agreeing to our Terms of Use and Privacy Policy , including our Cookie Policy.', '', '', '', '', '', '', '']"
,https://www.wxii12.com/article/nascars-clash-race-day-fan-schedule-bowman-gray-stadium/63634504,"['', '', '', 'The NASCAR racing action has finally arrived for the Clash at the Madhouse at Bowman Gray Stadium.', 'Here’s a look at the race day schedules for fans to get in all the action.', '9:00 am - NASCAR-Coordinated Parking Lots and Shuttle Transportation Open', 'On-site and Off-site at Innovation Quarter and Allegacy Stadium', '9:00 am - Merchandise Trailers Open', 'Fan Zone - East Parking Lot', '10:00 am - East, South and West Gates Open', 'Bowman Gray Stadium', '10:00 am - 6:00 pm - Fan Zone Open', 'Fan Zone - East Parking Lot', '11:15 am - 12:00 pm - Cook Out Madhouse Classic Practice', 'ON-TRACK ACTION', '12:00 pm - 12:45 pm - Cook Out Madhouse Classic Qualifying', 'ON-TRACK ACTION', '1:20 pm - Cook Out Madhouse Classic Pre-Race and Driver Introductions', 'ON-TRACK ACTION', '1:45 pm - COOK OUT MADHOUSE CLASSIC', 'ON-TRACK ACTION', '3:15 pm - 3:30 pm - Bubba Wallace Q&A at NASCAR EXPERIENCE', 'Fan Zone - East Parking Lot', '3:30 pm - 3:45 pm - Ricky Stenhouse Jr. Q&A', 'Fieldhouse Hospitality', '3:30 pm - 4:00 pm - Wood Bros. Q&A Panel at NASCAR EXPERIENCE', 'Fan Zone - East Parking Lot', '4:00 pm - 4:15 pm - Chase Elliott Q&A at NASCAR EXPERIENCE', 'Fan Zone - East Parking Lot', '4:15 pm - 4:30 pm - Alex Bowman Q&A at NASCAR Experience', 'Fan Zone - East Parking Lot', '4:30 pm - Driver/Team Track Walk', 'ON-TRACK', '4:40 pm - 4:55 pm - Tim Brown (Rick Ware Racing) Q&A at NASCAR Experience', 'Fan Zone - East Parking Lot', '6:10 pm - NASCAR Cup Series Clash Practice and Qualifying', 'ON-TRACK ACTION', '', '3:00 pm - NASCAR-Coordinated Parking Lots and Shuttle Transportation Open', 'On-site and Off-site at Innovation Quarter and Allegacy Stadium', '3:00 pm - Merchandise Trailers Open', 'Fan Zone - East Parking Lot', '3:30 pm - 3:45 pm - Joey Logano & Coleman Pressley Q&A at NASCAR Experience', 'Fan Zone - East Parking Lot', '3:45 pm - 4:00 pm - Josh Berry Q&A at NASCAR Experience', 'Fan Zone - East Parking Lot', '4:00 pm - East, South, and West Gate Open', 'Bowman Gray Stadium', '4:00 pm - 4:15 pm - Ryan Blaney Q&A at NASCAR Experience', 'Fan Zone - East Parking Lot', '4:15 pm - 4:30 pm - Kyle Larson Q&A at NASCAR Experience Stage', 'Fan Zone - East Parking Lot', '4:30 pm - 4:45 pm - William Byron Q&A at NASCAR Experience', 'Fan Zone - East Parking Lot', '4:45 pm - 5:00 pm - Kyle Busch, Richard Childress & Austin Dillon Q&A at NASCAR Experience', 'Fan Zone - East Parking Lot', '6:00 pm - NASCAR Clash Last Chance Qualifier', 'ON-TRACK ACTION', '7:50 pm - CLASH Pre-Race and Driver Introductions', 'ON-TRACK ACTION', '8:00 pm - COOK OUT CLASH AT BOWMAN GRAY', 'ON-TRACK ACTION', 'Before you head to the track find out what you need to know about parking.', '', '', '', 'NASCAR officials designated two areas for race fans to park. One is the Allegacy Stadium lots, where Wake Forest football fans park and the other area is in the Innovation Quarter along Research Parkway. Fans will ride in comfort from there to the track in climate-controlled shuttles.', 'All parking lots at and near the track are being used by NASCAR and their broadcast partners.', 'The Winston-Salem Police Department also sent the following information about road closures for the weekend.', 'Temporary road closures include:', 'Saturday, Feb. 1, 2025', '8 a.m. to 11:30 p.m.', 'Sunday, Feb. 2, 2025', 'Noon to 11:30 p.m.', 'Argonne Boulevard at Calvert Drive — NASCAR Credentialing Traffic Only', 'Argonne Boulevard at S. Martin Luther King Jr. Drive – NASCAR Credentialing Traffic Only', '**Residents affected by this temporary road closure are encouraged to use Peachtree Street (north) to access Reynolds Park Road, or Argonne Boulevard (south) to access Waughtown Street.', 'Williamson Street at S. Martin Luther King Jr. Drive – West Lot Pre-Paid Parking Only', 'Williamson Street at Timlic Avenue – West Lot Pre-Paid Parking Only', 'Diggs Boulevard at Bruce Street – West Lot Pre-Paid Parking Only', '**Residents affected by this temporary road closure are encouraged to use Diggs Boulevard (south) to access Vargrave Street, U.S. Route 52, and Waughtown Street.', 'If you need to buy parking passes for the Cookout Clash at Bowman Gray or need additional information, here is the link.', 'Click here if you want to book a camping spot at the Winston-Salem Fairgrounds.', ""Want more Madhouse click below to subscribe to WXII 12's YouTube channel and check out extended interviews NASCAR's Hall of Famers, legends, and past highlights and racing action from Bowman Gray Stadium."", ""Subscribe to WXII's YouTube channel here"", 'Check out the haulers arriving earlier to set up for the Clash!', '', '', '', '', '', '', 'Hearst Television participates in various affiliate marketing programs, which means we may get paid commissions on editorially chosen products purchased through our links to retailer sites.']"
Race Rewind: The Clash Opens The Season With A Bang At Bowman Gray,https://www.autosport.com/nascar-cup/video/race-rewind-the-clash-opens-the-season-with-a-bang-at-bowman-gray/658720/,"['', '', '', 'It\'s the No. 9 that survives the ""Madhouse."" Chase Elliott wins the Cook Out Clash in its first year at Bowman Gray Stadium.', 'Receive exciting Motorsport news, updates, and special offers straight to your inbox.', '', '', '']"
