Title,Link,Paragraphs
Should NASCAR’s Cup Series return to Bowman Gray Stadium next year or look for change?,https://www.charlotteobserver.com/sports/nascar-auto-racing/article299110465.html,"['', 'By so many metrics, the NASCAR Cup Series’ season-opening event was a hit.', 'The Clash at Bowman Gray Stadium was a sellout, fit with intense race fans standing shoulder-to-shoulder in collective vigor. They yelled together. Flashed birds together. Forty percent of all the fans were from the local Triad region in North Carolina, NASCAR said; the rest were from 44 states and five countries and three continents. Screams for the local legends — all-time winningest drivers Tim Brown and Burt Myers — were louder than the rest, and those two guys didn’t even make it past the Last Chance Qualifier, the undercard to Sunday’s main event.', 'There were bumper bumps and spin-outs. Tempers flared. Ty Gibbs went airborne when he tried to retaliate under caution once. There were no confrontations like last year’s All-Star race — North Wilkesboro Speedway presents the same bullring sorta deal that breeds contempt and racing moments — but there was plenty of action on the racetrack nonetheless, a day that ended with the sport’s most popular driver, Chase Elliott, earning the first Clash victory of his career.', 'Still, come a mere 30 minutes after the checkered flag, drivers were asked to weigh in on 2026:', 'Should NASCAR return to the same venue, for the same event, at the same time a year from now?', 'Some, like second-place finisher Ryan Blaney, were swift with a “yes,” adding that there will be “just as many people here next year as there was tonight.” Others, like his Team Penske teammate and 2024 champion Joey Logano, had mixed feelings.', '“From what I hear, they pack this place out every weekend without the star power of Cup guys. Just race fans, they like racing,” Logano said. “The other thing, too, to remember is it’s not a huge stadium, right? You pack it out, it looks good, the energy is real. It’s not like you have this ginormous stadium and you get half or three quarters of it full. Standing room only, it’s a special feel. It’s hard to get the ticket, and people want what they can’t have, right?”', 'He added: “On the same breath I would say it’s very important for us to move things around. We’ve seen the success of our sport moving to new racetracks. ... We’ve done that over the last five, six years. We’ve added new racetracks quite often. I think that’s successful.', '“Doing the same thing eventually gets stale, but I don’t think that’s going to happen here anytime soon.”', 'Denny Hamlin, who finished third, made it clear that he didn’t want to minimize what will be a memorable night for NASCAR. Bowman Gray Stadium, after all, is the quarter-mile track home to the 100th Cup win of Richard Petty; the football field-turned-racing heaven that hosted so many Cup moments before the series left in 1971 and didn’t return until Sunday; the racetrack that hosts weekly races that regularly draws tens of thousands of attendees.', 'But he also realizes that thinking ahead is important.', '“Certainly I don’t want to say this wasn’t good enough,” Hamlin said. “They took a facility here that’s been around for a long time and made it feel like a brand-new one. The fans obviously were very, very excited to see us. They were enthusiastic. We feed into that. It felt like a big event. Even though it’s not a points paying event or anything like that, it still feels big.', '“You want to go wherever can give you that feel and atmosphere. There’s surely bigger venues and bigger cities to go to, but will you have this type of feel or not? That’s really what matters.”', 'Elliott, the winner, naturally had a lot of positive things to say. Winning enhances experiences, surely. But he also thought that the racing was good — much better than what happened at the Coliseum in Los Angeles in the latter two of the three years NASCAR hosted the Clash there. Tire wear was a factor, he said. Passing wasn’t abundant but was feasible. The race’s seven cautions didn’t clutter the race — but possibility still lurked on every lap, around every corner, as it should at a place like this.', '“(The track) seemed bigger to me,” Elliott said. “I don’t know what the technical distance would be, how different it is or not, but the straightaways seemed a little longer. The corners weren’t so sharp. It didn’t feel like such a sharp apex. And that combined with the track surface having some age to it — I think all three of those things had a pretty large impact on the race being better and putting it a little more in your hands as far as tire management and all that stuff. “', 'Elliott, if nothing else, loved the fact that NASCAR is exploring “coming back” to important racetracks — including North Carolina venues Rockingham Speedway and North Wilkesboro.', '“You hate to see those cornerstone racetracks, of what paved NASCAR to be what it is today, shut down or go away,” Elliott said. “So if us having a race, or if it’s the Rockingham case where Xfinity and Trucks are over there, if that’s gonna keep that place alive and keep it from shutting down or getting bulldozed, then I think that’s a victory for motorsports.”', '', 'Real-time updates and all local stories you want right in the palm of your hand.', 'Part of the McClatchy Media Network']"
"NASCAR Clash winners and losers: Ryan Blaney nearly goes from worst to first, while Kyle Busch struggles",https://www.tennessean.com/story/sports/nascar/2025/02/02/nascar-clash-reaction-kyle-busch-ryan-blaney-winners-and-losers/78167490007/,"['The NASCAR Cup Series season informally began with the Cook Out Clash exhibition race on Sunday at the quarter-mile Bowman Gray Stadium in Winston-Salem, N.C., and the best of stock car racing was on display.', ""Chase Elliott won Sunday's Clash, leading 172 of 200 laps and holding off Ryan Blaney to win."", 'Other than added SAFER barriers and ads painted on the infield, Bowman Gray Stadium was the same track that local drivers in Winston-Salem race on weekly. It forced drivers to use bumpers to make passes, though with the understanding that bumping can go both ways.', 'It produced some of the best racing of the series over the last several years and a major upgrade from the makeshift LA Coliseum track of the past three years in the Clash.', 'Here is our list of winners and losers coming out of the NASCAR Clash:', 'Need a break? Play the USA TODAY Daily Crossword Puzzle.', 'RECAP:NASCAR Cup Series race at Clash: Live updates, highlights, live leaderboard as Chase Elliott wins the Clash', ""FROM THE LCQ:Watch Ty Gibbs' car go airborne after NASCAR Clash wreck with Justin Haley"", ""What a stunning drive for the 2023 Cup Series champion. Blaney elected to settle for the points provisional after finishing outside of the top five in Saturday's heat race, locking him into the 23rd and last starting spot on Sunday. Blaney steadily worked through the field up to the halfway break, then raced into the top 10 early in the second half of the 200-lap event."", ""Blaney avoided a pair of crashes and chased down Denny Hamlin for second place with 50 laps to go. Blaney couldn't quite catch Elliott for the lead as the two worked through lap traffic, and a near-wreck while trying to pass Kyle Busch with 10 laps to go all but ended his chances at the win."", ""Still, other than Elliott's win, Blaney's run through the field was the story of the night."", ""This weekend was a major success for fans at the track and watching at home. The track forces drivers to be physical but smart with who and how they race. Local star and track champion Burt Myers wrecked late in the last chance qualifier but was competitive. The stands were filled throughout Sunday's qualifier and the main event, and the 200-lap Clash was some of the best racing of the last several seasons as the series' best drivers drove balancing tact and aggression."", 'Something about this weekend was different than the LA Coliseum Clash racing (and the last two years of the All-Star Race at North Wilkesboro, for what it is worth). The site of the 2026 Clash has yet to be announced, but I cannot imagine there being a place that produces more compelling racing than BGS.', 'This was the best short-track racing of the NextGen era.', 'Busch was never competitive in the race, spinning on Lap 21 and staying outside the top 10 for the entirety of the race. He finished 15th.', ""This isn't about one race; Busch's night looked like a copycat from so many races in 2024. The No. 8 Richard Childress Racing team hoped those performances were in the past. Not only did Busch struggle, but Austin Dillon failed to make the Clash field at his grandfather's home track."", 'Gibbs was by the far the highest-profile car/driver combination to miss the 200-lap main. Despite leading early in the last chance qualifier, he fell behind Kyle Larson, Austin Dillon, Erik Jones and others. Josh Berry spun Gibbs around on Lap 57, all but ensuring that he was going to miss the field.', ""Who knows what internal pressure is on Gibbs in 2025, given his family connection to Joe Gibbs Racing. He is only 22 after all, but this is his third full season in the Cup Series and he's yet to win a race or establish himself as a consistent contender. This weekend was not a good start to the season for the No. 54 Toyota.""]"
Your Privacy,https://www.si.com/onsi/racing-america/news/srigley-nascar-s-return-to-bowman-gray-stadium-was-a-smashing-success-01jk6dpgny4s,"['On Sunday, in Winston-Salem, North Carolina, roughly 17,000 people were crammed into the standing-room only grandstands of Bowman Gray Stadium, where they flocked to watch the NASCAR Cup Series return to the historic quarter-mile facility for the first time since 1971.', 'Those 17,000 people, which at points throughout the night sounded like 170,000, came from 44 different states, five different countries, and three continents to watch one of the most historic racetracks in the United States host some of NASCAR’s best and brightest.', 'There were no brawls breaking out in the middle of the racetrack, or any super aggressive on-track retaliations, so maybe it wasn’t the most chaotic race that Bowman Gray Stadium has ever put on (which is probably a good thing), but the on-track product was stellar, and included lots of full-contact racing.', 'In this instance, it wasn’t about what the NASCAR Cup Series brought for the people packed into the grandstands, in terms of the on-track product, but it was more about what the fans brought to the NASCAR Cup Series… the true spirit of Bowman Gray Stadium.', 'Just ask Ricky Stenhouse, Jr., he experienced it first-hand, after getting into local legend Burt Myers and sending him crashing into the Turn 1 SAFER Barrier during the Last Chance Qualifier on Sunday. Collectively, Bowman Gray wasn’t a fan of the HYAK Motorsports driver.', 'That’s the pure beauty of Bowman Gray Stadium, though… the unhinged culture means that fans aren’t bashful about informing drivers of their number one status… even if they have to show them twice.', '“I thought the pre-race ceremony was pretty cool,” said defending NASCAR Cup Series champion Joey Logano. “The fans being right there, it’s what Bowman Gray is, right? You have the fans heckling you, saying whatever they want, saying you’re number one in two different ways. That’s what Bowman Gray was built off of.”', '“I don’t know if you guys got the boos I got,” Logano quipped. “Overall, I would say it was successful. When fans are cheering and screaming, the drivers’ brands are being exposed to everybody, which is great. Everyone has a favorite or not. You’re passionate about it.”', 'All of that energy, whether it’s just the general hype of those getting to watch a NASCAR Cup Series event at ‘The Madhouse’, rooting on your favorite driver, or making obscene gestures at a driver who just passed your favorite driver, funnels into an electric atmosphere, one that the driver certainly notice.', '“It was an extremely special moment. I think the people in the crowd made it that,” said race-winner Chase Elliott. “I’m thankful for that. It was a moment I’ll never forget, for sure. It’s not every day you not only race in an environment like that, but to have the opportunity to win and kind of share that moment with the crowd, it was really cool.”', 'It’s not just the fans in the stands that deserve credit for a successful return to Bowman Gray Stadium, but also NASCAR, who over the last several months have spent countless hours, and a lot of dollars, preparing this quarter-mile racetrack to be up-to-spec for the NASCAR Cup Series – adding a catchfence and SAFER Barriers.', '“I thought NASCAR did a good job of making a show, which is exactly what they wanted for all of this,” said Bubba Wallace. “I think the pre-race stuff was really fun. I thought the fans were engaged. It was good. It was good from start to finish. The best thing about it, is most of us in the room got a 45-minute drive back home. Not a stay in LA, fly six hours. All in all, it was a good weekend.”', 'Denny Hamlin, owner of Wallace’s NASCAR Cup Series entry, and driver of the No. 11 Joe Gibbs Racing Toyota Camry, also offered his props to NASCAR, saying: “I was happy. I thought the atmosphere was fantastic. I thought NASCAR Productions did really well with kind of the whole pre-race and everything. Yeah, made it feel like a big event. I thought overall it was a good exhibition, pre-season to our season coming up in a couple of weeks.”', 'The initial success of the Cook Out Clash at Bowman Gray Stadium has raised a number of questions about whether the pre-season exhibition event should return to Winston-Salem, North Carolina, or if the event should branch off into new markets, like NASCAR tried by having the event at the LA Memorial Coliseum from 2022 to 2024.', '“Looking forward to hopefully coming back here next year,” Blaney said in a post-race press conference. “I don’t see why you wouldn’t come back here. Hope everyone had a good time. You’re going to pack it out. There’s going to be just as many people here next year as there was tonight. I don’t think it would lose any of its luster.”', 'Three-time NASCAR Cup Series champion Joey Logano agreed, saying: “From what I hear, they pack this place out every weekend without the star power of Cup guys. Just race fans, they like racing. The other thing, too, remember its not a huge stadium. You pack it out, it looks good, the energy is real, it’s not like you have this ginormous stadium and you get half or three quarters of it full. Standing room only, it’s a special feel. It’s hard to get the ticket, which people want what they can’t have.”', 'An overwhelming consensus, at least from the drivers that performed well on Sunday at Bowman Gray Stadium, is that they would love to come back to the quarter-mile track for another edition of the Cook Out Clash.', ""“I don’t have any issue with coming back,” said Chase Elliott. “Like I said, overall, it seemed like a good show. The tire wear came into play. The environment from not only tonight but last night, the place was packed out. Just seemed like a good all-around event. Yeah, I just feel like if we're going to race on a football field, this is probably as good of a place as any to do it.”"", 'Even Noah Gragson, who finished 20th in the main event Sunday, was on-board with returning to Bowman Gray Stadium, and when asked by Andrew Kurland of Dirty Mo Media whether the track should host a points-paying race for the NASCAR Cup Series, had an excitable response: “F**k yeah.”', 'And I’d imagine, there are at least 17,000 people who would agree with him.', 'Joseph Srigley covers NASCAR for TobyChristie.com, Racing America, and OnSI, and is the owner of the #SrigleyStats brand. With a higher education in the subjects of business, mathematics, and data analytics, Joseph is able to fully understand the inner workings of the sport through multiple points of perspective.', 'Follow joe_srigley?s=21', ""© 2025\nABG-SI LLC\n- SPORTS ILLUSTRATED IS A REGISTERED TRADEMARK OF ABG-SI LLC. - All Rights Reserved. The content on this site is for entertainment and educational purposes only. Betting and gambling content is intended for individuals 21+ and is based on individual commentators' opinions and not that of Sports Illustrated or its affiliates, licensees and related brands. All picks and predictions are suggestions only and not a guarantee of success or profit. If you or someone you know has a gambling problem, crisis counseling and referral services can be accessed by calling 1-800-GAMBLER.""]"
SPORTS,https://www.nbcchicago.com/news/sports/nascar-race-today-cook-out-clash-time-tv-channel-lineup-results/3662997/,"['A general view of racing during qualifying heat race No. 1 for the Cook Out Clash at Bowman Gray Stadium on Feb. 1, 2025 in Winston Salem, North Carolina.', 'NASCAR is back.', 'After a few months away for the offseason, the top stock car races in the world are back on the track this weekend at a historic venue.', '', 'NASCAR is returning to Bowman Gray Stadium for the first time since 1971. The legendary short track, just a quarter-mile long, is nicknamed the ""Madhouse"" for all the chaos that its close quarters have produced.', ""Here's all the info for the race, including when it starts, how to watch it and who is competing:"", 'The season unofficially begins each year with ""The Clash,"" a preseason exhibition event. This year\'s event, for sponsorship purposes, has been dubbed the ""Cook Out Clash at Bowman Gray Stadium.""', ""While there are no championship points on the line, drivers want to win whenever they're on track. A victory in the Clash is sometimes a springboard for a driver to have a standout season. The Clash winner has gone on to win the title eight times in Cup Series history, including most recently Joey Logano in 2022."", 'For the first time ever, Bowman Gray Stadium will play host to the Clash. The track is located in Winston Salem, North Carolina, and seats 17,000 people.', '', 'The action on Sunday begins at 6:30 p.m. ET with the last chance race, where 19 drivers will be fighting for the last three spots in the main event.', 'The Cook Out Clash is scheduled for 8 p.m. ET on Sunday, with green flag expected at 8:20 p.m. ET.', 'Yes.', 'All action Sunday -- including the last chance race and the main event -- will air live on FOX and stream on FoxSports.com.', ""There were four heat races held on Saturday night to help set the field for Sunday's main event. Here are the results of those four races, with the top five in each automatically advancing to the Clash:"", 'HEAT 1', 'HEAT 2', 'HEAT 3', 'HEAT 4', 'With five drivers from each heat already locked into the Clash, we know the top 20 starters for the event. The final three spots will be filled from the last chance race -- with the top two finishers and the highest driver in the points standings from last year filling the field of 23.', ""Here's the starting lineup for the Clash:"", ""The NASCAR season officially begins with the Daytona 500 in two weeks, on Feb. 16, for the first points-paying event of 2025 in the sport's most iconic race."", 'Sign up to receive breaking news alerts in your inbox.', '', '', '', '', '', '', '', '']"
"Qualifying format, setting the lineup and practice groups for Cook Out Clash explained",https://www.nascar.com/news-media/2025/01/31/format-revealed-for-2025-cook-out-clash-at-bowman-gray-stadium/,"['', 'NASCAR CUP SERIES', 'By Zach Sturniolo', '', 'NASCAR.com', 'Published: January 31, 2025', '3 Minute Read', '', '', '', '', '', '', '', '', '', '', '', '', '', '', '', '', '', '', '', '', '', '', '', 'By using NASCAR.com, you are agreeing to our Terms of Use and Privacy Policy , including our Cookie Policy.']"
