Title,Link,Paragraphs
www.politico.com,https://www.politico.com/live-updates/2025/01/31/congress/dei-not-to-blame-crash-graves-00201777,['Verifying you are human. This may take a few seconds.']
Trump says helicopter in Washington crash was flying too high,https://www.reuters.com/world/us/trump-says-blackhawk-helicopter-dc-crash-was-flying-too-high-2025-01-31/,"['Get weekly news and analysis on U.S. politics and how it matters to the world with the Reuters Politics U.S. newsletter. Sign up here.', 'Reporting by Phil Stewart, Idrees Ali Doina Chiacu in Washington; Editing by Toby Chopra and Nia Williams', 'Our Standards: The Thomson Reuters Trust Principles.\n, opens new tab', 'Thomson Reuters', 'Phil Stewart has reported from more than 60 countries, including Afghanistan, Ukraine, Syria, Iraq, Pakistan, Russia, Saudi Arabia, China and South Sudan. An award-winning Washington-based national security reporter, Phil has appeared on NPR, PBS NewsHour, Fox News and other programs and moderated national security events, including at the Reagan National Defense Forum and the German Marshall Fund. He is a recipient of the Edwin M. Hood Award for Diplomatic Correspondence and the Joe Galloway Award.', 'Thomson Reuters', 'National security correspondent focusing on the Pentagon in Washington D.C. Reports on U.S. military activity and operations throughout the world and the impact that they have. Has reported from over two dozen countries to include Iraq, Afghanistan, and much of the Middle East, Asia and Europe. From Karachi, Pakistan.', 'Trump unveiled his surprise plan, without providing specifics, at a press conference with Netanyahu.', ""Reuters, the news and media division of Thomson Reuters, is the world’s largest multimedia news provider, reaching billions of people worldwide every day. Reuters provides business, financial, national and international news to professionals via desktop terminals, the world's media organizations, industry events and directly to consumers."", 'Build the strongest argument relying on authoritative content, attorney-editor expertise, and industry defining technology.', 'The most comprehensive solution to manage all your complex and ever-expanding tax and compliance needs.', 'The industry leader for online information for tax, accounting and finance professionals.', 'Access unmatched financial data, news and content in a highly-customised workflow experience on desktop, web and mobile.', 'Browse an unrivalled portfolio of real-time and historical market data and insights from worldwide sources and experts.', 'Screen for heightened risk individual and entities globally to help uncover hidden risks in business relationships and human networks.', 'All quotes delayed a minimum of 15 minutes. See here for a complete list of exchanges and delays.', '© 2025 Reuters. All rights reserved']"
Advocates Decry Trump For Blaming Plane Crash On People With Disabilities,https://www.disabilityscoop.com/2025/01/31/advocates-decry-trump-for-blaming-plane-crash-on-people-with-disabilities/31279/,"['by Michelle Diament | January 31, 2025', 'President Donald Trump speaks about a collision involving an American Airlines passenger jet and an Army helicopter during a press briefing at the White House in Washington on Thursday. (Yuri Gripas/Abaca Press/TNS)', 'Over a dozen disability advocacy groups are blasting President Donald Trump for baselessly implicating federal workers with disabilities in the deadly American Airlines plane crash near Washington, D.C.', 'Less than a day after the passenger flight collided with a U.S. Army Black Hawk helicopter near Ronald Reagan Washington National Airport leaving no survivors, Trump told reporters said that diversity efforts at the Federal Aviation Administration were to blame. During a briefing on the crash, Trump cited a Fox News article from last year.', '“It says FAA says people with severe disabilities are most underrepresented segment of the workforce and they want them in and they can be air traffic controllers. I don’t think so,” Trump said.', 'Advertisement - Continue Reading Below', 'The information referenced in the article that the president cited has been in place on the FAA’s website since at least 2013, including the entirety of Trump’s first term, according to Snopes, the fact-checking website.', 'In a statement, disability advocates called Trump’s remarks and any suggestion that federal workers with disabilities may have been responsible for the crash “irresponsible, disparaging and wrong” and accused the president of using a tragedy to push his political agenda.', '“Disabled employees, like non-disabled employees, are hired because they meet the qualifications needed to do the job,” reads the statement signed by the American Association of People with Disabilities, the American Council of the Blind, the Autistic Self Advocacy Network, the Bazelon Center for Mental Health Law, the Disability Rights Education & Defense Fund, the National Disability Rights Network and others. “Diversity hiring initiatives seek to expand the pool of potential qualified talent for a role — they do not supersede the qualifications and skills that the role requires.”', 'Advocates noted that many news reports suggested that there were staffing issues at the air traffic control tower at the time of the crash. Nonetheless, they said the White House has doubled down on people with disabilities, releasing a memo about aviation safety highlighting diversity, equity and inclusion initiatives including those focused on recruitment of people with severe intellectual disabilities. Trump signed an executive order shortly after taking office to do away with so-called DEI efforts in government.', '“There is no evidence that FAA hiring practices had anything to do with this accident, and suggesting otherwise is misleading and harmful,” said Katy Neas, CEO of The Arc of the United States. “People with disabilities — like all federal employees — are hired because of their qualifications, skills and ability to do a job. In moments like this, we should be focused on facts and supporting those affected, not pointing fingers at an entire community.”', 'Katherine Macfarlane, associate professor of law and the director of Disability Law and Policy Program at Syracuse University’s College of Law, said Trump’s comments could having lasting effects for a population that already struggles to get ahead.', '“Working-age people with disabilities remain disproportionately underemployed, and false stereotypes about people with disabilities keep Americans who are ready and willing to work out the workforce,” said Macfarlane. “Suggesting that people with disabilities are to blame for the tragic plane crash near Reagan National Airport, as a result of DEIA-focused hiring efforts at the FAA, perpetuate harmful, false stereotypes, and frustrate disabled peoples’ efforts to obtain gainful employment and contribute to the economy.”', '', '', ""Read more stories like this one. Sign up for Disability Scoop's free email newsletter to get the latest developmental disability news sent straight to your inbox."", '', ""Thousands of teens and adults with disabilities will be welcomed at proms worldwide all on a single night ahead of Valentine's Day."", ""As residents with developmental disabilities leave an institution following reports of mistreatment, a watchdog finds that many are waiting too long or that they're being sent to other large facilities."", ""Research shows that atypical reactions to light in a child's pupils are an indicator of autism. Now a manufacturer is aiming to bring a device that detects this to clinics across the country."", '', '', '', '© 2008-2025 Disability Scoop, LLC. All Rights Reserved.', '', '', '', ""You're reading of free articles this month."", '', '', '', '', '', '']"
D.C. plane collision echoes tragic Wichita State football team crash,https://www.washingtonpost.com/history/2025/02/03/wichita-state-football-plane-crash/,"['A plane flying Wichita State football players to an away game crashed in Colorado in 1970, leaving 31 dead.', '', '', '']"
Trump puts blame on DEI for plane crash. It's meant to exhaust us | Opinion,https://www.freep.com/story/opinion/contributors/2025/01/31/trump-dei-plane-crash-diversity/78087953007/,"['My eyes couldn’t believe what I was reading: President Donald Trump called Wednesday night’s tragic plane crash a product of Diversity, Equity and Inclusion hiring.', 'Trump had just finished a moment of silence for the victims of the plane crash — the midair collision of a regional jet and a U.S. Army helicopter at a Washington airport killed 67 — when he turned the moment into a political launching pad.', '“We must have only the highest standards for those who work in our aviation system,” Trump said. “I changed the Obama standards from very mediocre at best to extraordinary.', '“You remember that. Only the highest aptitude. They have to be the highest intellect and psychologically superior people were allowed to qualify for air traffic controllers. That was not so prior to getting there.”', 'Those comments and others sent folks into a tizzy. An upset white journalist in Pittsburgh sent the story to me first, but soon it was all over my social media feeds.', 'Need a break? Play the USA TODAY Daily Crossword Puzzle.', 'Who could blame them? It was an irresponsible move by the president, blaming the administrations of Barack Obama and Joe Biden (omitting that he served a term between them) without any evidence that a person of color, someone from the LBGQ+ community, a woman, or a person with a disability were involved with the crash. And it came just days after Trump issued an executive order ending affirmative action in federal contracting, and ending federal DEI programs from anti-bias training to funds for farmers and homeowners.  ', 'At issue: Trump is alleging that the Federal Aviation Administration has somehow lowered the standards for air traffic controllers in order to include DEI hires.', ""But what it inherently said to Black people — Black Detroiters, who make up 77% of this city — was that the people responsible for Wednesday's crash were in “one of those Black jobs.”"", '“I have common sense, OK?” Trump said, as quoted by CNN, when pressed what evidence he had to the blame the Biden and Obama administrations. “Unfortunately, a lot of people don’t.”', 'Trump added the FAA must hire only the most qualified.', '“… In 2016, I made that change very early on, because I always felt this was a job that, and other jobs too, but this was a job that had to be superior intelligence, and we didn’t really have that.', '“And we had it. And then when I left office and Biden took over, he changed them back to lower than ever before. Their policy was horrible and their politics was even worse.""', ""More from Freep Opinion:Trump's anti-trans executive order is breathtaking cruelty"", ""As of Thursday night, there were no survivors after the midair collision, the deadliest U.S. air disaster in more than 20 years. U.S. authorities said the causes of the crash were not yet clear. The American Airlines Bombardier jet carrying 60 passengers and four crew members collided with the Army Black Hawk helicopter and crashed into the Potomac River as it prepared to land at Ronald Reagan Washington National Wednesday night. The investigation into the crash in the nation's capital is just beginning."", 'The names of all the victims have not yet been released, but it included a number of promising young figure skaters and others traveling from Kansas, where the flight originated. U.S. Sen. Maria Cantwell, D-Washington, told Reuters that the dead included citizens from Russia, the Philippines and Germany.', 'In what should have been a news conference to discuss the deadliest plane crash since 2001, somehow the president found a way to inject DEI into the mix.', 'It was not only a slap in the face of those who, only hours ago, lost family members, but to what DEI represents. DEI is not a handout, as the president suggests, but a starting point for those who historically have been left behind. The purpose of DEI in hiring is not to hand jobs to unqualified candidates, but to ensure that qualified candidates from marginalized communities have a fair opportunity to compete.', 'In Detroit, it’s much like making contractors include 30% of women and minorities on major construction jobs, like the casinos, Comerica Park, Ford Field and Campus Martius projects in the late 1990s.', '“The tragedy of this lie is the fact that it covers up the DEI appointments (Trump) had made for unqualified people to lead the Defense Department, Health and Human services, FBI, Intelligence and Education, to name only a few,” said the Rev. Wendell Anthony, Detroit Branch NAACP president.', 'What Trump is after, Anthony said, is what he calls, “White Exclusivity Inclusion.”', '“This will not make America ‘great again,’” Anthony said. “This will make America pre-Reconstruction again. We must be better than this.”', 'More from Freep Opinion:What it will take to survive a 2nd Trump presidency', 'It’s hard to believe Trump has only been in office since Jan. 20.', 'In response to Trump’s anti-DEI executive order, the U.S. Department of Defense’s intelligence agency announced that they’ll eliminate activities for Martin Luther King Day, Black History Month, the Holocaust Day of Remembrance and Pride Month.', 'Others are skeptical about opening up the formerly classified files about the assassination of Martin Luther King Jr., which may — after more than 50 years — reveal infidelity or other misdeeds by the Civil Rights icon.', 'These incidents are triggering to some Detroiters, and infuriating to others.', 'I say to them, paraphrasing football coach Dennis Green: Trump is who we thought he was.', 'The president is operating by the same playbook he used during his first term, and what promised during the campaign. Less than two weeks into his regime, it’s felt like nearly a year already. Surely there is much more to come.', 'The scary part to some — and praised by his campaign supporters — is that this is exactly what America signed up for at the ballot box.', ""More from Freep Opinion:Trump is making good on his promises, and I couldn't be more excited"", 'For those who oppose his policies, it must require some restraint when he pops off with his usual rhetoric. It’s the same as when he said “the whole country will end up like Detroit if (Kamala Harris) is your president. You’re going to have a mess on your hands.”', 'There’s certainly more to come.', 'As long as what Trump says won’t permanently harm the country, don’t let it fester inside of yourself, even when it’s something you know is untrue. You’ll be doing yourself a favor. Their strategy is to exhaust and overwhelm us. We have to keep our eyes on the ball.', 'For incidents such as Thursday, it’s OK to get upset for a while, get it off your chest and find a way to let it roll off your back.', 'What the president said Thursday was inexcusable and reprehensible — to make an American tragedy about anything other than the 67 people who lost their lives in a plane crash. Their families are at least owed some time to process and grieve a horrible incident in front of the world.', 'The division has begun in Trump’s new term. What Trump decided to say was reprehensible, no doubt. But we must find a way to rise above this and not let it permanently take room in yourself and let it harm your wellbeing.', 'Otherwise, this presidential term will go by much slowly than you want it to.', 'Darren A. Nichols, named one of Michigan’s most recognized media figures, is a contributing columnist at the Free Press. He can be reached atdarren@dnick-media.com or his X (formerly Twitter) handle @dnick12. Submit a letter to the editor atfreep.com/letters.']"
