Title,Link,Paragraphs
Donald Trump’s Anti-Woke Wrecking Ball,https://www.newyorker.com/magazine/2025/02/10/donald-trumps-anti-woke-wrecking-ball,"['On the Wednesday evening of a Washington week defined by a blitzkrieg of executive orders, vituperative confirmation hearings for Robert F. Kennedy, Jr., Kash Patel, and Tulsi Gabbard, and an effort by the new President to suspend much of the federal budget, an American Airlines jet approaching Washington, D.C., from Wichita collided with an Army Black Hawk helicopter near Reagan National Airport. Everyone on board both aircraft was killed, sixty-seven people in total, some of them young ice-skaters. The next day, President Trump called a press conference. He began by expressing his condolences and described the “icy, icy Potomac—it was a cold, cold night, cold water.” He then said, “We do not know what led to this crash,” but, he added, “we have very strong opinions and ideas, and I think we’ll probably state those opinions now.”', 'That statement could be a motto for this Administration, but what Trump meant in this case was that diversity initiatives at the Federal Aviation Administration had somehow caused the calamity. It is essential, Trump said, that air-traffic controllers be hired for their “intellect, talent—the word ‘talent,’ ” but, instead, the Democrats “came out with a directive: too white.” (He also complained about Pete Buttigieg—Joe Biden’s Transportation Secretary and an occasional liberal antagonist on Fox News, who is reportedly considering a run for the U.S. Senate in Michigan—claiming, “He’s just got a good line of bullshit.”) Apparently quoting old reports in the New York Post and from Fox News, Trump listed conditions that he implied the F.A.A. had been giving preference to in its hiring practices—including “severe intellectual disability,” “psychiatric disability,” and “dwarfism.”', 'Trump offered no evidence that diversity had anything to do with the crash and, at other points, seemed to place the blame for it on the pilot of the Black Hawk. (Helicopters have “the ability to go up or down,” Trump noted.) When a reporter asked him if he had any proof that diversity hiring was responsible for the deaths, the President of the United States pursed his lips and said, “It just could have been.”', 'As recognizably Trump as these crude ramblings were—in their sheer self-absorption in the midst of a tragedy, and in their reflexive racial insinuations—they matched the spirit of the moment. Throughout the government, new appointees have been touting their reversals of diversity standards—the signal feature of what has been a rapid two-week effort to remake the preëxisting bureaucracy with an America First agenda. Sometimes the appointees have simply swapped in preferences for their favored groups: an order issued by Sean Duffy, the new Secretary of Transportation—who is a former congressman and reality-TV star and the father of nine—requires his agency to give preference in the awarding of contracts to communities with high marriage and birth rates; an order banning D.E.I. initiatives in the military requires the service academies to “teach that America and its founding documents remain the most powerful force for good in human history.”', 'In other instances, there has been a more general anti-idealism: a stop-work order issued by the Administration suspended the pepfar program, which supplies H.I.V. medication, largely in sub-Saharan Africa, and has saved an estimated twenty-six million lives. Foreign aid, the order argues, is “not aligned with American interests and in many cases antithetical to American values.”', 'The new Administration has been moving fast and operating almost exclusively by executive order—Trump seems largely uninterested in Congress, and his Inaugural Address offered barely any legislative agenda. (Congressional Republicans, of course, remain highly invested in Trump; they held a retreat last week at his golf club in Doral, Florida, where the President’s name had been scorched onto the hamburger buns.) When, on Monday, Trump’s Office of Management and Budget published a memo ordering federal agencies to “identify and review all Federal financial assistance programs and supporting activities” to be sure that they reflected “administration priorities” and not “wokeness,” it fell to the Democrats to point out that a President has no authority to suspend legally authorized congressional spending. Senator Jeff Merkley, of Oregon, called the suspension a “constitutional crisis,” and, if it wasn’t obviously that, it also wasn’t obviously not that.', 'By the O.M.B.’s own accounting, some three trillion dollars of the government’s ten-trillion-dollar annual expenditures was subject to the freeze—seemingly affecting programs such as Meals on Wheels and Head Start and even scientific research—and the White House appeared a little fuzzy as to where the list stopped. Trump’s new press secretary, Karoline Leavitt, was asked whether the seventy-two million Americans who rely on Medicaid were guaranteed their health insurance. Across the country, portals were down. “I’ll check back on that and get back to you,” she said. Perhaps that was a step too far. A federal judge issued an order pausing the freeze, and the next day the O.M.B. put out a very brief update rescinding the memo—but, Leavitt insisted, not the policy.', 'Was Trump just “weaving” when he used a press conference following a horrific plane crash to rant about diversity initiatives, or was he getting his Administration back on an anti-woke message, after overreaching in withholding federal funds? The smart money is on the latter. For all the glee and the diligence with which its staffers have tried to upend the liberal regime, they haven’t bothered to replace it with anything beyond a sour anti-principle. An agenda that casts doubt even momentarily on a basic social program like Medicaid can’t honestly be said to be either populist or “America First”; and Trump’s vows to install a government based on merit were undermined by his roster of clearly unqualified nominees. The operating credo at the outset of the Trump Administration has a transactional, Tammany Hall logic: there is no rule except power.', 'At Thursday’s press conference, after musing about the “high standard” he’d maintained when hiring air-traffic controllers in his first term, Trump said, “There are things where you have to go by brainpower, you have to go by psychological quality, and psychological quality is a very important element of it.” For air-traffic controllers and Presidents both. ♦', 'Has an old Soviet mystery finally been solved?', 'Why the rules of mustard and spaghetti sauce don’t apply to ketchup.', 'How the Unabomber avoided the death penalty.', 'The actress who magnified her celebrity by suddenly renouncing it.', 'The shareable feast of Jeremy Allen White’s Calvin Klein ad.', 'Fiction by Jamaica Kincaid: “Girl”', 'Sign up for our daily newsletter to receive the best stories from The New Yorker.', 'Sections', 'More', '© 2025 Condé Nast. All rights reserved. The New Yorker may earn a portion of sales from products that are purchased through our site as part of our Affiliate Partnerships with retailers. The material on this site may not be reproduced, distributed, transmitted, cached or otherwise used, except with the prior written permission of Condé Nast. Ad Choices']"
"Trump has stopped America’s DEI ‘scandal,’ JD Vance says in exclusive interview",https://www.foxbusiness.com/video/6368123709112,"['', '', '', 'Vice President JD Vance sets the record straight with President Donald Trump’s approach to DEI and more during an appearance on ‘Sunday Morning Futures.’', '©2025 FOX News Network, LLC. All rights reserved. This material may not be published, broadcast, rewritten, or redistributed. All market data delayed 20 minutes.']"
Trump claims Buttigieg 'was a disaster' as South Bend mayor. Data show the city grew,https://www.indystar.com/story/news/politics/2025/01/30/trump-press-briefing-american-airlines-plane-crash-pete-buttigieg-south-bend-indiana/78053354007/,"['After the air tragedy in which a passenger plane and an Army helicopter collided in Washington, leaving no survivors, President Donald Trump blasted the leadership skills of former Transportation Secretary Pete Buttigieg during a press briefing about the crash.', 'During a Thursday, Jan. 30, press briefing, Trump claimed that Buttigieg was a ""disaster"" as the mayor of South Bend. Is that claim true?', ""Here's what happened and what we know about Buttigieg's mayoral career."", 'Trump claimed that Buttigieg was a disastrous mayor of South Bend and ran the city into the ground, but according to previous IndyStar reporting, that is not the case.', 'Not everyone felt everything during his term had gone smoothly, but according to IndyStar interviews from 2019 with local government officials, political experts, neighborhood activists, business leaders and tourism officials, Buttigieg had South Bend headed in the right direction as their mayor.', 'Buttigieg was the mayor of the Indiana city for eight years. He increased economic development, unemployment rates lowered during his term and the population began to slowly rise after decades of decline.', 'His harshest criticisms were concerns about the redevelopment projects leading to gentrification and his handling of racial tensions with the South Bend police department.', 'Pete Buttigieg:Former mayor returns home to celebrate Biden administration investments and local growth', '""The FAA, which is overseen by Secretary Pete Buttigieg—a real winner, this guy\'s a real winner. You know how badly everything\'s run since he\'s run this Department of Transportation? He\'s a disaster. He was a disaster as a mayor, he ran his city into the ground and he\'s a disaster now. He\'s just got a good line of bullshit. The Department of Transportation is [the] government agency charged with regulating civil aviation. Well he runs it—45,000 people and he\'s run it right into the ground with his diversity.""', 'From USA TODAY:In aftermath of DC plane crash, Donald Trump criticizes DEI efforts', '""Despicable. As families grieve, Trump should be leading, not lying. We put safety first, drove down close calls, grew Air Traffic Control, and had zero commercial airline crash fatalities out of millions of flights on our watch. President Trump now oversees the military and the FAA. One of his first acts was to fire and suspend some of the key personnel who helped keep our skies safe. Time for the President to show actual leadership and explain what he will do to prevent this from happening again.""']"
Donald Trump Is Just Watching This Crisis Unfold,https://www.theatlantic.com/politics/archive/2025/01/trump-airplane-crash/681511/,"['Do you have newsworthy information to share? Send tips to The Atlantic at tips@proton.theatlantic.com.', 'But he’s not taking charge.', 'Produced by ElevenLabs and News Over Audio (Noa) using AI narration. Listen to more stories on the Noa app.', 'You might be forgiven for forgetting—ever so briefly—that Donald Trump is president of the United States. Sometimes it seems like he does, too.', 'In the middle of the night, as news about the plane crash at Ronald Reagan Washington National Airport was breaking, Trump posted on Truth Social:', 'The airplane was on a perfect and routine line of approach to the airport. The helicopter was going straight at the airplane for an extended period of time. It is a CLEAR NIGHT, the lights on the plane were blazing, why didn’t the helicopter go up or down, or turn. Why didn’t the control tower tell the helicopter what to do instead of asking if they saw the plane. This is a bad situation that looks like it should have been prevented. NOT GOOD!!!', 'He raises some valid points—ones that many people might be wondering about themselves. The difference between them and him is that he is the leader of the federal government, able to marshal unparalleled resources to get answers about a horror that happened just two and a half miles from his home. He’s the commander in chief of the U.S. armed forces, and the crash involved an Army helicopter. But Trump isn’t really interested in doing things. Like Chauncey Gardiner, the simple-minded protagonist of Being There, he likes to watch.', 'This morning, Trump held an astonishing briefing at the White House where he and his aides unspooled racist speculation, suggesting (without any evidence) that underqualified workers hired under DEI programs had caused the accident. “We do not know what led to this crash, but we have some very strong ideas and opinions, and I think we’ll state those opinions now,” Trump said, and he did. Vice President J. D. Vance and Defense Secretary Pete Hegseth criticized diversity efforts from the lectern as well. (Trump also misrepresented Federal Aviation Administration programs.) Trump insisted that he wasn’t getting ahead of the investigation by speculating, and that he could tell diversity was to blame because of “common sense.”', 'More Stories', 'Two Truths of Trump’s Second Term', 'A Handbook for Dealing With Trump Threats', '']"
‘DEI cost me a job in aviation – a crash was inevitable’,https://www.telegraph.co.uk/us/news/2025/01/31/diversity-hiring-cost-me-job-at-faa-a-crash-was-inevitable/,"['Aspiring air traffic controller speaks out following deadly collision between American Airlines plane and helicopter in Washington', '', '', '', '', '', '', '', '', '', '', 'An aspiring air traffic controller who claimed he was denied a job because of diversity targets said the aviation agency’s obsession with inclusion made an accident likely to happen.', 'Andrew Brigida, 35, scored 100 per cent in his training exam but alleged that he was denied a position in an air traffic control tower because the Federal Aviation Administration (FAA) recruitment process favoured diverse candidates. He is part of a class action lawsuit filed against the federal agency.', 'Speaking after the Washington air disaster, in which 67 people were killed, Mr Brigida claimed that years of diversity hiring meant it was only a matter of time before an accident happened.', '“You want to hire the best and the brightest for this kind of job because it is a very stressful job and it can take a toll on you, age you prematurely,” he told The Telegraph. “You want to make sure that the people that are doing it are the best.”', 'On Friday, it emerged that one of the air traffic controllers had left their post early on Wednesday evening when a passenger plane and a military helicopter collided above Washington.', 'At the time of the collision, there was one controller managing traffic for both helicopters and planes – a job normally handled by two people – according to The New York Times. The FAA described staffing levels as “not normal for the time of day and the volume of traffic”.', 'Investigators have recovered the black boxes from both the passenger jet and the helicopter, and are combing through the flight data and audio recordings. A report is expected to be released in 30 days.', 'More victims were named overnight, including the American Airlines pilots and crew. Captain Jonathan Campos, 34, and First Officer Samuel Lilley, 28, died along with flight attendants Ian Epstein, 52, and Danasia Elder.', 'On the Black Hawk helicopter, Crew Chief Ryan O’Hara was named along with Chief Warrant Officer 2, Andrew Eaves. The female pilot has not yet been identified.', 'Mr Brigida graduated from Arizona State University’s collegiate training initiative in 2013 – a partnership programme with the FAA that was previously used to train and select the most qualified applicants.', 'After scoring top marks in his air traffic control selection and training examination, he was placed on a preferred candidate list until the FAA changed the rules.', 'Under the Obama administration, the regulator replaced a skills-based test with a biographical questionnaire to attract more diverse applicants.', 'When Mr Brigida tried again to become an air traffic controller under the new tests, he said he failed the biographical questionnaire because he “didn’t fit the preferred ethnic profile”.', 'Donald Trump blamed the fatal crash on the FAA’s recruitment policies, saying candidates with “severe intellectual and psychiatric disabilities” had been hired as air traffic controllers.', 'Mr Brigida said previous administrations were to blame for the air traffic control staffing crisis because they “got too comfortable because there has not been an incident in a long time”.', 'He added: “There have been plenty of stories of near miss events that have been the cause of staffing issues. It’s surprising that it’s gone on this long without being properly recognised by the government.”', 'Asked whether years of diversity hiring meant an accident was waiting to happen, Mr Brigida, who now works in the FAA as a programme manager said: “Yes, that’s kind of accurate.”', 'He said he hoped Mr Trump would now  “immediately” to fix the staffing crisis, saying: “He obviously sees the issue at hand, and if he didn’t I’m sure people that work in the Department of Transportation and the FAA informed him that there is an issue with staffing and air traffic control.”', 'In November 2019, attorneys for Mountain States Legal Foundation sought class action status in a lawsuit for more than 2,500 aspiring air traffic controllers who they said were harmed by the FAA’s hiring policies.', 'They argued that the Obama administration endangered public safety by prioritising racial politics and owes compensation for the “grave injustice”. The FAA and the US transport department are contesting the lawsuit.', 'With the case expected to go to court early next year with 900 claimants, Will Trachman, the lead counsel, said Joe Biden had tried to sweep the diversity scandal “under the rug”.', '“This started under Obama, but it’s the Biden administration that tried to sweep it under the rug and assert attorney-client privilege over 14,000 documents and has been trying to oppose and dismiss this case,” said Mr Trachman.', '“It’s one thing to do it but the Biden administration refused to recognise the error of the FAA’s ways and so they dug in and, in fact, tried to go bigger on diversity measures.”', 'American Airlines flight 5342 had been descending towards the runway at Ronald Reagan National Airport on Wednesday evening when it collided with the helicopter and plunged into the Potomac. All of those on board both aircraft were killed.', 'Mr Trump told a White House press conference that the military helicopter did “the opposite of what it was told” before crashing into the American Airlines flight, which had 64 people on board.', 'The president, who has recently signed executive orders dismantling diversity, equity and inclusion initiatives in the federal government, blamed his predecessor for lowering standards and endangering lives.', '“My administration will set the highest possible bar for aviation safety,” he told reporters, adding that a “very special genius” was needed to coordinate air traffic.', 'Quoting DEI policy, he said that the FAA was “actively recruiting workers who suffer severe intellectual disabilities, psychiatric problems, and other mental and physical conditions”.', '', '', '', '', '']"
Trump criticized DEI and the FAA's diversity policies after a deadly plane crash. Here's what we know.,https://www.cbsnews.com/news/trump-dei-diversity-policies-plane-crash/,"['Watch CBS News', 'By Laura Doan, Alex Clark', 'Updated on: January 31, 2025 / 8:31 PM EST / CBS News', 'In a Thursday press briefing, President Trump criticized his predecessor for his management of the Federal Aviation Administration and suggested, without evidence, that diversity initiatives at the agency could be to blame for a deadly crash between a passenger plane and an Army helicopter in Washington, D.C.', '""I put safety first. Obama, Biden and the Democrats put policy first,"" Mr. Trump said. ""The FAA\'s website states they include hearing, vision, missing extremities, partial paralysis, complete paralysis, epilepsy, severe intellectual disability, psychiatric disability, and dwarfism."" Mr. Trump added that people in those categories would be ""qualified"" for controller positions, even though the agency\'s statement does not say that.', 'The president continued, ""Brilliant people have to be in those positions."" ', ""It has been longstanding FAA policy — including before, during and after Mr. Trump's first term — to include people with disabilities in recruitment. However, there is no evidence that these initiatives have compromised air safety or had any relation to the crash Wednesday night. The cause of the collision remains under investigation."", 'Air traffic controllers must undergo extensive training and meet rigorous standards, including physical and mental fitness tests. They cannot have a history of mental disorders or physical conditions that could interfere with their duties, according to the U.S. Office of Personnel Management, which is the chief human resources agency for the federal government.', 'People with disabilities have to meet the same rigorous standards as other applicants, according to Chai Feldblum, a former commissioner of the U.S. Equal Employment Opportunity Commission during both the Obama and first Trump administrations. ', '""Obviously you only hire a person with a disability to do a job for which they\'re qualified,"" Feldblum said. ""I\'ve seen no evidence that there are people with intellectual disabilities that have been hired to be air traffic controllers.""', 'Before Mr. Trump took office last week, there was a ""Diversity and Inclusion"" page on the FAA\'s website, which stated the FAA had a ""special emphasis in recruiting and hiring"" people with the list of disabilities Trump cited. ', 'The FAA has a range of roles beyond air traffic controllers, and its website does not indicate that these hires would be eligible for air traffic controller positions. ', ""Additionally, the policy has been on the FAA's website since at least February 2013, including throughout Trump's first term. The policy page was recently removed from the website, archives show."", 'Since 1973, federal law has required federal agencies to take steps to hire people with disabilities.', '""The thing [President Trump] got wrong legally was that somehow this would be just a Democratic administration that had suddenly out of the blue decided to try to find and hire people with disabilities. That\'s simply not grounded in reality,"" Feldblum said. ', 'When asked by a reporter how he could come to the conclusion that diversity had something to do with the crash, Mr. Trump replied, ""Because I have common sense.""', 'The head of the National Air Traffic Controllers Association, which is the controllers\' union, said in a letter to its members that at this time it would be ""premature to speculate on the root cause of this accident."" ', 'Federal investigators have also said it is too early to determine the cause or what factors may have contributed to the crash. It was the first major commercial airline crash in the United States since 2009.', 'Mr. Trump was also asked why the ""Diversity and Inclusion"" policy was not changed on the FAA\'s website throughout his first administration. He said, ""I did change it. I changed the Obama policy, and we had a very good policy. And then Biden came in and he changed it."" It\'s unclear precisely what policy he was referring to.', ""Records show that initiatives aimed at expanding the workforce existed under President Trump's first term, including a program launched in 2019 that aimed to recruit and train qualified individuals with disabilities, including veterans, for careers in air traffic operations."", 'This month, President Trump signed a memorandum titled ""Keeping Americans Safe in Aviation"" which directed the FAA to end all diversity, equity and inclusion or DEI initiatives. He issued similar orders across the federal government.', 'In response to Mr. Trump\'s claims on Thursday, former Transportation Secretary Pete Buttigieg said in a post on X, ""As families grieve, Trump should be leading, not lying. We put safety first, drove down close calls, grew Air Traffic Control, and had zero commercial airline crash fatalities out of millions of flights on our watch.""', 'Nick Daniels, the head of the National Air Traffic Controllers Association, said, ""America\'s highly trained and skilled air traffic controllers all do amazing work every day keeping the nation\'s passengers and cargo moving safely and efficiently to their destinations. We serve quietly, but events like this remind us of the weight we bear.""', ""CBS News reached out to the FAA about Mr. Trump's remarks about its hiring practices, but the agency declined to comment. "", 'Laura Doan is a fact checker for CBS News Confirmed. She covers misinformation, AI and social media.', '© 2025 CBS Interactive Inc. All Rights Reserved.', 'Copyright ©2025 CBS Interactive Inc. All rights reserved.']"
