Title,Link,Paragraphs
,https://www.thenation.com/article/society/trumps-racist-rants-conceal-the-rights-air-safety-failures/,"['', '', '', '', 'ELIE MYSTAL', 'JEET HEER', 'DAVE ZIRIN', 'JOAN WALSH', 'Roberto Marquez from Dallas, Texas, sets up a makeshift memorial for the victims of the crash of an American Airlines flight and a Blackhawk helicopter in Arlington, Virginia.\n(Roberto Schmidt / AFP via Getty Images)', '', '', '', '', '', '', '', '', 'E\nven as divers were struggling to bring the victims’ corpses to the surface of the icy Potomac on January 30, Donald Trump plodded into the White House briefing room to cast blame. Rather than wait for the results of an investigation of the midair collision between a commercial jet and a military helicopter that killed 67, he chose to share his own “very strong opinions and ideas” of its cause.', 'Trump did not cite the chronic underfunding and short staffing of the Federal Aviation Administration (FAA), the mandatory overtime and six-day work weeks that many air traffic controllers endure to maintain safety amid the world’s highest volume of flights above the United States, or the recent addition of more flights to the already packed airspace of Reagan National Airport (DCA) at the insistence of powerful politicians and airlines. Instead, he focused blame on federal diversity, equity, and inclusion (DEI) programs.', 'Under Barack Obama, Joe Biden, and the recently departed transportation secretary Pete Buttigieg, he alleged, incompetent controllers were accepted if they filled diversity goals. Trump assured the press that his administration would hire only those possessing “the highest level of genius,” no matter “what they look like.” He was unable to defend that accusation, of course. When pressed for evidence, he cited only his “common sense.” And, when pressed further on whether DEI played a role in the crash, he admitted, “It may have, I don’t know,” before shifting some blame to the helicopter crew. After the press conference he signed another directive mandating that the FAA end all DEI efforts, including one he initiated in his first term.', 'It would be difficult to imagine a scene more thoroughly illustrative of the advanced moral decay of today’s Republican Party than what transpired this week, especially when one measures Trump’s actions against those of the president after whom DCA is named.', 'Forty-three years ago, Ronald Reagan reckoned with an air disaster of his own, involving another crash into the Potomac. On January 13, 1982, Air Florida Flight 90, its fuselage encrusted with ice, failed to gain altitude after taking off from DCA during a snowstorm, clipped vehicles on Washington’s 14th Street Bridge, and crashed into the river, killing 74. That was a dicey event for Reagan, for the DCA control tower was understaffed that day due to his recent firing of more than 11,000 members of the Professional Air Traffic Controllers Organization (PATCO) for staging an illegal strike—a walkout waged in part over safety and long workdays. The banning of those strikers led to a fatal 50-minute wait between Flight 90’s deicing and its takeoff, as a skeleton crew of controllers struggled to move traffic in a storm.', '', '', '', '', 'Had Reagan blamed the strikers for that crash, he would have reinforced growing public unease about his decision to ban even those who renounced PATCO and begged for a second chance from returning to work. So, rather than cast blame, Reagan elevated a hero. At his State of the Union address that year, he praised federal worker Lenny Skutnik, who sat next to the first lady in the visitors’ gallery, for bravely jumping into the icy Potomac to rescue one of Flight 90’s five survivors. By citing Skutnik’s heroism, Reagan effectively shielded himself from any blame. That shrewd move inaugurated a political tradition: Every president since then has basked in the reflected glow of everyday American heroes strategically placed in the gallery for that purpose.', 'If Reagan avoided accountability in part by lifting up Skutnik, Trump’s graceless blamecasting seems less likely to divert attention from his own culpability. By raising his obviously baseless DEI contention, which he was unable to defend to the press, Trump has invited increased scrutiny of the significant role that he and his allies have played in bringing our air traffic control system into its current state of growing precarity.', 'Subscribe today and Save up to $129.', 'The number of air traffic controllers declined in each year of Trump’s first presidency. Then Trump plunged air traffic controllers (and other federal workers) into uncertainty during the 2018–19 government shutdown, which forced controllers to work without pay—a major blow to their already battered morale. That shutdown only ended, it should be remembered, when enough New York area controllers called in sick to ground flights on the East Coast.', 'The Biden years saw a slow rebuild of controller ranks. But warning signs of a systemic crisis were growing. Training of new controllers was disrupted by the Covid pandemic, and staffing shortages continued. A spate of near-misses led the FAA to convene a unusual “safety summit” on March 23, 2023, to discuss solutions, and the office of Department of Transportation Inspector General Eric J. Soskin completed a 2023 audit that found that of the FAA’s 26 most critical facilities, 20 (77 percent) were below the 85 percent minimum staffing levels and supervisors were mandating overtime and six-day work weeks to cover staff shortages. Biden’s FAA hired 1,811 controllers in 2024, and his 2025 budget sought funding to hire 2,000 more.', 'Trump’s return to the presidency has already been a setback for air safety. He fired DOT Inspector General Soskin, who illuminated the extent of the FAA’s staffing problems. Trump’s White House alter ego Elon Musk succeeded in driving Biden’s FAA administrator, Mike Whitaker, from office even before Trump was sworn in, because Whitaker’s FAA had the temerity to fine SpaceX for safety violations. Musk even went so far as to claim that “humanity will forever be confined to Earth unless there is radical reform at the FAA!” That Trump’s FAA intends radical changes seems clear. Astonishingly, his letter encouraging federal workers to resign their positions and find private sector jobs went to air traffic controllers despite the continued staffing crisis at the nation’s airports.', 'Reagan’s belief that “government is the problem” initiated a long, tragic deterioration of respect for government workers, including those who keep our skies safe. But Trump’s “deep state” conspiracy theories and obsession with DEI are doing far graver harm, reducing the right’s anti-government discourse to authoritarian theater and farce. Make no mistake, these recent events are a harbinger of what is to come. Trump’s effort to deflect attention to DEI should not avert our eyes from the larger collision that threatens the very functioning of our government unless we make a course correction.', 'Joseph A. McCartin\nJoseph A. McCartin teaches at Georgetown University and is the author of Collision Course: Ronald Reagan and the Strike that Changed America.']"
Did FAA Reject Air Traffic Controllers Based on Race? What We Know,https://www.newsweek.com/faa-reject-air-traffic-controllers-race-airport-crash-2024097,"['', '', '', '', '', ""Complaints about the Federal Aviation Administration's (FAA) hiring policy have resurfaced following the Ronald Reagan Washington National Airport aircraft disaster, including claims that candidates were rejected based on race."", 'Newsweek has contacted the FAA for comment via email.', 'Details surrounding the midair collision between a passenger jet and a military helicopter, which left as many as 67 people dead, are still emerging. President Donald Trump has suggested diversity hiring programs were to blame, though he did not provide evidence to support his claims.', ""Scrutiny over the FAA's hiring policies was raised years before Wednesday's accident near Reagan National Airport."", 'A major class-action lawsuit has been filed against the federal agency over claims that applications for air traffic controllers were rejected based on race.', 'The original lawsuit was filed on behalf of Andrew Brigida, who claimed the FAA under the Obama administration dropped a skill-based system for hiring air traffic controllers (ATCs) and replaced it with a ""biographical assessment,"" which was allegedly used to attract more minority applicants.', 'Brigida, who is white and scored 100 percent on his training exam, said he was discriminated against because of his race when his application was rejected.', 'In January 2014, Brigida received an email informing him that the FAA was ""implementing changes to improve and streamline"" the hiring process for air traffic controllers and that his application was ""impacted"" by these changes, according to William Perry Pendley, an attorney and president of the Mountain States Legal Foundation, the firm handling the lawsuit.', ""The Mountain States Legal Foundation is representing hundreds of people from different racial backgrounds who say they were discriminated against under the FAA's hiring policy."", 'The FAA and the Department of Transportation are contesting the lawsuit.', ""The FAA's biographical assessment was a screening tool used to assess applicants' behaviors and experiences. The test involved multiple-choice questions on topics such as decision-making, handling pressure, and risk management."", 'The FAA dropped the biographical assessment in 2018 in response to Congress passing a law banning its use. The FAA says on its website that the assessment was removed as a screening tool, and all applicants are now required to take the Air Traffic Skills Assessment (ATSA).', 'Andrew Brigida, speaking to British newspaper The Telegraph on Thursday: ""You want to hire the best and the brightest for this kind of job because it is a very stressful job and can take a toll on you, aging you prematurely. You want to make sure that the people doing it are the best.""', 'Mountain States Legal Foundation said in a Thursday statement: ""DEI hiring policies have no place in America, especially in safety-critical industries, yet they have shaped the FAA\'s hiring decisions for years. Last night\'s accident is a sobering reminder of the cost of placing ideology over expertise. How many more tragedies must occur before we return to common sense? It\'s time to demand accountability, end DEI hiring in aviation, and restore safety as the top priority in our airways.""', 'FAA statement to Fox News in April 2024: ""Every FAA-certified air traffic controller has gone through months of screening and training at the FAA Academy, and that is before another 18-24 months of training to learn specific regions and airspaces. There is a well-known national shortage of air traffic controllers, and the FAA has ramped up outreach to ensure no talent is left on the table. We are accelerating the pace of recruiting, training, and hiring to meet demand while maintaining the highest qualification standards.""', 'President Donald Trump during Thursday\'s press conference: ""We have to have our smartest people. It doesn\'t matter what they look like, how they speak, who they are. What matters is intellect, talent. The word talent—they have to be talented, naturally talented, geniuses. Brilliant people have to be in those positions [air traffic controllers], and their lives are actually shortened, very substantially shortened, because of the stress, where you have many, many planes coming into one target, and you need a very special talent and a very special genius to be able to do it.""', 'A civil discrimination case against the FAA involving around 900 claimants is expected to go to court early next year.', 'An investigation to determine the cause of the Ronald Reagan National Airport accident is underway, though this could take months or even years to complete.', '', '', ""Newsweek Is Committed To Journalism That'S Factual And Fair."", 'Hold Us Accountable And Submit Your Rating Of This Article On The Meter.', '', '', 'Ewan Palmer is a Newsweek News Reporter based in London, U.K. His focus is reporting on US politics, domestic policy ... read more', 'Newsletters in your inbox See all', 'Company', 'Editions:', 'Contact', 'Terms of Use', '© 2025 NEWSWEEK DIGITAL LLC']"
"Trump blames DEI, Army pilot error for deadly Black Hawk collision",https://www.militarytimes.com/news/pentagon-congress/2025/01/30/trump-blames-dei-army-pilot-error-for-deadly-black-hawk-collision/,"['President Donald Trump blamed diversity, equity and inclusion efforts at the Federal Aviation Administration for a deadly midair collision between an Army helicopter and a passenger jet outside Washington, as authorities continue to investigate the worst U.S. aviation disaster in almost a quarter century.', 'Speaking in the White House press briefing room Thursday, the president, without evidence, blamed air traffic controllers, as well as the helicopter pilot and Democratic policies at federal agencies for Wednesday night’s collision, which occurred between an American Airlines jet and a Blackhawk helicopter at Ronald Reagan National Airport.', 'Trump stated the helicopter pilot made an incorrect turn prior to the collision, though he did not provide evidence to support his claim.', '“I have helicopters. You can stop a helicopter very quickly,” Trump said. “It had the ability to go up or down. It had the ability to turn, and the turn it made was not the correct turn, obviously.”', 'Trump asserted this opinion even though the crash has yet to be fully investigated and there has been no determination as to whether the FAA or the helicopter pilots did anything wrong.', 'Dozens of people — including more than a dozen figure skaters — were killed in the collision after the helicopter apparently flew into the path of the jet as it was landing at the airport, officials said.', 'There are reportedly no survivors.', 'The plane was carrying 60 passengers and four crew members at the time.', 'Three soldiers, whose identities have not yet been released, were aboard the helicopter during a training flight, an Army official previously said.', 'Defense Secretary Pete Hegseth identified the three soldiers as a captain, staff sergeant and chief warrant officer 2 at Thursday’s briefing.', '“While performing a training mission, a United States Army UH-60 Blackhawk helicopter from Bravo Company, 12th Aviation Battalion, Davison Army Airfield, Fort Belvoir, Virginia, collided in midair with an American Airlines Bombardier CRJ700 regional jet Flight 5342 last night at Ronald Reagan Washington National Airport,” said Ron McLendon II, public affairs deputy director of the Joint Task Force-National Capital Region and the U.S. Army Military District of Washington.', '“The FAA, NTSB and the United States Army will investigate,” he added. “The NTSB will lead the investigation. We are working with local officials and will provide any additional information once it becomes available.”', 'Hegseth released a statement on social media Thursday morning, noting that the helicopter crew members were conducting an annual proficiency night training flight at the time of the collision and were using night-vision goggles.', 'The 12th Aviation Battalion announced a 48-hour operational pause in the wake of the crash, Hegseth added.', 'The body of the plane was found upside down in three sections in waist-deep water. The wreckage of the helicopter was also found. At least 28 bodies were pulled from the icy waters of the Potomac River. There was no immediate word on the cause of the collision, but officials said flight conditions were clear as the jet arrived from Wichita, Kansas.', 'Trump suggested Thursday he might make sweeping changes at federal aviation agencies. There could be firings “if we find that people aren’t mentally competent,” he said.', '“For some jobs,” Trump said, singling out air traffic controllers, “they have to be at the highest level of genius.”', 'Trump blamed previous administrations’ efforts to promote diversity at federal agencies for contributing to the crash. Asked why he thought that was an issue with Wednesday’s collision, he responded, “Because I have common sense.”', 'During Thursday’s briefing, Hegseth echoed Trump’s remarks on DEI policies, stating, “The era of DEI is gone at the Defense Department.”', '“As you said in your inaugural, it is colorblind and merit-based. The best leaders possible, whether it’s flying Black Hawks and flying airplanes, leading platoons or in government,” Hegseth told reporters. “We need the best and brightest, whether it’s in our air traffic control, whether it’s in our generals, or whether it’s throughout government.”', 'Senate Democratic Leader Chuck Schumer of New York said Trump spewing conspiracy theories about the crash “turns your stomach.”', '“It’s one thing for internet pundits to spew off conspiracy theories, it’s another for the president of the United States,” Schumer said at the Capitol.', 'Meanwhile, Coast Guard boats were helping to scour the chilly waters of the Potomac River.', 'Every “available U.S. Coast Guard resource for search and rescue” has been deployed to join other agencies, said Secretary Kristi Noem of the Department of Homeland Security.', '“We are actively monitoring the situation & stand ready to support local responders,” Noem said on the social media platform X.', 'In a statement, the Coast Guard says its pollution crews have been mobilized and are ready to respond if necessary.', 'The Coast Guard is working with the Army Corps of Engineers and Navy’s Supervisor of Salvage and Diving to coordinate removing the wreckage and keeping river traffic out of the area until it becomes safe.', 'Wednesday’s crash was the deadliest in the U.S. since Nov. 12, 2001, when an American Airlines flight crashed into a residential area of Belle Harbor, New York, just after takeoff from Kennedy Airport, killing all 260 people aboard.', 'The last major fatal crash involving a U.S. commercial airline occurred in 2009 near Buffalo, New York. Everyone aboard the Bombardier DHC-8 propeller plane was killed, along with one person on the ground, bringing the total death toll to 50.', 'Military Times editor Beth Sullivan contributed to this report.', 'Military Times © 2024']"
Combative Trump blames diversity policies after air tragedy,https://www.bbc.com/news/articles/cpvmdm1m7m9o,"['Donald Trump stood before the White House press room cameras on Thursday to perform a traditional presidential duty – consoler-in-chief during a time of tragedy.', 'He said the country was in mourning, shared his condolences during ""an hour of anguish"" and paid tribute to first responders and the victims.', 'Then he sharply pivoted - providing yet another reminder of how his new presidency is going to be very different.', 'It will be combative. It will be unscripted. And it will be quick to point the finger of blame.', '""We do not know what led to this crash, but we have some very strong opinions and ideas,"" he said.', 'He then speculated, without giving evidence, that lowered standards of hiring for air traffic controllers in the Federal Aviation Administration during the Joe Biden and Barack Obama presidencies may have been a factor in the disaster.', 'Trump and his fellow Republicans have regularly attacked ""diversity, equity and inclusion"" programmes in the federal government.', 'His team has made undoing such programmes a core part of their first days in office, saying they have divided Americans and weakened the country.', 'And less than 24 hours after the first major US air disaster in more than a decade, Trump – along with his secretaries of transportation and defence, and his vice-president – took turns hammering their point, even as they provided no evidence that federal hiring practices had any connection to this particular crash.', 'Asked by a reporter how he could blame diversity programmes for the crash when the investigation had only just begun, the president responded: ""Because I have common sense.""', 'At other moments, he acknowledged there was no confirmed cause, saying ""it\'s all under investigation"".', ""But some of Trump's fellow Republicans thought he spoke too soon."", '""I\'d have to see if the evidence is substantiated,"" Senator Thom Tillis of North Carolina told The Independent. ""It seems a bit early to me when I think that statement was made before we even have a flight data recorder.""', 'A number of disabilities rights groups including the American Association of People with Disabilities (AAPD) issued a joint statement calling Trump\'s comments ""irresponsible, disparaging, and wrong"".', '""The president is deliberately spreading falsehoods to demonize the quarter of American adults who live with disabilities rather than directing federal resources towards ensuring such a devastating tragedy never happens again,"" said AAPD president Maria Town.', 'Trump said the hiring guidance for the FAA\'s diversity and inclusion programme included preference for those with disabilities involving ""hearing, vision, missing extremities, partial paralysis, complete paralysis, epilepsy, severe intellectual disability, psychiatric disability and dwarfism"".', 'An archived version of a website for the FAA\'s diversity and inclusion hiring programme that appears to have been taken down in December included a similar list. The agency was seeking people with ""targeted disabilities"" that the federal government was prioritising for recruitment at the time.', 'But it\'s unclear how that drive to make recruitment more diverse may have impacted the ranks of air traffic controllers, who President Trump said needed to all be ""naturally talented geniuses"". The FAA has more than 35,000 employees, only a fraction of which perform that role.', 'In response to criticisms over diversity hiring practices last year, the agency released a statement asserting that all new hires must meet ""rigorous qualifications"" that ""vary by position"".', 'The agency has faced criticism over a longstanding shortage of air traffic controllers, particularly after the Covid-19 pandemic caused massive disruptions in commercial air travel.', 'Reports suggest that staffing levels at Reagan airport on Wednesday night may have been compromised.', 'In his remarks, Trump specifically blamed Biden administration Transportation Secretary Pete Buttigieg, whom he described with an obscenity and said had ran the department ""into the ground"".', 'Buttigieg defended his record on social media, calling Trump\'s comments ""despicable"". ""As families grieve, Trump should be leading, not lying,"" he said.', ""Senate Democratic Leader Chuck Schumer also criticised Trump's comments."", '""It\'s one thing for internet pundits to spew off conspiracies, it\'s another for the President of the United States to throw out idle speculation as bodies are still being recovered,"" Schumer said.', 'Once he departed from his prepared remarks, however, speculation was what President Trump seemed most interested in offering.', 'Along with his condemnation of DEI policies, he offered extended discussion of the angles and elevation at which the two aircraft were flying, the weather conditions on Wednesday night, the temperature of the Potomac and the behaviour of the Army helicopter.', '""We had a situation where we had a helicopter that had an ability to stop,"" he said. ""For some reason, it just kept going.""', 'But on Thursday evening, the White House doubled down on blaming his predecessor and DEI policies. The president signed a memorandum to end diversity efforts in the aviation sector and to review all hiring decisions and changes to safety protocols made during the Biden administration. He also signed an executive order to appoint a new head of the FAA.', ""Two things were very clear from Trump's remarks on Thursday."", 'The first is that his eagerness to inject himself into a major news story is undiminished in his new term. And the second is that in his view it is never too soon to inject politics into national tragedy – and use it to attack opponents and advance his agenda.', ""Follow the twists and turns of Trump's second presidential term with North America correspondent Anthony Zurcher's weekly US Politics Unspun newsletter. Readers in the UK can sign up here. Those outside the UK can sign up here."", 'The president has pledged to eliminate the federal agency that oversees the US education system.', 'Courtroom surveillance video shows two family members jumping over the gallery divider and charging at the defendant.', 'Hadi Matar denies charges of attempted murder and assault for the August 2022 attack.', 'A list of agents who worked on the Capitol riot investigator reportedly was handed over to Trump loyalists at the US Department of Justice.', 'The two won the support of Republicans on Senate committees that had grilled them about their views.', 'Copyright 2025 BBC. All rights reserved.  The BBC is not responsible for the content of external sites. Read about our approach to external linking.', ' ', '']"
