Title,Link,Paragraphs
What is DEI? Trump suggests diversity policies to blame for DC plane crash,https://www.tallahassee.com/story/news/politics/2025/01/31/what-dei-trump-diversity-and-inclusion-policies-executive-order/78080026007/,"[""Since President Donald Trump regained the White House, he has fought to remove all DEI programs from the federal government, blaming diversity, equity and inclusion initiatives for many of the country's ills."", 'On Thursday morning, without evidence of how, Trump suggested that the collision between a commercial airliner and a military helicopter in Washington, D.C. that killed 67 people the night before was the fault of DEI programs instituted by former presidents Barack Obama and Joe Biden and former U.S. Secretary of Transportation Pete Buttigieg, claiming that DEI hires in the Army, airlines and the Federal Aviation Administration had lowered standards.', ""“The FAA — another story — determined that the workforce was too white. They actually came out with a directive, too white, and we want the people that are competent,” he said, after reading part of the FAA's DEI website page."", 'When a reporter asked how he could point to DEI as the reason for the crash before any investigation, he shot back: “Because I have common sense.”', ""On Friday, 12 state attorneys released a joint statement condemning Trump's assault on DEI programs."", '“President Trump’s executive orders are unnecessary and disingenuous,"" the statement says, ""These orders have nothing to do with combatting discrimination. The Trump administration has longstanding civil rights laws at its disposal to combat real discrimination, and we would be willing partners if it chose to pursue this path. Instead, the administration is targeting lawful policies and programs that are beneficial to all Americans.', '""These policies and programs are not only consistent with state and federal anti-discrimination laws, they foster environments where everyone has an opportunity to succeed. That is the opposite of discrimination.""', 'Fact checking:Researching Trump’s statements about DEI, past administrations after DC crash | In context', 'The National Transportation Safety Board has only just started its investigation into the cause of the crash. Multiple media outlets have reported that only one air traffic controller was responsible for directing helicopters and commercial airliners that night, a job usually handled by two staffers.', 'Trump critics have pointed out that his day-one executive order freezing the hiring of federal civilian employees prevented the hiring of air traffic controllers. It is uncertain if the order applies since it excludes public safety which may or may not exclude air traffic controllers and there is no evidence the order had an effect in this event.', 'The FAA also is currently without a head. The former administrator, Michael Whitaker, resigned on Jan. 20, a few months after billionaire and new White House advisor Elon Musk, who has battled the FAA over multiple safety regulation fines from SpaceX launches, called for him to step down. On Friday, Trump appointed U.S. Air Force and FAA career veteran Chris Rocheleau as acting FAA head.', 'Trump did not mention Whitaker or the hiring freeze in the Thursday morning press conference. Newly confirmed Cabinet members Sean Duffy, transportation secretary, and Pete Hegseth, Department of Defense secretary, followed Trump to praise his leadership and vow that they would eradicate DEI policies and hire only qualified individuals in their departments.', ""What is DEI, and why is Trump so determined to kill it? Here's what to know."", 'Diversity, equity and inclusion (DEI) is a term used to describe programs and policies that encourage fairer representation and participation for groups that have been historically and systematically marginalized, such as Black people, women, LGBTQ+ community members, disabled people and ethnic minorities in the United States.', 'DEI programs in business are intended to make sure that everyone — especially groups that have historically been underrepresented or discriminated against — receives fair treatment and that differences are embraced to improve relations and teamwork and increase cultural sensitivity. In education, DEI typically refers to strategies, policies and practices that provide all students equal access to educational opportunities, regardless of their background, identity or abilities.', '""Companies that are diverse, equitable, and inclusive are better able to respond to challenges, win top talent, and meet the needs of different customer bases,"" said multinational consulting firm McKinsey & Company.', 'Efforts to address discrimination in the U.S. have existed for centuries in the U.S. but the current DEI programs grew out of the affirmative action measures started during the Civil Rights era.', 'The Civil Rights Act, signed by then-President Lyndon B. Johnson, banned discrimination based on race, religion, national origin, color and sex. The act ended segregation and brought major changes to the country. Johnson also issued an executive order prohibiting discrimination in federal hiring and employment practices on the basis of race, creed, color, or national origin. (Trump revoked that action.)', 'DEI programs exploded in popularity during the #MeToo and Black Lives Matter movements, especially after the murder of George Floyd and several other Black Americans led to worldwide protests against racism.', 'Critics claim DEI programs prioritize minorities to the exclusion of more qualified candidates and treat them as anti-white, anti-male, ideologically-driven ""woke"" policies that serve as racial discrimination against white Americans, with some even saying they contribute to antisemitism.', 'Supporters say anti-DEI advocates see only white men as capable and intelligent and assume all women and people of color, no matter how qualified, are only in a position of power due to quotas, and warn that the rollback threatens to reverse the progress minorities have made in the workplace over the past six decades.', 'The anti-woke backlash over the last few years, especially after 2023 when the Supreme Court struck down affirmative-action admissions policies, has resulted in DEI programs getting dropped at many public colleges. Conservative foundations, think tanks and political activists have filed a growing number of legal challenges advocating for ""colorblindness"" in the workplace and pressuring companies to drop their programs.', ""DEI was also a special target of Project 2025, the Heritage Foundation's roadmap for a conservative president."", 'Since Trump took office, more big companies have publicly dropped their diversity initiatives, including Amazon, Meta, Walmart, Nissan and Target although some, such as Costco, have resisted.', ""Some of Trump's executive orders have also targeted DEIA programs, which mean diversity, equity, inclusion and accessibility, causing some critics to worry that federal protections for disabled workers may be next on the chopping block."", 'The term DEI hire is a shortened version of ""diversity hire,"" a pejorative term implying someone was only hired to fill a quota or check a box in a DEI program and not on their own merits.', 'During the 2024 presidential campaign, Tennessee Rep. Tim Burchett accused Vice President Kamala Harris, a former district attorney, California attorney general and U.S. senator, was hired for identity politics.', '“One hundred percent she is a DEI hire,” he said.', 'DEI programs have long been a particular target for Gov. Ron DeSantis.', 'The ""Stop WOKE Act"" in 2022 limited discussion of race, gender and other topics in state university classrooms, but it also banned diversity practices and training that could make employees feel ""personal responsibility"" for actions committed in the past by someone of the ""same race, color, sex or national origin."" That part of the Act was permanently struck down by a federal judge.', 'After the liberal arts college New College of Florida in Sarasota had its board members replaced by conservative DeSantis appointees it quickly abolished the school’s DEI office.', 'In 2023, DeSantis signed legislation to ban state or federal funding for any state university programs that “advocate for diversity, equity, and inclusion, or promote or engage in political or social activism.”']"
Trump baselessly blames D.C. plane crash that killed 67 on DEI and Biden,https://www.the-independent.com/news/world/americas/us-politics/dc-plane-crash-trump-briefing-cause-b2689341.html,"['', '', 'President Trump went off on longstanding efforts to recruit people with disabilities as he addressed the deadly collision between an Army helicopter and American Airlines jet', '', '', ""From reproductive rights to climate change to Big Tech, The Independent is on the ground when the story is developing. Whether it's investigating the financials of Elon Musk's pro-Trump PAC or producing our latest documentary, 'The A Word', which shines a light on the American women fighting for reproductive rights, we know how important it is to parse out the facts from the messaging."", '', '', 'President Donald Trump used a deadly air crash that killed three Army aviators and 64 passengers and crew aboard an American Airlines jet to attack his two Democratic predecessors and falsely suggest the tragedy was the result of diversity initiatives in government.', 'In his first visit to the White House briefing room since returning to the presidency last week, Trump initially offered a moment of silence for the victims and praised the efforts of first responders after the crash, which took place just before 9 p.m. ET at Reagan National Airport outside Washington.', 'Footage of the crash shows the two aircraft colliding in midair before exploding in a massive fireball. A massive search-and-rescue operation for survivors, involving multiple agencies, was launched in the nearby Potomac River, amid heavy winds and icy 42-degree water temperatures.', 'So far, at least 40 bodies have been recovered from the river of the 67 people believed to be dead, Chief John Donnelly of Washington’s fire and emergency service said in a Thursday morning press conference.', 'After the moment of silence ended, Trump called the crash “a moment of anguish” for the country and said there is now a “systematic and comprehensive investigation” underway, led by the National Transportation Safety Board, and announced he was appointing Christopher Rocheleau as the acting FAA administrator.', 'He then pivoted to baselessly alleging that standards for air traffic control recruitment and hiring had become lax during the presidencies of his two Democratic predecessors, Barack Obama and Joe Biden.', ""“We must have only the highest standards for those who work in our aviation system. I changed the Obama standards from very mediocre at best to extraordinary, you remember that only the highest aptitude they have to be the highest intellect and psychologically superior people were allowed to qualify for air traffic controllers,” he claimed. “That was not so prior to getting there ... and then when I left office and Biden took over, he changed them back to lower than ever before. I put safety first. Obama, Biden and the Democrats put policy first, and they put politics at a level that nobody's ever seen because this was the lowest level. Their policy was horrible, and their politics was even worse,” he added."", 'Trump also falsely claimed to have once again raised standards for air traffic controllers by signing a memorandum upon taking office which shuttered a longstanding effort at the Federal Aviation Administration to recruit people with disabilities to serve in roles having nothing to do with air traffic control.', 'Positions in the air traffic control system require years of training, special licenses, and annual physical examinations and medical certifications to ensure that controllers meet high-performance standards.', 'Continuing, the president slammed the FAA’s disability recruitment program for having sought out “people with severe intellectual and psychiatric disabilities” and falsely claimed that the prior administration wanted people with such disabilities to serve as air controllers.', '“Brilliant people have to be in those positions, and their lives are actually shortened, very substantially shortened because of the stress where you have many, many planes coming into one target and you need a very special talent and a very special genius to be able to do it,” Trump said.', 'He then falsely claimed that the FAA website stated that persons with conditions such as “hearing, vision, missing, extremities, partial paralysis, complete paralysis, epilepsy, severe intellectual disability, psychiatric disability and dwarfism” were “all qualified for the position of a controller of airplanes pouring into our country” even though the requirements for controllers have long included specific physical and mental health standards.', ""“The initiative is part of the FAA’s ‘diversity and inclusion hiring plan,’ which says diversity is ‘integral to achieving the FAA’s mission of ensuring safe and efficient travel.’ I don't think so. I don't think so. I think it's just the opposite,” he said."", 'While the president would go on to further blame the Biden administration’s transportation secretary, Pete Buttigieg, for the efforts to hire people with disabilities, the policy had been in place since 2013 without interruption, including during the period Trump previously served as president from 2017 to 2021.', 'Vice President JD Vance, who joined Trump at the briefing, also took time to blame diversity initiatives for the crash and suggested that the FAA had been lowering standards because the government has been attempting to hire non-white people for ATC positions.', '""If you go to some of the headlines over the past ten years many hundreds of people suing the government because they would like to be air traffic controllers but turned away because of the color of their skin. That policy ends under Donald Trump’s leadership. Safety is the first priority of our aviation industry,” he said.', 'At the same time as he attacked the prior administration and diversification efforts for the crash, Trump also said he wasn’t sure that the air traffic control system workers involved did anything wrong with respect to the tragedy. He also suggested it was the Army helicopter pilots who’d erred in a social media post made shortly after the crash.', ""Asked why he was now blaming efforts to recruit people with disabilities, he replied: “Because I have common sense, okay, and unfortunately, a lot of people don't,” he said."", 'He referred to the complex system of keeping aircraft separated in crowded airspace as “a major chess game at the highest level” that requires “very high level computer work.”', ""“I think it's very important to understand that for some jobs, and not only this, but air traffic controllers, they have to be at the highest level of genius,” he said."", 'Join thought-provoking conversations, follow other Independent readers and see their replies', '']"
Why Kansas Sen. Roger Marshall thinks DEI programs contributed to D.C. plane crash,https://www.cjonline.com/story/news/politics/state/2025/02/03/u-s-sen-roger-marshall-r-kansas-pins-plane-crash-on-dei-and-biden/78182048007/,"['U.S. Sen. Roger Marshall, R-Kansas, said he thinks diversity, equity and inclusion programs contributed to the in-air collision between a civilian aircraft that took off from Wichita and an Army Helicopter at the Ronald Reagan Washington National Airport in Washington, D.C.', '""I think you\'re going to find out is, there were a lot of qualified white men that they were not hiring because they were holding spots for DEI hires,"" Marshall said. ""You know, it\'s interesting ... I look at the pilot every time. I never said, \'Oh, I hope that\'s a DEI hire.\'""', 'Since the crash occurred on Jan. 29, President Donald Trump has alleged that DEI programs have lowered the standards of air traffic controllers and potentially caused the crash.', '""These are various, very powerful tests that we put to use. And they were terminated by (Joe) Biden. And Biden went by a standard that seeks the exact opposite. So we don’t know,"" Trump told reporters, according to the Associated Press.', ""Trump pointed to a Federal Aviation Administration program to hire people with disabilities, which was put in place in 2013 and remained policy throughout Trump's first term, and an ongoing class-action lawsuit. That lawsuit, Brigida v. the United States Department of Transportation, alleges discrimination in the admissions process for air traffic controllers."", ""An investigation into what caused the crash is ongoing, and there is no evidence that DEI initiatives played any role so far. The chair of the House Transportation Committee, U.S. Rep. Sam Graves, R-Missouri, told Politico he doesn't believe DEI played any role in the crash."", ""The lawsuit against the Federal Aviation Administration alleges that biographical tests meant to prioritize candidates from less privileged backgrounds was discriminatory. The test gave preferential scores to applicants who responded that they haven't been employed for three years or that their worst subjects in school was science."", 'Attorneys representing more than 2,500 air traffic control candidates argued that highly qualified air traffic controller candidates are ""being systematically excluded because of their race.""', ""That test hasn't been in use since 2018 and helped people gain entry to training programs, but uniform standards were applied on tests to graduate. The Biden administration's transportation secretary Pete Buttigieg said the standards for air traffic controllers were not changed under Biden."", '""To be abundantly clear: we did not change the rigorous standard for becoming a certified air traffic controller. Those claiming otherwise are mistaken or lying,"" Buttigieg said on X. ""We did increase funding & training, and grew the ATC workforce after years of declining numbers, including under Trump.""', 'But Marshall, like Trump, laid blame on DEI programs under former President Biden.', '""I think diversity issues did contribute to this accident, and what we know for sure is that under Joe Biden that they lowered the standards for people getting into air traffic control, they lowered the standards, and with that, the number of near misses increased 70%,"" Marshall said.', ""In the fiscal year ending in September 2023, there were 503 near-misses reported, about 65% more than in the prior year. A New York Times investigation said the rise in near-misses was mainly due to chronic understaffing of air traffic control rooms, noting that 285 of the nation's 313 air traffic control facilities are understaffed. Long hours, poor working conditions and underinvestment in technology may also have been primary causes for the increasing number of near-misses."", ""Marshall's office didn't immediately respond to a request for information on how Biden's administration had lowered standards for air traffic controllers. During the news conference, he noted that the job is challenging and stressed the need for merit."", '""I\'ve been in the Air Traffic Control Office there in Olathe. I think the job is harder than being a doctor, just the amount of volume that they\'re handling, it takes a very special person,"" Marshall said. ""And I don\'t care if it\'s a guy or a girl, what color your skin is, it needs to be a qualified person that need to be able to do their job.""']"
"What We Know About Trump Firing Key Aviation, Coast Guard Officials",https://www.snopes.com/fact-check/trump-firing-tsa-coast-guard-aviation-officials/,"['About this rating', 'The Trump administration fired former head of the U.S. Coast Guard Admiral Linda L. Fagan, according to a bulletin sent to all Coast Guard employees, on Jan. 21, 2025. Snopes also confirmed that the Trump administration fired former Transportation Security Administration head David Pekoske and terminated all advisory committees at the U.S. Department of Homeland Security, including the Aviation Security Advisory Committee, a key safety committee under TSA.', 'There is no evidence Trump fired 400 Federal Aviation Administration officials.', 'Amid reports of a collision between a passenger plane and a U.S. Army helicopter in Washington, D.C., on Jan. 29, 2025, killing 67 people, social media users began claiming that U.S. President Donald Trump disbanded a key aviation safety committee and fired the heads of the Transportation Security Administration (TSA) and the U.S. Coast Guard. ', ""Posts spread on Reddit, Bluesky and X (archived, archived and archived) while the cause of the crash remained under intense investigation. News reports about Trump's purported firings were amplified online, including by Democratic lawmakers U.S. Rep. Norma Torres of California and Sen. Martin Heinrich of New Mexico (archived, archived, archived and archived). "", 'Some posts also claimed that Trump fired 400 Federal Aviation Administration (FAA) senior officials and 3,000 air traffic controllers (archived, archived and archived). ', ""Snopes was able to independently verify that Trump's administration fired the heads of the Coast Guard and the TSA and disbanded the Aviation Security Advisory Committee. However, we found no evidence that Trump fired 400 Federal Aviation Administration officials. Thus, we rate this claim a mixture. "", 'Snopes also previously found no evidence that Trump fired 3,000 air traffic controllers. ', ""Trump's administration announced the firing of Admiral Linda L. Fagan, the first woman to head the Coast Guard as its commandant, in a Jan. 21, 2025, bulletin to Coast Guard employees. The bulletin was signed by Benjamine C. Huffman, Trump's pick to lead the U.S. Department of Homeland Security (DHS) as its acting secretary, before the U.S. Senate confirmed DHS Secretary Kristi Noem. "", ""According to the bulletin, Admiral Kevin E. Lunday became acting commandant of the United States Coast Guard after Fagan's dismissal. Congress confirmed Fagan as commandant of the Coast Guard under former President Joe Biden's administration in 2021. "", 'Huffman also sent a Jan. 20 memo to ""all members of Department of Homeland Security advisory committees"" informing them that he was directing the ""termination of all current memberships on advisory committees within DHS, effective immediately."" As the Aviation Security Advisory Committee is established under the TSA, which is part of DHS, that means all members of the Aviation Security Advisory Committee were terminated through this order. ', '(Andrew Huddleston/American Federation of Government Employees, AFL-CIO)', ""According to the TSA (archived), the Aviation Security Advisory Committee was established in 1989 after a terrorist attack on Pan Am flight 103 and provides advice to the TSA administrator on aviation security policy. Under a 2014 law, the committee's existence became permanent — but the Trump administration's decision to remove all advisory committee members meant it was effectively disbanded, at least temporarily. "", ""Snopes obtained a copy of the memo from Andrew Huddleston, director of communications at the American Federation of Government Employees, the largest federal employee union. Huddleston was also able to send former TSA Administrator David Pekoske's farewell message to TSA employees. "", 'In the message, Pekoske wrote that he was ""advised by President Trump\'s transition team"" that his time as TSA administrator would end at 12 p.m. EST on Jan. 20, 2025. ', '(Andrew Huddleston/American Federation of Government Employees, AFL-CIO)', 'Pekoske led the TSA from 2017 to 2025 after Trump appointed him and Congress confirmed him in 2017. ', 'Thus, it is true that Trump disbanded the Aviation Security Advisory Committee and fired the heads of the TSA and the Coast Guard. However, we found no evidence that he also fired 400 senior officials at the FAA. As Snopes previously reported, the fact that dozens of users shared posts with identical language claiming Trump fired 400 senior officials and 3,000 air traffic controllers could indicate a disinformation campaign. ', 'While Trump did sign a memorandum on Jan. 22, 2025, ending a Biden administration FAA hiring policy that he said ""prioritized diversity, equity, and inclusion (DEI) over safety and efficiency"" and ordered the FAA administrator to review the performance of FAA employees in ""critical safety positions,"" we found no evidence he specifically fired 400 senior officials. Here\'s the key text in the memo: ', 'Furthermore, FAA\'s website (archived) only shows 18 ""key official"" designations in its administrative structure, suggesting that the FAA does not have 400 ""senior officials"" to begin with, depending on how you define a senior official. It is true, however, that this key official page has six vacancies as of this writing. A Google search for ""Trump fired 400 FAA officials"" also returned no relevant results from reputable news outlets. ', ""Snopes reached out to the FAA, the Trump administration and the air traffic controllers' union for comment and will update the story if we hear back. "", '', '', '', '', '', '', '', '', 'Grace Deng specializes in government/politics and is based in Tacoma, Wash.', 'Company', 'Navigate', 'Sections', 'Account', '© 1995 - 2025 by Snopes Media Group Inc.', 'This material may not be reproduced without permission.', 'Snopes and the Snopes.com logo are registered service marks of Snopes.com']"
