Title,Link,Paragraphs
‘The Goonies’ Cast Reunites 40 Years Later To Celebrate Ke Huy Quan’s Hollywood Milestone,https://www.usmagazine.com/entertainment/news/the-goonies-cast-reunites-for-a-very-special-reason/,"['', '', '', '', '', '', '', '', 'The cast of classic ’80s blockbuster The Goonies had a heartwarming reunion in honor of their castmate Ke Huy Quan.', 'Quan, 53, was joined by Goonies costars Josh Brolin, Corey Feldman, Jeff Cohen and Kerri Green at his hand and footprint ceremony at the historic TCL Chinese Theatre in Hollywood on Monday, February 4.', 'Brolin, 56, read a letter to Quan from The Goonies producer Steven Spielberg, who could not attend Monday’s ceremony because he was on vacation, reports USA Today.', '', '“I’m proud of you for your meteoric rise as a child and then your second meteoric rise as a grown-up,” Spielberg, 78, wrote. “And believe me, very few of us get two bites at that apple.”', 'In his own speech, Brolin relayed how he has always held Quan and his “heart of gold” in “a very dear place in [his] heart.”', '“I could not be happier for you – I know we all are, all us Goonies here – for an honor that is not only totally deserved, but celebrates all that is right in this industry,” Brolin told his friend.', 'The Goonies screenwriter Chris Columbus was also in attendance at the Chinese Theatre ceremony, where he credited Quan with “the greatest comeback story in the history of cinema.”', ""“You, sir, are the embodiment of a phrase I wrote so many years ago: ‘Goonies never say die,'” Columbus declared of Quan."", 'Quan later remembered a “wild dream” he’d had when he was 13 years old after seeing Spielberg and George Lucas‘ hand and footprints at the Chinese Theatre.', '“I would realize how naive that dream was,” Quan recalled. “As the years passed, I would walk by [this theater] and be reminded how that once hopeful actor turned into just another moviegoer. And now here we are, more than 40 years later, and not only am I acting again, but that crazy dream actually came true.”', 'Quan stepped away from acting for nearly 20 years to work as a stunt coordinator and assistant director, before winning a Best Supporting Actor Oscar for his comeback performance in Everything Everywhere All at Once. He has since had high-profile roles in Marvel’s Loki and Kung Fu Panda 4.', 'Quan’s Goonies costar Sean Astin was not in attendance for the hand and footprint ceremony, but reunited with his castmates later in the day at the premiere of new movie Love Hurts.', 'Astin costars in director Jonathan Eusebio’s action thriller, where Quan plays a successful realtor desperate to bury his past as an international assassin. Love Hurts, which hits cinemas on Friday, February 7, also stars Oscar winner Ariana DeBose and American Born Chinese actor Daniel Wu.', 'Fans shouldn’t get their hopes up that the Goonies cast reunion at the Chinese Theatre may be a sign that a long-awaited sequel is finally in the works.', 'There were reports last year that a Goonies 2 script had been written and would be filmed in 2025, but OG cast members Feldman and Martha Plimpton quickly denied any sequel was happening.', '“People, there is no Goonies 2 script, there is no one ‘attached,’ Spielberg is not directing, it’s not real,” Plimpton wrote via Instagram in September.', 'Feldman echoed his costar’s denial, writing via X: “EVERY1 IS ASKING…I CAN OFFICIALLY TELL U 100% NO! I HAV NO INFO THAT A SEQUEL IS IN THE WORX.”', 'The Goonies was originally released on June 7, 1985, as part of a momentous summer for Hollywood that would see fellow blockbusters Back to the Future, Rambo: First Blood Part II and Cocoon hitting cinemas.', 'The Goonies is available to stream on Prime Video and Apple TV+.', '', 'By signing up, I agree to the Terms and Privacy Policy and to receive emails from Us Weekly', '', '', 'US WEEKLY HAS AFFILIATE PARTNERSHIPS SO WE MAY RECEIVE COMPENSATION FOR SOME LINKS TO PRODUCTS AND SERVICES.', '', 'By signing up, I agree to the Terms and Privacy Policy and to receive emails from Us Weekly', 'Us Weekly is part of Part of the a360media Entertainment Group. © a360media 2025\nPowered by WordPress VIP']"
No title found,https://www.imdb.com/news/ni65109737/?ref_\u003dnm_nwr_1,"['© 1990-2025 by IMDb.com, Inc.', '']"
,https://www.goodmorningamerica.com/culture/video/taylor-swift-alicia-keys-son-dance-night-grammys-118402787,"[""Swift and Keys' son Genesis danced away as Shakira performed on stage!"", 'Sandra Bullock is raising her concerns about social media scams.', '""My family\'s safety, as well as the innocent people being taken advantage of, is my deep concern, and there will be a time when I will comment more, but for now our focus is helping law enforcement handle this matter,"" the Oscar winner said in a statement to People on Monday.', ""Keanu Reeves, Sandra Bullock reunite at 'Speed' 30th anniversary event: Photos"", '""Please be aware that I do not participate in any form of social media,"" the statement continued. ""Any accounts pretending to be me or anyone associated with me are fake accounts and have been created for financial gain or to exploit people around me.""', 'The statement from Bullock came a day after her sister, Gesine Bullock-Prado, shared a post on Instagram stating the accounts that are impersonating her on Facebook.', '""Another day, the same lack of safety and response from @meta @metaforbusiness @zuck,"" she began in the caption. ""I\'m just posting a few FB imposter accounts, all of which I\'ve reported both on this app and to a live human at @meta. Surprise! They are all still up!""', 'She continued, ""I spend multiple times a day reporting fakes, dealing with weird & scary emails to my BUSINESS and HOME from men who believe that, through one of these many fake \'me\'s, they have a relationship with my sister through private messages and off app sites and have been giving (sometimes) THOUSANDS OF DOLLARS to an incredibly famous and successful grown assed woman.""', 'Bullock-Prado wrote she has also filed a report to a security service that gives the account ""addresses directly to a Meta employee.""', '""These accounts are run by crime rings,"" she said. ""They also run fake groups where a fake me posts \'official statements.\' Not me. This is my only account and y\'all know it\'s about baking, cooking, animals, and gardening.""', '""I\'m a grown assed middle aged woman with a life and I don\'t troll around at 54 DMing people,"" she added, urging the public to report and block any fake accounts pretending to be her.', 'She explained that she stays on Facebook primarily to monitor these scams and stay aware of potential threats, noting that she has even had to involve local law enforcement due to the severity of some of the scams.', 'While she praised Instagram for proactively handling impersonation accounts, she criticized Facebook for failing to take action despite being part of the same company.', 'Bullock-Prado also referenced a report about a French woman named Anne, who was scammed out of over $800,000 by fraudsters posing as Brad Pitt, according to France24. They convinced her they were in a relationship and that he needed financial help for medical expenses.', 'As a result, Anne reportedly fell into severe depression and required hospital treatment.', '""At first I said to myself that it was fake, that it\'s ridiculous,"" Anne told French channel TF1, per France24. ""But I\'m not used to social media and I didn\'t really understand what was happening to me.""', '""I ask myself why they chose me to do such harm like this?"" she added at the time. ""I\'ve never harmed anyone. These people deserve hell.""', 'ABC News has reached out to representatives of Bullock and Meta but did not hear back immediately.', '']"
Ke Huy Quan reunites with 'The Goonies' 40 years later: 'Goonies never say die',https://www.usatoday.com/story/entertainment/celebrities/2025/02/04/the-goonies-reunion-josh-brolin-ke-huy-quan/78207347007/,"['Goonies never say die.', '""The Goonies"" stars Josh Brolin, Corey Feldman, Jeff Cohen and Kerri Green reunited on Monday for Ke Huy Quan\'s hand and footprint ceremony at the famed TCL Chinese Theatre in Los Angeles.', 'Sean Astin did not attend but on Monday joined Quan, Cohen, Green and Feldman for the premiere of his and Quan\'s new movie ""Love Hurts.""', 'In a speech, Brolin, who played Brand in the classic 1985 film, said he holds Quan ""in a very dear place in my heart.""', '""You have that midas touch, my friend, and you have it because you have that heart of gold that you\'ve always had,"" the actor said.', 'Need a break? Play the USA TODAY Daily Crossword Puzzle.', 'Brolin added, ""I could not be happier for you — I know we all are, all us Goonies here — for an honor that is not only totally deserved, but celebrates all that is right in this industry. Love you, pal.""', 'Brolin also read a letter from Steven Spielberg, who directed Quan in ""Indiana Jones and the Temple of Doom"" and whose company Amblin Entertainment produced ""The Goonies."" The director, who was on vacation and couldn\'t attend, said Quan\'s ""whole life has been a dream come true.""', ""Watch Ke Huy Quan's emotionalOscars acceptance speech: 'This is the American dream'"", '""I\'m proud of you for your meteoric rise as a child and then your second meteoric rise as a grown-up,"" he said. ""And believe me, very few of us get two bites at that apple.""', 'After rising to fame as a child actor, Quan stepped away from acting for about 20 years due to difficulty finding roles and pivoted into working as a stunt coordinator and assistant director. But he made an acting comeback in 2022 by starring in ""Everything Everywhere All at Once,"" which earned Quan the Oscar for best supporting actor. The film also won best picture.', 'Since then, Quan has continued acting with roles in ""Loki"" and ""Kung Fu Panda 4,"" and his upcoming projects include ""The Electric State"" and ""Zootopia 2."" He\'s now taking on the lead role as an action star in the new action-comedy ""Love Hurts.""', 'In his speech, Quan got emotional as he reflected that when he was 13, he fantasized about one day being invited to imprint his hand and footprints at the Chinese Theatre after seeing Spielberg and George Lucas do so.', '""Of course, it was such a wild dream, and over the years, I would realize how naive that dream was,"" he said. ""As the years passed, I would walk by (the theater) and be reminded how that once hopeful actor turned into just another moviegoer. And now here we are, more than 40 years later, and not only am I acting again, but that crazy dream actually came true.""', 'Quan added that ""The Goonies"" is ""still one of the greatest adventures of my life"" and thanked his co-stars for turning out. ""The Goonies"" screenwriter Chris Columbus also attended Monday\'s ceremony and honored Quan, ""my fellow Goonie,"" in a speech.', '""You have proven yourself time and time and time again to be a man of great integrity, a man of great courage, a man who, against all odds, has been able to make his dreams come true,"" he said, adding that Quan\'s is ""one of, if not the greatest comeback story in the history of cinema.""', 'Oscars:Ke Huy Quan, Michelle Yeoh and more win big, but their moms were the biggest winners', 'Columbus continued, ""You, sir, are the embodiment of a phrase I wrote so many years ago: Goonies never say die.""', '""Everything Everywhere All at Once"" director Daniel Scheinert, who was joined by his co-director on the film Daniel Kwan, said it\'s been ""so inspiring to get a front row seat"" to Quan\'s acting comeback.', '""It\'s so beautiful because the world is just full of so many people who are getting older and thinking maybe they\'re not supposed to share their art anymore,"" he said. ""They were so inspired to see you come back and prove that you had so much more to offer.""', 'Quan choked up as he told Scheinert and Kwan, ""Thank you so much for bringing me back.""']"
All About Love Hurts Star Ke Huy Quan and His Wife Echo,https://www.nbc.com/nbc-insider/all-about-love-hurts-star-ke-huy-quan-and-wife-echo,"['', 'Get set to break some funny bones with Oscar winner Quan when Love Hurts hits theaters on February 7.', 'Oscar winner Ke Huy Quan is about to lay the hilarious smack down on a gang of pursuing baddies when Universal Pictures’ new action comedy Love Hurts throws the first punch in theaters everywhere beginning February 7 (get tickets here). But from his present-day acting revival all the way back to his eternally awesome childhood roles in 1980s classics Indiana Jones and the Temple of Doom and The Goonies, one thing’s always remained constant: Even when he’s being just a little bit bad, it’s impossible for Quan not to be funny. ', 'Quan’s remarkable return to the big screen, highlighted by his Academy Award-winning performance as Waymond Wang in 2022’s Everything Everywhere All At Once, came after a lengthy two-decade hiatus that put a lot of separation between his childhood and adult film roles. But as you’ll find out below, he hasn’t exactly been in hiding — in fact, an uplifting thread of consistency has signified Quan’s lengthy screen career, buoyed by the unwavering support of Echo Quan, his wife of more than 20 years. ', ""RELATED: Love Hurts: Everything to Know About Ke Huy Quan's New Action-Comedy"", 'Born in Saigon, South Vietnam and eventually emigrating to the Los Angeles area as a post-war refugee with his family while still a child, Quan landed the role of a lifetime when he debuted opposite Harrison Ford as Short Round, Indy’s 12-year-old sidekick, in 1984’s Indiana Jones and the Temple of Doom. ', 'Short Round’s funny, faithfully loyal vigil over Indy’s safety (not to mention some mad taxi driving skills) assured Quan an iconic place of honor in both Indiana Jones lore as well as in broader cinema history (his Temple of Doom performance earned him an early Saturn Award for Best Performance by a Younger Actor). Within a year, he was back at work in another Steven Spielberg movie collaboration — this time in the role of Richard ""Data"" Wang in The Goonies, holding down the fort as the gang’s gadget-savvy resident James Bond fan. ', 'RELATED: Ke Huy Quan is a ""Different Kind of Action Star"" in First Trailer for Love Hurts', ""Quan continued to act into his early 20s, landing roles in the Japanese film Passengers and, as some sitcom fans might remember, as Jasper Kwong in later seasons of TV's Head of the Class (1990-1991). On the big screen, Quan also appeared in Breathing Fire (1991) and opposite Pauly Shore and Brendan Fraser in Encino Man (1992), before his acting opportunities began to taper and he decided to take a fresh approach to the screen industry — this time from the other side of the camera."", 'Quan entered the film program at the University of Southern California in the 1990s, graduating in 1999 after developing Voodoo, a student-created horror-comedy flick that earned the Audience Award at the 2000 Slamdance Film Festival. “…I started working for some really fun and great people,” Quan shared with Entertainment Weekly in 2022, including a productive professional relationship with action choreographer Corey Yuen. ', '“He took me under his wing and started teaching me about action and action sequences and how to choreograph them,” Quan explained to EW, launching a mentorship that eventually landed him on the set of 2000’s X-Men as a fight sequence choreographer himself. He re-teamed with Yuen the following year to help orchestrate fight scenes for Jet Li in The One (2001), and continued to keep busy on various film projects until being brought on board as an assistant director for the critically-acclaimed Hong Kong-based romantic drama 2046.', 'He couldn’t have known it at the time, but Quan’s involvement in 2046 turned out to be a seismically life-changing event. Thanks to a fortuitous introduction from 2046 director Wong Kar-wai, Quan met his future wife Echo (a film language translator) during the movie’s Hong Kong production. ', 'After briefly dating, the two tied the knot and eventually moved together to Los Angeles, where some time passed before Quan encountered another stroke of serendipity. Energized by the success of 2018’s Crazy Rich Asians, he found renewed hope in Hollywood’s embrace of Asian talent, as he shared with Variety in the wake of his breakout reemergence in 2022’s Everything Everywhere All at Once. ', ""RELATED: Love Hurts: The Cast & Characters of Ke Huy Quan's Action-Comedy, Explained"", '“When Crazy Rich Asians came out and I saw my fellow Asian actors up on the screen, I wanted to be up there with them,” Quan confided. “…When I decided to get back to acting, I thought I would get little roles here and there, but never in my wildest imagination did I think that a script like this would be in front of me and provide an opportunity to audition for one of the greatest roles I’d ever read.”', 'Everything Everywhere, in fact, became an official couple’s project for both Ke and Echo. He landed an eventual Oscar-winning role, while she served as a multilingual translator on set. “This is her first job in the industry since she has moved here,” directors Daniel Kwan and Daniel Scheinert raved in a since-deleted Twitter post (via People). “She teared up when we hired her. But we’re the lucky ones!”', '', 'Red carpet watchers have little trouble spotting Ke and Echo at big premieres these days; they’re kinda famous for showing up — all dashing and debonair — in smart complementary suits. ', 'But there’s far more to their 20-year marriage than mere sartorial agreement, as Quan’s heartfelt Best Supporting Actor acceptance speech at the 2023 Academy Awards will forever attest. “I owe everything to the love of my life, my wife Echo,” he said, “who month after month, year after year, for 20 years told me that one day, one day, my time will come.”', 'Since the success of Everything Everywhere All at Once, Quan has been racking up a slew of high-profile acting gigs in Hollywood. He was featured in Season 2 of the Marvel TV series Loki, gave voice to Han the thieving pangolin in DreamWorks Animation’s Kung Fu Panda 4, and — in addition to his leading Love Hurts role — is set to appear this year as an animated voice in Zootopia 2 while also joining the huge ensemble star cast of The Electric State, the upcoming 2025 science fiction adventure film from directing duo the Russo brothers. ', 'Love Hurts puts Quan front and center as Marvin Gable, a mild-mannered real estate agent leading a quiet and happy life in the suburbs of Milwaukee. He takes pride in his job and seems to be doing just fine… until a pair of cryptic (and slightly ominous) messages, one bearing the warning that “love hurts” — arrives one day in the mail. ', 'There’s something familiar to Marvin about that phrase, and it revives some deeply buried demons from his distant criminal past. To put his former life behind him once and for all, he’ll have to learn to stop apologizing so nicely after landing each well-placed punch — all while remembering the deadly assassin’s skills that formerly earned him an underworld reputation as a much less friendly sort of fellow in the first place. ', 'Joining Quan on his action-packed comedy blast from the past is fellow Oscar winner Ariana DeBose (West Side Story) as Rose, Marvin\'s criminal ex-partner; Daniel Wu (Into the Badlands) as Marvin’s vengeful long-lost brother, Alvin “Knuckles” Gable; Mustafa Shakir (Luke Cage) as the poetry-loving hitman Roger, aka ""The Raven”; Lio Tipton (Crazy, Stupid, Love.) as Marvin\'s hapless real estate assistant; Rhys Darby (Our Flag Means Death) as eccentric number-cruncher Kippy Betts; Sean Astin (The Goonies) as Marvin\'s real estate boss; and Marshawn Lynch (watch for Marvin to duck a slapstick swing or two from the NFL great) as a brawny, lunkheaded enforcer-goon.', 'From the producers of Nobody and Violent Night, Universal Pictures’ Love Hurts premieres in theaters everywhere beginning Friday, February 7. Grab your tickets here!', 'The NBC App is the best place to catch up on the most recent season of your favorite shows, watch live TV, and stream movies.']"
The Goonies: Ke Huy Quan “would love” for a sequel to happen,https://www.joblo.com/the-goonies-sequel-ke-huy-quan/,"['HOME » MOVIE NEWS » THE GOONIES: KE HUY QUAN “WOULD LOVE” FOR A SEQUEL TO HAPPEN', 'It’s been forty years since the release of The Goonies, but Ke Huy Quan “would love” for the long-belated sequel to finally happen.', 'The Goonies never say die, even when it comes to a sequel. It’s been forty years since the release of the original movie, and there’s been talk of a follow-up for years. Will it ever happen? Who knows, but the cast is certainly game to return.', 'At Ke Huy Quan’s recent hand-and-footprint ceremony at the TCL Chinese Theatre in Hollywood, the actor told Variety that getting asked about a potential sequel to The Goonies is “one of the most asked questions in my life,” but that he “would love for it to happen.” Much of the original cast showed up to support Quan, including Josh Brolin, Corey Feldman, Jeff Cohen, Kerri Green, and screenwriter Chris Columbus.', 'Feldman added that he had been developing a potential sequel with Sean Astin a decade ago and had even pitched it to original director Richard Donner, who was excited by the concept but thought it was “too expensive.” Feldman is also down to return for more Goonies. “All I can say is, get us all together.” he said. “Everybody is looking good. Sean’s looking good. Josh is looking good. We’re all looking good still, and we’re all alive. Goonies never say die…There’s hope.“', 'Nothing is official yet, but last month, it was reported that Columbus was working on a new Goonies project (as well as a new Gremlins movie).', 'Quan will next be seen in Love Hurts. ” Quan stars as Marvin Gable, a realtor working the Milwaukee suburbs, where ‘For Sale’ signs bloom. Gable receives a crimson envelope from Rose (Ariana DeBose), a former partner-in-crime that he had left for dead. She’s not happy,” reads the Love Hurts synopsis. “Now, Marvin is thrust back into a world of ruthless hitmen, filled with double-crosses and open houses turned into deadly warzones. With his brother Knuckles (Daniel Wu), a volatile crime lord, hunting him, Marvin must confront the choices that haunt him and the history he never truly buried.” The film is set to hit theaters on February 7th.', 'Quan is also set to star alongside Chris Pratt and Millie Bobby Brown in The Electric State. Directed by the Russo brothers, the film is set in an alternate, retro-futuristic version of the 1990s, where sentient robots resembling cartoons and mascots, who once served peacefully among humans, now live in exile following a failed uprising. The film will debut on Netflix on March 14th.', 'Would you like to see a sequel to The Goonies?', 'Based in Canada, Kevin Fraser has been a news editor with JoBlo since 2015. When not writing for the site, you can find him indulging in his passion for baking and adding to his increasingly large collection of movies that he can never find the time to watch.', 'The Super Bowl is nearly upon us, and in addition to the battle between the Kansas City Chiefs and the…', 'Following the Karla Sofía Gascón controversy, Netflix is changing the Emilia Pérez Oscar campaign to distance itself from the actress.', 'It’s been forty years since the release of The Goonies, but Ke Huy Quan “would love” for the long-belated sequel to finally happen.', 'Fans have accused Marvel of using AI to create the posters for The Fantastic Four: First Steps, but the studio has denied it.', 'Addison Rae and Suzanna Son are rumored to have joined Charlie Hunnam in the Ed Gein-themed Monster season 3', 'Paul Feig’s Another Simple Favor, starring Blake Lively and Anna Kendrick, will help open this year’s SXSW festival.', 'Olivia Holt is set to star in director Adam MacDonald’s apocalyptic horror thriller This Is Not a Test, based on a Courtney Summers novel', 'Ethan Hawke is co-writing (and could direct) a remake of the Henry King-directed Gregory Peck Western The Gunfighter.', 'The Bear and Theater Camp actress Molly Gordon is stepping behind the camera for the high school glory days comedy Peaked.', 'Jurassic World Rebirth unveils new images while the producer and director reveal more story and action details', 'Some images sourced from TMDB\n© 1998 - present JoBlo Media Inc., All Rights Reserved | JoBlo® is a trademark of JoBlo Media Inc.\nAll movie titles, pictures, etc... are registered trademarks and/or copyrights of their respective holders']"
