Title,Link,Paragraphs
Can Fans Expect A Goonies Sequel in the Near Future? The stars weigh in…(Exclusive),https://www.eonline.com/videos/2406608451788/can-fans-expect-a-goonies-sequel-in-the-near-future-the-stars-weigh-in-exclusive,"['E! News chats with the stars of the 80’s classic ‘The Goonies’ at the ‘Love Hurts’ movie premiere and they reveal what it was like reuniting after 40 years. Plus, if fans can expect a sequel in the future.', 'about 9 hours ago', 'about 9 hours ago', 'about 10 hours ago', 'about 10 hours ago', 'about 10 hours ago', 'about 10 hours ago', 'about 10 hours ago', 'about 10 hours ago', 'February 24, 2014', 'February 25, 2014', 'February 25, 2014', 'February 21, 2014', 'February 21, 2014', 'February 21, 2014', 'February 19, 2014', 'February 19, 2014', 'about 14 hours ago', 'February 3, 2025', 'February 2, 2025', 'February 1, 2025', 'January 31, 2025', 'January 31, 2025', 'January 29, 2025', 'January 27, 2025', 'Your source for entertainment news, celebrities, celeb news, and celebrity gossip. Check out the hottest fashion, photos, movies and TV shows!', '© 2025 E! Entertainment Television, LLC A Division of NBCUniversal. All rights reserved.', '', '', '', '', '', '', '', '', '']"
Ke Huy Quan reunites with 'The Goonies' 40 years later: 'Goonies never say die',https://www.aol.com/ke-huy-quan-reunites-goonies-145308046.html,"['Advertisement', '', '', 'Goonies never say die.', '""The Goonies"" stars Josh Brolin, Corey Feldman, Jeff Cohen and Kerri Green reunited on Monday for Ke Huy Quan\'s hand and footprint ceremony at the famed TCL Chinese Theatre in Los Angeles.', 'Sean Astin did not attend but on Monday joined Quan, Cohen, Green and Feldman for the premiere of his and Quan\'s new movie ""Love Hurts.""', 'In a speech, Brolin, who played Brand in the classic 1985 film, said he holds Quan ""in a very dear place in my heart.""', '""You have that midas touch, my friend, and you have it because you have that heart of gold that you\'ve always had,"" the actor said.', 'Brolin added, ""I could not be happier for you — I know we all are, all us Goonies here — for an honor that is not only totally deserved, but celebrates all that is right in this industry. Love you, pal.""', 'Brolin also read a letter from Steven Spielberg, who directed Quan in ""Indiana Jones and the Temple of Doom"" and whose company Amblin Entertainment produced ""The Goonies."" The director, who was on vacation and couldn\'t attend, said Quan\'s ""whole life has been a dream come true.""', ""Watch Ke Huy Quan's emotional Oscars acceptance speech: 'This is the American dream'"", '""I\'m proud of you for your meteoric rise as a child and then your second meteoric rise as a grown-up,"" he said. ""And believe me, very few of us get two bites at that apple.""', 'After rising to fame as a child actor, Quan stepped away from acting for about 20 years due to difficulty finding roles and pivoted into working as a stunt coordinator and assistant director. But he made an acting comeback in 2022 by starring in ""Everything Everywhere All at Once,"" which earned Quan the Oscar for best supporting actor. The film also won best picture.', 'Since then, Quan has continued acting with roles in ""Loki"" and ""Kung Fu Panda 4,"" and his upcoming projects include ""The Electric State"" and ""Zootopia 2."" He\'s now taking on the lead role as an action star in the new action-comedy ""Love Hurts.""', 'In his speech, Quan got emotional as he reflected that when he was 13, he fantasized about one day being invited to imprint his hand and footprints at the Chinese Theatre after seeing Spielberg and George Lucas do so.', '""Of course, it was such a wild dream, and over the years, I would realize how naive that dream was,"" he said. ""As the years passed, I would walk by (the theater) and be reminded how that once hopeful actor turned into just another moviegoer. And now here we are, more than 40 years later, and not only am I acting again, but that crazy dream actually came true.""', 'Quan added that ""The Goonies"" is ""still one of the greatest adventures of my life"" and thanked his co-stars for turning out. ""The Goonies"" screenwriter Chris Columbus also attended Monday\'s ceremony and honored Quan, ""my fellow Goonie,"" in a speech.', '""You have proven yourself time and time and time again to be a man of great integrity, a man of great courage, a man who, against all odds, has been able to make his dreams come true,"" he said, adding that Quan\'s is ""one of, if not the greatest comeback story in the history of cinema.""', 'Oscars: Ke Huy Quan, Michelle Yeoh and more win big, but their moms were the biggest winners', 'Columbus continued, ""You, sir, are the embodiment of a phrase I wrote so many years ago: Goonies never say die.""', '""Everything Everywhere All at Once"" director Daniel Scheinert, who was joined by his co-director on the film Daniel Kwan, said it\'s been ""so inspiring to get a front row seat"" to Quan\'s acting comeback.', '""It\'s so beautiful because the world is just full of so many people who are getting older and thinking maybe they\'re not supposed to share their art anymore,"" he said. ""They were so inspired to see you come back and prove that you had so much more to offer.""', 'Quan choked up as he told Scheinert and Kwan, ""Thank you so much for bringing me back.""', ""This article originally appeared on USA TODAY: 'The Goonies' reunion: Josh Brolin, more stars honor Ke Huy Quan"", 'Yahoo Shopping', 'Advertisement', 'Advertisement']"
KE HUY QUAN HAS NOTHING BUT LOVE FOR HOLLYWOOD,https://www.rollingstone.com/culture/culture-features/ke-huy-quan-interview-love-hurts-steven-spielberg-oscar-1235230998/,"['By KORY GROW', 'A\nfter 40 years in Hollywood, Ke Huy Quan is no stranger to getting knocked around, literally and figuratively. He burst into the pop-culture consciousness in 1984 as the adorable young sidekick Short Round in Indiana Jones and the Temple of Doom. It was a pure accident — he’d accompanied his brother to the open audition, and when a casting director overheard him coaching from the sidelines, he got the gig instead (over not just his own brother but a ). Another scene-stealing turn in the beloved adventure movie followed, but Quan’s budding career seemed to fizzle as he got older.', '', '', '', '', '', '', '', '', '', '', '', '', '', '', '', '', '', '', '', '', '', '', '', '', '', '', '', '', '', '', '“You get wiser when you have more difficulties,” says Ke Huy Quan', 'IMAGES WITHIN ILLUSTRATION BY DANIELE VENTURELLI/GETTY IMAGES; VICTOR COLIN SUMNER/FAIRFAX MEDIA/GETTY IMAGES; TAYLOR HILL/FILMMAGIC; STEVE GRANITZ/FILMMAGIC', 'We want to hear it. Send us a tip using our anonymous form.', 'Rolling Stone is a part of Penske Media Corporation. © 2025 Rolling Stone, LLC. All rights reserved.', '', '', '']"
It Doesn’t Hurt To Love Ke Huy Quan: An AUGUSTMAN Exclusive,https://www.augustman.com/sg/people/it-doesnt-hurt-to-love-ke-huy-quan-an-augustman-exclusive/,"['', '', 'When I was eight, I hated Ke Huy Quan for being Short Round.', 'When my parents bought a new laser disc (LD) player, one of the first LDs they also bought was Indiana Jones and the Temple of Doom. Harrison Ford was already one of my favourite actors, but that movie made me an even bigger fan. While I loved a good scoundrel like Han Solo, I particularly loved the adventuring academic. As an eight-yearold, perpetually bored in primary school, something about someone who goes from campus to the jaws of danger in just two scenes appealed to me, so Professor Henry “Indiana” Jones Jr. was very easily my favourite fictional character of all time then.', '', '', '', 'As a boy, I never wanted to be my heroes. I yearned to be the person fighting alongside him. As much as I loved Frodo Baggins, I wanted to be Samwise Gamgee. I loved Han Solo, but I wanted to be Chewbacca. In Indiana Jones and the Temple of Doom, I especially loved Indy, and I especially wanted to be Short Round, his orphaned Asian sidekick.', 'Sadly, there was this Vietnamese-born Chinese American kid named Ke Huy Quan playing Short Round. Whenever I lived out my Indiana Jones fantasies at the playground, my mind went to the Asian boy who got to be on set with Harrison Ford, who received instruction from Steven Spielberg and George Lucas, and who got to shout, “Indy!” as he evaded trouble. The obsession I had for Ke Huy Quan turned to jealousy, and in my immature mind, he deserved my wrath.', 'Of course, as an eight-year-old, I had no idea that the person I hated was struggling and would continue to have a hard time surviving as an actor for years. After his memorable portrayal of Data in 1985’s The Goonies, roles for Quan dried up. His appearances in Taiwanese movies and shortrun American sitcoms were limited.', 'To gain the attention of Hollywood, the actor even tried changing his name. “For a long time, people didn’t know how to pronounce my name. When I was younger, my manager suggested I changed it to a more American name. So, at one point, I was called Jonathan,” he tells me. Having spent most of my formative years in the pre-woke era, I was not surprised.', 'However, Quan stayed true to himself. “When I got back into acting, I chose to go by my birth name again. The thought of people not knowing how to pronounce my name made me a little hesitant, but I told myself that if I work hard enough, people will learn how to say my name.” It is pronounced “Kee-Hwee-Kwahn”.', 'Because Quan’s Hollywood career started so brightly, the drought was particularly challenging. “I didn’t know much when I started in the business. I was 12 years old. I had just immigrated to the US four years earlier, learning the language and assimilating into my new life,” he recalls. “All of a sudden, I was cast in this big movie starring Harrison Ford, and working with the kings of Hollywood, George Lucas and Steven Spielberg. I had the most incredible time working with these men, and I learnt so much from them.”', 'Working on Indiana Jones and the Temple of Doom was particularly formative. Quan says, “That experience shaped who I am today—my love for this industry, my love of acting, and my work ethic. Being on the set taught me how to treat people, and that success does not mean that you must be an asshole. I’ve been extremely fortunate and have worked with very successful people who are the kindest, most humble, generous people I’ve ever met. That experience was nothing but positive.”', 'For his performance as Short Round, Quan was nominated for the Saturn Award for Best Performance by a Younger Actor by the Academy of Science Fiction, Fantasy and Horror Films. It paved the way for his next big role as Richard ‘Data’ Wang in The Goonies in 1985, a year after the release of Indiana Jones and the Temple of Doom. Despite his success, Quan remained grounded, and did not fall off the rails like many successful child actors.', '“My parents were very strict,” says Quan. As Asian children growing up in the ’80s and ’90s, we shared a small knowing laugh. Our parents were probably strict in similar ways. “I was always surrounded by my family. They kept me level-headed and grounded. They wouldn’t let me do any crazy stuff. My parents would have killed me if I did drugs. They raised me with very traditional Chinese values.”', 'Apart from that, he was never interested in the glitz, glamour, and temptations of the Hollywood party scene. “I was going through puberty, trying to find my own identity, my own belonging. Going to Hollywood parties was the last thing on my mind. I just wanted to find myself and find a job. After work, I went straight home. I never liked that scene anyway. I’m not a party guy. I’m very homey.”', 'After The Goonies, Ke Huy Quan found some success in Asia, but it was in Hollywood that he sought success. It was where he got his first break—to him, professionally, Hollywood was home. However, opportunities were scarce for an Asian actor in the ’90s.', 'As the roles dwindled, Quan quit acting and enrolled at University of Southern California’s School of Cinematic Arts. “Those two years I was there, I learnt so much about the entire movie-making process—not just from an actor’s point of view, but also from the director’s, cinematographer’s, editor’s, and sound designer’s perspective. That’s when I began to understand this industry and my perspective broadened. Seeing myself behind the camera was just as liberating as seeing myself in front of it. It opened many doors for me.”', 'Ke Huy Quan’s first job after the School of Cinematic Arts was assisting Corey Yuen, a legendary Hong Kong action film director, on the set of X-Men in 2000, where he met the young associate producer Kevin Feige, now President of Marvel Studios and the primary producer of the Marvel Cinematic Universe franchise since 2007.', 'Quan brought the same energy and positivity he has always possessed to that job. “It was incredible. With the education and experience of working with Corey Yuen. I started down a career path that, in retrospect, prepared me for Love Hurts.”', 'The action thriller-romcom is Quan’s latest and first-ever leading role in a Hollywood film. It follows his Oscar-winning performance in Everything Everywhere All at Once, which marked his return to acting after a two-decade hiatus. In Love Hurts, Quan plays Marvin Gable, a seemingly mild-mannered real estate agent hiding a dangerous past. When a former partner in crime returns seeking revenge, Marvin is thrust back into the world of violence and forced to confront the choices that have haunted him.', 'It was also a personal project for Ke Huy Quan. “We made this movie for action fans. We wanted to make sure that it was entertaining and that the fight scenes were incredible. They were the most demanding aspect of this shoot. There are five big action sequences, and each gets crazier, more complex, and more intense. Their style is similar to what Jackie Chan and Sammo Hung did in the ’80s. These greats focused on the action sequences to ensure they delivered.', '“The cast is incredible, too. Oscar winner Ariana DeBose, Daniel Wu, Mustafa Shakir, Marshawn Lynch—all incredible actors. In terms of the dramatic elements, playing off them was easy. When you work with great actors, they make it easy.” Quan’s Goonies co-star Sean Astin has a small role as Cliff Cussick, Gable’s real estate boss and mentor. “The day Sean arrived on set, I dropped everything and ran to give him a big hug,” he recalls. “We’re brothers for life because of that movie.”', 'Love Hurts continues a renaissance in Hollywood’s portrayal of masculinity, where leading men use intelligence, sensitivity, and kindness rather than pure muscle to win the day. This flag has been flown by protagonists such as Eddie Redmayne’s Newt Scamander from the Fantastic Beasts series, and Astin’s Samwise Gamgee in The Lord of the Rings movies. Quan began flying it as Waymond Wang and continues to do so as Marvin Gable. It’s a welcome change from the deluge of muscled superheroes solving plot points today with punches and laser beams.', '“For a long time, we defined masculinity by how tall a man was, how big his muscles were, how much weight he could lift, and how many guys he could beat up. I have always disagreed with that.” Quan shares, “To me, my dad was a real man. He was an extremely successful businessman in Vietnam. My siblings and I were born during the Vietnam War, and he wanted the family to have a better future, so he gave everything up—his business, his entire wealth—to get us all to the United States.”', 'Ke Huy Quan portrays Love Hurts’s Marvin Gable in this way. “At first, you can beat him, but he eventually becomes a genuine badass.” In this case, art mirrors reality. “In real life, a badass is not defined by how many guys he can beat up. A badass works hard, ensures his family is taken care of, treats his wife with a lot of love and everyone, with respect and kindness, and takes nothing for granted. He also offers help without expecting anything in return. To me, that is a real man and a badass.”', 'Now that I’m 38, I love Ke Huy Quan and everything he is and represents. Hollywood can be fickle. Like an eight-year-old boy, it can get bored quickly and move on to the next thing that appeals to it. But I’m happy we have finally reached a point in filmdom’s history when Ke Huy Quan is a leading man, as he deserves to be.', 'So, I’m sorry for hating you when I was eight, Mr. Quan. I’ve learnt my lesson from you, and I promise to keep my head down, work hard, and focus on being a better person.', 'Credits:', 'Hair + Makeup Mira Chai', 'Shot on location at Hollywood Roosevelt Hotel', 'BY \nAUGUSTMAN SINGAPORE\nSEP 05, 2024 | 14 MIN READ', 'BY \nFARHAN SHAH\nAUG 07, 2024 | 10 MIN READ', 'Yes, I agree to the Privacy Policy.', '', '', '']"
Goonies cast members have reunion to honor Ke Huy Quan’s launch as an action hero in Love Hurts,https://www.joblo.com/goonies-cast-members-have-reunion-to-honor-ke-huy-quans-launch-as-an-action-hero-in-love-hurts/,"['HOME » POP CULTURE NEWS » GOONIES CAST MEMBERS HAVE REUNION TO HONOR KE HUY QUAN’S LAUNCH AS AN ACTION HERO IN LOVE HURTS', 'Goonies stars Ke Huy Quan, Josh Brolin, Corey Feldman, Jeff Cohen, and Kerri Green had a reunion in Hollywood this week.', 'Hey you guuuuyysssss! There have been several Goonies reunions over the years, which seemed to amp once Ke Huy Quan was hitting the awards circuit with Everything Everywhere All at Once, which eventually won him the Best Supporting Actor Oscar. But we just got one of the most complete ever, as Josh Brolin, Corey Feldman, Jeff Cohen, Kerri Green, and screenwriter Chris Columbus gathered to celebrate Ke Huy Quan getting his hands and feet imprinted outside of the famed TCL Chinese Theatre in Los Angeles. No word on if he set any booby traps.', 'Ke Huy Quan has had a mid-career resurgence like no other Goonie, and the support he continues to receive – especially through reunions like this – shows a level of loyalty that feels almost unmatched in the world of Hollywood. While Brolin (Brandon Walsh), Feldman (Mouth), Cohen (Chunk), and Green (Andy) all turned out for Quan, the absences of Sean Astin (Mikey) and Martha Plimpton (Stef) were definitely noticed.', 'As part of this Goonies reunion, Brolin gave a speech in his he said, in part, “I won’t say much other than after The Goonies, I too lived in the ethers of our business for 19-plus years. The only difference being that I was still chipping away at leftovers and trading stocks full time while you pursued a whole other profession and excelled in it famously…I could not be happier for you. I know we all are, all us Goonies, here for an honor that is not only totally deserved but celebrates all that is right in this industry. Love you, pal.” Steven Spielberg – who was obviously a vital figure in Quan’s career – sent a letter as well.', 'As a childhood favorite of many of our readers, that The Goonies cast still remains tight enough to join for reunions like this and show their support to one another is pretty incredible. And honestly, that’s so much better and nostalgia-driven than any follow-up could touch. Considering The Goonies turns 40 this year, no doubt we can expect even more.', 'Whose post-Goonies career are you most impressed by? Leave your thoughts – but never say die! – in the comments section below. Watch out for our own interview with Ke Huy Quan on Thursday!', 'Mathew is an East Coast-based writer and film aficionado who has been working with JoBlo.com periodically since 2006. When he’s not writing, you can find him on Letterboxd or at a local brewery. If he had the time, he would host the most exhaustive The Wonder Years rewatch podcast in the universe.', 'The Super Bowl is nearly upon us, and in addition to the battle between the Kansas City Chiefs and the…', 'Goonies stars Ke Huy Quan, Josh Brolin, Corey Feldman, Jeff Cohen, and Kerri Green had a reunion in Hollywood this week.', 'Kelsey Grammer said Ted Danson told him, “You know, I’m kind of mad at you that sometimes you don’t show up ready to go.”', 'Cage would win the Best Actor award for his role in A24’s surreal comedy, Dream Scenario, and he would use his time to speak out against the technology.', 'Beyoncé, Kendrick Lamar and more had banner nights at Sunday’s Grammy Awards, taking home top honors and multiple trophies.', 'In addition to airing on Fox, Super Bowl LIX will also stream on Tubi, giving casual viewers a chance to enjoy the game.', 'It Ends With Us director Justin Baldoni is providing as many receipts as possible in order to win out against Blake Lively and Ryan Reynolds.', 'John Irwin, the voice actor behind He-Man, Master of the Universe, 9Lives spokescat Morris, and more, dies at 88.', 'Nirvana members Dave Grohl, Krist Novoselic and Pat Smear reunited with guest vocalists for a fundraiser to aid in wildfire relief.', 'Josh Brolin never shies away from telling Goonies stories and the actor would recall the audition process for him.', 'Some images sourced from TMDB\n© 1998 - present JoBlo Media Inc., All Rights Reserved | JoBlo® is a trademark of JoBlo Media Inc.\nAll movie titles, pictures, etc... are registered trademarks and/or copyrights of their respective holders']"
‘Goonies’ unite: Ke Huy Quan’s childhood co-stars turn out for his Hollywood handprint fest,https://www.latimes.com/entertainment-arts/movies/story/2025-02-04/ke-huy-quan-goonies-co-stars-chinese-theatre-handprint-love-hurts,"['For some fans of “The Goonies,” star Ke Huy Quan’s hand and footprint ceremony at the TCL Chinese Theatre on Monday was a “Data” remember.', 'The Oscar winner — who starred as gadget whiz Richard “Data” Wang in “The Goonies” — on Monday placed his prints in the renowned cement slabs, joining the ranks of Hollywood names memorialized at the landmark “The Forecourt of the Stars.” For Quan, the ceremony fulfilled a “crazy dream.”\n\nSubscribe to Continue Reading', '', '', '', '', '', '', '', '', '', '', '', '', '', '', '', '', '', '', '', 'Only good movies', ""Get the Indie Focus newsletter, Mark Olsen's weekly guide to the world of cinema."", 'You may occasionally receive promotional content from the Los Angeles Times.', '', 'Alexandra Del Rosario is an entertainment reporter on the Los Angeles Times Fast Break Desk. Before The Times, she was a television reporter at Deadline Hollywood, where she first served as an associate editor. She has written about a wide range of topics including TV ratings, casting and development, video games and AAPI representation. Del Rosario is a UCLA graduate and also worked at the Hollywood Reporter and TheWrap.', 'AWARDS', 'MOVIES', 'MUSIC', 'AWARDS', 'MOVIES', 'MOVIES', 'MOVIES', '', '', '', '']"
