Title,Link,Paragraphs
China's Sept industrial profits post steepest fall of the year,https://www.streetinsider.com/Reuters/Chinas+Sept+industrial+profits+post+steepest+fall+of+the+year/23883500.html,"['FREE Breaking News Alerts from StreetInsider.com!', 'StreetInsider.com Top Tickers, 10/28/2024', 'FILE PHOTO: An employee works at the production line of aluminium rolls at a factory in Zouping, Shandong province, China November 23, 2019. REUTERS/Stringer/File photo', 'By Qiaoyi Li and Kevin Yao', ""BEIJING (Reuters) -China's industrial profits plunged in September, recording the steepest monthly decline of the year, official data showed on Sunday, as policymakers ramp up stimulus to revitalise economic growth."", 'Profits in September fell 27.1% from a year earlier, following a 17.8% fall in August, while earnings slipped 3.5% in the first nine months versus a 0.5% rise in the January-August period, according to the National Bureau of Statistics (NBS).', 'The slump in industrial profits in September was due to factors such as insufficient demand and a sharper decline in producer prices, and a significantly higher base of comparison since August, NBS statistician Wei Ning said.', 'But recently unveiled policy measures will ""foster a favourable environment for the production and operation of industrial enterprises, supporting the recovery and improvement of their profits"", Wei said in a statement.', ""China's economy grew at the slowest pace since early 2023 in the third quarter, with the crisis-hit property sector showing few signs of steadying as Beijing races to revitalise growth."", 'Recent data also pointed to increased deflationary pressures, softer export growth and subdued loan demand, raising red flags over the economic recovery and strengthening the case for fiscal stimulus to galvanise growth.', ""Highlighting the business impact of price cuts and weak demand, profit at China's auto industry tumbled 21.4% year-on-year to 30.5 billion yuan in August, data from the China Passenger Car Association showed."", 'The authorities have sharply ramped up policy stimulus, including interest rate cuts, since late September to ensure growth will reach Beijing target of around 5% this year.', ""China's finance minister has vowed more fiscal stimulus to revive the faltering economy, without giving a dollar figure for the package, following the central bank's announcement late last month of the most aggressive monetary support measures since the pandemic."", 'The size of the expected fiscal package has been the subject of intense speculation in financial markets.', 'Earlier this month, local media outlet Caixin Global reported, citing sources with knowledge of the matter, that China may raise 6 trillion yuan ($842.7 billion)from special treasury bonds over three years to stimulate a sagging economy.', ""China's top legislative body will meet from Nov. 4-8, state news agency Xinhua said last week, but gave no detail of the agenda of highly anticipated debt and other fiscal measures."", ""State-owned firms recorded a 6.5% drop in profits in January-September, foreign firms' earnings rose 1.5%, while private-sector companies posted a 0.6% decline, according to a breakdown of NBS data."", 'Industrial profit numbers cover firms with annual revenues of at least 20 million yuan ($2.8 million) from their main operations.', '($1 = 7.1199 Chinese yuan)', '(Reporting by Qiaoyi Li and Kevin Yao; Editing by William Mallard and Jacqueline Wong)', 'Receive full access to all new and archived articles, unlimited portfolio tracking, e-mail alerts, custom newswires and RSS feeds - and more!', '', '', '', '', '']"
China’s industrial profits plunge as economic momentum falters,https://www.ft.com/content/c42fd341-dccb-462b-816b-dce705a4fad8,"['Complete digital access to quality FT journalism with expert analysis from industry leaders. Pay a year upfront and save 20%.', 'Then $75 per month. Complete digital access to quality FT journalism. Cancel anytime during your trial.', 'Get essential digital access to quality FT journalism on any device. Pay a year upfront and save 20%', 'Complete digital access for organisations. Includes exclusive features and content.', 'Terms & Conditions apply', 'See why over a million readers pay to read the Financial Times.']"
No title found,https://www.globaltimes.cn/page/202410/1321751.shtml,"['Photo: Screenshot of china.com.cn', ""China's new-energy vehicle (NEV) sector is still on a robust upward trajectory, with industry insiders projecting production and ..."", 'The total sales of China’s new-energy vehicles (NEV) is expected to reach 11.5 million this year, up 20 ...', 'Retail sales of new-energy vehicles (NEVs) in China hit 556,000 units in October, up 75.2 percent year-on-year, continuing ...']"
China’s industrial profits see steepest decline since COVID-19 pandemic,https://www.turkiyetoday.com/world/chinas-industrial-profits-see-steepest-decline-since-covid-19-pandemic-71446/,"['Industrial profits in China dropped by 27.1% year-on-year in September, marking the sharpest decline of 2024, according to data from the National Bureau of Statistics of China (NBS).', 'This drop follows a 17.8% decrease in August, as the world’s second-largest economy continues to face sluggish growth, weak demand and challenges in its real estate sector.', 'The significant drop in profits, the largest since March 2020, underscores the difficulties faced by Chinese industrial companies.', 'The NBS reported that industrial firms with annual revenues exceeding 20 million yuan (approximately $2.81 million) saw total profits reach 5.228 trillion yuan ($742.6 billion) between January and September. However, September’s figures highlighted the ongoing strain on the sector.', 'In September, profits for state-owned enterprises fell by 6.5%, while private-sector firms recorded a 9.6% decline.', 'Overall, industrial profits for the first nine months of the year were down 3.5% compared to the same period in 2023, reversing the 0.5% growth seen earlier in the year.', 'While Chinese authorities have introduced several stimulus measures in recent weeks aimed at boosting economic growth, the impact has yet to be reflected in the real economy.', 'The NBS highlighted that deflationary pressures and weak domestic demand are key factors hindering profitability, particularly in sectors like upstream materials and automobiles']"
News,https://www.trendforce.com/news/2024/10/28/news-chinas-industrial-profits-decline-further-amid-expanding-deflation/,"['', 'Insights', 'China industrial profit continued to decline in September due to expanding deflationary pressure, according to data released by China’s National Bureau of Statistics on October 27.', 'Profits for large-scale industrial enterprises fell by 27.1% year-on-year in September, down 9.3 percentage points from the previous month’s decline of 17.8%. Cumulatively, profits for the first nine months of the year dropped by 3.5%, compared to a 3.0% decrease in the first eight months.', 'High-tech manufacturing remained the key driver of industrial profits, with cumulative growth of 6.3%, contributing 1.1 percentage points to overall growth. However, this was a decline from the 10.6% cumulative growth reported for January to August.', 'Yu Weining, a statistician from the National Bureau of Statistics, attributed the decline to weak domestic demand and falling industrial product prices. Recent figures show that China’s core CPI rose by just 0.1% year-on-year in September, down 0.2 percentage points from the previous month, while the PPI fell by 2.8%, marking 24 consecutive months of decline, reflecting persistent weakness in domestic demand.', 'With trade barriers expected to increase in the future, China’s manufacturing sector may struggle to absorb its excess capacity through exports and domestic demand, further compressing corporate profits and intensifying deflationary pressures. This could make it even more difficult for China to achieve its 5% annual economic growth target.', 'From November 4 to November 8, the Chinese government will convene the Standing Committee of the National People’s Congress in Beijing, where the market will be watching for any new stimulus measures.']"
Bloomberg,https://www.bloomberg.com/news/articles/2024-10-28/china-s-steel-mills-and-oil-refiners-bear-brunt-of-tepid-economy,"[""To continue, please click the box below to let us know you're not a robot."", 'Please make sure your browser supports JavaScript and cookies and that you are not blocking them from loading. For more information you can review our Terms of Service and Cookie Policy.', 'For inquiries related to this message please contact our support team and provide the reference ID below.']"
,https://www.bastillepost.com/global/article/4266378-chinas-private-industrial-production-grows-steadily-in-first-three-quarters,"['', '', '', '', '', ""The industrial production of China's private sector registered steady growth in the first three quarters of 2024, with the investment in fixed assets continuing to expand in scale and the structure further optimized, according to the National Development and Reform Commission (NDRC)."", 'In the January to September period, the growth rate of industrial added value and profit related to the private economy increased compared with the same period of last year. The output of new energy vehicles, integrated circuits, 3D printing equipment and other products, of which the private economy accounts for a relatively high proportion, increased by more than 20 percent.', 'The private investment in the real economy witnessed a good momentum of growth.', 'In the same period, private investment in the secondary industry grew by 13.2 percent, of which that in the manufacturing sector grew by 11.6 percent, 2.4 percentage points higher than that in the overall manufacturing sector.', 'The effect of the policy on expanding effective investment has gradually been emerging.', 'In the period, a total of 37.9 trillion yuan (about 5.3 trillion U.S. dollars) was invested in fixed assets nationwide, a year-on-year increase of 3.4 percent, remaining the same as that of the January-August period.', ""China's private industrial production grows steadily in first three quarters"", 'Israeli strikes against Iran may lead to further tension escalation in the region, especially amid ongoing conflicts in the Gaza Strip and Lebanon, and turn the Middle East into an ""uncontrollable fireball,"" warned experts in Egypt on Sunday.', 'Strong explosions were heard in the Iranian capital Tehran in the early hours of Saturday, as Israel confirmed that it had launched precise strikes on military targets in Iran in response to months of continuous attacks from the country.', '""Egypt\'s concern about this situation stems from its rich experience in the region. Egypt believes that the ongoing conflict between Israel and Iran could potentially draw in international powers from other regions, turning the area into an uncontrollable fireball,"" said Hani Al-Jamal, a researcher in political and regional affairs.', ""Abdel Fattah, an Egyptian expert in international relations, echoed these concerns, emphasizing the region's fragility amid persisting conflicts in Gaza and Lebanon."", '""The main reasons for concern about this attack are as follows. Firstly, Israel has for the first time declared a strike against Iran\'s hinterland, marking a shift in the conflict between Israel and Iran from proxy and covert wars to direct conflict. Secondly, this attack occurred amid tensions in southern Lebanon and the Gaza Strip, as well as the ongoing Russia-Ukraine war. The region can no longer bear any further escalation of conflict,"" said Fattah.', 'The Egyptian Foreign Affairs Ministry called for an immediate ceasefire in Lebanon and the Gaza Strip, and also a prisoner swap agreement, saying that is the only way to ease the tension.', '""Egypt has always believed that peace and stability in the Middle East require addressing the root causes of issues rather than just treating the symptoms. The root of the issue lies in Israel\'s current occupation and attacks on the Gaza Strip, the West Bank, and southern Lebanon. Therefore, to ease conflicts and reduce tensions, all Israeli attacks should be halted, and agreements should be reached for exchange of prisoners. This would pave the way for rebuilding and restoring humanitarian aid and resuming negotiations to achieve the goal of establishing the State of Palestine based on the June 4,1967 borders, with East Jerusalem as its capital,"" said Fattah.', 'The strikes came after several public threats from Israel. The previous threats include attacks on Iran’s military facilities in response to Iran’s Oct. 1 missile attacks.', ""Iran launched some 200 ballistic missiles targeting Tel Aviv’s key locations. Iran said the attack in early October was in retaliation for Israel's assassinations of Hamas leader Ismail Haniyeh in Tehran, Hezbollah leader Hassan Nasrallah, and IRGC General Abbas Nilforoushan."", 'Israeli strikes against Iran likely evolve into ""uncontrollable fireball"", Egyptian experts', 'Harry Kane scores his 15th goal of the season as Bayern Munich cruises to 5-0 win at Bochum', 'Hong Kong FinTech Week 2024: A Hub for Innovation and Investment in Fintech', ""China's Shenzhou-18 crew prepares to return to Earth"", ""Stephen Curry sprains left ankle in Warriors' loss"", 'Man United misses open goal and concedes late penalty in loss at West Ham. Palmer shines for Chelsea', 'Peter Yan Appointed Director-General of Office for Attracting Strategic Enterprises in Hong Kong', 'Clippers hold off Warriors as Stephen Curry goes down injured', '136th Canton Fair 2nd phase concludes in Guangzhou', ""Int'l scientists gather in Shanghai to discuss AI strategies for better future"", 'Grand Opening of October 2024 Global Sources Sports &amp; Outdoor Show Emerging Sports Rise: Pickleball and AR Fitness Take Center Stage', ""China's central bank starts using outright reverse repos"", 'Stefon Diggs leaves Texans game against Colts with non-contact knee injury in third quarter', 'Hong Kong Government Issues Policy for Responsible AI Use in Financial Markets', 'AI experts call for global consensus on ethics, regulation at WLA Forum', 'Beijing releases guide on use of AI in education', '', '', '', '', '', '', '', '', '', '', '', '', '', '', '', '', '', '', '', '', '', '', '', '', '', '', '', '', '', '', '', '© 2024 Bastillepost. All rights reserved.']"
"China industrial profits plunge in September, extending slump",https://www.marketscreener.com/news/latest/China-industrial-profits-plunge-in-September-extending-slump-48173977/,"['', '', '', '', '', '', '', '', '', '', '', '', '', '', '', '', '', '', '', '', '', '', '', '', '', '', '', '', '', '', '', '', '', '', '', ""BEIJING (Reuters) - China's industrial profits plunged in September, extending their declines with the year's steepest monthly fall, official data showed on Sunday, as policymakers ramp up stimulus to revitalise economic growth."", 'Profits fell 27.1% in September from a year earlier, following a 17.8% fall in August, while earnings fell 3.5% in the first nine months versus a 0.5% rise in the January-August period, according to the National Bureau of Statistics (NBS).', ""China's economy grew at the slowest pace since early 2023 in the third quarter, with the crisis-hit property sector showing few signs of steadying as Beijing races to revitalise growth."", 'Recent data also pointed to increased deflationary pressures, softer export growth and subdued loan demand, raising red flags over the economic recovery and strengthening the case for fiscal stimulus to galvanise growth.', ""Highlighting the business impact of price cuts and weak demand, profit at China's auto industry tumbled 21.4% year-on-year to 30.5 billion yuan in August, data from the China Passenger Car Association showed."", ""China's finance minister has vowed more fiscal stimulus to revive the faltering economy, without giving a dollar figure for the package, following the central bank's announcement late last month of the most aggressive monetary support measures since the pandemic."", 'State-owned firms recorded a 6.5% drop in profits in January-September, foreign firms saw earnings up 1.5%, while private-sector companies netted a 0.6% decline, per a breakdown of NBS data.', 'Industrial profit numbers cover firms with annual revenues of at least 20 million yuan ($2.8 million) from their main operations.', '($1 = 7.0746 Chinese yuan renminbi)', '', '(Reporting by Qiaoyi Li and Kevin Yao; Editing by William Mallard)', '', 'Weekly market update: Battle of Numbers Before the Battle of the Ballot Box', 'Sterling on track for biggest monthly fall since September 2023 vs dollar', 'Orange: Taking a step back', ""European Midday Briefing : Israel's Limited Response in Iran Boosts Stocks, Hits Oil"", 'CAC40: in the green ahead of a busy week', 'Universal Health Services: Some challenges to overcome', 'Futures march higher as markets await megacap earnings, US election', 'Oil and yen drop on MidEast restraint, Japan indecision', 'CBRE Group, Inc: Resilience in action', 'Milan stock exchange, positive start, banks good, Eni down', 'Indian airline IndiGo falls 8% after warning on passenger revenue drop', '', 'Oil slides on Mideast respite, yen down as Japan govt loses majority', 'Asset managers roll out new ETFs to tap in to AI buzz', 'Philips lowers sales outlook as China demand wanes', 'Take Five: Ready for an action-packed week?', ""European airlines' Q3 struggle with plane delays, high costs"", 'Biden Gives First Remarks on Israeli Airstrikes', 'Mib expected to rise; few data expected', 'Gold slips as dollar firms; market eyes crucial US data', 'Some companies change tack in China with no recovery in sight', 'Pre-market (Indicative prices)', 'Best financial\nportal', '+951% of historical\nperformance', 'More than 20 years\nat your side', '+ 1,000,000\nmembers', 'Quick & easy\ncancellation', 'Our Experts\nare here for you', 'OUR EXPERTS ARE HERE FOR YOU', 'Monday - Friday 9am-12pm / 2pm-6pm GMT + 1']"
China industrial profits decline,https://www.taipeitimes.com/News/biz/archives/2024/10/28/2003825957,"['Profits at China’s industrial firms last month declined at a faster pace than a month earlier, as deflationary pressures sap the strength of corporate finances.', 'Last month’s industrial profits at large Chinese companies fell 27.1 percent from a year earlier, after a 17.8 percent plunge in August, the National Bureau of Statistics said in a statement yesterday. Profits decreased 3.5 percent in the first nine months from the same period last year.', 'The data was “affected by factors such as high base in the same period last year” the bureau said in a statement.', 'Photo: AFP', 'Industrial profits provide a key measure of the financial health of factories, mines and utilities that can affect their investment decisions in the months to come.', 'Weaker profits became emblematic of the challenges facing China’s US$18 trillion economy, prompting measures such as interest rate cuts since late last month.', 'The country’s top legislative body is to hold a highly anticipated session in Beijing on Nov. 4 to 8, as investors watch for any approval of further fiscal stimulus to revive growth.', 'Economists expect the meeting to confirm a plan to refinance local governments’ debt and issuance of sovereign bonds to inject capital into banks.', 'Investors have been on the lookout for fresh stimulus in the form of greater public borrowing and spending, but opinions differ over whether it would materialize this year.', 'Deepening deflation in producer prices was likely a drag on company earnings despite faster growth in industrial output, Bloomberg Economics said before the release. Factory-gate prices extended declines for a 24th straight month last month, with the recent drop accelerating, reflecting weak domestic demand.', 'The economy expanded 4.6 percent in the July-to-September period from a year earlier, the slowest pace since March last year.', 'The growth of the high-technology sector has offered signs of hope for the economy, with profit for the industry’s manufacturers climbing 6.3 percent in the first nine months, according to the statistics bureau.', 'REGIONAL COMPETITION: Over the past few years the Philippines has lost ground to neighbors such as Vietnam, Indonesia and Malaysia, a Philippine official said The Philippines is trying to enlist Taiwanese chip giants to expand in semiconductors, a bid to catch up with its neighbors who are emerging as significant suppliers in the industry. Taiwan Semiconductor Manufacturing Co (TSMC, 台積電) and United Microelectronics Corp (UMC, 聯電) are among companies the Philippines is reaching out to as it seeks equipment and expertise to build out chip fabrication operations, said Dan Lachica, head of the Southeast Asian country’s main electronics industry group, the Semiconductor and Electronics Industries in the Philippines Foundation Inc (SEIPI). The association is working with Philippine officials in Taiwan to talk with potential', 'Taiwan Semiconductor Manufacturing Co (TSMC, 台積電) halted shipments to a customer this month after its semiconductors were sent to China’s Huawei Technologies Co (華為), potentially breaching US sanctions, a government official said. The US slapped sanctions on Huawei in 2019, and expanded them the following year, over fears its technology could be used for Beijing’s espionage operations. The restrictions prevent TSMC from selling semiconductors to Huawei. However, TSMC discovered on Oct. 11 that chips made for a “specific customer” had ended up with the Chinese company, a Taiwanese official with knowledge of the incident said on the condition of anonymity. TSMC “immediately activated', 'Nvidia Corp is set to unveil investment plans for Thailand, joining Alphabet Inc and Microsoft Corp, as Southeast Asia becomes a hot spot for building artificial intelligence (AI) data centers and manufacturing the components that power them. The US chip designing firm would announce investments during chief executive officer Jensen Huang’s (黃仁勳) trip to Bangkok in December, Thai Minister of Commerce Pichai Naripthaphan said on Monday. He declined to give details on the investment or how much the company would bring into Thailand. The investment by Nvidia could lead to more funding “with related clusters following suit,” Pichai said. Clinching', 'Powerchip Semiconductor Manufacturing Corp (力積電) yesterday said it had terminated a deal with SBI Holdings Inc to help build a chip manufacturing plant in Japan, as Powerchip found it unpractical to take the full responsibility of operating a plant it does not own for more than 10 years. Powerchip, Taiwan’s third-largest contract chipmaker, inked a non-binding memorandum of understanding (MOU) with SBI in July last year to explore the possibility of building a 12-inch chip fab in Japan. According to the MOU, Powerchip’s role was that of a technology provider, as the company hopes to generate a new revenue stream,']"
