Title,Link,Paragraphs
No title found,https://www.yicaiglobal.com/news/chinas-industrial-profits-fall-at-fastest-pace-this-year-in-september,"['', ""(Yicai) Oct. 28 -- Profits at China's industrial enterprises plunged last month by the most this year, mainly because of persistently low factory gate prices, surging costs, and a high comparative base a year earlier."", 'Profits earned by industrial firms with an annual turnover of at least CNY20 million (USD2.8 million) sank 27.1 percent to CNY575.4 billion (USD85.9 billion) in September, according to data released by the National Bureau of Statistics yesterday. That followed a 17.8 percent drop in August.', 'Lower-than-expected demand growth, particularly in export markets, has been weighing on factory prices this year, while rising production costs have eroded profit margins. But the government is taking steps to stabilize and revive industrial profits, particularly by promoting high-tech manufacturing, consumer goods, and infrastructure investment.', 'China should expedite the implementation of existing policies and the recent stimulus package to foster a suitable environment for the healthy development of industrial enterprises and support profit recovery, said Yu Weining, an NBS statistician.', 'In the nine months ended Sept. 30, industrial profits fell 3.5 percent to CNY5.23 trillion (USD735.4 billion), while business revenue rose 2.1 percent, NBS data also showed.', 'Profits at high-tech and consumer goods manufacturers climbed 6.3 percent and 2.4 percent, respectively, underlining the resilience of industrial economic development, Yu noted, while the textile and furniture sectors reported gains of more than 10 percent.', 'China will introduce initiatives to boost consumption and expand domestic demand this quarter, including some focused on technology upgrades, equipment renewal, the low-altitude economy, and smart manufacturing, Wang Jiangping, vice minister for industry and information technology, said recently.', 'The country will also speed up the issuance of special government bonds and CNY150 billion in relending for tech upgrades, as well as kick off preparations for pilot programs in manufacturing transformation, Wang noted. There are 36,000 industrial projects under construction or about to commence in China, with projected investment in excess of CNY11 trillion (USD1.4 trillion) over the next three years.', 'CNY300 billion of ultra-long special government bonds have been issued to expand the scope of trade-in policies and stimulate investment and consumption, said Wen Bin, chief economist at Minsheng Bank.', 'The funds have been fully allocated, and special bond investments have accelerated, which will positively impact industrial confidence and strengthen the recovery of the industrial economy, ultimately promoting profit restoration, Wen added.', 'Editor: Futura Costaglione']"
China's industrial profits down 3.5% in first 3 quarters,https://www.shine.cn/biz/economy/2410271091/,"['The combined profit of major industrial enterprises in China reached 5.23 trillion yuan (US$735.41 billion) in the January-September period, down 3.5 percent year on year, the National Bureau of Statistics said on Sunday.', 'Meanwhile, the new momentum industries represented by high-tech manufacturing experienced rapid growth. NBS statistician Yu Weining said this showcases the resilience of industrial economic development.', ""Multiple factors have contributed to the decline in industrial enterprises' profit growth rates, including a significant increase in the year-on-year comparison base since August, insufficient effective demand, and declining industrial product prices, said Yu."", 'In September alone, profits dropped by 27.1 percent year on year.', 'According to the NBS, the total profits of major industrial enterprises increased by 575.43 billion yuan from January to September compared to the period from January to August.', 'During the first nine months, driven by rapid production growth, the profits of high-tech manufacturing industries increased by 6.3 percent year on year.', 'Yu said this growth rate is 9.8 percentage points higher than the average level of major industrial enterprises, contributing 1.1 percentage points to the overall profit growth. This performance has significantly supported industrial profits.', ""With solid efforts to expand domestic demand, promote consumption, and stabilize international market demand, the consumer goods manufacturing industry's profits increased by 2.4 percent year on year in the January-September period, contributing 0.5 percentage points to the overall industrial profit growth."", 'The resilience of new industrial growth drivers is evident, although the industrial profit growth rate has declined, said Yu, adding that with the stabilization in the expectation of industrial enterprises and an increase in confidence, industrial profit growth is expected to recover.', '', '', '', 'In Focus', 'Metro', 'Nation', 'World', 'Sport', 'Economy', 'Tech', 'Auto', 'Company', 'Property', 'Finance', 'Event', 'Art & Culture', 'Travel', 'Lifestyle', 'Taste', 'Entertainment', 'Wellness', 'MENTAL', 'Book', 'Education', 'iDEALShanghai', '沪公网安备 31010602001940号', '', '', '', '', '', '', '']"
China's industrial profits collapse in September: -27.1% y/y (vs -17.8% y/y prior),https://www.forexlive.com/news/chinas-industrial-profits-collapse-in-september-271-yy-vs-178-yy-prior-20241027/,"['', '', '', '', '', '', ""China's National Bureau of Statistics (NBS) slip[ped these out over the weekend:"", 'prior -17.8% in August', 'earnings -3.5% in the January - September period', 'according to the National Bureau of Statistics (NBS).', 'That plunge for industrial profits in September is the biggest monthly decline all year.', 'NBS says the collapse in industrial profits in September was due to:', 'NBS finished on an upbeat note (which is almost obligatory in communist politburo-ruled China):', 'The recent policy announcement will dull the impact of these figures somewhat.', 'Tags', 'Most Popular', '', '', 'Stock Daily Updates', 'Top Forex Brokers', 'Must Read', 'Follow Us', 'Read our Terms, Cookies and Privacy Notice', 'HIGH RISK WARNING: Foreign exchange trading carries a high level of risk that may not be suitable for all investors. Leverage creates additional risk and loss exposure. Before you decide to trade foreign exchange, carefully consider your investment objectives, experience level, and risk tolerance. You could lose some or all your initial investment; do not invest money that you cannot afford to lose. Educate yourself on the risks associated with foreign exchange trading and seek advice from an independent financial or tax advisor if you have any questions.', 'ADVISORY WARNING: FOREXLIVE™ is not an investment advisor, FOREXLIVE™ provides references and links to selected news, blogs and other sources of economic and market information for informational purposes and as an educational service to its clients and prospects and does not endorse the opinions or recommendations of the blogs or other sources of information. Clients and prospects are advised to carefully consider the opinions and analysis offered in the blogs or other information sources in the context of the client or prospect\'s individual analysis and decision making. None of the blogs or other sources of information is to be considered as constituting a track record. Past performance is no guarantee of future results and FOREXLIVE™ specifically hereby acknowledges clients and prospects to carefully review all claims and representations made by advisors, bloggers, money managers and system vendors before investing any funds or opening an account with any Forex dealer. Any news, opinions, research, data, or other information contained within this website is provided on an ""as-is"" basis as a general market commentary and does not constitute investment or trading advice, and we do not purport to present the entire relevant or available public information with respect to a specific market or security. FOREXLIVE™ expressly disclaims any liability for any lost principal or profits which may arise directly or indirectly from the use of or reliance on such information, or with respect to any of the content presented within its website, nor its editorial choices.', 'DISCLAIMER: FOREXLIVE™ may be compensated by the advertisers that appear on the website, based on your interaction with the advertisements or advertisers.', 'Finance Magnates CY Limited', '', '', '', '', '', '']"
No title found,https://www.chinadailyasia.com/article/596244,"['', '', 'BEIJING- The combined profit of major industrial enterprises in China reached 5.23 trillion yuan ($735.41 billion) in the January-September period, down 3.5 percent year-on-year, the National Bureau of Statistics (NBS) said on Sunday.', 'Meanwhile, the new momentum industries represented by high-tech manufacturing experienced rapid growth. NBS statistician Yu Weining said this showcases the resilience of industrial economic development.', ""Multiple factors have contributed to the decline in industrial enterprises' profit growth rates, including a significant increase in the year-on-year comparison base since August, insufficient effective demand, and declining industrial product prices, said Yu."", 'In September alone, profits dropped by 27.1 percent year-on-year.', ""ALSO READ: China's manufacturing sector picks up amid sustained economic recovery"", 'According to the NBS, the total profits of major industrial enterprises increased by 575.43 billion yuan from January to September compared to the period from January to August.', 'During the first nine months, driven by rapid production growth, the profits of high-tech manufacturing industries increased by 6.3 percent year-on-year.', 'Yu said this growth rate is 9.8 percentage points higher than the average level of major industrial enterprises, contributing 1.1 percentage points to the overall profit growth. This performance has significantly supported industrial profits.', ""With solid efforts to expand domestic demand, promote consumption, and stabilize international market demand, the consumer goods manufacturing industry's profits increased by 2.4 percent year-on-year in the January-September period, contributing 0.5 percentage points to the overall industrial profit growth."", ""READ MORE: China's industrial profits up 0.5% in first eight months"", 'The resilience of new industrial growth drivers is evident, although the industrial profit growth rate has declined, said Yu, adding that with the stabilization in the expectation of industrial enterprises and an increase in confidence, industrial profit growth is expected to recover.', ' ', ' ', '']"
China's industrial profits plunge at fastest pace since the pandemic,https://www.cnbc.com/2024/10/28/chinas-industrial-profits-plunge-at-fastest-pace-since-since-the-pandemic.html,"['', '', '', '', '', '', '', '', '', '', '', '', '', '', '', '', '', '', '', '', '', '', '', '', '', '', '', '', '', '', '', '', '', '', '', '', '', '', '', '', '', '', '', '', '', '', '', '', '', '', '', '', '', '', '', '', '', '', '', '', '', '', '', '', '', '', '', '', '', '', '', '', '', '', '', '', '', '', '', '', '', '', '', '', '', '', '', '', '', '', '', '', '', '', '', '', '', '', '', '', '', '', '', '', '', '', '', '', '', '', '', '', '', '', '', '', 'China’s industrial profits in September dropped at its fastest pace since the pandemic, data from the National Bureau of Statistics showed, as the country tussles with an economy plagued by slow growth, lack of demand and a property crisis.', 'After a 17.8% fall in August, industrial profits declined 27.1% in September from a year ago, marking the steepest plunge since March 2020, when it dropped by 34.9%, according to data kept by Wind Information.', 'The database excluded figures for most of 2022, the year when Shanghai and other parts of China were under stringent Covid-19 measures that limited business activity.', 'Chinese authorities have ramped up measures in recent weeks to bolster growth. The nation’s parliament scheduled a meeting for early next month, after which the National People’s Congress is expected to announce details on highly anticipated fiscal stimulus.', 'This data release “underscores the need for more forceful policy responses amid weak domestic demand and deflationary pressures,” Goldman Sachs chief China economist Hui Shan said in a note Sunday.', 'In the first nine months, industrial profits fell by 3.5% from a year ago. NBS statistician Yu Weining said “insufficient demand and a sharp decline in producer prices” weighed down the profitability of industrial firms.', 'Data released earlier this month showed that the producer price index fell 2.8% year-on-year in September, steeper than a 1.8% decline the previous month.', 'Gary Ng, senior economist at Natixis, said in an email to CNBC that “the weakness of industrial profits indicates China’s greater need for demand-side policies.”', '“While there is divergence across sectors, the stress is particularly high in upstream materials and automobiles,” he said.', 'China’s economy grew by 4.6% in the third quarter, the slowest pace since early 2023. In the first three quarters of the year, the economy expanded by an annual 4.8%, slightly slower than the 5% pace seen in the first half of the year. Beijing has a target of around 5% economic growth for 2024.', 'The country is set to release its official manufacturing purchasing managers’ index for October on Thursday.', 'Economists polled by Reuters expect the figure to come in at 50.1, after five months of contraction. The PMI was 49.8 in September, 49.1 in August, 49.4 in July and 49.5 in June. A reading above 50 indicates expansion in activity, while one below that level suggests a contraction.', 'Got a confidential news tip? We want to hear from you.', 'Sign up for free newsletters and get more CNBC delivered to your inbox', 'Get this delivered to your inbox, and more info about our products and services.', '© 2024 CNBC LLC. All Rights Reserved. \nA Division of NBCUniversal', 'Data is a real-time snapshot *Data is delayed at least 15 minutes. Global Business and Financial News, Stock Quotes, and Market Data and Analysis.', 'Data also provided by']"
"Hong Kong stocks rise slightly as investors weigh China stimulus hopes, industrial profits",https://www.scmp.com/business/china-business/article/3284097/hong-kong-stocks-waver-investors-weigh-stimulus-outlook-weak-industrial-profits,"['Goldman Sachs analyst: ‘We expect more fiscal easing and believe it holds the key for the effectiveness of the ongoing stimulus package’', 'Hong Kong stocks edged up slightly as investors assessed the prospect of China’s fiscal stimulus after an official report showed deepening profit declines among industrial companies.', 'Mainland China’s stock benchmarks also finished higher. The CSI 300 Index advanced 0.2 per cent, and the Shanghai Composite Index climbed 0.7 per cent.', '“Following the larger-than-expected monetary easing, we expect more fiscal easing and believe it holds the key for the effectiveness of the ongoing stimulus package,” said Lisheng Wang, an analyst at Goldman Sachs in Hong Kong.', 'Legislators may approve a quota of as much as 2 trillion yuan (US$280.5 billion) of ultra-long special government bond issuance, scale up the local-government debt resolution plan by 6 trillion yuan and set a notably higher bond-issuance limit for next year, according the US investment bank.', 'In a baseline scenario, China may raise the official fiscal deficit ratio to 3.6 per cent in 2025 from 3 per cent this year, and fiscal expansion could be more aggressive should the likelihood of higher tariffs on Chinese goods increase after the US election result, it said.', '']"
,https://www.bastillepost.com/global/article/4266291-key-industries-regions-make-outstanding-contributions-to-chinas-industrial-growth-in-first-three-quarters-official,"['', '', '', '', '', ""China's industrial economy had maintained smooth operation in the first three quarters of this year, with key industries and regions making particularly outstanding contributions, said an official of the Ministry of Industry and Information Technology (MIIT) on Wednesday."", ""Speaking at a press conference in Beijing, Zhao Zhiguo, chief engineer of the MIIT, said that China's industrial economy showed three major characteristics in the January to September period."", '""Industrial production had grown steadily, and we had been actively promoting the implementation of policies. In the first three quarters, the added value of industries above the designated size increased by 5.8 percent year on year, with the total industrial added value accounting for 31.8 percent of the GDP,"" Zhao said.', '""Key industries and regions had made outstanding contributions. We had thoroughly implemented the work plan for stabilizing growth in ten key industries, and given full play to the key supporting role of major industrial provinces and cities. The four industries of electronics, nonferrous metals, chemicals, and automobiles contributed nearly half of the growth in industrial production, and the growth rate in nine major industrial provinces exceeded the national average,"" he said.', '""The momentum of development continued to accumulate. We actively promoted equipment renewal and technological transformation in the industrial field, and pushed forward the transformation of sci-tech achievements into productivity. Investment in equipment and tools increased by 16.4 percent year on year. The output of products with high technological content and high added value, such as artificial intelligence chips and servers, had grown rapidly,"" Zhao said.', ""Key industries, regions make outstanding contributions to China's industrial growth in first three quarters: official"", 'The Montreux Jazz Festival China opened on the shore of Jinji Lake in Suzhou on Friday, providing an audio-visual feast to jazz fans that flocked there and bridging the cultural exchange between the East and the West.', 'This is the third time for the event to be held in China, with this edition themed ""When West Meets East"".', 'Upward of 100 Chinese and foreign musicians staged more than 20 performances during the three-day event, covering various music styles such as jazz, rock, electronic music, and pop, creating a cultural feast for the audience.', '""It\'s great to discover a small part of China, because in three days -- I won\'t see a lot, but I really like to see how Chinese people are enjoying music. Yesterday evening during the concert of \'Earth, Wind and Fire\', everyone was dancing. It was really lively , and really nice to enjoy this music together. Through music, we can understand each other. Sometimes it\'s very difficult to understand each other through the languages, and also sometimes with cultural gap. But through music we gather everyone around the emotions and the pleasure to share this kind of moment. This is why we promote the cultural exchange, in Montreux in Switzerland and also here, of course, in Suzhou. So we are very happy, and we hope to, maybe, welcome emerging musicians from China in Montreux,"" said Viviane Rychner Raouf, secretary general of Montreux Jazz Artists Foundation.', 'The concert ""Earth, Wind and Fire Experience"" mentioned by Raouf was given by Al McKay, one of the world\'s best Rhythm and Blues groups, and it provided a swing party to spectators.', 'Swiss music promoter Claude Nobs, who died in 2013, founded the Montreux Jazz Festival in 1967 and built it into an international festival and event platform for music lovers.', 'Since its creation, the festival under its slogan ""Where Legends Are Born"" has seen many iconic live music performances.', 'World-renowned music festival held in Suzhou', '', '© 2024 Bastillepost. All rights reserved.']"
No title found,https://www.msn.com/en-xl/money/other/hopes-for-stimulus-roll-out-on-china-s-horizon-after-industrial-profits-dive-in-september/ar-AA1t0YFz,"['Use precise geolocation data and actively scan device characteristics for identification. This is done to store and access information on a device and to provide personalised ads and content, ad and content measurement, audience insights and product development.\nList of Partners (vendors)', '', '', '', '', '', '', '', '', '', '', '', '', '', '', '', '', '', '', '', '', '', '', '']"
Hopes for stimulus roll-out on China’s horizon after industrial profits dive in September,https://www.scmp.com/economy/china-economy/article/3284065/hopes-stimulus-roll-out-chinas-horizon-after-industrial-profits-dive-september,"['All eyes are on November’s NPC Standing Committee meeting for more details of support for the economy', 'According to data released by the National Bureau of Statistics (NBS) on Sunday, profits for major industrial firms – those with annual revenues at least 20 million yuan (US$2.8 million) – fell by 27.1 per cent in September from a year earlier.', 'It was the biggest percentage point drop since March 2020 when the country was hit hardest by the pandemic.', '']"
No title found,https://www.globaltimes.cn/page/202410/1321929.shtml,"[""Workers complete assembling an electric vehicle (EV) at China's EV start-up Leapmotor in Jinhua, East China's Zhejiang Province on April 1, 2024. The smart EV factory delivered 14,567 new vehicles in March, a yearly increase of 136 percent. Photo: VCG"", 'Whenever you spot a big crowd of global buyers gathering at a booth in the Canton Fair complex, ...']"
