Title,Link,Paragraphs,Topic,Image
"Winter fuel payment U-turn in place this year, says chancellor",https://www.bbc.co.uk/news/articles/czr8e5g5vp8o,"['Changes to the winter fuel payment to allow more people to receive it will be in place this year, the chancellor has said.', 'Rachel Reeves said more people would qualify for the allowance ""this winter"", however details of the changes and who will be eligible remain unclear.', ""Prime Minister Sir Keir Starmer has said he wanted to widen the threshold for winter fuel in a U-turn on one of his government's first major policies, but failed to confirm on Wednesday how many would now get it."", ""The payment, worth up to £300 to help with energy bills during the coldest months, was paid only to those on pension credit last year, but the policy was widely blamed for Labour's poor local election results."", 'It meant 10 million fewer pensioners received the money in 2024. There was particular concern among charities and some MPs about those whose income was slightly too high to qualify, but were hit by the loss of the payment as energy costs remained expensive.', ""Sir Keir did not confirm during Prime Minister's Questions who would be eligible for the revised policy, having previously admitted in a recent BBC interview that clarity was needed as soon as possible."", '""We will look, again, as I said two weeks ago, at the eligibility for winter fuel, and of course, we\'ll set out how we pay for it,"" when quizzed by Conservative Party leader Kemi Badenoch on how many of the 10 million pensioners who lost the allowance would get it back.', 'The questions came after Reeves said earlier that people ""should be in no doubt that the means test will increase and more people will get winter fuel payment this winter"".', 'Badenoch said the Chancellor was ""rushing her plans because she just realised when winter is"".', 'If the government waits until the Budget to announce the changes, it would be just before payments are typically made.', 'Eligible pensioners receive payments automatically in November or December. Under the short-lived current system, people are required to claim pension credit - which is a top-up to the state pension for those on low incomes.', 'Households with a person under 80 receive £200 a year, while homes with a person over 80 receive £300.', 'PM accepts need for clarity on winter fuel payments', 'How much is the winter fuel payment and who can still get it?', 'Spending Review: When is it and what might Rachel Reeves announce?', 'In response to growing questions over the changes, Downing Street said it would provide ""clarity"" on how it would expand payments ""as soon as we can"".', 'Caroline Abrahams, charity director at Age UK, said: ""We are encouraged by the chancellor\'s words, but will wait to see the detail, which needs to be published very soon if changes are to be made in time for this winter, something that is absolutely crucial if we\'re to protect the pensioners at greatest risk.""', 'Earlier on Wednesday, pensions minister Torsten Bell said there would be no return to the previous system in which the payment was made to all 11.4 million pensioners.', '""It\'s not a good idea that we have a system paying a few hundreds of pounds to millionaires, and so we\'re not going to be continuing with that,"" he said.', 'The government has not provided details of who would qualify as a millionaire.', 'Sir Keir told Parliament that the reason the government could expand the number of people receiving the payment was because Labour had ""stabilised the economy"".', 'Reeves said the economy was now in a ""better shape,"" and that the government ""had listened to the concerns people had about the level of the means test"" in a speech in Greater Manchester announcing billions of pounds of investment in transport infrastructure in England.', 'But Daisy Cooper, treasury spokesperson for the Liberal Democrats, said pensioners deserved an apology from the government.', '""This whole debacle has caused needless misery for millions of pensioners,"" she said.', ""The decision to means-test the previously universal payment was one of the first announcements by the chancellor after Labour's landslide election victory last year."", 'The practicalities of changing the system again are complicated. One option would be a system in which people on certain incomes can make a claim.', 'Clawing back a payment via the tax system for those on higher incomes is another possibility.', 'The government has yet to outline which mechanics it intends to use to enact its change of policy.', 'In Scotland, ministers have already outlined a different policy. Those in receipt of qualifying benefits like pension credit would get the payment as before, while others would get £100.', 'The funds - which are limited to one payment per household - will be paid through a new Scottish Parliament benefit, which will not be ready until late 2025.', ""The confirmation that more people will receive winter fuel payments this winter comes ahead of the UK government's spending review, which will be announced on 11 June."", 'The review will outline day-to-day departmental budgets over the next three years and investment budgets over the next four.', 'Whitehall insiders have told the BBC they expect it will be ""ugly"", and on Wednesday, Reeves said ""not every department will get everything that they want next week"", suggesting she had turned down requests for funding from ministers.', ""Reeves's position on ruling out borrowing for day-to-day spending and not raising taxes again has fuelled speculation that spending cuts will be made."", 'During PMQs, Sir Keir sidestepped calls to say whether he will scrap the two-child benefit cap.', 'The cap was introduced in 2015 by then-Conservative chancellor George Osborne and restricts child welfare payments to the first two children born to most families.', 'Sizewell C nuclear plant gets £14bn go-ahead from government', 'Trump orders fresh troop deployment to LA as unrest continues into fourth day', 'We quit our jobs, sold our home twice and spent 10 years fighting for the truth', 'People on £10,000 to £96,000 tell us what they want from the Spending Review', 'Ketamine swapped for salt as smugglers exploit Europe loophole in booming market', ""'It was fuelish' and '£14bn for nuclear'"", ""LA's chaotic weekend of protests in maps and pictures"", 'Sly Stone: A funky life - in pictures', 'The winter fuel payment U-turn in numbers', ""China's electric cars are becoming slicker and cheaper - but is there a deeper cost?"", 'Frederick Forsyth: Life as a thriller writer, fighter pilot, journalist and spy', 'US Politics Unspun: Cut through the noise with North America correspondent Anthony Zurcher’s newsletter', ""Prince's iconic hits on the BBC"", 'Watchlist Add Prince and His Songs at the BBC to your Watchlist in iPlayer', 'Glastonbury: Annie and Nick sit down with Emily Eavis', 'Subscribe Add Sidetracked with Annie and Nick to My Sounds']",World,https://news.google.com/api/attachments/CC8iK0NnNW1TRVp6UW1oeE5UaDFVRFZNVFJDZkF4ampCU2dLTWdZcFZaU3VKUWc=-w280-h168-p-df
Winter fuel payment should be restored for NI pensioners – Lyons,https://www.barrheadnews.com/news/national/25226118.winter-fuel-payment-restored-ni-pensioners---lyons/,"['Stormont’s Communities Minister Gordon Lyons has said he will be recommending that pensioners in Northern Ireland have their winter fuel payment restored following a U-turn by the UK Government.', 'Mr Lyons said the details of Chancellor Rachel Reeves’ decision were still to be worked out, but added that the “most simple and straightforward” approach seemed to be to replicate the same approach in Northern Ireland.', 'Around 250,000 pensioners in the region were affected when the payment was cut last year in a cost-saving measure by the new Labour government.', 'On Monday, the Chancellor announced she had changed course and some nine million pensioners in England and Wales will receive the winter fuel payment this winter.', 'The payment, worth up to £300, will be restored to the vast majority of pensioners who previously received it because anyone with an income of under £35,000 a year will now get the payment automatically.', 'Mr Lyons told the Northern Ireland Assembly that “more clarity is needed” on how pensioners affected by previous winter fuel payment cuts will have the benefit reinstated.', 'I am glad the Government has made a U-turn in relation to this. What we now need to do is to work out what is coming next and how that impacts upon Northern Ireland.', 'Speaking to the media, Mr Lyons said it was “good news” that the Government had listened to concerns over its policy.', 'He said: “It is right that they have had a think again on this. There were many people right on the borderline of pension credit who were in need and weren’t getting the support that they should have got.', '“I am glad the Government has made a U-turn in relation to this.', '“What we now need to do is to work out what is coming next and how that impacts upon Northern Ireland.', '“I met with one of the Department for Work and Pensions ministers this afternoon, along with the Finance Minister (John O’Dowd) and officials will continue to work throughout the course of today to nail down some of those details.”', 'Pressed on whether pensioners in Northern Ireland would definitely have their payment restored, Mr Lyons said: “That will ultimately be a decision for the Executive, but right now that is certainly what I would be recommending.', '“That the money that will be there, that will be available, that we allow what is happening in England and Wales to happen in Northern Ireland as well.', '“I think that is going to be the most simple and straightforward way to do it and that is what I want to see happen.”', 'After the Government withdrew the payment from many pensioners last year, Mr Lyons announced a one-off £100 fuel support payment for pensioner households in Northern Ireland who were no longer eligible.', 'Hopefully those who have been most affected will now be helped again and that is a good thing.', 'He said: “It has been handled very poorly by the Government, I don’t think anybody expected a Labour government to attack pensioners in this way.', '“My focus was always on those who were in need, those who just about missed out because of where the boundary was for pension credit.', '“I met a lot of people who were worried and they were concerned and that is why I was pleased to be able to give a little bit to help those who otherwise would have missed out.', '“It was imperfect, it wasn’t as quick as I would have liked it to have been.', '“Hopefully those who have been most affected will now be helped again and that is a good thing.”', 'Alliance Party MLA Sian Mulholland said it was important that pensioners in Northern Ireland are not left behind.', 'She said: “The Communities Minister has a duty to explore the possibilities associated with bringing in a comparable uplift for those in Northern Ireland who have borne the brunt of previous cuts.”', 'SDLP MLA Daniel McCrossan said: “This announcement today will be welcome news for many pensioners across the north who struggled to pay their heating bill and keep warm over a difficult winter.', '“This cut was a decision that should never have been made in the first place, it is the duty of government to protect the most vulnerable people in our society and the UK Government totally failed in that regard.”', ""This website and associated newspapers adhere to the Independent Press Standards Organisation's Editors' Code of Practice. If you have a complaint about the editorial content which relates to inaccuracy or intrusion, then please contact the editor here. If you are dissatisfied with the response provided you can contact IPSO here"", '© 2001-2025. Newsquest Media Group Ltd, 1st Floor, Chartist Tower, Upper Dock Street, Newport, Wales, NP20 1DW | 01676637 |', '', '', '', '', '']",World,https://news.google.com/api/attachments/CC8iK0NnNW1TRVp6UW1oeE5UaDFVRFZNVFJDZkF4ampCU2dLTWdZcFZaU3VKUWc=-w280-h168-p-df
Reeves and Cooper forced into U-turn over pensioner fuel payments,https://www.thetimes.com/uk/politics/article/rachel-reeves-yvette-cooper-news-fdbd322mc,"['Now showing content from the last twelve months, not just the past six days.', 'The U-turn, when it came, was even bigger than expected. Rachel Reeves decided to clear the decks before the spending review by announcing that nine million pensioners would receive winter fuel payments this winter.', 'It was a move born of political \xadnecessity and that has little fiscal logic. When the chancellor announced that she was stripping ten million pensioners of the winter fuel allowance next year, she argued that it was fundamental to restoring economic stability.', '“This is not a decision I wanted to make,” she said. “Nor is it one that I \xadexpected to make. But these are the necessary and urgent decisions I must make. It is the responsible thing to do to fix the foundations of our economy and bring back economic stability.”', 'On Tuesday, economists point out that the fiscal circumstances are, if anything, significantly worse.', 'The reversal means that a policy \xadintended to save £1.5 billion will now save only £50 million this year, at the expense of huge reserves of public goodwill and political capital. It will \xadonly add to pressure on the already \xadailing public finances.', 'Paul Johnson, director of the Institute for Fiscal Studies, said the decision meant there would have to be tax rises or more cuts to welfare in the autumn budget. “To suggest the fiscal situation has got a lot better flies in the face of reality,” he said. “If they are saying this means there will not be any additional borrowing then it follows, as sure as night follows day, that this will mean they will need to raise the equivalent of an additional amount of tax.”', 'It also means that Reeves has crossed another line. She had insisted that she would never make an unfunded \xadspending pledge, arguing that to do so would be “desperate and reckless”. That is exactly what she has now done, and the detail of how the about-turn will be paid for will be confirmed in the autumn budget.', 'After the announcement on Monday, Reeves found herself trying to argue that she had been right in scrapping the universal payments in the first place while simultaneously trying to justify the change in position. It was not an easy circle to square.', 'The decision was the result of a \xadrecognition in both No 10 and No 11 that cutting the allowance had been a \xadmistake, although Reeves would not \xadacknowledge that on Monday.', 'During the local elections in May, \xadLabour activists found the issue of \xadwinter fuel coming up again and again on the doorstep. Polling found that the decision was one of the main reasons voters deserted the party, whether they moved to Reform UK or to the Greens.', '• What to expect in Rachel Reeves’s spend, spend, spending review', 'Discussion about a reversal began in No 10 almost immediately, but was \xaddenied for weeks by the government. By the time Sir Keir Starmer was \xadconfronted over the “toxic” policy by a succession of angry MPs at a meeting of the Parliamentary Labour Party three weeks ago, it was clear that the position was beginning to shift.', 'However, concern that there was a lack of detail about what would replace the previous policy quickly made clear that the government could not wait long before setting out a replacement. Ministers were determined to introduce a means test to avoid paying “a few hundred pounds to millionaires”, and officials struggled to graft one on to ageing computer systems in the \xadDepartment for Work and Pensions.', 'Eventually, it became clear that HM Revenue & Customs would have to be used, clawing payments back from wealthier pensioners through the tax system. This meant that a wish to base payments on household incomes had to be abandoned, as the system assesses only individual incomes.', 'Ministers picked a relatively high \xadincome, covering three quarters of \xadpensioners, to make sure that no older people in poverty would lose out even at the cost of hundreds of millions of pounds.', 'Theoretically, this means that the pensioner partner of a millionaire will receive a winter fuel payment of £100 if they have an income below £35,000 themselves, but ministers \xaddecided that this was a price worth \xadpaying for a rapid solution.', 'For ministers who have spent months defending hugely unpopular cuts, there has been frustration about how much political capital was wasted for such tiny sums of money.', '• Rachel Reeves’s winter fuel cut reversal is a sign of desperation', 'Much of the blame is being pinned on Reeves. It was she who chose to press ahead with a cut long recommended by Treasury advisers but rejected as politically toxic by a succession of previous chancellors.', 'Starmer nodded the decision through, however, despite the clear risk of a severe political backlash. He is said to have been surprised by the scale of the reaction.', 'Ministers will be hoping that the turnaround is enough to quell public anger, which led Labour to slump in the polls.', 'Sharon Graham, head of the Unite union, one of Labour’s biggest donors, put it bluntly. “While this is an important step forward, questions will be asked about how this disastrous \xaddecision was made in the first place — the damage may not easily be \xadreversed,” she said. “Leadership is about choices and the choice to pit workers against pensioners was simply wrong.”', '', '', '', '', '', '', '', '', '', '', '', '', '', '', '', '', '© Times Media Limited 2025.', 'Registered in England No. 894646. Registered office: 1 London Bridge Street, SE1 9GF.']",World,https://news.google.com/api/attachments/CC8iK0NnNW1TRVp6UW1oeE5UaDFVRFZNVFJDZkF4ampCU2dLTWdZcFZaU3VKUWc=-w280-h168-p-df
No title found,https://www.msn.com/en-ca/money/other/winter-fuel-u-turn-solves-one-headache-for-starmer-but-creates-two-more/ar-AA1GmoB0,"['Use precise geolocation data. Actively scan device characteristics for identification. Store and/or access information on a device. Personalised advertising and content, advertising and content measurement, audience research and services development.\nList of Partners (vendors)', '', '', '', '', '', '', '', '', '', '', '', '', '', '', '', '', '', '', '', '', '', '', '', '']",World,https://news.google.com/api/attachments/CC8iK0NnNW1TRVp6UW1oeE5UaDFVRFZNVFJDZkF4ampCU2dLTWdZcFZaU3VKUWc=-w280-h168-p-df
