Title,Link,Paragraphs,Topic,Image
Labour MPs in call for benefits U-turn after change to winter fuel payment cut,https://www.harwichandmanningtreestandard.co.uk/news/national/25226424.labour-mps-call-benefits-u-turn-change-winter-fuel-payment-cut/,"['Labour backbenchers have called for a Government U-turn on planned disability benefit cuts, after Chancellor Rachel Reeves restored winter fuel payments to a majority of pensioners.', 'Ms Reeves’ £1.25 billion plan unveiled on Monday will see automatic payments worth up to £300 given to pensioners with an income less than £35,000 a year.', 'It followed last year’s decision to strip pensioners of the previously universal scheme, unless they claimed certain benefits, such as pension credit.', 'Nadia Whittome, the Labour MP for Nottingham East, warned ministers they risked making a “similar mistake” if they tighten the eligibility criteria for personal independence payments, known as Pip.', 'Leeds East MP Richard Burgon called on pensions minister Torsten Bell to “listen now” so that backbenchers can help the Government “get it right”.', 'In her warning, Ms Whittome said she was not asking Mr Bell “to keep the status quo or not to support people into work” and added: “I’m simply asking him not to cut disabled people’s benefits.”', 'The pensions minister, who works in both the Treasury and Department for Work and Pensions, replied that the numbers of people receiving Pip is set to “continue to grow every single year in the years ahead, after the changes set out by this Government”.', 'In its Pathways to Work green paper, the Government proposed a new eligibility requirement, so Pip claimants must score a minimum of four points on one daily living activity, such as preparing food, washing and bathing, using the toilet or reading, to receive the daily living element of the benefit.', '“This means that people who only score the lowest points on each of the Pip daily living activities will lose their entitlement in future,” the document noted.', 'Mr Burgon told the Commons: “As a Labour MP who voted against the winter fuel payment cuts, I very much welcome this change in position, but can I urge the minister and the Government to learn the lessons of this and one of the lessons is, listen to backbenchers?', '“If the minister and the Government listen to backbenchers, that can help the Government get it right, help the Government avoid getting it wrong, and so what we don’t want is to be here in a year or two’s time with a minister sent to the despatch box after not listening to backbenchers on disability benefit cuts, making another U-turn again.”', 'Mr Bell replied that it was “important to listen to backbenchers, to frontbenchers”.', 'Opposition MPs cheered when the minister added: “It’s even important to listen to members opposite on occasion.”', 'Liberal Democrat MP Mike Martin warned that “judging by the questions from his own backbenchers, it seems that we’re going to have further U-turns on Pip and on the two-child benefit cap”.', 'The Tunbridge Wells MP asked Mr Bell: “To save his colleagues anguish, will he let us know now when those U-turns are coming?”', 'The minister replied: “What Labour MPs want to see is a Labour Government bringing down child poverty, and that’s what we’re going to do', '“What Labour MPs want to see is a Government that can take the responsible decisions, including difficult ones on tax and on means testing the winter fuel payment so that we can invest in public services and turn around the disgrace that has become Britain’s public realm for far too long.”', 'Conservative former work and pensions secretary Esther McVey had earlier asked whether the Chancellor, “now that she and the Government have got a taste for climbdowns”, would “reverse the equally ridiculous national insurance contribution (Nic) rises, which is destroying jobs, and the inheritance tax changes, which is destroying farms and family businesses”.', 'Mr Bell said: “This is a party opposite that has learned no lessons whatsoever, that thinks it can come to this chamber, call for more spending, oppose every tax rise and expect to ever be taken seriously again – they will not.”', 'Labour MP Rebecca Long-Bailey pressed the Government to make changes to the two-child benefit cap, which means most parents cannot claim for more than two children.', '“It’s the right thing to do to lift pensioners out of poverty, and I’m sure that both he and the Chancellor also agree that it’s right to lift children out of poverty,” the Salford MP told the Commons.', '“So can he reassure this House that he and the Chancellor are doing all they can to outline plans to lift the two-child cap on universal credit as soon as possible?”', 'Mr Bell replied: “All levers to reduce child poverty are on the table.', '“The child poverty strategy will be published in the autumn.”', 'He added: “If we look at who is struggling most, having to turn off their heating, it is actually younger families with children that are struggling with that.', '“So she’s absolutely right to raise this issue, it is one of the core purposes of this Government, we cannot carry on with a situation where large families, huge percentages of them, are in poverty.”', ""This website and associated newspapers adhere to the Independent Press Standards Organisation's Editors' Code of Practice. If you have a complaint about the editorial content which relates to inaccuracy or intrusion, then please contact the editor here. If you are dissatisfied with the response provided you can contact IPSO here"", '© 2001-2025. Newsquest Media Group Ltd, 1st Floor, Chartist Tower, Upper Dock Street, Newport, Wales, NP20 1DW | 01676637 |', '', '', '', '', '']",World,https://news.google.com/api/attachments/CC8iK0NnNW1TRVp6UW1oeE5UaDFVRFZNVFJDZkF4ampCU2dLTWdZcFZaU3VKUWc=-w280-h168-p-df
Should the government apologise for the winter fuel payment shambles?,https://www.silversurfers.com/speakers-corner/should-the-government-apologise-for-the-winter-fuel-payment-shambles-s-c/,"['', '', '', '', '', '', 'Some nine million pensioners in England and Wales will receive the winter fuel payment this winter, the Chancellor has announced in a £1.25 billion U-turn of Government plans.', 'The payment, worth up to £300, will be restored to the vast majority of pensioners who previously received it because anyone with an income of under £35,000 a year will now get the payment automatically.', 'Confirming the U-turn, Rachel Reeves said the Government had “listened to people’s concerns” about the decision to limit the payment to the poorest pensioners last winter, and was now able to widen eligibility because Labour had restored “stability” to the economy.', 'Ministers have insisted no additional Government borrowing will be needed to cover the costs of the reversal, prompting warnings of tax rises on the horizon.', 'Those with an income above the £35,000 threshold will also receive the payment, but it will then be reclaimed from them in tax.', 'To be eligible for the winter fuel allowance, a person will need to have reached state pension age by the week starting September 15 this year.', 'Devolved authorities in Scotland and Northern Ireland will each receive a funding uplift so they too can meet the new threshold.', 'Pensioners who do not want to receive the payment will be able to opt out, according to the Treasury.', 'The decision to limit the winter fuel payment to only those who claimed pension credit was one of Labour’s first acts in Government, aimed at balancing what was described as a £22 billion “black hole” in the public finances.', 'This meant the number of pensioners receiving the payment was reduced by around 10 million, from 11.4 million to 1.5 million.', 'But Sir Keir Starmer signalled there would be a partial U-turn on the policy in May, after it was thought to have contributed to Labour’s drubbing in the local elections.', 'The Treasury claims the new arrangement will cost £1.25 billion in England and Wales, while means-testing winter fuel will save the taxpayer £450 million.', 'Speaking during visit to north London, the Chancellor said: “From this winter, nine million pensioners will now receive winter fuel payments.', '“It will be still means-tested, but at a higher level, we’ve listened to people’s concerns around the level of the means test.”', 'Ms Reeves suggest that the “stability we’ve brought back to the economy” meant the Government was able to change the eligibility threshold for winter fuel payments.', 'She added: “We will set out in the normal way, in the budget, how everything is funded, but no-one should be in any doubt about my commitment to the fiscal rules to ensure that the sums always add up.”', 'The Chancellor told Sky News there was “still work to do to ensure that the sums always add up”, and also insisted the reversal did not mean the Government was “going back to the universal system” it had scrapped.', 'Ms Reeves added: “I don’t think it is right that the very richest pensioners have their fuel bills subsidised, but this year nine million pensioners will get the winter fuel payments.”', 'Some two million pensioners who earn more than £35,000 will see their winter fuel payments clawed back via the taxman, the Treasury estimates.', 'Costs of the U-turn will be accounted for at the autumn budget, the Treasury said, but the plan will not require extra borrowing, according to the Government department.', 'Writing on social media site X, Paul Johnson of the Institute for Fiscal Studies responded by saying: “The corollary of ‘this will not lead to permanent additional borrowing’ is that it will lead to permanent additional taxes (or just possibly permanent cuts to other bits of welfare).”', 'No 10 insisted the Government’s manifesto commitment to not raise VAT, income tax, or National Insurance remained in place.', '“It will be for the Chancellor to set out how this is funded at the budget”, the Prime Minister’s official spokesman added.', 'Kemi Badenoch, leader of the Opposition, claimed the Prime Minister had “scrambled to clear up a mess of his own making”.', 'The Conservative leader added: “I repeatedly challenged him to reverse his callous decision to withdraw winter fuel payments, and every time Starmer arrogantly dismissed my criticisms.', '“This humiliating U-turn will come as scant comfort to the pensioners forced to choose between heating and eating last winter.', '“The Prime Minister should now apologise for his terrible judgment.”', 'Liberal Democrat Leader Sir Ed Davey said: “Finally the Chancellor has listened to the Liberal Democrats and the tireless campaigners in realising how disastrous this policy was, but the misery it has caused cannot be overstated.', '“Countless pensioners were forced to choose between heating and eating all whilst the Government buried its head in the sand for months on end, ignoring those who were really suffering.', '“We will now study the detail of this proposal closely to make sure those who need support actually get that support.', '“The pain they went through this winter cannot be for nothing.”', 'What are your views? Should the government apologise for the pain caused to many pensioners this winter?', '', 'After recently retiring from a big career I think I am in a great place to really enjoy...', 'Think someone you know would enjoy being part of the Silversurfers community? Spread the word...', '', '', '', '', '', '', '', '']",World,https://news.google.com/api/attachments/CC8iK0NnNW1TRVp6UW1oeE5UaDFVRFZNVFJDZkF4ampCU2dLTWdZcFZaU3VKUWc=-w280-h168-p-df
'It was fuelish' and '£14bn for nuclear',https://www.bbc.com/news/articles/cr580m6r711o,"['', 'Under the headline ""winter wonderful,"" the Daily Mirror says Rachel Reeves has delighted pensioners.', 'The i newspaper says her decision was warmly welcomed but Labour MPs have warned her to water down  plans to cut disability benefits, to avoid being forced into another embarrassing U-turn later.', '""It was fuelish"" is The Sun\'s headline, while the Daily Mail says Ms Reeves and Sir Keir Starmer are ""deluded"" for claiming the original cut was right, and suggesting they are now in a position to restore the payments, because they\'ve fixed the economy.  Both papers are demanding an apology.', 'The Daily Express says the ""humiliating U-turn"" is a ""victory for pensioners,"" while The Daily Telegraph claims the change will cause chaos for the pensioners on incomes above £35,000, because they\'ll receive their winter fuel payment, and then have to work out how to pay it back.', ""According to The Times, the chancellor has refused to meet the home secretary's demand for extra police funding, despite warnings that the government could miss its targets on law and order as a result."", 'The paper says Rachel Reeves imposed a settlement on Yvette Cooper yesterday, after weeks of negotiations went to the wire. A source said there would still be a real-terms increase in funding for police, but it would fall short of what Ms Cooper had pushed for.', ""The Guardian and the Telegraph highlight the government's decision to invest £14.2bn to build the Sizewell C nuclear plant in Suffolk."", 'The Telegraph says the move will address fears that the rush to build wind and solar would leave the UK vulnerable to blackouts. Writing in the paper, Energy Secretary Ed Miliband says demand for electricity is expected to at least double by 2050, and ""new nuclear is a crucial source of firm baseload power"".', ""A report in the Daily Mail says Reform UK will later today appoint the TV presenter, David Bull, as the party's new chairman, following the resignation last week of Zia Yusuf. The paper says Mr Bull made his name fronting a popular show about ghosts and the paranormal, on the Rupert Murdoch channel, Talk UK."", 'Finally, the Times and the Daily Mirror report that a new treatment, which zaps hard-to reach cancers using sound waves, is to be offered on the NHS.', 'The Times explains that a machine uses ultrasound waves to create a tightly focused cluster of bubbles from gases naturally present in the target tissue, and as the bubbles form and collapse in microseconds, they tear apart cancer cells, leaving surrounding organs undamaged.', 'The Daily Mirror says until now the treatment was available only in the US.', 'Sign up for our morning newsletter and get BBC News in your inbox.', 'Copyright 2025 BBC. All rights reserved.  The BBC is not responsible for the content of external sites. Read about our approach to external linking.', ' ', '']",World,https://news.google.com/api/attachments/CC8iK0NnNW1TRVp6UW1oeE5UaDFVRFZNVFJDZkF4ampCU2dLTWdZcFZaU3VKUWc=-w280-h168-p-df
,https://www.itn.co.uk/news/martin-lewis-says-winter-fuel-uturn-huge-relief-0,"['We use cookies to optimise site functionality and give you the best possible experience.', 'We use cookies to optimise site functionality and give you the best possible experience.', '', 'Martin Lewis said the government\'s decision to U-turn the winter fuel payment is a ""huge relief"" for pensioners. Rachel Reeves confirmed on Monday that pensioners earning less than £35k will be eligible to claim winter fuel payments this coming winter.\n.', '', '', '', '', '', '', '', '', '', '', '', '', '', '', '', '', '', '', '', '', '', '', '', '', '', '', '', '', '', '', '', '', '', '', '', '', '', '', '', '', '', '', '', '', '', '', '', '', '', '', '', '', '', '', '', '', '', '', '', '', '', '', '', '', '', '', '', '', '', '', '', '', '', '', '', '020 7833 3000', ""Independent Television News Limited is registered in England and Wales under company number 548648.\nRegistered office: 200 Gray's Inn Road, London WC1X 8XZ"", '© 2023 Independent Television News Limited. All rights reserved.']",World,https://news.google.com/api/attachments/CC8iK0NnNW1TRVp6UW1oeE5UaDFVRFZNVFJDZkF4ampCU2dLTWdZcFZaU3VKUWc=-w280-h168-p-df
Rachel Reeves’s winter fuel U turn is indefensible,https://www.spectator.co.uk/article/rachel-reevess-winter-fuel-u-turn-is-indefensible/,"['', '', 'Rachel Reeves has shown just how spineless this government is by U-turning on her flagship policy of cutting winter fuel allowance. Instead of sensibly offering only the poorest pensioners help during the coldest months, nine million pensioners on total incomes less than £35,000 will receive it. When a government with a majority of 174 seats can’t cut government spending by £1.6 billion, or, less than 0.2 per cent of its budget, there is little hope for sorting out the nation’s finances with impending demographic disaster on the horizon.', 'No doubt on the doorstep many pensioners have told Labour politicians, including the chancellor, that they simply can’t do without the £200 winter fuel allowance; it’s a choice between heating and eating, according to them. Yet for many pensioners this is simply not true. If we take the bottom 20 per cent of pensioner households we find they spend 17', '', 'Already a subscriber? Log in', 'Charles Amos studied Political Theory at The University of Oxford and writes The Musing Individualist Substack. He tweets @mrcharlesamos.', '', '', 'TOPICS IN THIS ARTICLE', 'TRENDING', 'ALSO IN ECONOMY', 'ALSO BY CHARLES AMOS', 'LATEST', 'Be part of the conversation with other Spectator readers by getting your first three months for $5.', 'Already a subscriber? Log in']",World,https://news.google.com/api/attachments/CC8iK0NnNW1TRVp6UW1oeE5UaDFVRFZNVFJDZkF4ampCU2dLTWdZcFZaU3VKUWc=-w280-h168-p-df
More than 75% of pensioners to get winter fuel payment as Reeves confirms major U-turn,https://www.bbc.co.uk/news/live/c5yxvdl4d0pt,"[""More than three-quarters of pensioners will receive the winter fuel payment this year as Rachel Reeves confirms a major U-turn on the government's policy""]",World,https://news.google.com/api/attachments/CC8iK0NnNW1TRVp6UW1oeE5UaDFVRFZNVFJDZkF4ampCU2dLTWdZcFZaU3VKUWc=-w280-h168-p-df
Winter fuel U-turn to cause financial chaos for pensioners,https://www.telegraph.co.uk/politics/2025/06/09/winter-fuel-quarter-pensioners-payments-rachel-reeves/,"['Quarter of pensioners will receive payment but have to return it via PAYE or tax returns', '', '', '', '', '', '', '', '', '', '', '', '', '', '', '', '', '', '', '', '', 'Sir Keir Starmer’s about-turn on winter fuel will cause chaos for millions of pensioners as they work out how to return money to the Treasury...', '', '', 'You’ll receive regular news updates', 'By creating an account you’ll agree to our terms and conditions. We will not share your email address with other companies. For details on how Telegraph Media Group Holdings will use your data, see our privacy policy.', ""Or if you'd prefer, sign up with:"", '', 'Already have an account? Log in']",World,https://news.google.com/api/attachments/CC8iK0NnNW1TRVp6UW1oeE5UaDFVRFZNVFJDZkF4ampCU2dLTWdZcFZaU3VKUWc=-w280-h168-p-df
"Winter fuel U-turn should have come a long time ago, Reeves told",https://www.bordertelegraph.com/news/national/25225550.winter-fuel-u-turn-come-long-time-ago-reeves-told/,"['The decision to reinstate the winter fuel payment should have been made “a long time ago”, Scotland’s Social Justice Secretary has said.', 'Chancellor Rachel Reeves said on Monday that nine million pensioners will be in receipt of the payment this year after a cut was announced in the first weeks of the Labour Government last summer.', 'The initial decision was met with heavy backlash and forced the Scottish Government to delay the implementation of its own devolved benefit.', 'John Swinney’s administration later announced a similar payment for pensioners which would be tapered and see those on the highest incomes receiving £100, compared to £305.10 for those on the least.', 'Monday’s announcement will result in cash being sent to the devolved administration at Holyrood, and Scottish Labour has urged the Government to increase its payments.', 'But Scotland’s Social Justice Secretary Shirley-Anne Somerville said the decision was “a betrayal” of pensioners.', '“I welcome any extension of eligibility by the UK Government, but this is a U-turn the Chancellor should have made a long time ago,” she said.', '“But there is still no detail about how the Chancellor intends to go about that. Unfortunately, it still sounds as if many pensioners will miss out.”', 'Ms Somerville added that the Scottish Government had not been consulted on the decision and urged UK ministers to “ensure the Scottish Government is fully appraised of the proposed changes as soon as possible”.', 'The SNP must not go ahead with plans that would rob poorer pensioners in order to fund payments for millionaires', '“The Cabinet Secretary for Finance and Local Government wrote to the Chief Secretary to the Treasury last week to urge the UK Government to share its plans with us as quickly as possible, so that we can understand any implications for our own programmes and, crucially, our budget,” she said.', 'Scottish Labour MSP Paul O’Kane said: “The winter fuel payment is a devolved payment in Scotland and Scottish Labour has long been clear that we want to see it reinstated for the majority of pensioners up here – but despite their loud spin, the SNP voted against our attempts to do so.', '“The SNP must not go ahead with plans that would rob poorer pensioners in order to fund payments for millionaires.', '“The SNP must re-examine their own proposals in light of this game-changing announcement, ensure payments reach those most in need, and give a cast-iron guarantee that no struggling Scottish pensioners will be left out of pocket under their plans.”', 'The Scottish Government’s plans were initially to provide a universal payment to pensioners, but the proposals were scuppered by the Chancellor’s announcement of the cut last summer, forcing ministers to create a different system for this winter.', ""This website and associated newspapers adhere to the Independent Press Standards Organisation's Editors' Code of Practice. If you have a complaint about the editorial content which relates to inaccuracy or intrusion, then please contact the editor here. If you are dissatisfied with the response provided you can contact IPSO here"", '© 2001-2025. Newsquest Media Group Ltd, 1st Floor, Chartist Tower, Upper Dock Street, Newport, Wales, NP20 1DW | 01676637 |', '', '', '', '', '']",World,https://news.google.com/api/attachments/CC8iK0NnNW1TRVp6UW1oeE5UaDFVRFZNVFJDZkF4ampCU2dLTWdZcFZaU3VKUWc=-w280-h168-p-df
