Title,Link,Paragraphs,Topic,Image
‘Lessons to learn’ from winter fuel payments U-turn,https://www.ealingtimes.co.uk/news/national/25225212.lessons-learn-winter-fuel-payments-u-turn/,"['', '', 'The Government’s decision to reinstate winter fuel payments for millions of pensioners has been welcomed, but commentators said there are lessons to learn from the U-turn.', 'Nine million pensioners will receive the payments this winter as pensioners in England and Wales with an income of £35,000 or less per year benefit.', 'The payments were previously linked to pension credit, with the Government arguing this would help to balance a “black hole” in public finances.', 'The lesson here is that if Government wants to better target support, it must do so with careful planning, adequate resourcing and a clear communication strategy', 'Jon Greer, head of retirement policy at wealth manager Quilter, said: “While restricting payments to those on pension credit may have appeared fiscally responsible, it underestimated both the administrative burden and the strength of feeling such changes provoke among pensioners.”', 'He added: “The lesson here is that if Government wants to better target support, it must do so with careful planning, adequate resourcing and a clear communication strategy.', '“It also throws into sharp relief the growing tension around the state pension triple lock (which is used to increase the state pension).', '“There is a strong case to say the triple lock is no longer fit for purpose, yet this episode has shown just how radioactive any attempt at reform has become.”', 'SNP Westminster leader Stephen Flynn MP said: “This screeching u-turn was inevitable and lessons must be learnt from the damaging mess the Labour Government caused by robbing pensioners of their winter fuel payments.”', 'In a video posted on X, consumer champion Martin Lewis said: “Do I think this is an improvement? Spoiler, yes, very much so.”', 'He added that the previous threshold set last winter was “just far too low and left many people on still very low incomes earning just above the threshold missing out”.', 'He said moving it to £35,000 “which is much more equivalent to average income is a big improvement and should lead to three in four state pensioners getting a payment, according to the Government numbers. So yes, that’s worthwhile.”', 'Mr Lewis said that pension credit had long been under-claimed, “so linking winter fuel payments to pension credit was in my view flawed.', '“And even now, there are 700,000 eligible state pensioners on very low incomes who should be getting pension credit who don’t, which also means they miss out on winter fuel payment.', '“Well that’s gone, because now every state pensioner household will get this by default unless they choose to opt out of it, which means those vulnerable households who are least likely to act will automatically get it.”', ""I feel relieved, that's my instant reaction to the news"", 'Mr Lewis said the move means: “Far more pensioners who were struggling with still high energy bills will get this payment.', '“I feel relieved, that’s my instant reaction to the news.”', 'Unison general secretary Christina McAnea said: “This is the right thing to do. The Government acknowledges it made a mistake.', '“Restoring the fuel payment to all but the wealthiest pensioners will make a huge difference to anyone who struggled to keep warm last winter.”', 'Our helpline receives thousands of calls from older people making drastic cutbacks just to get by and the changes to the winter fuel payment made this worse', 'Sarah Coles, head of personal finance, Hargreaves Lansdown, said: “The partial u-turn on the winter fuel payment will make a huge difference to the finances of some of the lowest-earning pensioners, who had missed out by a hair’s breadth by earning fractionally too much to qualify for pension credit.”', 'Independent Age chief executive Joanna Elson said: “Our helpline receives thousands of calls from older people making drastic cutbacks just to get by and the changes to the winter fuel payment made this worse.', '“For millions living on low incomes, the entitlement supports them to turn their heating on and stock up on food during the colder months.”', 'Caroline Abrahams, charity director at Age UK, said: “At Age UK we heard from many through the winter who were so frightened about their bills that they didn’t even try to keep their homes adequately warm.”', 'Chancellor Rachel Reeves said the Government had “listened to people’s concerns” about the decision to limit the payment last winter.', 'But some commentators questioned whether the admin created by excluding some pensioners from entitlement to winter fuel payments was worth it.', 'Pensioners who are above the £35,000 threshold will have the full amount of the winter fuel payment they received automatically collected via PAYE (pay as you earn), or via their self-assessment return.', 'A simple system will also be set up for those who want to opt out from receiving the winter fuel payment, the Government has said, removing the need for HM Revenue and Customs (HMRC) to recover the payment.', 'This farcical situation could lead to pensioner panic', 'Rachel Vahey, head of public policy at AJ Bell, said: “This not only creates tax chaos for over a million people but it creates a cottage industry for Government to impose the clawback, creating additional admin which will cut into the estimated £450 million saving to taxpayers.”', 'She added: “This farcical situation could lead to pensioner panic. Many will be scrabbling to make sure their income dips under the critical £35,000 limit.', '“Given the chaos it could cause and the relatively tiny taxpayer savings on offer, it may have made sense for the Government to take the political embarrassment of a U-turn on the chin and make the payment to all pensioners.”', 'Alex Clegg, an economist at the Resolution Foundation, said: “The new scheme for means testing winter fuel payments means that that the number of pensioners receiving support will rise from 1.3 million last winter to around nine million this winter, and not far off the 11.6 million who received winter fuel payments two winters ago when they were universal.”', 'He added: “The new means test will create new complexity in the tax system, including a cliff edge for those with around £35,000 of income. The reported savings of £450 million will be reduced further by the cost of increased pension credit take-up as a result of the original policy, and the cost of administering the new means test.”', ""This website and associated newspapers adhere to the Independent Press Standards Organisation's Editors' Code of Practice. If you have a complaint about the editorial content which relates to inaccuracy or intrusion, then please contact the editor here. If you are dissatisfied with the response provided you can contact IPSO here"", '© 2001-2025. Newsquest Media Group Ltd, 1st Floor, Chartist Tower, Upper Dock Street, Newport, Wales, NP20 1DW | 01676637 |', '', '', '', '', '']",World,https://news.google.com/api/attachments/CC8iK0NnNW1TRVp6UW1oeE5UaDFVRFZNVFJDZkF4ampCU2dLTWdZcFZaU3VKUWc=-w280-h168-p-df
'They're in blind panic!' Nigel Farage takes credit for Winter Fuel Payment U-turn in fiery swipe at Labour,https://www.gbnews.com/politics/nigel-farage-winter-fuel-payment-u-turn-labour,"['', '', 'ADVERTISEMENT', 'By Ed Griffiths', 'Published: 09/06/2025', 'Rachel Reeves confirmed that around nine million pensioners will benefit under the new rules', 'Nigel Farage has taken credit for Labour\'s Winter Fuel Payment U-turn this afternoon in a fierce swipe at the ""panicking"" Labour Government.', ""The Reform UK leader said Labour's U-turn announcement today had been timed in an attempt to overshadow his speech and press conference in Port Talbot."", '', 'He said the decision to restore the payments to some nine million pensioners was a ""considerable step in the right direction"" and vowed that his party had made ""the political weather on this one"".', 'Just minutes prior, he accused Sir Keir Starmer\'s party of being in a ""state of absolute blind panic"" because of the rise of Reform.', ""1\nState pension future in doubt as Labour urged to 'introduce means-testing'"", '2\nITV Coronation Street star Rebecca Ryan, 34, celebrates birth of second child with sweet photo', ""3\nMeghan Markle and Prince Harry appear to use Lilibet's birthday cake to send message to the Royal Family"", ""4\nMeghan Markle 'moves onto hotels' amid Prince Harry's UK arrangements"", ""5\nPrince Andrew feels Prince Harry and Meghan's former home 'not good enough for him' as duke refus..."", '', '', '', '', '', '', '', '', '', '', ""Nigel Farage has taken credit for Labour's Winter Fuel Payment U-turn"", 'Getty', '""Reform are leading now much of their agenda,"" he jabbed.', 'Following the decision to U-turn on the policy, everyone over the state pension age in England and Wales with an income of £35,000 or less a year will now receive the winter payment.', 'The change will offer certainty and targeted support to those on lower and middle incomes.', 'Rachel Reeves confirmed that around nine million pensioners will benefit under the new rules, representing over three-quarters of all pensioners in England and Wales.', 'LATEST DEVELOPMENTS:', ""Farage has vowed that 'figures will emerge' in the coming months in the race to become Reform UK's First Ministerial candidate in Wales"", 'Getty', 'The support, which is worth £200 per household, or £300 where someone is aged 80 or over, will be paid automatically this winter.', 'For those with incomes above the £35,000 threshold, the payment will still be issued but then recovered via HMRC, either through PAYE or a Self-Assessment return.', 'The Treasury said: ""This change gives people certainty and ensures that payments can be made in time for this winter.\nDON\'T MISS\nRio Ferdinand, 46, lands new job abroad just days after TNT Sports exit\nThere\'s a brand-new way to watch Sky TV, and it\'s on-sale from £6 today\nGB News Daily Reflections - Tuesday 10th June', '""Payments will be better targeted than before 2024-25, when they were previously paid to all pensioners regardless of their income, meaning those on lower and middle incomes will still receive the help they need.""', 'Rachel Reeves confirmed that around nine million pensioners will benefit under the new rules', 'Getty', 'Farage has also vowed that ""figures will emerge"" in the coming months in the race to become Reform UK\'s First Ministerial candidate in Wales.', 'The Reform chief said that while his party was ""rapidly"" building in Wales, it was not yet at the point of having a ""lead member"".', 'He said: ""Figures will emerge over the course of the next few months who through merit will no doubt be in a position where they can qualify to be our lead member. We are not at that point of evolution just yet.""', 'Reform UK\'s ""ambition is to re-industrialise Wales"" to fuel Britain\'s growing demand for steel, according to Farage.', '', 'ADVERTISEMENT', 'ADVERTISEMENT', 'ADVERTISEMENT', 'ADVERTISEMENT', 'ADVERTISEMENT', 'ADVERTISEMENT', 'ADVERTISEMENT', 'ADVERTISEMENT']",World,https://news.google.com/api/attachments/CC8iK0NnNW1TRVp6UW1oeE5UaDFVRFZNVFJDZkF4ampCU2dLTWdZcFZaU3VKUWc=-w280-h168-p-df
"Winter fuel payments to be reinstated this year, Rachel Reeves confirms",https://www.theguardian.com/society/2025/jun/04/winter-fuel-payments-to-be-reinstated-this-year-rachel-reeves-confirms,"['Threshold over which pensioners are no longer eligible for payment will rise before winter, chancellor says', 'Rachel Reeves has confirmed that some winter fuel payments will be reinstated in time for this winter after weeks of uncertainty over the government’s decision to make a U-turn on scrapping the benefit.', 'The UK chancellor said ministers would be announcing details of the changes to the £11,500 threshold over which pensioners are no longer eligible for the allowance “as soon as we possibly can”.', 'However, the pensions minister, Torsten Bell, categorically ruled out a return to a universal winter fuel payment to all pensioners, reflecting a view in government that it would be unfair for the richest pensioners to receive it.', 'Keir Starmer confirmed last month that he wanted more pensioners to be eligible for winter fuel payments after a backlash against one of the most unpopular policies of the Labour government.', 'However, No 10 was unable to confirm whether the U-turn would come into effect by this winter if announced in the autumn budget – or how many of the approximately 10 million pensioners who lost it would have it restored.', 'The chancellor could announce the new threshold at next week’s spending review despite Downing Street not regarding this as a fiscal event.', 'At a speech in Rochdale, Reeves told reporters: “We have listened to the concerns that people had about the level of the means test, and so we will be making changes to that; they will be in place so that pensioners are paid this coming winter.', '“We’ll announce the detail of that and the level of that as soon as we possibly can. But people should be in no doubt that the means test will increase and more people will get a winter fuel payment this winter.”', 'Ministers are looking at restoring winter fuel as a universal benefit and then recouping the money when high income pensioners fill in their tax returns, the Guardian understands, as creating a new means test would be a highly complex option.', 'A similar approach was taken by the former Conservative chancellor George Osborne when he reduced child benefit eligibility for better-off parents. Treasury officials are still working on what level to set the new winter fuel threshold.', 'Speaking to the work and pensions committee, Bell said: “Is there any prospect of a universal winter fuel payment? The answer is no. The principle I think most people, 95% of people agree, that it’s not a good idea that we have a system paying a few hundreds of pounds to millionaires, and so we’re not going to be continuing with that. But we will be looking at making more pensioners eligible.”', 'The government’s reversal came despite Downing Street ruling out making changes to winter fuel payments after the Guardian revealed that it was rethinking the cut amid anxiety at the top of government that the policy could wreak serious electoral damage.', 'The chancellor also hinted at tensions between cabinet colleagues saying she had had to turn down spending requests as she struggled to balance the books off the back of what she described “14 years of Conservative maltreatment of our public services, our public realm and of our economy”.', '“Not every department will get everything that they want next week,” she said, “and I have had to say no to things that I want to do too.”', 'Sign up to First Edition', 'Our morning email breaks down the key stories of the day, telling you what’s happening and why it matters', '', 'Three Whitehall departments are still to agree their multi-year budgets with the Treasury before the spending review, the Guardian understands, with the home secretary, Yvette Cooper; the energy secretary, Ed Miliband; and the housing secretary, Angela Rayner, holding out.', 'The chancellor also ruled out bending her fiscal rules, which she acknowledged would be the subject of much discussion over the coming days.', 'Starmer’s government set out new fiscal rules in October last year, which say the budget should be on course to be in balance or surplus, and financial debt should fall as a share of the economy, by 2029-30. The rules also put constraints on welfare spending.', '“Over the next week, you will hear a lot of debate about my so-called self-imposed fiscal rules,” Reeves said. “Now, contrary to some conventional wisdom, I didn’t come into politics because I care passionately about fiscal rules. I came into politics because I want to make a difference to the lives of working people.”', 'Referencing Liz Truss’s 2022 mini-budget that sent interest rates soaring, she warned against “fantasy economics” and said “no one should need to be told about the dangers of reckless borrowing for the financial security of ordinary families”.', '“Fiscal rules are an indispensable safeguard for working people, and that is why my rules are non-negotiable,” she said.']",World,https://news.google.com/api/attachments/CC8iK0NnNW1TRVp6UW1oeE5UaDFVRFZNVFJDZkF4ampCU2dLTWdZcFZaU3VKUWc=-w280-h168-p-df
"If you’re going to make a U-turn, do it properly, writes Andrew Marr",https://www.lbc.co.uk/opinion/views/andrew-marr-winter-fuel-payments/,"['LBC', 'IAN PAYNE\n4am - 7am', 'OPINION', 'LBC OPINION', '', '', '', '9 June 2025, 17:55 | Updated: 9 June 2025, 18:01', 'By Andrew Marr', 'If you’re going to make a U-turn, do it properly.', 'If you’re going to own up to a mistake, own it.', 'If you’re going to eat humble pie, then pour on a good dollop of grovel sauce while you are at it.', 'When Keir Starmer announced last month after Labour had taken a battering in the local elections he was thinking again about the removal of the winter fuel payment to millions of pensioners, everyone was a little suspicious.', 'How many would actually get the money back?', 'And when – in time for this winter?', 'Well today, the Chancellor Rachel Reeves filled in key details; and this is indeed a proper U-turn.', 'More than 3/4 of pensioners, that’s everyone with an income of below £35,000 a year, more than eight million people, will now get the payment this winter.', 'That will cost the treasury well over £1 billion and we don’t know where the money is coming from.', 'Reform and the Tories are claiming this is a victory for them, and you can see why but the real victors are the voters who told Labour what they thought in no uncertain terms.', 'It’s a victory for democracy – but it should, also, draw a line under the single biggest policy mistake made by Labour since the election.', 'It allows Reeves to focus for the rest of this week on the big investment coming in the spending review – more for nuclear power, creating thousands of new jobs.', 'More for tech, railways, policing and the NHS.', 'It’s one of the most important weeks for the new, but unpopular, government.', 'Up to now Starmer and friends have been widely criticised for being stingy, unimaginative and lacking in vision.', 'So the biggest question is whether this longer term investment and industrial strategy version of Labour hangs together – is noticed by voters - and can fend off the rising Reform rebellion led by Nigel Farage.', '________________', 'LBC Opinion provides a platform for diverse opinions on current affairs and matters of public interest.', 'The views expressed are those of the authors and do not necessarily reflect the official LBC position.', 'To contact us email opinion@lbc.co.uk', 'See more', '19 hours ago', '23 hours ago', '1 day ago', 'See more', 'See more']",World,https://news.google.com/api/attachments/CC8iK0NnNW1TRVp6UW1oeE5UaDFVRFZNVFJDZkF4ampCU2dLTWdZcFZaU3VKUWc=-w280-h168-p-df
No title found,https://www.reuters.com/world/uk/uk-restore-winter-fuel-payments-millions-pensioners-major-u-turn-2025-06-09/,[],World,https://news.google.com/api/attachments/CC8iK0NnNW1TRVp6UW1oeE5UaDFVRFZNVFJDZkF4ampCU2dLTWdZcFZaU3VKUWc=-w280-h168-p-df
