Title,Link,Paragraphs,Topic,Image
"Millions more pensioners to get winter fuel payments this year, Rachel Reeves confirms after major U-turn",https://www.standard.co.uk/news/politics/pensioners-winter-fuel-payments-reeves-spending-review-b1231164.html,"['NEWS | POLITICS', 'Get our award-winning daily news email featuring exclusive stories, opinion and expert analysis', '', 'I would like to be emailed about offers, event and updates from Evening Standard. Read our privacy notice.', 'Millions more pensioners will get winter fuel payments this year, Rachel Reeves has confirmed after a major U-turn.', 'The Chancellor had restricted the winter fuel allowance to people on Pension Credit or similar benefits, meaning ten million pensioners lost out.', 'But she was forced to change the policy after a backlash from voters, Labour MPs and activists, including at the May local elections which saw a string of victories for Reform UK.', 'Taking questions after a Spending Review speech in Manchester, when she announced transport projects for the North and Midlands, she confirmed that the easing of the controversial policy would take place in time for pensioners to get the payments this winter.', '“We have listened to the concerns that people had about the level of the means test, and so we will be making changes to that, they will be in place so that pensioners are paid this coming winter,” Ms Reeves said.', '“We’ll announce the detail of that and the level of that as soon as we possibly can. But people should be in no doubt that the means test will increase and more people will get a winter fuel payment this winter.”', 'How many more pensioners will get the payment this year has not been revealed.', 'But it is likely to be in the millions - any less would be unlikely to quell the anger at the policy and would be a political blunder leaving Labour vulnerable to Reform UK at the next general election.', 'One idea, being reported in The Times, is for all pensioners denied the payment of up to £300 to get it again, and then for those above the average level of real household disposable income, around £37,000, to have it clawed back through the tax system.', 'Such a scheme would mean around five million more people than currently would be eligible for the allowance.', 'Education Secretary Bridget Phillipson stressed the Government wanted more pensioners to get the payments but ruled out it going to “millionaires”.', 'Reeves and Starmer are losing their grip as rebels sharpen the knives', '‘Bold rewiring’ of economy needed as Tories seek to regain trust, Stride says', 'Bill to create pension ‘megafunds’ and tidy up ‘micro’ retirement savings pots', 'Enter the AXA Startup Angel competition to win £25,000', 'Pension minister Torsten Bell on Wednesday said there is no prospect of returning to a universal winter fuel payment.', 'Speaking to the Work and Pensions Committee, Mr Bell said: ""Directly on your question of is there any prospect of a universal winter fuel payment, the answer is no, the principle I think most people, 95% of people, agree, that it\'s not a good idea that we have a system paying a few hundreds of pounds to millionaires and so we\'re not going to be continuing with that.', '""But we will be looking at making more pensioners eligible.""', 'Mr Bell said he did not have ""lots to add"" to what Sir Keir Starmer had said recently about the allowance.', ""The Prime Minister recently signalled a partial U-turn over the Government's decision to strip winter fuel payments from millions of pensioners."", 'The PM said he wanted to look at widening eligibility for the payments ""as the economy improves"".', ""The decision to means-test the previously universal payment was one of the first announcements by Ms Reeves after Labour's landslide election victory last year and it has been widely blamed for the party's collapse in support."", 'Pension credit is the primary benefit by which pensioners can receive the winter fuel payment.', 'The credit tops up incomes for poorer pensioners and acts as a gateway to additional support, including the winter fuel payment.', 'MORE ABOUT', 'Have your say...', '1', 'FOOTBALL', 'Transfer news LIVE: Arsenal £70m talks, Zubimendi hijack; Mbeumo to Man Utd; Chelsea set Maignan deadline', '', '2', 'POLITICS', ""Cash for visas scandal: Corrupt immigration advisers ‘charge migrants up to £22,000 for skilled worker visas'"", '', '3', 'LONDON', ""Outrage as boy, 8, turned away from treatment at London NHS clinic 'because he attends private school'"", '', '4', 'LONDON', ""Angry friends removing graffiti from Bakerloo line Tube trains ‘doing what Sadiq Khan can’t'"", '', '5', 'POLITICS', 'Winter fuel payments to go to 7.5 million more pensioners after major U-turn, Rachel Reeves announces', '', '']",World,https://news.google.com/api/attachments/CC8iK0NnNW1TRVp6UW1oeE5UaDFVRFZNVFJDZkF4ampCU2dLTWdZcFZaU3VKUWc=-w280-h168-p-df
Winter Fuel Payments details of who is eligible confirmed,https://www.ardrossanherald.com/news/national/uk-today/25224565.winter-fuel-payments-details-eligible-confirmed/,"['The details of which pensioners in England and Wales will receive the winter fuel payment have been confirmed.', 'The payment, worth up to £300, will return for millions this winter, the Chancellor has announced. To be eligible for the winter fuel allowance, a person will need to have reached state pension age by the week starting September 15 this year.', 'Devolved authorities in Scotland and Northern Ireland will each receive a funding uplift so they too can meet the new threshold.', 'Payments will be restored to the vast majority of pensioners who previously received it because anyone with an income of under £35,000 a year will now get the payment automatically ', 'Those with an income above this threshold will also receive the payment, but it will then be reclaimed from them in tax.', 'Pensioners who do not want to receive the payment will be able to opt out, according to the Treasury.', 'The decision to limit the winter fuel payment to only those who claimed pension credit was one of Labour’s first acts in Government, aimed at balancing what was described as a £22 billion “black hole” in the public finances.', 'This meant the number of pensioners receiving the payment was reduced by around 10 million, from 11.4 million to 1.5 million.', 'But Sir Keir Starmer announced there would be a partial U-turn on the policy in May, after it was thought to have contributed to Labour’s drubbing in the local elections.', 'The Treasury claims the new arrangement will cost £1.25 billion in England and Wales, while means-testing winter fuel will save the taxpayer £450 million.', '', 'Chancellor Rachel Reeves said: “Targeting winter fuel payments was a tough decision but the right decision because of the inheritance we had been left by the previous government.', '“It is also right that we continue to means test this payment so that it is targeted and fair, rather than restoring eligibility to everyone including the wealthiest.', '“But we have now acted to expand the eligibility of the winter fuel payment so no pensioner on a lower income will miss out.', '“This will mean over three-quarters of pensioners receiving the payment in England and Wales later this winter.”', 'Some two million pensioners who earn more than £35,000 will see their winter fuel payments clawed back via the taxman, the Treasury estimates.', 'Kemi Badenoch, Leader of the Opposition, claimed the Prime Minister had “scrambled to clear up a mess of his own making”.', 'The Conservative leader added: “I repeatedly challenged him to reverse his callous decision to withdraw winter fuel payments, and every time Starmer arrogantly dismissed my criticisms.', 'hr />', ""Martin Lewis shares 'crucial need to know' energy bill rules"", '“This humiliating U-turn will come as scant comfort to the pensioners forced to choose between heating and eating last winter. The Prime Minister should now apologise for his terrible judgment.”', 'Liberal Democrat Leader Sir Ed Davey said: “Finally the Chancellor has listened to the Liberal Democrats and the tireless campaigners in realising how disastrous this policy was, but the misery it has caused cannot be overstated.', '“Countless pensioners were forced to choose between heating and eating all whilst the Government buried its head in the sand for months on end, ignoring those who were really suffering.', '“We will now study the detail of this proposal closely to make sure those who need support actually get that support. The pain they went through this winter cannot be for nothing.”', ""This website and associated newspapers adhere to the Independent Press Standards Organisation's Editors' Code of Practice. If you have a complaint about the editorial content which relates to inaccuracy or intrusion, then please contact the editor here. If you are dissatisfied with the response provided you can contact IPSO here"", '© 2001-2025. Newsquest Media Group Ltd, 1st Floor, Chartist Tower, Upper Dock Street, Newport, Wales, NP20 1DW | 01676637 |', '', '', '', '', '']",World,https://news.google.com/api/attachments/CC8iK0NnNW1TRVp6UW1oeE5UaDFVRFZNVFJDZkF4ampCU2dLTWdZcFZaU3VKUWc=-w280-h168-p-df
,https://www.barrons.com/news/uk-govt-u-turns-on-scrapping-pensioners-heating-benefit-bfed77dd,"['AFP - Agence France Presse', 'June 09, 2025, 7:04 am EDT', ""Britain's Labour government Monday announced it had reversed a policy to scrap a winter heating benefit for millions of pensioners, following widespread criticism, including from within its own party."", 'The government will raise the income threshold for receiving the subsidy, which ""extends eligibility to the vast majority of pensioners"", or nine million people, the Treasury said in a statement ahead of a key announcement on government spending due Wednesday.', 'ajb/bcp/phz', ""The Barron's news department was not involved in the creation of the content above. This article was produced by AFP. For more information go to AFP.com.\n© Agence France-Presse"", '']",World,https://news.google.com/api/attachments/CC8iK0NnNW1TRVp6UW1oeE5UaDFVRFZNVFJDZkF4ampCU2dLTWdZcFZaU3VKUWc=-w280-h168-p-df
Labour MPs call for action on benefits after winter fuel U-turn,https://www.aol.com/news/labour-mps-call-action-benefits-181250671.html,"['Advertisement', '', '', 'The Brighter Side of News', 'USA TODAY', 'Associated Press', '', '', '', '', '', '', '', '', '', '', '', '', '', '', '', '', '', '', '', '', '', '', '', '', '', '', '', '', '', '', '', '', '', '', '', '', '', '', '', '', '', '', '', '', ""Labour MPs have used the government's U-turn on winter fuel payments to renew their calls for planned benefit cuts to be reversed."", 'Backbenchers broadly welcomed the announcement pensioners in England and Wales with an annual income of £35,000 or less would now be eligible for up to £300 to help with energy bills this winter.', 'They thanked the government for listening to their concerns, arguing means testing was fair but that the threshold for the payment, which was previously for all pensioners, was set too low last year.', 'However, several urged ministers to also think again on planned cuts to disability payments, while others called for the two-child benefit cap to be scrapped.', 'Under planned changes to the benefits system it would be harder for people with less severe conditions to claim personal independence payments (Pips), while the government is promising more support to help people get into work.', 'The two-child benefit cap policy prevents most families from claiming means-tested benefits for any third or additional children born after April 2017, which critics say has pushed people into poverty.', 'Ministers are considering lifting the cap, with a decision expected in the autumn, when a child poverty strategy is published.', ""Pressure from Labour backbenchers over both issues - as well as on winter fuel payments - has been growing since the party's poor performance at local election's in May."", 'The winter fuel payment was previously paid to all pensioners but last year the government announced only those receiving pension credit or another means-tested benefit would be eligible in England and Wales.', 'The original cut last year was estimated to save £1.7bn, with the government arguing it was necessary because of the state of the public finances.', 'But the move, which meant more than 10 million pensioners did not receive the payment in 2024, was criticised by charities, unions, opposition parties and many Labour MPs.', 'Following mounting pressure, Prime Minister Sir Keir Starmer announced a U-turn last month, with the details of who will get the payment this winter set out on Monday.', 'The chancellor said she would detail how the £1.25bn policy would be paid for in the autumn Budget.', 'How much is the winter fuel payment and who will get it?', 'Labour hope to put winter fuel misstep behind them', 'At-a-glance: Key changes to benefits in welfare shake-up', 'Imran Hussain was among the Labour MPs to call for the planned benefit cuts to be scrapped in response to a government statement in the Commons on changes to winter fuel payments.', '""It is clear the government has listened, so I ask them to listen again to the growing calls in this chamber and scrap their planned, devastating cuts to disability support,"" the MP for Bradford East said.', 'Fellow Labour MPs Nadia Whittome and Richard Burgon also welcomed the winter fuel U-turn but urged the government to listen to backbench concerns over benefit cuts.', 'In response, Torsten Bell, who is both a Treasury minister and pensions minister, told MPs there needed to be ""a better system focusing on supporting those who can work into work"".', 'He added that the status quo - where 1,000 people a day are going onto Pips - was not ""a position that anybody should support"".', 'Labour MP Rachael Maskell, who has been a leading campaigner for restoring winter fuel payments, welcomed the government\'s change in policy, saying it was ""long overdue"".', 'She told BBC Radio 4\'s World at One programme the £35,000 salary threshold for the payment was a ""sensible measure"".', 'However, Maskell called on the government to consider a larger payment following increases in energy prices over the past year.', 'The MP for York Central also urged a rethink on planned benefit cuts, adding: ""You can\'t rob disabled people in order to pay older people, that doesn\'t make sense.""', 'Meanwhile, she was among several MPs to reiterate their calls for the government to scrap the two-child benefit cap.', 'In the Commons Rebecca Long Bailey, Labour MP for Salford, also asked for reassurances minsters ""are doing all they can to outline plans to lift the two-child cap on universal credit as soon as possible"" to bring children out of poverty.', 'In response Bell said ""all levers to reduce child poverty are on the table"".', 'The minister added: ""She\'s absolutely right to raise this issue, it is one of the core purposes of this government.', '""We cannot carry on with a situation where large families, huge percentages of them, are in poverty.""', 'The Conservatives have called for the government to apologise to pensioners who lost out on winter fuel payments last year.', 'Shadow work and pensions secretary Helen Whately described the U-turn as ""the most humiliating climbdown a government has ever faced in its first year in office"".', 'She told the Commons ""this rushed reversal raises as many questions as it answers"", arguing the move was ""totally unfunded"" and could lead to tax rises.', 'Liberal Democrat leader Sir Ed Davey said: ""Finally the chancellor has listened to the Liberal Democrats and the tireless campaigners in realising how disastrous this policy was, but the misery it has caused cannot be overstated.', '""Countless pensioners were forced to choose between heating and eating all whilst the government buried its head in the sand for months on end, ignoring those who were really suffering.""', ""Sign up for our Politics Essential newsletter to read top political analysis, gain insight from across the UK and stay up to speed with the big moments. It'll be delivered straight to your inbox every weekday."", 'Advertisement']",World,https://news.google.com/api/attachments/CC8iK0NnNW1TRVp6UW1oeE5UaDFVRFZNVFJDZkF4ampCU2dLTWdZcFZaU3VKUWc=-w280-h168-p-df
Will Labour’s winter fuel U-turn work?,https://www.newstatesman.com/politics/labour/2025/06/will-labours-winter-fuel-u-turn-work,"['New Times,\nNew Thinking.', 'Some inside government fear Rachel Reeves has missed the opportunity to make a moral argument.', 'By George Eaton', 'Winston Churchill believed that “the Americans can always be counted on to do the right thing, once all other possibilities have been exhausted”. The same, one minister tells me, is true of Rachel Reeves and winter fuel payments.', 'Two days before her first Spending Review (which I preview here), Reeves has announced that winter fuel payments will be restored to three-quarters of pensioners (or all those earning below £35,000). The Chancellor wants to use the event to tell a story of pro-growth investment and dispel accusations of austerity – hence this advance U-turn. ', 'As I reported last August, plenty inside government always feared that the original £11,500 earnings threshold – above which the £200-£300 benefit was withdrawn – was too brutal. So it proved. MPs began referring to the policy as Labour’s “original sin” and it was blamed for the party’s dismal performance in the local elections and its defeat to Reform in the Runcorn by-election. ', 'Though Reeves long defended the measure as an emblem of fiscal discipline, the Chancellor herself came to conclude that it was untenable (cabinet colleagues such as Ed Miliband and Liz Kendall had doubts from the start). ', 'Reeves is now making the argument that some new Labour MPs wanted her to deliver from the start: that it is “fair” to withdraw the benefit from the “wealthiest” pensioners (two million earn over £35,000). Such a framing could have opened up a conversation around generational inequality but the policy was instead justified narrowly as a response to the Conservatives’ “£22bn black hole” or an offering to the bond vigilantes.', 'Even now, some inside government fear that an opportunity has been missed to make a values-based argument. Here, for instance, is how Gordon Brown explained his U-turn over the abolition of the 10p income tax rate in 2008. “It really hurt that suddenly people felt I wasn’t on the side of people on middle and modest incomes – because on the side of hard-working families is the only place I’ve ever wanted to be,” he said. “And from now on it’s the only place I ever will be.”', 'But Reeves avoided such a moral narrative today, leaving Labour open to the charge that it has merely U-turned out of political expediency. In recent weeks she and Starmer have also sought to tie the move to an improving economy – growth of 0.7 per cent in the first quarter – yet this creates an additional headache: renewed pressure to reverse other measures (such as the health and disability benefit cuts) even as debt continues to rise. ', 'The winter fuel episode ultimately left Labour looking both unfair and weak, a deadly combination for any government. For Reeves, the test is whether she can now escape from her own history and use this moment to reset her Chancellorship.', '', '', '', 'Related']",World,https://news.google.com/api/attachments/CC8iK0NnNW1TRVp6UW1oeE5UaDFVRFZNVFJDZkF4ampCU2dLTWdZcFZaU3VKUWc=-w280-h168-p-df
The winter fuel payment U-turn in numbers,https://www.bbc.com/news/articles/c79eg2x5qnno,"[""The government's decision to largely reverse its cuts to winter fuel payments has raised questions about its spending and savings plans - and its fiscal rules."", 'BBC Verify has been looking at the the key numbers.', 'At the time Labour won the 2024 general election, the Department for Work and Pensions was projecting that 10.8 million pensioners in England and Wales would be eligible for winter fuel payments in 2024-25.', 'The payments are worth either £200 or £300 per household.', 'The new government, in order to save money, decided that only pensioners in receipt of pension credit (a separate benefit aimed at low-income pensioners) would receive winter fuel payments that winter - and said that would reduce the number of individual recipients to 1.5 million.', 'Now the government has changed course - after widespread criticism - and said that, from 2025-26, all pensioners will get it, although it will be clawed back in the following tax year from individuals earning £35,000 and above.', 'It claims this means about 9 million pensioners will now be eligible..', 'The effect of this is largely to undo the impact of its initial policy in terms of the numbers affected.', 'The government estimated that the cost of the winter fuel payment system it inherited in 2024-25 would have been £1.9bn.', 'It estimated that its initial reform last year would cut this bill by £1.4bn in 2024-25 (rising to £1.5bn in 2025-26) taking the cost of the system down to £0.5bn', 'Now the government says the cost of the system after its latest change will be £1.25bn - a saving of £450m relative to a system in which all pensioners were eligible to receive the payments.', ""The government added that this £450m saving has not yet been certified by the Office for Budget Responsibility (OBR) - the government's official forecaster."", 'But, if it transpired, this saving would be only a third of the original £1.5bn savings target.', 'And some analysts think the overall net saving for the government could actually be lower still.', ""Under Labour's initial 2024 reform, winter fuel payments were only available to those in receipt of a separate benefit aimed at low-income pensioners, called pension credit."", 'Last year, the government initiated a campaign to encourage the hundreds of thousands of pensioners who are eligible for pension credit, but who do not claim it, to start doing so.', ""The latest data shows almost 60,000 more pension credit claims were awarded than otherwise might have been, likely because of the government's awareness campaign."", 'With each annual pension credit claim costing the government £3,900 a year on average, the former Lib Dem pensions minister Steve Webb has calculated that the total annual cost of these new claims could be about £234m.', 'That additional cost would offset around half of the £450m savings claimed by the government for its latest changes to winter fuel eligibility.', 'When Chancellor Rachel Reeves announced the tightening of winter fuel payments in 2024, she said the £1.5bn per year savings were needed to stabilise the public finances.', ""And those savings were entered into the OBR's budget calculations."", ""Now the savings will only be £450m per year - or even lower - a gap of at least £1bn will open up in the government's finances."", 'The Treasury said it will address this gap in the next Budget in the Autumn of 2025 and said ""it will not lead to permanent additional borrowing"".', 'Assuming the OBR does not raise its GDP growth and tax revenue forecasts in the Budget, giving the government more money to fill the gap, this will imply ministers would either have to raise additional taxes or cut spending elsewhere to close this roughly £1bn gap .', 'However, it should be noted that £1bn is a relatively low sum in the context of the public finances.', 'In 2025-26 the government is projected by the OBR to spend £1,347bn and to borrow £129bn.', ""It is also worth noting that the projected savings from the government's working age welfare reforms, announced earlier this year, are considerably higher than the savings from changing eligibility for winter fuel payments."", 'The changes in eligibility for personal independence payments and the cuts to universal credit incapacity payments are projected by the OBR to save the government £4.8bn a year by 2029-30.', 'If the government were to reverse or water down those reforms, as some Labour MPs are urging, it would create a considerably larger financial headache for the chancellor in terms of meeting her fiscal rules.', ""Those rules specify that she has to be projected to be on course to balance the government's day-to-day spending budget (which excludes spending on infrastructure) by 2029-30."", 'In March 2025, the OBR projected that she had just £9.9bn of ""headroom"" against this rule, a very small amount of leeway given the size of overall government spending and borrowing.', 'Reversing the welfare cuts would wipe out around half of it.', ""And many economists expect the chancellor's projected headroom to be further eroded by the OBR in any case in the Autumn Budget as a result of downgraded growth forecasts and an increase in government market borrowing costs in recent months."", 'What do you want BBC Verify to investigate?', 'Copyright 2025 BBC. All rights reserved.  The BBC is not responsible for the content of external sites. Read about our approach to external linking.', ' ', '']",World,https://news.google.com/api/attachments/CC8iK0NnNW1TRVp6UW1oeE5UaDFVRFZNVFJDZkF4ampCU2dLTWdZcFZaU3VKUWc=-w280-h168-p-df
