Title,Link,Paragraphs,Topic,Image
"Hong Kong stocks rise as US, China negotiators gear up for trade talks",https://www.scmp.com/business/markets/article/3313583/hong-kong-stocks-rise-us-china-negotiators-gear-trade-talks,"['Top trade negotiators from the US and China are scheduled to engage in talks in London on Monday', 'The Hang Seng Index rose 1.6 per cent to 24,181.43, its highest point since March 20. The Hang Seng Tech Index jumped 2.8 per cent. On the mainland, the CSI 300 Index added 0.3 per cent and the Shanghai Composite Index gained 0.4 per cent.', 'Online delivery giant Meituan rose 4.7 per cent to HK$148.40 and Kuaishou Technology, owner of a short video platform, advanced 5.6 per cent to HK$62.40 thanks to a strong outlook for its artificial intelligence product.', 'Other major tech stocks also performed well: JD.com added 4.1 per cent to HK$134 and Alibaba Group Holding, owner of the Post, rose 2.3 per cent to HK$119.30.', 'Top trade negotiators from the US and China were scheduled to engage in talks in London on Monday, raising hopes that tariff tensions could ease as both nations sought to bolster their economies.', '']",Business,https://news.google.com/api/attachments/CC8iK0NnNWplbVIzV0V0UlRWSlpUR28xVFJDZkF4ampCU2dLTWdhbEpKU3VtUWs=-w280-h168-p-df
No title found,https://www.reuters.com/world/china/global-markets-view-europe-2025-06-10/,[],Business,https://news.google.com/api/attachments/CC8iK0NnNWplbVIzV0V0UlRWSlpUR28xVFJDZkF4ampCU2dLTWdhbEpKU3VtUWs=-w280-h168-p-df
5 Things to Know Before the Stock Market Opens,https://www.investopedia.com/5-things-to-know-before-the-stock-market-opens-june-02-2025-11746196,"['News of the day for June 2, 2025', 'ANGELA WEISS / AFP via Getty Images', ""U.S. stock futures are pointing lower as investors review comments from China that accused the U.S. of undermining the recent trade agreement between the two countries; President Donald Trump said he would double tariffs on steel imports to 50%, sending U.S. steelmaker stocks higher in premarket trading; Federal Reserve Chair Jerome Powell is set to deliver remarks today; and Blueprint Medicines (BPMC) stock is soaring after French pharmaceutical firm Sanofi (SNY) said it would acquire the U.S. drugmaker. Here's what investors need to know today."", ""U.S. stock futures are pointing lower as investors weigh China's accusation that the U.S. had undermined a trade agreement between the two countries, potentially inflaming trade tensions. Nasdaq futures are 0.5% lower after the tech-heavy index rose by more than 9% in May for its biggest monthly gain since November 2023. S&P 500 futures are down 0.3% after the benchmark index added more than 6% last month, also its biggest advance since November 2023, while Dow Jones Industrial Average futures are dipping 0.2%. Bitcoin (BTCUSD) is lower, trading at just over $104,000. The yield on the 10-year Treasury note is higher. Oil futures are surging roughly 4% and gold futures are up nearly 2% to trade at around $3,375 an ounce."", 'China on Monday said that the U.S. had introduced measures that ""seriously undermine"" the trade agreement between the two countries. China\'s statement follows remarks from President Donald Trump that accused Beijing of being in violation of the deal struck last month in Geneva. China said that moves by the U.S. to issue export control guidelines for AI chips, stop the sale of chip design software to China, and revoke Chinese student visas were among the violations of the agreement.\n1', 'President Trump said Friday that he would double tariffs on steel imports to 50%, sending shares of U.S. steelmaker Cleveland-Cliffs (CLF) soaring 25% in premarket trading, while those of Steel Dynamics (STLD) and Nucor (NUE) are jumping around 10%. Tariffs of 25% on steel and aluminum went into effect on March 12, part of Trump\'s stated goal of bringing more metal production to the U.S., which imports nearly a quarter of its supplies of steel. The move comes amid Trump\'s endorsement of a ""partnership"" between U.S. Steel (X) and Japan\'s Nippon Steel after former President Joe Biden blocked Nippon\'s proposed acquisition.', ""Federal Reserve Chair Jerome Powell is scheduled to deliver remarks today at 1 p.m. ET at an event hosted by the central bank. Powell's comments come after he met last week with President Trump, who has been pressuring the Fed to lower interest rates, and as price pressures eased again in April. Fed officials have said they are monitoring inflation for signs of price increases from Trump's tariffs. Powell’s comments follow remarks from Fed Governor Christopher Waller, who this weekend said that interest rate cuts could be on the table later this year.\n2"", 'Shares of Blueprint Medicines (BPMC) are soaring 27% in premarket trading as French pharmaceutical firm Sanofi (SNY) said it would acquire the U.S. drugmaker for up to $9.5 billion.\n3\nThe deal would give Sanofi access to Blueprint\'s treatment for systemic mastocytosis (SM), a rare immunological disease. ""Blueprint\'s established presence among allergists, dermatologists, and immunologists is expected to enhance Sanofi’s growing immunology pipeline,"" Sanofi said. U.S.-listed shares of Sanofi are down less than 1%.', '', '', '']",Business,https://news.google.com/api/attachments/CC8iK0NnNWplbVIzV0V0UlRWSlpUR28xVFJDZkF4ampCU2dLTWdhbEpKU3VtUWs=-w280-h168-p-df
"US stocks end mostly up on hopes of trade deal with China, but key inflation report ahead",https://www.usatoday.com/story/money/markets/2025/06/09/stocks-us-china-trade-talks/84106602007/,"['U.S. stocks closed mostly higher on expectations China will export rare earths in exchange for looser China access to semiconductors from the U.S.', '""I expect this to be a short meeting with a big strong handshake,"" Kevin Hassett, director of the National Economic Council, said in a CNBC interview about talks overnight between the U.S. and China in London.', '“Our expectation is that ... immediately after the handshake, any export controls from the U.S. will be eased, and the rare earths will be released in volume, and then we can go back to negotiating smaller matters,"" he added. Shares of Nvidia and AMD rose, while stock of the largest U.S rare earth miner, MP Materials, rallied 7.81%.', 'The talks follow a phone call between Trump and Chinese President Xi Jinping after Trump accused China of violating terms of a tariff pause agreed on last month in Switzerland.', 'The blue-chip Dow closed flat, or just 1.11 points lower, to 42,761.76; the broad S&P 500 gained 0.09%, or 5.52 points, to 6,005.88; and the tech-heavy Nasdaq added 0.31%, or 61.28 points, to 19,591.24. All three indexes closed higher last week, and the S&P 500 topped the 6,000 mark for the first time since Feb. 21 and is now around 2% from its record high. The benchmark 10-year Treasury yield fell to 4.478%.', 'Inflation data due this week and how the Senate may vote on the more than 1,000-page tax bill before it will also be scrutinized.', 'The May consumer price index report, due midweek, could provide insight into whether the tariff rollercoaster is reviving inflation. It is the first full month of data since President Donald Trump announced his aggressive tariff plan on April 2. Many of the harshest tariffs have been rolled back or paused, but some have kicked in.', 'Wholesale price data are due the next day and could give investors an idea of whether there is inflation coming down the pipeline to Americans. Wholesale prices are what businesses pay for their goods and services.', 'At the end of the week, a new consumer sentiment reading from the University of Michigan also includes data on inflation expectations.', 'Earlier, a survey by the New York Federal Reserve showed consumers expect lower inflation over the next year than they did a month ago.', 'Investors will also continue to watch the path of the so called ""One, Big Beautful bill"" in the Senate after a public and fierce tit-for-tat social media exchange between Tesla chief executive Elon Musk and Trump. Musk said the ""pork-filled Congressional spending bill is a disgusting abomination,"" and Trump called Musk ""crazy.""', 'Cryptocurrency platform Gemini said it confidentially submitted a draft registration statement with the Securities and Exchange Commission (SEC) for an initial public offering of class A shares. The IPO is expected after the SEC review process, it said in a release.', 'Bitcoin was last up 2.79% at $108,720.70.', 'This story was updated with new information.', 'Medora Lee is a money, markets, and personal finance reporter at USA TODAY. You can reach her at mjlee@usatoday.com and subscribe to our free Daily Money newsletter for personal finance tips and business news every Monday through Friday.']",Business,https://news.google.com/api/attachments/CC8iK0NnNWplbVIzV0V0UlRWSlpUR28xVFJDZkF4ampCU2dLTWdhbEpKU3VtUWs=-w280-h168-p-df
US Dollar Index (DXY) returns below 99.00 with all eyes on the US-China meeting,https://www.fxstreet.com/news/us-dollar-index-dxy-returns-below-9900-with-all-eyes-on-the-us-china-meeting-202506090816,"['The Dollar is featuring the weakest performance of the G8 currencies on Monday as investors shifted their focus from the upbeat US Nonfarm Payrolls report to the trade negotiations between the US and China, due later today in London.\n\nThe USD Index (DXY), which measures the value of the Greenback against the world’s six most traded currencies, is accelerating its reversal from post-NFP highs, at 99.35 on Friday, back to levels below 99.00.', 'Investors are trimming their US Dollar long bets on Monday, in a cautious stance ahead of a meeting between China and US representatives, which will try to brush off their differences on trade, and revive the spirit that led to a reduction of their reciprocal tariffs after last month’s talks in Geneva.\n\nA phone call between US President Donald Trump and his Chinese counterpart, Xi Jinping, last week eased some of the previous tensions and has improved expectations about today’s meeting. Trump has contributed to the optimistic market mood with a tweet over the weekend showing his confidence that the negotiations will go “very well”.\n\nThe calendar is thin on Monday, and the effect of Friday’s stronger-than-expected US Payrolls data is waning. The Fed is on its blackout period, ahead of next week’s meeting, which is likely to be a non-event, as Friday’s employment report has practically confirmed that the bank will keep interest rates unchanged, at least until September.', 'Generally speaking, a trade war is an economic conflict between two or more countries due to extreme protectionism on one end. It implies the creation of trade barriers, such as tariffs, which result in counter-barriers, escalating import costs, and hence the cost of living.', '', '', '', '', 'Information on these pages contains forward-looking statements that involve risks and uncertainties. Markets and instruments profiled on this page are for informational purposes only and should not in any way come across as a recommendation to buy or sell in these assets. You should do your own thorough research before making any investment decisions. FXStreet does not in any way guarantee that this information is free from mistakes, errors, or material misstatements. It also does not guarantee that this information is of a timely nature. Investing in Open Markets involves a great deal of risk, including the loss of all or a portion of your investment, as well as emotional distress. All risks, losses and costs associated with investing, including total loss of principal, are your responsibility. The views and opinions expressed in this article are those of the authors and do not necessarily reflect the official policy or position of FXStreet nor its advertisers. The author will not be held responsible for information that is found at the end of links posted on this page.', 'If not otherwise explicitly mentioned in the body of the article, at the time of writing, the author has no position in any stock mentioned in this article and no business relationship with any company mentioned. The author has not received compensation for writing this article, other than from FXStreet.', 'FXStreet and the author do not provide personalized recommendations. The author makes no representations as to the accuracy, completeness, or suitability of this information. FXStreet and the author will not be liable for any errors, omissions or any losses, injuries or damages arising from this information and its display or use. Errors and omissions excepted.', 'The author and FXStreet are not registered investment advisors and nothing in this article is intended to be investment advice.', '', 'CFDs are complex instruments and come with a high risk of losing money rapidly due to leverage. 81.4% of retail investor accounts lose money when trading CFDs with this provider. You should consider whether you understand how CFDs work, and whether you can afford to take the high risk of losing your money.', 'Forex trading and trading in other leveraged products involves a significant level of risk and is not suitable for all investors.', 'Risk Warning: CFDs are complex instruments and come with a high risk of losing money rapidly due to leverage...', '', '', '', 'GBP/USD edges lower in the European session on Tuesday but manages to hold above 1.3550. The data from the UK showed that the ILO Unemployment Rate rose to 4.6% in the three months to April, as expected. Markets await the outcome of US-China trade talks.', ""The EUR/USD pair struggles to capitalize on the previous day's move higher and attracts fresh sellers near the 1.1435 region during the Asian session on Tuesday. The intraday slide is sponsored by a goodish pickup in the US Dollar demand and drags spot prices back below the 1.1400 round figure in the last hour."", 'Gold price struggles to capitalize on the previous day’s bounce from a one-week trough. The emergence of some USD buying and trade optimism weighed on the XAU/USD pair. Fed rate cut bets, US fiscal concerns, and geopolitical risks could support the commodity.', 'Hyperliquid, the decentralized perpetual trading platform and Layer 1 blockchain, is extending its gains on Tuesday, just inches away from the all-time high of $39.96. On-chain and derivatives data support the price rally as HYPE’s Open Interest and Total Value Locked are rising.', 'Tesla (TSLA) stock is facing one of its worst trading sessions in a long time on Thursday. Shared closed above $332 on Wednesday, but at the time of writing late in the afternoon session, TSLA has traded below $274, suffering a 17% sell-off.', ""SPONSORED\nDiscover the top brokers for trading EUR/USD in 2025. Our list features brokers with competitive spreads, fast execution, and powerful platforms. Whether you're a beginner or an expert, find the right partner to navigate the dynamic Forex market."", '©2025 ""FXStreet"" All Rights Reserved', 'Note: All information on this page is subject to change. The use of this website constitutes acceptance of our user agreement. Please read our privacy policy and legal disclaimer.', 'Trading foreign exchange on margin carries a high level of risk and may not be suitable for all investors. The high degree of leverage can work against you as well as for you. Before deciding to trade foreign exchange you should carefully consider your investment objectives, level of experience and risk appetite. The possibility exists that you could sustain a loss of some or all of your initial investment and therefore you should not invest money that you cannot afford to lose. You should be aware of all the risks associated with foreign exchange trading and seek advice from an independent financial advisor if you have any doubts.', 'Opinions expressed at FXStreet are those of the individual authors and do not necessarily represent the opinion of FXStreet or its management. FXStreet has not verified the accuracy or basis-in-fact of any claim or statement made by any independent author: errors and omissions may occur. Any opinions, news, research, analyses, prices or other information contained on this website, by FXStreet, its employees, clients or contributors, is provided as general market commentary and does not constitute investment advice. FXStreet will not accept liability for any loss or damage, including without limitation to, any loss of profit, which may arise directly or indirectly from use of or reliance on such information.']",Business,https://news.google.com/api/attachments/CC8iK0NnNWplbVIzV0V0UlRWSlpUR28xVFJDZkF4ampCU2dLTWdhbEpKU3VtUWs=-w280-h168-p-df
MONEY REPORT,https://www.nbcdfw.com/news/business/money-report/asia-pacific-markets-set-to-mostly-climb-as-investors-await-details-of-u-s-china-trade-talks/3859705/,"['Aerial view by drone of Tokyo Cityscape with Tokyo Sky Tree visible in Tokyo city, Japan on sunrise.', ""This is CNBC's live blog covering Asia-Pacific markets."", 'Asia-Pacific markets climbed Tuesday as investors awaited further details on the U.S.-China trade talks, which were slated to continue for a second day.', '', ""Officials from both countries held trade talks in London on Monday, with U.S. Treasury Secretary Scott Bessent, Commerce Secretary Howard Lutnick and Trade Representative Jamieson Greer meeting with their Chinese counterparts led by Beijing's Vice Premier He Lifeng."", 'Christian Floro, market strategist at Principal Asset Management foresees that the ""market backdrop will remain uncertain in the period ahead,"" in light of the ""fluid nature of trade policy.""', '', 'Urging investors to prepare for continued market volatility, Floro noted that now is an opportune time to look at ""previously overlooked value-oriented stocks and international equities.""', 'He identified investment opportunities in domestic-oriented sectors such as utilities, real estate and financials which are typically less sensitive to trade-related shocks. Pockets of opportunities can also be found in software and internet companies, Floro added in a Tuesday note.', ""Japan's benchmark Nikkei 225 climbed 0.92%, while the broader Topix index increased by 0.43%."", '', 'In South Korea, the Kospi index advanced 0.42%, while the small-cap Kosdaq added 0.77%.', ""Mainland China's CSI 300 index moved up 0.16% while Hong Kong's Hang Seng Index rose 0.33%."", 'Over in Australia, the S&P/ASX 200 benchmark advanced 0.73%.', ""Meanwhile, India's benchmark Nifty 50 BSE Sensex started the day flat."", 'U.S. stock futures rose in Asian hours, after President Donald Trump said that the talks with China were going well and he was ""only getting good reports,"" according to Reuters.', 'Overnight stateside, moves on all three key benchmarks on Wall Street were muted. The broad-based S&P 500 inched up 0.09% and notched a second winning session, closing at 6,005.88. The Nasdaq Composite climbed 0.31% to end at 19,591.24. The Dow Jones Industrial Average ticked down 1.11 points and closed at 42,761.76.', ""— CNBC's Pia Singh and Jesse Pound contributed to this report."", 'Shares of South Korean supermarket chains took a beating Tuesday, after the ruling Democratic Party of Korea reportedly proposed a bill mandating the closure of large chains on public holidays.', 'Losses were led by Lotte Shopping, which had plunged 8.3% and Emart, which retreated 7.95% as of 12.22 p.m. local time.', 'Shares of Shinsegae, which owns Emart, were also down 1.29%, while Hyundai Department Store fell 5.4%.', '— Amala Balakrishner', ""Taiwan's benchmark Taiex index surged 2.01% to hit 22,229.80 as of 11.01 a.m. local time, its highest level since Mar. 26."", 'The advance was led by the technology, energy, and basic materials sectors, according to data from LSEG.', 'The top three performers were Mercuries Data Systems and Fittech which advanced by 9.94% each, and Bonny Worldwide which added 9.91%.', 'Meanwhile, shares of tech giants Taiwan Semiconductor Manufacturing Co and Hon Hai Precision Industry — known globally as Foxconn — were last seen trading 2.99% and 0.65% higher, respectively.', ""The iShares MSCI Taiwan ETF shows the index's moves:"", '— Amala Balakrishner', 'Asia-Pacific currencies mostly weakened against the greenback Tuesday as investors awaited updates on trade negotiations between the U.S. and China.', 'The U.S. dollar index, which measures the currency against six major rivals, moved up 0.31% to 99.251 as of 10.45 a.m. Singapore time, after falling the day before.', 'The Japanese yen depreciated 0.26% against the dollar to 144.98, after Finance Minister Katsunobu Kato reportedly said that the government will conduct appropriate debt management policies while having close communication with market participants.', 'Similarly, the South Korean won weakened 0.33% against the dollar to 1,358.56.', ""Meanwhile, China's offshore yuan and the Australian dollar traded flat against the greenback at 7.1839 and 0.6513, respectively."", '— Amala Balakrishner', 'Oil prices continued to rise Tuesday, following expectations of a resumption in U.S.-China trade talks for a second day, after reports of progress on the first day.', 'Brent Crude remained above $67 per barrel after rising nearly 1% to its highest level since Apr. 28 on Monday.', 'As at 9.20 a.m. Singapore time, Brent Crude was up 0.25% to $67.21 per barrel.', 'Meanwhile, the West Texas Intermediate crude added 0.23% to $65.44, after hitting its highest level since Apr. 4 earlier in the session.', 'The moves come alongside a weaker dollar.', ""China is the world's largest importer of oil, so progress in trade negotiations between the two superpowers could ease fears of weaker energy demand and a weaker global economic outlook."", '— Amala Balakrishner', ""Investors have become weary from President Donald Trump's tariff policy rollout that has sent stocks on a rollercoaster, according to Ed Yardeni of Yardeni Research."", '""The market\'s become very jaded about these tariffs, and rightly so,"" Yardeni said on CNBC\'s ""Squawk on the Street"" Monday morning.', '""The game changes all the time,"" Yardeni said. ""On balance, it\'s in everybody\'s interest to come up with some solution to this that doesn\'t cause a recession in any country, or certainly not in the world economy.""', '— Alex Harring', '', '', '', '', '', '', '', '']",Business,https://news.google.com/api/attachments/CC8iK0NnNWplbVIzV0V0UlRWSlpUR28xVFJDZkF4ampCU2dLTWdhbEpKU3VtUWs=-w280-h168-p-df
