Title,Link,Paragraphs,Topic,Image
S&P 500 posts back-to-back gain as traders optimistic U.S-China trade talks making progress: Live updates,https://www.cnbc.com/2025/06/08/stock-market-today-live-updates.html,"['', 'The S&P 500\nclosed marginally higher on Monday as President Donald Trump’s officials met with their Chinese counterparts in an effort to resolve trade issues between the two economic giants.', 'The broad market index added 0.09% and notched a second winning session, closing at 6,005.88. The Nasdaq Composite\nclimbed 0.31% to end at 19,591.24.The Dow Jones Industrial Average\nticked down 1.11 points and closed at 42,761.76.', 'Officials from the U.S. and China held trade talks on Monday in London, with U.S. Treasury Secretary Scott Bessent, Commerce Secretary Howard Lutnick and Trade Representative Jamieson Greer representing the U.S. National Economic Council Director Kevin Hassett told CNBC on Monday that the U.S. was seeking confirmation that China would restore critical mineral exports.', '“The purpose of the meeting today is to make sure that they’re serious … to literally get handshakes … and get this thing behind us,” Hassett said on CNBC’s “Squawk Box.” “Our expectation is that … immediately after the handshake, any export controls from the U.S. will be eased, and the rare earths will be released in volume, and then we can go back to negotiating smaller matters.”', 'The talks are set to continue on Tuesday morning, a source familiar with the situation told CNBC. The meeting in London comes after Trump and Chinese President Xi Jinping held a lengthy phone call last week. Last month, the two countries agreed to temporarily cut tariffs while trade negotiations proceeded.', 'Shares of several semiconductor companies rose on Monday. Qualcomm\njumped more than 4% after the chipmaker announced it will acquire semiconductor firm Alphawave for $2.4 billion. Shares of Advanced Micro Devices\nadded 4.8% and Texas Instruments\nrose 3.5%, while Nvidia shares ticked higher. Alibaba\ngained 1.8%.', '“Investors are taking bullish trades today on China large caps and U.S. semiconductor stocks, which are both beneficiaries of U.S./China trade talks,” said Larry Tentarelli, chief technical strategist for Blue Chip Daily Trend Report.', 'Separately, Apple\nshares lost 1.2% as the company held its 2025 Worldwide Developers Conference, during which it announced its first new iPhone operating system redesign since 2013.', 'Inflation data is expected to be a key topic later in the week. The latest consumer price index is due out on Wednesday, followed by the producer price index on Thursday. Traders will be looking for clues as to how the current tariff rates are flowing through the economy.', 'Monday’s moves come after all three of the major indexes notched their second-straight winning week. The S&P 500 on Friday closed above the 6,000 level for the first time since Feb. 21.', 'Correction: The producer price index will be released Thursday morning. A previous version of this story misstated the timing.', 'The Dow Jones Industrial Average\nclosed lower by just 1.11 points to end at 42,761.76. The S&P 500\nedged higher by just 0.09%, closing at 6,005.88, while the Nasdaq Composite\nadvanced 0.31% and settled at 19,591.24.', '— Pia Singh', 'Trade talks between the U.S. and China in London will continue on Tuesday morning, a source familiar with the situation told CNBC’s Megan Casella.', 'President Donald Trump said that “he’s only getting good reports” from the talks but has not yet had a phone call with his team.', '— Jesse Pound', 'Bond yields advancing can put a lid on the stock market’s bounce, according to JPMorgan.', 'Stocks originally cratered after President Donald Trump announced his plan for broad and steep tariffs in April. But the market has regained lost ground after Trump rolled back much of those duties. Still, the S&P 500\nhas yet to return to all-time highs notched earlier this year.', '“Big picture, our view is that activity-inflation tradeoff is likely to deteriorate into the summer, with potentially rising bond yields, which is set to arrest the equity rebound seen over the past two months,” Mislav Matejka, head of global and European equity strategy at JPMorgan, wrote to clients in a Monday note.', '— Alex Harring', 'Investors have become weary from President Donald Trump’s tariff policy rollout that has sent stocks on a rollercoaster, according to Ed Yardeni of Yardeni Research.', '“The market’s become very jaded about these tariffs, and rightly so,” Yardeni said on CNBC’s “Squawk on the Street” Monday morning.', '“The game changes all the time,” Yardeni said. “On balance, it’s in everybody’s interest to come up with some solution to this that doesn’t cause a recession in any country, or certainly not in the world economy.”', '— Alex Harring', 'The recent gains in the market could be approaching a standstill, if history is any indication, according to Raymond James.', '“It’s easy to forget, this is seasonally normal, as early march-early June is a seasonally strong period for the equity market historically, but this tends to fade into the ‘summer doldrums’ starting right about now,” Tavis McCourt, an institutional equity strategist at the firm, wrote in a recent note. “It’s unclear why this trend persists, but our guess is increasing worries over 2H EPS ramps (which this year appear very optimistic), combined with tax loss selling later in September/October.”', '— Sean Conlon', 'National Security Council Director Kevin Hassett expressed confidence Monday that trade talks with Chinese leaders will yield results.', '“Really, the purpose of the meeting today is to make sure that they’re serious ... to literally get handshakes ... and get this thing behind us,” Hassett said on CNBC’s “Squawk Box.” “I expect it to be a short meeting with a big, strong handshake.”', 'Assuming that happens, Hassett predicted movement on some of the larger issues separating the two sides.', '“So our expectation is that ... immediately after the handshake, any export controls from the U.S. will be eased, and the rare earths will be released in volume, and then we can go back to negotiating smaller matters,” he said.', '—Jeff Cox', 'Morgan Stanley has shed some of its optimism on Lululemon\nand is moving to the sidelines on the stock.', 'The firm downgraded stock in the athleisure company to equal weight from overweight in a Sunday note, and lowered its price target to $280 per share from $346. Morgan Stanley’s forecast calls for about 6% upside from Friday’s $265.27 close.', '“We’re downgrading LULU to Equal-weight on lesser confidence in positive Americas comp inflection, the inability for the stock to work until this KPI shows consistent improvement, fair-to-high M-T Street estimates, & reasonable valuation for that set-up,” analyst Alex Straton said.', '— Brian Evans', 'Check out the companies making the biggest moves midday:', 'For the full list, read here.', '— Pia Singh', 'Shares of IonQ jumped 2.8% after the company said it is acquiring United Kingdom-based quantum computing startup Oxford Ionics in a deal worth nearly $1.1 billion.', '“We believe the advantages of our combined technologies will set a new standard within quantum computing and deliver superior value for our customers through market-leading enterprise applications,” IonQ CEO Niccolo De Masi in a Monday release.', '— Pia Singh', 'The ARK Fintech ETF\n(ARKF) rose slightly Monday to hit its highest level since December 2021. The rally is led by the newly public Circle\n, which jumped about 16% and has skyrocketed 300% from the IPO price of $31.', 'The ETF’s top holdings include Shopify\n, Robinhood\n, Coinbase\nand Circle. The fund is up 20% this year.', '— Yun Li', 'The iShares U.S. Aerospace & Defense ETF (ITA)\nrose 0.2% in morning trading, putting the fund on track for its 11th consecutive positive session. That would tie the longest winning streak on record for the fund, which was launched in 2006. The previous streak came in 2009.', 'ITA is now up 25% year to date, led by Howmet Aerospace\n, GE Aerospace\nand Kratos Defense\n.', '— Jesse Pound, Nick Wells', 'The Dow Jones Industrial Average\nwas trading 42 points, or 0.1%, lower shortly after the opening bell. The S&P 500\nrose by less than 0.1%, while the Nasdaq Composite\nadded about 0.15%.', '— Pia Singh', 'Shares of Robinhood dropped more than 3% in premarket trading as the online brokerage was snubbed in the latest quarterly rebalance of the S&P 500 after months of speculation that it could earn a coveted spot in the benchmark.\n\nThe stock has rallied 3.3% Friday to bring last week’s gain to over 13% before the S&P Dow Jones Indices said after the bell that the S&P 500 would remain unchanged.', 'Just last week, Bank of America called Robinhood a top candidate to join the S&P 500 during the big reshuffling in June. The S&P 500 rebalance, which typically comes on the third Friday of the last month in a quarter, is usually an impactful event as it can spark billions of dollars of trading and spur passive funds to snap up its shares.', '— Yun Li', 'Some stocks are making big moves in the premarket Monday:', 'Read here for the full list of names.', '— Sean Conlon', 'Warner Bros. Discovery\nannounced Monday that it plans to split into two public companies by the middle of next year.', 'The company will split into Streaming and Studios, which will include its movie properties and streaming service HBO Max, and Global Networks, which will include CNN, TNT Sports and Discovery.', 'Shares of Warner Bros. Discovery were halted in premarket trading Monday morning. The stock is down roughly 7% year to date. For more on the split, read here.', '— Jacob Pramuk, Pia Singh', 'Asian markets climbed Monday as investors awaited trade talks between Washington and Beijing later in the day, and digested China inflation and trade data.', 'China’s consumer price inflation fell by 0.1% year on year in May, smaller than the 0.2% decline forecast by economists polled by Reuters, while the producer price index declined 3.3%, compared to a 3.2% drop expected by analysts.', 'Mainland China’s CSI 300 index rose 0.29% to end the day at 3,885.25 while Hong Kong’s Hang Seng Index added 1.63% to 24,181.43, and the tech-heavy Hang Seng Tech index\nsurged 2.78% to 5,433.23.', 'Japan’s benchmark Nikkei 225 added 0.92% to end the day at 38,088.57, while the broader Topix index rose 0.58% to 2,785.41.', 'The country’s GDP contraction for the January to March quarter narrowed to an annualized 0.2%, from the 0.7% print released previously, revised estimates showed.', 'In South Korea, the Kospi index climbed 1.55% to end the day at 2,855.77 while the small-cap Kosdaq rose 1.06% to 764.21.', 'India’s benchmark Nifty 50 was up 0.43%, while the BSE Sensex added 0.37% as at 1.45 p.m. Indian Standard Time.', 'Australian markets were closed for a public holiday.', '— Amala Balakrishner', 'S&P Dow Jones Indices did not announce any changes to the S&P 500 lineup on Friday, which was rebalance announcement date for the second quarter.', 'Robinhood\nwas widely speculated as a leading candidate for inclusion, and the stock rose 13% last week. Shares retreated in extended trading Friday.', 'S&P Dow Jones Indices had already made an intra-quarter change by adding Coinbase\nto the S&P 500 in May, replacing Discover Financial Services.', '— Jesse Pound', 'Apple\n’s developers conference this week is an opportunity for one of the market’s biggest stocks to find its footing again.', 'Shares of the iPhone maker are down more than 18% year to date and have not enjoyed the same bounce-back from the early April tariff sell-off as the broader market.', 'One issue for Apple is that it doesn’t seem to be benefitting from the AI boom in the same way as its Big Tech brethren. Investors will be looking for information about AI features for Apple products and how the company is navigating the evolving tariff landscape.', 'CEO Tim Cook is slated to give a keynote address at 1 p.m. ET on Monday.', '— Jesse Pound', 'Futures were calm when trading resumed on Sunday evening, with the three main futures contracts drifting marginally higher.', '— Jesse Pound', 'The communication services group was the top performing sector in the S&P 500 last week, gaining 3.19%. The sector’s three-biggest stocks — Alphabet\n, Meta Platforms\nand Netflix\n— all finished higher on the week.', 'Meanwhile, consumer staples was the worst performing sector, sinking 1.57%.', 'Small caps were another bright spot, as the Russell 2000\ngained 3.19% for its eighth positive week in 9.', '— Jesse Pound, Christopher Hayes', 'Got a confidential news tip? We want to hear from you.', 'Sign up for free newsletters and get more CNBC delivered to your inbox', 'Get this delivered to your inbox, and more info about our products and services.', '© 2025 CNBC LLC. All Rights Reserved. \nA Division of NBCUniversal', 'Data is a real-time snapshot *Data is delayed at least 15 minutes. Global Business and Financial News, Stock Quotes, and Market Data and Analysis.', 'Data also provided by', '', '', '', '', '', '', '', '']",Business,https://news.google.com/api/attachments/CC8iK0NnNWplbVIzV0V0UlRWSlpUR28xVFJDZkF4ampCU2dLTWdhbEpKU3VtUWs=-w280-h168-p-df
Dollar keeps lower awaiting details on US-China trade talks in London,https://www.forexlive.com/news/dollar-keeps-lower-awaiting-details-on-us-china-trade-talks-in-london-20250609/,"['', '', '', '', '', '', 'For now at least, the dollar is holding lower as the woes continue for the currency. USD/JPY is down 0.5% to near 144.00 after backing away from another run up to 145.00 at the end of last week. Meanwhile, AUD/USD buyers are starting to test the waters for a firmer break above the 0.6500 mark so that is one to watch out for as well.', 'Traders are keenly awaiting details on US-China trade talks in London today but so far there is no word on when exactly it will happen.', 'The two sides are no doubt scrambling to sort out an agenda, with market players definitely eyeing discussions about rare earth supplies. China is even seen offering a gesture of goodwill here. So, that will at least help to ease some of the tensions before the two sides meet later in the day.', 'That being said, it is still doubtful that we will see any material progress. There were nice words exchanged in Geneva but not much real headway after. And I would expect the same to be seen this time around as well.', ""Sure, there might be some gestures of amity to be expected after. But a proper trade deal and one that will see both sides honour it? Still a pipedream more than anything else if you'd ask me."", 'Tags', 'Top Brokers', 'Sponsored', 'Most Popular', '', 'Stock Daily Updates', 'Must Read', 'Follow Us', 'Read our Terms, Cookies and Privacy Notice', 'HIGH RISK WARNING: Foreign exchange trading carries a high level of risk that may not be suitable for all investors. Leverage creates additional risk and loss exposure. Before you decide to trade foreign exchange, carefully consider your investment objectives, experience level, and risk tolerance. You could lose some or all your initial investment; do not invest money that you cannot afford to lose. Educate yourself on the risks associated with foreign exchange trading and seek advice from an independent financial or tax advisor if you have any questions.', 'ADVISORY WARNING: FOREXLIVE™ is not an investment advisor, FOREXLIVE™ provides references and links to selected news, blogs and other sources of economic and market information for informational purposes and as an educational service to its clients and prospects and does not endorse the opinions or recommendations of the blogs or other sources of information. Clients and prospects are advised to carefully consider the opinions and analysis offered in the blogs or other information sources in the context of the client or prospect\'s individual analysis and decision making. None of the blogs or other sources of information is to be considered as constituting a track record. Past performance is no guarantee of future results and FOREXLIVE™ specifically hereby acknowledges clients and prospects to carefully review all claims and representations made by advisors, bloggers, money managers and system vendors before investing any funds or opening an account with any Forex dealer. Any news, opinions, research, data, or other information contained within this website is provided on an ""as-is"" basis as a general market commentary and does not constitute investment or trading advice, and we do not purport to present the entire relevant or available public information with respect to a specific market or security. FOREXLIVE™ expressly disclaims any liability for any lost principal or profits which may arise directly or indirectly from the use of or reliance on such information, or with respect to any of the content presented within its website, nor its editorial choices.', 'DISCLAIMER: FOREXLIVE™ may be compensated by the advertisers that appear on the website, based on your interaction with the advertisements or advertisers.', 'Finance Magnates CY Limited', '', '', '', '', '', '']",Business,https://news.google.com/api/attachments/CC8iK0NnNWplbVIzV0V0UlRWSlpUR28xVFJDZkF4ampCU2dLTWdhbEpKU3VtUWs=-w280-h168-p-df
No title found,https://www.reuters.com/business/wall-street-futures-slip-after-trumps-steel-aluminum-tariff-threats-2025-06-02/,[],Business,https://news.google.com/api/attachments/CC8iK0NnNWplbVIzV0V0UlRWSlpUR28xVFJDZkF4ampCU2dLTWdhbEpKU3VtUWs=-w280-h168-p-df
"CNBC Daily Open: If U.S.-China talks go well, analysts think the S&P 500 could hit new high",https://www.cnbc.com/2025/06/10/cnbc-daily-open-if-us-china-talks-go-well-sp-could-hit-new-high.html,"['', 'In this article', 'Taken from CNBC’s Daily Open, our international markets newsletter — Subscribe today', 'Trade negotiators from the U.S. and China have met in London, and talks are expected to continue Tuesday, a source familiar with the situation told CNBC’s Megan Casella.', 'At the top of the agenda for America appears to be a relaxation of China’s rare earths export curbs, according to a CNBC interview with U.S. National Economic Council Director Kevin Hassett. If China’s actions late last week — when it seemingly gave Western automakers concessions regarding those minerals — are any indication, Beijing could be willing to accede to the U.S. request.', 'But the world’s second-biggest economy would demand reciprocity. On June 2, Beijing bristled at Washington’s tighter grip on exports of chip design software to China. But it appears that Washington is also in a conciliatory mood. “Our expectation is that … immediately after the handshake, any export controls from the U.S. will be eased,” Hassett said on CNBC’s “Squawk Box.”', 'If the U.S.-China talks go well, there’s a chance the S&P 500, only around 2% off its February high as of Tuesday morning Singapore time, could reach a new peak, noted the JPMorgan trading desk.', 'That’d be something to cheer, of course. But it’s slightly upsetting to realize that the S&P could have continued scaling heights from February, or at least broken its closing high much earlier in the year, if not for truculent trade policy from the White House — which, as is evident from the meeting between U.S. and China, governments now are still trying to undo.', 'U.S.-China talks set to go into Day 2\nU.S. President Donald Trump’s top trade officials met Chinese counterparts in London on Monday for talks aimed at resolving their trade dispute — particularly with regard to mineral exports. Discussions are set to continue Tuesday. Late last week, in an apparent olive branch, China seemed to offer U.S. and European auto giants something of a reprieve regarding its exports of rare earth elements.', 'Stocks in the U.S. rose marginally\nU.S. stocks edged up Monday. The S&P 500\nadded 0.09%, the Dow Jones Industrial Average\nwas mostly flat, and the Nasdaq Composite\nrose 0.31%. Europe’s Stoxx 600\nindex dipped 0.07%.  Shares of chip designer Alphawave jumped 20% on a takeover by U.S. semiconductor giant Qualcomm, while Spectris soared 60% after confirming it is in talks over a takeover deal with private equity group Advent International.', 'A new ‘Liquid Glass’ look for Apple’s iOS\nApple\nheld its annual Worldwide Developers Conference keynote on Monday. At the event, the company announced a redesign to its iOS system called “Liquid Glass,” a virtual glass look that was inspired by the Vision Pro; real-time translation to calls, texts and FaceTime; new gaming, video and enterprise features for its augmented reality device Vision Pro; a new version of its Mac operating system, named Tahoe.', 'UK in a ‘Goldilocks’ moment: Nvidia CEO\n“The U.K. is in a Goldilocks circumstance,” Nvidia CEO Jensen Huang said Monday on a panel with British Prime Minister Keir Starmer and Investment Minister Poppy Gustafsson. “You can’t do machine learning without a machine — and so the ability to build these AI supercomputers here in the U.K. will naturally attract more startups,” Huang said, though he added that the country lacks homegrown AI infrastructure.', '[PRO] New record for S&P soon?\nThe S&P 500 ticked higher on Monday and continues to chip away at the gap to a new record high. The broad-based index is just 2% below its record close set in February. Several events in the days ahead could prove to be the catalyst that vaults it over the top, according to the JPMorgan\ntrading desk.', '‘Bitcoin Family’ hides crypto codes etched onto metal cards on four continents after recent kidnappings', 'Didi Taihuttu, patriarch of the so-called Bitcoin Family, said he overhauled the family’s entire security setup after a wave of high-profile kidnappings targeting cryptocurrency executives.', 'The Taihuttus — who sold everything they owned in 2017, from their house to their shoes, to go all in on bitcoin when it was trading around $900 — have long lived on the outer edge of crypto ideology. They travel full-time with their three daughters and remain entirely unbanked.', 'Over the past eight months, he said, the family ditched hardware wallets in favor of a hybrid system: Part analog, part digital, with seed phrases encrypted, split and stored either through blockchain-based encryption services or hidden across four continents.', 'Got a confidential news tip? We want to hear from you.', 'Sign up for free newsletters and get more CNBC delivered to your inbox', 'Get this delivered to your inbox, and more info about our products and services.', '© 2025 CNBC LLC. All Rights Reserved. \nA Division of NBCUniversal', 'Data is a real-time snapshot *Data is delayed at least 15 minutes. Global Business and Financial News, Stock Quotes, and Market Data and Analysis.', 'Data also provided by']",Business,https://news.google.com/api/attachments/CC8iK0NnNWplbVIzV0V0UlRWSlpUR28xVFJDZkF4ampCU2dLTWdhbEpKU3VtUWs=-w280-h168-p-df
Bloomberg,https://www.bloomberg.com/news/articles/2025-06-09/chinese-stocks-in-hong-kong-head-for-bull-market-before-us-talks,"[""To continue, please click the box below to let us know you're not a robot."", 'Please make sure your browser supports JavaScript and cookies and that you are not blocking them from loading. For more information you can review our Terms of Service and Cookie Policy.', 'For inquiries related to this message please contact our support team and provide the reference ID below.', 'Get the most important global markets news at your fingertips with a Bloomberg.com subscription.']",Business,https://news.google.com/api/attachments/CC8iK0NnNWplbVIzV0V0UlRWSlpUR28xVFJDZkF4ampCU2dLTWdhbEpKU3VtUWs=-w280-h168-p-df
