Title,Link,Paragraphs,Topic,Image
,https://www.post-gazette.com/business/money/2025/06/05/stock-market-today-june-5-2025/stories/202506050066,"['NEW YORK — U.S. stocks drifted lower on Thursday as financial markets locked in their final moves before a highly anticipated update coming Friday about the U.S. job market.', 'The S&P 500 fell 0.5% for its first drop in four days. After sprinting through May and rallying within a couple good days’ worth of gains of its all-time high, the index at the center of many 401(k) accounts has lost momentum.', 'The Dow Jones Industrial Average dropped 108 points, or 0.3%, and the Nasdaq composite sank 0.8%.', 'Trading activity in options markets suggests investors believe the next big move for the S&P 500 could come on Friday, when the U.S. Labor Department will say how many more jobs U.S. employers created than destroyed during May. The expectation on Wall Street is for a slowdown in hiring from April.', 'A resilient job market has been one of the linchpins that has propped up the U.S. economy, and the worry is that all the uncertainty created by President Donald Trump’s on-and-off tariffs could push businesses to freeze their hiring.', 'A report on Thursday said more U.S. workers applied for unemployment benefits last week than economists expected. The number remains relatively low compared with history, but it still hit its highest level in eight months.', 'The data came as Procter & Gamble, the giant behind such brands as Pampers diapers and Cascade dish detergent, said it will cut up to 7,000 jobs over the next two years. Its stock fell 1.9%.', 'The day’s heaviest weight on the market was Tesla, which tumbled 14.3%. It’s lost nearly 30% of its value so far this year as CEO Elon Musk’s relationship with Trump sours amid a disagreement over the president’s signature bill of tax cuts and spending.', 'Brown-Forman, the company behind Jack Daniel’s and Woodford Reserve, dropped 17.9% for its worst day since it began trading in 1972.', 'Its profit and revenue for the latest quarter fell short of Wall Street’s expectations, and the company said it expects its upcoming fiscal year to be challenging because of “consumer uncertainty, the potential impact from currently unknown tariffs” and other things.', 'The CEO of PVH, which runs the Calvin Klein and Tommy Hilfiger brands, likewise cited challenges from “an increasingly uncertain consumer and macroeconomic backdrop.”', 'Its stock fell 18% even though it reported stronger revenue and profit for the latest quarter than analysts expected. The company cut its profit forecast for its full fiscal year, saying it will likely be able to offset only some of the potential hit it will take because of tariffs.', 'Hopes that Trump will lower his tariffs after reaching trade deals with other countries have been among the main reasons the S&P 500 has rallied back so furiously since dropping roughly 20% from its record two months ago. It’s now back within 3.3% of its all-time high.', 'Trump boosted such hopes Thursday after saying he had “a very good phone call” with China’s leader, Xi Jinping, about trade and that “their respective teams will be meeting shortly at a location to be determined.”', 'It’s an easing of tensions after the world’s two largest economies had earlier accused each other of violating the agreement that had paused their stiff tariffs against each other, which threatened to drag the economy into a recession.', 'To be sure, nothing is assured amid Trump’s on-and-off rollout of tariffs, and markets took the latest detente with China relatively coolly.', 'Among Wall Street’s winners was MongoDB, which jumped 12.8% after the database company likewise delivered a stronger profit than analysts expected.', 'Circle Internet Group, the U.S.-based issuer of one of the most popular cryptocurrencies, surged 168.5% in its first day of trading on the New York Stock Exchange.', 'Five Below climbed 5.6% after the retailer, which sells products priced between $1 and $5, reported a stronger profit for the latest quarter than analysts expected. CEO Winnie Park credited broad-based strength across most of its merchandise', 'All told, the S&P 500 fell 31.51 points to 5,939.30. The Dow Jones Industrial Average dropped 108.00 to 42,319.74, and the Nasdaq composite sank 162.04 to 19,298.45.', 'In the bond market, Treasury yields held steadier. The yield on the 10-year Treasury rose to 4.40% from 4.37% late Wednesday after tumbling from 4.46% the day before.', 'Yields dropped so sharply on Wednesday as expectations built that the Federal Reserve will need to cut interest rates later this year to prop up an economy potentially weakened by tariffs.', 'In stock markets abroad, indexes in Europe were mixed amid modest moves after the European Central Bank cut its main interest rate again, as was widely expected.', 'The moves were bigger in Asia, where South Korea’s Kospi jumped 1.5% after the country’s new president and leading liberal politician Lee Jae-myung began his term, vowing to restart talks with North Korea and beef up a partnership with the U.S. and Japan.', 'First Published: June 5, 2025, 5:53 a.m.\nUpdated: June 5, 2025, 9:03 a.m.']",Business,https://news.google.com/api/attachments/CC8iK0NnNDBNbHBKVlZaRFMyOVpVbUpQVFJDZkF4ampCU2dLTWdhaFJZN3NvUWc=-w280-h168-p-df
No title found,https://www.wsj.com/livecoverage/stock-market-today-trump-tariffs-trade-war-06-04-2025?gaa_at\u003deafs\u0026gaa_n\u003dASWzDAjpZkzmAv8lDkEB1jD8RAtNXctXoLE4NJivwdzq1r44zIlqvZGCmWOa\u0026gaa_ts\u003d68435a5e\u0026gaa_sig\u003dIsOcdFUxf4BkHGX3pyfn8GdhAkIoVddz8clNcKepX_9hTnx9JoETSjzh3SW9NIVSJ-tI1jeDqkeWGZXzgUdQSw%3D%3D,[],Business,https://news.google.com/api/attachments/CC8iK0NnNDBNbHBKVlZaRFMyOVpVbUpQVFJDZkF4ampCU2dLTWdhaFJZN3NvUWc=-w280-h168-p-df
"Dow, Nasdaq Up Triple Digits Amid Labor Market Optimism",https://www.schaeffersresearch.com/content/ezines/2025/06/06/dow-nasdaq-up-triple-digits-amid-labor-market-optimism,"['Stocks are rallying this afternoon, thanks to better-than-expected nonfarm payrolls data for May. The Dow Jones Industrial Average (DJI) and Nasdaq Composite (IXIC) are both up triple digits, while the S&P 500 Index (SPX) is also higher after earlier hitting 6,000 for the first time since February. Despite more headlines around the feud between President Donald Trump and Tesla (TSLA) CEO Elon Musk, all three major benchmarks remain on track for weekly gains.', '', ""Continue reading for more on today's market, including:"", '', 'Applied Digital Corp (NASDAQ:APLD) stock is getting blasted in the options pits today, with 224,000 calls and 58,000 puts exchanged so far -- 7 times the volume typically seen at this point. The weekly 6/6 15-strike call is the most active contract, with new positions opening there. APLD was last seen 19.2% higher to trade at $15.22, after the company inked a deal with CoreWeave (CRWV) that is expected to bring in $7 billion in revenue over 15 years. Shares earlier surged to a fresh three-year high of $15.17, and sport a 207% year-over-year lead.', 'Micron Technology Inc (NASDAQ:MU) is near the top of the SPX today, last seen up 3.7% to trade at $110.30, after earlier surging to its highest level since December. The chip stock sports a more than 30% lead for 2025, and is today eyeing its fifth-straight daily gain and best weekly performance since September. MU blasted past overhead pressure at the $100 early this week, with support from its 20-day moving average.', '', ""Mosaic Co (NYSE:MOS) stock is one of the worst performers on the SPX today, down 3.5% to trade at $35.11 at last glance, after the company lowered its phosphates sales and production guidance for the fiscal second quarter and full year. MOS is pulling back from yesterday's 52-week high of $37.69, but still sports a healthy 42.3% lead for 2026."", 'Two High-Octane Trade Ideas. One Simple Goal: Intraday Profits.', 'Dynamite Day Trading Signals delivers two same-day options trades every week — powered by proprietary intraday analysis and 43+ years of trading expertise.', 'But this isn’t just another stream of alerts.', 'It’s a structured plan with clear entry and exit points – designed for traders who want to act fast, trade smart, and wrap up gains before the closing bell.', 'No guesswork. No overnight exposure – Just two well-researched setups per week — whether you prefer buying premium or selling it.', 'And the results speak for themselves: subscribers have locked in +245.8% total profit over the last six months (since inception!).', '👉 Start your one-month trial now for just $10, and be ready for the next trade alert.', '', '', ' ']",Business,https://news.google.com/api/attachments/CC8iK0NnNDBNbHBKVlZaRFMyOVpVbUpQVFJDZkF4ampCU2dLTWdhaFJZN3NvUWc=-w280-h168-p-df
Bloomberg,https://www.bloomberg.com/news/articles/2025-06-05/stock-market-today-dow-s-p-live-updates,"[""To continue, please click the box below to let us know you're not a robot."", 'Please make sure your browser supports JavaScript and cookies and that you are not blocking them from loading. For more information you can review our Terms of Service and Cookie Policy.', 'For inquiries related to this message please contact our support team and provide the reference ID below.', 'Get the most important global markets news at your fingertips with a Bloomberg.com subscription.']",Business,https://news.google.com/api/attachments/CC8iK0NnNDBNbHBKVlZaRFMyOVpVbUpQVFJDZkF4ampCU2dLTWdhaFJZN3NvUWc=-w280-h168-p-df
Stock Market Today: Good Feelings and Solid Data Lift Stocks,https://www.kiplinger.com/investing/stocks/stock-market-today-good-feelings-and-solid-data-lift-stocks,"['From $95.40 $24.95', 'Subscribe to Kiplinger', 'Resilience and de-escalation defined another generally positive day for financial markets.', 'When you purchase through links on our site, we may earn an affiliate commission. Here’s how it works.', 'Equity futures and U.S. Treasury yields surged on incoming data showing the labor market remains ""resilient"" even amid down-trending sentiment survey results.', 'Meanwhile, reports of de-escalation in the burgeoning feud between President Donald Trump and erstwhile adviser Elon Musk provided an additional boost for the bulls on Jobs Friday.', ""They continue to turn May's rally into June's with fresh inflation data looming on Wednesday, early consumer survey results deadlining next Friday, and the Federal Reserve in a quiet period ahead of its upcoming policy meeting."", 'Become a smarter, better informed investor. Subscribe from just $95.40 $24.95, plus get up to 4 Special Issues.', 'Tensions between the president and the Tesla CEO may or may not have eased – the White House would like to move on. But Trump, unbound by any ""quiet period,"" continues to attack Fed Chair Jerome ""Too Late"" Powell.', '""If \'Too Late\' at the Fed would CUT, we would greatly reduce interest rates, long and short, on debt that is coming due,"" posted the president about 20 minutes after Friday\'s opening bell.', 'U.S. Treasury yields were higher across maturities, the 2-year up to 4.041% from 3.924% Thursday, the 10-year up to 4.506% from 4.395% and the 30-year up to 4.966% from 4.884%.', 'By the closing bell, the blue-chip Dow Jones Industrial Average was up 1.1% at 42,762, the broad-based S&P 500 had added 1.0% to 6,000, and the tech-heavy Nasdaq Composite was up 1.2% at 19,529.', 'Tesla (TSLA) rebounded 3.7% Friday after its 14.3% crash Thursday and recovered about $50 billion of the $152 billion in market capitalization it lost.', 'Indeed, stocks to buy for a Trump presidency were up across the board.', 'And Trump Media & Technology Group (DJT) was up 3.9%.', '""The most colorful story is the rift between President Trump and Elon Musk,"" muses Louis Navellier of Navellier & Associates, who recounts the Tesla CEO\'s journey from fanboy to critic as the president\'s ""big beautiful bill"" made its way through the House and to the Senate.', 'And ""the rhetoric between the two got really heated"" as TSLA stock fell from an intraday high of $355 Tuesday to an intraday low of $273 Thursday.', 'Other names in the Trump Industrial Complex, such as AI stock Palantir Technologies (PLTR, +6.5%), rose amid peace-for-now between Trump and Musk.', 'Beyond the battle between social media heavyweights with market-moving implications, according to Navellier, ""What people are looking for is to see if the S&P can close above 6,000.""', 'The index climbed as high as 6,016.87 within 15 minutes of Thursday\'s opening bell. ""Clearly,"" Navellier concludes, ""the trend remains positive.""', 'The Bureau of Labor Statistics said nonfarm payrolls increased by 139,000 in May, ahead of a consensus estimate of 130,000. As expected, the unemployment rate remained at 4.2%.', ""The BLS reported a net downward revision of 95,000 jobs for the previous two months, the March count down from 185,000 to 120,000, and April's count trimmed from 177,000 to 147,000."", 'Average weekly hours were unchanged at 34.3, while average hourly earnings increased from $36.09 in April to $36.24 in May. Average weekly earnings increased from $1,237.89 in April to $1,243.03 in May.', '""It\'s clear that the economy remains resilient, with the job market holding up well,"" says Northlight Asset Management Chief Investment Officer Chris Zaccarelli.', 'Zaccarelli adds that the Fed ""should be reluctant to cut rates because the full effects of tariffs haven\'t impacted inflation numbers yet and the job market isn\'t deteriorating enough to force their hand.""', 'Raymond James Chief Economist Eugenio J. Alemán suggests the report ""will appease market concerns about the U.S. labor market"" and that ""even after those large downward revisions, job growth remains healthy for now.""', 'Echoing Zaccarelli, Morgan Stanley Wealth Management Chief Economic Strategist Ellen Zentner concludes that ""continued labor market resilience could help the economy sidestep recession.""', ""Profit and prosper with the best of Kiplinger's advice on investing, taxes, retirement, personal finance and much more. Delivered daily. Enter your email in the box and click Sign Me Up."", 'David Dittman is the former managing editor and chief investment strategist of Utility Forecaster, which was named one of ""10 investment newsletters to read besides Buffett\'s"" in 2015. A graduate of the University of California, San Diego, and the Villanova University School of Law, and a former stockbroker, David has been working in financial media for more than 20 years.', '', '', '', '', '', '', '', '', '', '', '', '', '', '', '', '', '', '', '', '', 'Kiplinger is part of Future US Inc, an international media group and leading digital publisher. Visit our corporate site.', '© Future US, Inc. Full 7th Floor, 130 West 42nd Street, New York, NY 10036.', 'Become a smarter, better informed investor.\nSubscribe from just $95.40 $24.95, plus get up to 4 Special Issues.']",Business,https://news.google.com/api/attachments/CC8iK0NnNDBNbHBKVlZaRFMyOVpVbUpQVFJDZkF4ampCU2dLTWdhaFJZN3NvUWc=-w280-h168-p-df
Dow Jones Industrial Average loses some ground as Trump and Musk clash,https://www.fxstreet.com/news/dow-jones-industrial-average-remains-in-consolidation-as-markets-look-ahead-to-nfp-jobs-data-202506051749,"['', '', '', '', 'The Dow Jones Industrial Average (DJIA) held steady on Thursday, chugging quietly near the previous day’s closing bids. Investors are braced for this week’s Nonfarm Payrolls (NFP) jobs report, slated to release on Friday, and the Trump administration is hard at work barreling into trade talks with China and exchanging barbs over budget bills with billionaires. However, steep losses', 'Jobs are the headline datapoint for investors this week. ADP job postings sank in May, causing investors to moderate their expectations for this week’s NFP official follow-up. May’s NFP jobs data report is expected to show a net gain of 130K employment positions over the reference period, down from the previous month’s 177K.', 'Also in markets: Fed officials still concerned about tariff impacts on inflation', 'President Trump’s former right-hand hatchet man, Elon Musk, has been lobbing potshots at Trump’s ‘big beautiful budget bill’ this week via social media. Posting to the social media platform that he owns, Musk has been openly deriding the Trump budget that he had a hand in creating.', 'Musk is ostensibly incensed that the Trump budget codifies functionally none of the federal spending cuts that he swiftly executed without Congressional oversight at the beginning of Trump’s second term. The relationship between two of the most prominent people in the country is souring quickly as the two exchange barbs over social media platforms or through statements to media personnel.', 'Shares of Tesla (TSLA) were down 17% at their lowest on Thursday, slipping below $305 per share after Elon Musk openly claimed that Donald Trump would have lost the federal election without his “involvement”. Earlier this week, Elon Musk also threatened to primary Congressional lawmakers who support the Trump administration’s deficit-heavy spending bill.', 'The Trump team is racing toward trade talks with China following a call between President Trump and Chinese President Xi Jinping. According to statements by Donald Trump on Thursday, the two had a productive phone call, and tariff negotiations are expected to continue. However, Donald Trump himself and most of his retinue have a poor track record of maintaining their composure when dealing with Chinese trade officials. Trump and Xi exchanged barbs as recently as this week over trade, with both sides accusing each other of violating pre-deal trade terms agreed upon in Geneva, Switzerland, in early May.', 'Read more stock news: Circle Internet Group stock spikes 235% on IPO debut', 'The Dow Jones Industrial Average remains trapped in a consolidation zone. Investors are awaiting a fundamental shift in either direction, and a routine of nerve-fraying headlines on trade and tariffs has significantly widened the scope of intraday technical signals.', 'The Dow Jones is pinned to the 42,500 region, with bullish price action firmly capped below the 43,000 handle. However, downside pressure remains firmly subdued, with bids strung along the north side of the 200-day Exponential Moving Average (EMA) near 41,600.', '', 'The Dow Jones Industrial Average, one of the oldest stock market indices in the world, is compiled of the 30 most traded stocks in the US. The index is price-weighted rather than weighted by capitalization. It is calculated by summing the prices of the constituent stocks and dividing them by a factor, currently 0.152. The index was founded by Charles Dow, who also founded the Wall Street Journal. In later years it has been criticized for not being broadly representative enough because it only tracks 30 conglomerates, unlike broader indices such as the S&P 500.', '', '', '', '', 'Information on these pages contains forward-looking statements that involve risks and uncertainties. Markets and instruments profiled on this page are for informational purposes only and should not in any way come across as a recommendation to buy or sell in these assets. You should do your own thorough research before making any investment decisions. FXStreet does not in any way guarantee that this information is free from mistakes, errors, or material misstatements. It also does not guarantee that this information is of a timely nature. Investing in Open Markets involves a great deal of risk, including the loss of all or a portion of your investment, as well as emotional distress. All risks, losses and costs associated with investing, including total loss of principal, are your responsibility. The views and opinions expressed in this article are those of the authors and do not necessarily reflect the official policy or position of FXStreet nor its advertisers. The author will not be held responsible for information that is found at the end of links posted on this page.', 'If not otherwise explicitly mentioned in the body of the article, at the time of writing, the author has no position in any stock mentioned in this article and no business relationship with any company mentioned. The author has not received compensation for writing this article, other than from FXStreet.', 'FXStreet and the author do not provide personalized recommendations. The author makes no representations as to the accuracy, completeness, or suitability of this information. FXStreet and the author will not be liable for any errors, omissions or any losses, injuries or damages arising from this information and its display or use. Errors and omissions excepted.', 'The author and FXStreet are not registered investment advisors and nothing in this article is intended to be investment advice.', '', '', '', '', 'CFDs are complex instruments and come with a high risk of losing money rapidly due to leverage. 81.4% of retail investor accounts lose money when trading CFDs with this provider. You should consider whether you understand how CFDs work, and whether you can afford to take the high risk of losing your money.', 'Forex trading and trading in other leveraged products involves a significant level of risk and is not suitable for all investors.', 'Risk Warning: CFDs are complex instruments and come with a high risk of losing money rapidly due to leverage...', 'EUR/USD loses its traction and trades below 1.1400 in the second half of the day on Friday. The pair struggles to build on the ECB-inspired gains and looks to end the week little changed as the US Dollar (USD) benefits from the better-than-expected Nonfarm Payrolls reading for May.', 'GBP/USD remains under mild selling pressure and fluctuates below 1.3550 in the American trading hours on Friday. The US Dollar holds the upper hand on the upbeat employment data for May, making it difficult for the pair to reverse its direction.', 'Gold stays on the back foot and trades slightly below $3,350 in the American session. The US Dollar gains some positive traction as markets lean toward a Fed policy hold in July after the May report, causing XAU/USD to stretch lower heading into the weekend.', 'The cryptocurrency market capitalization drops 4% to $3.3 trillion amid growing concerns about tariffs and global trade. Bitcoin rebounds after testing support slightly above $100,000, reflecting weak sentiment in the broader crypto market.', 'Tesla (TSLA) stock is facing one of its worst trading sessions in a long time on Thursday. Shared closed above $332 on Wednesday, but at the time of writing late in the afternoon session, TSLA has traded below $274, suffering a 17% sell-off.', ""SPONSORED\nDiscover the top brokers for trading EUR/USD in 2025. Our list features brokers with competitive spreads, fast execution, and powerful platforms. Whether you're a beginner or an expert, find the right partner to navigate the dynamic Forex market."", '©2025 ""FXStreet"" All Rights Reserved', 'Note: All information on this page is subject to change. The use of this website constitutes acceptance of our user agreement. Please read our privacy policy and legal disclaimer.', 'Trading foreign exchange on margin carries a high level of risk and may not be suitable for all investors. The high degree of leverage can work against you as well as for you. Before deciding to trade foreign exchange you should carefully consider your investment objectives, level of experience and risk appetite. The possibility exists that you could sustain a loss of some or all of your initial investment and therefore you should not invest money that you cannot afford to lose. You should be aware of all the risks associated with foreign exchange trading and seek advice from an independent financial advisor if you have any doubts.', 'Opinions expressed at FXStreet are those of the individual authors and do not necessarily represent the opinion of FXStreet or its management. FXStreet has not verified the accuracy or basis-in-fact of any claim or statement made by any independent author: errors and omissions may occur. Any opinions, news, research, analyses, prices or other information contained on this website, by FXStreet, its employees, clients or contributors, is provided as general market commentary and does not constitute investment advice. FXStreet will not accept liability for any loss or damage, including without limitation to, any loss of profit, which may arise directly or indirectly from use of or reliance on such information.']",Business,https://news.google.com/api/attachments/CC8iK0NnNDBNbHBKVlZaRFMyOVpVbUpQVFJDZkF4ampCU2dLTWdhaFJZN3NvUWc=-w280-h168-p-df
No title found,https://www.thestreet.com/investing/stock-market-today-musk-trump-feud-hits-stocks-but-employment-numbers-are-good,[],Business,https://news.google.com/api/attachments/CC8iK0NnNDBNbHBKVlZaRFMyOVpVbUpQVFJDZkF4ampCU2dLTWdhaFJZN3NvUWc=-w280-h168-p-df
