Title,Link,Paragraphs,Topic,Image
"Wall Street posts weekly gains, Treasury yields jump as upbeat jobs data ease economic fears",https://www.investing.com/news/stock-market-news/stocks-on-guard-for-payrolls-tesla-tumbles-as-trumpmusk-bromance-sours-4084283,"['© Reuters. FILE PHOTO: A woman walks past an electronic screen displaying stock quotation board in Tokyo, Japan April 15, 2025. REUTERS/Issei Kato/ File Photo', 'By Stephen Culp', 'NEW YORK (Reuters) -U.S. stocks closed sharply higher on Friday and U.S. Treasury yields jumped as a generally upbeat employment report and bounce-back in Tesla (NASDAQ:TSLA) shares helped the indexes notch weekly advances.', 'All three major U.S. stock indexes surged, while bitcoin jumped and crude prices settled at their highest level since mid-April.', '""Stocks bounced back nicely today,"" said Ryan Detrick, chief market strategist at Carson Group in Omaha. ""It’s a recent theme we’ve been seeing; the day after a red day has been pretty strong. That’s another clue that the bulls are in charge.""', 'The U.S. economy added 139,000 jobs in May, topping analysts’ expectations, while the unemployment rate held firm at 4.2%, the Labor Department said. The report also showed hotter-than-anticipated wage growth, which is unlikely to convince the U.S. Federal Reserve to cut its key policy rate in the near term.', '""The headline number was solid, but clearly there is some deterioration and slowing when you peel back the onion,"" Detrick added. ""The reality, though, is the labor market is still growing and the overall economy is still on fairly firm footing. That led to the relief rally to close out a solid week.""', 'Tesla stock rebounded 3.8% a day after a very public spat between U.S. President Donald Trump and his top advisor, billionaire Elon Musk, sent shares of Musk-helmed Tesla tumbling, which helped drag the indexes decisively lower.', 'The falling out between the erstwhile allies revived concerns over Trump’s ""Big Beautiful Bill"" of tax and spending plans and its effect on the growing deficit.', 'Tariff negotiations between the U.S. and its trading partners remain fluid, with the European Union and India working toward ironing out deals, and further U.S.-China talks promised after Trump’s phone call on Thursday with Chinese President Xi Jinping.', 'China has granted temporary export licenses to rare-earth suppliers of the top three U.S. automakers amid emerging supply chain snags due to Beijing’s export curbs on the materials. On the flip side, the United States has suspended licenses for nuclear equipment suppliers to sell to Chinese power plants, according to people familiar with the matter.', 'The Dow Jones Industrial Average rose 443.13 points, or 1.05%, to 42,762.87. The S&P 500 climbed 61.06 points, or 1.03%, to 6,000.36 and the Nasdaq Composite advanced 231.50 points, or 1.20%, to 19,529.95.', 'European shares followed their U.S. counterparts higher after the jobs report, notching their second consecutive weekly gains, buoyed by upbeat U.S. employment data and waning worries over trade disputes.', 'MSCI’s gauge of stocks across the globe rose 5.27 points, or 0.59%, to 892.10.', 'The pan-European STOXX 600 index rose 0.32%, while Europe’s broad FTSEurofirst 300 index rose 7.10 points, or 0.32%.', 'Emerging market stocks rose 0.12 points, or 0.01%, to 1,182.80. MSCI’s broadest index of Asia-Pacific shares outside Japan closed lower by 0.1%, to 622.63, while Japan’s Nikkei rose 187.12 points, or 0.50%, to 37,741.61.', 'The dollar rose against major currencies in the wake of the better-than-expected employment data.', 'The dollar index, which measures the greenback against a basket of currencies including the yen and the euro, rose 0.51% to 99.18, with the euro down 0.42% at $1.1396.', 'Against the Japanese yen, the dollar strengthened 0.87% to 144.77.', 'The report also prompted a rally in cryptocurrencies. Bitcoin gained 3.80% to $104,334.11. Ethereum rose 3.7% to $2,487.77.', 'U.S. Treasury yields also rode the wave of the upbeat jobs data.', 'The benchmark U.S. 10-year note yield rose 11.1 basis points to 4.506% from 4.395% late on Thursday.', 'The 30-year bond yield rose 8.2 basis points to 4.9655% from 4.884% late on Thursday.', 'The 2-year note yield, which typically moves in step with interest rate expectations for the Federal Reserve, rose 11.7 basis points to 4.041%, from 3.924% late on Thursday.', 'Crude prices registered their first weekly gain in three after Trump and Xi resumed trade talks, raising hopes of demand growth.', 'U.S. crude rose 1.91% to settle at $64.58 per barrel, while Brent settled at $66.47 per barrel, up 1.73% on the day.', '', 'Gold prices dipped in opposition to the strengthening greenback, as the jobs report clouded the outlook for rate cuts from the Federal Reserve.', 'Spot gold fell 1.27% to $3,310.58 an ounce. U.S. gold futures fell 1.23% to $3,309.50 an ounce.', '', 'ProPicks AI are 6 model portfolios created by Investing.com which identify the best stocks for investors to buy now. The stocks that made the cut could produce monster returns in the coming years. Is TSLA one of them?', '']",Business,https://news.google.com/api/attachments/CC8iK0NnNDBNbHBKVlZaRFMyOVpVbUpQVFJDZkF4ampCU2dLTWdhaFJZN3NvUWc=-w280-h168-p-df
Nasdaq 100 Shrugs Off Trump-Musk Drama; May US NFP Doesn’t Miss,https://www.tastylive.com/news-insights/nasdaq100-trump-musk-nfp,"['', 'NASDAQ 100 SHRUGS OFF TRUMP-MUSK DRAMA; MAY US NFP DOESN’T MISS', 'JUN 6, 2025', 'BY:THOMAS WESTWATER', '', '', '', '', '', '', '', '', '', '', '', '', '', '', 'Linguists have yet to conceive of the words to describe what unfolded across traditional and social media yesterday between the world’s most powerful man and the world’s richest man. Not that it mattered for stocks — taking Tesla and the Trump/Musk feud out of the equation, stocks traded higher yesterday. And with signs of cooling off by this morning, traders have started to look past the drama and instead shift their attention back to more orthodox catalysts. ', ' ', 'One such catalyst was the May US non-farm payrolls report released this morning. Jobs growth is solid if not slowing, with the headline figure coming in at 139,000 vs. the expected 130,000. But the previous two months were revised lower by 95,000, taking some sheen off the beat. The unemployment rate (U3) held stead at 4.2%, but a look below the hood shows a 4.244% reading; not barely falling below the line where it would have been rounded up to 4.3%. Wages, on the other hand, were stronger with an increase 3.9% year over year vs. the 3.7% expected.  ', ' ', 'Overall, the May US jobs report was a mixed bag: firmer wages may have to do with kinks around the tariffs, with workers decidedly negative in the household employment survey: They reported a drop of 696,000 jobs, the largest decline since December 2023. ', ' ', '', '', ' ', 'A strong jobs report dispelled fears of a recession, pushing US equity prices higher this morning. S&P 500 futures (/ESM5) rose over 1% to hit the highest levels traded since early March. Broadcom (AVGO) fell almost 3% after the chipmaker reported a drop in free cash flow. Lululemon (LULU) fell over 20% after the retailer cut its guidance for the year.  ', ' ', '', 'Long 21600 p', 'Short 21700 p', 'Short 22500 c', 'Long 22600 c', 'Short 21700 p', 'Short 22500 c', '', ' ', '', ' ', ' ', '', '', ' ', 'The strong jobs report saw traders pull back on interest rate cut bets for the Federal Reserve, which sent yields higher in the Treasury market. 30-year T-bond futures (/ZBU5) fell 0.74% in early trading. The move today pushed prices into negative territory for the month. Next week will bring inflation data and consumer confidence figures, but the downward calculus for Treasuries may last more than a couple of days, given the jobs report strength.  ', ' ', '', 'Long 110 p ', 'Short 111 p ', 'Short 114 c ', 'Long 115 c ', 'Short 111 p ', 'Short 114 c ', 'Long 110 p ', 'Short 111 p ', '', ' ', '', ' ', ' ', '', '', ' ', 'Gold is giving up some ground following the jobs report. /GCQ5 is trading down to its 21-day exponential moving average (EMA), which has supported prices several times over the past several weeks. The move higher in yields and the dollar are putting a firm headwind on gold prices. Still, technical structure is holding, and bulls can hinge their hopes on escalating trade tensions.  ', ' ', '', 'Long 3300 p ', 'Short 3305 p ', 'Short 3415 c ', 'Long 3420 c ', 'Short 3305 p ', 'Short 3415 c ', 'Long 3300 p ', 'Short 3305 p ', '', ' ', '', ' ', ' ', '', '', ' ', 'Crude oil prices (/CLN5) pushed higher after the jobs report, rising about 1.89% an hour into US trading. Prices are now trading at the highest level since early April. For the week, prices are on track to record the largest weekly gain since December. Besides the jobs report, bulls cheered positive headlines on the trade front, with President Xi and President Trump making progress after a phone call this week. Meanwhile, geopolitical premium remains in the price as some anticipate a possible Israeli strike against Iran.  ', ' ', '', 'Long 61.5 p ', 'Short 62 p ', 'Short 64.5 c ', 'Long 65 c ', 'Short 62 p ', 'Short 64.5 c ', 'Long 61.5 p ', 'Short 62 p ', '', ' ', '', ' ', ' ', '', '', ' ', 'It’s a bad day for the Japanese yen after the jobs report fueled US dollar gains and improved market sentiment. /6JM5 fell 0.78% in early trading. The Treasury’s exchange-rate report to Congress supported further tightening in monetary policy for the Bank of Japan. The Treasury noted that Japan is on its monitoring list for foreign exchange scrutiny but didn’t label Japan as a currency manipulator.  ', ' ', '', 'Long 0.00685 p ', 'Short 0.0069 p ', 'Short 0.0071 c ', 'Long 0.00715 c ', 'Short 0.0069 p ', 'Short 0.0071 c ', 'Long 0.00685 p ', 'Short 0.0069 p ', '', ' ', '', '', '', '', '', '', '', '', '', '', '', 'For live daily programming, market news and commentary, visit tastylive or the YouTube channels tastylive (for options traders), and #tastyliveTrending for stocks, futures, forex & macro. ', 'Trade with a better broker, open a tastytrade account today. tastylive Inc. and tastytrade Inc. are separate but affiliated companies. ', 'Options involve risk and are not suitable for all investors. Please read Characteristics and Risks of Standardized Options before deciding to invest in options.', 'JJ KINAHAN', 'JUN 6, 2025', '', 'ILYA SPIVAK', 'JUN 5, 2025', '', 'THOMAS WESTWATER', 'JUN 5, 2025', '', 'THOMAS WESTWATER', 'JUN 5, 2025', '', 'About Us', 'Careers', 'Legal Stuff', 'Newsroom', 'FAQ', 'Glossary', 'Help Center', 'Contact Us', 'Twitter', 'Instagram', 'Facebook', 'LinkedIn', 'tastytrade', 'tastycrypto', 'luckbox', 'Store', 'Connect from anywhere!', 'Newsletters', 'News & Insights', 'On Demand', 'YouTube', 'tastylive content is created, produced, and provided solely by tastylive, Inc. (“tastylive”) and is for informational and educational purposes only.\u202fIt is not, nor is it intended to be, trading or investment advice or a recommendation that any security, futures contract, digital asset, other product, transaction, or investment strategy is suitable for any person. Trading securities, futures products, and digital assets involve risk and may result in a loss greater than the original amount invested.\u202ftastylive, through its content, financial programming or otherwise, does not provide investment or financial advice or make investment recommendations. Investment information provided may not be appropriate for all investors and is provided without respect to individual investor financial sophistication, financial situation, investing time horizon or risk tolerance. tastylive is not in the business of transacting securities trades, nor does it direct client commodity accounts or give commodity trading advice tailored to any particular client’s situation or investment objectives. Supporting documentation for any claims (including claims made on behalf of options programs), comparisons, statistics, or other technical data, if applicable, will be supplied upon request.\u202ftastylive is not a licensed financial adviser, registered investment adviser, or a registered broker-dealer.\u202f Options, futures, and futures options are not suitable for all investors.\u202f Prior to trading securities, options, futures, or futures options, please read the applicable risk disclosures, including, but not limited to, the Characteristics and Risks of Standardized Options Disclosure and the Futures and Exchange-Traded Options Risk Disclosure found on tastytrade.com/disclosures.', 'tastytrade, Inc. (""tastytrade”) is a registered broker-dealer and member of FINRA, NFA, and SIPC.\u202ftastytrade was previously known as tastyworks, Inc. (“tastyworks”). tastytrade offers self-directed brokerage accounts to its customers. tastytrade does not give financial or trading advice, nor does it make investment recommendations.\u202fYou alone are responsible for making your investment and trading decisions and for evaluating the merits and risks associated with the use of tastytrade’s systems, services or products. tastytrade is a wholly-owned subsidiary of tastylive, Inc.', 'tastytrade has entered into a Marketing Agreement with tastylive (“Marketing Agent”) whereby tastytrade pays compensation to Marketing Agent to recommend tastytrade’s brokerage services. The existence of this Marketing Agreement should not be deemed as an endorsement or recommendation of Marketing Agent by tastytrade. tastytrade and Marketing Agent are separate entities with their own products and services. tastylive is the parent company of tastytrade.', 'tastycrypto is provided solely by tasty Software Solutions, LLC. tasty Software Solutions, LLC is a separate but affiliate company of tastylive, Inc. Neither tastylive nor any of its affiliates are responsible for the products or services provided by tasty Software Solutions, LLC. Cryptocurrency trading is not suitable for all investors due to the number of risks involved. The value of any cryptocurrency, including digital assets pegged to fiat currency, commodities, or any other asset, may go to zero.', '© copyright 2013 - 2025 tastylive, Inc. All Rights Reserved.\u202f Applicable portions of the Terms of Use on tastylive.com apply.\u202f Reproduction, adaptation, distribution, public display, exhibition for profit, or storage in any electronic storage media in whole or in part is prohibited under penalty of law, provided that you may download tastylive’s podcasts as necessary to view for personal use. tastylive was previously known as tastytrade, Inc. tastylive is a trademark/servicemark owned by tastylive, Inc.', '', '', '', '', '', '', '', '', '']",Business,https://news.google.com/api/attachments/CC8iK0NnNDBNbHBKVlZaRFMyOVpVbUpQVFJDZkF4ampCU2dLTWdhaFJZN3NvUWc=-w280-h168-p-df
No title found,https://www.wsj.com/livecoverage/stock-market-jobs-report-dow-sp500-nasdaq-06-06-2025?gaa_at\u003deafs\u0026gaa_n\u003dASWzDAgFRPYWmMC3nveZuId_MCCuKg2dRzywKjtjoPWb0TMe32xcGNKu5fgg\u0026gaa_ts\u003d68435a5e\u0026gaa_sig\u003dQvcHVXdP57ZbgK5kAAFfSefu7Kvt4tY8-gUm1UP4agvTQdcghLAzt1c3zuOV9a3Vb-tuL_J9YqY4wl5KVym6fA%3D%3D,[],Business,https://news.google.com/api/attachments/CC8iK0NnNDBNbHBKVlZaRFMyOVpVbUpQVFJDZkF4ampCU2dLTWdhaFJZN3NvUWc=-w280-h168-p-df
World shares are mixed ahead of Friday’s U.S. jobs report,https://www.pbs.org/newshour/economy/world-shares-are-mixed-ahead-of-fridays-u-s-jobs-report,"['Your favorite shows at PBS are in danger of going away. The federal funding that supports local stations and public media is under threat.', '', 'Elaine Kurtenbach, Associated Press', 'Leave your feedback', 'TOKYO (AP) — World shares were mixed Friday ahead of an update on the U.S. job market that will offer insights into how the economy is faring.', 'The future for the S&P 500 gained 0.4% while that for the Dow Jones Industrial Average was up 0.5%.\nGermany’s DAX lost 0.3% to 24,258.74, while the CAC 40 in Paris edged 0.1% lower, to 7,785.19. Britain’s FTSE 100 edged 0.2% higher to 8,825.82.', 'In Asian trading, Tokyo’s Nikkei 225 index rose 0.5% to 37,741.61, while the Kospi in South Korea jumped 1.5% to 2,812.05.', 'Hong Kong’s Hang Seng lost 0.2% to 23,859.52 and the Shanghai Composite index edged less than 0.1% higher, to 3,385.36.', 'Australia’s S&P/ASX 200 shed 0.3% to 8,515.70.', 'India’s Sensex gained 0.8% after the Reserve Bank cut its key interest rate by a half a percentage point to 5.50%.', 'On Thursday, the S&P 500 fell 0.5% for its first drop in four days. After sprinting through May and rallying within a couple good days’ worth of gains of its all-time high, the index at the center of many 401(k) accounts has lost momentum.', 'The Dow dropped 0.3%, and the Nasdaq composite sank 0.8%.', 'The U.S. Labor Department is due to report how many more jobs U.S. employers created than destroyed during May. The expectation on Wall Street is for a slowdown in hiring from April.', 'A resilient job market has been one of the linchpins that’s propped up the U.S. economy, and the worry is that all the uncertainty created by President Donald Trump’s on-and-off tariffs could push businesses to freeze their hiring.', 'A report on Thursday said more U.S. workers applied for unemployment benefits last week than economists expected. The number remains relatively low compared with history, but it still hit its highest level in eight months.', 'The data came as Procter & Gamble, the giant behind such brands as Pampers diapers and Cascade dish detergent, said it will cut up to 7,000 jobs over the next two years. Its stock fell 1.9%.', 'The day’s heaviest weight on the market was Tesla, which tumbled 14.3%. It’s lost nearly 30% of its value so far this year as CEO Elon Musk’s relationship with Trump sours amid a disagreement over the president’s signature bill of tax cuts and spending. In after-hours trading Tesla gained 0.8%.', 'Hopes that Trump will lower his tariffs after reaching trade deals with other countries have been among the main reasons the S&P 500 has rallied back so furiously since dropping roughly 20% from its record two months ago. It’s now back within 3.3% of its all-time high.', 'Trump boosted such hopes Thursday after saying he had “a very good phone call” with China’s leader, Xi Jinping, about trade and that “their respective teams will be meeting shortly at a location to be determined.”', 'China’s assessment of the call, as reported in state media, was less enthusiastic.', 'Still, it’s an easing of tensions after the world’s two largest economies had earlier accused each other of violating the agreement that had paused their stiff tariffs against each other, which threatened to drag the economy into a recession.', 'Markets took the latest signs of detente with Beijing coolly, given that nothing is assured in Trump’s on-and-off rollout of tariffs.', 'Among Wall Street’s winners was MongoDB, which jumped 12.8% after the database company likewise delivered a stronger profit than analysts expected.', 'Circle Internet Group, the U.S.-based issuer of one of the most popular cryptocurrencies, surged 168.5% in its first day of trading on the New York Stock Exchange.', 'The yield on the 10-year Treasury held steady at 4.38%, up from 4.37% late Wednesday after tumbling from 4.46% the day before.', 'Yields dropped so sharply on Wednesday as expectations built that the Federal Reserve will need to cut interest rates later this year to prop up an economy potentially weakened by tariffs.', 'In other dealings early Friday, U.S. benchmark crude oil lost 34 cents to $63.03 per barrel. Brent crude, the international standard, fell 28 cents to $65.06 per barrel.', 'The U.S. dollar rose to 143.90 Japanese yen from 143.49 yen. The euro fell to $1.1424 from $1.1448.', 'Your donation makes a difference in these uncertain times.', ""Left: A man looks at an electronic screen displaying Japan's Nikkei, Topix share averages and the Dow Jones Industrial Average outside a brokerage in Tokyo, Japan August 2, 2024. Photo by REUTERS/Issei Kato"", 'By Stan Choe, Associated Press', 'By Stan Choe, Associated Press', 'By Stan Choe, Associated Press', 'By Stan Choe, Associated Press', 'Elaine Kurtenbach, Associated Press', 'Support Provided By:\nLearn more', 'Support PBS News:', 'Subscribe to Here’s the Deal, our politics newsletter for analysis you won’t find anywhere else.', '', 'Watch Jun 05\nBreaking down Trump’s ‘Big Beautiful Bill’ and its impact on the deficit and national debt', 'Read Jun 06\nWATCH: DOJ brings Kilmar Abrego Garcia back to U.S. to face charges of transporting undocumented immigrants', 'Read Jun 06\nIn Trump-Musk feud, a once-steady alliance turns into an online spectacle', 'Read Jun 04\nAs U.S. veterans plan protest for D-Day, here’s a look at their nearly 250-year history of fighting for their benefits', 'Watch Jun 05\nGOP Sen. Ron Johnson explains why he opposes Trump’s budget in its current form', 'Politics Jun 06', 'By Lindsay Whitehurst, Associated Press', 'Politics Jun 06', 'By Associated Press', 'World Jun 06', 'By Bassem Mroue, Associated Press', 'Politics Jun 06', 'By Michelle R. Smith, Ali Swenson, Associated Press', 'World Jun 06', 'By Associated Press', '', '', '', '', '', '', '© 1996 - 2025 NewsHour Productions LLC. All Rights Reserved.', 'PBS is a 501(c)(3) not-for-profit organization.', 'Sections', 'About', 'Stay Connected', ""Subscribe to Here's the Deal with Lisa Desjardins"", '', 'Support for News Hour Provided By']",Business,https://news.google.com/api/attachments/CC8iK0NnNDBNbHBKVlZaRFMyOVpVbUpQVFJDZkF4ampCU2dLTWdhaFJZN3NvUWc=-w280-h168-p-df
"US stock futures point to strong gains after non-farm payrolls, spoos up 1%",https://www.forexlive.com/news/us-stock-futures-point-to-strong-gains-after-non-farm-payrolls-spoos-up-1-20250606/,"['', '', '', '', '', '', ""It's looking like a strong rebound for US stock markets after yesterday's late-day selloff. Futures levels:"", ""That's a nice rebound. In focus will be Tesla shares after yesterday's plunge: they're up 3.8% premarket. Another mover is Lululemon, down 18% after lowering guidance on poor macro and Broadcom down 2.9% on earnings."", ""I didn't see much in the non-farm payrolls report to spark this kind of buying but the fast majority of the lift came after the data, indicating some real angst about the economy."", 'Tags', 'Top Brokers', 'Sponsored', 'Most Popular', '', '', 'Stock Daily Updates', 'Must Read', 'Follow Us', 'Read our Terms, Cookies and Privacy Notice', 'HIGH RISK WARNING: Foreign exchange trading carries a high level of risk that may not be suitable for all investors. Leverage creates additional risk and loss exposure. Before you decide to trade foreign exchange, carefully consider your investment objectives, experience level, and risk tolerance. You could lose some or all your initial investment; do not invest money that you cannot afford to lose. Educate yourself on the risks associated with foreign exchange trading and seek advice from an independent financial or tax advisor if you have any questions.', 'ADVISORY WARNING: FOREXLIVE™ is not an investment advisor, FOREXLIVE™ provides references and links to selected news, blogs and other sources of economic and market information for informational purposes and as an educational service to its clients and prospects and does not endorse the opinions or recommendations of the blogs or other sources of information. Clients and prospects are advised to carefully consider the opinions and analysis offered in the blogs or other information sources in the context of the client or prospect\'s individual analysis and decision making. None of the blogs or other sources of information is to be considered as constituting a track record. Past performance is no guarantee of future results and FOREXLIVE™ specifically hereby acknowledges clients and prospects to carefully review all claims and representations made by advisors, bloggers, money managers and system vendors before investing any funds or opening an account with any Forex dealer. Any news, opinions, research, data, or other information contained within this website is provided on an ""as-is"" basis as a general market commentary and does not constitute investment or trading advice, and we do not purport to present the entire relevant or available public information with respect to a specific market or security. FOREXLIVE™ expressly disclaims any liability for any lost principal or profits which may arise directly or indirectly from the use of or reliance on such information, or with respect to any of the content presented within its website, nor its editorial choices.', 'DISCLAIMER: FOREXLIVE™ may be compensated by the advertisers that appear on the website, based on your interaction with the advertisements or advertisers.', 'Finance Magnates CY Limited', '', '', '', '', '', '']",Business,https://news.google.com/api/attachments/CC8iK0NnNDBNbHBKVlZaRFMyOVpVbUpQVFJDZkF4ampCU2dLTWdhaFJZN3NvUWc=-w280-h168-p-df
Please verify you are a human,https://www.investors.com/market-trend/stock-market-today/dow-jones-sp500-nasdaq-jobs-report-nvidia-rival-broadcom-avgo/,"['Access to this page has been denied because we believe you are using automation tools to browse the website.', 'This may happen as a result of the following:', 'Please make sure that Javascript and cookies are enabled on your browser and that you are not blocking them from loading.', 'Reference ID: #451da720-4319-11f0-a634-f32abc9ce8c5', 'Powered by PerimeterX , Inc.']",Business,https://news.google.com/api/attachments/CC8iK0NnNDBNbHBKVlZaRFMyOVpVbUpQVFJDZkF4ampCU2dLTWdhaFJZN3NvUWc=-w280-h168-p-df
