Title,Link,Paragraphs,Topic,Image
"US stocks end up on strong jobs data, China-US talks ahead. S&P 500 at highest since Feb.",https://www.usatoday.com/story/money/markets/2025/06/06/stocks-may-jobs-report/84061556007/,"['U.S. stocks closed higher, with the broad S&P 500 piercing the 6,000 level for the first time since February, after a better-than-expected monthly jobs report and hopes for a trade deal with China.', 'The U.S. and China are set to have talks next week in London, President Donald Trump said in a social media post. This announcement comes after Trump and Chinese President Xi Jinping spoke earlier this week for the first time since Trump took office. Investors hope this is a sign recently chilly relations are thawing again and will lead to a permanent trade deal. Trump recently accused China of violating terms of a tariff pause agreed to in Switzerland last month.', 'Earlier, stocks got a boost after the Labor Department said the economy added 139,000 jobs in May, topping the average economist forecast for 130,000. The unemployment rate was 4.2%, as expected. The May report is the first full month of data since Trump announced his aggressive tariff plans on April 2, and investors were keen to see if the rollercoaster ride had affected the labor market.', '""It was evident in this morning’s print that tariff uncertainty has yet to meaningfully grind payroll growth lower, with the impact of the current policy backdrop on employment limited to trade-reliant sectors,"" said Michael Reid, senior U.S. economist for Royal Bank of Canada.', 'The blue-chip Dow added 1.05%, or 442.88 points, to 42,762.62; the S&P 500 jumped 1.03%, or 61.02 points, to 6,000.32; and the tech-heavy Nasdaq gained 1.20%, or 231.50 points, to 19,529.95. All three indexes posted gains for the week.', 'The benchmark 10-year Treasury yield rose to 4.506%.', '""The May jobs report is an encouraging one for the Fed,"" said Bank of America U.S. economist Shruti Mishra. ""We\'ve been arguing that if something in the economy is going to break because of trade policy, it will happen in the near term.""', 'With the labor market intact and inflation still cooling, most economists predict now the Federal Reserve will keep rates steady for the foreseeable future.', 'Still, Trump again called for the Federal Reserve to lower interest rates. “Go for a full point, Rocket Fuel!” Trump wrote in a social media post.', 'Lower interest rates reduce the cost of borrowing, which encourages businesses and consumers to spend money.', ""Though this morning's jobs report continued to show a stable job market, many economists still predict erosion later this year."", 'Strategy, formerly known as Microstrategy, increased the amount of money it plans to raise in a stock offering to buy more Bitcoin.', ""Already, the world's largest holder of the digital asset, Strategy said it plans to issue 11,764,700 shares of 10.00% Series A Perpetual Stride Preferred Stock at a public offering price of $85 per share. That would be nearly $1 billion in net proceeds, after deducting the underwriting discounts and commissions for the firm’s offering expenses, for “general corporate purposes, including the acquisition of Bitcoin and for working capital.”"", 'Bitcoin was last up 2.68% at $104,319.20.', '(This story was updated with new information.)', 'Medora Lee is a money, markets, and personal finance reporter at USA TODAY. You can reach her at mjlee@usatoday.com and subscribe to our free Daily Money newsletter for personal finance tips and business news every Monday through Friday.']",Business,https://news.google.com/api/attachments/CC8iK0NnNDBNbHBKVlZaRFMyOVpVbUpQVFJDZkF4ampCU2dLTWdhaFJZN3NvUWc=-w280-h168-p-df
Jobs Report: Decent Hiring Obscures Labor Market Cooling; S&P 500 Rises,https://www.investors.com/news/economy/jobs-report-may-federal-reserve-sp-500/,"['', ""Today's jobs report showed that hiring remained decent enough to likely keep Federal Reserve rate cuts on hold this summer, but prior months' job gains were revised down pretty sharply and the survey of household showed a big drop in employment. S&P 500 futures are rising after the data, with Tesla (TSLA) leading the way after CEO Elon Musk and President Donald Trump apparently paused their war of words."", 'There have been growing signs that the labor market is turning cool, from rising jobless claims to increased corporate layoff announcements. However, Fed concerns over renewed inflation pressures driven by Trump tariffs create a high bar for resuming rate cuts.', '""The labor market is slowing, but the pace of the slowdown remains too gradual for the FOMC to ease policy at its next two meetings, given its desire for greater clarity on the scale of the uplift to inflation from the new tariffs."" — Samuel Tombs, chief U.S. economist, Pantheon Macroeconomics', ""The Bureau of Labor Statistics' employer survey shows a deterioration in the breadth of job growth, with a 50 reading for the diffusion index, which indicates an equal balance between the number of industries with increasing and decreasing employment. That was down from positive readings of 51.6 in March and 51.8 in April."", 'Job gains were led by health care and social assistance (78,300) and leisure and hospitality (48,000). Factories shed 8,000 workers, while retailers cut 6,500 jobs and temp help services 20,200.', 'Federal government employment fell by 22,000 amid a federal hiring freeze, but that was mostly offset by job gains at the state and local level.', 'Overall, the private sector added 140,000 jobs and the government trimmed 1,000.', 'After the jobs report, markets are pricing in 99.9% odds of no rate cut at the June 18 Federal Reserve meeting. Odds of a rate cut at the July 30 Fed meeting tumbled to 14.5% from 30% ahead of the data.', 'Markets now see 34% odds of just one quarter-point rate cut this year, up from 26% before the jobs report.', 'The headline hiring figure comes from a midmonth employer survey, while the unemployment rate comes from a survey of households that has a higher margin of error.', 'While the steady 4.2% jobless rate looks like a status-quo reading, the household survey data was actually a bit shocking. The ranks of the employed tumbled by 696,000. Yet the number of unemployed persons only rose 71,000, because the ranks of labor force participants — those employed or actively looking for work — sank by 625,000.', ""Some economists have raised the possibility that Trump's immigration crackdown could have a negative impact on labor force participation."", 'Below the surface, the household survey shows that the number of people who have been unemployed for less than five weeks jumped by 264,000, which suggests a much weaker hiring climate. However that was mostly offset by a 218,000 drop in the number of people who have been unemployed for at least 27 weeks.', 'The S&P 500 rose 0.8% soon after the jobs report release, adding to modest gains. The 10-year Treasury yield rose several basis points to 4.45%.', 'Employers added 139,000 jobs in May, slightly topping 129,000 forecasts. The unemployment rate held at 4.2%, as expected.', 'Job gains for March and April were revised down by a combined 95,000.', 'Average hourly earnings surprised on the upside, rising 0.4%. That lifted 12-month wage growth to 3.9%, above 3.7% forecasts.', 'Wall Street economists are forecasting a net gain of 129,000 nonfarm payrolls, with 120,000 additional private-sector positions.', 'The unemployment rate is seen holding at 4.2%. Average hourly earnings are expected to rise 0.3% on the month, while the 12-month rate of wage growth is seen dipping to 3.7% from an initially reported 3.8%.', 'Ahead of the jobs report, markets are pricing essentially no chance (2.6% odds) of a rate cut at the upcoming June 18 Fed meeting. Odds of a cut at the July 30 meeting have crept up to 30% from 26% a week ago.', 'For the full year, markets see 74% odds of at least 50 basis points in cuts, but just 36% odds of 75 basis points in easing.', ""S&P 500 futures are climbing 0.4% in Friday's stock market action ahead of the jobs report. The S&P 500 slipped 0.5% on Thursday, despite news that President Trump and Chinese President Xi Jinping set talks to resolve Beijing's freeze on rare-earth exports to the U.S."", 'The S&P 500 finished 3.3% below its Feb. 19 all-time high and up 19.2% from its 52-week closing low on April 8, just before the pause of reciprocal tariffs.', ""Be sure to read IBD's The Big Picture column after each trading day to get the latest on the prevailing stock market trend and what it means for your trading decisions."", 'YOU MAY ALSO LIKE:', 'Catch The Next Big Winning Stock With MarketSurge', 'Want To Get Quick Profits And Avoid Big Losses? Try SwingTrader', ""IBD Digital: Unlock IBD's Premium Stock Lists, Tools And Analysis Today"", 'How To Invest: Rules For When To Buy And Sell Stocks In Bull And Bear Markets', '', 'Get instant access to exclusive stock lists, expert market analysis and powerful tools with 2 months of IBD Digital for only $20!', 'Get market updates, educational videos, webinars, and stock analysis.', ""Learn how you can make more money with IBD's investing tools, top-performing stock lists, and educational content."", 'Information in Investor’s Business Daily is for informational and educational purposes only and should not be construed as an offer, recommendation, solicitation, or rating to buy or sell securities. The information has been obtained from sources we believe to be reliable, but we make no guarantee as to its accuracy, timeliness, or suitability, including with respect to information that appears in closed captioning. Historical investment performances are no indication or guarantee of future success or performance. Authors/presenters may own the stocks they discuss. We make no representations or warranties regarding the advisability of investing in any particular securities or utilizing any specific investment strategies. Information is subject to change without notice. For information on use of our services, please see our Terms of Use.', '*Real-time prices by Nasdaq Last Sale. Real-time quote and/or trade prices are not sourced from all markets. Ownership data provided by LSEG and Estimate data provided by FactSet.', ""IBD, IBD Digital, IBD Live, IBD Weekly, Investor's Business Daily, Leaderboard, MarketDiem, MarketSurge and other marks are trademarks owned by Investor's Business Daily, LLC."", '©2025 Investor’s Business Daily, LLC. All Rights Reserved.']",Business,https://news.google.com/api/attachments/CC8iK0NnNDBNbHBKVlZaRFMyOVpVbUpQVFJDZkF4ampCU2dLTWdhaFJZN3NvUWc=-w280-h168-p-df
"US stocks end up on jobs data, China hopes; Tesla bounces",https://www.reuters.com/business/autos-transportation/wall-street-futures-edge-up-ahead-jobs-data-tesla-rebounds-2025-06-06/,"['Stay up to date with the latest news, trends and innovations that are driving the global automotive industry with the Reuters Auto File newsletter. Sign up here.', 'Reporting by Kanchana Chakravarty and Sukriti Gupta in Bengaluru and Saeed Azhar in New York; Editing by Maju Samuel and David Gregorio', 'Our Standards: The Thomson Reuters Trust Principles.\n, opens new tab', 'Thomson Reuters', ""Saeed Azhar is a Reuters financial journalist and part of the U.S. banking team, which covers Wall Street's biggest banks. He focuses on Goldman Sachs and Bank of America, and also writes about regional banks. Before moving to New York in July 2022, he led the finance team in the Middle East from Dubai, and also worked in Singapore, covering Southeast Asia finance."", 'Tesla shares recouped some losses that had been triggered by a spat between CEO Elon Musk and U.S. President Donald Trump, even though a truce appeared uncertain on Friday as a White House official said the president was not keen on talking to his former ally.', ""Reuters, the news and media division of Thomson Reuters, is the world’s largest multimedia news provider, reaching billions of people worldwide every day. Reuters provides business, financial, national and international news to professionals via desktop terminals, the world's media organizations, industry events and directly to consumers."", 'Access unmatched financial data, news and content in a highly-customised workflow experience on desktop, web and mobile.', 'Browse an unrivalled portfolio of real-time and historical market data and insights from worldwide sources and experts.', 'Screen for heightened risk individual and entities globally to help uncover hidden risks in business relationships and human networks.', 'All quotes delayed a minimum of 15 minutes. See here for a complete list of exchanges and delays.', '© 2025 Reuters. All rights reserved']",Business,https://news.google.com/api/attachments/CC8iK0NnNDBNbHBKVlZaRFMyOVpVbUpQVFJDZkF4ampCU2dLTWdhaFJZN3NvUWc=-w280-h168-p-df
"How major US stock indexes fared Friday, 6/6/2025",https://www.washingtonpost.com/business/2025/06/06/wall-street-stocks-dow-nasdaq/b75e773c-4315-11f0-b78e-5ddff7eb1e49_story.html,"['Stocks rose on Wall Street following a better-than-expected report on the U.S. job market', '', '', '']",Business,https://news.google.com/api/attachments/CC8iK0NnNDBNbHBKVlZaRFMyOVpVbUpQVFJDZkF4ampCU2dLTWdhaFJZN3NvUWc=-w280-h168-p-df
No title found,https://www.marketwatch.com/livecoverage/dow-s-p-500-and-nasdaq-set-to-bounce-ahead-of-jobs-data-as-tesla-shares-reboundog/card/strong-jobs-report-and-a-bit-of-fomo-are-driving-friday-s-rally-globalt-fWs1O0lB59bg02RkPRx7?mod\u003dmw_FV,[],Business,https://news.google.com/api/attachments/CC8iK0NnNDBNbHBKVlZaRFMyOVpVbUpQVFJDZkF4ampCU2dLTWdhaFJZN3NvUWc=-w280-h168-p-df
Unemployment Holds Steady; S&P 500 Closing In On 6000,https://www.forbes.com/sites/jjkinahan/2025/06/06/unemployment-holds-steady-sp-500-closing-in-on-6000/,"['', '', 'ByJJ Kinahan,', 'Senior Contributor.', '', '', '', '', '', '', '', '', '', '', '', '', '', '', '', '', '', 'SPECIAL OFFER', '$\n9.99', 'Billed Monthly', '$\n74.99', 'Billed Annually', '$\n145', 'Billed Biennially', 'Subscriptions renew automatically. You may cancel your subscription at any time.', 'Benefits']",Business,https://news.google.com/api/attachments/CC8iK0NnNDBNbHBKVlZaRFMyOVpVbUpQVFJDZkF4ampCU2dLTWdhaFJZN3NvUWc=-w280-h168-p-df
