Title,Link,Paragraphs,Topic,Image
"Your Costco Membership Card? No, It Is Not a Replacement for Real ID.",https://www.nytimes.com/2025/06/08/travel/costco-tsa-real-id.html,"['ADVERTISEMENT', '', 'The T.S.A. is reminding travelers that Costco cards are not on their own going to get you through security. “Can’t fly on hot dogs and hope,” the agency said.', 'By Talya Minsberg', 'The membership card that gets you a $1.50 hot dog combo meal will not, in fact, get you past Transportation Security Administration agents.', 'That’s what airport security officials are reminding travelers as some forget the details for Real ID, which require passengers navigating through airport security checkpoints to present a federally compliant, security-enhanced, star- or flag-emblazoned form of identification.', 'And that big gold star on Costco cards does not count.', '“Can’t fly on hot dogs and hope,” the T.S.A. posted across its social media accounts on Wednesday. “Your Costco Gold Star Membership card might score you a 48-pack of TP, magical rotisserie chicken and a hot dog and soda that defies inflation, but it won’t get you through a TSA checkpoint.”', 'While the T.S.A. is known to have a sense of humor online (the agency’s Instagram handle is @tsa, but the name is Travel Tips & Dad Joke Hits 🎶), the post was meant as a genuine reminder to those who think the membership card could be a true replacement for a government-issued identification.', 'Every few months, a Reddit thread points travelers to this tip: If you end up at the airport without a proper ID, try your Costco card instead.', '“That’s the realest ID,” someone commented. “It’s got the gold star they want to see,” another said.', 'Some posts make it sound easy: Get through security with the same card that gets you bulk-size deals.', 'On May 25, the food site Chowhound picked up a thread that ran that advice under the promising headline “How Your Costco Card Can Save You at the Airport.”', 'On June 3, the article was updated to include a disclosure: The T.S.A. does not explicitly state that a Costco card can be used as a form of identification. With new Real ID requirements, using your membership card on its own is not going to get you through security.', 'There is no Kirkland special at the airport.', 'However, because Costco membership cards include your photo and name, it may help T.S.A. agents confirm your identity if you have no other form of identification. Still, it is not a replacement for a government-issued form of identification.', 'T.S.A. agents would most likely have to take additional measures to confirm your identity, and you could be pulled aside for additional screening.', 'If you are about to travel and you don’t have a Real ID, you can get through airport security with a state-issued enhanced driver’s license, a permanent resident card (also known as a green card), a valid passport, a passport card or identification for trusted traveler programs like Global Entry and NEXUS.', 'But don’t leave your Costco card at home. The big-box store has hundreds of locations around the world, and they all take the same membership card.', 'Talya Minsberg is a Times reporter covering breaking and developing news.', 'ADVERTISEMENT']",Business,https://news.google.com/api/attachments/CC8iK0NnNVNTMDVtT0VVNGJIaEZZVkpOVFJERUF4aW1CU2dLTWdZVk5JSW9uZ2c=-w280-h168-p-df
"Your Costco membership has amazing perks, but this isn’t one of them",https://www.pennlive.com/life/2025/06/your-costco-membership-has-amazing-perks-but-this-isnt-one-of-them.html,"['', 'The TSA has cleared up rumors on social media about Costco cards being adjacent to Real ID. Costco', 'Costco cards might get you discounts on travel and vacations, but it can not get you onto a plane.', 'With the Real ID requirement now in place, those lacking one are weighing their options when it comes to flying. Rumors across social media have spread saying that Costco Membership cards could be used in place of a Real ID.', 'The Transportation Security Administration, or TSA, has cleared up the rumors in an X post confirming that no matter the level of Costco membership, it won’t get you through the airport.', '“We love hot dogs & rotisserie chickens as much as the next person, but please stop telling people their Costco card counts as a Real ID because it absolutely does not,” the post reads.', 'Lorrie Dankers, TSA spokesperson, told SFGate that rumors like this emerge yearly, but with the Real ID requirement, many have been looking for IDs that could be Real ID-adjacent.', 'Reddit posts and other articles like the one cited from Chowhound have been relaying what Dankers said is old information and doesn’t reflect the TSA’s identification process.', '“Let me tell you something about that. Whoever wrote that story is recycling old material,” Dankers said. “Essentially, what the process they’re describing is … let’s say you lost your ID and only had a Costco card in your pocket. That would help establish a baseline identity for you. The TSA officer would use that as a starting point to confirm your identity, but they would still have to go through our identity verification process.”', 'Keeping your Costco card in your wallet could certainly help the identification process, but it will not be enough to get you airborne.', 'If you’re wondering what is Real ID adjacent, here are forms of identification that are accepted in place of a Real ID according to the TSA.', 'As of May 7, if you’re flying domestically or need to access a federal building, a Real ID or one of the listed forms of identification above is required. One thing is for sure, though: the Costco membership cards should likely be left at home.', '', 'If you purchase a product or register for an account through a link on our site, we may receive compensation. By using this site, you consent to our User Agreement and agree that your clicks, interactions, and personal information may be collected, recorded, and/or stored by us and social media and other third-party partners in accordance with our Privacy Policy.', 'Use of and/or registration on any portion of this site constitutes acceptance of our User Agreement, (updated 8/1/2024) and acknowledgement of our Privacy Policy, and Your Privacy Choices and Rights (updated 1/1/2025).', '© 2025 Advance Local Media LLC. All rights reserved (About Us).\nThe material on this site may not be reproduced, distributed, transmitted, cached or otherwise used, except with the prior written permission of Advance Local.', 'Community Rules apply to all content you upload or otherwise submit to this site.', ""YouTube's privacy policy is available here and YouTube's terms of service is available here."", 'Ad Choices']",Business,https://news.google.com/api/attachments/CC8iK0NnNVNTMDVtT0VVNGJIaEZZVkpOVFJERUF4aW1CU2dLTWdZVk5JSW9uZ2c=-w280-h168-p-df
"Bad News, Bargain Shoppers: Your Costco Card Won’t Get You Past Airport Security",https://www.thedailybeast.com/bad-news-bargain-shoppers-your-costco-card-wont-get-you-past-airport-security/,"['Night Reporter', 'While a Costco membership might save you some dollars in your weekly grocery shop, one thing it won’t do is get you through airport security. The Transportation Security Agency has issued a statement clarifying that a Costco card cannot be used as valid ID when flying domestic. “We love hotdogs & rotisserie chickens as much as the next person but please stop telling people their Costco card counts as a REAL ID because it absolutely does not,” the TSA wrote on Facebook. In fairness, up until last month, adult passengers were able to use a range of ID cards to travel and there have been documented cases of Costco cards being waved through. Changes brought in on May 7 though, requiring the use of a ‘REAL ID’ like a driver’s license, put an end to the thrifty life hack.', 'Night Reporter', 'jack.revell@thedailybeast.com', 'Got a tip? Send it to The Daily Beast here.', 'ADVERTISEMENT', 'ADVERTISEMENT', 'ADVERTISEMENT', 'ADVERTISEMENT']",Business,https://news.google.com/api/attachments/CC8iK0NnNVNTMDVtT0VVNGJIaEZZVkpOVFJERUF4aW1CU2dLTWdZVk5JSW9uZ2c=-w280-h168-p-df
No title found,https://www.sfgate.com/travel/article/tsa-refutes-popular-food-blog-says-costco-cards-20359087.php,[],Business,https://news.google.com/api/attachments/CC8iK0NnNVNTMDVtT0VVNGJIaEZZVkpOVFJERUF4aW1CU2dLTWdZVk5JSW9uZ2c=-w280-h168-p-df
TSA: Costco cards are not valid forms of ID at airport security,https://www.scrippsnews.com/us-news/tsa-costco-cards-are-not-valid-forms-of-id-at-airport-security,"['Menu', 'The Transportation Security Administration is advising travelers that Costco membership cards are not an acceptable form of identification at airport security checkpoints.', 'The clarification comes amid false rumors circulating on social media suggesting that the wholesale club cards can be used to clear security.', 'TSA officials say the claims are untrue and could cause delays for passengers who show up without valid identification.', 'RELATED STORY | After years of delays, TSA confirms Real ID enforcement will begin May 7', '""We love hotdogs & rotisserie chickens as much as the next person but please stop telling people their Costco card counts as a REAL ID because it absolutely does not,"" The TSA posted on X.', 'As of May 7, travelers flying domestically must present a REAL ID-compliant driver’s license or another acceptable form of ID, such as a passport, U.S. military ID, border crossing card or permanent resident card.', 'Passengers without proper identification may be forced to undergo additional screening or be denied boarding.', 'A full list of acceptable IDs is available on the TSA’s website.', '', 'Stay updated with top headlines and news that impacts you—delivered to your inbox.', 'By signing up, you agree to our terms of use, our privacy policy, and to receive marketing and account-related emails from Scripps News. You can unsubscribe at any time.']",Business,https://news.google.com/api/attachments/CC8iK0NnNVNTMDVtT0VVNGJIaEZZVkpOVFJERUF4aW1CU2dLTWdZVk5JSW9uZ2c=-w280-h168-p-df
Does a Costco card qualify as Real ID at the airport? Here's how the rumor started,https://www.azcentral.com/story/money/business/consumers/2025/06/09/does-costco-card-qualify-as-real-id-what-to-know-about-rumor/84114004007/,"['A Costco membership comes with a lot of perks, like $1.50 hot dog combos at the food court and major discounts on popular products and service.', ""But don't expect your Costco card to get you through TSA next time you're at the airport."", 'TSA proclaimed in an X post on Wednesday, June 4: ""We love hotdogs & rotisserie chickens as much as the next person but please stop telling people their Costco card counts as a REAL ID because it absolutely does not.""', 'As of May 7, travelers need a Real ID or other acceptable identification for domestic flights and accessing federal facilities. This left some travelers scrambling and scratching their heads before recent flights.', 'TSA Pacific spokesperson Lorie Dankers told SFGate that the rumor of Costco cards being accepted as official identification pops up every year or so. When people try to use their warehouse club cards at airports, for instance, it could lead to delays and travel headaches, she added.', 'The misconception started after food blog Chowhound claimed in the initial version of an article titled ""How Your Costco Card Could Save You At The Airport,"" that people\'s Costco cards could pass through TSA because it is considered a photo ID. The article cited Reddit, where users claimed their warehouse club cards helped them through airport security when they forgot or lost their regular ID.', 'After TSA debunked the rumor on social media, Chowhound issued an update to the article, saying, ""A previous version of this article stated TSA is likely to accept a Costco membership card in lieu of a valid form of ID. TSA does not explicitly state you can use a Costco card as a form of identification, explaining, \'The TSA officer may ask you to complete an identity verification process which includes collecting information such as your name and current address to confirm your identity. If your identity is confirmed, you will be allowed to enter the screening checkpoint, where you may be subject to additional screening.\'""', 'These documents qualify as a Real ID, according to the TSA:', 'These are the Costco locations in Arizona:']",Business,https://news.google.com/api/attachments/CC8iK0NnNVNTMDVtT0VVNGJIaEZZVkpOVFJERUF4aW1CU2dLTWdZVk5JSW9uZ2c=-w280-h168-p-df
TSA tells fliers: Stop flashing your Costco card at REAL ID checkpoints,https://www.livenowfox.com/news/tsa-says-costco-card-not-real-id-compliant,"['', ""Kristi Noem told a congressional panel that 81% of travelers already have IDs that comply with the REAL ID requirements. Nick de Mauro, CEO of Law Enforcement against drugs & violence and former NJ Police Officer & Detective, joins LiveNOW from FOX, along with FOX's Chelsea Torres, to break down the latest information."", 'As travelers adjust to new identification requirements for flying in the U.S., TSA has some advice for fliers who may be confused: Your Costco membership card does not count as a REAL ID. ', 'TSA shared a comical reminder on its social media accounts this week, noting that while they ""love hotdogs & rotisserie chickens as much as the next person, please stop telling people their Costco card counts as a REAL ID because it absolutely does not."" ', 'As many social media users commented on the post, it’s easy to see why they’d be confused: Most REAL IDs have a star on them, as do Costco membership cards. ', 'FILE - A customer shows their Costco membership card in this arranged photograph inside a Costco Wholesale Corp. store in Villebon-sur-Yvette, France, on Friday, Nov. 3, 2017. Photographer: Marlene Awaad/Bloomberg via Getty Images', 'Big picture view:', 'REAL ID is a federally compliant state-issued license or identification card that the DHS says is a more secure form of identification. That’s because getting a REAL ID requires more personal documentation than what’s required to obtain a regular license.', 'RELATED: Will REAL ID be required for other transportation after May 7?', 'Besides needing a REAL ID to fly domestically, you will also need one to access certain federal buildings and facilities.', 'The backstory:', 'When the REAL ID Act was signed into law in 2005, it enacted a recommendation from the 9/11 Commission that the government set security standards for state-issued driver’s licenses and IDs.', '""REAL ID is a coordinated effort by the federal government to improve the reliability and accuracy of driver’s licenses and identification cards,"" John Essig, the Transportation Security Administration’s Security Director for airports in the New York City region said in a press release on April 3. ""The improvements are intended to inhibit terrorists’ ability to evade detection by using fraudulent identification.""', 'Real ID requirements are set to go into effect soon. LiveNOW discusses what is expected of travelers soon with the new identification requirements at airports and other ports.', 'The REAL ID Act was supposed to begin rolling out in 2008, ""but has faced repeated delays due to state implementation challenges and the COVID-19 pandemic,"" said Nina Ruggiero, senior editorial director for Travel + Leisure. ""The combination of varying state processes and shifting deadlines has added to the overall confusion around REAL IDs and likely led some travelers to take the deadlines less seriously.""', 'Dig deeper:', 'If you’ve gotten a new ID in the last few years, it could already be REAL ID-compliant.', '""I also hear from travelers who are confused as to whether or not they already have a REAL ID,"" Ruggiero said. ""Some people who have recently renewed their license may already have a compliant ID and not know it,"" so you may want to double-check yours before starting the process.', 'A REAL ID-compliant driver’s license has a symbol ( in most states, a star ) in the top corner of the card.', 'If you live in Michigan, Minnesota, New York, Vermont or Washington, it’s possible you could have an ""enhanced″ ID card instead, which permits you to both fly domestically and cross land and sea borders into Mexico and Canada from the U.S. It does not, however, allow you to fly into either of those countries.', 'Enhanced IDs will have an American flag icon, as well as the word ""enhanced"" at the top of the card.', 'What you can do:', 'If you need a REAL ID, visit the website of your state’s driver’s licensing agency to find out the specific steps, including whether you’ll need to make an appointment at a DMV and what documentation you’ll need when you get there.', 'You will likely still be able to fly without a REAL ID, but you may be diverted to a different line and have extra steps to board the plane. ', ""What they're saying:"", '""The TSA officer may ask you to complete an identity verification process which includes collecting information such as your name and current address to confirm your identity,"" TSA states on its website. ""If your identity is confirmed, you will be allowed to enter the screening checkpoint, where you may be subject to additional screening.', '""You will not be allowed to enter the security checkpoint if you choose to not provide acceptable identification, you decline to cooperate with the identity verification process, or your identity cannot be confirmed.""', 'The Source: This report includes information from TSA, The Associated Press and previous LiveNow from FOX reporting. ', '', 'This material may not be published, broadcast, rewritten, or redistributed. ©2025 FOX Television Stations']",Business,https://news.google.com/api/attachments/CC8iK0NnNVNTMDVtT0VVNGJIaEZZVkpOVFJERUF4aW1CU2dLTWdZVk5JSW9uZ2c=-w280-h168-p-df
TSA refutes rumors about using Costco cards as an airport ID alternative,https://www.ktvu.com/news/tsa-refutes-rumors-about-using-costco-cards-airport-id-alternative,"['', ""FILE - Passengers at O'Hare International Airport wait in line to be screened at a Transportation Security Administration (TSA) checkpoint."", 'OAKLAND, Calif. - Federal transportation officials are strongly refuting internet rumors that suggest a Costco membership card can be used as a form of identification to get through airport security.', ""What they're saying:"", '""That is not considered an acceptable form of identification. It\'s not a government-issued ID,"" said Transportation Security Administration Spokesperson Lorie Dankers, who noted that the agency has been very clear about what constitutes an acceptable form of identification for air travel, especially in the context of the REAL ID.   ', ""The new law replacing the traditional driver's license with a REAL ID-compliant license for domestic air travel went into effect last month after years of delays.  "", 'In addition to REAL IDs, other acceptable forms of identification include a passport, a U.S. passport card, a Veteran Health Identification Card, and a Department of Homeland Security trusted traveler card like Global Entry and NEXUS.  ', '""Adult passengers 18 and older must show valid identification at the airport checkpoint in order to travel,"" the TSA specified on its website, with a list of acceptable IDs.', 'The agency also noted that the list is subject to change without notice, and advised travelers to recheck it before getting on a flight.  ', ""SEE ALSO: Traveling to the UK? You'll need this document to enter the country"", 'Dankers addressed the Costco card rumors by saying that every few months, this fallacy circulates on the internet, and people are misled to believe the membership card will be accepted at TSA security checkpoints. But she warned against depending on a Costco card or any non-governmental card to get you cleared to board a plane.', 'A Reddit post from last month has gotten a lot of traction with many people discussing their experiences. ', '""It’s mostly click-bait,"" Dankers said. ', 'She did note that Costco cards and other identification that uses a photo can be used in extreme cases to support those travelers who find themselves in a bind due to lost or stolen identification.', 'Dankers said that in the situation where a traveler only has a non-governmental-issued photo ID on them, anything from a Costco membership card to a library card or student identification, the cards can be used to establish a launching point in the strict and detailed process of proving their identity.  ', ""It's better than not having any form of a photo ID. "", '""At least we know that some place has given them an ID,"" the TSA spokesperson explained, while stressing, ""That in itself is not considered an acceptable ID but is considered a baseline.""', 'That baseline would allow TSA officials to begin a vetting process, involving a series of verification steps to try and confirm someone’s identity.', 'But travelers are warned that it’s not a process anyone would want to go through, as it’s time-consuming, and if the person’s identity can’t be confirmed, they will be denied access to fly.', '""There is no upside to doing this because all it does is delay you,"" Dankers said, adding that it\'s not only going to delay the traveler without their proper ID on them, but the process can lead to long delays for others.', 'A TSA agent working on your case will affect the workflow at the checkpoint and threaten the schedules of other travelers who are rushing to catch a flight. ', '""It causes our resources to be taken,"" Dankers said, stressing, ""It should only be used in the most extreme of cases.""', ""And even then, there's no guarantee your Costco or other non-governmental photo card will lead to a verification of your ID and allow you to get on that flight.  "", ""It's Memorial Day weekend, and travelers can expect longer-than-usual wait times at airports as not all travelers are READ OD compliant."", ""Information for this story came from KTVU's interview with regional TSA Spokesperson Lorie Dankers and a May 8 Reddit post. "", 'All the news you need to know, every day', 'By clicking Sign Up, I confirm\nthat I have read and agree\nto the Privacy Policy\nand Terms of Service.', '', 'This material may not be published, broadcast, rewritten, or redistributed. ©2025 FOX Television Stations']",Business,https://news.google.com/api/attachments/CC8iK0NnNVNTMDVtT0VVNGJIaEZZVkpOVFJERUF4aW1CU2dLTWdZVk5JSW9uZ2c=-w280-h168-p-df
"TSA debunks online rumor: No, you can't use a Costco card as valid ID at airports",https://www.wral.com/lifestyle/travel/tsa-debunks-costco-card-id-airports-june-2025/,"[""Costco cards may be good for getting hot dogs, but they can't be used as a form of identification at the airport. "", ""The Transportation Security Administration took to X this week to remind flyers that, despite rumors on social media, Costco and other membership club cards don't count for screening."", 'The TSA wrote, ""We love hotdogs & rotisserie chickens as much as the next person but please stop telling people their Costco card counts as a REAL ID because it absolutely does not.""', 'The false rumors that travelers can use the Costco card with the gold star on the front and a photo ID on the back to board a plane have apparently been circulating the internet for years. A recent Reddit thread features multiple commenters saying they made it past security with a Costco card.', '""I actually forgot my ID once and they did let me go through with my Costco card,"" one Reddit user wrote.', 'Not only are Costco cards not accepted, the TSA said travelers trying to use club cards for ID at security checkpoints could actually lead to delays and travel headaches, as travelers may be questioned.', 'Last month, TSA began enforcing the requirement for REAL IDs and other acceptable forms of identification used for security points. Passports, border crossing and permanent resident cards are all acceptable forms of ID. The full list below can be found online.', 'Local news & alerts']",Business,https://news.google.com/api/attachments/CC8iK0NnNVNTMDVtT0VVNGJIaEZZVkpOVFJERUF4aW1CU2dLTWdZVk5JSW9uZ2c=-w280-h168-p-df
