Title,Link,Paragraphs,Topic,Image
"Your Costco Membership Card? No, It Is Not a Replacement for Real ID.",https://www.seattletimes.com/nation-world/your-costco-membership-card-no-it-is-not-a-replacement-for-real-id/,"['The membership card that gets you a $1.50 hot dog combo meal will not, in fact, get you past Transportation Security Administration agents.', 'That’s what airport security officials are reminding travelers as some forget the details for Real ID, which require passengers navigating through airport security checkpoints to present a federally compliant, security-enhanced, star- or flag-emblazoned form of identification.', 'And that big gold star on Costco cards does not count.', '“Can’t fly on hot dogs and hope,” the TSA posted across its social media accounts Wednesday. “Your Costco Gold Star Membership card might score you a 48-pack of TP, magical rotisserie chicken and a hot dog and soda that defies inflation, but it won’t get you through a TSA checkpoint.”', 'While the TSA is known to have a sense of humor online (the agency’s Instagram handle is @tsa, but the name is Travel Tips & Dad Joke Hits ), the post was meant as a genuine reminder to those who think the membership card could be a true replacement for a government-issued identification.', 'Every few months, a Reddit thread points travelers to this tip: If you end up at the airport without a proper ID, try your Costco card instead.', '“That’s the realest ID,” someone commented. “It’s got the gold star they want to see,” another said.', 'Some posts make it sound easy: Get through security with the same card that gets you bulk-size deals.', 'On May 25, the food site Chowhound picked up a thread that ran that advice under the promising headline “How Your Costco Card Can Save You at the Airport.”', 'On June 3, the article was updated to include a disclosure: The TSA does not explicitly state that a Costco card can be used as a form of identification. With new Real ID requirements, using your membership card on its own is not going to get you through security.', 'There is no Kirkland special at the airport.', 'However, because a Costco membership card includes your photo and name, it may help TSA agents confirm your identity if you have no other form of identification. Still, it is not a replacement for a government-issued form of identification.', 'TSA agents would most likely have to take additional measures to confirm your identity, and you could be pulled aside for additional screening.', 'If you are about to travel and you don’t have a Real ID, you can get through airport security with a state-issued enhanced driver’s license, a permanent resident card (also known as a green card), a valid passport, a passport card or identification for trusted traveler programs like Global Entry and NEXUS.', 'But don’t leave your Costco card at home. The big-box store has hundreds of locations around the world, and they all take the same membership card.', '']",Business,https://news.google.com/api/attachments/CC8iK0NnNVNTMDVtT0VVNGJIaEZZVkpOVFJERUF4aW1CU2dLTWdZVk5JSW9uZ2c=-w280-h168-p-df
What is REAL ID to fly on a plane as TSA clarifies Costco cards confusion,https://www.unilad.com/news/travel/real-id-plane-tsa-rules-costco-confusion-799677-20250609,"['Home> News> Travel', 'Ellie Kemp', ""As the TSA confirms Americans cannot use their Costco membership cards to board domestic flights, let's take a look at what REAL ID is and why you need it."", ""Getting on a plane can be stressful, whether you're traveling on a short-haul flight or even all the way to Hawaii."", ""When you've got check-in and security to worry about, you most certainly don't want to be delayed for having the wrong form of ID."", 'And as of May 2025, US citizens have had to ensure their IDs are REAL compliant in order to travel.', '', ""The Transportation Security Administration (TSA) has been forced to clarify that people can't use their Costco membership card to board a flight either, as per a post on the TSA’s Facebook page."", 'The government agency posted on June 4: ""We love hotdogs & rotisserie chickens as much as the next person but please stop telling people their Costco card counts as a REAL ID because it absolutely does not.""', ""Elsewhere on its website, the TSA explained exactly what REAL ID is and why it's been put into motion."", '', ""The REAL ID Act was actually passed in Congress back in 2005, enacting the 9/11 Commission's recommendation that the Federal Government 'set standards for the issuance of sources of identification, such as driver's licenses'."", ""The Act established minimum security standards for state-issued driver's licenses and identification cards and prohibits certain federal agencies from accepting for official purposes licenses and identification cards from states that do not meet these standards."", 'So, people need them not only to board federally regulated commercial aircraft, but to access certain federal facilities as well as nuclear power plants.', 'And as of May 7, 2025, state-issued driver’s licenses and IDs - that are not REAL ID compliant - are no longer accepted as valid forms of identification at airports.', '', 'REAL IDs are subject to more enhanced security standards, including documentation like birth certificates, proof of Social Security number, and proof of US residency.', 'They are marked with a star at the top of the card, indicating compliance with federal standards.', 'So, passengers need to travel with a REAL ID, or an acceptable alternative form of ID, like a passport.', '""Passengers who present a state-issued identification that is not REAL ID compliant at TSA checkpoints and who do not have another acceptable alternative form of ID will be notified of their non-compliance, may be directed to a separate area and may receive additional screening,"" the TSA warns.', '', '""This includes TSA PreCheck passengers.""', 'The TSA advises visiting your state’s driver’s licensing agency website to find out exactly what documentation is required to obtain a REAL ID.', '', 'To obtain a REAL ID, you must provide your full legal name, date of birth, Social Security number, two documents that prove your address of principal residence, and proof of lawful status.', 'States may impose additional requirements, so check with your state’s driver’s licensing agency website, before visiting them in person, for additional guidance and assistance.', 'Topics: Travel, News, US News', 'ADVERT', 'ADVERT', 'ADVERT']",Business,https://news.google.com/api/attachments/CC8iK0NnNVNTMDVtT0VVNGJIaEZZVkpOVFJERUF4aW1CU2dLTWdZVk5JSW9uZ2c=-w280-h168-p-df
Costco Members Cautioned Against Using Their Membership Card,https://www.mensjournal.com/news/costco-members-cautioned-about-using-their-membership-card,"['John Keeble/Getty Images', 'Costco is a popular big-box membership warehouse club, offering discounted prices on brand-name merchandise in bulk and non-bulk sizes. Costco is actually the third-largest retailer in the world, only behind Walmart and Amazon, and is a Fortune 500 company.', '""With hundreds of locations worldwide, Costco provides a wide selection of merchandise, plus the convenience of specialty departments and exclusive member services, all designed to make your shopping experience a pleasurable one,"" the company states on their website.', 'To shop at Costco, members have to own a membership card. The Costco ""Gold Star Membership"" card includes two card and the ability to shop online and in warehouses. For those who want to up their game, the Costco ""Executive Membership"" package also includes an annual 2% reward and Costco services discounts.', 'But, Costco customers are being told not to use their membership card for one specific thing.', ""The TSA is showing their frustration with travelers who are not showing them a REAL ID to take a flight, and they don't want passengers to think that their Costco card counts as a proper REAL ID."", '""In a Facebook post shared on June 4, the TSA stated a Costco membership card is not, in any way, an acceptable form of identification to get on a plane. Yes, people are actually trying to use their Costco cards to get on aiplanes.', '“We love hotdogs & rotisserie chickens as much as the next person,"" the TSA stated in their post, ""but please stop telling people their Costco card counts as a REAL ID because it absolutely does not.""', 'Beginning May 7, the majority of adult citizens taking a flight in the U.S. must show either a passport or upgraded identification card that meets federal REAL ID standards. The U.S. Department of Homeland Security has information for each state about scheduling appointments and also provides the types of documents needed.', ""Anne Erickson is a trending news writer for Men's Journal. She's an award-winning reporter who covers sports and entertainment.""]",Business,https://news.google.com/api/attachments/CC8iK0NnNVNTMDVtT0VVNGJIaEZZVkpOVFJERUF4aW1CU2dLTWdZVk5JSW9uZ2c=-w280-h168-p-df
TSA Ban Costco Cards As Travel ID,https://www.newsweek.com/tsa-costco-card-real-id-2082679,"['When you use this site, we collect personal information via technologies like cookies to improve your site experience. We also share information about your use of our site with our social media, advertising, and analytics partners. You can manage your cookie settings at any time. To learn more, please view our Privacy Policy.', '', '', '', '', '', '', '', 'The Transportation Security Administration (TSA) has taken to social media to clarify that Costco cards do not count as REAL ID, in an effort to clear up confusion following the implementation of new laws last month.', 'TSA wrote in a Facebook post: ""We love hotdogs & rotisserie chickens as much as the next person but please stop telling people their Costco card counts as a REAL ID because it absolutely does not.""', 'Newsweek has reached out to Costco via an online contact form for comment outside of regular working hours.', ""Twenty years after it was first proposed, REAL ID has been implemented, meaning that Americans and permanent residents will only be able to pass through airport security or enter some federal government buildings if they have a REAL ID, or another valid form of identification, such as a passport or Enhanced Driver's Licenses and identification cards (EDL/EID) issued in the following states: Michigan, Minnesota, New York, Vermont and Washington."", 'Real ID-compliant cards are marked with a star at the top and require applicants to provide documents that prove their identity, Social Security number and lawful status in the U.S.', ""The REAL ID Act was signed into law in 2005, establishing uniform security standards for state-issued driver's licenses and identification cards and it came into effect as of May 7, 2025."", 'A Costco ID Card is issued to those with a Costco membership. The card includes a photo, membership number and name and membership type. Some membership cards have a star on them.', 'Costco cards never counted as a REAL ID, and you were never able to travel on one.', 'Department of Homeland Security (DHS) Secretary Kristi Noem said in a press release that: ""Real ID helps ensure that travelers are who they say they are and prevents fraud by criminals, terrorists, and illegal aliens.""', 'One social media user commented on TSA\'s Facebook post: ""I was let into a bar once cause what person has a Costco membership under the age of 21 it does help to have one.""', 'Another social media user commented: ""Im pretty sure that the Costco card is stronger than some passports.""', 'Another social media user commented: ""I was once asked for my Costco card by a TSC gate agent when I couldn\'t find my driver\'s license since it was a photo ID, and I got through. So I feeeeeel like we should count it.""', 'Travelers will need to ensure they possess a REAL ID or other federally approved documentation for air travel and federal facility access.', '', '', 'Marni Rose McFall is a Newsweek reporter based in London, U.K. Her focus is on internet trends, U.S. politics and ... read more', 'Newsletters in your inbox See all', 'Company', 'Editions:', 'Contact', 'Terms of Use', '© 2025 NEWSWEEK DIGITAL LLC']",Business,https://news.google.com/api/attachments/CC8iK0NnNVNTMDVtT0VVNGJIaEZZVkpOVFJERUF4aW1CU2dLTWdZVk5JSW9uZ2c=-w280-h168-p-df
"TSA: No, Costco membership card is not Real ID replacement",https://www.960theref.com/news/trending/tsa-no-costco-membership-card-is-not-real-id-replacement/EVCXZD3MABCFBEST32XCEVFM6E/,"['', 'Yes, it does have your picture, your name and a star, but a Costco membership card is not a replacement for a Real ID.', 'The Transportation Security Administration recently posted a reminder to its social media accounts, “Can’t fly on hot dogs and hope. Your Costco Gold Star Membership card might score you a 48-pack of TP, magical rotisserie chicken and a hot dog and soda that defies inflation, but it won’t get you through a TSA checkpoint.”', 'A post shared by Travel Tips & Dad Joke Hits 🎶 (@tsa)', 'The New York Times said every few months, Reddit brings up using the Costco card as an ID replacement at the airport.', 'People online claim they have used their Costco card as their ID when they lost or forgot their normal one, USA Today reported.', 'This time it was an article on Chowhound that spread the misinformation, citing Reddit posts.', 'But it isn’t that simple.', 'The card could be used to verify who you are if you have no other form of identification, according to the Times.', 'TSA Spokesperson Lori Dankers said it could be used as a starting point for verification, but not a total pass through security.', '“Let me tell you something about that. Whoever wrote that story is recycling old material,” Dankers told SF Gate. “Essentially, what the process they’re describing is … let’s say you lost your ID and only had a Costco card in your pocket. That would help establish a baseline identity for you. The TSA officer would use that as a starting point to confirm your identity, but they would still have to go through our identity verification process.”', 'That means TSA agents would have to use additional means to confirm you say who you are and you may have to undergo additional screenings, the Times said.', 'You may have to provide your two previous addresses for example, SF Gate said.', 'Dankers said the Costco card is better than nothing but, “We don’t want to oversell this as an option.”', 'Chowhound ended up adding a clarification which reads in part, “A previous version of this article stated TSA is likely to accept a Costco membership card in lieu of a valid form of ID. TSA does not explicitly state you can use a Costco card as a form of identification, and ends with “Now with the Real ID requirements, it is even less likely to get you through TSA quickly or successfully.""', 'So what should you do if you don’t have a Real ID? You can use a state-issued enhanced driver’s license; a permanent resident card, also known as a green card; valid passport or passport card or a trusted traveler identification from Global Entry or NEXUS.', 'The Real ID requirement went into effect on May 7, USA Today reported.', '© 2025 Cox Media Group', 'Sign up below to be added to our mailing list for the latest news updates, access to exclusive contests, and more!', 'Everything you love about 960theref.com and more! Tap on any of the buttons below to download our app.', 'Enable our Skill today to listen live at home on your Alexa Devices!', '', '© 2025 Cox Media Group. All Rights Reserved. By using this website, you accept the terms of our Visitor Agreement and Privacy Policy, and understand your options regarding Ad Choices. Learn about careers at Cox Media Group.', 'Manage Cookie Preferences', '', '', '', '']",Business,https://news.google.com/api/attachments/CC8iK0NnNVNTMDVtT0VVNGJIaEZZVkpOVFJERUF4aW1CU2dLTWdZVk5JSW9uZ2c=-w280-h168-p-df
TSA Just Banned Costco Cards at Airport Security,https://www.yahoo.com/news/tsa-just-banned-costco-cards-033225289.html,"['', '', '', '', '', ""Since May 7, 2025, travelers have needed a REAL ID-compliant driver's license or state ID to board domestic flights. And now, TSA is putting its foot down, telling travelers that their Costco cards do not count as a valid form of ID to travel with."", 'TSA posted the following message on Facebook: ""We love hotdogs & rotisserie chickens as much as the next person but please stop telling people their Costco card counts as a REAL ID because it absolutely does not.""', 'Several people flocked to the comments section of the Facebook post, writing things like, ""I mean at least it has a STAR on it,"" and ""Im pretty sure that the Costco card is stronger than some passports."" Another jokingly wrote, ""So, you\'re saying we should bring you a chicken?""', 'The post garnered over 15k reactions as of June 7, with over 700 comments.', 'The REAL ID Act was passed in 2005 following a recommendation from the 9/11 Commission to ""set standards for the issuance of sources of identification, such as driver\'s licenses.” The process has taken 20 years to implement, per the Associated Press. ', 'At this time, all states are issuing REAL ID-compliant cards. In response to the question, ""How do I get a REAL ID?"" TSA\'s site reads, ""Visit your state’s driver’s licensing agency website to find out exactly what documentation is required to obtain a REAL ID. At a minimum, you must provide documentation showing: 1) Full Legal Name; 2) Date of Birth; 3) Social Security Number; 4) Two Proofs of Address of Principal Residence; and 5) Lawful Status.""', ""The confusion over the Costco cards likely stems from the prominent gold stars on members' cards. Real ID-compliant cards either contain a star— a lone star, one in a circle, or one in a bear."", 'Related: Salmonella Outbreak Linked to Cucumbers Spreads to 18 States', ""TSA Just Banned Costco Cards at Airport Security first appeared on Men's Journal on Jun 8, 2025""]",Business,https://news.google.com/api/attachments/CC8iK0NnNVNTMDVtT0VVNGJIaEZZVkpOVFJERUF4aW1CU2dLTWdZVk5JSW9uZ2c=-w280-h168-p-df
"No, your Costco card does not count as REAL ID, TSA says",https://www.statesman.com/story/news/state/2025/06/09/costco-card-real-id-texas-tsa-identification-card-airport-travel/84111185007/,"[""The Transportation Security Administration wants to make something very clear: you can't use your Costco membership card as a form of identification."", 'On June 4, the TSA attempted to dispel rumors on social media that using a Costco card is equivalent to using a REAL ID to get through airport security. According to reports, the rumor has been seen on Reddit posts and blog posts.', 'TSA spokesperson Lorie Dankers said presenting your Costco card to TSA will just lead to delays.', '""Let me tell you something about that. Whoever wrote that story is recycling old material,” Dankers told SF Gate.', '""Essentially, what the process they’re describing is … let’s say you lost your ID and only had a Costco card in your pocket. That would help establish a baseline identity for you. The TSA officer would use that as a starting point to confirm your identity, but they would still have to go through our identity verification process.”', ""Here is the type of ID you're supposed to have at the airport."", ""The REAL ID Act, passed in 2005, sets security standards for issuing sources of identification, such as driver's licenses. Congress passed the REAL ID Act in response to the September 11 attacks. "", 'Texas began issuing REAL ID-compliant cards on October 10, 2016. These cards are marked with a gold circle with an inset star located in the upper right-hand corner. ', ""If you look at your current Texas driver's license, it should have a gold star at the top-right corner of the ID. Your current Texas driver's license or ID is REAL ID-compliant if it has a gold star in the top right corner. If it doesn’t, you’ll see the gold star on your next renewal or request a replacement card."", 'If you plan to fly domestically, the deadline to be REAL ID ready was May 7, 2025.', 'On June 4, the TSA shared a post on X, advising people not to attempt to use a Costco membership card of any kind to bypass airport security. A Costco membership card will not count as a REAL ID.', ""According to Texas.Gov, you can apply for a new REAL ID-compliant Texas driver's license or ID in person at a Texas DPS office. You may be eligible to renew your existing Texas driver's license or ID online."", ""You can still use your current, unexpired Texas driver's license or ID to drive and for non-federal ID purposes. When it’s time to renew your driver's license or ID, you’ll get a REAL ID-compliant one. "", 'REAL IDs work for domestic travel, but can’t replace a passport for international flights. Passports are still required for venturing beyond U.S. borders.']",Business,https://news.google.com/api/attachments/CC8iK0NnNVNTMDVtT0VVNGJIaEZZVkpOVFJERUF4aW1CU2dLTWdZVk5JSW9uZ2c=-w280-h168-p-df
"Sorry, you can't use your Costco membership card to get through TSA",https://www.businessinsider.com/tsa-costco-membership-card-not-real-id-flying-2025-6,"['""Can\'t fly on hotdogs and hope.""', ""That's according to the Transportation Security Administration, which recently posted on social media to let Americans know they cannot, in fact, use their Costco membership cards in place of a Real ID."", '""We love hotdogs & rotisserie chickens as much as the next person but plz stop telling people their Costco card counts as a REAL ID because it absolutely does not,"" TSA said in an X post on June 4.', 'In a follow-up post on Instagram, the agency said a Costco Gold Star Membership card might get you a 48-pack of toilet paper and other goodies the warehouse retailer is known for, but ""it won\'t get you through a TSA checkpoint.""', '""We get it, you\'re a bulk-buying boss, the executive of excess, the sultan of samples. But unless your $1.50 hot dog has a passport, you\'re gonna need a REAL ID or other acceptable form of ID to fly,"" the post said.', 'The posts from TSA, which is known to have a tongue-in-cheek social media presence, came after Real ID requirements were set to take effect in May.', 'Americans were scrambling ahead of the May 7 deadline to secure a Real ID, which the Department of Homeland Security had previously said would be required to fly domestically from that date. However, Homeland Security Secretary Kristi Noem announced that Americans would still be able to fly without a Real ID for the time being.', ""TSA's website currently says that travelers without a Real ID — or an alternative form of acceptable identification, like a passport — will be notified of their noncompliance and could be subject to additional screening at the airport."", ""As for other acceptable forms of identification? Costco cards didn't make the list."", '', '', '', '', '']",Business,https://news.google.com/api/attachments/CC8iK0NnNVNTMDVtT0VVNGJIaEZZVkpOVFJERUF4aW1CU2dLTWdZVk5JSW9uZ2c=-w280-h168-p-df
