Title,Link,Paragraphs,Topic,Image
TSA issued a warning about Costco cards and the reason is stranger than you think,https://www.al.com/news/2025/06/tsa-issued-a-warning-about-costco-cards-and-the-reason-is-stranger-than-you-think.html,"['', 'In a June 4 post, the TSA debunked long-standing rumors swirling on social media and warned people Costco membership cards do not qualify as a REAL ID.Getty Images', 'There has been much talk about the need for a REAL ID (called a STAR ID if you live in Alabama) if you plan to travel on a commercial airline. The requirement has prompted an influx of warnings, tips and guidelines from the Transportation Security Administration related to the new identification rules.', 'That’s why one of the security agency’s latest social media messages is grabbing attention and leading people to ask: “You mean someone has tried this?”', 'In a June 4 post, the TSA debunked long-standing rumors on social media and warned people that Costco membership cards do not qualify as a REAL ID.', '“We love hotdogs and rotisserie chickens as much as the next person but please stop telling people their Costco card counts as a REAL ID because it absolutely does not,” the TSA said.', 'READ MORE: Do you need a REAL ID, STAR ID to cruise? Carnival Cruise Line shares clear answer', 'People’s online reactions showed most appreciated post.', '“I mean at least it has a star on it,” a commenter said, referencing the “Gold Star” label on membership cards for the warehouse club.', '“I should have put “Using a Costco membership card as a REAL ID” on my 2025 Bingo card,” someone replied.', 'REAL ID rules went into effect last month and require enhanced state-issued driver’s licenses and ID cards to be used for official purposes, including flying onboard commercial aircraft. The ID looks like a regular driver’s license but is differentiated by a gold star near the top.', 'READ MORE: 15 things you can use if you don’t have Real ID, Star ID, according to TSA', 'Failure to present proper ID can lead to delays, additional screenings and the possibility of not being allowed past a security checkpoint, the TSA warned.', 'In addition to REAL ID, other approved identification includes:', '• State-issued Enhanced Driver’s License (EDL) or Enhanced ID (EID)', '• U.S. passport', '• U.S. passport card', '• DHS trusted traveler cards (Global Entry, NEXUS, SENTRI, FAST)', '• U.S. Department of Defense ID, including IDs issued to dependents', '• Permanent resident card', '• Border crossing card', '• An acceptable photo ID issued by a federally recognized Tribal Nation/Indian Tribe, including Enhanced Tribal Cards (ETCs).', '• HSPD-12 PIV card', '• Foreign government-issued passport', '• Canadian provincial driver’s license or Indian and Northern Affairs Canada card', '• Transportation worker identification credential', '• U.S. Citizenship and Immigration Services Employment Authorization Card (I-766)', '• U.S. Merchant Mariner Credential', 'RECOMMENDED', 'U.S. Embassy security alert: Travelers to vacation hotspot face serious risk from common activityJun. 6, 2025, 7:00 a.m.', '$4 million in Alabama EBT Card funds stolen in 1 month: What you need to doJun. 5, 2025, 10:19 a.m.', '• Veteran Health Identification Card (VHIC)', '', '', 'If you purchase a product or register for an account through a link on our site, we may receive compensation. By using this site, you consent to our User Agreement and agree that your clicks, interactions, and personal information may be collected, recorded, and/or stored by us and social media and other third-party partners in accordance with our Privacy Policy.', 'Use of and/or registration on any portion of this site constitutes acceptance of our User Agreement, (updated 8/1/2024) and acknowledgement of our Privacy Policy, and Your Privacy Choices and Rights (updated 1/1/2025).', '© 2025 Advance Local Media LLC. All rights reserved (About Us).\nThe material on this site may not be reproduced, distributed, transmitted, cached or otherwise used, except with the prior written permission of Advance Local.', 'Community Rules apply to all content you upload or otherwise submit to this site.', ""YouTube's privacy policy is available here and YouTube's terms of service is available here."", 'Ad Choices']",Business,https://news.google.com/api/attachments/CC8iK0NnNVNTMDVtT0VVNGJIaEZZVkpOVFJERUF4aW1CU2dLTWdZVk5JSW9uZ2c=-w280-h168-p-df
Why Are People Trying To Fly With Their Costco Cards?,https://www.aol.com/why-people-trying-fly-costco-171700648.html,"['Advertisement', '', '', 'Costco has plenty of deals and discounts to love. Everything from delicious rotisserie chickens to bulk household essentials, and a satisfying food court. But one thing they don’t offer? REAL IDs.', 'Of course, no one expects a wholesale club to issue government identification but that hasn’t stopped some travelers from trying to pass off their Costco membership cards as valid IDs at the airport. Yes, really.', 'It’s gotten so out of hand that the Transportation Security Administration had to step in and debunk the myth on X (formerly Twitter).', '“We love hotdogs & rotisserie chickens as much as the next person but please stop telling people their Costco card counts as a REAL ID because it absolutely does not,” the post read.', 'Naturally, fans went wild in the replies with some even insisting the confusion is understandable. Why? Because both a REAL ID and a Costco Gold Star membership card feature, well, a gold star.', '“I beg to differ,” one user wrote. “REAL ID is denoted by a gold star. A basic Costco membership is a Gold Star. Which makes Executive Membership TSA Pre.”', 'Another chimed in, “It should [count as a REAL ID]. Costco verifies everyone’s true identity.”', 'And just like your ID, many say their Costco card is must-carry status. Or, as one user put it: “I never leave the house without my Costco card. Not going to get caught unprepared for a rotisserie chicken. Priorities.”', 'All jokes aside, while your Costco card will get you access to samples and a ton of savings, it won’t get you through airport security. So if you want to skip the lines (and the TSA side-eye), bring a real ID please, not your membership card.', 'You Might Also Like', 'Insanely Easy Weeknight Dinners To Try This Week', '29 Insanely Delicious Vodka Cocktails', 'Advertisement', 'Advertisement']",Business,https://news.google.com/api/attachments/CC8iK0NnNVNTMDVtT0VVNGJIaEZZVkpOVFJERUF4aW1CU2dLTWdZVk5JSW9uZ2c=-w280-h168-p-df
"Costco cards good for 'hot dogs & rotisserie chickens,' not airports, TSA says",https://www.usatoday.com/story/travel/2025/06/07/costco-card-real-id-tsa-rumor/84088409007/,"[""Costco memberships come with a variety of perks, including access to discounted products and services; however, the Transportation Security Administration (TSA) recently debunked the rumor that customers' warehouse club cards substitute for a Real ID."", 'TSA proclaimed in an X post on Wednesday, June 4: ""We love hotdogs & rotisserie chickens as much as the next person but please stop telling people their Costco card counts as a REAL ID because it absolutely does not.""', 'TSA Pacific spokesperson Lorie Dankers told SFGate that the rumor of Costco cards being accepted as official identification pops up every year or so. When people try to use their warehouse club cards at airports, for instance, it could lead to delays and travel headaches, she added.', ""As of May 7, travelers need a Real ID or other acceptable identification for domestic flights and accessing federal facilities. Those who haven't gotten one yet may be scrambling to figure out what they need to do before booking their next trip. One thing is for certain: They should probably leave their Costco membership cards at home."", 'Here are the acceptable forms of identification, according to the TSA, as well as some background on how the most recent version of the Costco card rumor originated.', 'According to the TSA, valid forms of ID at airports include:', 'Food blog Chowhound claimed in the initial version of an article titled ""How Your Costco Card Could Save You At The Airport,"" that people\'s Costco cards could pass through TSA because it is considered a photo ID. The article cited Reddit, where users claimed their warehouse club cards helped them through airport security when they forgot or lost their regular ID.', 'On June 4, the day TSA debunked the rumor on social media, Chowhound issued an update to the article, saying, ""A previous version of this article stated TSA is likely to accept a Costco membership card in lieu of a valid form of ID. TSA does not explicitly state you can use a Costco card as a form of identification, explaining, \'The TSA officer may ask you to complete an identity verification process which includes collecting information such as your name and current address to confirm your identity. If your identity is confirmed, you will be allowed to enter the screening checkpoint, where you may be subject to additional screening.\'""', 'The update concludes with: ""Now with the Real ID requirements, (a Costco card) is even less likely to get you through TSA quickly or successfully.""', 'If someone tried using a Costco card at an airport, they would likely be pulled from the TSA checkpoint line for further questioning about other personal information, such as their two previous home addresses, Dankers told SFGate.', 'Contributing: Chad Murphy/ Akron Beacon Journal']",Business,https://news.google.com/api/attachments/CC8iK0NnNVNTMDVtT0VVNGJIaEZZVkpOVFJERUF4aW1CU2dLTWdZVk5JSW9uZ2c=-w280-h168-p-df
Your Costco card won't get you through airport security. Here's what will work as Real ID,https://www.freep.com/story/news/local/michigan/2025/06/09/real-id-tsa-warning-costco-alternative-documents-passport/84112285007/,"[""The Transportation Security Administration issued a warning to travelers this past week: Your Costco card or other membership IDs won't work as Real ID to pass through airport security."", 'In a recent social media post, the TSA said ""We love hotdogs & rotisserie chickens as much as the next person but please stop telling people their Costco card counts as a REAL ID because it absolutely does not.""', 'Since May 7, domestic airline travelers and those seeking entry to some federal facilities, have needed a Real ID-complaint ID to pass through security. A variety of documents will work, but many people can use an upgraded license to travel — just not a membership card.', ""State and federal officials offer guidance on the correct documents you'll need to be Real ID-compliant."", ""Here's what to know."", 'No, your Costco card is not a valid form of Real ID.', 'Costco, a bulk retail chain, offers membership cards to customers with member benefits. The company and its card have no affiliation with Real ID.', 'Other membership cards also will not work to pass through security.', 'There are two forms of Real ID compliant licenses in Michigan.', 'Michigan’s old license and ID design, which is being phased out by January 2029, features a star in a gold circle to indicate REAL ID compliance.', 'The state’s new license design features a star in a silhouette of Michigan.', 'Both versions are acceptable.', 'TSA-approved Real ID alternatives include:', 'Yes, the Michigan Secretary of State continues to upgrade people to Real ID-compliant licenses. You can upgrade your license when you renew or by making an appointment.', ""You can update your ID by visiting your local Michigan Secretary of State branch office. You'll need to bring the following documents, per the department:"", 'Contact Jenna Prestininzi: jprestininzi@freepress.com.']",Business,https://news.google.com/api/attachments/CC8iK0NnNVNTMDVtT0VVNGJIaEZZVkpOVFJERUF4aW1CU2dLTWdZVk5JSW9uZ2c=-w280-h168-p-df
U.S. TSA reminds travellers: Costco cards won’t get you through security,https://www.ctvnews.ca/world/article/costco-cards-are-great-for-deals-not-for-boarding-flights-tsa-warns/,"['ADVERTISEMENT', 'Published: June 09, 2025 at 11:13AM EDT', 'Flashing your Costco card might get you a $1.50 hot dog – but try it at airport security and you might just miss your flight.', 'The U.S. Transportation Security Administration (TSA) has issued a reminder for travellers that Costco membership cards are not acceptable as REAL IDs at U.S. airport security checkpoints.', 'In a Facebook post, laced with humour, the TSA said, “We love hotdogs & rotisserie chickens as much as the next person but please stop telling people their Costco card counts as a REAL ID because it absolutely does not.”', 'According to the TSA, only federally approved documents such as REAL ID-compliant driver’s licences, U.S. passports, enhanced driver’s licences (EDLs), Global Entry/NEXUS cards or veteran/military IDs are permitted.', 'The REAL ID is a U.S. federally approved form of identification introduced under the REAL ID Act passed in 2005 as a post-9/11 security measure.', 'As of May 7, 2025, all air travellers in the U.S. aged 18 and older must present a REAL ID-compliant licence (typically marked with a star), a valid passport or another TSA-approved form of identification to board domestic flights or enter certain federal facilities.', 'For Canadians travelling to the U.S., a valid passport remains the gold standard. While U.S. citizens must show a REAL ID or equivalent for domestic flights, Canadians are not required to hold a REAL ID to enter the U.S. by air.', 'Instead, they must show a valid Canadian passport or NEXUS card, which is stated in U.S. Customs and Border Protection (CBP) requirements.', 'By land or sea, U.S. CBP will accept a Canadian passport, an enhanced driver’s licence – a regular driver’s licence with added citizenship information – NEXUS or SENTRI enrolment cards.', 'ADVERTISEMENT', 'The Shopping Trends team is independent of the journalists at CTV News. We may earn a commission when you use our links to shop. Read about us.', '©2025 BellMedia All Rights Reserved']",Business,https://news.google.com/api/attachments/CC8iK0NnNVNTMDVtT0VVNGJIaEZZVkpOVFJERUF4aW1CU2dLTWdZVk5JSW9uZ2c=-w280-h168-p-df
"No, you can't use your Costco card as Real ID at the airport, TSA warns",https://www.nbcwashington.com/news/national-international/costo-card-real-id-airport-security/3931897/,"[""There are many acceptable substitutes for a Real ID at the airport — a passport, permanent resident card, enhanced driver's license, etc."", 'A Costco card is not one of them.', '', 'Last week, the Transportation Security Administration debunked a rumor that claimed airport security agents would accept the grocery store membership card in place of a Real ID.', '""We love hotdogs & rotisserie chickens as much as the next person but please stop telling people their Costco card counts as a REAL ID because it absolutely does not,"" the agency said in a post on X.', '', 'However, fliers are more than welcome to use their cards before heading to the airport to buy a light travel snack — or a whole rotisserie chicken — TSA said in another post June 2.', '""Can you bring a rotisserie chicken on the plane? You bet your drumsticks! Cooked or raw, it\'s allowed in carry-on or checked bags,"" the post said. ""Gravy? Keep it under 3.4oz in carry-on.""', 'The federal government began enforcing Real ID requirements at U.S. airports in May. Travelers now need a Real-ID compliant license or other accepted form of identification like a passport to get through security before a domestic flight.', 'Attempting to use other, non-compliant forms of identification could prevent delays for both you and the other travelers around you.', 'Here are some other things TSA wants fliers to know before taking their next trip:', ""A Real ID is a federally compliant DMV-issued driver license, learner permit, or non-driver ID issued by a state driver's licensing agency that will be required to board a domestic flight unless you have a passport. The ID is marked with a star or flag in the top right corner."", 'Real ID-compliant identification has been required for those flying domestically in the U.S since May 7, 2025.', 'No. Children under the age of 18 years old are not required by TSA to provide identification when traveling with a companion within the United States, according to the Homeland Security website.', 'Those 18 years old and over are required to have a Real ID or other accepted form of identification like a passport to fly.', '', 'The cards can be obtained at Secretary of State’s Office locations, though many require appointments, which became harder to come by as the deadline approached. Be sure to visit your state’s driver’s licensing agency website to find out which documentation is required to obtain a REAL ID.', 'The REAL ID Act was passed by Congress in 2005 in the wake of the Sept. 11, 2001 terror attacks to increase security of identification documents, making them more difficult to duplicate.', 'In addition to being required for flying, Real IDs will also be needed to enter federal and state facilities, including courthouses and prisons, as well as secure facilities like nuclear power plants.', 'Without a Real ID, travelers looking to fly on a domestic flight will need either a U.S. passport, passport card, permanent resident card, or certain Department of Homeland Security trusted traveler cards.', '', '', '', '', '', '', '', '']",Business,https://news.google.com/api/attachments/CC8iK0NnNVNTMDVtT0VVNGJIaEZZVkpOVFJERUF4aW1CU2dLTWdZVk5JSW9uZ2c=-w280-h168-p-df
"No, you can't use your Costco card as Real ID at the airport, TSA says",https://www.cbsnews.com/news/real-id-costco-card-tsa-airport-flying/,"['Watch CBS News', 'June 9, 2025 / 2:24 PM EDT / CBS News', 'Travelers who are headed to airports and hoping to use their Costco membership cards in place of Real IDs are out of luck. ', 'Travelers need a Real ID — or other acceptable form of identification — for domestic flights and for accessing federal facilities as of May 7. The Transportation Security Administration has warned fliers that the Costco card is not an acceptable alternative.', '""We love hotdogs & rotisserie chickens as much as the next person but please stop telling people their Costco card counts as a REAL ID because it absolutely does not,"" the TSA said in a post last week on social media.', ""If you are planning to bring a rotisserie chicken on a flight, whether from Costco or elsewhere, the TSA says that's OK. "", '""You bet your drumsticks! Cooked or raw, it\'s allowed in carry-on or checked bags. Gravy? Keep it under 3.4oz in carry-on,"" the travel agency said. ', 'A TSA spokesperson said the agency issues routine reminders to travelers about which forms of IDs are not accepted at TSA checkpoints, ""including warehouse club membership cards.""', 'The TSA social media post about Costco cards came several days after Chowhound published an article titled, ""How Your Costco Card Could Save You At The Airport."" Chowhound updated its article on June 3 to clarify that ""TSA does not explicitly state you can use a Costco card as a form of identification.""', 'TSA spokesperson Lorie Dankers told SFGate she hears the rumor about Costco cards every year to 18 months. She said flyers presenting Costco cards to the TSA can create delays at the airport. ', '""Essentially, what the process they\'re describing is … let\'s say you lost your ID and only had a Costco card in your pocket. That would help establish a baseline identity for you,"" Dankers told SFGate. ""The TSA officer would use that as a starting point to confirm your identity, but they would still have to go through our identity verification process.""', 'In addition to Real IDs, passports, passport cards, U.S. Department of Defense IDs and DHS trusted traveler cards are considered acceptable forms of identification at TSA checkpoints. A full list of acceptable forms of identification can be found on the TSA website. The TSA says the list of acceptable IDs is subject to change without notice.', ""Costco didn't immediately respond to a CBS News request for comment. "", 'Aliza Chasan is a Digital Content Producer for ""60 Minutes"" and CBSNews.com. She has previously written for outlets including PIX11 News, The New York Daily News, Inside Edition and DNAinfo. Aliza covers trending news, often focusing on crime and politics.', '© 2025 CBS Interactive Inc. All Rights Reserved.', 'Copyright ©2025 CBS Interactive Inc. All rights reserved.']",Business,https://news.google.com/api/attachments/CC8iK0NnNVNTMDVtT0VVNGJIaEZZVkpOVFJERUF4aW1CU2dLTWdZVk5JSW9uZ2c=-w280-h168-p-df
Why Are People Trying To Fly With Their Costco Cards?,https://www.yahoo.com/lifestyle/why-people-trying-fly-costco-171700421.html,"['', '', '', '', '', 'Costco has plenty of deals and discounts to love. Everything from delicious rotisserie chickens to bulk household essentials, and a satisfying food court. But one thing they don’t offer? REAL IDs.', 'Of course, no one expects a wholesale club to issue government identification but that hasn’t stopped some travelers from trying to pass off their Costco membership cards as valid IDs at the airport. Yes, really.', 'It’s gotten so out of hand that the Transportation Security Administration had to step in and debunk the myth on X (formerly Twitter).', '“We love hotdogs & rotisserie chickens as much as the next person but please stop telling people their Costco card counts as a REAL ID because it absolutely does not,” the post read.', 'Naturally, fans went wild in the replies with some even insisting the confusion is understandable. Why? Because both a REAL ID and a Costco Gold Star membership card feature, well, a gold star.', '“I beg to differ,” one user wrote. “REAL ID is denoted by a gold star. A basic Costco membership is a Gold Star. Which makes Executive Membership TSA Pre.”', 'Another chimed in, “It should [count as a REAL ID]. Costco verifies everyone’s true identity.”', 'And just like your ID, many say their Costco card is must-carry status. Or, as one user put it: “I never leave the house without my Costco card. Not going to get caught unprepared for a rotisserie chicken. Priorities.”', 'All jokes aside, while your Costco card will get you access to samples and a ton of savings, it won’t get you through airport security. So if you want to skip the lines (and the TSA side-eye), bring a real ID please, not your membership card.', 'You Might Also Like', 'Insanely Easy Weeknight Dinners To Try This Week', '29 Insanely Delicious Vodka Cocktails']",Business,https://news.google.com/api/attachments/CC8iK0NnNVNTMDVtT0VVNGJIaEZZVkpOVFJERUF4aW1CU2dLTWdZVk5JSW9uZ2c=-w280-h168-p-df
