Title,Link,Paragraphs,Topic,Image
TSA makes clear if Costco card works as REAL ID,https://www.yahoo.com/news/tsa-makes-clear-costco-card-210438855.html,"['', '', '', '', '', '**Related Video Above: Real ID requirement went into effect last month', '(WJW) — The Transportation Security Administration is warning travelers that a Costco membership card is not the same as a REAL ID.', '“We love hot dogs and rotisserie chickens as much as the next person but please stop telling people their Costco card counts as a REAL ID because it absolutely does not,” the government agency said on Facebook last week.', 'Can you fly without a REAL ID after the May deadline?', 'The agency did not clarify if people had been attempting to make it through airport security using their Costco cards or if the post was in response to other online messaging.', 'Still, the reaction to the the post caused quite a flurry of enthusiasm from commenters.', '“I’m pretty sure that the Costco card is stronger than some passports,” one person wrote.', '“I was told my Blockbuster employee name tag from 2005 would work … is this true?” another wondered.', 'Owner of raccoon found with meth pipes vows she won’t surrender him', 'The REAL ID deadline was May 7, when states started to require enhanced verification for domestic airline travel and entrance to some federal buildings. In Ohio, the REAL ID has a star on the upper right side of the card.', 'Find out more about REAL IDs and how to acquire one in Ohio right here.', 'Copyright 2025 Nexstar Media, Inc. All rights reserved. This material may not be published, broadcast, rewritten, or redistributed.', 'For the latest news, weather, sports, and streaming video, head to Fox 8 Cleveland WJW.']",Business,https://news.google.com/api/attachments/CC8iK0NnNVNTMDVtT0VVNGJIaEZZVkpOVFJERUF4aW1CU2dLTWdZVk5JSW9uZ2c=-w280-h168-p-df
TSA urges people to stop trying to use a Costco card as a sufficient REAL ID,https://www.wsfa.com/2025/06/06/tsa-urges-people-stop-trying-use-costco-card-sufficient-real-id/,"['(Gray News) – The TSA is expressing frustrations with travelers who are not providing a proper REAL ID to fly.', 'In a Facebook post Wednesday, the TSA made it known that a Costco membership card is not an acceptable identification.', '“We love hotdogs & rotisserie chickens as much as the next person, but please stop telling people their Costco card counts as a REAL ID because it absolutely does not,” the TSA wrote in the post.', 'Starting May 7, most adults catching a flight in the U.S. are now required to present either a passport or an upgraded identification card that meets federal REAL ID standards.', 'According to the Associated Press, the requirement is 20 years in the making.', 'A REAL ID is a driver’s license or other state-issued ID that meets security requirements mandated in a 2005 law passed in the aftermath of the Sept. 11, 2001, terrorist attacks.', 'In most cases, REAL IDs are designated with a white star in a yellow circle.', 'REAL IDs have been available for years from the DMV. People who didn’t get one by May 7 can still apply.', 'The Department of Homeland Security website links to information in each state on scheduling appointments and lists the documents needed.', 'Copyright 2025 Gray Local Media, Inc. All rights reserved. The Associated Press contributed to this report.']",Business,https://news.google.com/api/attachments/CC8iK0NnNVNTMDVtT0VVNGJIaEZZVkpOVFJERUF4aW1CU2dLTWdZVk5JSW9uZ2c=-w280-h168-p-df
www.washingtontimes.com,https://www.washingtontimes.com/news/2025/jun/7/uh-costco-cards-dont-work-real-id-airports-says-tsa/,['Verifying you are human. This may take a few seconds.'],Business,https://news.google.com/api/attachments/CC8iK0NnNVNTMDVtT0VVNGJIaEZZVkpOVFJERUF4aW1CU2dLTWdZVk5JSW9uZ2c=-w280-h168-p-df
Costco Members Cautioned Against Using Their Membership Card—Don't Use It As a REAL ID,https://www.yahoo.com/news/costco-members-cautioned-against-using-231857470.html,"['', '', '', '', '', 'Costco is a popular big-box membership warehouse club, offering discounted prices on brand-name merchandise in bulk and non-bulk sizes. Costco is actually the third-largest retailer in the world, only behind Walmart and Amazon, and is a Fortune 500 company.', '""With hundreds of locations worldwide, Costco provides a wide selection of merchandise, plus the convenience of specialty departments and exclusive member services, all designed to make your shopping experience a pleasurable one,"" the company states on their website.', 'To shop at Costco, members have to own a membership card. The Costco ""Gold Star Membership"" card includes two card and the ability to shop online and in warehouses. For those who want to up their game, the Costco ""Executive Membership"" package also includes an annual 2% reward and Costco services discounts.', 'But, Costco customers are being told not to use their membership card for one specific thing.', ""The TSA is showing their frustration with travelers who are not showing them a REAL ID to take a flight, and they don't want passengers to think that their Costco card counts as a proper REAL ID."", '""In a Facebook post shared on June 4, the TSA stated a Costco membership card is not, in any way, an acceptable form of identification to get on a plane. Yes, people are actually trying to use their Costco cards to get on aiplanes.', '“We love hotdogs & rotisserie chickens as much as the next person,"" the TSA stated in their post, ""but please stop telling people their Costco card counts as a REAL ID because it absolutely does not.""', 'Beginning May 7, the majority of adult citizens taking a flight in the U.S. must show either a passport or upgraded identification card that meets federal REAL ID standards. The U.S. Department of Homeland Security has information for each state about scheduling appointments and also provides the types of documents needed.', 'Related: Costco Announces a Big Change for Shoppers', ""Costco Members Cautioned Against Using Their Membership Card—Don't Use It As a REAL ID first appeared on Men's Journal on Jun 6, 2025""]",Business,https://news.google.com/api/attachments/CC8iK0NnNVNTMDVtT0VVNGJIaEZZVkpOVFJERUF4aW1CU2dLTWdZVk5JSW9uZ2c=-w280-h168-p-df
No title found,https://www.thestreet.com/travel/tsa-shares-travel-warning-for-costco-members,[],Business,https://news.google.com/api/attachments/CC8iK0NnNVNTMDVtT0VVNGJIaEZZVkpOVFJERUF4aW1CU2dLTWdZVk5JSW9uZ2c=-w280-h168-p-df
"No, your Costco card cannot be used as a substitute for a REAL ID. What Tennesseans should know about travel",https://www.tennessean.com/story/news/2025/06/09/can-you-travel-with-a-costco-card-instead-of-a-real-id-in-tennessee/84114672007/,"[""While a Costco membership has multiple perks, including bulk discounts and savings on gas, there are a few things the card can't provide. For example, access to board domestic flights or certain federal facilities, unlike the REAL ID."", 'Since the May 7 implementation date, travelers in Tennessee and across the United States have relied on REAL ID — or other acceptable forms of identification — to pass through security and travel domestically.', ""Some, however, have opted for other methods of identification, which has led the Transportation Security Administration (TSA) to recently debunk the rumor that customers' warehouse club cards can substitute for a REAL ID."", '""We love hotdogs & rotisserie chickens as much as the next person but please stop telling people their Costco card counts as a REAL ID because it absolutely does not,"" wrote the administration in a post to social media.', ""Despite some membership cards displaying a star and digital options displaying a photo, that doesn't qualify the cards as a valid form of identification. In order to fly, travelers must have either a REAL ID, a valid passport or another federally issued photo ID."", 'As previously reported by USA TODAY, TSA Pacific spokesperson Lorie Dankers told SFGate that the rumor of Costco cards being accepted as official identification pops up every year or so. When people try to use their warehouse club cards at airports, for instance, it could lead to delays and travel headaches, she added.', 'No — Tennesseans are not required to obtain a REAL ID compliant license or identification credential. A REAL ID is not necessary to drive, vote, purchase alcohol or cigarettes, access hospitals, visit the post office, access federal courts or apply for or receive federal benefits such as social security or veterans’ benefits.', ""If you don't have a REAL ID, here is the complete list of TSA acceptable IDs:"", 'Yes — Tennesseans can still obtain a REAL ID, with or without an appointment, although walk-in applicants should anticipate potentially long wait times.', 'Diana Leyva covers trending news and service journalism for the Tennessean. Contact her at Dleyva@gannett.com or follow her on X, the platform formerly known as Twitter, at @_leyvadiana']",Business,https://news.google.com/api/attachments/CC8iK0NnNVNTMDVtT0VVNGJIaEZZVkpOVFJERUF4aW1CU2dLTWdZVk5JSW9uZ2c=-w280-h168-p-df
"After May Seven Deadline Confusion, Transportation Security Administration (TSA) Rejects Costco Cards for US Domestic Flights, Essential REAL ID Guide Every American Traveler Must Know",https://www.travelandtourworld.com/news/article/after-may-seven-deadline-confusion-transportation-security-administration-tsa-rejects-costco-cards-for-us-domestic-flights-essential-real-id-guide-every-american-traveler-must-know/,"['', '', 'Monday, June 9, 2025', 'After May Seven, confusion has spread about what IDs are valid for US domestic flights. The TSA has made it clear: Costco membership cards are not valid for boarding. This revelation has left many travelers scrambling to understand what exactly REAL ID means for American travelers moving forward.', 'The deadline has passed, and the travel landscape has shifted. No longer can you rely on familiar but unofficial forms of ID to breeze through airport security. Instead, REAL ID compliance is now mandatory.', 'Advertisement', 'But what is REAL ID? Why does it matter so much? And how can you make sure you’re prepared before your next flight?', 'This is more than a bureaucratic change—it’s a crucial travel security upgrade. The stakes are high, and the consequences of not having the right ID could derail your plans. Stay with us as we unravel the REAL ID mystery and what every American traveler needs to know to fly smoothly in 2025.', 'Travelers across the United States face a crucial travel policy deadline as REAL ID enforcement takes full effect this May 2025. The Transportation Security Administration (TSA) recently stepped in to clear widespread confusion—no, your Costco membership card does not count as a REAL ID. This reminder arrives as millions prepare for summer travel, and the wrong ID could mean delays, additional screening, or even denied boarding.', 'Understanding what REAL ID means is more urgent than ever. This federal mandate, born from post-9/11 security reforms, requires state-issued driver’s licenses and IDs to meet enhanced standards for them to be accepted at airport security checkpoints. Non-compliant IDs will no longer be valid for domestic flights, impacting every American’s travel plans.', 'Meanwhile, airlines, airports, and travel agencies are gearing up for the transition, encouraging passengers to check their IDs and avoid last-minute surprises. The stakes are high: smoother airport experiences depend on compliance.', 'The REAL ID Act, passed in 2005, sets strict security benchmarks for identification documents. Its goal is to thwart identity fraud and enhance national security. For travelers, this means only IDs meeting these federal standards—or alternatives like passports—will be accepted at TSA checkpoints starting May 7, 2025.', 'Each compliant card is marked with a distinctive star at the top. This visual cue tells TSA agents the ID has met the new rigorous criteria, including verified proof of birth, Social Security number, and residency.', 'Despite public awareness campaigns, confusion has run rampant. Many Americans mistakenly believed that their Costco membership cards or other non-government-issued IDs could substitute for REAL IDs.', 'The TSA put an end to this rumor emphatically, highlighting that only federally approved IDs qualify. This clarification is critical as travelers rush to update documents, avoiding costly travel disruptions during peak seasons.', 'Travelers must ensure they have a REAL ID-compliant driver’s license or another federally accepted form of identification before heading to the airport. These include passports, passport cards, military IDs, and trusted traveler cards like Global Entry.', 'Failure to present a valid ID will lead to extra screening, which can be time-consuming and stressful. This policy applies to all travelers, including those with TSA PreCheck, underscoring the importance of preparation.', 'Obtaining a REAL ID is straightforward but requires careful preparation. Applicants must provide proof of legal name, date of birth, Social Security number, and two documents verifying their residence. Some states may ask for additional paperwork, so checking with local DMV websites before applying is crucial.', 'Many states now offer online appointment scheduling to streamline the process. Early action is recommended to avoid last-minute lines and delays.', 'This enforcement will influence travel behavior and airline operations. Airlines are ramping up communication efforts, reminding passengers to carry proper identification to avoid denied boarding scenarios. Airport security lines may see longer wait times initially as travelers adjust.', 'Tourism boards and travel agencies are proactively educating customers, highlighting the importance of compliant IDs, especially for international visitors returning to the U.S. who must align with these domestic security measures.', 'The REAL ID enforcement reflects a broader shift toward tightening travel security through technology and policy. The challenge lies in balancing safety with convenience, a critical factor in enhancing passenger experience.', 'Travel experts anticipate that digital ID solutions may emerge as future complements or alternatives, but for now, physical REAL ID compliance remains mandatory. The industry is closely watching policy developments that could ease or complicate travel flows in the coming years.', 'International visitors flying domestically within the U.S. must also comply with REAL ID rules once they obtain U.S.-issued IDs. Meanwhile, tourists from Canada and Mexico, who frequently cross borders, need to be aware of evolving ID requirements for both entry and domestic flights.', 'Border tourism and cross-border flights constitute significant travel segments, and clarity around REAL ID compliance supports seamless journeys. Stakeholders in these markets are collaborating to raise awareness and smooth transitions.', 'The message to travelers is clear: check your ID today, and plan ahead. This simple step could be the difference between a smooth airport journey and frustrating delays.', 'Airports across the U.S. are enhancing signage and staffing to assist travelers during the transition period. Airlines are also offering digital checklists and reminders in booking confirmations.', 'The enforcement of REAL ID marks a significant milestone in travel security policy. It exemplifies how legislation can directly impact millions of travelers and reshape industry practices.', 'For the travel and tourism sector, adaptability, clear communication, and customer-centric policies will be key to maintaining confidence and encouraging continued travel growth.', 'As millions prepare for post-pandemic travel rebounds, this ID change adds a new dimension of preparedness. Ultimately, REAL ID aims to protect both travelers and the nation.', 'Advertisement', 'Tags: Airline Updates, airport security, Costco card confusion, Costco Membership, domestic flights, passenger safety, Real ID, Tourism Trends, travel compliance, travel industry news, Travel Policy, TSA, U.S. Travel', '', '', ""I want to receive travel news and trade event update from Travel And Tour World. I have read Travel And Tour World'sPrivacy Notice."", '', '', 'Tuesday, June 10, 2025', 'Tuesday, June 10, 2025', 'Tuesday, June 10, 2025', 'Tuesday, June 10, 2025', 'Monday, June 9, 2025', 'Monday, June 9, 2025', 'Monday, June 9, 2025', 'Monday, June 9, 2025']",Business,https://news.google.com/api/attachments/CC8iK0NnNVNTMDVtT0VVNGJIaEZZVkpOVFJERUF4aW1CU2dLTWdZVk5JSW9uZ2c=-w280-h168-p-df
No title found,https://www.msn.com/en-my/news/other/air-travelers-are-trying-to-bypass-real-id-requirements-with-a-hilarious-hack/ar-AA1Gh1ku,[],Business,https://news.google.com/api/attachments/CC8iK0NnNVNTMDVtT0VVNGJIaEZZVkpOVFJERUF4aW1CU2dLTWdZVk5JSW9uZ2c=-w280-h168-p-df
TSA tells Americans their Costco cards won't fly at airport security despite love for hot dogs,https://www.foxnews.com/politics/tsa-tells-americans-costco-cards-wont-fly-airport-security-despite-love-hotdogs,"['', 'Political science professor and national identification cards expert Magdalena Krajewska weighs in on the REAL ID deadline. ', 'The Transportation Security Administration clarified this week that a Costco membership card is not sufficient to present at airport security. ', '""We love hotdogs & rotisserie chickens as much as the next person but please stop telling people their Costco card counts as a REAL ID because it absolutely does not,"" the TSA wrote on Facebook Wednesday. ', ""The reminder comes less than a month after the U.S. began requiring a REAL ID driver's license when flying domestically May 7. "", 'The Transportation Security Administration clarified this week that a Costco membership card is not sufficient to present at airport security.  (Tim Boyle/Getty Images)', 'Aside from REAL IDs, which have enhanced federal standards, domestic flyers can also use their passports or another federally-approved form of identification like Defense Department-issued IDs (but not a Costco card). ', '""Department of Defense IDs for active and retired military continue to be an acceptable form of ID at TSA checkpoints following the implementation of REAL ID last month,"" the TSA wrote on Facebook Thursday. ', 'A sample of a REAL ID.  (DHS)', 'REAL IDs were available for years before the requirement went into effect after a 2005 law passed based on recommendations from the 9/11 Commission report. ', 'Crowds queue at the security checkpoint at Atlanta Hartsfield-Jackson Airport after the REAL ID requirement deadline.  (Robin Rayne for Fox News Digital)', 'CLICK HERE TO GET THE FOX NEWS APP', 'With many procrastinating until shortly before the deadline, DMV centers were inundated with long lines in April and early May, and there was confusion about what forms of identification, such as a passport, birth certificate or Social Security card, were acceptable at a DMV to secure a REAL ID. ', 'Get the latest updates from the 2024 campaign trail, exclusive interviews and more Fox News politics content.', 'By entering your email and clicking the Subscribe button, you agree to the Fox News Privacy Policy and Terms of Use, and agree to receive content and promotional communications from Fox News. You understand that you can opt-out at any time.', '', '', 'This material may not be published, broadcast, rewritten, or redistributed. ©2025 FOX News Network, LLC. All rights reserved. Quotes displayed in real-time or delayed by at least 15 minutes. Market data provided by Factset. Powered and implemented by FactSet Digital Solutions. Legal Statement. Mutual Fund and ETF data provided by Refinitiv Lipper.']",Business,https://news.google.com/api/attachments/CC8iK0NnNVNTMDVtT0VVNGJIaEZZVkpOVFJERUF4aW1CU2dLTWdZVk5JSW9uZ2c=-w280-h168-p-df
