Title,Link,Paragraphs,Topic,Image
Eggs linked to salmonella outbreak recalled: See the affected states,https://www.usatoday.com/story/money/food/2025/06/08/august-egg-company-recall-salmonella/84101830007/,"[""About 1.7 million dozen shell eggs are being voluntarily recalled after being linked to a salmonella outbreak, officials say. Here's what you should know."", 'The salmonella outbreak is linked to 79 hospitalizations, according to the Centers for Disease Control and Prevention, CDC.', 'The recall was issued on June 6 after brown cage-free eggs and brown certified organic eggs distributed by August Egg Company and sold under different brand names and restaurants were linked to the outbreak, the Food and Drug Administration says. The eggs were sold in nine states.', '""FDA is working with the firm to determine if eggs were distributed elsewhere and will update the advisory as information becomes available,"" the FDA states on its website.', 'The outbreak has led to an investigation, the FDA says.', 'The eggs were sold under the plant code numbers P-6562 or CA5330 and include organic and cage-free eggs, the FDA says.', 'The eggs also have a printed Julian Date from “32” to “126.”', 'The eggs were sold under the following brands, according to the FDA:', 'The eggs were sold in Walmart locations across nine states:', 'Eggs recalled from Walmart were distributed from Feb. 3 to May 6, and sell-by dates ranged from March 4 to June 19.', 'Eggs were also sold in the following locations in California and Nevada:', 'The eggs sold in the stores listed above were distributed from Feb. 3 to May 15, and had sell-by dates that ranged from March 4 to June 4.', 'Anyone who has purchased the recalled eggs should throw them away or return them to the store where they were purchased, according to the CDC. People should also wash things and surfaces the eggs may have touched using ""hot soapy water or a dishwasher.""', 'Anyone who is experiencing the following severe symptoms should call their health care provider immediately, the CDC says:', 'Julia is a trending reporter for USA TODAY. Connect with her on LinkedIn,X, Instagram and TikTok: @juliamariegz, or email her at jgomez@gannett.com']",Business,https://news.google.com/api/attachments/CC8iK0NnNWtVR1Z2Vm5odFdtUjBhWGswVFJDZkF4amlCU2dLTWdhQkFZZ3ZPUVU=-w280-h168-p-df
"Salmonella recall of 20 million eggs from Walmart, Safeway, Ralphs, among others",https://www.miamiherald.com/news/recalls/article308166660.html,"['', 'Another salmonella outbreak caused the recall of 1.7 million dozen eggs — meaning roughly more than 20 million less eggs to fry — and has sickened people in seven states.', 'The aforementioned eggs were distributed to Walmart, Safeway, chains owned by Kroger and various other independent and chain supermarkets.', 'Hilmar, California’s August Egg Company, a division of Gemperle Enterprises, produced the eggs and issued the recall Friday, June 6.', '“August Egg Company is not selling fresh shell eggs at this time,” the company-written, FDA-posted recall notice said. “Our firm has voluntarily been diverting eggs to an egg-breaking plant for over 30 days, which pasteurizes the eggs and kills any potential foodborne pathogens.”', 'READ MORE: Public health alert: Deadly E. coli found in beef sent to Whole Foods stores', 'Packaging for the recalled eggs will have plant code P-6562 or CA5330 with the Julian Dates between 32 to 126.', 'The eggs that went to Walmart stores had sell by dates from March 4 through June 19. Other retailers got eggs with “sell by dates” from March 4 through June 4.', 'August Egg says these eggs went to stores in California, Washington, Illinois, Nevada, Arizona, Wyoming, New Mexico, Nebraska, and Indiana. The recall section of Walmart’s website says this also involves its stores in Alaska, Colorado, Hawaii, Iowa, Idaho, Kansas, Michigan, Montana, North Dakota, Ohio, Oklahoma, Oregon, Texas and Wisconsin.', '▪ Marketside (a Walmart store brand): Organic Large Cage Free Brown Eggs in cartons of 12 and 18; Large Cage Free Brown Eggs in cartons of 12 and 18.', '▪ First Street (a Smart & Final house brand): Cage Free Large Brown loose eggs.', '▪ Clover: Organic Large Brown Eggs, one dozen.', '▪ Nulaid: One dozen Medium Brown Cage Free, one dozen Jumbo Brown Cage Free.', '▪ O Organics: Cage Free Large Brown, six eggs; and Large Brown, 12 and 18 eggs. This brand will be found at Safeway and other Albertson’s-owned stores.', '▪ Raley’s (store brand): Large Cage Free Brown, 12 eggs: Organic Large Cage Free Brown, 12 and 18 eggs.', '▪ Simple Truth: Cage Free Large Brown and Medium Brown 18 eggs. This brand will be found at Food 4 Less, Ralphs and other Kroger-owned chains.', '▪ Sun Harvest: Organic Large Cage Free Brown Eggs in cartons of 12 and 18.', '▪ Sunnyside: Organic Large Cage Free Brown Eggs in cartons of 12 and 18; and Large Cage Free Brown Eggs in cartons of 12 and 18.', 'Saturday’s outbreak update from the Centers for Disease Control and Prevention says 79 people have been sickened in this outbreak with 21 hospitalizations. Of those 79, 63 are in California. The remaining 16 break down as Nevada and Washington (four each); Arizona, three; Nebraska and New Jersey (two each); and Kentucky, one.', 'Salmonella outbreaks tend to be very undercounted because most people recover without medical attention.', 'The CDC estimates about 1.35 million people in the United States will get salmonella each year. Of that number, 26,400 will be hospitalized, usually driven to the hospital by bloody diarrhea, and 420 will die.', 'Usually, salmonella just means a few days of diarrhea, vomiting, fever and stomachaches.', 'If you have any of the recalled eggs listed above, return them to the store for a refund or throw them deep into the garbage. If you have any questions about the recalls, call August Farms at 800-710-2554, noon to 8 p.m., Eastern time.', 'This story was originally published June 8, 2025 at 5:41 PM.', '', 'Part of the McClatchy Media Network', '']",Business,https://news.google.com/api/attachments/CC8iK0NnNWtVR1Z2Vm5odFdtUjBhWGswVFJDZkF4amlCU2dLTWdhQkFZZ3ZPUVU=-w280-h168-p-df
1.7M eggs recalled in 9 states: Are your eggs affected?,https://www.nj.com/food/2025/06/17m-eggs-recalled-in-9-states-are-your-eggs-affected.html,"['', '1.7 million dozen brown eggs are being recalled after 79 people fell ill with Salmonella.Canva', 'You might want to reconsider buying those dozen brown eggs if you live in certain areas of the U.S.', 'About 1.7 million dozen brown eggs are being recalled in nine states, according to the U.S. Food and Drug Administration.', 'The reason for this, according to the Centers for Disease Control and Prevention, is that 79 people fell ill with Salmonella in seven of the nine states as a result of consuming the eggs.', 'Twenty-one out of the 79 people were hospitalized, but no deaths have been reported.', 'Here’s what else you need to know about this egg recall.', 'You can find the full list of brown eggs affected here.', 'According to the CDC, the following seven states (out of the nine impacted states) reported illnesses from Salmonella:', 'California\nNevada\nNew Jersey\nWashington\nKentucky\nNebraska\nArizona,', 'Consumers who purchased the dozen brown eggs are urged to return the eggs to their place of purchase for a full refund.', 'The CDC also urged people not to eat, sell, or serve the eggs that fall under the recall.', 'Those with questions can call August Egg Company at 1-800-710-2554 between 9 a.m. and 5 p.m. PT.', 'Our journalism needs your support. Please subscribe today to NJ.com.', 'Katherine Rodriguez can be reached at krodriguez@njadvancemedia.com. Have a tip? Tell us at nj.com/tips.', 'If you purchase a product or register for an account through a link on our site, we may receive compensation. By using this site, you consent to our User Agreement and agree that your clicks, interactions, and personal information may be collected, recorded, and/or stored by us and social media and other third-party partners in accordance with our Privacy Policy.', 'Use of and/or registration on any portion of this site constitutes acceptance of our User Agreement, (updated 8/1/2024) and acknowledgement of our Privacy Policy, and Your Privacy Choices and Rights (updated 1/1/2025).', '© 2025 Advance Local Media LLC. All rights reserved (About Us).\nThe material on this site may not be reproduced, distributed, transmitted, cached or otherwise used, except with the prior written permission of Advance Local.', 'Community Rules apply to all content you upload or otherwise submit to this site.', ""YouTube's privacy policy is available here and YouTube's terms of service is available here."", 'Ad Choices']",Business,https://news.google.com/api/attachments/CC8iK0NnNWtVR1Z2Vm5odFdtUjBhWGswVFJDZkF4amlCU2dLTWdhQkFZZ3ZPUVU=-w280-h168-p-df
CDC warns of Salmonella outbreak linked to eggs,https://www.cdc.gov/media/releases/2025/2025-cdc-warns-of-salmonella-outbreak-linked-to-eggs.html,"['', '', '', 'SUBJECT: CDC warns of Salmonella outbreak linked to eggs', 'A CDC investigation notice regarding a multistate outbreak of Salmonella infections has been posted: https://www.cdc.gov/salmonella/outbreaks/eggs-06-25/index.html', 'Key Points:', 'What You Should Do:', 'What Businesses Should Do:', 'About Salmonella:', ""If you have questions about cases in a particular state, please call that state's health department."", 'Thank you,', 'CDC News Media Branch', '404-639-3286', 'media@cdc.gov', '', '###\nU.S. DEPARTMENT OF HEALTH AND HUMAN SERVICES', 'Whether diseases start at home or abroad, are curable or preventable, chronic or acute, or from human activity or deliberate attack, CDC’s world-leading experts protect lives and livelihoods, national security and the U.S. economy by providing timely, commonsense information, and rapidly identifying and responding to diseases, including outbreaks and illnesses. CDC drives science, public health research, and data innovation in communities across the country by investing in local initiatives to protect everyone’s health.', 'CDC public health news, press releases, government public health news, medical and disease news, story ideas, photos.', '', '']",Business,https://news.google.com/api/attachments/CC8iK0NnNWtVR1Z2Vm5odFdtUjBhWGswVFJDZkF4amlCU2dLTWdhQkFZZ3ZPUVU=-w280-h168-p-df
Egg Recall Map Shows Warnings Issued to Customers in 9 States,https://www.newsweek.com/egg-recall-map-shows-warnings-issued-customers-9-states-2082254,"['When you use this site, we collect personal information via technologies like cookies to improve your site experience. We also share information about your use of our site with our social media, advertising, and analytics partners. You can manage your cookie settings at any time. To learn more, please view our Privacy Policy.', '', '', '', '', '', '', '', '', '', 'August Egg Company has issued a recall on Friday for 1,700,000 brown cage-free and certified organic brown eggs due to potential fears of salmonella.', 'Newsweek reached out to the company after hours via phone Friday night for comment.', 'Numerous recalls have been initiated this year due to the potential for the following: damaged products, foodborne illness, contamination and undeclared food allergens.', 'Millions of Americans experience food sensitivities or food allergies every year. According to the Food and Drug Administration (FDA), the nine ""major"" food allergens in the U.S. are eggs, milk, fish, wheat, soybeans, Crustacean shellfish, sesame, tree nuts and peanuts.', 'The FDA warns that salmonella is an organism that could cause serious and sometimes fatal infections in frail or older people, young children and those with weakened immune systems.', 'The FDA says in its alert that some of the eggs were distributed to grocery stores including Save Mart, FoodMaxx, Lucky, Smart & Final, Safeway, Raleys, Food 4 Less and Ralphs.', 'Those eggs were distributed from February 3, 2025, to May 15, 2025, with sell by dates of March 4, 2025, and June 4, 2025, in both California and Nevada.', 'The FDA says additional eggs were distributed from February 3, 2025, to May 6, 2025, with sell by dates of March 4, 2025, and June 19, 2025, in Walmart stores in Illinois, Indiana, Nebraska, New Mexico, California, Washington, Nevada, Arizona and Wyoming.', 'The plant code numbers for the recalled eggs can be found printed on the package and are P-6562 or CA5330 with Julian Dates from 32 to 126, the FDA says. The Julian Dates are codes of three to seven digits and represent the date that the food was packaged or manufactured.', '""This recall is associated with an ongoing outbreak investigation of Salmonella Enteritidis illnesses"" the alert says, adding the investigation is related to products distributed in the nine states.', 'The FDA alert also has a chart of the Julian Dates with corresponding item names.', 'The FDA alert, in part: ""August Egg Company is not selling fresh shell eggs at this time. Our firm has voluntarily been diverting eggs to an egg-breaking plant for over 30 days, which pasteurizes the eggs and kills any potential foodborne pathogens.""', 'August Egg Company in the FDA alert: ""August Egg Company of Hilmar, CA is voluntarily recalling 1,700,000 dozen shell eggs processed at our California plant and sold to various grocery customers. This recall has been initiated due to possible Salmonella enteritidis contamination, which poses a health risk. With that in mind, we believe it is appropriate out of an abundance of caution to conduct this voluntary recall, as consumers may still have these eggs in their homes.', '""It is important to know that when our processing plant identified this concern, we immediately began diverting all eggs from the plant to an egg-breaking facility, which pasteurizes the eggs and kills any pathogens.', '""August Egg Company\'s internal food safety team also is conducting its own stringent review to identify what measures can be established to prevent this situation from recurring. We are committed to addressing this matter fully and to implementing all necessary corrective actions to ensure this does not happen again.""', 'Customers with additional questions can call August Egg Company at 1-800-710-2554 from 9 a.m. and 5 p.m. PT and can also return the eggs to the original place of purchase for a refund.', '', '', ""Newsweek Is Committed To Journalism That'S Factual And Fair."", 'Hold Us Accountable And Submit Your Rating Of This Article On The Meter.', '', '', '', '', '', '', 'Anna Commander is a Newsweek Editor and writer based in Florida. Her focus is reporting on crime, weather and breaking ... read more', 'Newsletters in your inbox See all', 'Company', 'Editions:', 'Contact', 'Terms of Use', '© 2025 NEWSWEEK DIGITAL LLC']",Business,https://news.google.com/api/attachments/CC8iK0NnNWtVR1Z2Vm5odFdtUjBhWGswVFJDZkF4amlCU2dLTWdhQkFZZ3ZPUVU=-w280-h168-p-df
Here Are The 9 States Being Hit With The Latest Egg Recall,https://www.yahoo.com/news/9-states-being-hit-latest-145721166.html,"['', '', '', '', '', ""Egg price decreases have been slow to arrive at grocery stores nationwide. Over the past two months, prices have finally begun to cool and a multi-state salmonella outbreak is just the punctuation mark to months of relentless eggflation that weary consumers don't need. But, it's what they've got! According to an official FDA announcement on June 6, nearly 2 million dozen egg cartons are being pulled from shelves due to a mass salmonella contamination risk."", ""As if consumers weren't feeling wary enough, the specific recalled product is 1.7 million dozen brown, cage-free, certified organic eggs -- health-centric buzzwords that make customers feel like they're purchasing a product they can trust. This latest salmonella outbreak risk exponentially compounds the growing issue of consumer trust in food safety. For the first time since October 2024, month-to-month dozen egg prices finally decreased from $6.23 in March to $5.12 in April -- a national average price which still remains at a historic high. Eggflation was due largely in part to a shortage caused by an avian flu outbreak, which makes this latest recall of millions of eggs feel somehow even worse."", 'The outbreak traces back to August Egg Company, a California-based manufacturer. As of June 5, the CDC has reported 79 cases of illness spanning seven states. The affected eggs were sold at Walmart stores in nine states: Arizona, California, Illinois, Indiana, Nebraska, Nevada, New Mexico, Washington, and Wyoming, as well as several other grocery chains concentrated in California and Nevada.', 'Read more: 12 Gluten-Free Pasta Brands, Ranked Worst To Best', 'Twenty-one of the 79 ill consumers have been hospitalized, and the CDC estimates that the actual number of sickened people is much higher. Consumers reported becoming ill between February 24, 2025 and May 17, 2025. Luckily, as an exercise in reducing food waste on such a mass scale, the August Egg Company ""immediately began diverting all eggs from the plant to an egg-breaking facility, which pasteurizes the eggs and kills any pathogens,"" per a statement from the company, as reported by the FDA.', 'To stay safe, people who have recently purchased eggs from Walmart should check their cartons for sell-by dates between March 4, 2025 and June 19, 2025. Foodies who have purchased eggs from grocery chains Save Mart, FoodMaxx, Lucky, Smart & Final, Safeway, Raleys, Food 4 Less, or Ralphs should look for sell-by dates from March 4, 2025 to June 4, 2025. The packages of affected eggs will be printed with the plant code number P-6562 or CA5330 with the Julian Dates between 32 and 126. A full list of affected plant numbers and UPCs is included in the FDA report. Shoppers who spy any of the above details on their egg cartons are being instructed to return the product to its place of purchase for a full refund. To be safe, sanitize all surfaces with which the affected product might have come into contact.', 'Read the original article on Tasting Table.']",Business,https://news.google.com/api/attachments/CC8iK0NnNWtVR1Z2Vm5odFdtUjBhWGswVFJDZkF4amlCU2dLTWdhQkFZZ3ZPUVU=-w280-h168-p-df
Nearly 2 million egg cartons recalled after salmonella outbreak sickens 79 people in multiple states,https://www.foxbusiness.com/retail/nearly-2-million-egg-cartons-recalled-after-salmonella-outbreak-sickens-79-people-across-multiple-states,"['', '', ""Eat Just CEO Josh Tetrick says the company is growing 'five times faster' today than last year on 'The Claman Countdown.'"", 'Nearly 2 million egg cartons have been recalled across the country after being linked to a salmonella outbreak that has sickened 79 people, according to the U.S. Food and Drug Administration and the U.S. Centers for Disease Control and Prevention. ', 'Of the 79 who became sick after eating the eggs, 21 were hospitalized. ', 'The August Egg Company of Hilmar, California, on Friday decided to voluntarily recall 1.7 million cartons of a dozen brown cage-free and brown certified organic eggs distributed between Feb. 3 and May 15 in Arizona, California, Illinois, Indiana, Nebraska, New Mexico, Nevada, Washington and Wyoming.', 'LIQUID EGGS FOOD PRODUCTS ARE RECALLED, MAY HAVE BEEN DISTRIBUTED NATIONWIDE', 'Nearly 2 million egg cartons were recalled across the country after being linked to a salmonella outbreak that has sickened 79 people, according to the U.S. Food and Drug Administration and the U.S. Centers for Disease Control and Prevention.  (Emily Elconin/Bloomberg via Getty Images / Getty Images)', 'Recalled eggs with sell-by dates from March 4 to June 4 were distributed in California and Nevada to multiple stores, including Save Mart, FoodMaxx, Lucky, Smart & Final, Safeway, Raleys, Food 4 Less and Ralphs.', 'The recalled eggs were also available at Walmart in California, Nevada, Washington, Arizona, Wyoming, New Mexico, Nebraska, Indiana and Illinois. The cartons all had sell-by dates between March 4 and June 19. ', 'A 3D illustration of salmonella bacteria (iStock / iStock)', 'Salmonella poisoning can result in diarrhea, nausea, stomach cramps and fever and can start anywhere from hours to a week after ingesting contaminated food. ', 'JUMBO PUMPKIN SEEDS FROM CANADA COULD BE CONTAMINATED WITH SALMONELLA', 'It can also be fatal in young children, the elderly and people with weakened immune systems. ', 'The CDC advises throwing out any recalled eggs and washing any surfaces that might have come into contact with the eggs. ', 'The eggs were sold under various brands. (FDA / Fox News)', 'The eggs were sold under several brand names, including Clover Organic, First Street, Nulaid, O Organics, Marketside, Raleys, Simple Truth, Sun Harvest and Sunnyside. ', 'CLICK HERE TO READ MORE ON FOX BUSINESS ', 'Here is the full list of recalled eggs with the plant and carton UPC numbers, which should be on the carton: ', '', 'Get a brief on the top business stories of the week, plus CEO interviews, market updates, tech and money news that matters to you.', '', 'By clicking subscribe, you agree to the Fox News Privacy Policy and Terms of Use, and agree to receive content and promotional communications from Fox News. You understand that you can opt-out at any time.', 'Quotes displayed in real-time or delayed by at least 15 minutes. Market data provided by Factset. Powered and implemented by FactSet Digital Solutions.  Legal Statement.', 'This material may not be published, broadcast, rewritten, or redistributed. ©2025 FOX News Network, LLC. All rights reserved. FAQ - New Privacy Policy']",Business,https://news.google.com/api/attachments/CC8iK0NnNWtVR1Z2Vm5odFdtUjBhWGswVFJDZkF4amlCU2dLTWdhQkFZZ3ZPUVU=-w280-h168-p-df
1.7 million dozen eggs recalled after salmonella outbreak. Where they were sold in Indiana,https://www.indystar.com/story/news/2025/06/09/1-7-million-dozen-egg-recall-june-2025-where-they-were-sold-in-indiana-brands/84111305007/,"['Be careful with breakfast.', 'About 1.7 million dozen shell eggs are being voluntarily recalled after being linked to a salmonella outbreak, officials say.', 'Indiana is among nine states where the eggs were sold.', 'The salmonella outbreak is linked to 79 hospitalizations, according to the Centers for Disease Control and Prevention, CDC.', 'The recall was issued on June 6 after brown cage-free eggs and brown certified organic eggs distributed by August Egg Company and sold under different brand names and restaurants were linked to the outbreak, the Food and Drug Administration says.', '""FDA is working with the firm to determine if eggs were distributed elsewhere and will update the advisory as information becomes available,"" the FDA states on its website.', 'The outbreak has led to an investigation, the FDA says.', 'The eggs were sold under the following brands, according to the FDA:', 'The eggs were sold in Walmart locations across nine states:', 'Eggs recalled from Walmart were distributed from Feb. 3 to May 6, and sell-by dates ranged from March 4 to June 19.', 'The eggs were sold under the plant code numbers P-6562 or CA5330 and include organic and cage-free eggs, the FDA says.', 'Eggs were also sold in the following locations in California and Nevada:', 'The eggs sold in the stores listed above were distributed from Feb. 3 to May 15, and had sell-by dates that ranged from March 4 to June 4.', 'Anyone who has purchased the recalled eggs should throw them away or return them to the store where they were purchased, according to the CDC. People should also wash anything the eggs may have touched using ""hot soapy water or a dishwasher.""', 'Anyone who is experiencing the following severe symptoms should call their health care provider immediately, the CDC says:', 'Contact IndyStar reporter Cheryl V. Jackson at cheryl.jackson@indystar.com or 317-444-6264. Follow her on X.com:@cherylvjackson or Bluesky: @cherylvjackson.bsky.social.']",Business,https://news.google.com/api/attachments/CC8iK0NnNWtVR1Z2Vm5odFdtUjBhWGswVFJDZkF4amlCU2dLTWdhQkFZZ3ZPUVU=-w280-h168-p-df
