Title,Link,Paragraphs,Topic,Image
CA company recalls 20 million eggs. Here are the local stores where they were sold,https://www.sacbee.com/news/california/article308214520.html,"['', 'More than 20 million eggs have been recalled due to a salmonella outbreak that’s sickened people in seven states, including California.', 'It’s linked to a Merced County company.', 'August Egg Co. of Hilmar recalled a total of 1.7 million dozen cage-free and certified organic brown eggs “because they have the potential to be contaminated with salmonella,” the company wrote in a Friday, June 6, announcement shared by the U.S. Food and Drug Administration.', 'The bacteria “can cause serious and sometimes fatal infections in young children, frail or elderly people,” as well as those with weakened immune systems,” said August Egg Co., a division of Gemperle Enterprises in Turlock.', 'Potentially tainted eggs were shipped to supermarkets across California, the company said.', 'Here’s what to know:', 'Eggs affected by the recall were distributed to grocery stores in California and Nevada including Save Mart, FoodMaxx, Lucky, Smart & Final, Safeway, Raleys, Food 4 Less and Ralphs locations, according to the recall notice.', 'Those retailers got eggs with “sell by dates” from March 4 through June 4.', 'Eggs were also shipped to Walmart locations in California, Washington, Nevada, Arizona, Wyoming, New Mexico, Nebraska, Indiana and Illinois, August Egg Co. said.', 'The recall also involves eggs sent to Walmart stores in Alaska, Colorado, Hawaii, Iowa, Idaho, Kansas, Michigan, Montana, North Dakota, Ohio, Oklahoma, Oregon, Texas and Wisconsin, according to the recall section of Walmart’s website.', 'The eggs that went to Walmart stores had “sell by” dates from March 4 through June 19.', 'Packaging for the recalled eggs will have plant code P-6562 or CA5330 with Julian Dates between 32 to 126.', 'According to August Egg Co., the following brands were impacted by the egg recall:', '▪ Marketside (a Walmart store brand): Organic Large Cage Free Brown Eggs in cartons of 12 and 18; Large Cage Free Brown Eggs in cartons of 12 and 18.', '▪ First Street (a Smart & Final house brand): Cage Free Large Brown loose eggs.', '▪ Clover: Organic Large Brown Eggs, one dozen.', '▪ Nulaid: One dozen Medium Brown Cage Free, one dozen Jumbo Brown Cage Free.', '▪ O Organics: Cage Free Large Brown, six eggs; and Large Brown, 12 and 18 eggs. Available at Safeway and other Albertson’s-owned stores.', '▪ Raley’s (store brand): Large Cage Free Brown, 12 eggs: Organic Large Cage Free Brown, 12 and 18 eggs.', '▪ Simple Truth: Cage Free Large Brown and Medium Brown 18 eggs. Available at Food 4 Less, Ralphs and other Kroger-owned chains.', '▪ Sun Harvest: Organic Large Cage Free Brown Eggs in cartons of 12 and 18.', '▪ Sunnyside: Organic Large Cage Free Brown Eggs in cartons of 12 and 18; and Large Cage Free Brown Eggs in cartons of 12 and 18.', 'Considered a “leading cause of foodborne illness in the United States,” salmonella bacteria sicken about 1.35 million people across the nation every year, according to the federal Centers for Disease and Prevention.', 'You can get exposed to salmonella by eating contaminated food, drinking contaminated water or touching animals or their poop, the CDC said.', 'Common salmonella symptoms include diarrhea, fever and stomach cramps. In some cases, salmonella infections can lead to hospitalization or death.', '“You can help prevent infection by washing your hands, safely preparing and storing food, and being mindful while swimming, traveling and playing with animals,” the CDC said.', 'The multi-state salmonella outbreak linked to tainted eggs had sickened a total of 79 people as of Friday, according to the CDC.', 'That includes 63 California residents.', 'A total of 11 people fell ill in Arizona, Nevada and Washington state, the CDC said, while a total of five people got sick in Kentucky, Nebraska and New Jersey.', 'Of the people affected by the outbreak, 21 have been hospitalized.', 'If you have any of the eggs affected by the recall, return them to the store for a refund or toss them in the trash.', '“Consumers, restaurants, and retailers should not eat, sell or serve recalled brown cage-free and brown certified organic eggs from August Egg Company,” the FDA said.', 'If you have any questions about the recalls, call August Farms toll-free at 800-710-2554.', 'This story was originally published June 9, 2025 at 10:46 AM.', '', 'Part of the McClatchy Media Network', '']",Business,https://news.google.com/api/attachments/CC8iK0NnNWtVR1Z2Vm5odFdtUjBhWGswVFJDZkF4amlCU2dLTWdhQkFZZ3ZPUVU=-w280-h168-p-df
Eggs sold at Walmart locations in Washington recalled for Salmonella,https://www.kxly.com/news/eggs-sold-at-walmart-locations-in-washington-recalled-for-salmonella/article_81155b85-9ed9-4bdb-b327-1095d51b8a72.html,"['Spokane', '', 'This is a modal window.', '', '', 'Live updates all day, breaking news as it happens and weather every 10 minutes', 'Resize:', '', '', '', 'The average price of a dozen Grade A large eggs was $3 in February, according to the latest Consumer Price Index.', 'The Centers for Disease and Control and Prevention (CDC) and the Food and Drug Administration (FDA) have recalled over a million eggs sold in multiple states, including Washington, due to Salmonella.', 'The eggs were sold at grocery stores in Arizona, California, Illinois, Indiana, Nebraska, New Mexico, Nevada, Washington, and Wyoming.', 'Recalled eggs include brown cage-free eggs and brown certified organic eggs with sell by dates of March 4, 2025, to June 19, 2025. These eggs were distributed from February 3, 2025, through May 6, 2025 at Walmart locations in Washington.', 'The FDA says throw away your recalled eggs or return them to where you bought them. Also make sure to wash all items and surfaces that the eggs may have touched.', 'Severe Salmonella symptoms include diarrhea longer than three days, a fever higher than 102 degrees Fahrenheit, bloody diarrhea, excessive vomiting and dehydration. Symptoms of Salmonella usually start 6 hours or 6 days after swallowing the bacteria.', 'If you experience these symptoms, call your healthcare provider.', 'For the full list of recalled egg brands, click here.', 'COPYRIGHT 2025 BY KXLY. ALL RIGHTS RESERVED. THIS MATERIAL MAY NOT BE PUBLISHED, BROADCAST, REWRITTEN OR REDISTRIBUTED.', 'Digital Content Producer', '']",Business,https://news.google.com/api/attachments/CC8iK0NnNWtVR1Z2Vm5odFdtUjBhWGswVFJDZkF4amlCU2dLTWdhQkFZZ3ZPUVU=-w280-h168-p-df
More than 1.5 Million Dozen Eggs Recalled in Several States Due to Salmonella Risk. See the List,https://www.today.com/health/recall/eggs-recalled-salmonella-contamination-rcna211702,"[""A STYLE EXPERT ON NORDSTROM'S BEST AFFORDABLE SUMMER FASHION: VUORI, STEVE MADDEN, MORE"", '', '', '', '', '', '', 'Nearly two million dozen eggs are being recalled due to potential salmonella contamination.', 'The U.S. Food and Drug Administration announced June 6 that August Egg Company, based in Hilmar, California, is recalling 1.7 million dozen brown cage free and brown certified organic eggs due to a potential salmonella contamination.', 'The affected eggs were distributed within various retail locations across the United States.', 'August Egg Company shared in a statement that after the issue was identified, the company “immediately began diverting all eggs from the plant to an egg-breaking facility, which pasteurizes the eggs and kills any pathogens.”', 'The Centers for Disease Control and Prevention said that as of June 5, 79 people from 7 states have been infected with the outbreak strain of salmonella.', 'Those affected became sick between Feb. 24, 2025, and May 17, 2025. Six of the individuals were reported to have traveled to California or Nevada the week before they got sick. Out of the 61 individuals with information available, 21 people have been hospitalized, but there are no reported deaths.', 'Here’s what to know about the egg recalls.', 'The affected eggs were distributed between Feb. 3, 2025, and May 15, 2025, with sell by dates from March 4, 2025, to June 4, 2025, in California and Nevada at various retail locations.', 'The eggs were also distributed between Feb. 3, 2025, and May 6, 2025, with sell by dates of March 4, 2025. and June 19, 2025, within Walmart locations across nine states.', 'All of the recalled eggs will have the plant code number P-6562 or CA5330 with the Julian Dates between 32 to 126 printed on the side of the carton or package.', 'The 29 affected item names include:', 'The FDA shared several images of the cartons of affected eggs, including:', 'The affected eggs were distributed within various retail locations in nine states. Those states include:', 'Of these states, illness has been reported in seven: Washington (4), California (63), Nevada (4), Arizona (3), Nebraska (2), Kentucky (1) and New Jersey (2).', 'The CDC reports that the number of those sickened is likely higher than these reported numbers since many people recover from exposure without medical intervention or testing.', 'The affected eggs were sold at Walmart locations across Arizona, California, Illinois, Indiana, Nebraska, Nevada, New Mexico, Washington and Wyoming.', 'Additionally, in California and Nevada, the affected eggs were sold at several retail locations including:', 'Consumers who purchased the recalled eggs and have identified the plant code on the egg carton are instructed to return the eggs to the place of purchase for a full refund.', 'Additional questions can be sent to August Egg Company by calling 1-800-710-2554 between 9 a.m. and 5 p.m. PT.', 'The CDC also advised to not eat, sell or serve any recalled eggs.', 'For individuals experiencing a salmonella infection, common symptoms include severe stomach cramps and watery diarrhea, per the CDC.', 'Other symptoms include headache, loss of appetite, nausea and vomiting. Symptoms typically begin between six hours to six days after infection and will last between four to seven days.', 'The CDC recommends contacting a doctor for more severe symptoms including blood in your excrement, diarrhea or vomiting for more than two days, fever higher than 102°F or signs of dehydration.', 'To diagnose you, a doctor might sample your stool, blood, urine or other bodily fluids.', 'In order to prevent a salmonella infection, the CDC recommends keeping your hands clean through hand washing to protect yourself and others.', 'Other prevention tips include food safety by following four steps:', 'Francesca Gariano is a New York City-based freelance journalist reporting on culture, entertainment, beauty, lifestyle and wellness. She is a freelance contributor to TODAY.com, where she covers pop culture and breaking news.', '© 2025 NBCUniversal Media, LLC', '', '', '', '', '', '', '', '', '']",Business,https://news.google.com/api/attachments/CC8iK0NnNWtVR1Z2Vm5odFdtUjBhWGswVFJDZkF4amlCU2dLTWdhQkFZZ3ZPUVU=-w280-h168-p-df
Multistate Salmonella outbreak linked to brown eggs,https://www.cidrap.umn.edu/salmonella/multistate-salmonella-outbreak-linked-brown-eggs,"['krblokhin / iStock', 'Federal and state health officials are investigating a multistate outbreak of Salmonella linked to brown eggs from a distributor in California.', 'In an update published late last week, the Centers for Disease Control and Prevention (CDC) said that as June 5, 79 people in 7 states had been infected with Salmonella Enteritidis, with 21 people hospitalized and no fatalities. The age of the case-patients ranges from 1 to 90 years, and illness onset dates range from February 24 to May 17. The affected states are Arizona, California, Kentucky, Nebraska, Nevada, New Jersey, and Washington.', ""Of the 30 people who've been interviewed, 27 reported eating eggs, and state health officials have identified illness sub-clusters at two restaurants where eggs were served. Six of the case-patients reported traveling to California or Nevada in the week before they got sick. "", 'The CDC says the true number of sick people in the outbreak is likely much larger, since most people with Salmonella infections recover without medical care.', ""A traceback investigation, conducted by the Food and Drug Administration (FDA) and based on where sick people reported shopping for or eating eggs, has linked the outbreak to brown cage free and brown certified organic eggs distributed by August Egg Company in Hillmar, California, from February 3 through May 15, with sell by dates from March 4 to June 4. Whole genome sequencing of environmental samples collected during an inspection of the company's processing facility identified two samples that matched the outbreak strain of Salmonella."", '""Consumers, restaurants, and retailers should not eat, sell, or serve recalled brown cage free and brown certified organic eggs by August Egg Company,"" the FDA said.', 'The eggs were sold under several brands, including Clover, First Street, Nulaid, O Organics, Martketside, Raleys, Simple Truth, Sun Harvest, and Sunnyside. They were sold to retailers in Arizona, California, Illinois, Indiana, Nebraska, New Mexico, Nevada, Washington, and Wyoming.', 'Consumers, restaurants, and retailers should not eat, sell, or serve recalled brown cage free and brown certified organic eggs by August Egg Company.', ""The FDA said the company diverted all eggs to an egg-breaking facility in May, and has agreed to recall 1.7 million cartons of brown cage free and brown certified organic eggs that could potentially be in people's homes. The investigation is ongoing."", ""The CDC noted that the Salmonella strain implicated in this outbreak is resistant to nalidixic acid and nonsusceptible to ciprofloxacin and is related to a strain that's been isolated from chicken, eggs, and backyard poultry. One clinical sample also predicted additional resistance to ampicillin and streptomycin."", '""Most people with\u202fSalmonella\u202fillness recover without antibiotics,"" the CDC said. ""However, if antibiotics are needed, some illnesses in this outbreak may not be treatable with some commonly recommended antibiotics and may require a different antibiotic choice.""', 'Other states report more cases, including Minnesota, with two, one of which involves a child whose infection suggests community spread.', 'The company\'s ""next-generation"" COVID-19 vaccine, mNexspike, was approved for adults 65 and older and younger people at risk of severe disease.', 'Beneficiaries with 4 or more COVID-19 vaccine doses had a 39% lower rate of long COVID.', 'In other developments, Canada reported its first measles death of the year, a premature infant born to an infected mother.', 'The findings underscore the need for improved awareness, education, testing practices, and reporting to achieve better patient outcomes, the authors say.', 'The latest case-patient is a vaccinated adult Denver resident who was a passenger on Turkish Airlines flight 201.', 'The results of the non–peer-reviewed research highlight the risk of contracting H5N1 avian flu from unpasteurized dairy products or occupational exposure in dairies.', 'Population density and tourism are among factors driving infections in Sierra Leone, which made up 53% of mpox illnesses in Africa last week.', 'The findings underscore the need for continued surveillance to monitor the long-term dynamics of SARS-CoV-2 in deer and the related zoonotic risks.', ' Among 45 cases, 16 people have required hospitalization.', ""Help make CIDRAP's vital work possible"", 'CIDRAP - Center for Infectious Disease Research & Policy\nResearch and Innovation Office, University of Minnesota, Minneapolis, MN', 'EMAIL US', '© 2025 Regents of the University of Minnesota. All rights Reserved.\nThe University of Minnesota is an equal opportunity educator and employer', 'Research and Innovation Office |   Contact U of M  |  Privacy Policy', 'NEWSLETTER SUBSCRIBE']",Business,https://news.google.com/api/attachments/CC8iK0NnNWtVR1Z2Vm5odFdtUjBhWGswVFJDZkF4amlCU2dLTWdhQkFZZ3ZPUVU=-w280-h168-p-df
Egg recall over salmonella warning spans across nine states,https://www.yahoo.com/news/egg-recall-over-salmonella-warning-133820586.html,"['', '', '', '', '', 'Almost two million eggs have been recalled in the United States over concerns of salmonella contamination.', 'The recall, announced on Friday by the U.S. Food and Drug Administration, affects products distributed in nine states and is associated with various grocery store chains.', 'According to the FDA, California-based August Egg Company of Hilmar is recalling 1,700,000 dozen brown cage-free and brown certified organic eggs due to potential contamination.', 'The eggs were distributed from February 3 through May 15, with sell-by dates from March 4 to June 4, within California and Nevada.', 'Products were distributed at locations including Save Mart, FoodMaxx, Lucky, Smart & Final, Safeway, Raleys, Food 4 Less, and Ralphs.', 'Eggs were also distributed from February 3 through May 6 with sell-by dates from March 4 to June 19 to Walmart locations in California, Washington, Nevada, Arizona, Wyoming, New Mexico, Nebraska, Indiana, and Illinois.', 'The recalled eggs will have the plant code number P-6562 or CA5330 printed on the carton or package, with Julian Dates between 32 and 126. The recalled retail eggs will be in fiber or plastic cartons, with the above codes printed on one side of the carton.', 'Salmonella can cause serious and sometimes fatal infections in young children, the frail or elderly, and others with weakened immune systems, according to the FDA.', 'Healthy persons infected with Salmonella often experience fever, nausea, vomiting, abdominal pain, and even bloody diarrhea.', 'In rare circumstances, infection with Salmonella can result in more severe illnesses.', 'A statement from August Egg Company read: “It is important to know that when our processing plant identified this concern, we immediately began diverting all eggs from the plant to an egg-breaking facility, which pasteurizes the eggs and kills any pathogens.', '“August Egg Company’s internal food safety team is also conducting its own stringent review to identify what measures can be established to prevent this situation from recurring.', '“We are committed to addressing this matter fully and to implementing all necessary corrective actions to ensure this does not happen again.”']",Business,https://news.google.com/api/attachments/CC8iK0NnNWtVR1Z2Vm5odFdtUjBhWGswVFJDZkF4amlCU2dLTWdhQkFZZ3ZPUVU=-w280-h168-p-df
Salmonella outbreak prompts recalls for some foods sold in Louisville area,https://www.wdrb.com/news/salmonella-outbreak-prompts-recalls-for-some-foods-sold-in-louisville-area/article_00468ad0-7f8f-4259-9995-fcaef9a57a21.html,"['', '', '', '', '', '', '', '', 'LOUISVILLE, Ky. (WDRB) -- A salmonella outbreak is prompting major recalls for certain products sold at grocery stores in the Louisville area.', ""Dozens of people across the country have gotten sick from contaminated food, but there are steps you can take to help make sure what you're serving your family is safe."", 'When it comes to grocery shopping, most people are worried about the rising costs. But food safety should also be top of mind when checking off your shopping list.', 'Last week, nearly two million eggs — some sold at Walmart stores in Indiana — were recalled over a serious salmonella outbreak that left dozens of people sick across the country. Just days ago, a major cucumber recall was expanded for similar contamination concerns.', '""Salmonella can infect anybody at any age and make you pretty sick,"" said Dr. David Acheson. ""You might end up being hospitalized and people die from salmonella, so it\'s absolutely something to take seriously.""', ""Acheson is a food safety expert who has held roles at both the U.S. Food and Drug Administration and the U.S. Department of Agriculture. Even though it may seem like it, he said we aren't actually seeing recalls more frequently. But they are involving bigger brands and more serious contaminants that grab attention."", '""If you look at the data around the numbers of recalls per year broadly across U.S. food, it really has changed much, it\'s largely flat,"" he said. ""But what has changed is that we\'ve had some very high profile recalls.""', 'Those recalls are making some people very sick. Dr. Joshua Yuen, with Norton Healthcare, said a fever, severe abdominal pain and dehydration are symptoms that would warrant a trip to the doctor.', '""When it comes to food-borne illnesses, generally most people will get better on their own,"" Yuen said. ""If they have cancer, if they have an autoimmune disease, if they\'re pregnant, if they\'re older, certainly we want to be more careful.""', 'There are also things you can do once you get your groceries home to lower your risk of illness. That includes keeping your food cold, cook it properly to kill bacteria, avoid cross-contamination and stay aware about recalls being issued.', '""Now cucumbers, they\'re gone or you\'ve thrown them out or you\'ve eaten them,"" said Acheson. ""If it\'s something like a jar of peanut butter or something with a longer shelf life, you can take action on that to protect yourself and your family.""', 'The best place to find information about food safety and the latest recalls is on the federal Food Safety website by clicking here. The website has the latest information, photos of the affected products, and times and locations where items were sold.', 'Related Coverage:', 'Kentucky health officials say kratom products pose risk of serious health risks', 'Cucumbers recalled in Kentucky for possible salmonella contamination', 'Health officials say 2 Kentucky infants have died from whooping cough in last 6 months', 'Shelby County health fair screening helps judge executive catch Stage 4 cancer just in time', 'Copyright 2025 WDRB Media. All Rights Reserved.', 'Anchor', 'Sorry, there are no recent results for popular articles.', '', '']",Business,https://news.google.com/api/attachments/CC8iK0NnNWtVR1Z2Vm5odFdtUjBhWGswVFJDZkF4amlCU2dLTWdhQkFZZ3ZPUVU=-w280-h168-p-df
Millions of brown eggs sold recalled: See list of affected products,https://www.usatoday.com/story/money/food/2025/06/09/brown-eggs-salmonella-recall/84119269007/,"['Almost two million dozen shell eggs were voluntarily recalled after being linked to a widespread salmonella outbreak, health officials said.', 'According to the Centers for Disease Control and Prevention (CDC), the salmonella outbreak has been linked to 79 cases, which include 21 hospitalizations across the United States. ', 'The recall was issued on June 6 after brown cage-free eggs and brown certified organic eggs distributed by August Egg Company, and sold under different brand names and restaurants were linked to the outbreak, the Food and Drug Administration says.', '""FDA is working with the firm to determine if eggs were distributed elsewhere and will update the advisory as information becomes available,"" the FDA said on its website.', 'August Egg Co. said consumers can identify the recalled eggs by the plant code on one side of the egg carton. They can return the eggs to the place of purchase for a refund. Consumers with questions can call the company at 1-800-710-2554, between 9 a.m. and 5 p.m. PT.', 'Here are the products recalled with the plant code and UPC.', 'The eggs were sold under the following brands, according to the FDA:', 'The recalled eggs were distributed beginning Feb. 3 across multiple retailers in nine states:', 'Eggs with sell-by dates to June 4: Through May 15, eggs with those sell-by dates were distributed to Save Mart, FoodMaxx, Lucky, Smart & Final, Safeway, Raleys, Food 4 Less, and Ralphs stores in California and Nevada.', 'Eggs with sell-by dates to June 19: Through May 6, eggs with those sell-by dates were distributed to Walmart locations in California, Washington, Nevada, Arizona, Wyoming, New Mexico, Nebraska, Indiana, and Illinois.', 'Contributing: Mike Snider and Julia Gomez, USA TODAY', 'Fernando Cervantes Jr. is a trending news reporter for USA TODAY. Reach him at fernando.cervantes@gannett.com and follow him on X @fern_cerv_.']",Business,https://news.google.com/api/attachments/CC8iK0NnNWtVR1Z2Vm5odFdtUjBhWGswVFJDZkF4amlCU2dLTWdhQkFZZ3ZPUVU=-w280-h168-p-df
