Title,Link,Paragraphs,Topic,Image
Science-Backed Ways to Stay Healthy during Salmonella Outbreak in Eggs,https://www.scientificamerican.com/article/how-to-protect-yourself-from-recent-salmonella-outbreak-in-recalled-eggs/,"['JUNE 9, 2025', '3 MIN READ', 'Science-Backed Ways to Stay Healthy during Salmonella Outbreak in Eggs', 'To prevent Salmonella food poisoning, refrigerate your eggs, cook them well, never eat them raw and clean, clean, clean', 'BY MARK FISCHETTI EDITED BY DEAN VISSER', 'wildpixel/Getty Images', 'Join Our Community of Science Lovers!', 'At least 79 people have been sickened by a Salmonella outbreak linked to organic and cage-free eggs, distributed under various brand names across nine U.S. states. The eggs were processed by the August Egg Company in Hilmar, Calif., according to the Food and Drug Administration. On June 6, after FDA tests discovered the bacterium, the company issued a wide recall.', 'The recall is just the latest in a string of callbacks linked to Salmonella contamination. On June 4 TGD Cuts of Jessup, Md., recalled cucumber and salsa products. And in late May the FDA urged consumers to follow a recall of tomatoes that were packaged and shipped by various companies.', 'What is Salmonella, how can it make you sick, and how can you minimize your chances of getting it? Here are some basics.', 'Salmonella is a bacterium that thrives in the intestinal tracts of certain animals, including chickens and cows—and humans. It is shed through feces.', 'Like many foodborne pathogens, Salmonella is often spread by improper cleaning or handling of raw food—including meat, eggs, seafood, vegetables, fruits and rice—at farms or factories. It is often associated with chicken and eggs, although past outbreaks have also been linked to peanut butter, raw pork and beef, cucumbers and even raw flour in cookie dough. When compromised products are shipped, stores and consumers may be unaware of the contamination until enough people start to become sick and investigators trace the source back to specific food lots. The U.S. Centers for Disease Control and Prevention estimates that 48 million Americans get sick from food each year.', 'You may begin to feel sick anywhere from eight to 72 hours after you are exposed. As the bacteria multiply, they can cause stomach cramps, diarrhea, vomiting and fever. Children under age five often account for a large percentage of cases in a Salmonella outbreak, and older people or those with a weakened immune system are at greater risk. In rare cases, people develop joint pain or eye irritation.', 'LORI YOUMSHAJEKIAN', 'TANYA LEWIS', 'KATE GRAHAM-SHAW', 'TANYA LEWIS', 'Infections often clear within three or four days. But if you experience diarrhea that lasts for more than two days or your body temperature rises above 102 degrees Fahrenheit (39 degree Celsius), health officials urge that you should see a doctor. Complications such as diarrhea can cause dehydration, so drink plenty of fluids.', 'Contaminated food is the chief source of infection, so never eat raw foods that can carry the bacterium. Refrigerate eggs or other susceptible foods at 40 degrees F (four degrees C) or less. When preparing meals, use separate cutting boards and knives for meats and vegetables and thoroughly wash cooking equipment—as well as kitchen surfaces and your hands after prep. Microwave dishwashing sponges on high. Cook ground meat and eggs to at least 160 degrees F (71 degrees C).', 'Birds, hedgehogs, turtles, guinea pigs and even pet bearded dragons can carry Salmonella and make you sick through direct contact, according to a 2024 Scientific American story. A trend among homeowners to raise chickens in the backyard, which expanded during the COVID pandemic, has also been a culprit in people becoming infected by the bacterium. Salmonella bacteria can linger on an animal’s skin, so regardless of how cute you think your chickens are, try not to snuggle or kiss them (which evidently is a thing)!', 'MARK FISCHETTI has been a senior editor at Scientific American for 17 years and has covered sustainability issues, including climate, weather, environment, energy, food, water, biodiversity, population, and more. He assigns and edits feature articles, commentaries and news by journalists and scientists and also writes in those formats. He edits History, the magazine\'s department looking at science advances throughout time. He was founding managing editor of two spinoff magazines: Scientific American Mind and Scientific American Earth 3.0. His 2001 freelance article for the magazine, ""Drowning New Orleans,"" predicted the widespread disaster that a storm like Hurricane Katrina would impose on the city. His video What Happens to Your Body after You Die?, has more than 12 million views on YouTube. Fischetti has written freelance articles for the New York Times, Sports Illustrated, Smithsonian, Technology Review, Fast Company, and many others. He co-authored the book Weaving the Web with Tim Berners-Lee, inventor of the World Wide Web, which tells the real story of how the Web was created. He also co-authored The New Killer Diseases with microbiologist Elinor Levy. Fischetti is a former managing editor of IEEE Spectrum Magazine and of Family Business Magazine. He has a physics degree and has twice served as the Attaway Fellow in Civic Culture at Centenary College of Louisiana, which awarded him an honorary doctorate. In 2021 he received the American Geophysical Union\'s Robert C. Cowen Award for Sustained Achievement in Science Journalism, which celebrates a career of outstanding reporting on the Earth and space sciences. He has appeared on NBC\'s Meet the Press, CNN, the History Channel, NPR News and many news radio stations. Follow Fischetti on X (formerly Twitter) @markfischetti', 'At Secret Math Meeting, Researchers Struggle to Outsmart AI', ""The world's leading mathematicians were stunned by how adept artificial intelligence is at doing their jobs"", 'LYNDIE CHIOU', 'Tree Planting Efforts Could Actually Worsen Climate Change', 'With wildfires turning forests into “massive carbon emitters,” planting trees in some places could inadvertently increase carbon emissions, a new report says', 'ANNE C. MULKERN, E&E NEWS', 'AI Found a ‘Magic Potion’ That Can Bring Dead Batteries Back to Life', 'Electric vehicles leave behind mountains of dead lithium-ion batteries. A new “injection” brings them back to life', 'YOU XIAOYING', 'Mathematicians Solve Multidimensional Fruit-Slicing Dilemma', 'A 40-year-old conjecture on shapes’ cross sections is finally proven', 'MAX SPRINGER', 'Do Wobbling Muons Point the Way to New Physics?', 'The most anticipated particle physics result of recent years is here—but the real news came one week before: the “muon g–2 anomaly” might have never existed', 'ELENI PETRAKOU', 'Human Intelligence Created the Climate Crisis—But It’s Also the Solution', 'Science communicator Hank Green explains how our species’ unique intelligence got us into this climate mess—and how it will help us solve it', 'HANK GREEN', 'Subscribe to Scientific American to learn and share the most exciting discoveries, innovations and ideas shaping our world today.', 'Scientific American is part of Springer Nature, which owns or has commercial relations with thousands of scientific publications (many of them can be found at www.springernature.com/us). Scientific American maintains a strict policy of editorial independence in reporting developments in science to our readers.', '© 2025 SCIENTIFIC AMERICAN, A DIVISION OF SPRINGER NATURE AMERICA, INC.\nALL RIGHTS RESERVED.', '', '', '', '', '', '', '', '', '', '', '', '']",Business,https://news.google.com/api/attachments/CC8iK0NnNWtVR1Z2Vm5odFdtUjBhWGswVFJDZkF4amlCU2dLTWdhQkFZZ3ZPUVU=-w280-h168-p-df
"Investigation Update: Salmonella Outbreak, Eggs, June 2025",https://www.cdc.gov/salmonella/outbreaks/eggs-06-25/investigation.html,"['', '', 'CDC, FDA, and public health officials in several states are investigating a multistate outbreak of Salmonella infections linked to eggs. If you have any of these recalled products in your home or business, throw them out or return them to the store.', 'CDC, public health and regulatory officials in several states, and the U.S. Food and Drug Administration (FDA) are collecting different types of data to investigate a multistate outbreak of Salmonella Enteritidis infections.', 'Epidemiologic, laboratory, and traceback data show that eggs distributed by August Egg Company may be contaminated with Salmonella Enteritidis and may be making people sick.', 'As of June 5, 2025, a total of 79 people infected with the outbreak strain of Salmonella have been reported from 7 states. Six sick people reported traveling to California or Nevada in the week before they got sick. Illnesses started on dates ranging from February 24, 2025 to May 17, 2025. Of the 61 people with information available, 21 have been hospitalized. No deaths have been reported.', 'The true number of sick people in this outbreak was likely much higher than the number reported, and this outbreak may not have been limited to the states with known illnesses. This is because many people recover without medical care and are not tested for Salmonella.\u202fIn addition, recent illnesses may not yet be reported as it usually takes 3 to 4 weeks to determine if a sick person is part of an outbreak.', 'Public health officials collect many different types of information from sick people, including their age, race, ethnicity, other demographics, and the foods they ate in the week before they got sick. This information provides clues to help investigators identify the source of the outbreak.', 'The table below has information about sick people in this outbreak (""n"" is the number of people with information available for each demographic).', 'Demographics', 'Information', '', 'Age', '', '', '(n=79)', '', 'Range from 1 to 90 years', 'Median age of 48', '', 'Sex', '(n=79)', '', '59% female', '41% male', '', 'Race', '(n=42)', '', '94% White', '2% African American/Black', '2% Asian', '2% reported more than one race', '', 'Ethnicity', '(n=53)', '', '74% non-Hispanic', '26% Hispanic', 'State and local public health officials are interviewing people about the foods they ate in the week before they got sick. Of the 30 people interviewed, 27 (90%) reported eating eggs. State health officials identified illness sub-clusters at two restaurants. An illness sub-cluster is a group of unrelated sick people who all ate at the same location or event, such as a restaurant. Investigating sub-clusters can help identify a food item eaten by all the sick people that could be the source of the outbreak. Eggs were served at both sub-cluster locations.', ""Public health investigators are using the PulseNet system to identify illnesses that may be part of this outbreak. CDC PulseNet manages a national database of DNA fingerprints of bacteria that cause foodborne illnesses. DNA fingerprinting is performed on bacteria using a method called whole genome sequencing (WGS). WGS showed that bacteria from sick people's samples are closely related genetically. This suggests that people in this outbreak got sick from the same food."", ""FDA conducted an inspection at August Egg Company's processing facility and collected samples for testing. Some samples tested positive for Salmonella. WGS showed that the Salmonella in the samples are closely related to Salmonella from sick people."", ""Based on\u202fWGS analysis, bacteria from 79 people's samples predicted resistance to nalidixic acid and nonsusceptibility to ciprofloxacin (NSC); this NSC strain is related to a strain of Salmonella\u202fEnteritidis isolated from chicken, eggs, and backyard poultry\n. One person's samples also predicted an additional resistance to ampicillin and streptomycin.\u202fMost people with\u202fSalmonella\u202fillness recover without antibiotics. However, if antibiotics are needed, some illnesses in this outbreak may not be treatable with some commonly recommended antibiotics and may require a different antibiotic choice. More information is available at the\u202fNational Antimicrobial Resistance Monitoring System (NARMS)\u202fsite."", 'People reported buying many different brands of eggs from multiple stores. FDA conducted a traceback investigation based on where the ill people reported shopping or eating during the timeframe of interest, and August Egg Company was identified as a common supplier of eggs.', 'Ill people in Kentucky, New Jersey, and Washington reported traveling to California and Nevada before they got sick.', 'On June 6, 2025, August Egg Company recalled eggs. CDC is advising people not eat, sell, or serve recalled eggs.', 'Salmonella bacteria (germs) are a leading cause of foodborne illness in the United States. Learn about symptoms, treatment, and prevention of infection.', '', '']",Business,https://news.google.com/api/attachments/CC8iK0NnNWtVR1Z2Vm5odFdtUjBhWGswVFJDZkF4amlCU2dLTWdhQkFZZ3ZPUVU=-w280-h168-p-df
Salmonella outbreak tied to recalled eggs makes dozens sick across 7 states in the West and Midwest,https://www.cbsnews.com/news/salmonella-outbreak-tied-to-eggs-makes-cdc/,"['Watch CBS News', 'Updated on: June 9, 2025 / 4:27 PM EDT / CBS/AP', 'A salmonella outbreak linked to a large egg recall has made dozens of people sick in seven states in the West and Midwest, federal health officials said Saturday.', ""The August Egg Company recalled about 1.7 million brown organic and brown cage-free egg varieties distributed to grocery stores between February and May because of the potential for salmonella, according to an announcement posted Friday on the Food and Drug Administration's website."", 'At least 79 people in seven states have gotten a strain of salmonella that was linked to the eggs, and 21 people have been hospitalized, the Centers for Disease Control and Prevention said.', 'The recall affects retailers in Arizona, California, Illinois, Indiana, Nebraska, New Mexico, Nevada, Washington and Wyoming. ', ""The recalled eggs were sold under brand names including Clover, First Street, Nulaid, O Organics, Marketside, Raleys, Simple Truth, Sun Harvest, and Sunnyside. Plant code numbers for the recalled eggs are P-6562 or CA5330, according to the CDC's website."", '""August Egg Company\'s internal food safety team also is conducting its own stringent review to identify what measures can be established to prevent this situation from recurring,"" the company said in a statement on the FDA\'s website. ""We are committed to addressing this matter fully and to implementing all necessary corrective actions to ensure this does not happen again.""', 'Symptoms of salmonella poisoning include diarrhea, fever, severe vomiting, dehydration and stomach cramps. Most people who get sick recover within a week.', 'Infections can be severe in young children, older adults and people with weakened immune systems, who may require hospitalization.', 'The CDC advises people to throw away recalled eggs or return them to the store where they were purchased. Consumers should also wash and disinfect any surfaces that came in contact with the eggs.', 'This is the latest in a string of salmonella-related outbreaks recently involving food.', 'A tomato recall affecting three southern states was upgraded to a Class I recall, the most severe warning by the Food and Drug Administration. The recall was first announced in May over potential salmonella contamination.', 'Also, nearly four dozen people across 18 states have gotten sick with salmonella food poisoning tied to recalled cucumbers, according to federal health officials. In an update, the CDC said the expanding outbreak led to at least 16 people being hospitalized.', '© 2025 CBS Interactive Inc. All Rights Reserved. This material may not be published, broadcast, rewritten, or redistributed. The Associated Press contributed to this report.', 'Copyright ©2025 CBS Interactive Inc. All rights reserved.']",Business,https://news.google.com/api/attachments/CC8iK0NnNWtVR1Z2Vm5odFdtUjBhWGswVFJDZkF4amlCU2dLTWdhQkFZZ3ZPUVU=-w280-h168-p-df
"20 million eggs recalled from Walmart, Safeway other stores in several states",https://www.idahostatesman.com/news/business/article308229990.html,"['', 'A salmonella outbreak has caused the recall of 1.7 million dozen eggs and has sickened 79 people in seven states. So far, Idaho is not among states with reports of sick consumers, though the U.S. Food and Drug Administration continues to track the outbreak.', 'The recall was issued on June 6 for 20 million eggs distributed to Walmart, Safeway, chains owned by Kroger and various other independent and chain supermarkets around the country. The Centers for Disease Control is recommending that people throw the eggs away.', 'Hilmar, California’s August Egg Company, a division of Gemperle Enterprises, produced the eggs and issued the recall last week.', '“August Egg Company is not selling fresh shell eggs at this time,” the company-written, FDA-posted recall notice said. “Our firm has voluntarily been diverting eggs to an egg-breaking plant for over 30 days, which pasteurizes the eggs and kills any potential foodborne pathogens.”', 'Packaging for the recalled eggs will have plant code P-6562 or CA5330 with the Julian Dates from 32 to 126.', 'The eggs that went to Walmart stores had sell-by dates from March 4 through June 19. Other retailers got eggs with sell-by dates from March 4 through June 4.', 'The recall section of Walmart’s website says the egg recall involves its stores in Alaska, Colorado, Hawai’i, Iowa, Idaho, Kansas, Michigan, Montana, North Dakota, Ohio, Oklahoma, Oregon, Texas and Wisconsin.', '▪ Marketside (a Walmart store brand): Organic Large Cage Free Brown Eggs in cartons of 12 and 18; Large Cage Free Brown Eggs in cartons of 12 and 18.', '▪ First Street (a Smart & Final house brand): Cage Free Large Brown loose eggs.', '▪ Clover: Organic Large Brown Eggs, one dozen.', '▪ Nulaid: One dozen Medium Brown Cage Free, one dozen Jumbo Brown Cage Free.', '▪ O Organics: Cage Free Large Brown, six eggs; and Large Brown, 12 and 18 eggs. This brand will be found at Safeway and other Albertsons-owned stores.', '▪ Raley’s (store brand): Large Cage Free Brown, 12 eggs: Organic Large Cage Free Brown, 12 and 18 eggs.', '▪ Simple Truth: Cage Free Large Brown and Medium Brown 18 eggs. This brand will be found at Food 4 Less, Ralphs and other Kroger-owned chains.', '▪ Sun Harvest: Organic Large Cage Free Brown Eggs in cartons of 12 and 18.', '▪ Sunnyside: Organic Large Cage Free Brown Eggs in cartons of 12 and 18; and Large Cage Free Brown Eggs in cartons of 12 and 18.', 'An outbreak update from the Centers for Disease Control and Prevention says 79 people have been sickened in this outbreak with 21 hospitalizations. Most of those have been in California so far, and none have been in Idaho.', 'The remaining 16 break down as Nevada and Washington (four each); Arizona (three); Nebraska and New Jersey (two each); and Kentucky (one).', 'Salmonella outbreaks tend to be very undercounted because most people recover without medical attention.', 'The CDC estimates about 1.35 million people in the United States will get salmonella each year. Of that number, 26,400 will be hospitalized, usually driven to the hospital by bloody diarrhea, and 420 will die.', 'Usually, salmonella means a few days of diarrhea, vomiting, fever and stomachaches.', 'The Mayo Clinic notes that salmonella symptoms include:', 'If you have any of the recalled eggs listed above, return them to the store for a refund or throw them deep into the garbage. If you have any questions about the recalls, call August Farms at 800-710-2554, 10 a.m. to 6 p.m. daily, Mountain time.', '', 'Part of the McClatchy Media Network', '']",Business,https://news.google.com/api/attachments/CC8iK0NnNWtVR1Z2Vm5odFdtUjBhWGswVFJDZkF4amlCU2dLTWdhQkFZZ3ZPUVU=-w280-h168-p-df
Salmonella Outbreak Linked to Eggs Sickens Dozens,https://www.nytimes.com/2025/06/08/health/eggs-salmonella-recall.html,"['ADVERTISEMENT', '', 'The outbreak has been tied to multiple brown organic and brown cage-free egg brands distributed to grocery stores in seven states, officials said.', 'By Johnny Diaz', 'Dozens of people across seven states, most of them in the West, have become ill in a salmonella outbreak linked to a recall of 1.7 million eggs, federal safety regulators said.', 'The August Egg Company, of Hilmar, Calif., issued the recall of brown organic and brown cage-free eggs tied to multiple brands that were distributed to grocery stores from Feb. 3 to May 15 this year because of their potential to be contaminated with salmonella, the U.S. Food and Drug Administration said on Friday.', '', '', '']",Business,https://news.google.com/api/attachments/CC8iK0NnNWtVR1Z2Vm5odFdtUjBhWGswVFJDZkF4amlCU2dLTWdhQkFZZ3ZPUVU=-w280-h168-p-df
"Eggs Sold in Safeway, Walmart, More Recalled Over Salmonella",https://www.today.com/video/eggs-sold-in-safeway-walmart-more-recalled-over-salmonella-241132101559,"[""A STYLE EXPERT ON NORDSTROM'S BEST AFFORDABLE SUMMER FASHION: VUORI, STEVE MADDEN, MORE"", '', '', '', '', '', '', 'The August Egg Company is recalling nearly two million eggs in stores like Safeway and Walmart due to a salmonella outbreak. The CDC reports at least 79 people from New Jersey to California have got sick from the eggs.\nJune 8, 2025', '© 2025 NBCUniversal Media, LLC', '', '', '', '', '', '', '', '', '']",Business,https://news.google.com/api/attachments/CC8iK0NnNWtVR1Z2Vm5odFdtUjBhWGswVFJDZkF4amlCU2dLTWdhQkFZZ3ZPUVU=-w280-h168-p-df
"20 million eggs recalled from Walmart, Safeway other stores in WA, other states",https://www.thenewstribune.com/news/article308235340.html,"['', 'A salmonella outbreak has caused the recall of 1.7 million dozen eggs and has sickened 79 people in seven states. Four people in Washington have been reported sick, and the U.S. Food and Drug Administration continues to track the outbreak. There have been no deaths.', 'The recall was issued June 6 for 20 million eggs distributed to Walmart, Safeway, chains owned by Kroger and various other independent and chain supermarkets around the country. The Centers for Disease Control is recommending that people throw the eggs away.', 'Hilmar, California’s August Egg Co., a division of Gemperle Enterprises, produced the eggs and issued the recall last week.', '“August Egg Company is not selling fresh shell eggs at this time,” the company-written, FDA-posted recall notice said. “Our firm has voluntarily been diverting eggs to an egg-breaking plant for over 30 days, which pasteurizes the eggs and kills any potential foodborne pathogens.”', 'Packaging for the recalled eggs will have plant code P-6562 or CA5330 with the Julian Dates between 32 to 126.', 'The eggs that went to Walmart stores had sell-by dates from March 4 through June 19. Other retailers got eggs with “sell by dates” from March 4 through June 4.', 'The recall section of Walmart’s website say the egg recall involves its stores in two dozen states, including Washington. The FDA’s recall list includes California, Washington, Nevada, Arizona, Wyoming, New Mexico, Nebraska, Indiana and Illinois.', 'Here are specific brands to look for:', '▪ Marketside (a Walmart store brand): Organic Large Cage Free Brown Eggs in cartons of 12 and 18; Large Cage Free Brown Eggs in cartons of 12 and 18.', '▪ First Street (a Smart & Final house brand): Cage Free Large Brown loose eggs.', '▪ Clover: Organic Large Brown Eggs, one dozen.', '▪ Nulaid: One dozen Medium Brown Cage Free, one dozen Jumbo Brown Cage Free.', '▪ O Organics: Cage Free Large Brown, six eggs; and Large Brown, 12 and 18 eggs. This brand will be found at Safeway and other Albertson’s-owned stores.', '▪ Raley’s (store brand): Large Cage Free Brown, 12 eggs: Organic Large Cage Free Brown, 12 and 18 eggs.', '▪ Simple Truth: Cage Free Large Brown and Medium Brown 18 eggs. This brand will be found at Food 4 Less, Ralphs and other Kroger-owned chains.', '▪ Sun Harvest: Organic Large Cage Free Brown Eggs in cartons of 12 and 18.', '▪ Sunnyside: Organic Large Cage Free Brown Eggs in cartons of 12 and 18; and Large Cage Free Brown Eggs in cartons of 12 and 18.', 'An outbreak update from the Centers for Disease Control and Prevention says 79 people have been sickened in this outbreak with 21 hospitalizations. Most of those have been in California, with four in Washington.', 'The remaining 10 break down as Nevada (four); Arizona (three); Nebraska and New Jersey (two each); and Kentucky (one).', 'Salmonella outbreaks tend to be under-counted because most people recover without medical attention.', 'The CDC estimates about 1.35 million people in the United States will get salmonella each year. Of that number, 26,400 will be hospitalized, usually driven to the hospital by bloody diarrhea, and 420 will die.', 'Usually, salmonella means a few days of diarrhea, vomiting, fever and stomachaches.', 'The Mayo Clinic notes that salmonella symptoms include:', 'If you have any of the recalled eggs listed above, return them to the store for a refund or throw them deep into the garbage. If you have any questions about the recalls, call August Farms at 800-710-2554, 9 a.m. to 5 p.m. daily, Pacific time.', '', 'Part of the McClatchy Media Network', '']",Business,https://news.google.com/api/attachments/CC8iK0NnNWtVR1Z2Vm5odFdtUjBhWGswVFJDZkF4amlCU2dLTWdhQkFZZ3ZPUVU=-w280-h168-p-df
