Title,Link,Paragraphs,Topic,Image
"RBI policy brings cheer for Indian stocks: Nifty Bank soars over 800 points, realty skyrockets",https://www.tribuneindia.com/news/business/rbi-policy-brings-cheer-for-indian-stocks-nifty-bank-soars-over-800-points-realty-skyrockets/,"['New Delhi [India], June 6 (ANI): The Indian stock indices ended on a strong note and surged after the larger-than-expected policy rate cut, reflecting elevated optimism among the market participants on the last trading day of the week.', '', 'At the end of the trading on Friday, the BSE Sensex was at 82,188.99, up 746.95 points or 0.92 per cent, and the Nifty 50 was up 252.15 points or 1.02 per cent.', ""The market analysts say that the RBI's decision to cut the repo rate exceeds expectations and gives a strong message to the markets that the apex bank is willing to move aggressively when macroeconomic conditions allow."", '', 'Following the MPC outcome announcements, Nifty Bank hit a new high, and the Central Bank was surprised with a larger-than-expected policy rate cut of 50 basis points, taking the repo rate to 5.5 per cent. The Nifty Bank ended at 56,578.40, climbing over 817 points.', '""This big rate cut will impact the margins of the banks and, therefore, bank stocks will be under pressure in the near term. However, the credit growth that this rate cut will hopefully stimulate will compensate for the dip in margins,"" said VK Vijayakumar, Chief Investment Strategist, Geojit Investments Limited.', '', '""The Indian stock market responded optimistically to RBI\'s surprise and aggressive growth push policy,"" Vijayakumar further added.', 'CS Setty, Chairman at State Bank of India & Chairman at IBA said, ""RBI today\'s monetary policy communication was action-packed - innovative, out of the box and an unanticipated surprise.""', '""The policy is definitely positive for all sectors of the economy, particularly for banking and finance. In particular, lower cost of borrowing will act as a counterbalance to any uncertainty,"" he added.', 'The investors also reacted strongly to the Realty, which rose over 4 per cent.', 'Reacting to the rate cut announcement, Mayank Jain, CEO, KREEVA, a real estate developer, said, ""The reduced borrowing cost will not only strengthen homebuyers\' sentiments but also help in easing the liquidity flow in the market.', '""In light of significant market volatility and real estate witnessing a surge in the investment flow, this proactive approach signals the central bank\'s strong commitment to thrust economic momentum and boost investor confidence,"" Jain added.', 'Except for Media, which was one per cent down on Friday, all other sectoral indices ended higher with metal, auto, and consumer durables jumping over one per cent each. (ANI)', '(The story has come from a syndicated feed and has not been edited by the Tribune Staff.)', '', '', 'The Tribune, Now Published From Chandigarh, Started Publication On February 2, 1881, In Lahore (Now In Pakistan). It Was Started By Sardar Dyal Singh Majithia, A Public-Spirited Philanthropist, And Is Run By A Trust Comprising Five Eminent Persons As Trustees.\n\nThe Tribune, The Largest Selling English Daily In North India, Publishes News And Views Without Any Bias Or Prejudice Of Any Kind. Restraint And Moderation, Rather Than Agitational Language And Partisanship, Are The Hallmarks Of The Newspaper. It Is An Independent Newspaper In The Real Sense Of The Term.\n\nThe Tribune Has Two Sister Publications, Punjabi Tribune (In Punjabi) And Dainik Tribune (In Hindi).', 'Remembering Sardar Dyal Singh Majithia']",Business,https://news.google.com/api/attachments/CC8iK0NnNXVSak0yWkhaSWRUVmhRbnBhVFJEVEF4aVFCU2dLTWdhMUZJYVBFUXM=-w280-h168-p-df
"Real estate sector will witness a boom with RBI’s move on lending rates, says CREDAI State vice president",https://www.thehindu.com/news/national/andhra-pradesh/real-estate-sector-will-witness-a-boom-with-rbis-move-on-lending-rates-says-credai-state-vice-president/article69664955.ece,"['', '', '', '', '', '', '', '', '', '', 'Published - June 06, 2025 06:26 pm IST - VIZIANAGARAM', 'Confederation of Real Estate Developers Association of India (CREDAI) State vice president K. Subhash Chandra Bose on Friday said that the construction industry would witness a boom in the State, including Amaravati region and North Andhra districts, as the banks are expected to reduce home loans.', 'Mr. Bose’s remarks come in the wake of the Reserve Bank of India (RBI) reducing 50 basis points on lending rates. Speaking to media here, he said that RBI’s support to banks would immensely benefit the real estate sector which had been facing challenges in the last few years.', '', '', '', '', 'Copyright© 2025, THG PUBLISHING PVT LTD. or its affiliated companies. All rights reserved.', 'BACK TO TOP', '', '', '']",Business,https://news.google.com/api/attachments/CC8iK0NnNXVSak0yWkhaSWRUVmhRbnBhVFJEVEF4aVFCU2dLTWdhMUZJYVBFUXM=-w280-h168-p-df
A jumbo cut and all accoutrements to meet growth aspirations,https://www.moneycontrol.com/news/opinion/a-jumbo-cut-and-all-accoutrements-to-meet-growth-aspirations-13102911.html,"['', '', '', '', '', '', '', '', 'By Rajni Thakur ', 'We started this morning with a discussion on how predictable monetary policy has become in current times and were soon reminded of the might of a Central Bank in guiding policy discourse. RBI, with its big, bold decisions today, has elevated policy deliberations towards conditions required for the aspirational growth path of the Indian economy despite prevailing global uncertainties.', 'The Governor Sanjay Malhotra highlighted the strength, stability, and opportunity that the Indian economy presents in what can best be described as a chaotic global backdrop.  He not only emphasized on strong balance sheets of all major economic agents- corporates, banks, households, government, and the external sector, but also underlined stability on all fronts– price, financial, and political- as key strengths of the economy in form of policy and economic certainty.', 'With a surprise jumbo-sized rate cut of 50 basis points (bps) along with the lowering of CRR by 100 bps, MPC has front-loaded monetary policy support to stimulate domestic demand and growth. This also marks reduction of policy repo rate by a cumulative 100 bps in quick succession since February 2025.', '', '', '', '', '', '', '', 'Discover the latest Business News, Budget 2025 News, Sensex, and Nifty updates. Obtain Personal Finance insights, tax queries, and expert opinions on Moneycontrol or download the Moneycontrol App to stay updated!', 'Sensex Today RBI MPC Meeting Live Elon Musk Covid Cases In India Stampede At Chinna Swamy Stadium Bangalore Stampede Shashi Tharoor Ram Darbar Pran Pratishtha', 'Business Markets Stocks India News City News Economy Mutual Funds Personal Finance IPO News Startups', 'Home Currencies Commodities Pre-Market IPO Global Market Bonds', 'Home Loans Up To 50 Lakhs Credit Cards Lifetime Free Finance TrackerNEW Fixed Deposits Fixed Deposit Comparison Fixed Income', 'Home MC 30 Top Ranked Funds ETFs Mutual Fund Screener', 'Income Tax Calculator EMI Calculator Retirement Planning Gratuity Calculator', 'Stock Markets', 'News18 Firstpost CNBC TV18 News18 Hindi Cricketnext Overdrive Topper Learning', 'About Us Contact Us Advisory Alert Advertise With Us SupportDisclaimer Privacy Policy Cookie Policy Terms & Conditions Financial Terms (Glossary) Sitemap', 'Copyright © Network18 Media & Investments Limited. All rights reserved. Reproduction of news articles, photos, videos or any other content in whole or in part in any form or medium without express written permission of moneycontrol.com is prohibited.', '']",Business,https://news.google.com/api/attachments/CC8iK0NnNXVSak0yWkhaSWRUVmhRbnBhVFJEVEF4aVFCU2dLTWdhMUZJYVBFUXM=-w280-h168-p-df
India central bank delivers sharp rate cut as growth and inflation fall,https://www.bbc.com/news/articles/c62vdq6g945o,"[""India's central bank has lowered interest rates by a deeper-than-expected half a percent - the third cut in a row amid falling inflation and lower growth in Asia's third largest economy."", 'It also increased the amount of liquidity - or supply of money - available in the system.', 'The repo rate - the level at which the central bank lends money to commercial banks, influencing borrowing costs for home and car loans - now stands at 5.5%, the lowest in three years.', 'Explaining the rationale for the cut, RBI governor Sanjay Malhotra said growth is ""lower than our aspirations"" and the bank felt it was ""imperative to stimulate domestic consumption and investment"" amid rising global uncertainties.', 'The rate cut comes on the back of two previous reductions in April and February.', ""Data released last week showed that India's economy grew by 6.5% in the previous financial year ending March."", ""The country remains the world's fastest expanding major economy, although growth has sharply dropped from the 9.2% high recorded in financial year 2023-24."", ""Meanwhile, retail prices in India have slowed faster than expected to 3.16% in April - the lowest in six years - and below the RBI's 4% target, driven down by falling food prices."", 'RBI has now forecast lower inflation than earlier projected for the year ahead.', 'But the central bank has changed its monetary policy stance from ""accommodative"" to ""neutral"", indicating that further rate cuts will depend on how India\'s growth-inflation dynamic evolves.', ""However, fuller granaries due to a better-than-expected monsoon, weaker prices of commodities like oil - of which India is a net importer - as well as a strong currency are likely to help keep India's inflation in check in the months ahead, allowing the RBI to keep rates low."", 'Lower borrowing costs could have a positive growth impact due to improved purchasing power for households, lower input costs for companies and lower debt servicing costs for the government.', 'They will also help homebuyers and a struggling real estate sector.', '""This effectively lowers the cost of borrowing, making home loan EMIs [mortgage payments] easier on the pocket and thereby directly improving affordability for buyers. This can potentially boost demand in the Indian real estate sector, especially in affordable and mid-income segments. Affordable housing faced the sharpest pandemic fallout, with sales and new launches shrinking in the top 7 cities,"" Anuj Puri, chairman of ANAROCK Group, said.', 'Indian markets rallied sharply post the rate cut announcement.', 'Relations had deteriorated after accusations India was behind the murder of a Sikh activist in Canada.', ""Priya Rastogi and her family depend on her late husband's work visa which expires in August."", 'The bridge will connect the valley region of Indian-administered Kashmir with the rest of the country by train.', 'Personnel from the cricket league - Royal Challengers Bengaluru - are among the four arrested.', ""Trump's proposed 3.5% tax on remittances by foreign workers could seriously impact top recipient India."", 'Copyright 2025 BBC. All rights reserved.  The BBC is not responsible for the content of external sites. Read about our approach to external linking.', ' ', '']",Business,https://news.google.com/api/attachments/CC8iK0NnNXVSak0yWkhaSWRUVmhRbnBhVFJEVEF4aVFCU2dLTWdhMUZJYVBFUXM=-w280-h168-p-df
"RBI's rate cut will boost mid-segment housing affordability in top cities, say real estate executives",https://www.lokmattimes.com/business/rbis-rate-cut-will-boost-mid-segment-housing-affordability-in-top-cities-say-real-estate-executives/,"['', 'Marathi | Hindi', 'FOLLOW US :', '', '', 'By ANI | Updated: June 6, 2025 12:23 IST', 'New Delhi [India], June 6 : The decision of the Reserve Bank of India (RBI) to reduce the policy repo rate will significantly help mid-segment housing across top-tier cities, translating into lower EMIs (Equated Monthly Installment) and better affordability, said real estate executives, terming it a ""strategic move"".', 'The policy rates massively impact the sale of the real estate infrastructure, as lowering of rates means lower interest rates from banks for the home buyers and cheaper EMIs.', 'The policy rate cuts have a massive impact on the real estate sector. This effectively lowers the cost of borrowing, making home loan EMIs easier on the pocket and thereby directly improving affordability for buyers.', ""RBI's MPC, after the meeting today, decided to reduce the policy repo rate under the Liquidity Adjustment Facility by 50 basis points to 5.5 per cent."", 'This larger-than-expected cut in the repo rate was accompanied by a 100 bps cut in the Cash Reserve Ratio (CRR), now reduced to 3 per cent, aimed at enhancing liquidity by Rs 2.5 lakh crore.', '""The cumulative 100 basis point reduction over the last six months is a welcome and strategic move. We are particularly optimistic about its impact on the affordable housing sector, which has been under pressure on both the demand and supply sides. Lower interest rates will increase homebuyer affordability and improve the financial viability of affordable housing projects,"" said Shekhar G Patel, President of the real estate industry body CREDAI.', '""Not only will it make homeownership affordable and boost buyers\' sentiments but it will also add new vigour to the economy, which in turn will augur well for both residential and commercial realty,"" said Manoj Gaur, CMD, Gaurs Group.', 'Anshul Jain, Chief Executive, India, SEA & APAC Tenant Representation, Cushman & Wakefield, in his analysis, said that RBI has today delivered a boost to consumer/household sentiment with a 50 bps cut, seen as positive for the real estate sector, particularly housing.', '""With this, the cumulative cut for this year of 1 per cent is indeed going to help translate into lower EMIs and relatively better affordability, thereby helping the mid-segment housing across top-tier cities,"" Jain added.', 'Anuj Puri, Chairman of ANAROCK Group, shared similar views and added, ""This can potentially boost demand in the Indian real estate sector, especially in affordable and mid-income segments.""', 'Commenting on the impact of the decision on the luxury segment, Pradeep Aggarwal, Founder & Chairman, Signature Global (India) Ltd, said, ""The demand for mid- and premium-segment homes has already been on the rise following previous rate cuts, and this larger reduction will further accelerate interest from both homebuyers and investors.""', '""This move could spur refinancing activity and strengthen investment interest in branded properties known for their attractive returns, particularly among Grade A developers,"" said Niranjan Hiranandani, Chairman, NAREDCO & Hiranandani Group.', 'Umang Jindal, CEO at Homeland Group, said, ""More than numbers, it also paints a picture of a growing economy and a confident future.""', ""Real estate sector has an important role to play. As per the government data, the real estate sector contributed around 7 per cent to India's GDP in 2018-19 and its share is expected to grow to around 13 per cent of India's GDP in 2025."", 'Disclaimer: This post has been auto-published from an agency feed without any modifications to the text and has not been reviewed by an editor', 'FOLLOW US :', '', 'Copyright ©2025 Lokmat Media Pvt Ltd']",Business,https://news.google.com/api/attachments/CC8iK0NnNXVSak0yWkhaSWRUVmhRbnBhVFJEVEF4aVFCU2dLTWdhMUZJYVBFUXM=-w280-h168-p-df
Indian equity markets ride the RBI rate cut tide to recoup losses,https://www.wionews.com/business-economy/sensex-and-nifty-ride-the-rbi-rate-cut-tide-to-recoup-losses-1749211190409,"['The aggressive policy easing reversed two weeks of negative sentiment, sparking a strong rally across sectors. The Nifty surged past the 25,000 mark.', 'Indian equity markets ended the week on a high note, propelled by the Reserve Bank of India’s (RBI) unexpected move to slash the repo rate by 50 basis points (bps) and the cash reserve ratio (CRR) by 100 bps.', 'The aggressive policy easing reversed two weeks of negative sentiment, sparking a strong rally across sectors. The Nifty surged past the 25,000 mark closing at 25,003.05 after rising 252.15 points, or 1.02 per cent. While the Sensex gained 746.95 points, or 0.92 per cent, to close at 82,188.99, marking one of the strongest weekly performances in recent times.', 'The RBI’s policy, coupled with a shift in stance from ‘accommodative’ to ‘neutral’, signalled a decisive pro-growth pivot, igniting optimism among investors.', 'The Nifty Realty index surged 4.68 per cent, emerging as the top-performing sector, as hopes of a housing demand revival gained momentum. Financials followed closely, with the Nifty Bank and Financial Services indices climbing 1.5 per cent and 1.75 per cent, respectively, driven by gains in top lenders and NBFCs. Auto stocks also rallied, contributing to the upbeat sentiment.', 'Market heavyweights HDFC Bank and Bajaj Finance were among the biggest individual contributors to the Nifty’s rally, adding 48 and 25 points, respectively. Axis Bank, M&M, and Shriram Finance also featured prominently among the top gainers.', 'Meanwhile, the broader markets outperformed, with the Nifty Midcap index rising 3 per cent for the week and 1.2 per cent on June 6 alone. The Nifty Smallcap index added 0.8 per cent.', 'The RBI’s dovish stance had an immediate impact on investor wealth. The market capitalisation of BSE-listed companies jumped by ₹3.6 lakh crore (nearly $42 billion) in Friday’s session alone, pushing total market cap to ₹451.1 lakh crore (almost $5,262 billion).', 'The advance-decline ratio remained robust at 3:2, signalling widespread investor participation. In total, 46 out of the 50 Nifty stocks posted gains during the week, with some surging over 10 per cent.', 'Notably, gold loan financiers like Muthoot Finance saw strong buying interest as the RBI hinted at easing norms for unsecured loans, further lifting sector sentiment.', 'Despite the week’s strong gains, analysts maintain a cautious optimism. The Nifty, while still in a consolidation phase, is now eyeing a breakout above the 25,200 level. A decisive move beyond this could pave the way for a fresh rally towards 25,600. Technical indicators remain supportive, particularly with the Nifty Bank index touching a new 52-week high of 56,584.', 'Volatility also declined, with the India VIX falling over 2 per cent, indicating cooling risk perception. Meanwhile, the RBI’s decision to lower the CPI inflation forecast for FY26 to 3.7 per cent further strengthened the case for an extended easing cycle.', 'Looking ahead, rate-sensitive sectors like financials, realty, and auto are expected to stay in focus. Themes like infrastructure and railways could also benefit from the evolving pro-growth environment.', '']",Business,https://news.google.com/api/attachments/CC8iK0NnNXVSak0yWkhaSWRUVmhRbnBhVFJEVEF4aVFCU2dLTWdhMUZJYVBFUXM=-w280-h168-p-df
"Steepest rate cut in 5 years boosts rupee, ends higher at 85.62",https://www.onmanorama.com/news/business/2025/06/06/rbi-rate-cut-boosts-rupeeon-friday.html,"['', 'FRIDAY, JUN 6, 2025', '', '', 'Reuters', 'PUBLISHED: JUNE 06 , 2025 04:19 PM IST', '1 MINUTE READ', '', ""Mumbai: Rupee strengthened modestly on Friday as the Reserve Bank of India's (RBI) steepest rate cut in five years boosted local equities, helping the currency eke out a gain even as the dollar firmed against major peers."", 'The rupee closed at 85.6250 against the dollar, up from 85.79 in the previous session. However, it declined 0.2 per cent for the week.', 'RBI cut its key repo rate by 50 basis points on Friday and slashed the cash reserve ratio (CRR) for banks, as low inflation allowed policymakers to focus on supporting growth.', ""India's benchmark equity indexes, the BSE Sensex and Nifty 50, rose about 1 per cent each on Friday, posting their best one-day gain in two weeks as the rate cut fuelled domestic growth expectations."", ""India's benchmark 10-year bond whipsawed between gains and losses as traders digested the central bank's policy moves, including a shift in stance from 'accommodative' to 'neutral.'"", 'The yield on the benchmark paper was last quoted a tad higher at 6.2237 per cent  Meanwhile, dollar-rupee forward premiums fell in reaction to the rate cut with the one-year implied yield dropping 10 basis points to 1.81 per cent.', 'The Indian central bank\'s ""larger-than-expected 50 bps rate cut and 100 bps cut in the cash reserve ratio should support INR,"" DBS said in a Friday note.', '""We will consider lowering USD/INR’s forecast if the US Federal Reserve pivots towards a rate cut later this year and sets the stage for more US dollar weakness,"" the noted added.', ""On the day, the dollar index was up 0.3 per cent at 98.9 in the run-up to the release of closely watched US non-farm payrolls data, which will offer cues on how the world's largest economy is faring in the face of trade policy-sparked uncertainty."", '© Copyright 2025 Onmanorama. All rights reserved.', '', '', '']",Business,https://news.google.com/api/attachments/CC8iK0NnNXVSak0yWkhaSWRUVmhRbnBhVFJEVEF4aVFCU2dLTWdhMUZJYVBFUXM=-w280-h168-p-df
Nifty Bank hits record high after RBI rate cuts; Banking & financial stocks rally,https://www.businesstoday.in/markets/stocks/story/nifty-bank-hits-record-high-after-rbi-rate-cuts-banking-financial-stocks-rally-479278-2025-06-06,"['', '', '', '', '', 'The Nifty Bank index was seen hitting a new record high during the trading session on Friday, after the Reserve Bank of India (RBI) announced its monetary policy, cutting the interest rates by 50 basis points (bps), beating the major consensus of 25 basis points rate cut. This led to a sharp rally in the rate sensitive financial stocks including banks and shadow lenders.', 'The Nifty Bank index soared 1.39 per cent to hit 56,535.85 during the session. Among the index constituents, IDFC First Bank led the gainers, rising 5 per cent to Rs 70.10. It was followed by Axis Bank and Punjab National Bank, which rose 3 per cent each to Rs 1,193.70 and Rs 111.80, respectively. Canara Bank was the sole loser in the Nifty Bank index.', 'The higher-than-expected 50 bps rate cut decision by the MPC, though positive for growth, is slightly negative from the market perspective for the near-term, said Dr VK Vijayakumar, Chief Investment Strategist at Geojit Investments.', 'This big rate cut will impact the margins of the banks and, therefore, bank stocks will be under pressure in the near-term. However, the credit growth that this rate cut will hopefully stimulate will compensate for the dip in margins,"" he said.', 'The Nifty Private Bank index outperformed the Nifty PSU bank index. The former one increased 1.35 per cent, while the latter one was up 0.75 per cent after the policy. Nifty Financial Services index was up 1.35 per cent. However, state-run lenders were trading mixed. Bank of Baroda was up 2 per cent and SBI rose a per cent. Indian Overseas Bank was down 3 per cent, while UCO Bank and Central Bank were down 2 per cent each.', 'A 25 bps rate cut was already priced in by the markets, a 50 bps cut comes as a surprise. The unanimous decision is along expected lines, but the magnitude of the cut is significant, said Divam Sharma, Founder & Fund Manager at Green Portfolio PMS. ""We like niche domestic manufacturing companies that are building in India and gearing up to compete on a global scale.""', 'All the private bank indices were trading in green. Bandhan Bank rose 2 per cent, following Axis Bank and IDFC First Bank. RBL Bank, Federal Bank, Kotak Mahindra Bank, IndusInd Bank and HDFC Bank gained one per cent each. YES Bank and ICICI Bank were also up one-third per cent higher.', 'In the financial services index, HDFC AMC gained nearly 5 per cent, while Bajaj Finance rose 4 per cent. Shriram Finance and SBI Cards were up 3 per cent each. Chola Finance, ICICI Lombard GIC and REC gained up to 2 per cent each. However, HDFC Life Insurance Company was the sole stock trading in red in the index.', 'The cumulative 100 basis point rate cut since February underscores the RBI’s urgency to support demand, while the shift to a neutral stance signals a more cautious, data-driven approach to balancing growth and inflation risks going forward, said Anil Rego Founder & Fund Manager at Right Horizons PMS.', '', 'Copyright © 2025 Living Media India Limited. For reprint rights: Syndications Today. India Today Group.', '', '', '', '', '', '', '', '', '', '']",Business,https://news.google.com/api/attachments/CC8iK0NnNXVSak0yWkhaSWRUVmhRbnBhVFJEVEF4aVFCU2dLTWdhMUZJYVBFUXM=-w280-h168-p-df
