Title,Link,Paragraphs,Topic,Image
It’s Time to Kill Siri,https://www.wired.com/story/its-time-to-kill-siri/,"[""IF YOU'VE HAD a passing interest in Apple over the past year, you've likely heard of the company's struggles in the AI race. Apple Intelligence, which arrived slightly late after the launch of the iPhone 16, fell short of expectations, and Apple has yet to deliver the much-improved Siri it promised at WWDC 2024. Siri got a new look and an integration with ChatGPT, but its ability to understand your personal context via emails, messages, notes, and calendar was “indefinitely” delayed earlier this year as Apple is reportedly facing several challenges."", 'Even if Apple were to deliver a better Siri, would people use it? Despite arriving first, Siri has long been derided by iPhone owners, often the butt of a joke, as Google Assistant and Alexa rose to the top. But if Apple wants its customers to take the supposed improvements coming to the voice assistant seriously, it should consider taking a page from Google and killing it off for something new.', ""Google has no problem with pulling the plug when things aren't working or priorities change. In fact, the search giant has a history of killing so many of its services that there’s a website dedicated to tracking all the gravestones. One of its most recent terminations? Google Assistant."", 'Nearly 10 years since its debut, Google Assistant is in the process of being phased out from every ecosystem it was a part of. Wear OS smartwatches? It’s being replaced soon. Android Auto? In the coming months. It’s already no longer the default assistant on Android phones. By 2026, it’s unlikely we’ll see the branding anywhere anymore. So ends the reign of arguably the most effective voice assistant of its time, gone without a care in the world.', 'But Google’s decision to kill it, instead of keeping the Google Assistant name, may have been smart. “It’s primarily branding,” says Chris Harrison, who directs the Future Interfaces Group at Carnegie Mellon’s Human-Computer Interaction Institute. “But it underlines a technology reason, which is that the previous generation of these assistants really weren’t very much like assistants. Asking for the weather and setting a timer—not very sophisticated. You wouldn’t really ask a personal assistant for those mundane tasks.”', ""Gemini is completely different. It can rummage through your emails to find the location of your kid's soccer match, parse through large documents, and when paired with a camera-enabled device, can understand what you're seeing and offer help. Its capabilities are vastly superior to what Google Assistant could do. Apple's goal is to achieve similar results in a more privacy-friendly way—so that when you have Siri connect to ChatGPT, your data is not passed off to OpenAI."", '“Apple thought Siri\'s capabilities would grow, but that didn\'t really materialize; Siri kind of atrophied out of the gate,"" Harrison says. “Now, we\'re in this new generation of things that are really much more like assistants—they can do reasoning, personalization.” But while Google Assistant and Gemini both have voice interfaces and at a first glance may share a similar look, they\'re two different applications. “Simply renaming it Google Assistant 2.0 would not spur people to use it in a fundamentally different way.” It seems that switch to Gemini has been key to moving customer understanding along.', ""However, it's fair to say that Apple and even Amazon's Alexa have had a cultural cachet that Google Assistant never enjoyed. It wasn't unusual to hear Siri or Alexa's name in a movie or TV show; they were much more recognizable than Google's generic-named voice assistant. This may be why Amazon decided to keep the Alexa branding and simply add a “+” icon to denote the new souped-up version of Alexa powered by the latest large language models—and perhaps why Apple is still hanging onto Siri."", ""This might have all been OK if Apple actually delivered on its promise and released a functioning, much-improved Siri when it originally said it would. With a massive marketing push to put Apple Intelligence in everyone's mind (maybe a regretful move), it would have been a great opportunity to wow users with a much-improved Siri. Months later, customers are left wondering why Siri—new look and all—still lags behind."", ""But the broader problem affecting all large language models isn't just the branding, but the user interface. Harrison compares it to the days of command-line computing and the shift to the graphical user interface (GUI) in the ’80s and ’90s. It wasn't the graphics that made the latter more popular, but the discoverability and explorable interface. In the command-line era, you had to remember how to do anything. With GUI, you could put anyone in front of a computer, and they'd be able to figure out how to navigate the operating system."", 'If you put someone in front of ChatGPT or Gemini, say it\'s an incredible tool, and tell them to ask it anything, they\'ll just stare blankly at the blinking prompt. “It\'s like we\'ve gone back 30 years in interface design. They have no idea what to do or say."" Harrison says he did this exact experiment with his parents: They asked what the weather was tomorrow, and the AI responded that it didn\'t have that information.', '“We\'ve regressed in discoverability,"" he says. “A regular person, not the tech people, if all they\'ve been doing is setting timers with Siri for the past 10 years, and now they have to think about it in a fundamentally different way—that\'s an extremely hard problem. Some sort of renaming of the application is going to be important.""', ""Saying goodbye to Siri would be a big move for Apple—after all, it has spent more that a decade investing in it. But most people today still use it for playing music, checking weather, and setting timers, and aren't even pushing the boundaries of its current, relatively limited, capabilities. It's hard to see that changing anytime soon, even if Siri's feature-packed next generation arrives as promised."", '“For 99 percent of the planet, this kind of AI revolution has totally gone over their head,” Harrison says. Like the 10-year transition from command line to graphical user interfaces, rethinking the way we use these personal voice assistants will take time and education, but maybe a new name will help Apple with the transition.', 'Join the WIRED community to add comments.', 'BJARTE', '20 hours ago', '""Gemini is completely different. It can rummage through your emails to find the location of your kid\'s soccer match, parse through large documents, and when paired with a camera-enabled device, can understand what you\'re seeing and offer help. Its capabilities are vastly superior to what Google Assistant could do.""\n\nIt\'s also NOT able to do even the simple tasks Assistant does reliably, like creating reminders, call someone or start navigation in Google Maps, which I use all the time.\n\nI turned Gemini off pretty quickly when I got it on my phone. Sad to hear Assistant is disappearing soon.', '3', 'Reply', ""In your inbox: Will Knight's AI Lab explores advances in AI"", 'The Trump tariffs are how everything works now', 'Big Story: If Anthropic succeeds, a nation of benevolent AI geniuses could be born', 'Scientists claim to have brought back the dire wolf', 'Special Edition: The most dangerous hackers you’ve never heard of', 'MORE FROM WIRED', 'REVIEWS AND GUIDES', '© 2025 Condé Nast. All rights reserved. WIRED may earn a portion of sales from products that are purchased through our site as part of our Affiliate Partnerships with retailers. The material on this site may not be reproduced, distributed, transmitted, cached or otherwise used, except with the prior written permission of Condé Nast. Ad Choices']",Technology,https://news.google.com/api/attachments/CC8iK0NnNWhabkpqZFdsdlR6aDZWblJsVFJEUUF4aVZCU2dLTWdZbE5KYU9uUWc=-w280-h168-p-df
"Ahead of WWDC 2025, former Apple employees reveal why LLM Siri is still not ready",https://www.indiatoday.in/technology/news/story/ahead-of-wwdc-2025-former-apple-employees-reveal-why-llm-siri-is-still-not-ready-2738009-2025-06-09,"['Listen to Story', ""Just hours before Apple's WWDC 2025 event, fresh information from former Apple employees has come to light, offering some clarity on why the company’s new AI-based Siri is still not ready for launch. While Apple is reportedly working on a major upgrade to its voice assistant using large language models (LLMs), insiders say the project has been tougher than expected."", 'According to a report from Financial Times, the company has been trying to build these LLM features on top of the existing Siri system, which already works on millions of devices worldwide. But this approach has brought several issues. According to ex-employees, combining old machine learning code with newer AI models has caused frequent bugs and slowed down development. On the other hand, companies like OpenAI, which started from scratch with their voice assistants, have avoided such problems and moved ahead faster.', 'One former Apple employee said that it was clear from the beginning that just adding new layers to Siri would not be enough. Inside Apple, some leaders had described the plan as “climbing the hill,” meaning they wanted to slowly improve Siri instead of completely rebuilding it. However, the results have reportedly been disappointing. “It’s clear they stumbled,” the person said, highlighting the gap between expectations and reality.', '', 'As of now, there is no confirmation on when the new version of Siri will be released. While there are chances that Apple may talk about it during WWDC 2025, reports suggest the final rollout could take until 2027. That is still a long way off, especially at a time when rivals are already offering more advanced conversational assistants.', 'Even though Apple is known for waiting until its products are polished, the delay in Siri’s upgrade raises questions about whether the company is falling behind in the AI race. For now, fans and developers might get a preview of what is coming, but they should not expect the new Siri to be available anytime soon.', 'The latest Apple WWDC 2025 event will start tonight at 10:30PM and it is expected to showcase updates to Apple’s operating systems — iOS 26, iPadOS 26, macOS 26, visionOS 26, watchOS 26, and tvOS 26. A fresh design across platforms and improvements in Apple’s AI tools are expected to take the spotlight, according to several reports. You can stay tuned to India Today Tech for all the updates.', '']",Technology,https://news.google.com/api/attachments/CC8iK0NnNWhabkpqZFdsdlR6aDZWblJsVFJEUUF4aVZCU2dLTWdZbE5KYU9uUWc=-w280-h168-p-df
"Apple Isn't Even at the AI Party, Ross Gerber Says",https://www.marketscreener.com/quote/stock/APPLE-INC-4849/news/Apple-Isn-t-Even-at-the-AI-Party-Ross-Gerber-Says-50194732/,"['', '', '', '', '', '', '', '', 'Published on 06/09/2025 at 17:23', '', 'Bloomberg videos, provided by MT Newswires', ""Apple Isn't Even at the AI Party, Ross Gerber Says"", 'June 09, 2025 at 05:23 pm EDT', 'Can Apple still surprise us?', 'Trump threatens Apple with a 25% tax on iPhones that are not made in the US', 'Best financial\nportal', '+951% of historical\nperformance', '', '+ 1,000,000\nmembers', 'Quick & easy\ncancellation', 'Our Experts\nare here for you', 'OUR EXPERTS ARE HERE FOR YOU', 'Monday - Friday 9am-12pm / 2pm-6pm GMT + 1', '', '', '', '', '', '']",Technology,https://news.google.com/api/attachments/CC8iK0NnNWhabkpqZFdsdlR6aDZWblJsVFJEUUF4aVZCU2dLTWdZbE5KYU9uUWc=-w280-h168-p-df
Apple's Siri Could Be More Like ChatGPT. But Is That What You Want?,https://www.cnet.com/tech/mobile/apples-siri-could-be-more-like-chatgpt-but-is-that-what-you-want/,"[""Commentary: Should Siri evolve to become more of a manager than an assistant? Let's hope Apple can listen to what people want from its voice assistant."", 'This is a modal window.', '', '', '', '', ""I've noticed a vibe shift in the appetite for AI on our devices. My social feeds are flooded with disgust over what's being created by Google's AI video generator tool, Veo 3. The unsettling realistic video of fake people and voices it creates makes it clear we will have a hard time telling apart fiction from reality. In other words, the AI slop is looking less sloppy."", 'Meanwhile, the CEO of Anthropic is warning people that AI will wipe out half of all entry-level white-collar jobs. In an interview with Axios, Dario Amodei is suggesting government needs to step in to protect us from a mass elimination of jobs that can happen very rapidly. ', ""So as we gear up for Apple's big WWDC presentation on Monday, I have a different view of headlines highlighting Apple being behind in the AI race. I wonder, what exactly is the flavor of AI that people want or need right now? And will it really matter if Apple keeps waiting longer to push out it's long promised (and long delayed) personalized Siri when people are not feeling optimistic about AI's impact on our society?"", ""In this week's episode of One More Thing, which you can watch embedded above, I go over some of the recent reporting from Bloomberg that discusses leadership changes on the Siri team, and how there are different views in what consumers want out of Siri. Should Apple approach AI in a way to make Siri into a home-grown chatbot, or just make it a better interface for controlling devices? (Maybe a bit of both.)"", ""I expect a lot of griping after WWDC about the state of Siri and Apple's AI, with comparisons to other products like ChatGPT. But I hope we can use those gripes to voice what we really want in the next path for the assistant, by sharing our thoughts and speaking with our wallet. Do you want a Siri that's better at understanding context, or one that goes further and makes decisions for you? It's a question I'll be dwelling on more as Apple gives us the next peak into the future of iOS on Monday, and perhaps a glimpse of how the next Siri is shaping up."", ""If you're looking for more One More Thing, subscribe to our YouTube page to catch Bridget Carey breaking down the latest Apple news and issues every Friday.""]",Technology,https://news.google.com/api/attachments/CC8iK0NnNWhabkpqZFdsdlR6aDZWblJsVFJEUUF4aVZCU2dLTWdZbE5KYU9uUWc=-w280-h168-p-df
Apple unveils a new look but the wait for AI Siri continues,https://www.brisbanetimes.com.au/technology/apple-unveils-software-visual-redesign-but-no-revamped-siri-20250610-p5m63k.html,"['', '', 'Cupertino, California: Apple has made a number of announcements at its annual worldwide developer conference (WWDC) overnight, including a visual overhaul of its software, and changes to the iPad that make it more like a Mac. But major expected updates to its AI platform and voice assistant did not show up.', 'The iPhone-maker has been under pressure to deliver since its Apple Intelligence suite was unveiled at last year’s WWDC, but was perceived as underdeveloped and the promised updates have failed to eventuate. Key among them are plans to evolve the Siri voice assistant into a smarter and more capable agent that understands context, akin to ChatGPT.', 'Apple’s software updates for later this year have a new ‘liquid glass’ visual design.', '“As we’ve shared, we’re continuing our work to deliver the features that make Siri even more personal,” said Craig Federighi, Apple’s senior vice president of software engineering, on stage at WWDC.', '“This work needed more time to reach a high-quality bar, and we look forward to sharing more about it in the coming year.”', 'Industry watchers also anticipated an announcement that Google’s Gemini would join OpenAI’s ChatGPT as a service that could be leveraged through Apple Intelligence, but that didn’t eventuate. Instead, Apple’s primary consumer-facing announcements were a new visual language for all of its operating systems, and updates for the iPad that will let apps move around like windows.', 'Apple chief Tim Cook (left) and Craig Federighi, senior vice president of software engineering, on stage at WWDC, at Apple Park in Cupertino, California.\nCREDIT:\nBLOOMBERG', 'From the developers in attendance, the largest applause was for the announcement that Apple would be opening up access to the large language model that powers Apple Intelligence. That means any app can make use of the iPhone’s on-device AI to build on things like image recognition and creation, language translation or text summarisation.', '“We think this will ignite a whole new wave of intelligent experiences in the apps that you use every day,” Federighi said.', '“We couldn’t be more excited about how developers can build on Apple Intelligence to bring you new experiences that are smart, available when you’re offline, and that protect your privacy.”', 'Wedbush Securities analyst Dan Ives called the presentation a yawner.', '“Cupertino is playing it safe and close to the vest after the missteps last year,” he said.', '“We have a high level of confidence Apple can get this [AI] right, but they have a tight window to figure this out, and that will be the focus of investors for the next year.', 'Many elements in the new software can be customised to be transparent.', 'Apple is changing the way it names its yearly operating system versions to make them more uniform. So the update coming to iPhone later this year will not be iOS 19, but iOS 26, and that also applies to iPadOS, tvOS, visionOS and watchOS. The new MacOS will also be version 26, but inkeeping with the tradition of naming each version after a location in California it will be called MacOS Tahoe.', 'All the operating systems have a new visual style Apple is calling Liquid Glass, designed to look like various layers of coloured or transparent glass. Elements have also become more rounded and fluid; for example, the big glass numerals on the iPhone lock screen clock change size dynamically depending on your background photo and notification content. This is the first major visual change for the iPhone in 12 years, with the current look being a refined take on the interface of iOS 7 from 2013.', 'Some iPhone apps, including Camera, Phone and Messages, are also getting pared-back redesigns.', 'The iPad interface is becoming more desktop-like.', 'Apple did announce some new AI iPhone features, which bring to mind similar options already available on some Android phones. Call Screening answers unfamiliar numbers for you and asks who is calling, showing you a text transcript so you can decide whether to answer. Hold Assist detects hold music and can silence the call, giving you a ring when a human is back on the line.', 'Visual Intelligence, which currently works through the camera to answer questions about real-world objects, will be expanded to work on screenshots. It will be able to copy text, automatically create calendar entries, search Google, ask ChatGPT and more. And new language translation features will apply across text and verbal communication on the phone.', 'For iPadOS 26, Apple introduced a sizeable change to multitasking. Any full-screen app can be resized, at which point it will gain the red, yellow and green dots familiar from MacOS that let you control it like a window. There’s even a new menu bar at the top of the display, a more PC-like mouse pointer for use with touchpads, and a revamped file system that lets you put folders in the dock and choose apps to open each file.', 'WatchOS is getting an AI-powered Workout Buddy that gives exercise insights and encouragement in real time with a human-like voice, while the biggest update to MacOS is an improved Spotlight search that can take actions, trigger shortcuts and holds a history of your clipboard.', 'On iPhone, iPad and Mac, Apple is also introducing a new Games app that will make personalised recommendations and keep score with your friends.', 'All the new software will be available to the public in a beta form next month.', 'The author travelled to California as a guest of Apple.', 'Get news and reviews on technology, gadgets and gaming in our Technology newsletter every Friday. Sign up here.', 'Copyright © 2025']",Technology,https://news.google.com/api/attachments/CC8iK0NnNWhabkpqZFdsdlR6aDZWblJsVFJEUUF4aVZCU2dLTWdZbE5KYU9uUWc=-w280-h168-p-df
