Title,Link,Paragraphs,Topic,Image
Siri's big comeback? iOS 26 could transform Apple’s AI assistant after a decade of lag,https://www.livemint.com/technology/tech-news/siris-big-comeback-ios-26-could-transform-apple-s-ai-assistant-after-a-decade-of-lag-11749470632788.html,"['After years of lagging behind in the AI assistant race, Apple’s Siri is likely to be poised for a substantial revival with the release of iOS 26 this autumn. Under a new leadership team and with a renewed focus on intelligent user support, Siri is expectedly to undergo its most significant upgrade in over a decade. The forthcoming features promise a far more intuitive, personalised, and capable digital assistant experience.', 'According to a 9To5Mac report, a cornerstone of Siri’s upcoming transformation is its deeper integration within Apple’s ecosystem. Thanks to a privacy-conscious approach to user data, Siri in iOS 26 will likely be able to deliver context-aware and highly personalised assistance.', '5% OFF', '₹54999', 'Get This', '₹15999', 'Check Details', '₹49990', 'Check Details', '13% OFF', '₹39998', 'Get This', '₹19999', 'Check Details', 'Reportedly, Apple has shared striking examples of what this might look like in practice. For instance, users could ask, “Play that podcast Jamie recommended,” and Siri will seamlessly locate and begin playback—drawing from messages or emails where the podcast was mentioned. Similarly, asking “When is Mum’s flight landing?” will prompt Siri to fetch real-time flight data by cross-referencing personal calendar entries and tracking services.', 'Such enhancements could signal a clear intention to make Siri not only smarter but also more human-like in its ability to understand and respond naturally to user needs.', 'While Siri has long been able to handle basic tasks, it has struggled to move beyond simple commands. That is set to change with iOS 26, which introduces a major expansion in the range of supported voice actions—now including multi-app capabilities.', 'This means users will likely be able to give more complex, cross-app instructions without lifting a finger. For example, one might say, “Add the photos from this morning to my Birding note,” and Siri will complete the task by working across Photos and Notes in the background.', 'Such a shift could bring Apple closer to delivering the long-promised reality of hands-free productivity, freeing users from the need to juggle apps manually for routine actions.', 'Another expected standout improvement is anticipated to be Siri’s newfound onscreen awareness. Currently, Siri offers limited interaction with onscreen content, such as setting a reminder linked to an email. However, iOS 26 could aim to take this several steps further.', 'With the new system, Siri will likely gain the ability to comprehend and act on content visible on the user’s screen across more apps. For example, if a contact shares their address via Messages, users will be able to say, “Add this address to his contact card,” and Siri will complete the action accordingly.', 'This onscreen understanding is expected to streamline many everyday tasks, reinforcing Siri’s role as a reliable digital assistant that works more intuitively within the Apple environment.', 'Catch all the Technology News and Updates on Live Mint. Download The Mint News App to get Daily & Live .', ""A viral video shows an American groom dancing energetically to the iconic ‘Dhoom Machale’ at his wedding. This naturally captured Hrithik Roshan's attention, who appreciated the groom's dance and energy."", 'Download the Mint app and read premium stories', '', '']",Technology,https://news.google.com/api/attachments/CC8iK0NnNWhabkpqZFdsdlR6aDZWblJsVFJEUUF4aVZCU2dLTWdZbE5KYU9uUWc=-w280-h168-p-df
Apple boosts AI features but leaves Siri behind for now,https://www.indailyqld.com.au/news/in-depth/2025/06/10/apple-boosts-ai-features-but-leaves-siri-behind-for-now,"['It will screen your phone calls, translate your messages, and help you work out but Apple’s artificial intelligence software is not ready to smarten up Siri.']",Technology,https://news.google.com/api/attachments/CC8iK0NnNWhabkpqZFdsdlR6aDZWblJsVFJEUUF4aVZCU2dLTWdZbE5KYU9uUWc=-w280-h168-p-df
No title found,https://www.fudzilla.com/news/ai/61166-siri-stumbles-as-apple-botches-ai-race,"['Apple Intelligence flounders while rivals eat its lunch', 'The Fruity Cargo Cult Apple is having a right old mess of it trying to make Siri less of a clueless digital butler and more like an actual AI assistant.', 'According to the Financial Times, Job’s Mob is struggling to retrofit Siri with large language models that can handle more than just setting reminders and mishearing your mum’s name. Recently exiled employees say that trying to integrate LLM into Siri has revealed shedloads of bodged coding that has been there from the start and has caused bugs galore. Unlike OpenAI, which built its assistant properly from scratch, Apple has been approaching the issue with duct tape,  wishful thinking and number eight fencing wire. ', '“It was obvious that you were not going to revamp Siri by doing what executives called ‘climbing the hill’,” said one former Apple executive, referring to the company’s hopelessly incremental approach to development. “It’s clear that they stumbled,” the person added.', 'Apple had big plans to pump its iPhones full of what it dubbed “Apple Intelligence,” a shiny suite of AI features meant to flog more overpriced gadgets. But delays and embarrassments have piled up. Its AI rollout in China, done in partnership with Alibaba, is jammed in regulatory mud. Meanwhile, consumers still haven’t seen the flagship Siri revamp actually materialise.', 'JPMorgan analyst Samik Chatterjee said that it was the time where Apple needed to put up or shut up. “We’re at the point where investors already know what the good news potentially is, and it’s about: let’s first have you deliver what you promised last year.” ', 'The cocaine nose jobs of Wall Street have not taken kindly to the faffing about. Apple stock is down 18 per cent this year, making it the worst performer in the so-called Magnificent Seven. By comparison, the Nasdaq has more or less gone nowhere.', 'When ChatGPT burst onto the scene, one former senior Apple employee said “the way companies were doing conversational interaction was changing rapidly, and it was clear Siri was coming up short.” The person admitted they were “surprised” that Job’s Mob had publicly promised features that were “not going to make it” to release which shows the level of naivety among Apple staff.', 'Job’s Mob has been telling its chums in the Tame Apple Press that Siri’s failings are because it is obsessed with privacy. Its AI features are meant to run on-device through smaller models, which sounds noble but apparently makes the tech even harder to get working properly. OpenAI and Google, by contrast, run their smarter assistants through the cloud like normal people.', 'However, Chief executive Tim Cook finally came clean, admitting the technology did not meet Apple’s “high quality bar” and was “taking a bit longer than we thought.” Which, judging by how often Siri still bungles basic commands, must be buried somewhere beneath the carpet.', 'Internal changes are now being made. Apple’s AI boss John Giannandrea, who joined from Google in 2018, has seen the Siri team shifted to Mike Rockwell, best known for that overpriced ski mask called the Vision Pro. Some insiders blame fragmented leadership and a lack of money thrown at the problem. Others just think Job’s Mob didn’t take AI seriously until it was way too late.', 'Now it’s leaning on OpenAI integration to keep Siri vaguely useful while rivals like OpenAI, Google and even Perplexity launch assistants that actually know what they’re doing. Adding insult to injury, OpenAI has snapped up IO, the hardware firm started by former Apple designer Jony Ive, in a $6.5 billion deal. Apple shares dropped two per cent on the news.', ""Bank of America analysts wrote that “Apple is essentially three years or more away from delivering a truly modern AI assistant, long after Google and others have integrated such tech.” So if you're still waiting for Siri to get clever, don’t hold your breath. By the time Job’s Mob catches up, your dishwasher might be telling you your personality problems to ten decimal places."", '', ""I'm tired of hearing all of these peasants whining about GPU prices. Get a better job or go..."", 'GPU market stumbles as dGPU penetration flattens · 6 hours ago', 'I blame 350$ entry level cards that are 3 years old like the 3060-8gb card and 600$ mid range...', 'GPU market stumbles as dGPU penetration flattens · 8 hours ago', 'Intel board room : ""we should copy Cerebras ...""', 'Intel boasts chip package the size of a dinner plate · 12 hours ago', 'Frank, that dude on twitter is still waiting for you to pay up on the bet you lost about the RX...', ""AMD insists gamers don't need more than 8GB of VRAM · 14 hours ago"", ""If it's been sold out since launch, it's a supply issue."", 'RTX 5060 Ti kicks AMD’s 9070 into the long grass · 15 hours ago', '']",Technology,https://news.google.com/api/attachments/CC8iK0NnNWhabkpqZFdsdlR6aDZWblJsVFJEUUF4aVZCU2dLTWdZbE5KYU9uUWc=-w280-h168-p-df
AI Daily: Apple struggles to deliver upgrades to AI voice assistant,https://www.tipranks.com/news/the-fly/ai-daily-apple-struggles-to-deliver-upgrades-to-ai-voice-assistant-thefly,"['Catch up on the top artificial intelligence news and commentary by Wall Street analysts on publicly traded companies in the space with this daily recap compiled by The Fly:', '', '', 'AI VOICE ASSISTANT: Apple (AAPL) is struggling to deliver upgrades to its AI voice assistant for the iPhone, with the company facing challenges with updating the software, Michael Acton of The Financial Times reports, citing recently departed employees. Apple has been attempting to build its own language learning models over the machine learning technology currently powering Siri, but the process of integrating such has led to bugs.', 'AI BILL: U. The U.K. has delayed proposals to regulate AI, with plans to introduce an AI bill in 2026 to address concerns about issues like safety and copyright, The Guardian’s Eleni Courea and Kiran Stacey report. The U.K. had originally planned to introduce a short, narrowly drafted AI bill within months of entering office that would have been focused on large language models, such as ChatGPT, which would have required companies to hand over their models for testing by the U.K.’s AI Security Institute.', 'SCALE AI: Meta Platforms (META) is in discussions to potentially make a more than $10B investment in AI startup Scale AI, David Carnevali, Shirin Ghaffary, Katie Roof, and Kurt Wagner of Bloomberg report, citing people familiar with the matter. This would make it one of the largest private company funding events of all time. The terms of the deal have not been finalized and could still be changed, the sources added.', 'AI INNOVATION: Amazon (AMZN) announced plans to invest at least $20B in Pennsylvania to expand data center infrastructure to support artificial intelligence and cloud computing technologies. Salem Township and Falls Township are the first communities identified as sites for these future innovation campuses. Multiple additional Pennsylvania communities are under consideration. This landmark investment is expected to create at least 1,250 new high-skilled jobs while supporting thousands of other jobs in the Amazon Web Services data center supply chain. The new highly skilled jobs will range from data center engineers and network specialists, to engineering operations managers, security specialists, and many more technical roles. In addition to these direct positions, this planned investment is expected to support thousands of local construction jobs and positions in the data center supply chain, as well as other jobs in the local community.', 'Published first on TheFly – the ultimate source for real-time, market-moving breaking financial news. Try Now>>', 'See Insiders’ Hot Stocks on TipRanks >>', 'Read More on MSFT:', 'Disclaimer & Disclosure', ""Looking for a trading platform? Check out TipRanks' Best Online Brokers guide, and find the ideal broker for your trades."", '']",Technology,https://news.google.com/api/attachments/CC8iK0NnNWhabkpqZFdsdlR6aDZWblJsVFJEUUF4aVZCU2dLTWdZbE5KYU9uUWc=-w280-h168-p-df
No title found,https://www.msn.com/en-in/news/other/apple-s-alleged-powerful-ai-models-could-be-hallucinating-more-than-the-company-would-like-report-says/ar-AA1FVlTS,[],Technology,https://news.google.com/api/attachments/CC8iK0NnNWhabkpqZFdsdlR6aDZWblJsVFJEUUF4aVZCU2dLTWdZbE5KYU9uUWc=-w280-h168-p-df
No title found,https://www.msn.com/en-in/money/news/ahead-of-wwdc-2025-former-apple-employees-reveal-why-llm-siri-is-still-not-ready/ar-AA1GmdFg,[''],Technology,https://news.google.com/api/attachments/CC8iK0NnNWhabkpqZFdsdlR6aDZWblJsVFJEUUF4aVZCU2dLTWdZbE5KYU9uUWc=-w280-h168-p-df
AI Siri’s absence from WWDC shows it’s still Apple’s biggest failure in 14 years,https://www.techradar.com/phones/iphone/siris-ai-absence-from-wwdc-shows-its-still-apples-biggest-failure-in-14-years,"['Lagging behind since 2011', 'When you purchase through links on our site, we may earn an affiliate commission. Here’s how it works.', ""I am going to talk about Terminator 2: Judgment Day in a post about AI, but not for the reason you would assume, so bear with me. I want to talk about John Connor's be-mulleted best friend, Tim."", ""There's a moment at the arcade during which the T-1000 is searching for Connor, and Tim bravely tries to deflect it away from him. The T-1000 elbows Tim out of the frame effortlessly in order to pursue its prey."", ""This is a picture wrap for Tim. He doesn't appear again. He has been glued to John Connor up until that point, but now he's shoved not only out of sight, but out of the movie."", ""That was Siri's role at WWDC 2025, but without the courage."", 'Apple opened with a big section on Apple Intelligence, but we were reminded that the AI-powered Siri has yet to meet Apple\'s high standards, and that ""we look forward to sharing more about it in the coming year"".', ""Oof, shove, goodbye Siri, there's only room for one irritating pre-teen in this action flick."", ""Bear in mind with the quote above that AI Siri was announced at WWDC 2024, so we've been waiting a year for it, and now it's coming at some vague point within the next year."", ""The upgraded Siri's failure to launch is often said to be part of Apple generally not keeping up with the pace of AI development – but while it's true that I've turned off a lot of Apple Intelligence features myself because I think they're sorely underbaked, Siri has a long history of lagging behind the competition."", ""It's funny to think that Siri was borderline the first of its kind. I say borderline, because Siri was an existing product that Apple bought in, so logically the tech already existed – but integrating it into the phone in the way Apple did in the iPhone 4S was new and interesting."", 'I was working on a dedicated iPhone magazine at the time, and Siri was obviously a huge deal: a new way of interacting with your phone, and – we assumed at the time – a new platform that would be developed constantly.', 'This was not, alas, the case. Siri would stumble forward with new features occasionally, but remained largely a voice-activated remote control for timers and maybe sending a message.', 'When Alexa and Google Assistant became the biggest tech platforms in the world for a time, we expected Siri to accelerate to keep up with them. It did not.', 'When Apple launched the original HomePod with Siri on it to compete with the Echo, Siri was far less capable than Alexa, and would frequently get wrong even basic music requests, despite a huge part of the launch being that it had been upgraded to be especially great at music.', 'Oh yes… and the HomePod was announced at WWDC 2017, but was delayed by nearly a year.', '', ""Apple has often added features and tinkered with Siri over the years, but it hasn't fixed the fundamental problem that it's never really seemed capable of handling anything outside of those basic remote-control requests."", 'I use Siri almost every day, to set cooking timers. Often to turn smart lights on and off. Sometimes to activate Apple Watch workouts if my hands are full. I send a message a few times a year, though I rarely trust its transcription.', ""None of these are meaningful progressions from what it could do 14 years ago. Every time I've encouraged it to explore new areas of usefulness with me, it has immediately tripped and fallen on its face, like a scene in a comedy about rich people who go on a hike for the first time."", ""Next year's WWDC will mark 15 years of Siri, and it's a big 'if' as to whether we'll have seen the new version by then. If we haven't – or even if we have, but it's only been as successful an update as previous versions – it really might be Old Yeller time."", ""Google Gemini is too impressive on Android phones for Siri to keep walking into walls. ChatGPT is working with Apple's own Jony Ive on a new AI-first device. Siri can't be carried forever; and yet, its failure to turn up for the huge WWDC event is just another in a long line of disappointments. Surely this has to end, one way or the other, soon."", 'Sign up for breaking news, reviews, opinion, top tech deals, and more.', ""Matt is TechRadar's Managing Editor for Entertainment, meaning he's in charge of persuading our team of writers and reviewers to watch the latest TV shows and movies on gorgeous TVs and listen to fantastic speakers and headphones. It's a tough task, as you can imagine. Matt has over a decade of experience in tech publishing, and previously ran the TV & audio coverage for our colleagues at T3.com, and before that he edited T3 magazine. During his career, he's also contributed to places as varied as Creative Bloq, PC Gamer, PetsRadar, MacLife, and Edge. TV and movie nerdism is his speciality, and he goes to the cinema three times a week. He's always happy to explain the virtues of Dolby Vision over a drink, but he might need to use props, like he's explaining the offside rule."", '', 'TechRadar is part of Future US Inc, an international media group and leading digital publisher. Visit our corporate site.', '© Future US, Inc. Full 7th Floor, 130 West 42nd Street, New York, NY 10036.']",Technology,https://news.google.com/api/attachments/CC8iK0NnNWhabkpqZFdsdlR6aDZWblJsVFJEUUF4aVZCU2dLTWdZbE5KYU9uUWc=-w280-h168-p-df
