Title,Link,Paragraphs,Topic,Image
Why We're Not Getting That AI-Powered Siri Anytime Soon,https://www.bundle.app/en/lifestyle/why-we're-not-getting-that-ai-powered-siri-anytime-soon-d11dcd12-23a5-495a-84e8-70c69c4a5f4b,"['', '', '', '', '', '', '', '', '', 'Credit: DenPhotos/Shutterstock', ""If you were under the assumption that  Siri was soon going to be supercharged with AI, you wouldn't be alone. In fact, Apple has advertised as much since last WWDC, showing off its ChatGPT-like assistant in commercials and promotional materials."", ""It's been nearly a year since WWDC 2024, and that new  Siri is still not here. The thing is, it likely won't be for a long time. How long is anyone's guess (I've been tracking the delays here), but one thing seems likely: Apple is probably not showing off AI Siri at next week's WWDC 2025."", ""In a report from Bloomberg's Mark Gurman last month, he describes a chaotic situation regarding Apple's AI department. The piece is a fascinating and in-depth look at Apple's AI woes, and I won't give a detailed summary of the entire article. However, I will briefly discuss what's going on, and how it related to AI Siri."", 'Executive leadership at Apple, including senior vice president of Software Engineering Craig Federighi, didn\'t believe AI was worth the investment, and didn\'t want to allocate resources away from Apple\'s core software components in order to develop the technology. But once Federighi used ChatGPT following its late 2022 launch, he did a 180. He and other Apple executives began meeting with the big AI companies to learn everything they could, and pushed for iOS 18 to have ""as many AI-powered features as possible.""', ""While Apple's AI department already existed before this scramble (the company had poached Google's artificial intelligence chief John Giannandrea), the engineers simply couldn't match the quality or accuracy of the tools provided by other companies like OpenAI, Anthropic, or Google, who had a huge head start on generative AI."", 'That lag manifested in two ways: First, many of the AI features that Apple did bring to market were half-baked. Apple Intelligence\'s notification summaries feature, for example, infamously made some major mistakes, such as ""summarizing"" a BBC news alert to say that United Healthcare shooting suspect Luigi Mangione had shot himself. (Apple later disabled the feature for news alerts.)', ""Second, because Apple couldn't rely on its own tech to carry Apple Intelligence, they outsourced some tech to another AI company. While there was much debate about which company they should work with (Giannandrea wanted to work with Google and bring Gemini to iOS), Apple eventually settled for ChatGPT—which is why OpenAI's bot is built into your iPhone today."", ""Apple's lack of AI focus meant they missed the rush to acquire GPUs—the main processing unit used for training and running AI models. They also have strict privacy policies when it comes to user data, which severely limits what data they can use to train their models. (Some might say that's actually a good thing, and pause to think about the companies that do have a plethora of data to train with.)"", 'While Apple was able to get some AI features working ""well"" enough to ship, Siri was never among them. In order to bring AI to Siri, the company had to split Siri\'s ""brain"" in two—one featuring the existing code, used for traditional Siri tasks like setting timers and making calls, and the other for AI. While the AI side in a vacuum can work, integrating it with the other half of Siri\'s brain is problematic, and is the cause of much of the delay.', ""But rather than wait until Apple figured out how to get AI  Siri working to actually show off its new features, the company went ahead and heavily marketed them. During WWDC 2024, we saw prerecorded demos of Siri taking complex requests and generating helpful answers by accessing both a knowledge base about the user in question, as well as an awareness of what was happening on-screen. A prime example was an Apple employee asking  Siri about their mom's travel itinerary: Siri dove through the employee's messages with their mom to draw up the plans."", 'Apple even hired Bella Ramsey of The Last of Us to promote AI Siri features: In the commercial, Ramsey sees someone at a party they recognize but don\'t remember the name of. Ramsey then asks Siri ""What\'s the name of the guy I had a meeting with a couple of months ago at Cafe Granel?"" Siri immediately responds with the acquaintance\'s name, pulling from a calendar entry. Ramsey doesn\'t need to say the exact date or where to pull the information from, since AI Siri is presumably contextually aware, and can understand vague responses. (Apple has since deleted the ad from its YouTube account.)', ""Since then, AI features have trickled in on various iOS 18 updates, but not AI Siri. We've been following reports (mostly from Gurman) that Apple's engineers were having trouble getting it to work, and each delay pushed AI Siri's release to the next major iOS 18 update. At one point, we thought it could come with iOS 18.4: As Gurman reports in this latest piece, that was the plan, but Federighi himself was surprised to see that the AI Siri features didn't work on a beta for 18.4."", 'Siri\'s big AI upgrade was delayed again, now ""indefinitely."" According to Gurman\'s sources, there are no plans to announce Siri\'s new features alongside iOS 19 (or iOS 26, if rumors at to be believed) at next week\'s WWDC event. While the goal is to get AI Siri out for iOS 26 at some point, the situation is dire—Siri\'s features reportedly don\'t work a third of the time, and every time you fix one of Siri\'s major bugs, ""three more crop up.""', ""Gurman's sources say Apple has an AI department in Zurich working on a new LLM-based Siri that scraps the two-sided brain of the current assistant. Siri also has a new leader, Mike Rockwell, who replaced Giannandrea this spring. Some sources even say that Apple's internal chatbot is now rivaling ChatGPT, which could prove useful if integrated with Siri."", ""There are reasons to be mildly optimistic about Siri's long-term future, but there's no denying that the last year has been a disaster. If you're excited for Siri's next big development, lower your expectations for the short-term."", 'Devamını oku : lifehacker.com', '', '', '', '']",Technology,https://news.google.com/api/attachments/CC8iK0NnNWhabkpqZFdsdlR6aDZWblJsVFJEUUF4aVZCU2dLTWdZbE5KYU9uUWc=-w280-h168-p-df
WWDC 2025: Apple Says Personalized Siri Features Are Still Not Ready,https://www.macrumors.com/2025/06/09/personalized-siri-still-not-ready/,"['If you were hoping for the more personalized version of Siri to launch soon, Apple today said that you will have to keep waiting.', ""During the WWDC 2025 keynote today, Apple's software engineering chief Craig Federighi said that the company will share more details about the personalized Siri features in the coming year, signaling that they are still not ready."", '""As we\'ve shared, we\'re continuing our work to deliver the features that make Siri even more personal,"" said Federighi. ""This work needed more time to reach our high quality bar, and we look forward to sharing more about it in the coming year.""', ""Federighi's commentary indicates that the personalized Siri features will not be available for testing in the first iOS 26, iPadOS 26, and macOS 26 developer betas."", 'Apple first previewed the personalized Siri features during its WWDC 2024 keynote last June. The enhancements were initially expected to launch with iOS 18.4 a few months ago, but in March, Apple said they were delayed.', ""Whenever they launch, the Siri upgrades will include understanding of a user's personal context, on-screen awareness, and deeper per-app controls. For example, during its WWDC 2024 keynote, Apple showed an iPhone user asking Siri about their mother's flight and lunch reservation plans based on info from the Mail and Messages apps."", 'The promised Siri upgrades will require an iPhone that supports Apple Intelligence.', 'Get weekly top MacRumors stories in your inbox.', '', '', '', '', '', '', '', '', '', '', '', '', '', ' ', 'MacRumors attracts a broad audience of both consumers and professionals interested in the latest technologies and products. We also boast an active community focused on purchasing decisions and technical aspects of the iPhone, iPad, Mac, and other Apple platforms.']",Technology,https://news.google.com/api/attachments/CC8iK0NnNWhabkpqZFdsdlR6aDZWblJsVFJEUUF4aVZCU2dLTWdZbE5KYU9uUWc=-w280-h168-p-df
"Apple Brings Big Software Updates To iPhone, iPad, Mac And More But Stays Silent On Siri",https://www.timesnownews.com/technology-science/apple-brings-big-software-updates-to-iphone-ipad-mac-and-more-but-stays-silent-on-siri-article-151824770,"['Theme', 'Latest', 'Entertainment', 'India', 'Sports', 'Business', 'World', 'Lifestyle', 'Tech', 'Education', 'Viral', 'Cryptonow', 'Updated Jun 10, 2025, 11:32 IST', 'Apple Siri.', 'Bharat is an Assistant News Editor at Times Now, currently leading the Tech, Gaming, and Science section. He has spent almost 8 years reporting on tec...View More', 'News', 'Technology & Science', 'Follow us :', '© 2025 Bennett, Coleman & Company Limited']",Technology,https://news.google.com/api/attachments/CC8iK0NnNWhabkpqZFdsdlR6aDZWblJsVFJEUUF4aVZCU2dLTWdZbE5KYU9uUWc=-w280-h168-p-df
Why Apple's stock suddenly dropped a few minutes into its WWDC keynote,https://www.businessinsider.com/apple-wwdc-aapl-stock-suddenly-dropped-keynote-ai-siri-2025-6,"['Apple shares suddenly dropped a few minutes into its WWDC keynote on Monday. The culprit appears to be one word: Siri.', ""About six minutes into the presentation, Apple's stock abruptly fell more than 2.5%, from roughly $206 to below $201. That's the equivalent of about $75 billion in market value."", ""Just seconds earlier, Apple software chief Craig Federighi was on stage recapping the Apple Intelligence features the company had already rolled out in recent months, such as Genmoji, smart replies, photo cleanup tools . Then he pivoted to Siri. That's when things got awkward."", '""We\'re continuing our work to deliver the features that make Siri even more personal,"" Federighi said. ""This work needed more time to reach our high quality bar, and we look forward to sharing more about it in the coming year.""', ""Translation: Apple's long-promised AI revamp of Siri still isn't ready. Investors probably didn't like hearing that."", '""WWDC laid out the vision for developers BUT was void of any major Apple Intelligence progress,"" Dan Ives, a tech analyst at Wedbush Securities, wrote in a note to investors.', '""We get the strategy but this is a big year ahead for Apple to monetize on the AI front as ultimately Cook & Co. may be forced into doing some bigger AI acquisitions to jumpstart this AI strategy,"" Ives added. ""We have a high level of confidence Apple can get this right but they have a tight window to figure this out.""', 'Wall Street has been hoping and waiting for big AI advances from Apple for about a year. Expectations were not that high that WWDC 2025 would produce massive new progress here.', 'However, competitors such as Google, Microsoft, and OpenAI are racing ahead, with new generative AI models, chatbot upgrades and features coming out across the industry every week. Instead, on Monday Apple reiterated its message that major AI features are still in the works.', 'Earlier this year, Apple had to pull ads after an industry watchdog said the company\'s ""available now"" claims about Apple Intelligence, including next-gen Siri, overstated what was actually ready.', 'The delay underscores a deeper problem: Apple has been slow to build the infrastructure and foundational models that power modern AI.', '""The silence surrounding Siri was deafening; the topic was swiftly brushed aside to some indeterminate time next year,"" Forrester analyst Dipanjan Chatterjee told Business Insider. ""Apple continues to tweak its Apple Intelligence features, but no amount of text corrections or cute emojis can fill the yawning void of an intuitive, interactive AI experience that we know Siri will be capable of when ready. We just don\'t know when that will happen.""', ""Apple's old playbook was to stay quiet until everything was perfect. But in the AI arms race, waiting may not win. These days, just admitting you're not ready is sometimes enough to wipe out tens of billions in market value."", '""The end of the Siri runway is coming up fast,"" Chatterjee said. ""Apple needs to lift off.""', 'Jordan Hart contributed reporting.', '', '', '', '', '', '', '', '', '', 'Where Big Tech secrets go public — unfiltered in your inbox weekly. Sign up chevron down icon An icon in the shape of an angle pointing down.', '']",Technology,https://news.google.com/api/attachments/CC8iK0NnNWhabkpqZFdsdlR6aDZWblJsVFJEUUF4aVZCU2dLTWdZbE5KYU9uUWc=-w280-h168-p-df
Apple boosts AI features but leaves Siri behind for now,https://www.thenewdaily.com.au/life/tech/2025/06/10/apple-boosts-ai,"['Apple has added new AI capabilities to its software, including screening unknown callers.', 'It will screen your phone calls, translate your messages, and help you work out but Apple’s artificial intelligence software is not ready to smarten up Siri.', 'Artificial intelligence technology will be used to screen unknown phone calls, translate messages in real time, and guide runners through their workouts, but it is not yet ready to take Apple’s voice assistant to the next level.', 'The US tech giant revealed plans for future AI features at its Worldwide Developers Conference in California on Tuesday (local time), unveiling a host of upcoming software additions for its smartphones, tablets and computers.', 'But the company also revealed it would need “more time” to boost the capabilities of its voice assistant Siri using AI in a move that one analyst said would surprise the market.', 'Despite the delay, artificial intelligence dominated software enhancements announced at the event, ranging from a major design change to the way devices handle messages and phone calls.', 'Apple software engineering senior vice-president Craig Federighi said AI software would be key to changing the way people use personal technology.', '“Last year we took the first steps on a journey to bring users intelligence that’s helpful, relevant, easy to use and right where users need it,” he said.', '“Now the models that power Apple Intelligence are becoming more capable and efficient, and we’re integrating features in even more places across each of our operating systems.”', 'AI features coming to Apple devices will include Call Screening, which automatically answers and collects details from unknown callers, Live Translation, which will work with foreign languages in messages and phone calls, and changes to let users search the web for images they see on screen.', 'Exercise, including indoor and outdoor runs, will also get an AI boost with a feature called Workout Buddy that promises to use personal fitness history to tailor sessions. Future Apple software releases will feature a translucent design called Liquid Glass and be renamed for the year.', 'Developers would also get access to Apple’s on-device AI model to create apps, Federghi said, shortly after revealing the company was not yet ready to expand Siri’s capabilities using AI.', '“We’re continuing our work to deliver the features that make Siri even more personal,” he told the audience.', '“This work needed more time to reach our high-quality bar and we look forward to sharing more about it in the coming year.”', 'The company’s failure to boost its assistant with AI was a surprise, Creative Strategies technology analyst Carolina Milanesi said, even though Apple had demonstrated a sweeping plan to integrate AI technology in its platforms.', '“I don’t think what the analysts expected and what Apple delivered was the same,” she said.', '“What Siri would deliver is a more personal experience but it doesn’t mean that Apple doesn’t have intelligence now.”', 'Other Apple software changes announced at the event included customisable app windows on iPads, a dedicated Games app, and the release of MacOS Tahoe that will be the last to support Intel-based computers.', 'Apple’s announcements come after rival Google unveiled a suite of AI changes at its annual software conference in May and weeks before Samsung is expected to launch AI features inside a new folding phone.', 'This article was made possible with the support of Apple', '-AAP']",Technology,https://news.google.com/api/attachments/CC8iK0NnNWhabkpqZFdsdlR6aDZWblJsVFJEUUF4aVZCU2dLTWdZbE5KYU9uUWc=-w280-h168-p-df
Apple unveils a new look but the wait for AI Siri continues,https://www.smh.com.au/technology/apple-unveils-software-visual-redesign-but-no-revamped-siri-20250610-p5m63k.html,"['', '', 'Cupertino, California: Apple has made a number of announcements at its annual worldwide developer conference (WWDC) overnight, including a visual overhaul of its software, and changes to the iPad that make it more like a Mac. But major expected updates to its AI platform and voice assistant did not show up.', 'The iPhone-maker has been under pressure to deliver since its Apple Intelligence suite was unveiled at last year’s WWDC, but was perceived as underdeveloped and the promised updates have failed to eventuate. Key among them are plans to evolve the Siri voice assistant into a smarter and more capable agent that understands context, akin to ChatGPT.', 'Apple’s software updates for later this year have a new ‘liquid glass’ visual design.', '“As we’ve shared, we’re continuing our work to deliver the features that make Siri even more personal,” said Craig Federighi, Apple’s senior vice president of software engineering, on stage at WWDC.', '“This work needed more time to reach a high-quality bar, and we look forward to sharing more about it in the coming year.”', 'Industry watchers also anticipated an announcement that Google’s Gemini would join OpenAI’s ChatGPT as a service that could be leveraged through Apple Intelligence, but that didn’t eventuate. Instead, Apple’s primary consumer-facing announcements were a new visual language for all of its operating systems, and updates for the iPad that will let apps move around like windows.', 'Apple chief Tim Cook (left) and Craig Federighi, senior vice president of software engineering, on stage at WWDC, at Apple Park in Cupertino, California.\nCREDIT:\nBLOOMBERG', 'From the developers in attendance, the largest applause was for the announcement that Apple would be opening up access to the large language model that powers Apple Intelligence. That means any app can make use of the iPhone’s on-device AI to build on things like image recognition and creation, language translation or text summarisation.', '“We think this will ignite a whole new wave of intelligent experiences in the apps that you use every day,” Federighi said.', '“We couldn’t be more excited about how developers can build on Apple Intelligence to bring you new experiences that are smart, available when you’re offline, and that protect your privacy.”', 'Wedbush Securities analyst Dan Ives called the presentation a yawner.', '“Cupertino is playing it safe and close to the vest after the missteps last year,” he said.', '“We have a high level of confidence Apple can get this [AI] right, but they have a tight window to figure this out, and that will be the focus of investors for the next year.', 'Many elements in the new software can be customised to be transparent.', 'Apple is changing the way it names its yearly operating system versions to make them more uniform. So the update coming to iPhone later this year will not be iOS 19, but iOS 26, and that also applies to iPadOS, tvOS, visionOS and watchOS. The new MacOS will also be version 26, but inkeeping with the tradition of naming each version after a location in California it will be called MacOS Tahoe.', 'All the operating systems have a new visual style Apple is calling Liquid Glass, designed to look like various layers of coloured or transparent glass. Elements have also become more rounded and fluid; for example, the big glass numerals on the iPhone lock screen clock change size dynamically depending on your background photo and notification content. This is the first major visual change for the iPhone in 12 years, with the current look being a refined take on the interface of iOS 7 from 2013.', 'Some iPhone apps, including Camera, Phone and Messages, are also getting pared-back redesigns.', 'The iPad interface is becoming more desktop-like.', 'Apple did announce some new AI iPhone features, which bring to mind similar options already available on some Android phones. Call Screening answers unfamiliar numbers for you and asks who is calling, showing you a text transcript so you can decide whether to answer. Hold Assist detects hold music and can silence the call, giving you a ring when a human is back on the line.', 'Visual Intelligence, which currently works through the camera to answer questions about real-world objects, will be expanded to work on screenshots. It will be able to copy text, automatically create calendar entries, search Google, ask ChatGPT and more. And new language translation features will apply across text and verbal communication on the phone.', 'For iPadOS 26, Apple introduced a sizeable change to multitasking. Any full-screen app can be resized, at which point it will gain the red, yellow and green dots familiar from MacOS that let you control it like a window. There’s even a new menu bar at the top of the display, a more PC-like mouse pointer for use with touchpads, and a revamped file system that lets you put folders in the dock and choose apps to open each file.', 'WatchOS is getting an AI-powered Workout Buddy that gives exercise insights and encouragement in real time with a human-like voice, while the biggest update to MacOS is an improved Spotlight search that can take actions, trigger shortcuts and holds a history of your clipboard.', 'On iPhone, iPad and Mac, Apple is also introducing a new Games app that will make personalised recommendations and keep score with your friends.', 'All the new software will be available to the public in a beta form next month.', 'The author travelled to California as a guest of Apple.', 'Get news and reviews on technology, gadgets and gaming in our Technology newsletter every Friday. Sign up here.', 'Copyright © 2025']",Technology,https://news.google.com/api/attachments/CC8iK0NnNWhabkpqZFdsdlR6aDZWblJsVFJEUUF4aVZCU2dLTWdZbE5KYU9uUWc=-w280-h168-p-df
"Apple Isn't Even at the AI Party, Ross Gerber Says",https://www.bloomberg.com/news/videos/2025-06-09/apple-isn-t-even-at-the-ai-party-ross-gerber-says-video,"['', '', '', '', '', '', '', '', '""Siri is clueless and doesn\'t work,"" Ross Gerber, president and CEO of Gerber Kawasaki Wealth and Investment Management, says while discussing Apple\'s WWDC 2025. Speaking on ""Bloomberg The Close,"" Gerber also says Steve Jobs would call Apple\'s new products ""garbage."" (Source: Bloomberg)']",Technology,https://news.google.com/api/attachments/CC8iK0NnNWhabkpqZFdsdlR6aDZWblJsVFJEUUF4aVZCU2dLTWdZbE5KYU9uUWc=-w280-h168-p-df
