Title,Link,Paragraphs,Topic,Image
WWDC 2025: watchOS 26 to Reportedly Get Support for Third-Party Control Centre Widgets,https://www.gadgets360.com/wearables/news/watchos-26-third-party-control-centre-widgets-apple-watch-wwdc-2025-report-8600402,"['Photo Credit: Apple', 'WWDC 2025 kicks off on June 9 at Apple Park in California', 'At WWDC 2025 next week, Apple is expected to preview its upcoming OS iterations. While the rumour mill has suggested big changes coming to iOS 26, iPadOS 26 and most recently, visionOS 26, watchOS 26 may not be too far behind. As per a report, the Cupertino-based tech giant could finally introduce support for a highly requested feature on the Apple Watch — third party Control Centre widgets. This could potentially allow users to choose from relevant actions besides the staple Wi-Fi, Battery, and Focus Mode options.', ""9to5Mac reports that watchOS 26 will enable developers to incorporate their own third-party widgets into the Apple Watch's Control Centre. It is said to come with a fully customisable layout through the iPhone. Users may be able to add, remove, or re-order the widgets in the Control Centre in a simpler manner compared to the existing method."", 'With third-party widgets, Apple is expected to reportedly offer more Control Centre options to choose from, apart from the standard Airplane Mode, Battery, Do Not Disturb, Flashlight, and Wi-Fi options.', 'However, this is not the only change speculated to take place this year. Previous reports indicate that the company is all set to revamp the nomenclature of its OS updates. It is said to be moving away from an iteration-based strategy towards a year-based one. Thus, if this move comes to fruition, iOS 19 could be changed to iOS 26, iPadOS 19 to iPadOS 26, watchOS 12 to watchOS 26, and so on.', 'At WWDC 2025, Apple Watch is expected to get several upgrades, courtesy of watchOS 26. This includes AI capabilities powered by Apple Intelligence, even though the smartwatch would not run the AI models directly.', 'The company has also confirmed it is bringing an accessibility feature from the iPhone to the smartwatch. Live Listen turns the iPhone into a remote microphone to stream content directly to AirPods, Made for iPhone (MFi) hearing aids, or Beats headphones. With watchOS 26, users will be able to view Live Captions for Live Listen on their paired Apple Watch, while listening along to the audio.', ""For the latest tech news and reviews, follow Gadgets 360 on X, Facebook, WhatsApp, Threads and Google News. For the latest videos on gadgets and tech, subscribe to our YouTube channel. If you want to know everything about top influencers, follow our in-house Who'sThat360 on Instagram and YouTube."", 'ADVERTISEMENT', '05:53', '05:19', '03:05', '02:00', '01:32', 'ADVERTISEMENT']",Technology,https://news.google.com/api/attachments/CC8iK0NnNUlabFIxVFRWdk5sTjZXV3A1VFJDSEF4aVBCaWdLTWdZbGRZN09NUVk=-w280-h168-p-df
watchOS 12 could play nice with older Apple Watch models,https://www.cultofmac.com/news/watchos-12-could-play-nice-older-apple-watch,"['BY RAJESH PANDEY • 5:33 AM, JUNE 6, 2025', 'Apple reportedly does not plan to drop support for any older Apple Watch models with watchOS 12 (or watchOS 26). A leaker indicates the upcoming watchOS release will support Apple Watch Series 6 and newer models — the same as watchOS 11.', 'Apple discontinued support for several older Apple Watch models with the release of watchOS 11 in 2024', '', 'watchOS 11 currently supports Apple Watch SE (2nd gen), Apple Watch Series 6, and all newer models launched since then. Both models launched in 2020 and will be five years old this September. Despite their age, Apple will supposedly support them with watchOS 12/watchOS 26.', 'A private account on X, known for its accurate Apple leaks, claims watchOS 26 will support the same models as watchOS 11. A MacRumors source also confirmed Apple will change the naming style of its operating systems this year. So, as a previous report suggested, Apple will unveil iOS 26, iPadOS 26, macOS 26, and watchOS 26 at WWDC25 next week, instead of iOS 19 and iPadOS 19.', 'While not mentioned, Apple may not bring Apple Intelligence-powered features to its older smartwatches due to resource constraints. Apple could limit its AI features to newer models, like the Apple Watch Series 10 and Apple Watch Ultra 2.', 'With last year’s watchOS 11 already being a major update, Apple will seemingly focus on smaller quality-of-life improvements this year. Another recent leak indicated watchOS 26 will open up the Apple Watch Control Center to third-party widgets. This should make it a lot more powerful.', 'Apple will also reportedly let users customize the Apple Watch’s Control Center directly from the Watch app on their iPhone for easier access and personalization.', 'One of the key highlights of watchOS 26 could be a new visionOS-inspired redesign. Apple will apparently make the same UI changes across all its other operating systems.', 'Daily round-ups or a weekly refresher, straight from Cult of Mac to your inbox.', 'Our daily roundup of Apple news, reviews and how-tos. Plus the best Apple tweets, fun polls and inspiring Steve Jobs bons mots. Our readers say: ""Love what you do"" -- Christi Cardenas. ""Absolutely love the content!"" -- Harshita Arora. ""Genuinely one of the highlights of my inbox"" -- Lee Barnett.', 'The week\'s best Apple news, reviews and how-tos from Cult of Mac, every Saturday morning. Our readers say: ""Thank you guys for always posting cool stuff"" -- Vaughn Nevins. ""Very informative"" -- Kenly Xavier.', 'Please enable JavaScript']",Technology,https://news.google.com/api/attachments/CC8iK0NnNUlabFIxVFRWdk5sTjZXV3A1VFJDSEF4aVBCaWdLTWdZbGRZN09NUVk=-w280-h168-p-df
Apple is bringing third-party Control Center widgets to watchOS 26,https://www.gsmarena.com/apple_is_bringing_thirdparty_widgets_to_watchos_26_-news-68139.php,"['', 'Michail 06 June 2025', 'Apple watchOS Rumors', 'Apple is holding its annual Worldwide Developers Conference next week where we’ll see its latest operating systems which are expected to see a major visual overhaul and new naming scheme.', 'According to a new report from 9to5Mac, watchOS 26 will offer third-party widgets in the Control Center. This has been a longtime request for Apple Watch users who have so far only had access to Apple’s first-party apps and toggles in the drop-down menu.', 'Users will also be able to fully customize the widget placement on their smartwatch via the Apple Watch app on their iPhone.', 'Source', ""It makes it easier for the lay person to know whether their device's software is out of date. Which in turn helps with security for the general public among others things."", ""...Now, we can debate the dishonesty of labelling something being released to the public in the spring of 2025 as something deserving a 2026 name. But hey, it's Apple! When were they honest last time? So, better to lie than admitting they'..."", 'Hopefully these are not the only changes bc watchOS feels so underdeveloped for how much time and resources Apple has had to develop it… It really feels like they don’t give a fuck abt it, actually. But one could hope that the declining sales will...', 'PHONE FINDER', 'ALL BRANDS\nRUMOR MILL', 'Home News Reviews Compare Coverage Glossary FAQ RSS Youtube Instagram TikTok Facebook Twitter', '© 2000-2025 GSMArena.com Mobile version Android app Tools Contact us Merch store Privacy Terms of use']",Technology,https://news.google.com/api/attachments/CC8iK0NnNUlabFIxVFRWdk5sTjZXV3A1VFJDSEF4aVBCaWdLTWdZbGRZN09NUVk=-w280-h168-p-df
WatchOS 2026 Leaks: Apple to bring third-party widget support in Control Center. Here's why it matters,https://www.livemint.com/technology/tech-news/watchos-2026-leaks-apple-to-bring-third-party-widget-support-in-control-center-heres-why-it-matters-11749174703663.html,"[""Apple is all set to hold its Worldwide Developer Conference in Cupertino from 9 June. Ahead of the the company's second biggest event of the year - behind iPhone launch in September, there have been a lot of potential leaks about what the new operating system features to be announced the by the tech giant could like. "", 'For one thing, it is being seen as an almost certainty that Apple will break away from its current naming tradition and instead move to a naming system based on the current year. This translates to the upcoming version of software for Apple devices being called iOS 26, iPadOS 26, WatchOS 26 and the like. ', '74% OFF', '₹2008', 'Get This', '79% OFF', '₹3699', 'Get This', '74% OFF', '₹2833', 'Get This', '55% OFF', '₹44990', 'Get This', '49% OFF', '₹23999', 'Get This', '40% OFF', '₹39990', 'Get This', '46% OFF', '₹5104', 'Get This', '47% OFF', '₹18990', 'Get This', '70% OFF', '₹4299', 'Get This', '47% OFF', '₹7999', 'Get This', ""However, a report by 9to5Mac reveals that there will also be a new feature in WatchOS 26 that has been sought by Cuprtino's watch users for a long time. "", 'Currently, Apple only allows users to choose from its own toggles and tiles in the Control Center settins on Apple Watches but that is reportedly set to end with the latest software version.', 'Reportedly, Apple will bring third-party widgets in Control Center with WatchOS 26. This will mean Developers would be able to plug their widgets directly into the Control Center and users will be able to bring important data or actions from the third-part app like Wi-Fi, Battery and Focus Mode. ', 'Moreover, Apple could also make the layout for widgets on Control Center fully customizable, essentially allowing users to rearrange or remove widgets a lot more easily than the current method. ', ""Apple doesn't officially announce at this stage when its latest software will be rolled out and limits itself of just showcasing its software innovations at WWDC. However, the company's track record is of showing new innovations at WWDC and later rolling out all the new software updates shortly after the new iPhone launch event in September."", 'Catch all the Technology News and Updates on Live Mint. Download The Mint News App to get Daily Market Updates & Live .', 'MYANMAR-ARRESTS/:Six-year-old girl among Myanmar group arrested for killing retired general', 'Download the Mint app and read premium stories', '', '']",Technology,https://news.google.com/api/attachments/CC8iK0NnNUlabFIxVFRWdk5sTjZXV3A1VFJDSEF4aVBCaWdLTWdZbGRZN09NUVk=-w280-h168-p-df
watchOS 26 May Bring Third-Party Widgets to Control Center [Report],https://www.iclarified.com/97520/watchos-26-may-bring-thirdparty-widgets-to-control-center-report,[],Technology,https://news.google.com/api/attachments/CC8iK0NnNUlabFIxVFRWdk5sTjZXV3A1VFJDSEF4aVBCaWdLTWdZbGRZN09NUVk=-w280-h168-p-df
Apple Watch tipped for major control center upgrade in watchOS 26 — what we know,https://www.tomsguide.com/wellness/smartwatches/apple-watch-tipped-for-major-control-center-upgrade-in-watchos-26-what-we-know,"[""watchOS's big redesign could have extra third-party support"", 'When you purchase through links on our site, we may earn an affiliate commission. Here’s how it works.', ""WWDC 2025 is going to be a big deal for all of Apple's software, with redesigns reportedly coming for every operating system in the ecosystem — including watchOS. And according to a report from 9to5Mac, the upcoming watchOS 26 could include a long-requested feature for the best Apple Watches — third-party Control Center widgets."", ""Right now, the Apple Watch Control Center is limited to Apple's own tiles and toggles. But a source speaking to the site claims that it will change, with third-party support coming for the first time."", 'On top of that, the layout is tipped to be fully customizable via the Watch app on iPhone. That should be a lot simpler to change up the look of things compared to the current method, which is all contained on the watch itself.', ""While the report doesn't specify any specific third parties, I doubt it'll be long before developers jump on this opportunity. That way, Apple Watch users have the opportunity to toggle specific features on or off much faster than they can right now."", 'Apple\'s big redesign has been described as the ""most dramatic overhaul"" in Apple\'s history, and given the scope, it\'s not hard to see why that may be the case.', 'While this was initially expected to help close the gaps between iOS and macOS, reports suggest the redesign will expand across the entire Apple ecosystem. In other words, every Apple device, from phones and laptops to TV streamers and wearables, will have a similar unified design language.', 'Reports also suggest that the new ""Solarium"" UI is actually based on Apple\'s visionOS. That means more translucent elements, and maybe even floating icons. But Mark Gurman claims that the images circulating on the internet aren\'t ""representative"" of what the final designs are — so we\'ll have to wait until WWDC 2025 to see what Apple has planned.', 'Get instant access to breaking news, the hottest reviews, great deals and helpful tips.', ""Thankfully, with the keynote address taking place on June 9, we don't have that long to wait and see what's coming."", ""Tom is the Tom's Guide's UK Phones Editor, tackling the latest smartphone news and vocally expressing his opinions about upcoming features or changes. It's long way from his days as editor of Gizmodo UK, when pretty much everything was on the table. He’s usually found trying to squeeze another giant Lego set onto the shelf, draining very large cups of coffee, or complaining about how terrible his Smart TV is."", '', ""Tom's Guide is part of Future US Inc, an international media group and leading digital publisher. Visit our corporate site."", '© Future US, Inc. Full 7th Floor, 130 West 42nd Street, New York, NY 10036.']",Technology,https://news.google.com/api/attachments/CC8iK0NnNUlabFIxVFRWdk5sTjZXV3A1VFJDSEF4aVBCaWdLTWdZbGRZN09NUVk=-w280-h168-p-df
Apple Watch to get third-party widget support in watchOS 26,https://www.newsbytesapp.com/news/science/apple-s-watchos-26-to-bring-3rd-party-widgets-to-control-center/story,"['', '', 'Apple is set to unveil a major update for its Apple Watch operating system, watchOS 26, at the upcoming WWDC 2025 event.', 'The highlight of this update will be third-party widget support in the Control Center, according to 9to5Mac.', ""This new feature will give users a range of customization options beyond Apple's native toggles and tiles."", 'User flexibility', 'The upcoming watchOS 26 update will let users add, remove, and reorder widgets directly from the Watch app on their iPhones.', 'This is a major improvement over the current method of on-watch editing.', 'The update will also allow developers to integrate their own widgets with existing Apple toggles like Wi-Fi, Battery, and Focus Mode.', 'Feature highlights', 'The upcoming watchOS 26 is expected to bring a redesigned interface, AI-powered features, and expanded customization options.', 'The design will reportedly be inspired by visionOS, with translucent elements, floating menus, and rounder buttons for a more modern look.', 'Apple may also introduce AI-powered battery management and smart health coaching into the new OS version.', 'Enhanced usability', 'The watchOS 26 update will finally let users customize the Control Center with widgets from third-party apps, providing quick-access shortcuts.', 'The Apple Watch could also integrate with AirPods to automatically pause content when the user falls asleep, improving bedtime usability.', 'This feature is likely to make the device more user-friendly and convenient for everyday use.', 'Accessibility upgrade', 'Apple is also bringing the Live Captions feature to the Apple Watch with watchOS 26.', 'This will let users see real-time transcriptions while listening to audio through AirPods or hearing aids.', ""The move is part of Apple's effort to improve accessibility and make its devices more inclusive for all users, especially those with hearing impairments.""]",Technology,https://news.google.com/api/attachments/CC8iK0NnNUlabFIxVFRWdk5sTjZXV3A1VFJDSEF4aVBCaWdLTWdZbGRZN09NUVk=-w280-h168-p-df
WWDC 2025: New Features We Could See in watchOS 26,https://www.macrumors.com/2025/06/04/wwdc-2025-watchos-26/,"[""We're still counting down the days until the 2025 Worldwide Developers Conference, and Apple's big event is creeping closer. We haven't heard too much about what we might see in watchOS 26, but there are a few hints based on rumors, info about other updates, and features that Apple often adds to on a yearly basis."", '', 'Rather than naming the next-generation version watchOS 12, Apple is going to call it watchOS 26. All of the software updates coming this year will be numbered ""26,"" reflecting the September 2025 to September 2026 release cycle.', 'watchOS 26 will launch alongside iOS 26, iPadOS 26, macOS 26, tvOS 26, and visionOS 26, all of which are being renamed.', 'The overhauled design that Apple is introducing for \u200ciOS 26\u200c will also extend to the Apple Watch, though the changes to watchOS may not be as dramatic as the \u200ciOS 26\u200c refresh.', 'With \u200ciOS 26\u200c, Apple is introducing a design referred to internally as ""Solarium."" As the name suggests, it focuses on a glass-like look that\'s actually inspired by visionOS. Buttons, search interfaces, tab bars, and windows could adopt a translucent design reminiscent of frosted glass.', 'Floating menus, rounder buttons, and simplified navigation have been rumored, too. watchOS already uses round app icons and buttons, so it will fit right in. Apple could adopt the Solarium look for things like the app drawer, notifications, and Control Center.', ""Apple's aim is a more consistent design across all of its software platforms."", 'If watchOS is getting a design update to match \u200ciOS 26\u200c, Apple will likely add new watch faces that are designed with the new style.', 'The Apple Watch doesn\'t have the processing power to run Apple Intelligence on-device, but it is rumored to be getting some ""powered by \u200cApple Intelligence\u200c"" features that could rely on its link to the iPhone.', 'There are rumors that Apple will add an AI-powered battery management feature to iPhones running \u200ciOS 26\u200c, and similar functionality would make a lot of sense for the Apple Watch. On the \u200ciPhone\u200c, the feature will analyze device usage and make optimizations to maximize battery life.', ""Right now, features like ChatGPT Siri integration and Writing Tools don't extend to the Apple Watch, but these are options that Apple could add. The Apple Watch also doesn't support notification summaries or content summaries in general."", ""The Apple Watch could integrate with the AirPods to pause content that's playing when the wearer falls asleep. It's a rumored feature for \u200ciOS 26\u200c, but the AirPods have no sleep detection functionality, so the option would need to use Apple Watch data."", ""Apple is developing an updated version of the Health app for launch in \u200ciOS 26\u200c, but it's not clear if we'll see it at the keynote event because it's not going to be ready right away."", 'Apple wants to add AI-powered health coaching features that will provide users with personalized health recommendations, and any feature like that will rely on Apple Watch data and features.', 'Coaching could include expert information on health conditions, fitness tips, and ways to make positive lifestyle changes.', 'Apple is also said to be developing a food tracking feature that would let users log what they eat throughout the day, and the Apple Watch would be a convenient way to add foods to a daily intake list.', ""Apple has been developing a blood pressure monitoring feature for the Apple Watch, and if it's ready to go for the 2025 models, there could be a new blood pressure app in watchOS 26. The feature will alert users if hypertension is detected, but it won't provide specific systolic and diastolic readings."", ""It's not yet clear if blood pressure monitoring is ready to launch due to developmental problems, so it's something that we might not see until the 2026 Apple Watch models."", ""Apple typically adds new workout types and features with new watchOS releases. One area that's lacking is strength training, and Apple Watch users need to download third-party apps for counting reps. That's something that the Apple Watch could get in the future. Apple has patented a method for rep tracking that uses the \u200ciPhone\u200c's camera."", ""In 2024, Apple submitted a patent for an Apple Watch feature that would be able to determine when the wearer is drowning, which would be a logical addition to crash detection and fall detection. There's no word that Apple has plans to launch this feature in watchOS 26, but it's something that's in the works behind the scenes."", ""Apple's WWDC 2025 keynote will begin on Monday, June 9 at 10:00 a.m. Pacific Time. Apple will live stream the event on its website, on YouTube, and in the TV app."", '', '', 'Get weekly top MacRumors stories in your inbox.', '', '', '', '', '', '', '', '', '', '', '', '', '', ' ', 'MacRumors attracts a broad audience of both consumers and professionals interested in the latest technologies and products. We also boast an active community focused on purchasing decisions and technical aspects of the iPhone, iPad, Mac, and other Apple platforms.']",Technology,https://news.google.com/api/attachments/CC8iK0NnNUlabFIxVFRWdk5sTjZXV3A1VFJDSEF4aVBCaWdLTWdZbGRZN09NUVk=-w280-h168-p-df
