Title,Link,Paragraphs,Topic,Image
"Pacers vs. Thunder Prediction, Odds, Best NBA Prop Bets for NBA Finals Game 2",https://www.si.com/betting/pacers-vs-thunder-prediction-odds-best-nba-prop-bets-for-nba-finals-game-2,"['Game 1 of the NBA Finals has flipped the series in the eyes of some, as the Indiana Pacers stole Game 1 and have a chance to really take control of their series on the road in Game 2.', 'Still, oddsmakers have the Oklahoma City Thunder heavily favored to win Game 2 – they’re 11-point favorites – and the series (-300 to win the title). Still, the Thunder were -700 to win the title ahead of Game 1, so losing the series opener has certainly shifted things in favor of the Pacers.', 'This postseason, the Pacers are 7-2 on the road, and they’ve won six of their last seven road games. Their only loss on the road since the start of the second round came in Game 5 of the Eastern Conference Finals against the New York Knicks. ', 'There were a ton of interesting things to take away from Game 1, but here are a few things to watch – in my eyes – heading into Sunday’s contest: ', 'After OKC was favored to win this series in five games, it’s looking like these NBA Finals could last much longer than that.', 'Here’s a breakdown of the odds, players to watch in the prop market and my prediction for Game 2 on Sunday night. ', 'Odds via DraftKings Sportsbook.', 'Spread', 'Moneyline', 'Total', 'Pascal Siakam is averaging just 6.0 rebounds per game in the playoffs, but he grabbed 10 boards in Game 1 of this series with the Thunder opting to go smaller in their starting lineup.', 'OKC shied away from playing two bigs at the same time, leading to a massive advantage on the glass for the Pacers in the series opener.', 'What’s most interesting to me with this prop is that Siakam is averaging 10.9 rebound chances per game in the playoffs, but that number skyrocketed to 15.0 in Game 1. He responded by reaching double-digit boards for just the second time this postseason.', 'While I’m not expecting that again, I do think seven or more boards is in play for Siakam, who averaged 6.9 rebounds per game in the regular season.', 'This postseason, Shai Gilgeous-Alexander is shooting just 31.4 percent from beyond the arc, but he’s knocked down at least two shots from deep in nine of his playoff games, including each of his last four.', 'In game 1, SGA attempted six shots from deep, hitting three of them.', 'While the Thunder don’t rely heavily on the league MVP shooting the ball from beyond the arc, he’s still attempting 5.1 shots per game from deep in the playoffs.', 'Given that volume, I think Gilgeous-Alexander is worth a look in Game 2 with a ton on the line for OKC. I expect SGA to come out aggressive as a scorer, and he did step into a few 3-pointers in transition in Game 1. If the attempts for the star guard are hovering around the five-to-seven range, he’s a great bet to hit two of them on Sunday. ', 'Earlier today, I shared in my NBA Best Bets column – Peter’s Points – why the Pacers are the bet to make in Game 2: ', 'The Thunder have been elite as home favorites in the 2024-25 season, but I’m having a hard time buying them at this price against a Pacers team that has thrived on the road all season long.', 'Indiana is 7-2 straight up on the road in the playoffs and 19-11 against the spread as a road underdog in the 2024-25 season. The Pacers have covered the spread in seven of their last eight road games, easily doing so in Game 1 of this series.', 'While I do think that the Thunder will shoot better in Game 2, the Pacers also aren’t going to turn the ball over 25 times. This is an Indiana team that is one of the best in the league at limiting turnovers, and it showed in the second half of Game 1 (six turnovers) that it can take care of the ball against this elite OKC defense.', 'Plus, the Pacers dominated the glass in Game 1 with Isaiah Hartenstein moving to the bench for OKC. Does Mark Daigneault go back to his original starting lineup? ', 'There’s a lot more questions for OKC after playing a pretty decent game and still losing at home. The Pacers have to feel like they can play better, and they’ve shown all postseason long that they’re undervalued in the betting market.', 'I think Indiana can keep this game within double digits, even if OKC ends up winning easily in Game 2. ', 'Pick: Pacers +11 (-112 at DraftKings)', 'Odds refresh periodically and are subject to change.', 'If you or someone you know has a gambling problem and wants help, call 1-800-GAMBLER.', ""Find Peter Dewey's NBA betting record here (futures included). You can also follow my daily plays on  BetStamp here."", 'Are you new to DraftKings? Sign up today and place a $5 bet to earn a guaranteed $200 in bonus bets. Win or lose, DraftKings will issue six $25 bonus bets instantly.', 'Peter is a senior editor for Sports Illustrated Betting. He has worked as a writer and editor for BetSided, NBC Sports, the Connecticut Sun and the Meriden Record-Journal covering the NBA, WNBA, NFL, MLB, and more. A New York City resident, he is a hoops fanatic with a soft spot for his New York Knicks.', 'Follow @peterdewey2', ""© 2025\nABG-SI LLC\n- SPORTS ILLUSTRATED IS A REGISTERED TRADEMARK OF ABG-SI LLC. - All Rights Reserved. The content on this site is for entertainment and educational purposes only. Betting and gambling content is intended for individuals 21+ and is based on individual commentators' opinions and not that of Sports Illustrated or its affiliates, licensees and related brands. All picks and predictions are suggestions only and not a guarantee of success or profit. If you or someone you know has a gambling problem, crisis counseling and referral services can be accessed by calling 1-800-GAMBLER."", '', '']",Sports,https://news.google.com/api/attachments/CC8iK0NnNXlhbW95Y21nNFZTMVJRMTluVFJDb0FSaXNBaWdCTWdhaGxJcUx0UVk=-w280-h168-p-df
How the Thunder and Pacers outfoxed big-market super teams to reach NBA Finals,https://www.washingtonpost.com/sports/2025/06/05/nba-finals-matchup-thunder-pacers/,"['Oklahoma City and Indiana needed years of savvy maneuvering to overcome their disadvantages as small-market franchises and reach the sport’s biggest stage.', 'OKLAHOMA CITY — The latest and loudest sign that this year’s NBA Finals matchup between the Oklahoma City Thunder and the Indiana Pacers is an anomaly came Tuesday, when a tornado warning was issued in parts of Oklahoma as a massive thunderstorm moved across the state. The Pacers’ flight to Oklahoma City was diverted to Tulsa as a precaution, several out-of-market media members dealt with major delays, and NBA employees huddled in the basement of a downtown hotel as sirens blared outside. For many locals, this was just another day during a busy storm season. For uninitiated outsiders, the dark clouds, pouring rain, lightning strikes and flood warnings were disorienting and unnerving.', 'So began these upside-down Finals, which open with Game 1 on Thursday night and stand in direct opposition to the NBA’s long-standing conventional wisdom that the most famous and influential players shape the championship landscape by assembling super teams in glamorous coastal cities. This year, two small-market teams from the middle of the country have written impressive turnaround stories built on savvy trades and deep rosters rather than free agency power plays and overwhelming star power.', 'The Sports Moment newsletter', 'By Wednesday, the bad weather had passed, allowing the conference champions to safely assemble at Paycom Center. While Oklahoma City’s Shai Gilgeous-Alexander, the reigning MVP, and Indiana’s Tyrese Haliburton, an electric two-time all-star, are worthy headliners, the Thunder and Pacers aren’t exactly overflowing with household names. This matchup is almost the exact opposite of then-NBA commissioner David Stern’s famous quip that his dream Finals would pit the Los Angeles Lakers against the Los Angeles Lakers.', 'But Adam Silver, Stern’s successor, has spent years preaching the virtues of “parity of opportunity” and, at the behest of NBA owners, reshaping the league’s salary cap rules to create a more level playing field for all 30 teams. The structural changes, which have included harsh luxury tax penalties and roster-building restrictions for the biggest spenders, have given new hope to teams such as the Thunder and Pacers, who have long struggled to land high-profile free agents. After LeBron James and Kevin Durant dominated the 2010s with their free agency decisions and star-laden powerhouses, the NBA is set to crown its seventh different champion in as many seasons.', 'Follow Sports', '“It’s a new blueprint for the league,” Pacers center Myles Turner said. “The years of the super teams and stacking [talent] is not as effective as it once was. ... The new trend now is what we’re doing. OKC does the same thing. The young guys get out and run, defend and use the power of friendship.”', 'The Thunder and Pacers can trace the roots of their success to a critical moment in NBA history: Durant’s decision to leave Oklahoma City to join Stephen Curry’s Golden State Warriors in 2016. The Thunder, which was rocked by its franchise player’s departure, learned the painful lesson that it was better to trade a disgruntled star and get something in return rather than watch him leave for nothing in free agency. The Pacers felt the downstream effect of Durant’s decision when all-star forward Paul George pushed his way out of Indiana to Oklahoma City in a 2017 trade.', 'George didn’t remain as Durant’s replacement in Oklahoma City for long. During the summer of 2019, the deep-pocketed Los Angeles Clippers concocted an all-in plan to pair George with Kawhi Leonard, a two-time Finals MVP. Thunder General Manager Sam Presti acquiesced, landing Gilgeous-Alexander — then coming off his rookie season — and a boatload of draft picks for George. Later that summer, Presti shipped Russell Westbrook, the 2017 MVP and a fan favorite, to the Houston Rockets for Chris Paul and another pile of draft assets.', 'By proactively moving George and Westbrook, Presti set the stage for a rebuilding cycle and added a veteran mentor in Paul, rather than risk distracting rumors about the uncertain futures of his stars. Though it took years for Presti’s vision to come together, Gilgeous-Alexander eventually blossomed into a franchise guard, and Jalen Williams arrived in 2022 thanks to one of the first-round picks acquired from the Clippers. Williams, a 23-year-old forward, has emerged as Gilgeous-Alexander’s co-star and earned his first all-star selection this season.', '“When I [was drafted], there was a ton of people outside the hotel waiting to see us and congratulate us,” Williams said. “I always compare us to a small local high school football team being really good and the city around them kind of gathers around them. Everywhere we go, I’ve been met with love since I’ve been out here.”', 'The Thunder, which won just 24 games in 2021-22, has filled out Gilgeous-Alexander’s supporting cast by drafting center Chet Holmgren with the No. 2 pick in 2022, trading for guard Alex Caruso last summer and then making use of its salary cap flexibility to sign center Isaiah Hartenstein.', 'Rather than assemble an expensive “Big Three” of prime-age stars on maximum contracts — as the Miami Heat did with James, Dwyane Wade and Chris Bosh in the early 2010s — the Thunder is under the NBA’s luxury tax line of $170.8 million despite having a young and balanced roster that won 68 games and had the league’s No. 1 defense this season.', '“Those early [rebuilding] years were challenging,” Thunder Coach Mark Daigneault said. “How it felt every day was not a reflection of our record or where our standing was in the league. You could feel that some of the seeds we were planting were going to be flowering at some point. We were confident, even back then, that we were building something special and something that had the ability to sustain.”', 'The Pacers spun their wheels in the immediate aftermath of George’s 2017 departure, but they smartly flipped Domantas Sabonis, one of the pieces they got back from the Thunder, to the Sacramento Kings for Haliburton in 2022. When Indiana acquired Haliburton, less than two years after he was a 2020 lottery pick, Pacers President Kevin Pritchard hailed the young guard as the franchise’s answer to Peyton Manning, the Indianapolis Colts’ Hall of Fame quarterback. The fan base needed a jolt of hope given that Indiana finished the 2021-22 season with 25 wins.', 'Haliburton, like Gilgeous-Alexander, instantly gave his team an identity: The Pacers became a fast-and-loose offensive juggernaut, while the Thunder came to reflect Gilgeous-Alexander’s consistency and craftsmanship. Pritchard then set about finding players who would thrive in an up-tempo style, adding forwards Pascal Siakam, Aaron Nesmith and Obi Toppin in trades and selecting guard Andrew Nembhard in the 2022 draft.', '“[Presti] and Kevin Pritchard are two of the best franchise builders around,” Pacers Coach Rick Carlisle said. “I understand that there would be concern for how many people would watch because they’re smaller markets, but if we’re celebrating the game, it really shouldn’t matter.”', 'The Pacers put themselves in position to be contenders by landing Siakam from the Toronto Raptors in a January 2024 trade. At the time, he was heading for free agency and was viewed as a second-tier star. Indiana bet correctly that his athleticism and experience would be a good fit alongside Haliburton, and Pritchard’s careful management of the salary cap made it possible to grant Siakam a four-year, $189.5 million contract last summer without breaking the bank. In fact, the Pacers, like the Thunder, slid under the luxury tax line even though they possessed a solid rotation that featured 10 players who each logged at least 1,000 minutes.', 'Indiana was hampered by early-season injuries, but it still finished with 50 wins and top-10 rankings in offensive efficiency and pace. During the playoffs, the Pacers have gone 12-4 against the Milwaukee Bucks, Cleveland Cavaliers and New York Knicks while ranking second in offensive efficiency and third in pace.', '“I don’t need the glitz and glamour of a large city,” Haliburton said. “I really like the small-town feel from our fans. I think [Oklahoma City] can relate to that. … [The Pacers] took a chance on me. Sometimes I think they saw more in me than I saw in myself. When we brought [Siakam] here, we envisioned doing something special. He’s been like a big brother for me. He’s somebody who can always keep me steady. [Going to the Finals] is what we got together to do.”', 'With James, Curry and Durant entering the twilight of their careers, the Thunder and Pacers have moved to center stage thanks to a pair of fortunate trades for their stars and a philosophy of collecting as many good and affordable players as possible to withstand the physical grind of a fast-paced era. Oklahoma City and Indiana avoided the pitfalls faced by Durant’s Phoenix Suns, Giannis Antetokounmpo’s Bucks and Joel Embiid’s Philadelphia 76ers: They prioritized depth over top-end star power, so they aren’t one injury away from calamity.', 'The big-market behemoths will surely fight back. The Lakers landed Luka Doncic in a February blockbuster, and Antetokounmpo could alter the league’s landscape again if the Bucks trade him this summer.', 'For now, the Thunder and Pacers will savor their title shots despite the stormy start to Finals week: Oklahoma City hasn’t won a championship since relocating from Seattle in 2008, and Indiana has never won it all since joining the NBA from the rival American Basketball Association in 1976. Given how far they have come since Durant’s fateful decision in 2016, the Thunder and Pacers are well equipped to handle the elements.', '“To win a title on top of everything that happened this year would be special,” Gilgeous-Alexander said. “I’ve been so focused on Game 1. Trying to be the best version of myself for this group and trying to make sure that we’re clicking on all cylinders on the biggest stage of our careers has been on the forefront of my mind.”', 'What readers are saying', '']",Sports,https://news.google.com/api/attachments/CC8iK0NnNXlhbW95Y21nNFZTMVJRMTluVFJDb0FSaXNBaWdCTWdhaGxJcUx0UVk=-w280-h168-p-df
DraftKings Promo Code: Get $300 MLB Bonus This Week,https://www.nola.com/sports/betting/draftkings-promo-code-get-300-mlb-bonus-this-week/article_219bbe83-1761-49d8-b99c-297287a7f1d4.html,"['', '', 'Sign up with the latest DraftKings promo code offer on MLB this week. New users who take advantage of this opportunity can start with a 60-1 odds boost on MLB or any other sport. Click here to start signing up.', '', 'New players can sign up with this offer and place a $5 bet on MLB. Anyone who picks a winner on this first bet will receive $300 in total bonuses. Players will receive 12 $25 bonus bets to use on any sport throughout the week.', ""DraftKings Sportsbook has a ton of different ways to bet on baseball. Players can start with this sign-up bonus on any of Monday's games. There is no shortage of options to choose from. We also recommend checking out the different in-app offers for MLB and other sports like the NHL and NBA."", 'Click here to secure this DraftKings promo code offer and start with a $5 bet. Players who pick a winner will receive $300 in bonuses.', 'Bet $5, Get $300 Bonus With a Win', 'Picking a winner is the only hurdle to jump with this DraftKings Sportsbook. Set up a new account and place a $5 bet on any MLB game this week. Players who start with a winning bet will receive $300 in total bonuses.', ""From there, start using these bonus bets to make picks on any game throughout the week. It's important to note that these bonuses apply to a wide range of markets. MLB will be a top option for players on Monday night, but don't forget about other sports."", 'The Stanley Cup Final continues with Game 3 on Monday night. Not to mention, the NBA Finals will shift to Indiana for Game 3 on Wednesday night. Not to mention, there are plenty of niche options like the WNBA, soccer, tennis, golf and more.', 'New players can bypass the need for a promo code by following the step-by-step instructions below:', ""This sign-up bonus is an opportunity for players to get off to a fast start this week. Create a new account and start with a $5 bet to get $300 in total bonuses. However, there are other ways to bet on baseball. Check out the two in-app offers for Monday's games. There is a NRFI/YRFI MLB boost for any game. This allows players to win bigger paydays for a no run first inning or yes run first inning bet. Players can also grab a profit boost for any of the MLB games throughout the week. In short, there are tons of options for baseball fans."", '21+ and present in participating states. Gambling problem? Call 1-800-Gambler.', 'Gambling Problem? Call 1-877-770-STOP. Or visit this website.', 'News Tips:\nnolanewstips@theadvocate.com', 'Other questions:\nsubscriberservices@theadvocate.com', 'Need help?', '', 'This website stores data such as cookies to enable essential website functionality, marketing, personalization and analytics. By remaining on this website you indicate your consent. See updated terms and conditions.']",Sports,https://news.google.com/api/attachments/CC8iK0NnNXlhbW95Y21nNFZTMVJRMTluVFJDb0FSaXNBaWdCTWdhaGxJcUx0UVk=-w280-h168-p-df
Pacers return home with hopes of rebounding in NBA Finals,https://www.wishtv.com/sports/indiana-pacers/pacers-look-to-bounce-back-in-game-3/,"['', '', 'OKLAHOMA CITY (WISH) — For the first time this postseason, the Pacers do not have a 2-0 series lead.', 'The Pacers fell to the Thunder in Game 2 on Sunday night, 123-107.', '“Everybody’s got to do more,” Pacers head coach Rick Carlisle said. “It starts with the best players. It starts with, you know, Tyrese and Pascal and Myles, and then it goes from there. We are an ecosystem that has to function together, and stats — we’ve got to score enough points to win the game but who gets them and how they get them, not important.”', 'The Pacers have not had a 20 point scorer yet in the Finals. Tyrese Haliburton had just three points at halftime and five points at the end of the third quarter.', '“I have to do a better job of figuring out where I can be better,” Haliburton said. “In that game in the second half when you’re down by so much, you can choose to, you know, just take the game for what it is and just be done or try to continue to learn different things. I’m learning where my spots are and where I can be better. So we’ll take the good and the bad, watch film and see where we can improve the next game.”', 'The Pacers were outscored 42-34 in the paint and did not record any points in the paint in the first quarter.', '“I think we’ve got to watch the film and just find ways to no matter what, still be us,” Pacers forward Pascal Siakam said. “We’ve got to watch it, and find a way to, again, get to the paint or spray off threes. Whatever our game is, you know, we’ve got to find a way to do that.”', 'The Pacers now return to Indianapolis for their first home NBA Finals game since 2000.', '', '']",Sports,https://news.google.com/api/attachments/CC8iK0NnNXlhbW95Y21nNFZTMVJRMTluVFJDb0FSaXNBaWdCTWdhaGxJcUx0UVk=-w280-h168-p-df
Sunday Headlines: NBA Finals Game 2 Edition,https://www.aseaofblue.com/2025/6/8/24445112/uk-wildcats-news-nba-finals-game-2-kentucky-okc-thunder-pacers-sga,"['FILED UNDER:', 'Will SGA and OKC bounce back from a Game 1 heartbreaker?', 'Tonight is Game 2 of the NBA Finals, and the big question is: How will the Oklahoma City Thunder respond following a late-game collapse in Game 1.', 'The Thunder led by 9 with just under 3 minutes to go, but the Pacers came back as Tyrese Haliburton hit a jumper with less than 1 second on the clock to give Indiana the 1-0 lead in the series.', 'Former Kentucky Wildcats star Shai Gilgeous Alexander had a game-high 38 points, but he wasn’t as efficient from the floor as he’s been most of the season, shooting 14-30 from the floor.', 'So how will OKC and SGA respond in Game 2 on their home floor?', 'The Thunder only had 4 postseason losses before Game 1, and in each of those, they bounced back in the next game with a victory. The Thunder only lost back-to-back games twice this season.', 'We’ll likely see a strong response from OKC in Game 2, and if the Thunder are going to pick up a win and even the series, they’ll need a big performance from SGA.', 'The more things change, the more they stay the same. pic.twitter.com/3YCCoL0VvS', 'Really cool.', 'UK Athletics releases FAQ on revenue sharing - UK Athletics', 'This is good info.', 'Mikhail McLean in Mexico for FIBA U16 AmeriCup - KSR', 'The UK coaching staff is keeping an eye on the top players in ‘27 and ‘28.', 'Sean Woods knows Pope needs to make defensive changes - Vaughts Views', 'Definitely brought in some quality defenders.', 'Brunson’s usage among reasons for Thibodeau firing - CBS Sports', 'They knew who he was when they hired him.', 'Jay Wright won’t be in the mix for Knicks job - ESPN', 'No real surprise there.', 'Which MLB teams will be buyers at deadline - Yahoo', 'Expect the Yankees to make a move or two.', 'USMNT falls to Turkiye - NBC Sports', 'Another tough loss.', 'Zach Edey will likely miss start of next season - ESPN', 'Tough break for Memphis.', 'Mavericks likely to deny Knicks-Kidd meeting - Bleacher Report', ""Doesn't look like Kidd will be headed to the Knicks."", 'In this week’s SB Nation Reacts survey, 37% of Kentucky fans said they believe Kentucky should be ranked in the 5-7 range when the college basketball preseason polls are released.', 'This post was brought to you by FanDuel.', 'Gambling Problem? Call 1-800-GAMBLER (1-800-426-2537). Hope is here. GamblingHelpLineMA.org or call (800) 327-5050 for 24/7 support (MA). Visit www.mdgamblinghelp.org (MD). Call 877-8HOPE-NY or text HOPENY (467369) (NY). 21+ (18+ D.C.) and present in select states (for KS, in affiliation with Kansas Star Casino). Call 1-888-789-7777 or visit ccpg.org/chat (CT) or visit FanDuel.com/RG.']",Sports,https://news.google.com/api/attachments/CC8iK0NnNXlhbW95Y21nNFZTMVJRMTluVFJDb0FSaXNBaWdCTWdhaGxJcUx0UVk=-w280-h168-p-df
