Title,Link,Paragraphs,Topic,Image
"FanDuel Promo Code for New Customers: Bet $5+, Get $200 in Bonus Bets If Your Bet Wins",https://www.fanduel.com/research/fanduel-promo-code-for-new-customers-bet-usd5-get-usd200-in-bonus-bets-if-your-bet-wins-6-9-2025,"['', '', '', '', '', '', '', 'Subscribe to our newsletter', 'Are you new to FanDuel Sportsbook? New customers can receive $200 in Bonus Bets if your bet wins, valid on your first $5+ cash wager of any type — including the NBA Finals!', 'FanDuel doesn’t require promo codes, so for this offer, you won’t need one. Follow these steps to participate:', 'Bonus funds, profit boost tokens, and cashed out wagers are ineligible for this promotion Limit of one promotional bonus per person. See full terms and conditions at FanDuel Sportsbook.', 'Bonus Bets are bonuses that you’ll find in your account page or betslip.', 'Awarded Bonus Bets do not need to be used in one lump sum. You can update the amount of Bonus Bets you want to wager in your betslip. The remaining Bonus Bet balance will still be available in your account.', 'With Bonus Bets, only the winnings are returned to you, you will not get the stake returned as cash in your wallet.', 'More information on Bonus Bets found here.', 'The promotion is only open to individuals who, at the time of entry, are at least eighteen (18) years of age and physically present in the District of Columbia or Puerto Rico or are at least twenty one (21) years of age and are physically present in Arizona, Colorado, Connecticut, Illinois, Indiana, Iowa, Kansas, Kentucky, Louisiana (excluding the following parishes: Caldwell, Catahoula, Franklin, Jackson, LaSalle, Sabine, Union, West Carroll and Winn), Maryland, Massachusetts, Michigan, New Jersey, New York, North Carolina, Ohio, Pennsylvania, Tennessee, Vermont ,Virginia, West Virginia, or Wyoming during the promotion period.', 'The promotion ends at 11:59 PM PT on June 22nd, 2025.', 'Gambling Problem? Call 1-800-GAMBLER or visit RG-help.com.\nCall 1-888-789-7777 or visit ccpg.org/chat (CT). Hope is here. GamblingHelpLineMA.org or call (800) 327-5050 for 24/7 support (MA). Visit www.mdgamblinghelp.org (MD). Call 1-877-8HOPE-NY or text HOPENY (467369) (NY).\n21+ (18+ D.C. & PR) and present in select states (for KS, in affiliation with Kansas Star Casino). If playing causes you financial, family and occupational problems, call the ASSMCA PAS line at 1-800-981-0023 (PR). First online real money wager only. $5 first deposit required. Bonus issued as nonwithdrawable bonus bets which expire 7 days after receipt. Restrictions apply. See terms at sportsbook.fanduel.com.', 'Want more stories like this?', 'Sign up to our newsletter to receive the latest news.', 'Tuesday’s MLB Home Run Props - June 10', 'Data Skrive•2h', 'Tuesday’s MLB Strikeout Props - June 10', 'Data Skrive•2h', 'Yankees vs Royals Prediction, Odds, Moneyline, Spread & Over/Under for June 10', 'Data Skrive•2h', 'Twins vs Rangers Prediction, Odds, Moneyline, Spread & Over/Under for June 10', 'Data Skrive•2h', 'Blue Jays vs Cardinals Prediction, Odds, Moneyline, Spread & Over/Under for June 10', 'Data Skrive•2h', 'Astros vs White Sox Prediction, Odds, Moneyline, Spread & Over/Under for June 10', 'Data Skrive•2h', '']",Sports,https://news.google.com/api/attachments/CC8iK0NnNXlhbW95Y21nNFZTMVJRMTluVFJDb0FSaXNBaWdCTWdhaGxJcUx0UVk=-w280-h168-p-df
Gen Z is taking over the NBA Finals between Thunder and Pacers with youngest matchup in decades,https://www.cbsnews.com/news/nba-finals-thunder-pacers-youngest-nba-finals-rosters/,"['Watch CBS News', 'June 4, 2025 / 8:38 PM EDT / CBS News', ""When the Oklahoma City Thunder tip off against the Indiana Pacers in the 2025 NBA Finals Thursday night, it won't just be a battle for the title — it's a generational milestone."", 'Led by almost entirely Gen Z players born between the late 1990s and early 2010s, the Oklahoma City Thunder and Indiana Pacers are among the youngest teams in NBA history to make it to the championship games. The Thunder entered the season as the youngest team, with an average age of 24.148, according to the NBA. The Pacers came in slightly older at 25.263, but the number is still below the league average for teams that make it to the Finals.', 'The youngest team to win a championship was the Portland Trail Blazers nearly 50 years ago, with the average age of the team being just 25.03. They were led by then-24-year-old Bill Walton.', 'Now, a new generation of rising stars includes Shai Gilgeous-Alexander, Tyrese Haliburton, Chet Holmgren, and Bennedict Mathurin. The players themselves are aware of the shift this Finals represents. ', 'After the Pacers punched their ticket to the NBA Finals with a win in Game 6 of the Eastern Conference Finals — their first trip to the Finals in 25 years — Myles Turner, who has been on the team the longest of anyone on the roster, reflected on what the 2025 playoffs could represent: ""It\'s a new blueprint for the league, man … I think the years of the super teams and stacking, it\'s not as effective as it once was.""', '""Since I\'ve been in the league, the NBA is very trendy. It just shifts,"" he said. ""The new trend now is kind of what we\'re doing.""', ""The Oklahoma City Thunder dominated this year's regular season, finishing with a 68-14 record and securing the No.1 spot in the Western Conference. With the leadership of 2024-25 MVP Gilgeous-Alexander, they were able to mostly cruise through the playoffs, taking down a tough Mavericks team in seven games but easily handling the Timberwolves and the Grizzlies."", 'The Thunder is the youngest team to have ever won 68 games in a single regular season, according to NBA statistics. If they win the 2025 championship, they would be the second youngest team to ever do so. ', 'The Pacers finished the regular season with a record of 50-32, and the No. 4 seed in the Eastern Conference. Tyrese Haliburton, 24, has been leading the team alongside standouts Mathurin, 22, and 25-year-old Andrew Nembhard.', 'Both the Thunder and Pacers have built their rosters through strategic draft picks and trades. ', ""Oklahoma City's Gilgeous-Alexander arrived via trade in 2019, when he was a rising prospect. While first-round picks Jalen Williams and Chet Holmgren arrived in 2022 together. The Indiana Pacers had a similar blueprint, trading for Haliburton in 2022 and drafting Nembhard and Mauthrin in the following years. "", 'Both teams are now in the finals without having signed any of the marquee veteran players when they were available on the market.', 'The generation that grew up fully with the internet is now reshaping NBA history. Together, these teams are carving out a new lane, bringing fresh energy and excitement to the younger fan base by connecting with their fans on social media.', 'Both teams have been posting more content related to games on platforms like Instagram, X and TikTok, where the younger generation is, drawing on OKC\'s ""Loud City"" and the Pacers\' ""Pacer Nation.""', 'In a league where veterans like LeBron James, Kevin Durant and Steph Curry traditionally dominate the court, this year feels like a passing of the torch. ', '© 2025 CBS Interactive Inc. All Rights Reserved.', 'Copyright ©2025 CBS Interactive Inc. All rights reserved.']",Sports,https://news.google.com/api/attachments/CC8iK0NnNXlhbW95Y21nNFZTMVJRMTluVFJDb0FSaXNBaWdCTWdhaGxJcUx0UVk=-w280-h168-p-df
Where to watch NBA Finals: Live stream Indiana Pacers vs. Oklahoma City Thunder Game 2,https://www.businessinsider.com/guides/streaming/where-to-watch-nba-finals-game-2-2025,"[""The NBA Finals are off to an exciting start, suggesting fans could be in for a close series this year. We've scoured the viewing options for all the best information, including where to watch the NBA Finals and what time the next game tips off."", 'The No. 1 Oklahoma City Thunder played host for the first game of the series, which was certainly a tight one. The Thunder came out strong, dominating in the first half of the game, but the No. 4 Indiana Pacers were able to claw their way back in the second half. The fourth quarter featured a particularly snappy 12 minutes from the Pacers, which ended with Tyrese Haliburton firing off a final buzzer-beating shot that led Indiana to a 111-110 victory.', ""The Indiana Pacers, who haven't been to the Finals in 25 years, are shooting for their first-ever Championship. The Oklahoma City Thunder last appeared in the Finals in 2012, but they've yet to earn a title under their current name (the franchise originally debuted as the Seattle SuperSonics, under which they won the 1979 title). It's safe to say that everything is at stake for both teams."", ""The 2025 NBA Finals won't be available to watch on ESPN Plus, which means that the cheapest way to live stream the series without a free trial is through Sling TV. You can find everything you need to know about Sling below, in addition to other streaming services we recommend."", 'US: ABC', 'All NBA Finals match-ups, including the three potential games should the series extend past Game 4, will air on ABC in the United States. Game 2 will tip off on Sunday at 8 p.m. ET.', ""As we mentioned above, the absolute cheapest way for US cord-cutters to live stream the NBA Finals without a free trial is through Sling TV, since ESPN Plus won't be carrying the series. Sling costs $46/month, but new customers can get 50% off their first month of service. That means you can watch every game of the NBA Finals (even if the series makes it to Game 7) for $23. Sling is a month-to-month cable alternative, which means that you can cancel at any time."", ""You'll want to sign up for Sling's Orange plan, which carries ESPN, ESPN2, ESPN3, TNT, and 30 other popular live channels. ESPN3 live streams ABC on NBA games, so you'll be able to watch the Finals here. This is how I personally watched the Game 5 Championship win in 2024, and I've double-checked the Sling TV guide this year to confirm that Game 2 will live stream on ESPN3 tonight."", 'You can access 35 live channels with Sling Orange, including ESPN, ESPN2, and ESPN3. Right now, you can get 50% off your first month before subscriptions go back to $46 a month, which you can cancel any time.', ""While Sling doesn't have a free trial for new customers, other live TV streaming services that offer a free trial have significantly higher monthly fees, but they also come with even more channel options. Two of the best live TV streaming services that we've tried ourselves are DirecTV and Fubo. DirecTV's signature Entertainment plan costs $85/month, offers access to 90+ channels, and comes with a five-day free trial for new customers. Fubo's Pro plan starts at $85/month, comes with at least 150 live channels, and offers a seven-day free trial for new users. Plus, new Fubo users can get $20 knocked off their first month of service."", 'Previously known as AT&T TV, DirecTV offers streaming access to a large selection of live channels, including most key networks typically found in traditional cable packages.', ""Fubo is the streaming service for sports fans. Its huge library of channels includes regional and international sports leagues, setting it apart from the competition. You can also tack on additional programming to your plan, but it'll cost you extra."", ""NBA fans traveling outside the US can still keep up with their usual viewing methods with the help of a VPN, or virtual private network. VPNs are easy-to-use cybersecurity tools that enable people to change the virtual location of their devices. This way, they don't need to miss out on any games just because they're away from home. VPNs are popular ways to improve online security and privacy. The services we've highlighted today require US payment methods, so this option will work best for Americans who are just abroad at the moment."", ""ExpressVPN consistently ranks among the best VPNs on the market. It's a top-rated, user-friendly option with a 30-day money-back guarantee. You can learn more about the app and its extensive cybersecurity features in our ExpressVPN review."", 'With its consistent performance, reliable security, and expansive global streaming features, ExpressVPN is the best VPN out there, excelling in every spec and offering many advanced features that make it exceptional. Better yet, you can save more than 60% right now and get up to four months free.', ""All the items below have a free streaming option that can be unlocked from anywhere with a VPN. Set it to the corresponding country, and you're all set."", 'Note: The use of VPNs is illegal in certain countries and using VPNs to access region-locked streaming content might constitute a breach of the terms of use for certain services. Business Insider does not endorse or condone the illegal use of VPNs.', 'You can purchase logo and accolade licensing to this story here.\n\nDisclosure: Written and researched by the Insider Reviews team. We highlight products and services you might find interesting. If you buy them, we may get a small share of the revenue from the sale from our partners. We may receive products free of charge from manufacturers to test. This does not drive our decision as to whether or not a product is featured or recommended. We operate independently from our advertising team. We welcome your feedback. Email us at reviews@businessinsider.com.', '', '', '', '']",Sports,https://news.google.com/api/attachments/CC8iK0NnNXlhbW95Y21nNFZTMVJRMTluVFJDb0FSaXNBaWdCTWdhaGxJcUx0UVk=-w280-h168-p-df
,https://www.koco.com/article/thunder-pacers-nba-finals-2025/64945276,"['If you purchase something from the links on this page, we may earn a commission.', 'Below is what you need to know as the NBA Finals continues', '', '', '', '', '', 'The Thunder led throughout Game 2 of the NBA Finals to beat the Indiana Pacers Sunday night, with the series now tied 1-1.', 'Despite leading for almost the entirety of Game 1, the Pacers pulled off the last-second victory after overcoming a 15-point fourth-quarter deficit. Tyrese Haliburton continued his clutch ways during the playoffs and sunk a jumper with 0.3 seconds left, giving Indiana a 111-110 win on Thursday.', 'Shai Gilgeous-Alexander and the Thunder bounced back on Sunday, handily beating the Pacers in a game they led for pretty much the majority of the game.', ""Following the Thunder's Game 2 victory, the series shifts to Indianapolis to pivotal road games that could make Game 5 back in Oklahoma City a close-out game for either team."", 'Below is what you need to know as the NBA Finals continues.', 'Note: You can watch each game of the NBA Finals on KOCO 5.', '', '', '', 'Ticket prices range from several hundred dollars in Loud City to several thousand dollars in the lower bowl.', '', '', ""Through the Thunder's website via Ticketmaster, tickets to the NBA Finals will be restricted to residents of Oklahoma, Kansas, Arkansas, Missouri and Nebraska."", '', '', 'Video Below: Shai Gilgeous-Alexander scores 34 as Thunder top Timberwolves 124-94 to advance to NBA Finals', '', '', '', 'Video Below: Thunder-Nuggets Postgame Show: OKC beats Denver in Game 7, advances to Western Conference finals', '', '', '', 'Video Below: Thunder complete sweep of Grizzlies, reach Western Conference semifinals', '', '', '', ""It's official. Oklahoma City Thunder point guard Shai Gilgeous-Alexander has won the NBA Most Valuable Player award after leading the league in scoring with 32.7 points per game."", 'During the 2024-25 season, Gilgeous-Alexander scored 20 points 75 times, 30 points 49 times, 40 points 13 times and 50 points four times.', 'Video Below: Shai Gilgeous-Alexander honored with MVP trophy before Game 2', '', '', '', 'The point guard from the University of Kentucky beat out fellow MVP finalists Giannis Antetokounmpo (Milwaukee Bucks) and Nikola Jokić (Denver Nuggets). Gilgeous-Alexander was a finalist last year but lost out to Jokić.', 'Gilgeous-Alexander has become the third player in Thunder history to win the MVP. Kevin Durant earned the honor in 2014, and Russell Westbrook was awarded MVP in 2017.', 'To say the Oklahoma City Thunder had a great season is an understatement. On top of being entertaining, they also put up historic numbers and broke franchise records during the 2024-25 season.', 'The Thunder posted a 68-14 record, becoming the seventh team in NBA history to win at least 68 games during the regular season. The last team to win at least that many games was the 2015-16 Golden State Warriors, who broke the NBA record by going 73-9. Four of the previous six teams to win at least 68 games during the regular season would also go on to win the NBA Finals.', '>> Video Below: Looking at the historic numbers the Thunder put up during the 2024-25 season', '', '', '', '', '', 'On a franchise level, 68 wins is the most in Thunder history, as well as the most if you want to date back to the Seattle SuperSonics days. The previous Thunder wins record was 60, set during the 2012-13 season, and the most games the SuperSonics won in a season was 64 in 1995-96.', 'Shai Gilgeous-Alexander also led the NBA in scoring this season, averaging 32.7 points per game. This marks the seventh time a Thunder player has led the NBA in scoring, with Russell Westbrook and Kevin Durant leading the NBA those other six seasons.', 'The Oklahoma City Thunder announced a new playoff experience for fans to immerse themselves in Loud City during road games.', 'Loud City Live started during the Western Conference Finals with great energy and enthusiasm, and the Thunder will open its doors again during the NBA Finals.', 'The Paycom Center will be opened for Loud City Live, during which fans can experience a home-court atmosphere while the Thunder take on the Indiana Pacers.', 'Video Below: Thunder fans party at Paycom Center during Loud City Live night 2', '', '', '', ""Loud City Live will feature the national broadcast on the scoreboard inside the Paycom Center, free Thunder rally towels, concessions, appearances by Rumble, Thunder Girls, the O'City Crew, Storm Chasers and the Thunder Drummers. There also will be a live DJ on the blue carpet, photo opportunities, face-painting and more."", 'The first two Loud City Live events drew big crowd and excitement during Games 3 and 4 of the Western Conference Finals.', 'Video Below: Thunder fans bring the energy at Paycom Center for Loud City Live', '', '', '', 'Before every home game, the Thunder will place a playoff T-shirt on each seat at the Paycom Center. Fans going to the game are encouraged to arrive early to join in on the Thunder playoff tradition and put on their shirts before the players hit the court. Fans who don\'t have the playoff shirts on run the risk of being on the ""Put On Your Shirt"" camera on the jumbotron.', 'NBA Finals merchandise is currently available to buy online.', ""Along with the team's online shop, the Thunder merchandise trailer will be open during Thunder UP in the Park. The Thunder Shop at the Paycom Center also will be open during home playoff games and regular store hours of 10 a.m. to 4 p.m. Monday through Saturday."", ""Fanatics.com also has NBA Finals apparel and memorabilia that would be great for any Thunder fan's collection."", 'Thunder UP in the Park will be moved up to noon on Sunday for Game 2 of the NBA Finals due to the risk of severe weather possible for the Oklahoma City metro area Sunday afternoon.', 'The event will be ready to get fans ready and excited for the NBA Finals, and it will include a few extra attractions as the Thunder goes for its first championship.', 'Activities include:', ""Doors open two hours before tipoff, and food and beverages – excluding the Michelob Ultra Club, Jack Daniel's and suites – are half off for the first hour."", 'Fassler Hall locations in Oklahoma City and Tulsa are being turned into Thunder Hall and will be official Thunder watch party locations. All Thunder playoff games will be on the big screens. During away games, Thunder Hall will include giveaways, Thunder-themed entertainment and special appearances.', 'Video Below: Popular Oklahoma City restaurant transforming for Thunder playoff games. Click here to learn more.', '', '', '', ""Fans can watch Thunder playoff games in four Thunder Watch Zones in Oklahoma City as well as one in Tulsa. The Thunder Watch Zones are located at OKC Tap House, Social Capital, Truck Yard, Toby Keith's I Love This Bar & Grill in Oklahoma City and Puck's Bar and Grill in Tulsa. Click here for a full list of Thunder Watch Zones."", 'Hearst Television participates in various affiliate marketing programs, which means we may get paid commissions on editorially chosen products purchased through our links to retailer sites.']",Sports,https://news.google.com/api/attachments/CC8iK0NnNXlhbW95Y21nNFZTMVJRMTluVFJDb0FSaXNBaWdCTWdhaGxJcUx0UVk=-w280-h168-p-df
