Title,Link,Paragraphs,Topic,Image
Oklahoma City Thunder overwhelming favorites in NBA Finals,https://www.espn.com/nba/story/_/id/45413963/oklahoma-city-thunder-overwhelming-favorites-nba-finals,"['', 'The Oklahoma City Thunder are one of the biggest betting favorites in an NBA Finals across the past 20 seasons.', 'The Thunder opened as -750 favorites over the Indiana Pacers in the Finals at ESPN BET. The Pacers opened as +525 underdogs on Saturday.', ""Since 2005, only the 2017-18 Golden State Warriors (-1075 versus the Cleveland Cavaliers) had shorter odds heading into the Finals than this season's Thunder."", 'Game 1, for which the Thunder opened as 9-point favorites, is Thursday in Oklahoma City (ABC, 8:30 p.m. ET).', 'Oklahoma City took care of the Minnesota Timberwolves in five games to return to the NBA Finals for the first time since 2012. The Western Conference champions will face a Pacers team that began the season at 50-1 to win the title but went on a run in the playoffs and finished off the New York Knicks on Saturday in Game 6 of the East finals.', 'The Pacers, at 50-1, would be the biggest preseason long shots to win the title in the past 40 years. History is against them, however.', ""Over the past 50 years, only two teams that were at least +200 underdogs to start the NBA Finals -- the 2003-04 Detroit Pistons at +500 and the 2018-19 Toronto Raptors at +230 -- went onto claim the Larry O'Brien Championship Trophy, according to betting archive SportsOddsHistory.com.""]",Sports,https://news.google.com/api/attachments/CC8iK0NnNXlhbW95Y21nNFZTMVJRMTluVFJDb0FSaXNBaWdCTWdhaGxJcUx0UVk=-w280-h168-p-df
Weekend Warriors discussion: Are you rooting for the Pacers or Thunder in the NBA Finals?,https://www.goldenstateofmind.com/2025/6/7/24444793/warriors-thunder-pacers-rooting-interests-nba-finals,"['FILED UNDER:', 'Who ya got?', 'The NBA Finals are upon us. And while the Golden State Warriors gave it a good run, injuries and a lack of depth cut their season short, and for the third consecutive year, they won’t be the champion.', 'Instead, it will be either the Indiana Pacers or the Oklahoma City Thunder, as the pair of up and coming young teams ran their way to the game’s biggest stage, and are now battling for a trophy.', 'So who are you rooting for? The Thunder opened the series as the favorite, though the Pacers stole Game 1 behind yet another unthinkable hero shot by Tyrese Haliburton. Oklahoma City seems like the potential dynasty set to run the table for years to come, while Indiana feels like the shocking team of destiny that few had making even the Eastern Conference Finals, let alone winning a trophy.', 'There aren’t a lot of Warriors connections. The biggest connection for the Pacers is that they star Haliburton, a player linked to the Warriors in the 2020 NBA Draft, before the Dubs ultimately selected James Wiseman. Speaking of which, Wiseman began the year on Indiana’s roster, though he suffered a season-ending injury in the opening week, and then was salary dumped at the trade deadline.', 'The Thunder don’t have any former Warriors (despite employing a player whose last name is “Wiggins”), though Golden State has been linked to Alex Caruso more times than I can remember. And while they don’t have any former Warriors players, they did steal the team’s mascot name. Pour one out for Thunder, a muscular Oracle Arena legend.', 'So who are you rooting for, Dub Nation? And who do you think will win?', '', '', 'Gambling Problem? Call 1-800-GAMBLER (1-800-426-2537). Hope is here. GamblingHelpLineMA.org or call (800) 327-5050 for 24/7 support (MA). Visit www.mdgamblinghelp.org (MD). Call 877-8HOPE-NY or text HOPENY (467369) (NY). 21+ (18+ D.C.) and present in select states (for KS, in affiliation with Kansas Star Casino). Call 1-888-789-7777 or visit ccpg.org/chat (CT) or visit FanDuel.com/RG.']",Sports,https://news.google.com/api/attachments/CC8iK0NnNXlhbW95Y21nNFZTMVJRMTluVFJDb0FSaXNBaWdCTWdhaGxJcUx0UVk=-w280-h168-p-df
2025 NBA Finals picks: Experts predict the Indiana-Oklahoma City series,https://www.espn.com/nba/story/_/id/45444961/2025-nba-finals-picks-experts-predict-indiana-pacers-oklahoma-city-thunder,"['', 'From the moment the 2024-25 NBA season tipped off in October, it was all leading to June and the NBA Finals. After seven months of regular-season basketball and an electrifying postseason, the Oklahoma City Thunder and Indiana Pacers are the last two teams left standing.', ""The Thunder soared past the Minnesota Timberwolves in the Western Conference finals, winning the series in five games -- four of which featured 30-plus point outings from NBA MVP Shai Gilgeous-Alexander. This is the Thunder's second Finals appearance, and it would be their first NBA championship as the Oklahoma City Thunder. (The Seattle SuperSonics franchise relocated to Oklahoma City in 2008 and won a title in 1979.)"", ""The Pacers, led by Eastern Conference finals MVP Pascal Siakam and a historic Game 4 performance from Tyrese Haliburton, clinched the East with an entertaining six-game series against the New York Knicks. This is the franchise's second Finals appearance, and if it prevails, it would be its first NBA title."", 'Ahead of Game 1 of the Finals on Thursday (8:30 p.m. ET, ABC), our NBA experts make their picks.', 'Schedule and results | Offseason guide', 'Indiana Pacers (4) vs. Oklahoma City Thunder (1)', 'Victoria Arlen: Thunder in 6\nJerry Bembry: Thunder in 6\nTim Bontemps: Thunder in 5\nChris Canty: Pacers in 7\nEvan Cohen: Thunder in 5\nFreddie Coleman: Pacers in 6\nCourtney Cronin: Thunder in 6\nHarry Douglas: Thunder in 6\nIan Fitzsimmons: Thunder in 6\nJoe Fortenbaugh: Thunder in 5\nEmmett Golden: Thunder in 6\nChris Herring: Thunder in 5\nZach Kram: Thunder in 5\nBobby Marks: Thunder in 5\nMyron Medcalf: Thunder in 5\nDave McMenamin: Thunder in 6\nQ Myers: Thunder in 6\nGabe Neitzel: Thunder in 5\nNeil Paine: Thunder in 5\nKevin Pelton: Thunder in 5\nOmar Raja: Thunder in 5\nJay Reynolds: Thunder in 6\nMichelle Smallmon: Thunder in 6\nRamona Shelburne: Thunder in 5\nAndre Snellings: Thunder in 7\nMarc Spears: Thunder in 7\nAmber Wilson: Thunder in 5\nJeremy Woo: Pacers in 7\nMichael C. Wright: Thunder in 6\nClinton Yates: Thunder in 5\nOhm Youngmisuk: Thunder in 6\nJonathan Zaslow: Thunder in 4', 'Final tally:', 'Oklahoma City 29, Indiana 3']",Sports,https://news.google.com/api/attachments/CC8iK0NnNXlhbW95Y21nNFZTMVJRMTluVFJDb0FSaXNBaWdCTWdhaGxJcUx0UVk=-w280-h168-p-df
"NBA Finals 2025: Where SGA, Haliburton check in among playoff MVPs",https://www.espn.com/nba/story/_/id/45436887/nba-finals-2025-where-sga-haliburton-check-playoff-mvps,"['', 'The NBA Finals are here, with the Oklahoma City Thunder set to face the Indiana Pacers for the 2025 NBA title.', ""With Oklahoma City beating the Minnesota Timberwolves and Indiana knocking off the New York Knicks, it also means that 14 playoff teams have been sent home for the summer, and we've seen a whole assortment of star performances over the past several weeks."", ""So, for the third time in these playoffs, here's our latest look at the superlative performers of this postseason, as we rank the top eight players through the first three rounds ahead of the start of the championship round in Oklahoma City on Thursday (8:30 p.m. ET, ABC)."", 'Previous rankings: First round | Second round', 'Shai Gilgeous-Alexander puts up 34 points as the Thunder ease past the Timberwolves to complete a 4-1 series win.', '2025 playoff stats (16 games): 29.8 PTS | 6.9 AST | 5.7 REB | 1.6 STL', ""The Thunder have been the NBA's best team all season, and Gilgeous-Alexander was honored a couple of weeks ago as the league's regular-season MVP. He now finds himself in the top spot in these postseason rankings too, after averaging 31.4 points, 5.2 rebounds and 8.2 assists in OKC's five-game rout of the Timberwolves."", ""Gilgeous-Alexander has scored at least 30 points in 11 of the 16 games he has played this postseason, and he reached that milestone in all four of the Thunder's victories in the Western Conference finals. If the heavily favored Thunder go on to win the NBA title, it's hard to see a scenario where Gilgeous-Alexander doesn't add a Finals MVP trophy to his tally this season along with the Larry O'Brien."", 'Previous ranking: 4', 'Tyrese Haliburton drops 21 points and 13 assists as the Pacers drub the Knicks to clinch an NBA Finals berth.', '2025 playoff stats (16 games): 18.8 PTS | 9.8 AST | 5.7 REB | 1.4 STL', 'The impending matchup between Gilgeous-Alexander and Haliburton is the best point guard matchup in the NBA Finals since the duels between Kyrie Irving and Stephen Curry during the legendary showdowns between the Golden State Warriors and Cleveland Cavaliers from 2015 to 2018.', ""And if Indiana is going to pull off the upset, it's going to need Haliburton to have more games like his incredible performance in Game 4 of the conference finals against the Knicks. He finished with 32 points, 15 assists and no turnovers in a comfortable victory that gave Indiana a 3-1 series lead."", ""That last stat -- turnovers -- will be one of the key battlegrounds in this series. Oklahoma City's defense, the best in the league by a wide margin this season, excels at turning teams over. Haliburton, on the other hand, is the best point guard at avoiding turnovers in the NBA."", 'Previous ranking: 5', 'Jalen Brunson stands tall for New York as the Knicks overcome the Indiana Pacers in Game 5 to keep the series alive.', '2025 playoff stats (18 games): 29.4 PTS | 7.0 AST | 3.4 REB', ""While Brunson's defense was a problem in New York's loss to Indiana (and he had a disappointing Game 6 to end the Knicks' season), there's no denying his importance in leading the franchise to its best season in a quarter century. Brunson, the NBA's Clutch Player of the Year this season, averaged 30.7 points and shot over 50% from the field against the Pacers. That his performance overall was seen as a disappointment is indicative of the elevated status he has reached as a player."", ""Brunson's first three seasons in New York have already launched him into the top five careers in Knicks franchise history, and there's a pretty sound argument there are only three players -- all Hall of Famers -- ahead of him: Willis Reed, Patrick Ewing and Walt Frazier. Not bad company for the former second-round pick whom New York signed as an unrestricted free agent."", 'Previous ranking: 1', ""Take a look at some of Pascal Siakam's best plays as Eastern Conference finals MVP."", '2025 playoff stats (16 games): 21.1 PTS | 5.8 REB | 3.3 AST | 46.3 3P%', 'The Eastern Conference finals MVP, Siakam -- who had 30 points in three of the six games against the Knicks and averaged 24.8 across the series -- has fit in beautifully since arriving in Indiana 18 months ago, powering the franchise first to the conference finals last year and now back to the NBA Finals for the first time since 2000.', ""The symbiosis between Haliburton and Siakam has played a huge part in the Pacers becoming the high-powered offensive machine they have been for the past couple seasons, especially during these two playoffs runs. Matching that effort against the Thunder, however, is going to be Indiana's biggest challenge yet."", 'Previous ranking: NR', 'Nikola Jokic scored 44 points to go along with 15 boards, but the Nuggets fall to the Thunder 112-105.', '2025 playoff stats (14 games): 26.2 PTS | 12.7 REB | 8.0 AST | 2.0 STL', ""Surprised to see Jokic here despite Denver's loss in the second round of the playoffs? Well, let's remind you that the Nuggets had the Thunder on the ropes in Game 5 of the conference semifinals, when they held an eight-point lead through three quarters in Oklahoma City and looked set to put OKC on the brink of elimination for a second straight year."", ""But although that didn't happen this time, Jokic's brilliance forced the Thunder to go the distance in what could easily be the closest any team comes to knocking Oklahoma City off on its way to the title. That, coupled with Jokic's always comical stats, still has him pretty high on this list even though he has been home for a couple of weeks already."", 'Previous ranking: 2', 'Jalen Williams impresses with 34 points as OKC beats the Timberwolves 128-126 to take a 3-1 series lead.', '2025 playoff stats (16 games): 20.4 PTS | 5.8 REB | 5.3 AST | 1.6 STL', ""Williams struggled for large portions of Oklahoma City's second-round victory over Denver, but he came back and had a terrific West finals, shooting just under 50% from the field, 46.2% from 3 and averaging 22.2 points, 6.6 rebounds, 4.4 assists and 2.0 steals."", ""One of the big questions about Oklahoma City all season, in terms of its ability to contend for a title, was whether Williams could reliably step into the role as the secondary scorer behind Gilgeous-Alexander on a championship-level team. And while that has been a struggle at times in these playoffs, he showed in Game 4 of the Minnesota series in particular -- he had 34 points in perhaps the finest game of his career to help the Thunder take a 3-1 series lead -- that he's growing into that spot right in line with OKC's title window."", 'Previous ranking: NR', 'Anthony Edwards notches 30 points with 9 rebounds and 6 assists as the Timberwolves rout the Thunder in Game 3.', '2025 playoff stats (15 games): 25.3 PTS | 7.8 REB | 5.5 AST', ""Oklahoma City showed an appropriate fear of Edwards throughout the West finals, sending swarms of defenders at him in an effort to force passes to his teammates and make them beat the Thunder instead. As a result, Edwards finished below 20 points in three of the series' five games. That happened only once across the opening two rounds of the playoffs."", 'Still, Edwards leading the Timberwolves to the conference finals in back-to-back seasons after the franchise had only one previous series win is an impressive accomplishment. The question now is what it will take for both Edwards and the Wolves to catch (and surpass) the Thunder, who now loom as the existential threat atop the West for years to come.', 'Previous ranking: 3', 'Karl-Anthony Towns scores 20 points in fourth to spark Knicks over Pacers in Game 3.', '2025 playoff stats (18 games): 21.4 PTS | 11.6 REB | 1.3 AST', 'Like Brunson, Towns put together massive stats in the East finals, recording 24.8 points and 12.2 rebounds per game while shooting 50% overall and 36.7% from 3. But, like Brunson, Towns struggled defensively and with foul trouble, which Indiana repeatedly took advantage of as it dispatched New York and denied the Knicks a trip to the NBA Finals for the first time since 1999.', ""Towns' first season in New York has to be seen as a success, however. He was an All-NBA player and earned his fifth All-Star appearance while helping the Knicks reach the conference finals for the first time in 25 years. But his defense will need to improve, and the Knicks will have to improve the roster around him and Brunson if they want next season to end differently."", 'Previous ranking: NR', '', '', '']",Sports,https://news.google.com/api/attachments/CC8iK0NnNXlhbW95Y21nNFZTMVJRMTluVFJDb0FSaXNBaWdCTWdhaGxJcUx0UVk=-w280-h168-p-df
"2025 NBA Finals odds, NBA props, picks, bets: Thunder vs. Pacers Game 3 expert pick, score prediction",https://www.cbssports.com/nba/news/2025-nba-finals-odds-nba-props-picks-bets-thunder-vs-pacers-game-3-expert-pick-score-prediction/,"['', 'The Oklahoma City Thunder bounced back from a stunning Game 1 loss and left the Indiana Pacers in the dust on Sunday, 123-107. With the teams tied at 1-1, the series moves to Indiana for Game 3 on Wednesday at 8:30 p.m. ET. In four games against the Pacers this season, league MVP Shai Gilgeous-Alexander has scored 45, 33, 38, and 34 points. Will Indiana be able to slow him down on their home court? The Thunder are 5-point road favorites in Game 3 with the over/under at 228 points in the latest Thunder vs. Pacers odds. Oklahoma City is a -198 favorite (risk $198 to win $100) on the money line, while Indiana is a +164 underdog (risk $100 to win $164) for anyone finalizing how to bet Thunder vs. Pacers Game 3.', 'Before making any Thunder vs. Pacers picks, be sure to see the Game 3 NBA score prediction and Game 3 NBA picks from SportsLine expert Eric Cohen. They can help you make picks and take advantage of NBA Finals betting promos like the latest BetMGM promo code and DraftKings promo code, just to name a few.', 'Cohen is a SportsLine expert and Early Edge personality who has nailed two golf winners in the last month and finished among the top three college football experts on the site. A jack-of-all-trades, Cohen has a futures bet on the Thunder to win the series in five or six games.', ""Here are Cohen's top Thunder vs. Pacers picks for Game 3:"", ""Cohen's Analysis: I missed the Game 2 score by ONE point so time to see if I can nail it right on the head. Unlike Game 2, Wednesday night's game will be close throughout, but I think the Thunder steals one on the road. Sunday's contest flew over in the second half but I would be very surprised if we saw anything close to 130 points in the third and fourth quarters this time around so the under is preferred. League MVP Shai Gilgeous-Alexander continues to torch Indiana and the Pacers will have no answer for him yet again. He's averaging 37.5 points per game against them this season and will score somewhere between 30-35 on Wednesday night. Haliburton has only registered 12 assists against the Thunder in this series but before that, he had 10+ in 9 of the team's first 16 playoff games. At +265, that's an incredible value that I can't pass up. McConnell continues to be a spark plug off the bench for Indiana and has registered 14 and 20 PRA in this series despite playing less than 20 minutes per game. I wouldn't be surprised if Gilgeous-Alexander hit a game winner with close to no time left on the clock as Haliburton did in Game 1. After watching the domination in Game 2, I'm confident that Oklahoma City wins this series in six games."", ""You've seen Cohen's best bets for Pacers vs. Thunder on Wednesday. Now, get picks for Game 3 from the model that entered the 2025 NBA Finals a sizzling 160-116 on top-rated NBA picks."", '© 2004-2025 CBS Interactive. ALL RIGHTS RESERVED.', 'CBS Sports is a registered trademark of CBS Broadcasting Inc. Commissioner.com is a registered trademark of CBS Interactive Inc.', 'The content on this site is for entertainment purposes only and CBS Sports makes no representation or warranty as to the accuracy of the information given or the outcome of any game or event. There is no gambling offered on this site. This site contains commercial content and CBS Sports may be compensated for the links provided on this site.', 'Images by Getty Images and Imagn']",Sports,https://news.google.com/api/attachments/CC8iK0NnNXlhbW95Y21nNFZTMVJRMTluVFJDb0FSaXNBaWdCTWdhaGxJcUx0UVk=-w280-h168-p-df
,https://www.koco.com/article/thunder-pacers-nba-finals-oklahoma-city-storms-weather/65002000,"['It is a big day in Oklahoma City with Game 2 of the NBA Finals tipping off tonight at the Paycom Center.', '', '', '', '', '', 'It is a big day in Oklahoma City, with Game 2 of the NBA Finals tipping off tonight at the Paycom Center.', ""While fans are excited and hopeful that the Thunder will even the series after the stunning Game 1 loss, they'll also need to be weather-aware as severe storms could move into the metro around game time and when the game is over."", 'KOCO 5 Meteorologist Joseph Neubauer says people going to Thunder UP in the Park, which was moved up to noon, will be in the clear and experience temperatures in the upper 80s and low 90s.', ""The storm threat, however, increases by the end of Thunder UP in the Park and the start of pregame activities around 5 p.m. There's a potential for severe storms and heavy rain through the early evening and into the nighttime hours."", 'Video Below: Thunder look to even series with Pacers in Game 2 of NBA Finals tonight at Paycom Center', '', '', '', 'Joseph says storms will move into western Oklahoma during the afternoon and reach the OKC metro around 5 p.m. The big storm threat that develops in western Oklahoma will not reach OKC until after Game 2 has already started.', 'Storms with heavy rain are expected to be ongoing as the game ends and fans start to leave the Paycom Center.', 'Be sure to download the KOCO 5 App to receive customized weather alerts. You can watch our team coverage on the app, too.', '>> Check Closings', '>> Check Live, Interactive Radar', '>> Watch KOCO 5 Coverage', '>> Download the KOCO 5 App on iPhone', '>> Download the KOCO 5 App on Android', '>> ""Like"" KOCO 5 on Facebook', '>> ""Follow"" KOCO 5 on X', '>> Stream KOCO 5 weather updates anytime on the Very Local app', 'Hearst Television participates in various affiliate marketing programs, which means we may get paid commissions on editorially chosen products purchased through our links to retailer sites.']",Sports,https://news.google.com/api/attachments/CC8iK0NnNXlhbW95Y21nNFZTMVJRMTluVFJDb0FSaXNBaWdCTWdhaGxJcUx0UVk=-w280-h168-p-df
Thunder vs. Pacers: How a small-market NBA Finals affects the league’s bottom line,https://www.nytimes.com/athletic/6396219/2025/06/02/nba-finals-thunder-pacers-small-market/,"['NBA', 'NBA Finals', '590', 'NEW YORK — As the Indiana Pacers celebrated on their home court Saturday night, having pushed their way into the NBA Finals, the conventional wisdom was that a collective groan went out at the league’s Manhattan headquarters at the very same time.', 'The Pacers’ win meant that two small-market teams — Indianapolis is the 25th-largest media market in the country and Oklahoma City is No. 47 — would now face each other in the league’s marquee event. Here came Tyrese Haliburton, Pascal Siakam, Shai Gilgeous-Alexander and Jalen Williams as the four horsemen of the ratings apocalypse.', '', '', '', '', 'The NBA will undoubtedly take in less money in merchandise sales with the Pacers and Thunder than it would if the Knicks had advanced from the Eastern Conference finals or if a hamstring strain hadn’t felled Stephen Curry and the Warriors before they could make another long playoff run. The Thunder fan base, while loud and mighty, is also smaller than many of its peers. The state of Oklahoma has about four million people, or less than half of New York City.', 'The revenue from ticket sales is likely to be less than if those games were held elsewhere. Average seat prices at Madison Square Garden dwarf those at almost any other venue. The cheapest ticket for Game 5 of the Western Conference finals in Oklahoma City — $172 — was the most expensive ticket in the franchise’s history, according to TickPick, and it cost less than half of the least expensive seat at MSG for Game 5 of the Eastern Conference finals.', '', '', '', '', '', '', '', '', '', 'The NBA has experienced strong ratings this postseason, no doubt buoyed by a deep playoff run by the Knicks. Game 3 of the Knicks-Pacers series was the most watched Eastern Conference finals Game 3 since 2015, according to Sports Media Watch, and that series has provided three of the four largest audiences this spring.', '', '', '', '', '', '', '', '', '', '', '', '', '', '', '', 'Mike Vorkunov is the national basketball business reporter for The Athletic. He covers the intersection of money and basketball and covers the sport at every level. He previously spent three-plus seasons as the New York Knicks beat writer. Follow Mike on Twitter @MikeVorkunov', '']",Sports,https://news.google.com/api/attachments/CC8iK0NnNXlhbW95Y21nNFZTMVJRMTluVFJDb0FSaXNBaWdCTWdhaGxJcUx0UVk=-w280-h168-p-df
INACTIVE PLAYERS,https://www.nba.com/game/ind-vs-okc-0042400402/box-score,"['', '12:30 AM UTC (THURSDAY)', 'ABC', 'FRI', 'JUN 13', '12:30 AM UTC (SATURDAY)', 'ABC', 'MON', 'JUN 16', '12:30 AM UTC (TUESDAY)', 'ABC', 'THU', 'JUN 19', '12:30 AM UTC (FRIDAY)', 'ABC', '107', 'FINAL', '123', 'Sunday, June 8th, 2025', '', '', 'Click on any linked stat to view the Video and/or Shot Chart', 'Click on any linked stat to view the Video and/or Shot Chart', 'OKC: Nikola Topić', 'If you are having difficulty accessing any content on this website, please visit our Accessibility page.', 'NBA.com is part of Warner Media, LLC’s Turner Sports & Entertainment Digital Network', '']",Sports,https://news.google.com/api/attachments/CC8iK0NnNXlhbW95Y21nNFZTMVJRMTluVFJDb0FSaXNBaWdCTWdhaGxJcUx0UVk=-w280-h168-p-df
